NOUN, ADJ, 
controls, Super, Super easy controls, I use auto attack for battle cuz its a bit tricking timing it with the touch pad. Love this game i've bought it for ps4 as well.
controls, easy, Super easy controls, I use auto attack for battle cuz its a bit tricking timing it with the touch pad. Love this game i've bought it for ps4 as well.
bug, horrible, This game is amazing, really addicting, I love the characters, but there is a really horrible bug that's been present through all my playthrough, when special events with some characters the game just wotn show dialogs so I have to skip them, this events are really big for progressing with the relationship and I CANT DO IT BECAUSE THE GAME WONT PROGRESS, i use the invisible pad + 2 buttons.
events, special, This game is amazing, really addicting, I love the characters, but there is a really horrible bug that's been present through all my playthrough, when special events with some characters the game just wotn show dialogs so I have to skip them, this events are really big for progressing with the relationship and I CANT DO IT BECAUSE THE GAME WONT PROGRESS, i use the invisible pad + 2 buttons.
pad, invisible, This game is amazing, really addicting, I love the characters, but there is a really horrible bug that's been present through all my playthrough, when special events with some characters the game just wotn show dialogs so I have to skip them, this events are really big for progressing with the relationship and I CANT DO IT BECAUSE THE GAME WONT PROGRESS, i use the invisible pad + 2 buttons.
time, free, As fun and wholesome as played on PC, the game is adapted surprisingly well to the touch screen! I love it that I can now carry the game around and relax playing through a game day whenever I have free time during my life.
state, current, Love it. Can't stop. Please update to current state on pc so I have more to do.
games, best, One of the best games of all time. There are so many ways to play this game and it's so easy to get lost in the gameplay. If you enjoy the Harvest Moon games or farming simulators you will love Stardew Valley.
ways, many, One of the best games of all time. There are so many ways to play this game and it's so easy to get lost in the gameplay. If you enjoy the Harvest Moon games or farming simulators you will love Stardew Valley.
devices, other, Amazing, controls are hard to get used to if you don't play on phone as much as other devices though
game, amazing, Stardew valley is an amazing game and having the mobile version be just as good as PC I'm happy and I can play on the go!
version, mobile, Stardew valley is an amazing game and having the mobile version be just as good as PC I'm happy and I can play on the go!
game, good, Very good game. Would recommend!
view, nostalgic, The game is good.but not perfect. Really has nostalgic view of harvest moon
player, multiple, it's a fan game yet no multiple player its kinda unfair since some of us don't have any money to either buy a computer or switch it be much more better if you add a multiple player choice so other can finally play with their friends plus it can attract more players that way unless you did this on purpose so other people we'll just the game on their computer and switch just so they can be with their friend smart move yet quite unfair
choice, multiple, it's a fan game yet no multiple player its kinda unfair since some of us don't have any money to either buy a computer or switch it be much more better if you add a multiple player choice so other can finally play with their friends plus it can attract more players that way unless you did this on purpose so other people we'll just the game on their computer and switch just so they can be with their friend smart move yet quite unfair
players, more, it's a fan game yet no multiple player its kinda unfair since some of us don't have any money to either buy a computer or switch it be much more better if you add a multiple player choice so other can finally play with their friends plus it can attract more players that way unless you did this on purpose so other people we'll just the game on their computer and switch just so they can be with their friend smart move yet quite unfair
people, other, it's a fan game yet no multiple player its kinda unfair since some of us don't have any money to either buy a computer or switch it be much more better if you add a multiple player choice so other can finally play with their friends plus it can attract more players that way unless you did this on purpose so other people we'll just the game on their computer and switch just so they can be with their friend smart move yet quite unfair
move, smart, it's a fan game yet no multiple player its kinda unfair since some of us don't have any money to either buy a computer or switch it be much more better if you add a multiple player choice so other can finally play with their friends plus it can attract more players that way unless you did this on purpose so other people we'll just the game on their computer and switch just so they can be with their friend smart move yet quite unfair
game, good, It's a good game.
game, actual, Not the actual game, Google play. I paid for this game, accidentally uninstalled and now I can't get it back! If I was able to pay for Minecraft YEARS ago, and can still get it again NOW, why can't I do that with Stardew?!
games, best, One of the best games ever.
gamers, freeplay, Definitely a game for freeplay gamers. I love that you can make your own farm and technically create your own life. Me and my brother are addicted to playing this game.
farm, own, Definitely a game for freeplay gamers. I love that you can make your own farm and technically create your own life. Me and my brother are addicted to playing this game.
life, own, Definitely a game for freeplay gamers. I love that you can make your own farm and technically create your own life. Me and my brother are addicted to playing this game.
game, amazing, What an amazing game, but I'm so disappointed 1.5 hasn't been released yet. The gap between mobile and PC in terms of content is immense. 1.5 mobile is far overdue.
fun, Pretty, Pretty fun gets repetitive after a while tho
game, addictive, This is the most addictive game I've ever played on my phone!
game, good, Very good game, love the festivals and the heart events, also being able to choose from different ways you would like to spend your time is also phenomenal for a game. Also when will the new update be out? Just asking cause I can't wait!!😊
ways, different, Very good game, love the festivals and the heart events, also being able to choose from different ways you would like to spend your time is also phenomenal for a game. Also when will the new update be out? Just asking cause I can't wait!!😊
update, new, Very good game, love the festivals and the heart events, also being able to choose from different ways you would like to spend your time is also phenomenal for a game. Also when will the new update be out? Just asking cause I can't wait!!😊
game, incredible, This is the kind of app I wish the app store had more of. The developer took a game that was originally meant for the computer and flawlessly allowed for it to work on mobile. You really don't find that often. Stardew Valley is an incredible and soothing game, one of the most well-made games I have ever played (for mobile and desktop both), and by far the most comforting.
games, made, This is the kind of app I wish the app store had more of. The developer took a game that was originally meant for the computer and flawlessly allowed for it to work on mobile. You really don't find that often. Stardew Valley is an incredible and soothing game, one of the most well-made games I have ever played (for mobile and desktop both), and by far the most comforting.
game, Amazing, Amazing game! My personal game of the year i have bought it on at least 4 different platforms
game, personal, Amazing game! My personal game of the year i have bought it on at least 4 different platforms
platforms, different, Amazing game! My personal game of the year i have bought it on at least 4 different platforms
game, Great, Great game!
decision, Best, STELLAR GAME. I've been eyeballing this game for awhile and finally decided to get it. Best decision I've made on the app store so far. Cant wait for what you guys are planning next
day, mid, I love this game. I had the pc version and I love this just as much although playing by phone I wish there was a way to save my game mid day if I am playing while waiting to do something else it would be nice to be able to save. But all around great game.
game, great, I love this game. I had the pc version and I love this just as much although playing by phone I wish there was a way to save my game mid day if I am playing while waiting to do something else it would be nice to be able to save. But all around great game.
game, Best, Best game I ever played! Well worth the money, I have bought this game on multiple platforms, makes a great gift for friends too! Highly recommended!
platforms, multiple, Best game I ever played! Well worth the money, I have bought this game on multiple platforms, makes a great gift for friends too! Highly recommended!
gift, great, Best game I ever played! Well worth the money, I have bought this game on multiple platforms, makes a great gift for friends too! Highly recommended!
hours, many, I have way to many hours in this game!!! I love this game I have it on most of my Console. this game run so smooth and I love it!!
version, same, What is the point of sync your save from pc if the don't have the same version of the game for close to a year now. I'm desapointed.
game, enjoyable, Most enjoyable mobile game I've played, but please, when will the 1.5 patch be available for Android? 🙏
game, mobile, Most enjoyable mobile game I've played, but please, when will the 1.5 patch be available for Android? 🙏
life, real, just love this real life game
game, Nice, Nice game👏
game, Great, Great game, controls suck on the phone tho, I even connected a game pad and constantly find myself needing to touch the screen, bait won't attach to poles, and missing feature of being able to sit down on benches and chairs and what not. Also game glitches you in place if you cast a fishing rod and quickly change slots , found this out on accident trying to use bait. Was able to recreate it . Only way to fix it was to reload the game. Buggy but good, better on other platforms
platforms, other, Great game, controls suck on the phone tho, I even connected a game pad and constantly find myself needing to touch the screen, bait won't attach to poles, and missing feature of being able to sit down on benches and chairs and what not. Also game glitches you in place if you cast a fishing rod and quickly change slots , found this out on accident trying to use bait. Was able to recreate it . Only way to fix it was to reload the game. Buggy but good, better on other platforms
game, favorite, I love Harvest Moon, so I've been trying to find something similar. I came across this game and it's been my favorite game since. I actually ended up just purchasing the game on ps4 and will probably do the same once I get my desktop set up. Literally is becoming my favorite game of all time. I hope the updates never stop
game, favorite, I love Harvest Moon, so I've been trying to find something similar. I came across this game and it's been my favorite game since. I actually ended up just purchasing the game on ps4 and will probably do the same once I get my desktop set up. Literally is becoming my favorite game of all time. I hope the updates never stop
tbh, good, pretty good tbh
degree, frustrating, A degree more frustrating than the normal version, this version needs a controller. There are many control options but I find them lacking, and I don't see how it couldn't be compared to a proper controller or keyboard. A useful backup feature is kind of nullified by a cruel auto save feature. Accidentally axed an ancient berry? It auto saves sometimes on close! How convenient and cursed. Guess I'm starting that day over again. Screw gates, let your animals be free.
version, normal, A degree more frustrating than the normal version, this version needs a controller. There are many control options but I find them lacking, and I don't see how it couldn't be compared to a proper controller or keyboard. A useful backup feature is kind of nullified by a cruel auto save feature. Accidentally axed an ancient berry? It auto saves sometimes on close! How convenient and cursed. Guess I'm starting that day over again. Screw gates, let your animals be free.
options, many, A degree more frustrating than the normal version, this version needs a controller. There are many control options but I find them lacking, and I don't see how it couldn't be compared to a proper controller or keyboard. A useful backup feature is kind of nullified by a cruel auto save feature. Accidentally axed an ancient berry? It auto saves sometimes on close! How convenient and cursed. Guess I'm starting that day over again. Screw gates, let your animals be free.
controller, proper, A degree more frustrating than the normal version, this version needs a controller. There are many control options but I find them lacking, and I don't see how it couldn't be compared to a proper controller or keyboard. A useful backup feature is kind of nullified by a cruel auto save feature. Accidentally axed an ancient berry? It auto saves sometimes on close! How convenient and cursed. Guess I'm starting that day over again. Screw gates, let your animals be free.
feature, useful, A degree more frustrating than the normal version, this version needs a controller. There are many control options but I find them lacking, and I don't see how it couldn't be compared to a proper controller or keyboard. A useful backup feature is kind of nullified by a cruel auto save feature. Accidentally axed an ancient berry? It auto saves sometimes on close! How convenient and cursed. Guess I'm starting that day over again. Screw gates, let your animals be free.
feature, backup, A degree more frustrating than the normal version, this version needs a controller. There are many control options but I find them lacking, and I don't see how it couldn't be compared to a proper controller or keyboard. A useful backup feature is kind of nullified by a cruel auto save feature. Accidentally axed an ancient berry? It auto saves sometimes on close! How convenient and cursed. Guess I'm starting that day over again. Screw gates, let your animals be free.
feature, cruel, A degree more frustrating than the normal version, this version needs a controller. There are many control options but I find them lacking, and I don't see how it couldn't be compared to a proper controller or keyboard. A useful backup feature is kind of nullified by a cruel auto save feature. Accidentally axed an ancient berry? It auto saves sometimes on close! How convenient and cursed. Guess I'm starting that day over again. Screw gates, let your animals be free.
berry, ancient, A degree more frustrating than the normal version, this version needs a controller. There are many control options but I find them lacking, and I don't see how it couldn't be compared to a proper controller or keyboard. A useful backup feature is kind of nullified by a cruel auto save feature. Accidentally axed an ancient berry? It auto saves sometimes on close! How convenient and cursed. Guess I'm starting that day over again. Screw gates, let your animals be free.
killer, fun, Absolutely fun time killer, with a lot to actually do. Great story too, as long as you follow the community quests and don't sell your soul for easy access to some features (you'll get what I mean when you play the game.)
story, Great, Absolutely fun time killer, with a lot to actually do. Great story too, as long as you follow the community quests and don't sell your soul for easy access to some features (you'll get what I mean when you play the game.)
access, easy, Absolutely fun time killer, with a lot to actually do. Great story too, as long as you follow the community quests and don't sell your soul for easy access to some features (you'll get what I mean when you play the game.)
atmosphere, great, This game is ABSOLUTELY AMAZING it's got great atmosphere and feeling and a good personality the performance on this game Is exceptional but I have but one request for the dwarven helm at first I saw this and thought wow I can look like a dwarf but it was an artifact please make this a feature, overall rating 4 stars
personality, good, This game is ABSOLUTELY AMAZING it's got great atmosphere and feeling and a good personality the performance on this game Is exceptional but I have but one request for the dwarven helm at first I saw this and thought wow I can look like a dwarf but it was an artifact please make this a feature, overall rating 4 stars
helm, dwarven, This game is ABSOLUTELY AMAZING it's got great atmosphere and feeling and a good personality the performance on this game Is exceptional but I have but one request for the dwarven helm at first I saw this and thought wow I can look like a dwarf but it was an artifact please make this a feature, overall rating 4 stars
rating, overall, This game is ABSOLUTELY AMAZING it's got great atmosphere and feeling and a good personality the performance on this game Is exceptional but I have but one request for the dwarven helm at first I saw this and thought wow I can look like a dwarf but it was an artifact please make this a feature, overall rating 4 stars
room, back, I like it so far,but does the boat still appears in the game for mobile??so far I didn't manage to get the back room on Willy's..it's true I payd joja but still no boat or other 🏝️.thx
game, Amazing, Amazing game! I love the PC version and the pocket one is even better with the anytime saving feature.
feature, saving, Amazing game! I love the PC version and the pocket one is even better with the anytime saving feature.
game, Fantastic, Fantastic game and it being mobile is amazing. Just waiting on 1.5 update!
months, few, I've been playing on PC for a few months and love it. The mobile versions is amazing and very well adapted. Movement and actions (chopping trees, mining, watering crops) much much less awkward than I thought it would be. Highly recommend!
versions, mobile, I've been playing on PC for a few months and love it. The mobile versions is amazing and very well adapted. Movement and actions (chopping trees, mining, watering crops) much much less awkward than I thought it would be. Highly recommend!
Movement, awkward, I've been playing on PC for a few months and love it. The mobile versions is amazing and very well adapted. Movement and actions (chopping trees, mining, watering crops) much much less awkward than I thought it would be. Highly recommend!
thing, only, It was hard to use at first but it's pretty good the only thing that was hard was the controls rest was good
plus, huge, Ngl I would die for these characters and the story is nice af and well paced! Also got to marry Shane so huge plus. Edit: it's been months PLEASE add the beach farm!
game, incredible, absoulutely incredible game although it lacks one thing the updates from other platforms that seem to get new ones all the time while mobile is stuck in the past class game though
platforms, other, absoulutely incredible game although it lacks one thing the updates from other platforms that seem to get new ones all the time while mobile is stuck in the past class game though
ones, new, absoulutely incredible game although it lacks one thing the updates from other platforms that seem to get new ones all the time while mobile is stuck in the past class game though
game, past, absoulutely incredible game although it lacks one thing the updates from other platforms that seem to get new ones all the time while mobile is stuck in the past class game though
game, good, good game and i really like it
hours, many, Stardew Valley has given me so many hours of joy and got me through hard times. It quite literally changed my life. The only things I'd like to see added are mobile multiplayer and more characters, cities, events, etc - really just more of it! I know that Stardew V. Expanded is a hit, but it would be nice to have things like that added into the base game, without all the extra work required for mods. With that said, I love the new features that do get added and I'm excited to see this game grow.
times, hard, Stardew Valley has given me so many hours of joy and got me through hard times. It quite literally changed my life. The only things I'd like to see added are mobile multiplayer and more characters, cities, events, etc - really just more of it! I know that Stardew V. Expanded is a hit, but it would be nice to have things like that added into the base game, without all the extra work required for mods. With that said, I love the new features that do get added and I'm excited to see this game grow.
things, only, Stardew Valley has given me so many hours of joy and got me through hard times. It quite literally changed my life. The only things I'd like to see added are mobile multiplayer and more characters, cities, events, etc - really just more of it! I know that Stardew V. Expanded is a hit, but it would be nice to have things like that added into the base game, without all the extra work required for mods. With that said, I love the new features that do get added and I'm excited to see this game grow.
multiplayer, mobile, Stardew Valley has given me so many hours of joy and got me through hard times. It quite literally changed my life. The only things I'd like to see added are mobile multiplayer and more characters, cities, events, etc - really just more of it! I know that Stardew V. Expanded is a hit, but it would be nice to have things like that added into the base game, without all the extra work required for mods. With that said, I love the new features that do get added and I'm excited to see this game grow.
characters, more, Stardew Valley has given me so many hours of joy and got me through hard times. It quite literally changed my life. The only things I'd like to see added are mobile multiplayer and more characters, cities, events, etc - really just more of it! I know that Stardew V. Expanded is a hit, but it would be nice to have things like that added into the base game, without all the extra work required for mods. With that said, I love the new features that do get added and I'm excited to see this game grow.
work, extra, Stardew Valley has given me so many hours of joy and got me through hard times. It quite literally changed my life. The only things I'd like to see added are mobile multiplayer and more characters, cities, events, etc - really just more of it! I know that Stardew V. Expanded is a hit, but it would be nice to have things like that added into the base game, without all the extra work required for mods. With that said, I love the new features that do get added and I'm excited to see this game grow.
features, new, Stardew Valley has given me so many hours of joy and got me through hard times. It quite literally changed my life. The only things I'd like to see added are mobile multiplayer and more characters, cities, events, etc - really just more of it! I know that Stardew V. Expanded is a hit, but it would be nice to have things like that added into the base game, without all the extra work required for mods. With that said, I love the new features that do get added and I'm excited to see this game grow.
range, broad, Really broad range of activities and one of the best sims I've ever played
sims, best, Really broad range of activities and one of the best sims I've ever played
game, good, A good game when i have a free time. It's relaxing and fun! Looking forward the next update for mobile version
time, free, A good game when i have a free time. It's relaxing and fun! Looking forward the next update for mobile version
update, next, A good game when i have a free time. It's relaxing and fun! Looking forward the next update for mobile version
version, mobile, A good game when i have a free time. It's relaxing and fun! Looking forward the next update for mobile version
game, Best, Best farming game out there
borderline, impossible, I want to support the amazing as much as i can but the fishing part is just awful its borderline impossible to do please fix it. It sours the gaming experience.
game, damn, Litteraly bought the game accidentally Uninstalled now it wants me to buy the damn game again I just want to play damiy
addiction, unhealthy, omg I fell madly in love with this game. and I have an unhealthy addiction to Sebastian 💜
game, Great, Great game, I never really expected much out of a farm simulator. BUT, this game is so much more. It has bioware like rpg mechanics. I hope that if I were able to create a video game it would be as great as this.
thing, wrong, Can't think of one thing wrong with this port. Love the game ❤️ and totally worth the price of 🎫 admission.
game, Great, Great game, but been waiting 7 months for the new farm layout. Will rate it 5 stars when it comes out.
layout, new, Great game, but been waiting 7 months for the new farm layout. Will rate it 5 stars when it comes out.
game, Great, Great casual game for me. Something I can play on lunch at work.
game, casual, Great casual game for me. Something I can play on lunch at work.
mode, Missing, Missing multi-player mode hampers the experience.
mode, multi, Missing multi-player mode hampers the experience.
mode, -, Missing multi-player mode hampers the experience.
mode, player, Missing multi-player mode hampers the experience.
game, Best, Best phone game.
