NOUN, ADJ, 
game, new, Was very disappointed after paying for it only to find that it wouldn't even let me play any roms. When I click load new game none of the roms I have in my storage appear in drastic. All I see is all games and recent games at the top, and a folder icon that I can't click on underneath. I've tried everything I can to fix this and I finally found a way to play roms with this emulator. You have to download a file explorer app called ZArchiver and run the roms through that. For a paid app, not good.
games, recent, Was very disappointed after paying for it only to find that it wouldn't even let me play any roms. When I click load new game none of the roms I have in my storage appear in drastic. All I see is all games and recent games at the top, and a folder icon that I can't click on underneath. I've tried everything I can to fix this and I finally found a way to play roms with this emulator. You have to download a file explorer app called ZArchiver and run the roms through that. For a paid app, not good.
app, paid, Was very disappointed after paying for it only to find that it wouldn't even let me play any roms. When I click load new game none of the roms I have in my storage appear in drastic. All I see is all games and recent games at the top, and a folder icon that I can't click on underneath. I've tried everything I can to fix this and I finally found a way to play roms with this emulator. You have to download a file explorer app called ZArchiver and run the roms through that. For a paid app, not good.
card, new, Was working up til I had to install a new SD card now it won't read either card
emulator, Great, Great emulator
time, 2nd, Closes on me when I try to start a game, but always work the 2nd time I load it. I get a message about it closing randomly which happened few times but found a DiY fix somewhere on the web. All in all, its an okay app. But it DEFINITELY doesn't compare to Fast Emulator (A.K.A. MyBoy, a gba emulator,) and I 100% DEFINITELY dont reccomend paying for it. But its what I paid, just not at the quality I expected. Not bad, just needs a decent amount more work.
times, few, Closes on me when I try to start a game, but always work the 2nd time I load it. I get a message about it closing randomly which happened few times but found a DiY fix somewhere on the web. All in all, its an okay app. But it DEFINITELY doesn't compare to Fast Emulator (A.K.A. MyBoy, a gba emulator,) and I 100% DEFINITELY dont reccomend paying for it. But its what I paid, just not at the quality I expected. Not bad, just needs a decent amount more work.
app, okay, Closes on me when I try to start a game, but always work the 2nd time I load it. I get a message about it closing randomly which happened few times but found a DiY fix somewhere on the web. All in all, its an okay app. But it DEFINITELY doesn't compare to Fast Emulator (A.K.A. MyBoy, a gba emulator,) and I 100% DEFINITELY dont reccomend paying for it. But its what I paid, just not at the quality I expected. Not bad, just needs a decent amount more work.
amount, decent, Closes on me when I try to start a game, but always work the 2nd time I load it. I get a message about it closing randomly which happened few times but found a DiY fix somewhere on the web. All in all, its an okay app. But it DEFINITELY doesn't compare to Fast Emulator (A.K.A. MyBoy, a gba emulator,) and I 100% DEFINITELY dont reccomend paying for it. But its what I paid, just not at the quality I expected. Not bad, just needs a decent amount more work.
work, more, Closes on me when I try to start a game, but always work the 2nd time I load it. I get a message about it closing randomly which happened few times but found a DiY fix somewhere on the web. All in all, its an okay app. But it DEFINITELY doesn't compare to Fast Emulator (A.K.A. MyBoy, a gba emulator,) and I 100% DEFINITELY dont reccomend paying for it. But its what I paid, just not at the quality I expected. Not bad, just needs a decent amount more work.
interface, clean, I am very pleased with this app. It is user friendly, it has a very clean interface, and it also runs quite smoothly. The 5 dollars is a good price for a reliable emulator.
price, good, I am very pleased with this app. It is user friendly, it has a very clean interface, and it also runs quite smoothly. The 5 dollars is a good price for a reliable emulator.
emulator, reliable, I am very pleased with this app. It is user friendly, it has a very clean interface, and it also runs quite smoothly. The 5 dollars is a good price for a reliable emulator.
times, many, I have pirated this so many times, but I felt generous so I finally bought it. Locking an emulator behind a paywall is sketchy, but eh, ds emulation is hard and this one is the cream of the crop. So many quality of life stuff normal android ds emulators just do not have. 5 euros is not *that* much, and its very much worth it. This emulator, pirated or not made the past 5 ys of my life what they were.
emulation, ds, I have pirated this so many times, but I felt generous so I finally bought it. Locking an emulator behind a paywall is sketchy, but eh, ds emulation is hard and this one is the cream of the crop. So many quality of life stuff normal android ds emulators just do not have. 5 euros is not *that* much, and its very much worth it. This emulator, pirated or not made the past 5 ys of my life what they were.
quality, many, I have pirated this so many times, but I felt generous so I finally bought it. Locking an emulator behind a paywall is sketchy, but eh, ds emulation is hard and this one is the cream of the crop. So many quality of life stuff normal android ds emulators just do not have. 5 euros is not *that* much, and its very much worth it. This emulator, pirated or not made the past 5 ys of my life what they were.
android, normal, I have pirated this so many times, but I felt generous so I finally bought it. Locking an emulator behind a paywall is sketchy, but eh, ds emulation is hard and this one is the cream of the crop. So many quality of life stuff normal android ds emulators just do not have. 5 euros is not *that* much, and its very much worth it. This emulator, pirated or not made the past 5 ys of my life what they were.
ys, past, I have pirated this so many times, but I felt generous so I finally bought it. Locking an emulator behind a paywall is sketchy, but eh, ds emulation is hard and this one is the cream of the crop. So many quality of life stuff normal android ds emulators just do not have. 5 euros is not *that* much, and its very much worth it. This emulator, pirated or not made the past 5 ys of my life what they were.
card, external, For the developer: please make possible to use external SD card so I don't have to load all games on the internal storage. After installing and trying all the other emulators on the Play Store and trying the demo version of DraStic I decided to buy it. It's absolutely the best and fastest DS emulator for Android. Would be nice if WI-Fi support was enabled and also a better management of save states, beside this it is perfect.
storage, internal, For the developer: please make possible to use external SD card so I don't have to load all games on the internal storage. After installing and trying all the other emulators on the Play Store and trying the demo version of DraStic I decided to buy it. It's absolutely the best and fastest DS emulator for Android. Would be nice if WI-Fi support was enabled and also a better management of save states, beside this it is perfect.
emulators, other, For the developer: please make possible to use external SD card so I don't have to load all games on the internal storage. After installing and trying all the other emulators on the Play Store and trying the demo version of DraStic I decided to buy it. It's absolutely the best and fastest DS emulator for Android. Would be nice if WI-Fi support was enabled and also a better management of save states, beside this it is perfect.
emulator, best, For the developer: please make possible to use external SD card so I don't have to load all games on the internal storage. After installing and trying all the other emulators on the Play Store and trying the demo version of DraStic I decided to buy it. It's absolutely the best and fastest DS emulator for Android. Would be nice if WI-Fi support was enabled and also a better management of save states, beside this it is perfect.
management, better, For the developer: please make possible to use external SD card so I don't have to load all games on the internal storage. After installing and trying all the other emulators on the Play Store and trying the demo version of DraStic I decided to buy it. It's absolutely the best and fastest DS emulator for Android. Would be nice if WI-Fi support was enabled and also a better management of save states, beside this it is perfect.
error, unknown, I just keep getting unknown error -24" and it just won't install I have a note 3 it was fine on my old s3 please help I love this app and I payed for the full version :( will give it full stars if fixed.
s3, old, I just keep getting unknown error -24" and it just won't install I have a note 3 it was fine on my old s3 please help I love this app and I payed for the full version :( will give it full stars if fixed.
version, full, I just keep getting unknown error -24" and it just won't install I have a note 3 it was fine on my old s3 please help I love this app and I payed for the full version :( will give it full stars if fixed.
stars, full, I just keep getting unknown error -24" and it just won't install I have a note 3 it was fine on my old s3 please help I love this app and I payed for the full version :( will give it full stars if fixed.
emulator, Best, Best NDS emulator on android with most features,4 stars because wifi is not supported.
stars, most, Best NDS emulator on android with most features,4 stars because wifi is not supported.
game, new, Can't load games. When I click "load new game" the app only show "emulated" and "self". When I clicked "emulated" it showed empty list instead of folders like in file explorer so I can't go to the folder where I placed my games and I can't find "self" in file explorer therefore the app is useless. Tested on OnePlus Nord N10 5G. It used to work great on my old phone. Hope the dev can fix it soon.
list, empty, Can't load games. When I click "load new game" the app only show "emulated" and "self". When I clicked "emulated" it showed empty list instead of folders like in file explorer so I can't go to the folder where I placed my games and I can't find "self" in file explorer therefore the app is useless. Tested on OnePlus Nord N10 5G. It used to work great on my old phone. Hope the dev can fix it soon.
phone, old, Can't load games. When I click "load new game" the app only show "emulated" and "self". When I clicked "emulated" it showed empty list instead of folders like in file explorer so I can't go to the folder where I placed my games and I can't find "self" in file explorer therefore the app is useless. Tested on OnePlus Nord N10 5G. It used to work great on my old phone. Hope the dev can fix it soon.
equivilant, free, Fps is way better than the free equivilant of this. And the controls are usable and immersive. Great job tbh
tbh, Great, Fps is way better than the free equivilant of this. And the controls are usable and immersive. Great job tbh
emulator, great, Can't find roms saved in the sd card. I tried looking a work around in the forums, but there's no way to fix my problem. Besides that, great emulator.
games, 3ds, This app is good,and I enjoy playing Sonic Colors (DS) on it,but I have a question:do 3ds games work on it? Im tired of playing just DS games on it.Other than that question,solid app.
app, solid, This app is good,and I enjoy playing Sonic Colors (DS) on it,but I have a question:do 3ds games work on it? Im tired of playing just DS games on it.Other than that question,solid app.
emulator, great, Works well, great emulator, just wish there was a way we could move the buttons where we want, they more often then not cover the screen making touch screen games harder or near impossible to play or when a game has buttons and touch screen it's annoying when switches between the two. Also, if the button to reset the game was quicker to get to/able to be put on the screen. I for one like shiny hunting and having it there/having a more customizable overlay would make things alot more enjoyable.
hunting, shiny, Works well, great emulator, just wish there was a way we could move the buttons where we want, they more often then not cover the screen making touch screen games harder or near impossible to play or when a game has buttons and touch screen it's annoying when switches between the two. Also, if the button to reset the game was quicker to get to/able to be put on the screen. I for one like shiny hunting and having it there/having a more customizable overlay would make things alot more enjoyable.
overlay, customizable, Works well, great emulator, just wish there was a way we could move the buttons where we want, they more often then not cover the screen making touch screen games harder or near impossible to play or when a game has buttons and touch screen it's annoying when switches between the two. Also, if the button to reset the game was quicker to get to/able to be put on the screen. I for one like shiny hunting and having it there/having a more customizable overlay would make things alot more enjoyable.
button, 3rd, The 3rd special button is not appearing despite clearing data, reinstalling the emu again... It does appear in layout editor, but nowhere else can I find it in game, despite me trying to change the settings one by one to test out what cause this
button, special, The 3rd special button is not appearing despite clearing data, reinstalling the emu again... It does appear in layout editor, but nowhere else can I find it in game, despite me trying to change the settings one by one to test out what cause this
states, save, Crashes after 5mins. Also my save states don't work. The emulator fails to even meet standards of gba emulator. Everything is so clunky within the menu.
apps, few, One of the few apps I bought and it's cool :) Able to play pokemon 4th gen games.
storage, internal, Doesn't work on Android 11, doesn't appear to have access to internal storage despite giving it permission.
deal, great, Its a great deal
emulator, Incredible, Incredible emulator
screen, new, Load new game screen simply doesn't work whatsoever.
job, great, it does a great job
progress, recent, Was working absolutely fine until just recently. Screen randomly turns black and freezes the game. Only way around is to reload the game which loses my recent progress. Edit: I have recently started using the auto save feature and now it no longer freezes. Been absolutely brilliant. 5 stars.
feature, useless, Android 11's new "Scoped Storage" is the reason why this app cannot access SD Card anymore, they add this useless feature for "pRiVAcY fRiEnDLy", they really ruined all emulator apps because of this feature.
pRiVAcY, fRiEnDLy, Android 11's new "Scoped Storage" is the reason why this app cannot access SD Card anymore, they add this useless feature for "pRiVAcY fRiEnDLy", they really ruined all emulator apps because of this feature.
experience, Great, Great experience, though needs a GBA slot for Harvest Moon DS Cute! :)
reason, only, Runs games perfect, the only reason it's not a 5 star is because the fast forward seems extremely laggy no matter what game or settings, when set to unlimited its perfect for fps but way to fast at 1000+ percent, but if I have it set to any of the set speeds like 200, it feel choppy and not smooth at all
emulator, Best, Best ds emulator ever run smoothly in my phone no lag,crush,or any delay in game play
mejor, corría, Problemas de la precisión de los controles en Redmi Note 7, antes tenía un Samsung J5 y me corría mejor.
months, few, Worked fine for a while but after an update a few months ago it's constantly freezing
games, certain, It's great. The gameplay is nearly flawless. Kids love it on their tablets. Even better if your phone has a built in stylus for certain games. Only problem is no Wi-Fi multiplayer support. If you can update with that or even a Bluetooth connection I'd give it a 5.
problem, Only, It's great. The gameplay is nearly flawless. Kids love it on their tablets. Even better if your phone has a built in stylus for certain games. Only problem is no Wi-Fi multiplayer support. If you can update with that or even a Bluetooth connection I'd give it a 5.
support, Fi, It's great. The gameplay is nearly flawless. Kids love it on their tablets. Even better if your phone has a built in stylus for certain games. Only problem is no Wi-Fi multiplayer support. If you can update with that or even a Bluetooth connection I'd give it a 5.
screen, 3ds, My 3ds top screen broke on Monday so I guess I have to come back here
screen, top, My 3ds top screen broke on Monday so I guess I have to come back here
speed, full, Ran all games at full speed
emulator, good, I was worried at first I bought an emulator before and it didn't work so I wasn't going to get it but so happy I did its a really good emulator
update, Recent, Recent update to android 11 prevents access to the sd card completely on this app. Last update for this app was apr of 2020, it feels like this app has been abandoned. Android 11 has been out for a while now, yet no fix in sight.
update, Last, Recent update to android 11 prevents access to the sd card completely on this app. Last update for this app was apr of 2020, it feels like this app has been abandoned. Android 11 has been out for a while now, yet no fix in sight.
one, free, I paid $5 for this and it's basically the free one but crashes more. If you can refund me that'd be great.
jump, good, Has a lot of potential. Multiplayer compatibility would be a good jump and Gameboy compatible would be nice too.
emulator, best, This is the best DS emulator in existence. The only thing that could make it better would be incorporating achievement support through retroachievments.
thing, only, This is the best DS emulator in existence. The only thing that could make it better would be incorporating achievement support through retroachievments.
sensitivity, Pad, D-Pad weird sensitivity might've been fixed, i dunno, but it works good enough for me now.
sensitivity, weird, D-Pad weird sensitivity might've been fixed, i dunno, but it works good enough for me now.
speed, full, Just great! Runs games full speed on almost any device also with nifty features with savestates, fastforwarding, higher resolution, and advanced options to suit your needs. Definitely worth the price!
resolution, higher, Just great! Runs games full speed on almost any device also with nifty features with savestates, fastforwarding, higher resolution, and advanced options to suit your needs. Definitely worth the price!
options, advanced, Just great! Runs games full speed on almost any device also with nifty features with savestates, fastforwarding, higher resolution, and advanced options to suit your needs. Definitely worth the price!
user, Customisable, At first I thought "no way I'm paying for an emulator! I'd just buy a DS!" But oh BOY am I glad I took the chance. Customisable user interface down to each button and screen placent, not to mention the best emulator I've used, possibly for any console. Other emulators are choppy, mess all the textures up and make the music sound like it was made by someone with no sense of rythym, but this emulator is as good as the original as were ever going to get. Just buy it, trust me
emulator, best, At first I thought "no way I'm paying for an emulator! I'd just buy a DS!" But oh BOY am I glad I took the chance. Customisable user interface down to each button and screen placent, not to mention the best emulator I've used, possibly for any console. Other emulators are choppy, mess all the textures up and make the music sound like it was made by someone with no sense of rythym, but this emulator is as good as the original as were ever going to get. Just buy it, trust me
emulators, Other, At first I thought "no way I'm paying for an emulator! I'd just buy a DS!" But oh BOY am I glad I took the chance. Customisable user interface down to each button and screen placent, not to mention the best emulator I've used, possibly for any console. Other emulators are choppy, mess all the textures up and make the music sound like it was made by someone with no sense of rythym, but this emulator is as good as the original as were ever going to get. Just buy it, trust me
thing, only, The only thing that need the emulator, it's a multiplayer option to be perfect.
folder, appropriate, The emulator worked flawlessly on my S9 plus but now that I've downloaded it onto my S20 the app can't find the folder with my ROMs and I'm unable to navigate to the appropriate folder
experience, nice, Very nice experience and options but not the most modern looking and has some settings that refuse to update sometimes.
looking, modern, Very nice experience and options but not the most modern looking and has some settings that refuse to update sometimes.
tool, Wonderful, Wonderful tool, no complaints. However, wanted to give mention to a current issue I am experiencing today. Opening and 'continuing' crashes the app every time, unsure why. Worried that uninstall/reinstall will mess up save data. Galaxy S21 Ultra. Hopefully addressed soon. Thanks!
issue, current, Wonderful tool, no complaints. However, wanted to give mention to a current issue I am experiencing today. Opening and 'continuing' crashes the app every time, unsure why. Worried that uninstall/reinstall will mess up save data. Galaxy S21 Ultra. Hopefully addressed soon. Thanks!
Emulator, Best, Best DS Emulator Ever I jus love this app if u could make it a 3ds than it would be more fantastic and I would have given 10 stars😁
emulator, Best, Best emulator, very worthy
emulator, worthy, Best emulator, very worthy
games, old, Works well. Sometimes freezes tho? But that's RARE. very good for playing old pokemon games 👍
times, several, Was having fun over all playing Pokemon white 2, but then once I made it to mistralton city and to board the plane, the screen goes black, yet the music continues to play, so I can't make it to lentimas town, unable to progress in the game. I've tried several times, along with disabling any cheats I have on, thinking maybe it was part of the problem, but nothing worked, so I'm stuck in mistralton city, unable to continue.
problems, few, I just had a few problems learning how to work it
emulator, Best, Best ds emulator i have used by far. Has close to no bugs and is smooth even on my old lenovo v7 phone.
phone, old, Best ds emulator i have used by far. Has close to no bugs and is smooth even on my old lenovo v7 phone.
issues, related, Works perfectly for me. Zero crashes and no emulator-related issues. I wish some functionality to enter and save personal custom cheat-codes would improve the experience. Device used is a Samsung Galaxy A71, using touch screen controls. Have mainly played Pokémon games.
codes, personal, Works perfectly for me. Zero crashes and no emulator-related issues. I wish some functionality to enter and save personal custom cheat-codes would improve the experience. Device used is a Samsung Galaxy A71, using touch screen controls. Have mainly played Pokémon games.
emulator, Best, Best emulator I've used
purchase, Best, It's been nearly a decade since I bought and installed DraStic and I am still impressed by it's quality. Best purchase I have made, no doubt.
tablet, better, This literally got 60 fps on my KINDLE FIRE (yes you can get Google play on Kindle Fire). That thing only had 1 gb of ram and it still delivered. I now use it on a much better tablet and still get 60 (obviously). Overall, I am very pleased and am very thankful to whoever developed this.
sites, unsafe, Nice. Don't install roms from unsafe sites though. Could end somewhat badly for you.
idk, dissapointed, I just bought it and it keeps crashing im so dissapointed idk what to do
device, other, Please add support for android 11. :) My other device can't access sd card. Thank you. :)
feature, extra, Very nice for the price easily plays the roms and has some built in cheats for that extra debug feature, very nice
feature, debug, Very nice for the price easily plays the roms and has some built in cheats for that extra debug feature, very nice
time, big, Darn near Perfect. No trouble what-so-ever getting set. Has all the features I've come to expect in quality Nds emulation. Only problem is getting it to properly function with an Xbox one controller. Wish there was a button mapping process, big time. Would be 5 stars.
years, few, But they stopped a few years ago but you can tell that it's not really great anymore I wish I can get a refund
Emulator, best, The best NDS Emulator on Play Store, no crashes so far, money well spent on this app
end, low, drastic can even run on low end phones. devs really deserve my money.
emulator, Best, Best emulator although no multiplayer but that fine
emulator, Finest, Finest emulator for android to those who had not have Nintendo DS physically.
app, used, Use to be my most used app on my phone until the most recent update. Now I can't access my roms on my SD card. Looks like this is something that's been known for months but the devs aren't doing anything to fix the issue. Such a shame :\
update, recent, Use to be my most used app on my phone until the most recent update. Now I can't access my roms on my SD card. Looks like this is something that's been known for months but the devs aren't doing anything to fix the issue. Such a shame :\
