VERB, PREP, POBJ, 
challenging, with, music, Great game! Fun and challenging with good music.
miss, from, PC, Really fun port to movile, good job! I kinda miss the interactive home menu from PC, though...
felt, at, shortness, Played the flash version. Loved it but felt sad at its shortness. Now, over two years later i accidentally find it's on both steam and android and i just couldn't hold my finger
added, in, while, I love EVERY minute of this. It is so fleshed out, even though it has a one button control. Amazing for a great cost. Edit: After all of the updates, this game is even BETTER than the original version, with new free content being added once in a while. It adds a lot of challenge, but it is VERY worth it. Amazing rhythm gameplay for a low cost, and its got a great difficulty curve, I recommend it 100%.
got, for, birthday, Best game ever! When i got this game for my birthday i thought it was amazing! Cant wait to beat it!
move, through, stages, A charming, wonderful one-button rhythm game I have adored ever since it was just a finished proof-of-concept. You will move your way through many well-crafted stages with custom music and heaps of love, all with the brutal unforgivingness that makes it all the more worth it. Ever since the full release, the game is beautiful whose graphics complement the experience with so much room for creativity and expression. I love this game. I even have it on Steam too! Much love from the UKSRT folks!
move, with, unforgivingness, A charming, wonderful one-button rhythm game I have adored ever since it was just a finished proof-of-concept. You will move your way through many well-crafted stages with custom music and heaps of love, all with the brutal unforgivingness that makes it all the more worth it. Ever since the full release, the game is beautiful whose graphics complement the experience with so much room for creativity and expression. I love this game. I even have it on Steam too! Much love from the UKSRT folks!
complement, with, room, A charming, wonderful one-button rhythm game I have adored ever since it was just a finished proof-of-concept. You will move your way through many well-crafted stages with custom music and heaps of love, all with the brutal unforgivingness that makes it all the more worth it. Ever since the full release, the game is beautiful whose graphics complement the experience with so much room for creativity and expression. I love this game. I even have it on Steam too! Much love from the UKSRT folks!
have, on, Steam, A charming, wonderful one-button rhythm game I have adored ever since it was just a finished proof-of-concept. You will move your way through many well-crafted stages with custom music and heaps of love, all with the brutal unforgivingness that makes it all the more worth it. Ever since the full release, the game is beautiful whose graphics complement the experience with so much room for creativity and expression. I love this game. I even have it on Steam too! Much love from the UKSRT folks!
allow, to, saves, Great rythm game, only thing I'd want to be added is to allow steam to mobile saves if that would be possible.
stick, with, calibration, Bought the PC version on Steam, but kinda hard to calibrate (so I just stick with the default calibration for now)
enjoy, with, challenge, Really fun and addictive with a great challenge. I reccomend this to those who enjoy rhythm games with a great challenge and simple controls
wait, for, 3, I like the game But if you can make the bigining of the level start by tap not by counting No 1 2 3 just tap ang go Because it is boring avry time i lose and start again and wait for 1 2 3
move, on, cause, The windup is a bad stage and I cant move on cause of it I've been trying for weeks and I've beaten every stage I could but this level is holding me back from having fun
trying, for, weeks, The windup is a bad stage and I cant move on cause of it I've been trying for weeks and I've beaten every stage I could but this level is holding me back from having fun
Waited, for, hour, I bought the game, booting it up, nothing happened. Waited for 1 hour for the game to start, it didnt load. I tried re-installing rhe game and restarting my phone, still didnt work. Fix it pls
Played, on, PC, Played this on PC and loved it, feels just as good on mobile.
jumping, over, someone?This, You know that game about jumping over someone?This is the same thing.I was stuck on 1-X For About 150Times.Gud Game
stuck, on, X, You know that game about jumping over someone?This is the same thing.I was stuck on 1-X For About 150Times.Gud Game
stuck, For, 150Times, You know that game about jumping over someone?This is the same thing.I was stuck on 1-X For About 150Times.Gud Game
Have, on, pc, Have this on pc I'm getting 300+ audio latency on my huawei p30 bare had any on my steam version. Otherwise its a good game and the issue may be device specific.
getting, on, bare, Have this on pc I'm getting 300+ audio latency on my huawei p30 bare had any on my steam version. Otherwise its a good game and the issue may be device specific.
playing, for, sometime, Great Rhythm game. I've been playing it for quite sometime on both my cellphone and PC. This game was developed by a company that understands musical theory and how to turn it on its head. I cant wait for their next game Rhythm Doctor to finally get its release. Keep it up.
playing, on, cellphone, Great Rhythm game. I've been playing it for quite sometime on both my cellphone and PC. This game was developed by a company that understands musical theory and how to turn it on its head. I cant wait for their next game Rhythm Doctor to finally get its release. Keep it up.
turn, on, head, Great Rhythm game. I've been playing it for quite sometime on both my cellphone and PC. This game was developed by a company that understands musical theory and how to turn it on its head. I cant wait for their next game Rhythm Doctor to finally get its release. Keep it up.
wait, for, game, Great Rhythm game. I've been playing it for quite sometime on both my cellphone and PC. This game was developed by a company that understands musical theory and how to turn it on its head. I cant wait for their next game Rhythm Doctor to finally get its release. Keep it up.
playing, since, 2014, Definently my favorite game I've been playing since 2014. I LOVE the update!
played, on, steam, Just great played this on steam and wanted it on my phone
wanted, on, phone, Just great played this on steam and wanted it on my phone
enjoyed, since, Cytus, If you like rhythm games, you will love this! Simple and executed fantastically. I haven't enjoyed a rhythm game this much since Cytus. I love that you can speed up the tracks to really test your limits. It adds the sense that you can always do better which is great for replayability. The training levels before the full "boss track" is a nice touch and the music itself is enjoyable to listen to, especially towards the end. The final track genuinely feels like a reward! Really great job :)
feels, like, reward, If you like rhythm games, you will love this! Simple and executed fantastically. I haven't enjoyed a rhythm game this much since Cytus. I love that you can speed up the tracks to really test your limits. It adds the sense that you can always do better which is great for replayability. The training levels before the full "boss track" is a nice touch and the music itself is enjoyable to listen to, especially towards the end. The final track genuinely feels like a reward! Really great job :)
fall, into, problem, An absolutely wonderful game that achieves everything it sets out to be - a simple, yet challenging rhythm game. Due to the controls being so simple, it doesn't fall into the problem that most other mobile rhythm games have, which is being harder to play on a smaller screen. A Dance of Fire and Ice plays wonderfully on any device that can run it. The gameplay paired with equally fantastic music and surprisingly engaging custom visuals for each level makes the price tag absolutely worth it. 5/5.
play, on, screen, An absolutely wonderful game that achieves everything it sets out to be - a simple, yet challenging rhythm game. Due to the controls being so simple, it doesn't fall into the problem that most other mobile rhythm games have, which is being harder to play on a smaller screen. A Dance of Fire and Ice plays wonderfully on any device that can run it. The gameplay paired with equally fantastic music and surprisingly engaging custom visuals for each level makes the price tag absolutely worth it. 5/5.
plays, on, device, An absolutely wonderful game that achieves everything it sets out to be - a simple, yet challenging rhythm game. Due to the controls being so simple, it doesn't fall into the problem that most other mobile rhythm games have, which is being harder to play on a smaller screen. A Dance of Fire and Ice plays wonderfully on any device that can run it. The gameplay paired with equally fantastic music and surprisingly engaging custom visuals for each level makes the price tag absolutely worth it. 5/5.
paired, with, music, An absolutely wonderful game that achieves everything it sets out to be - a simple, yet challenging rhythm game. Due to the controls being so simple, it doesn't fall into the problem that most other mobile rhythm games have, which is being harder to play on a smaller screen. A Dance of Fire and Ice plays wonderfully on any device that can run it. The gameplay paired with equally fantastic music and surprisingly engaging custom visuals for each level makes the price tag absolutely worth it. 5/5.
recommend, to, anyone, Great rhythm game. Very difficult as well. I love it. I would recommend it to anyone who like rhythm games.
acess, to, 12, Is it just me or do they say over 100 levels but i have acess to only 12?
make, in, version, Amazing game but I have just 1 request, please add the ability to make a custom level like in the PC version, thanks for your time :D
Owned, on, PC, Great game! Owned it on PC and loved it!
filled, with, nothing, Easy to pick up hard to master, after being tired of the top rhythm game charts being filled with nothing but clones of the same 3 games it's refreshing to have something actually engaging which doesn't bombard you with advertising every 30 or so seconds. I reccomend this to anyone who considers themselves a fan of rhythm games, if they have somehow not heard of it already.
bombard, with, advertising, Easy to pick up hard to master, after being tired of the top rhythm game charts being filled with nothing but clones of the same 3 games it's refreshing to have something actually engaging which doesn't bombard you with advertising every 30 or so seconds. I reccomend this to anyone who considers themselves a fan of rhythm games, if they have somehow not heard of it already.
heard, of, it, Easy to pick up hard to master, after being tired of the top rhythm game charts being filled with nothing but clones of the same 3 games it's refreshing to have something actually engaging which doesn't bombard you with advertising every 30 or so seconds. I reccomend this to anyone who considers themselves a fan of rhythm games, if they have somehow not heard of it already.
went, into, port, Super fun to play and runs perfectly. I love all the extra touches that went into the mobile port!
played, on, ver, Release World XO pleaseee, i played that on pc ver already, but i want it on mobile :) Edit: i found that you can do secret code input to access this and manage to beat it.. But please add it to legit world selection lol
want, on, mobile, Release World XO pleaseee, i played that on pc ver already, but i want it on mobile :) Edit: i found that you can do secret code input to access this and manage to beat it.. But please add it to legit world selection lol
start, from, place, Great game! It would be great if there was a "practice mode" like in Beat Saber or guitar hero. A mode where you can start from a specific place, no-fail enabled and the option to reduce speed. Unrelated: Whoever made level 9. Please more of that!
bought, on, pc, Love the game, bought it on pc and mobile just to support the creator
learn, because, tutorials, Great game at first try it was hard but you will slowly learn how to do it because of the tutorials even if your new to the game also It has a Great graphics and effects too.
Looking, to, songs, SUPER challenging yet super fun! The beats are fun to play to and the graphics are amazing as well. Still havent beaten everything and it always presentes a challenge and ultimate playability. Looking forward to more songs!
having, with, game, Yeah I'm having fun with this game... The calibration kinda hard to understand but it doesn't matter... The control are good and the gameplay is easy to catchup... Really hope level editor will be added soon...
love, to, day, I remember when this was first on Kongregate. I was first to comment, iirc... still love it to this day! Edit: It's great to see the game come so far! The levels are beautiful and the newer ones are the perfect amount of challenging.
lends, to, platform, I have this game on PC too, and the simple single button control-style lends itself to any platform very well. Catchy music, fun visuals, and a new way of presenting music theory and patterns to those who aren't musically-inclined.
finished, on, steam, Originally I finished this on steam. Its very addictive that I had to buy it for my phone too, and it works no differently to the pc version A fun Rhythm game.
buy, for, phone, Originally I finished this on steam. Its very addictive that I had to buy it for my phone too, and it works no differently to the pc version A fun Rhythm game.
works, to, version, Originally I finished this on steam. Its very addictive that I had to buy it for my phone too, and it works no differently to the pc version A fun Rhythm game.
saw, about, game, This game is amazing! If you like games like osu! or other rythm games you're going to love this one, its simple to play but hard to master, the original music its super catchy and perfect for the gameplay, i would also recommend this game if you are a musician. I bought it twice cause its also available for pc. Im super happy I saw that tokaku and miraie video about this game. Love it!
tailored, to, gameplay, A suprisingly well made music game with original music tailored specifically to the gameplay. Constant updates with added hidden levels.
play, on, mobile, To play on mobile and pc hehe xd
juiced, to, perfection, Easy but thorougly enjoyable rythm-based mechanic, that is juiced to perfection. Love it!
had, from, players, Solid Rhythm game. Love the music and quirks some of the levels have. Wish it had custom levels from players, or curated levels.
tap, to, type, This game is a very fun and challenging rhythm game! The concept of the game is very simple while giving you a very easy "just tap to the beat" type of gameplay. It does a very good job at expanding on how to play while increasing the difficulty. I highly recommend you play this game!
played, on, phone, Best game I've ever played on a phone. Great for drummers. Innovative approach to rhythm games and awesome songs. Update: moooore leveeeels aaahhhrrggg!!! Can't stop!
keep, with, beat, One of the best rhythm games I've played. Very simple, yet very challenging. It helps train your ear rhythmically to keep up with the beat. Really enjoyable. Well done. Hope you guys create more rhythm games.
gets, in, levels, Very simple game mechanics, which gets quite challenging in later levels. I had no Lags whatsoever on my OP3, which is critical for a good expirience. No ads, just the game. Can recommend! I also tried the online Demo of "Rhythm Doctor", which i can also recommend. It's also a Single Button Rhythm game, but with completely different mechanics.
had, on, OP3, Very simple game mechanics, which gets quite challenging in later levels. I had no Lags whatsoever on my OP3, which is critical for a good expirience. No ads, just the game. Can recommend! I also tried the online Demo of "Rhythm Doctor", which i can also recommend. It's also a Single Button Rhythm game, but with completely different mechanics.
playing, for, years, I've been playing for years. Love this game
play, with, headphones, Incredibly fun rhythm game, really provided a challenge, but was never too infuriating. Also, the input delay can be calibrated, so it means I can play with Bluetooth headphones connected, which really improves the game, because I can now play when out and about.
faded, into, background, Severe difficulty spike after 5-x, but other than that love your game! Love the aesthetic and the music. First time I was interested in playing a rhythm game. Sometimes I get angry because I cant hear the beat because it faded into the background. This game is an absolute steal for $2 Cheers, Donovan
see, in, this, Please add Google Play achievements and the ability to transfer/save data! The game is pretty much like Geometry Dash in similar aspects and it's really good. Would like to see a level editor in this soon!
come, from, tokaku, Just come here from tokaku :)
added, in, updates, Wonderful game! I love the concept of using angles to represent beats, and I enjoyed it very much. The graphical options are appreciated, as are the new levels that are being added in updates! This game is a definite 5/5 for me. Thank you, everyone on the dev team. Highly recommended. P.S. My heart was beating out of my chest during the 6-X speed trial, lol. Took me a while but I did it!
beating, during, trial, Wonderful game! I love the concept of using angles to represent beats, and I enjoyed it very much. The graphical options are appreciated, as are the new levels that are being added in updates! This game is a definite 5/5 for me. Thank you, everyone on the dev team. Highly recommended. P.S. My heart was beating out of my chest during the 6-X speed trial, lol. Took me a while but I did it!
play, with, pen, it will be better if I could play it with S-pen.
spent, for, it, Updated! The Good: As a rhythm game, the concept is neat, the execution is very good, and the soundtrack is beautiful. The visualization of percussion and beats was refreshing. The Bad: The calibration is still a little iffy, in my experience. The Ugly: Nothing, really. Previously, this paid app was the same as its free browser counterpart, but with updates to graphics and several additional worlds, it's well worth the $3 I spent for it years ago. It's been a joy revisiting this masterpiece!
Played, on, pc, Love the game, love the music. Played it on pc and still do but bought it to support the maker. 4 years later and I still love the music and the game - heck a few of the songs are on my daily listen list. Trying the new stuff now. The game is way more polished than last time I tied it.
said, with, that, Good work on the fixes. I saw the changes and im glad, especially with the new levels coming in. I also have the pc version and with that said if its not too much to ask, will we ever get the ability to play custom maps in here? I mean its okay if we cant make our own custom levels here but being able to play custom maps here would be amazing.
playing, through, game, This is my third time playing through this game. It is a phenomenal rhythm game with amazing, and unique music as well as a creative but easy to understand concept. The graphics are a little downgraded compared to the computer version but that's to be expected I think, the game still looks wonderful and keeps essentially all of its charm.
compared, to, version, This is my third time playing through this game. It is a phenomenal rhythm game with amazing, and unique music as well as a creative but easy to understand concept. The graphics are a little downgraded compared to the computer version but that's to be expected I think, the game still looks wonderful and keeps essentially all of its charm.
Works, with, phone, After all these updates this game is so great that its one of my favourite android games now. I love how devs are always adding new worlds, which are all great. The mechanism is very simple and calibration comes often handy. Works well with my phone and emulator too.
Followed, since, WAY, Followed this game since WAY back then. Congratulation on getting top spot on paid app! Good luck on Rhythm Doctor, will buy it once you released it on Android ^^
released, on, Android, Followed this game since WAY back then. Congratulation on getting top spot on paid app! Good luck on Rhythm Doctor, will buy it once you released it on Android ^^
become, after, update, has become laggy after the update. this used to work fine before. but right after update i couldnt even play anymore
play, after, update, has become laggy after the update. this used to work fine before. but right after update i couldnt even play anymore
have, on, phone, The game is fabulous on steam. love the music. love the gameplay. I thought it would be amazing to have it on my phone. However, it's obvious that the developer have made no effort on optimising the game for mobile users. The game is lag af and unplayable on my phone (Huawei p20 lite). I hope this could be improved. until then.
restart, into, beat, Really good. Could be better if it had an exit button and if it remembered last progress so one can continue without having to manually skip tutorials. Also, a wonderful feature would be to have the initial beat of the level continue after failing, so one can seamlessly restart the level into that beat. Ending the audio abruptly upon failing is very anticlimactic. Same for the menu music that ends abruptly when entering the settings - at least fade it out!
Ending, upon, failing, Really good. Could be better if it had an exit button and if it remembered last progress so one can continue without having to manually skip tutorials. Also, a wonderful feature would be to have the initial beat of the level continue after failing, so one can seamlessly restart the level into that beat. Ending the audio abruptly upon failing is very anticlimactic. Same for the menu music that ends abruptly when entering the settings - at least fade it out!
find, to, Devs, simple but fun! (i would consider it a hard game) nice, that there are new levels, keep it up! to Devs: i find myself playing the game only orientating with hearing because video ist sometimes a bit laggy. how about coloring the floor green or red depending on hitting perfect / too late/... (different colors for early and late!!)
orientating, with, hearing, simple but fun! (i would consider it a hard game) nice, that there are new levels, keep it up! to Devs: i find myself playing the game only orientating with hearing because video ist sometimes a bit laggy. how about coloring the floor green or red depending on hitting perfect / too late/... (different colors for early and late!!)
change, to, sound, Absolutely love this game, and it just so happens that I'm a drummer too. I'm addicted to it! A real pity that it's so short though. Would've loved it even more if it had some endless mode etc. Just 3 suggestions for the game. One, there's no orientation change even when rotating the phone. Please implement this! Two, an option to disable haptic feedback would be nice. Maybe change it to a sound instead too. Three, my 'worlds' all have accuracy over 100%. Not sure if it's a bug? Thank you!
buy, on, platform, I am a huge fan. I will buy this game on every platform.
came, because, hongbin, i came here because of hongbin
broken, for, me, Amazing game, one of my favorites. Unfortunately, World #3, Level X is currently broken for me (Love Letters) - at about 19%-20%, when the screen flashes and the base kicks in, instead of proceeding with the beat, the spheres stay in one place and on the next beat you lose. I've tried this level about 20 times and I'm pretty sure it's a bug (Samsung S7 with Android 8.0 and build 1.0.5 ~ r15). Please fix this!
broken, at, %, Amazing game, one of my favorites. Unfortunately, World #3, Level X is currently broken for me (Love Letters) - at about 19%-20%, when the screen flashes and the base kicks in, instead of proceeding with the beat, the spheres stay in one place and on the next beat you lose. I've tried this level about 20 times and I'm pretty sure it's a bug (Samsung S7 with Android 8.0 and build 1.0.5 ~ r15). Please fix this!
proceeding, with, beat, Amazing game, one of my favorites. Unfortunately, World #3, Level X is currently broken for me (Love Letters) - at about 19%-20%, when the screen flashes and the base kicks in, instead of proceeding with the beat, the spheres stay in one place and on the next beat you lose. I've tried this level about 20 times and I'm pretty sure it's a bug (Samsung S7 with Android 8.0 and build 1.0.5 ~ r15). Please fix this!
stay, in, place, Amazing game, one of my favorites. Unfortunately, World #3, Level X is currently broken for me (Love Letters) - at about 19%-20%, when the screen flashes and the base kicks in, instead of proceeding with the beat, the spheres stay in one place and on the next beat you lose. I've tried this level about 20 times and I'm pretty sure it's a bug (Samsung S7 with Android 8.0 and build 1.0.5 ~ r15). Please fix this!
try, for, everyone, Now my lag issue has been resolved (really fast and helpful answer!), i can give it the full 5 stars it earns. (for everyone else who has a lag problem: try increasing the offset by ~0.20. Bluetooth speakers might be the cause of it lagging)
increasing, by, ~0.20, Now my lag issue has been resolved (really fast and helpful answer!), i can give it the full 5 stars it earns. (for everyone else who has a lag problem: try increasing the offset by ~0.20. Bluetooth speakers might be the cause of it lagging)
