VERB, PREP, POBJ, 
got, on, steam, I do love this game, got it on steam and on my switch, so it was also a must have for my mobile. Until now I have just a few Problems a) my characters lips look a bit weird, makes her look as if she had tusks in her lower jaw. b) the sprint key is in a bad position, I read a complain that someone had trouble not to sprint all the time; I have trouble to use sprint at all c) The "Sort All" option doesn't work, pressing the key does nothing at all.
had, in, jaw, I do love this game, got it on steam and on my switch, so it was also a must have for my mobile. Until now I have just a few Problems a) my characters lips look a bit weird, makes her look as if she had tusks in her lower jaw. b) the sprint key is in a bad position, I read a complain that someone had trouble not to sprint all the time; I have trouble to use sprint at all c) The "Sort All" option doesn't work, pressing the key does nothing at all.
need, on, smartphone, I need more game like this on smartphone .. Ao gorgeousss!!!!
Thank, for, fixing, Thank you for fixing! Can we link our google accounts to xbox account or vice versa? Would like to continue my xbox game. Thanks ♥
link, to, account, Thank you for fixing! Can we link our google accounts to xbox account or vice versa? Would like to continue my xbox game. Thanks ♥
played, like, game, Very like this game👍🏻 played it on pc before. I've got a request, Could you put customize control button because it's a bit hard for me to push the button and stuff. Jobs done and keep it up.👏🏻
played, on, pc, Very like this game👍🏻 played it on pc before. I've got a request, Could you put customize control button because it's a bit hard for me to push the button and stuff. Jobs done and keep it up.👏🏻
Thank, to, developers, Great game until now. No bugs dettected. Thank you to developers for their hard work.
Thank, for, work, Great game until now. No bugs dettected. Thank you to developers for their hard work.
playing, for, days, I'm really enjoying that this game is open world and that there isn't ads or additional costs once bought. However after I'd playing for 3 days and making a fair amount of progress the game froze and my Samsung UI failed. I had to do a soft reset on my phone. When opening the app again it remained frozen so I deleted it and reinstalled it. My game data hadn't saved properly despite saving to the cloud. The most recent save was from the 1st day of playing. Really annoying. Please fix this issue.
saving, to, cloud, I'm really enjoying that this game is open world and that there isn't ads or additional costs once bought. However after I'd playing for 3 days and making a fair amount of progress the game froze and my Samsung UI failed. I had to do a soft reset on my phone. When opening the app again it remained frozen so I deleted it and reinstalled it. My game data hadn't saved properly despite saving to the cloud. The most recent save was from the 1st day of playing. Really annoying. Please fix this issue.
slide, to, direction, Controls a bit laggy. Sometime stuck to one direction and cannot slide it to the direction i desire. Except that, all perfect.
Done, for, Game, The Freezing Issue has been fixing and i can play it Smoothly, Well Performance, Well Service Response, Well Done for amazing Game.
Runs, with, option, Great game and very nice port! I typically despise virtual gamepads, but this works really well. Layout is intuitive. Runs smoothly with any graphics option on my Note 20 Ultra. Knocked out about 24% of my battery over 1.5 hrs so it does suck up some juice. However, this isn't too surprising (nor that bad) considering the graphics. Overall, definitely a worthy purchase. I got it on sale, but its easily worth full price.
Knocked, over, hrs, Great game and very nice port! I typically despise virtual gamepads, but this works really well. Layout is intuitive. Runs smoothly with any graphics option on my Note 20 Ultra. Knocked out about 24% of my battery over 1.5 hrs so it does suck up some juice. However, this isn't too surprising (nor that bad) considering the graphics. Overall, definitely a worthy purchase. I got it on sale, but its easily worth full price.
got, on, sale, Great game and very nice port! I typically despise virtual gamepads, but this works really well. Layout is intuitive. Runs smoothly with any graphics option on my Note 20 Ultra. Knocked out about 24% of my battery over 1.5 hrs so it does suck up some juice. However, this isn't too surprising (nor that bad) considering the graphics. Overall, definitely a worthy purchase. I got it on sale, but its easily worth full price.
keeps, on, loading, It just keeps on loading and not opening Edit: from 1 to 5 stars, great game, great graphics, great gameplay, very addictive. F2p. Hope it becomes multiplayer later on. Keep up the good work.
keeps, from, stars, It just keeps on loading and not opening Edit: from 1 to 5 stars, great game, great graphics, great gameplay, very addictive. F2p. Hope it becomes multiplayer later on. Keep up the good work.
optimized, for, mobile, Always patch this game to become most stable and optimized for mobile. you should add 60fps or fps unlocked
use, with, games, Good port. Just wish there was controller support so it would be a bit easier to use since I have big hands and a small phone. So I use a mobile controller with most games that I can.
enter, to, Guild, I like this game, but whan I enter to Commercial Guild it's stuck.
have, on, platforms, I would rate this 5 star but because it does not support controller support I feel it should only be 3, I will change if or when it does support controller. I have this on all platforms and kickstarted sandrock so I am a massive fan but I do feel let down as been waiting for mobile port since day dot and the touch detect my thumbs correctly. Please sort this out.
waiting, for, port, I would rate this 5 star but because it does not support controller support I feel it should only be 3, I will change if or when it does support controller. I have this on all platforms and kickstarted sandrock so I am a massive fan but I do feel let down as been waiting for mobile port since day dot and the touch detect my thumbs correctly. Please sort this out.
waiting, since, dot, I would rate this 5 star but because it does not support controller support I feel it should only be 3, I will change if or when it does support controller. I have this on all platforms and kickstarted sandrock so I am a massive fan but I do feel let down as been waiting for mobile port since day dot and the touch detect my thumbs correctly. Please sort this out.
Looking, to, updates, Great game! I actually prefer this more than stardew valley 😄 good work, developers! Looking forward to more updates in future
Looking, in, future, Great game! I actually prefer this more than stardew valley 😄 good work, developers! Looking forward to more updates in future
have, on, One, Fantastic port of a game 🙂 have this on Xbox One since day of release and now also on mobile. So far cannot fault the game, they have made it simple to play and adapted it well to Mobile with the save feature on exiting the game via menu and the map being able to put a marker down and automatically running there. These are two awesome features.
have, since, day, Fantastic port of a game 🙂 have this on Xbox One since day of release and now also on mobile. So far cannot fault the game, they have made it simple to play and adapted it well to Mobile with the save feature on exiting the game via menu and the map being able to put a marker down and automatically running there. These are two awesome features.
adapted, to, Mobile, Fantastic port of a game 🙂 have this on Xbox One since day of release and now also on mobile. So far cannot fault the game, they have made it simple to play and adapted it well to Mobile with the save feature on exiting the game via menu and the map being able to put a marker down and automatically running there. These are two awesome features.
adapted, with, feature, Fantastic port of a game 🙂 have this on Xbox One since day of release and now also on mobile. So far cannot fault the game, they have made it simple to play and adapted it well to Mobile with the save feature on exiting the game via menu and the map being able to put a marker down and automatically running there. These are two awesome features.
exiting, via, menu, Fantastic port of a game 🙂 have this on Xbox One since day of release and now also on mobile. So far cannot fault the game, they have made it simple to play and adapted it well to Mobile with the save feature on exiting the game via menu and the map being able to put a marker down and automatically running there. These are two awesome features.
looking, for, game, Amazing game so far. I was looking for a farming game that is not the usual plant and log out thing and this seems to be it, with relationships and places to explore. Love the graphics, the calm atmosphere and the multitude of details. The quests/commissions are just complex enough to hold your attention. I am only on day 5, so I can't say too much about how it progresses as a game, but so far everything is going great. Looking forward to exploring this world which promises to be intriguing.
progresses, as, game, Amazing game so far. I was looking for a farming game that is not the usual plant and log out thing and this seems to be it, with relationships and places to explore. Love the graphics, the calm atmosphere and the multitude of details. The quests/commissions are just complex enough to hold your attention. I am only on day 5, so I can't say too much about how it progresses as a game, but so far everything is going great. Looking forward to exploring this world which promises to be intriguing.
works, with, moto, Good game, works with my old moto g5s plus
played, on, PC, It's def worth the money. Runs well. The controller isn't really needed. Good port having played it on PC first. It has a reasonable downgrade in graphics for a phone game. But it looks great with the cartoon look on a 6.5ish inch screen.
looks, with, look, It's def worth the money. Runs well. The controller isn't really needed. Good port having played it on PC first. It has a reasonable downgrade in graphics for a phone game. But it looks great with the cartoon look on a 6.5ish inch screen.
paid, for, game, This game could be so good, but the lag times, freezing, and force closes are unbearable. I paid for this game, and I can't really play it because of this. It's really frustrating.
play, because, this, This game could be so good, but the lag times, freezing, and force closes are unbearable. I paid for this game, and I can't really play it because of this. It's really frustrating.
play, on, phone, This is awesome...finally I can play on my phone.
unlock, in, updates, Awesome porting from PC! Hey dev, can you make this game run 60fps or higher? I think 30fps did not enough 😃 And also maybe in future updates, the other maps will unlock right?
flickering, with, silhouette, My only problem is the glitch on graphics. The town floor is flickering with green silhouette. If you would kindly fix this. Thank you.
releasing, for, mobile, Perfect game just like on pc version.Well minor is only battery drain.Price is cheap same as pc version.Very worthed u can have all fun like build,socializing petting,riding,farming,fishing,dungeon battle,adventure.etc.One buy no IAP and gacha.Thx for releasing this awesome game for mobile.
synced, with, Xbox, Love game but wish it synced with Xbox... But definitely a great game on mobile too!
play, on, mobile, Great job Pathea & Nuverse Ive enjoyed this game since it was on PC. Im glad you make it possible to play on mobile.
carried, to, guild, Hi I found a bug. When I finished making the Dee Dee transport and carried it to the commerce guild for the commission my game froze as soon as I entered the room. I have restarted my phone, I redid the day more than five times now but it still freezes when I enter the guild. What should I do? I'm rating this five star because it's a good game but I can't continue the game if my it keeps on freezing.
keeps, on, freezing, Hi I found a bug. When I finished making the Dee Dee transport and carried it to the commerce guild for the commission my game froze as soon as I entered the room. I have restarted my phone, I redid the day more than five times now but it still freezes when I enter the guild. What should I do? I'm rating this five star because it's a good game but I can't continue the game if my it keeps on freezing.
relaxing, at, time, The overall gameplay was excellent it was engaging and relaxing at the same time, i just so happen to encounter a problem with the inspection mini game at the commerce guild, everytime ypu enter the commerce guild the game freeze and force the game to close or restart the phone entirely. I do hope the developers address this issue.
start, during, weekends, After doing a lot of testing for this commerce guild freeze issue. Just found out that it will start freezing and crashing after day 20 (any season) during weekends consistently. I'm around level 13-15.
crashing, after, day, After doing a lot of testing for this commerce guild freeze issue. Just found out that it will start freezing and crashing after day 20 (any season) during weekends consistently. I'm around level 13-15.
get, with, solution, My relic scanner does not work properly. The gold orbs that are supposed to appear do not. I have tried everything. This means I can't progress any further. I really love this game but this has spoiled it for me. Can you please get back to me with a solution?
note, in, creation, This is a great game! It's almost a perfect port from the PC version. I would note in character creation the models lips look broken. Besides that I haven't seen any other errors! Would love some more customization options though!
seen, Besides, that, This is a great game! It's almost a perfect port from the PC version. I would note in character creation the models lips look broken. Besides that I haven't seen any other errors! Would love some more customization options though!
works, on, phone, A beautiful port of a wonderful game. If you like crafting simulation games like Stardew Valley, Graveyard Keeper, Rune factory 4 or Dragon Quest Builders, you'll love this game too. Unfortunately, this doesn't seem to support all devices - namely chromebooks. Runs and works great on my phone (4G RAM) but doesn't even get to the loading screen on my chromebook (16G RAM). Definitely worth every penny if you have the hardware to run it but can't give it an unreserved recommendation right now.
get, to, screen, A beautiful port of a wonderful game. If you like crafting simulation games like Stardew Valley, Graveyard Keeper, Rune factory 4 or Dragon Quest Builders, you'll love this game too. Unfortunately, this doesn't seem to support all devices - namely chromebooks. Runs and works great on my phone (4G RAM) but doesn't even get to the loading screen on my chromebook (16G RAM). Definitely worth every penny if you have the hardware to run it but can't give it an unreserved recommendation right now.
get, on, chromebook, A beautiful port of a wonderful game. If you like crafting simulation games like Stardew Valley, Graveyard Keeper, Rune factory 4 or Dragon Quest Builders, you'll love this game too. Unfortunately, this doesn't seem to support all devices - namely chromebooks. Runs and works great on my phone (4G RAM) but doesn't even get to the loading screen on my chromebook (16G RAM). Definitely worth every penny if you have the hardware to run it but can't give it an unreserved recommendation right now.
combining, with, gameplay, My 3rd playthrough combining with PC gameplay. The transition is smooth so far with actually an amazing control. You know I found this developer is passionate with the game and it is worth it to support them. Cant wait for first time at sandrock.
wait, for, time, My 3rd playthrough combining with PC gameplay. The transition is smooth so far with actually an amazing control. You know I found this developer is passionate with the game and it is worth it to support them. Cant wait for first time at sandrock.
loaded, for, hour, I have loaded for one hour ! But could not start. What a waste
runs, on, S, I had low expectations of this, since it's a ported console game, but it blew my expectations out of the water! It's every bit as good as the console versions, and runs perfectly on my Galaxy S 20.
change, to, stars, I like this game but my character's mouth looks really weird, and it's quite distracting. It makes the cut scenes with my character look so odd. I will change this to 5 stars if the mouth gets fixed.
keeps, on, freezing, It is a really nice game at first but now it keeps on freezing. I tried restarting the game and my phone as well but it is still the same. Please fix it!!! I really like this game.
stayed, in, loading, It stayed in loading... I didn't even get a chance to play the game. :-(
prefer, over, version, Great game. Great Port. I actually prefer this over Xbox version. However, it needs controller support. I can't use my Razer Kishi android controller with this game. 5 stars if I could.
use, with, game, Great game. Great Port. I actually prefer this over Xbox version. However, it needs controller support. I can't use my Razer Kishi android controller with this game. 5 stars if I could.
indicate, to, life, I NEED A FREAKING MOD this game is Soo GOOD But yeah, indicate to no life So ease PROVIDE US THE MODS thank you
play, at, pace, Pretty solid game, fun and you can play the game at your own pace. the only problem is that there is no controller setting, I can't use my ipega gamepad :( glad the touch control is really good, but still connecting to my gamepad would be blast
connecting, to, gamepad, Pretty solid game, fun and you can play the game at your own pace. the only problem is that there is no controller setting, I can't use my ipega gamepad :( glad the touch control is really good, but still connecting to my gamepad would be blast
rains, in, game, Game runs great on huawei p30 pro however I noticed that precipation effect doesn't show when it rains in game. You can see dark clouds, thunder sound but not precipation sound and it's not visible. It doesn't even show on highest graphic settings so hope it can be patched as there is precipation effect option and it does nothing to change anything in game. Anyway the game is really fun, controls are well thought out and should run great on similar phones that I have.
show, on, settings, Game runs great on huawei p30 pro however I noticed that precipation effect doesn't show when it rains in game. You can see dark clouds, thunder sound but not precipation sound and it's not visible. It doesn't even show on highest graphic settings so hope it can be patched as there is precipation effect option and it does nothing to change anything in game. Anyway the game is really fun, controls are well thought out and should run great on similar phones that I have.
change, in, game, Game runs great on huawei p30 pro however I noticed that precipation effect doesn't show when it rains in game. You can see dark clouds, thunder sound but not precipation sound and it's not visible. It doesn't even show on highest graphic settings so hope it can be patched as there is precipation effect option and it does nothing to change anything in game. Anyway the game is really fun, controls are well thought out and should run great on similar phones that I have.
run, on, phones, Game runs great on huawei p30 pro however I noticed that precipation effect doesn't show when it rains in game. You can see dark clouds, thunder sound but not precipation sound and it's not visible. It doesn't even show on highest graphic settings so hope it can be patched as there is precipation effect option and it does nothing to change anything in game. Anyway the game is really fun, controls are well thought out and should run great on similar phones that I have.
save, on, device, Edited : I meant save on the same mobile device not bring my switch save to my mobile. I'll check to make sure it's saved then when I close the game out it deletes the whole thing. I don't think leaving on In background should be answer but it feels like the only way to go.
bring, to, mobile, Edited : I meant save on the same mobile device not bring my switch save to my mobile. I'll check to make sure it's saved then when I close the game out it deletes the whole thing. I don't think leaving on In background should be answer but it feels like the only way to go.
think, In, background, Edited : I meant save on the same mobile device not bring my switch save to my mobile. I'll check to make sure it's saved then when I close the game out it deletes the whole thing. I don't think leaving on In background should be answer but it feels like the only way to go.
feels, like, way, Edited : I meant save on the same mobile device not bring my switch save to my mobile. I'll check to make sure it's saved then when I close the game out it deletes the whole thing. I don't think leaving on In background should be answer but it feels like the only way to go.
come, to, me, The game is beautiful but I think I spotted a bug or maybe unclear instructions, there is a mini game called roping, no matter what I do, animals don't come to me and I lose the rope... I suggest having a tutorial for these mini games better than instructions that are unclear... 3 stars now, please fix my problem, consider changing events and minigames into tutorials and you'll have 5 stars...
changing, into, tutorials, The game is beautiful but I think I spotted a bug or maybe unclear instructions, there is a mini game called roping, no matter what I do, animals don't come to me and I lose the rope... I suggest having a tutorial for these mini games better than instructions that are unclear... 3 stars now, please fix my problem, consider changing events and minigames into tutorials and you'll have 5 stars...
get, in, npc, No voice acting. Unless I get voiceovers in npc then it stays 3stars. But so far this game is exciting!
get, on, mobile, An excellent mobile port. Controls is as good as it can get on mobile and so far I haven't encountered any game breaking bugs. Im just glad to get another quality premium game for mobile and its worth the cheap asking price
got, on, mobile, I got the Nintendo switch version of this game my God on the mobile 10 times better than the console version the added in more voice acting the loading times are so much smoother touch screen controls are so smooth and fluent good job on improving the game it's worth buying this game I hope you guys are in line for porting the sequel my time at sandlot if you guys are most definitely going to buy the game
added, in, voice, I got the Nintendo switch version of this game my God on the mobile 10 times better than the console version the added in more voice acting the loading times are so much smoother touch screen controls are so smooth and fluent good job on improving the game it's worth buying this game I hope you guys are in line for porting the sequel my time at sandlot if you guys are most definitely going to buy the game
wait, for, support, love it!! Can't wait for the controller support! 🥰
entering, at, date, Something wrong it just me or anyone else also experienced this, it freeze when entering commerce guild at certain date in the game, it happened twice for me. the first time i just reload my game in the bed and skip the entire day without entering the commerce guild, and the next day it's normal. But these issues still there for the second time it freeze again. Well sure it will kill the mood if it happened again, reload my game and avoid the day without entering the commerce guild.
happened, for, me, Something wrong it just me or anyone else also experienced this, it freeze when entering commerce guild at certain date in the game, it happened twice for me. the first time i just reload my game in the bed and skip the entire day without entering the commerce guild, and the next day it's normal. But these issues still there for the second time it freeze again. Well sure it will kill the mood if it happened again, reload my game and avoid the day without entering the commerce guild.
looking, for, update, Love this life sim game. But this port is a bit unpolished for my liking like font is too small for sub 6" phone display, map is cluttered for a small screen device and, also the game is a bit laggy and unoptimised. Am looking forward for future update.
fades, to, screen, Unable to play. Allows me to make character and fades to black screen
come, to, mobile, Its nice to see this game come to mobile. I'm kind of getting tired of the typical "mobile" game which always feels hollow. This game is exactly like the pc version. The controls feel good and it works well on my S10+.
works, on, S10, Its nice to see this game come to mobile. I'm kind of getting tired of the typical "mobile" game which always feels hollow. This game is exactly like the pc version. The controls feel good and it works well on my S10+.
supported, on, mobile, Controller support is still missing. Can't fully recommend it as of yet. It is fun on console though. Will give five stars if and when controllers are supported on mobile too.
manage, than, versions, I find the mobile version to be easier to manage than the console and PC versions. This is great!
