VERB, PREP, POBJ, 
noticed, in, X, I noticed in PA-X, on the last mid-spin tile in the level, that the wrong texture was used or at least shown to where it showed a U-turn tile instead.
noticed, on, tile, I noticed in PA-X, on the last mid-spin tile in the level, that the wrong texture was used or at least shown to where it showed a U-turn tile instead.
sucks, without, paper, Yay options time but still detection system sucks without paper (and I meant that literally)
Play, on, tho, Play it on pc tho
challenging, at, levels, Game is simple but challenging at later levels. Truly a great game
got, for, phone, Game is super cool but the only reason why I got it for my phone was so I could play level 10 but you cant play it before beating level 8 & 9 which is super stupid because it isn't like that on pc either. Never played level 9 before and it is super hard. You should change it so that a player can choose which level they want to play regardless of the other levels. This is stupid
lovable, for, me, I am good at rythm games, this is a great rythm game, but it is also harder then other rythm games I've played. Thats what makes this game lovable for me :) I recommend you to get it
have, on, PC, Great game, have it on PC and wanted it here, sadly you can't play the last extra world, World XT, or "options" as I like to call it. Can't wait to have the muse dash songs here though!
getting, to, part, Cool game but the inability to practice certain sections made me refund it. I spent way too long getting to one part of a song before dying to it again and again learning nothing. Just because you have a cool looking rythm game doesn't mean you can omit features every other rythm game has.
dying, to, it, Cool game but the inability to practice certain sections made me refund it. I spent way too long getting to one part of a song before dying to it again and again learning nothing. Just because you have a cool looking rythm game doesn't mean you can omit features every other rythm game has.
play, at, %, Great game, but burns my battery way too fast. Can't play more than 15-20 minutes even at 100%
love, on, phone, I love this game on the phone and on the computer. I just hope you are able to release a custom level/level editor on the phone version.
gets, with, levels, Probably the most simplistic idea for a rhythm game imaginable, and yet it manages to still maintain so much content because of how difficult it gets with later levels. Definitely my favorite rhythm game of all time. After buying this version, I ended up getting the steam version as well for $6, and that one has the option of creating your own levels; or playing some of the 10,000s of online levels. The PC version is far better control wise, but mobile is still very much playable.
getting, for, 6, Probably the most simplistic idea for a rhythm game imaginable, and yet it manages to still maintain so much content because of how difficult it gets with later levels. Definitely my favorite rhythm game of all time. After buying this version, I ended up getting the steam version as well for $6, and that one has the option of creating your own levels; or playing some of the 10,000s of online levels. The PC version is far better control wise, but mobile is still very much playable.
Works, on, phone, Tried the web demo (first 3 levels) and really liked it. This full version has many interesting rhythms and catchy songs. Works well on my phone, and even works fine on my potato Chromebook after turning off special effects.
works, on, potato, Tried the web demo (first 3 levels) and really liked it. This full version has many interesting rhythms and catchy songs. Works well on my phone, and even works fine on my potato Chromebook after turning off special effects.
changing, to, everytime, Good game but it really needs an update since the game doesn't save your settings. It's annoying changing the resolution to 70 everytime I open the game.
link, with, acc, Can i link with my steam acc?
add, in, settings, please add fps options in the settings. The input lag is terrible and it makes the game annoyingly hard to play. Calibration in the settings doesn't really match with the gameplay. Maybe I expected too much from it.. it's very different compared to the Steam version.
match, with, gameplay, please add fps options in the settings. The input lag is terrible and it makes the game annoyingly hard to play. Calibration in the settings doesn't really match with the gameplay. Maybe I expected too much from it.. it's very different compared to the Steam version.
compared, to, version, please add fps options in the settings. The input lag is terrible and it makes the game annoyingly hard to play. Calibration in the settings doesn't really match with the gameplay. Maybe I expected too much from it.. it's very different compared to the Steam version.
get, for, fire, This game was amazingly fun! The extra worlds are really good, I found some great songs with this, it's worth the money! The more worlds you complete, the more colors you get for your fire and ice :)
enjoyed, for, people, The more level there is, the more I realize that I'm bad at rhytm.. Superb song though and I think it's a bit easier, like the error margin is more tolerant than it used to be, so I think it can be enjoyed better for people like me XD
tapping, on, screen, Pushing buttons > tapping on flat screen
see, over, store, Really good game No ads, fun, better than 90% of all games in the Google play store. Can't wait to see knockoffs of the game all over the store!
TAP, TO, RYTHEM, YOU TAP TO THE RYTHEM BUT THE RYTHEM IS A MINIGUN.
songs, on, mobile, Good game, but no custom songs on mobile. Only on PC Steam :(
work, on, mobile, Love the idea of this game but doesn't seem to work on mobile. I can calibrate fine but after about 80% of the first level it just stops registering my inputs and I lose on the simple section. Unless I can find a fix soon I will have to refund
calibrate, after, %, Love the idea of this game but doesn't seem to work on mobile. I can calibrate fine but after about 80% of the first level it just stops registering my inputs and I lose on the simple section. Unless I can find a fix soon I will have to refund
lose, on, section, Love the idea of this game but doesn't seem to work on mobile. I can calibrate fine but after about 80% of the first level it just stops registering my inputs and I lose on the simple section. Unless I can find a fix soon I will have to refund
buy, for, mobile, So good I had to buy it for mobile. Great game
playing, on, game, Hello, I'm a user who's been playing hard on this game. I'm writing this message to say that I want you to add a little bit to the update. Please add more levels to the update. Each time you clear the map, you can create your own account. Please make a system that raises the account level.
add, to, update, Hello, I'm a user who's been playing hard on this game. I'm writing this message to say that I want you to add a little bit to the update. Please add more levels to the update. Each time you clear the map, you can create your own account. Please make a system that raises the account level.
add, to, update, Hello, I'm a user who's been playing hard on this game. I'm writing this message to say that I want you to add a little bit to the update. Please add more levels to the update. Each time you clear the map, you can create your own account. Please make a system that raises the account level.
played, on, steam, played it on steam. off to work with train, watching streamers play this game. read the comment, THERES A MOBILE VERSION???!!!! 12/10 would dance with faiyah and iceeeee
work, with, train, played it on steam. off to work with train, watching streamers play this game. read the comment, THERES A MOBILE VERSION???!!!! 12/10 would dance with faiyah and iceeeee
dance, with, faiyah, played it on steam. off to work with train, watching streamers play this game. read the comment, THERES A MOBILE VERSION???!!!! 12/10 would dance with faiyah and iceeeee
ask, for, this, I love the game alot I just wanna ask when can we have a level editor for mobile, I've been wanting to ask for this, if possible could you please make it happen and have a whole mobile community come to gether and make leves for people who play on mobile.
come, to, gether, I love the game alot I just wanna ask when can we have a level editor for mobile, I've been wanting to ask for this, if possible could you please make it happen and have a whole mobile community come to gether and make leves for people who play on mobile.
play, on, mobile, I love the game alot I just wanna ask when can we have a level editor for mobile, I've been wanting to ask for this, if possible could you please make it happen and have a whole mobile community come to gether and make leves for people who play on mobile.
downloaded, on, 8th, Hey, i downloaded this on the 8th and its been not working since. I waited all of this time because i was not sure what to do Then i decided to try to get a refund This simalar thing happened with another game i bought and downloaded the game was called hiveswap and i waited a clouple weeks thinking that it needed time to render that i bought it and downloaded it. And it worked. Thats what i thought the same rules applied with this game and i guess not. The thing is, i want a refund if possible.
happened, with, game, Hey, i downloaded this on the 8th and its been not working since. I waited all of this time because i was not sure what to do Then i decided to try to get a refund This simalar thing happened with another game i bought and downloaded the game was called hiveswap and i waited a clouple weeks thinking that it needed time to render that i bought it and downloaded it. And it worked. Thats what i thought the same rules applied with this game and i guess not. The thing is, i want a refund if possible.
applied, with, game, Hey, i downloaded this on the 8th and its been not working since. I waited all of this time because i was not sure what to do Then i decided to try to get a refund This simalar thing happened with another game i bought and downloaded the game was called hiveswap and i waited a clouple weeks thinking that it needed time to render that i bought it and downloaded it. And it worked. Thats what i thought the same rules applied with this game and i guess not. The thing is, i want a refund if possible.
have, with, it, Everything about the game is great; controls, visuals, and of course the music. Only issue i have with it is the calibration. It constantly goes from around 250 to 300 ms at seemingly random. It also seems to break most of the time when checkpoints are used, bringing the song offbeat and offtiming things, making worlds like XO and XT more difficult than needed.
goes, from, ms, Everything about the game is great; controls, visuals, and of course the music. Only issue i have with it is the calibration. It constantly goes from around 250 to 300 ms at seemingly random. It also seems to break most of the time when checkpoints are used, bringing the song offbeat and offtiming things, making worlds like XO and XT more difficult than needed.
dive, to, this, I need to dive right in to this, in a compliment sandwich. With extra bread. This game is really smooth. I downloaded it on mobile and it is worth the money.Though, adding a level editor would be nice. I love the simple, easy to understand plot. It basically has you as god, controlling two planets in the rhythm of a song. And if you're broke, you can just go on your web browser and search up the best game, A Dance of Fire and Ice, and click on the itch.io build since Steam costs money.
dive, in, sandwich, I need to dive right in to this, in a compliment sandwich. With extra bread. This game is really smooth. I downloaded it on mobile and it is worth the money.Though, adding a level editor would be nice. I love the simple, easy to understand plot. It basically has you as god, controlling two planets in the rhythm of a song. And if you're broke, you can just go on your web browser and search up the best game, A Dance of Fire and Ice, and click on the itch.io build since Steam costs money.
downloaded, on, mobile, I need to dive right in to this, in a compliment sandwich. With extra bread. This game is really smooth. I downloaded it on mobile and it is worth the money.Though, adding a level editor would be nice. I love the simple, easy to understand plot. It basically has you as god, controlling two planets in the rhythm of a song. And if you're broke, you can just go on your web browser and search up the best game, A Dance of Fire and Ice, and click on the itch.io build since Steam costs money.
has, as, god, I need to dive right in to this, in a compliment sandwich. With extra bread. This game is really smooth. I downloaded it on mobile and it is worth the money.Though, adding a level editor would be nice. I love the simple, easy to understand plot. It basically has you as god, controlling two planets in the rhythm of a song. And if you're broke, you can just go on your web browser and search up the best game, A Dance of Fire and Ice, and click on the itch.io build since Steam costs money.
controlling, in, rhythm, I need to dive right in to this, in a compliment sandwich. With extra bread. This game is really smooth. I downloaded it on mobile and it is worth the money.Though, adding a level editor would be nice. I love the simple, easy to understand plot. It basically has you as god, controlling two planets in the rhythm of a song. And if you're broke, you can just go on your web browser and search up the best game, A Dance of Fire and Ice, and click on the itch.io build since Steam costs money.
go, on, browser, I need to dive right in to this, in a compliment sandwich. With extra bread. This game is really smooth. I downloaded it on mobile and it is worth the money.Though, adding a level editor would be nice. I love the simple, easy to understand plot. It basically has you as god, controlling two planets in the rhythm of a song. And if you're broke, you can just go on your web browser and search up the best game, A Dance of Fire and Ice, and click on the itch.io build since Steam costs money.
click, on, build, I need to dive right in to this, in a compliment sandwich. With extra bread. This game is really smooth. I downloaded it on mobile and it is worth the money.Though, adding a level editor would be nice. I love the simple, easy to understand plot. It basically has you as god, controlling two planets in the rhythm of a song. And if you're broke, you can just go on your web browser and search up the best game, A Dance of Fire and Ice, and click on the itch.io build since Steam costs money.
takes, for, one, I love rhythm games but I think this takes it for a phone one
spooking, in, game, Insanely great music, awesome gameplay, everything I wa spooking for in a rhythm game, sadly it's super short, but the time challenges are nice
play, on, mobile, Very great game, but obviously I can't play any customs on mobile, so it would have been nice to see a bit more content available after acing the game. It is nice to be able to practice while I'm on a trip however, and the detection is pretty good for a mobile rhythm game.
got, through, it, Love the game, got through it quickly, being a drummer. wish there were more levels.
like, on, pc, i like this gane boi... but i like on pc :>
found, about, it, Execelent game! I thought it was a cool game on itch.io until I found out about it on tablet. Amazing Game , good price Buy it!
found, on, tablet, Execelent game! I thought it was a cool game on itch.io until I found out about it on tablet. Amazing Game , good price Buy it!
Looking, to, addition, This game is one of the best rhythm games I have ever played. The music is catchy and the level graphics are amazing and still well optimized. The concept is an amazing idea and was executed excellently. The balancing on the levels is decent, and the levels are lots of fun to play and unique in their own way. This is a rhythm game for beginners, but not a beginner's rhythm game. Looking forward to the addition of the level editor on the mobile version!
buying, on, mobile, Great game. The one issue i have is that after buying it on mobile, if i wanted to play it with keyboard (touchscreen is less precise) i'd have to buy it on pc too
play, with, keyboard, Great game. The one issue i have is that after buying it on mobile, if i wanted to play it with keyboard (touchscreen is less precise) i'd have to buy it on pc too
buy, on, pc, Great game. The one issue i have is that after buying it on mobile, if i wanted to play it with keyboard (touchscreen is less precise) i'd have to buy it on pc too
add, on, mobile, I hope they also add costume level on mobile so I can play whenever I want. Btw I also make an ADOFAI content. Checkout my instagram @bonysubono069 thanks ^^
Bought, on, gplay, Bought a copy of this game on gplay and steam. One for pro gaming and one for casual killing-the-time kind of game.
staying, on, beat, This might be the worst rhythm game I've ever played. I tried calibrating it over and over so I can only conclude that the game intends to punish you for actually staying on beat, so you might as well play it on mute which just makes it a subpar one button game with no purpose
play, on, mute, This might be the worst rhythm game I've ever played. I tried calibrating it over and over so I can only conclude that the game intends to punish you for actually staying on beat, so you might as well play it on mute which just makes it a subpar one button game with no purpose
makes, with, purpose, This might be the worst rhythm game I've ever played. I tried calibrating it over and over so I can only conclude that the game intends to punish you for actually staying on beat, so you might as well play it on mute which just makes it a subpar one button game with no purpose
s, In, version, This game is extremely fun and I only have one gripe. In the steam version, theres support for custom maps, but this version doesnt have that. That's completely fine, it's still one of my favorite mobile rythem games.
look, at, game, Amazing Game. I love it so much that I play it almost every day! Its such a brilliant game. I recommend people look at the game first and if they love it, then they should get it.
stay, with, game, Like the warning said, this game is very reliant on rhythm and keeping the beat. That being said, it's a game that have a simple control or gameplay, but really hard to master, at least for me. It is my first time buying a game. Definitely, worth my money. I'm going to stay with this game so my sense of rhythm can be corrected. Hehe.
Loved, on, love, Loved it on PC love it on the phone
love, on, phone, Loved it on PC love it on the phone
put, in, %, F*****g dev. The game is extremely challanging and great to play but please!!! put a CHECK POINT in every 30%-50% of the level and in every song!!!. I give a star because it's frustrating to repeat the whole level when the mistake happen at 80% and above. Not everyone can play like a pro. Fix this on the next update. Don't let our purchase go to waste if u didn't do anything with our review.
happen, at, %, F*****g dev. The game is extremely challanging and great to play but please!!! put a CHECK POINT in every 30%-50% of the level and in every song!!!. I give a star because it's frustrating to repeat the whole level when the mistake happen at 80% and above. Not everyone can play like a pro. Fix this on the next update. Don't let our purchase go to waste if u didn't do anything with our review.
play, like, pro, F*****g dev. The game is extremely challanging and great to play but please!!! put a CHECK POINT in every 30%-50% of the level and in every song!!!. I give a star because it's frustrating to repeat the whole level when the mistake happen at 80% and above. Not everyone can play like a pro. Fix this on the next update. Don't let our purchase go to waste if u didn't do anything with our review.
Fix, on, update, F*****g dev. The game is extremely challanging and great to play but please!!! put a CHECK POINT in every 30%-50% of the level and in every song!!!. I give a star because it's frustrating to repeat the whole level when the mistake happen at 80% and above. Not everyone can play like a pro. Fix this on the next update. Don't let our purchase go to waste if u didn't do anything with our review.
do, with, review, F*****g dev. The game is extremely challanging and great to play but please!!! put a CHECK POINT in every 30%-50% of the level and in every song!!!. I give a star because it's frustrating to repeat the whole level when the mistake happen at 80% and above. Not everyone can play like a pro. Fix this on the next update. Don't let our purchase go to waste if u didn't do anything with our review.
get, past, %, I can't get past 40% on the first level. I try to calibrate it and it won't do it. I try and tap to the rythm and it says let's just go with the original game settings and won't calibrate. I try and tap to the rhythm and it won't do it. If I follow it visually I can get to 40% of the first level but then I am not taping in rythm to the music at all I am just following the visual squares so I don't die. I can not get past 40% on the first level. This game is impossible. Don't waste your time.
get, on, level, I can't get past 40% on the first level. I try to calibrate it and it won't do it. I try and tap to the rythm and it says let's just go with the original game settings and won't calibrate. I try and tap to the rhythm and it won't do it. If I follow it visually I can get to 40% of the first level but then I am not taping in rythm to the music at all I am just following the visual squares so I don't die. I can not get past 40% on the first level. This game is impossible. Don't waste your time.
tap, to, rythm, I can't get past 40% on the first level. I try to calibrate it and it won't do it. I try and tap to the rythm and it says let's just go with the original game settings and won't calibrate. I try and tap to the rhythm and it won't do it. If I follow it visually I can get to 40% of the first level but then I am not taping in rythm to the music at all I am just following the visual squares so I don't die. I can not get past 40% on the first level. This game is impossible. Don't waste your time.
go, with, settings, I can't get past 40% on the first level. I try to calibrate it and it won't do it. I try and tap to the rythm and it says let's just go with the original game settings and won't calibrate. I try and tap to the rhythm and it won't do it. If I follow it visually I can get to 40% of the first level but then I am not taping in rythm to the music at all I am just following the visual squares so I don't die. I can not get past 40% on the first level. This game is impossible. Don't waste your time.
tap, to, rhythm, I can't get past 40% on the first level. I try to calibrate it and it won't do it. I try and tap to the rythm and it says let's just go with the original game settings and won't calibrate. I try and tap to the rhythm and it won't do it. If I follow it visually I can get to 40% of the first level but then I am not taping in rythm to the music at all I am just following the visual squares so I don't die. I can not get past 40% on the first level. This game is impossible. Don't waste your time.
get, to, %, I can't get past 40% on the first level. I try to calibrate it and it won't do it. I try and tap to the rythm and it says let's just go with the original game settings and won't calibrate. I try and tap to the rhythm and it won't do it. If I follow it visually I can get to 40% of the first level but then I am not taping in rythm to the music at all I am just following the visual squares so I don't die. I can not get past 40% on the first level. This game is impossible. Don't waste your time.
taping, in, rythm, I can't get past 40% on the first level. I try to calibrate it and it won't do it. I try and tap to the rythm and it says let's just go with the original game settings and won't calibrate. I try and tap to the rhythm and it won't do it. If I follow it visually I can get to 40% of the first level but then I am not taping in rythm to the music at all I am just following the visual squares so I don't die. I can not get past 40% on the first level. This game is impossible. Don't waste your time.
taping, to, music, I can't get past 40% on the first level. I try to calibrate it and it won't do it. I try and tap to the rythm and it says let's just go with the original game settings and won't calibrate. I try and tap to the rhythm and it won't do it. If I follow it visually I can get to 40% of the first level but then I am not taping in rythm to the music at all I am just following the visual squares so I don't die. I can not get past 40% on the first level. This game is impossible. Don't waste your time.
taping, at, all, I can't get past 40% on the first level. I try to calibrate it and it won't do it. I try and tap to the rythm and it says let's just go with the original game settings and won't calibrate. I try and tap to the rhythm and it won't do it. If I follow it visually I can get to 40% of the first level but then I am not taping in rythm to the music at all I am just following the visual squares so I don't die. I can not get past 40% on the first level. This game is impossible. Don't waste your time.
