VERB, PREP, POBJ, 
deleted, off, phone, I just bought this game and it crashes constantly. It's frustrating because this is my favorite game on Xbox. Love how the didn't leave out any of the things that are on the console game, as most mobile versions usually do. But jeeze it's glitchy. I even deleted a bunch of stuff off my phone in case that was part of the problem. It wasnt. Super frustrating that it constantly freezes and kicks me off, usually right before I go to bed to save. Don't waste money on this till they fix this issue
deleted, in, case, I just bought this game and it crashes constantly. It's frustrating because this is my favorite game on Xbox. Love how the didn't leave out any of the things that are on the console game, as most mobile versions usually do. But jeeze it's glitchy. I even deleted a bunch of stuff off my phone in case that was part of the problem. It wasnt. Super frustrating that it constantly freezes and kicks me off, usually right before I go to bed to save. Don't waste money on this till they fix this issue
go, to, bed, I just bought this game and it crashes constantly. It's frustrating because this is my favorite game on Xbox. Love how the didn't leave out any of the things that are on the console game, as most mobile versions usually do. But jeeze it's glitchy. I even deleted a bunch of stuff off my phone in case that was part of the problem. It wasnt. Super frustrating that it constantly freezes and kicks me off, usually right before I go to bed to save. Don't waste money on this till they fix this issue
waste, on, this, I just bought this game and it crashes constantly. It's frustrating because this is my favorite game on Xbox. Love how the didn't leave out any of the things that are on the console game, as most mobile versions usually do. But jeeze it's glitchy. I even deleted a bunch of stuff off my phone in case that was part of the problem. It wasnt. Super frustrating that it constantly freezes and kicks me off, usually right before I go to bed to save. Don't waste money on this till they fix this issue
waiting, for, sale, I was waiting for the sale. As soon as it went on sale I instantly bought it. I am loving it ❤ but there is something wrong with the autopaths and i wish we can edit the controler or resize the buttons :3
went, on, sale, I was waiting for the sale. As soon as it went on sale I instantly bought it. I am loving it ❤ but there is something wrong with the autopaths and i wish we can edit the controler or resize the buttons :3
sunk, in, hours, Brilliant Game! It's just like Stardew Valley, but way better! I've already sunk in 30 hours of gameplay and there's still so much to do in the game. I can't say anything other than "brilliant".
do, in, game, Brilliant Game! It's just like Stardew Valley, but way better! I've already sunk in 30 hours of gameplay and there's still so much to do in the game. I can't say anything other than "brilliant".
spent, for, games, Dear Developer, This is the best roleplay game ever for me because i've never spent my money for any games even once before. This game is very worth to buy and so addictive. We didn't compete with anyone (Except Higgins in game haha) that's why it's very relaxing, and healing too. I hope in future you can give Indonesian subtitle and dubbing too, because so many Indonesian fans play this game.. And I hope you can give us more update to make us more addicted with this game. Regards 😊
compete, with, anyone, Dear Developer, This is the best roleplay game ever for me because i've never spent my money for any games even once before. This game is very worth to buy and so addictive. We didn't compete with anyone (Except Higgins in game haha) that's why it's very relaxing, and healing too. I hope in future you can give Indonesian subtitle and dubbing too, because so many Indonesian fans play this game.. And I hope you can give us more update to make us more addicted with this game. Regards 😊
hope, in, future, Dear Developer, This is the best roleplay game ever for me because i've never spent my money for any games even once before. This game is very worth to buy and so addictive. We didn't compete with anyone (Except Higgins in game haha) that's why it's very relaxing, and healing too. I hope in future you can give Indonesian subtitle and dubbing too, because so many Indonesian fans play this game.. And I hope you can give us more update to make us more addicted with this game. Regards 😊
grinding, on, game, The game is a refreshing take on "farm" sim rpg. The grinding on this game is almost the exact opposite on other farm sim, since you'll take most of your time mining instead of farming. Pro: 1. Combat are fairly easy 2. You can access every storage 3. There is voice acting and a lot of npc to befriend with Cons: 1. The game is fairly heavy, there are some area that will make your frame drops 2. You will lose your time playing this game (wait...its actually a good thing) Very worth it. 5/5
take, of, farming, The game is a refreshing take on "farm" sim rpg. The grinding on this game is almost the exact opposite on other farm sim, since you'll take most of your time mining instead of farming. Pro: 1. Combat are fairly easy 2. You can access every storage 3. There is voice acting and a lot of npc to befriend with Cons: 1. The game is fairly heavy, there are some area that will make your frame drops 2. You will lose your time playing this game (wait...its actually a good thing) Very worth it. 5/5
befriend, with, Cons, The game is a refreshing take on "farm" sim rpg. The grinding on this game is almost the exact opposite on other farm sim, since you'll take most of your time mining instead of farming. Pro: 1. Combat are fairly easy 2. You can access every storage 3. There is voice acting and a lot of npc to befriend with Cons: 1. The game is fairly heavy, there are some area that will make your frame drops 2. You will lose your time playing this game (wait...its actually a good thing) Very worth it. 5/5
crashing, in, phone, idk why but this games keep crashing in my phone even after I reset the phone
living, in, city, No regrets buying this game, it is a healing game for people living in the city like me.
living, like, me, No regrets buying this game, it is a healing game for people living in the city like me.
redo, to, ingame, Game crashes almost every 5-10 minutes. I have an android 8 phone... I know it's not within the recommended specs, but please create a solution where it doesn't crash so frequently. It's hard to do anything when the game crashes so ofter. I also have to manually save the game, so if I forget to save every 10 minutes or so, I'll have to redo a day to two ingame.
connect, to, account, Its wonderful but why i cant connect the game to my account in google play games
sold, in, pack, As of the last update, we can finally get the DLC outfits. However, instead of being sold in a pack, each individual outfit is a whooping $1 each ($26 total!!!) Outrageous to have to buy them separately, and while I could understand a price tag of maybe $8 for the outfits in total, this brings the DLC total over the cost of the main game. Ridiculous in the least, and so much more than the steam version. This move is beyond me, but I won't put a penny into them until the pricing is changed
understand, for, outfits, As of the last update, we can finally get the DLC outfits. However, instead of being sold in a pack, each individual outfit is a whooping $1 each ($26 total!!!) Outrageous to have to buy them separately, and while I could understand a price tag of maybe $8 for the outfits in total, this brings the DLC total over the cost of the main game. Ridiculous in the least, and so much more than the steam version. This move is beyond me, but I won't put a penny into them until the pricing is changed
put, into, them, As of the last update, we can finally get the DLC outfits. However, instead of being sold in a pack, each individual outfit is a whooping $1 each ($26 total!!!) Outrageous to have to buy them separately, and while I could understand a price tag of maybe $8 for the outfits in total, this brings the DLC total over the cost of the main game. Ridiculous in the least, and so much more than the steam version. This move is beyond me, but I won't put a penny into them until the pricing is changed
given, on, things, Great game.. Loved it.. Very detailed and thought has been given on each things.. Thanks for giving me such wonderful time.. Can't wait for Sandrock❤️
wait, for, ️, Great game.. Loved it.. Very detailed and thought has been given on each things.. Thanks for giving me such wonderful time.. Can't wait for Sandrock❤️
contacted, on, page, The game is addicting! Love it Edit: I had an issue with albert being invisible so I contacted them on their fb page. They're very helpful and helped me solved the issue. I'm changing the rating back to 5.
takes, from, storage, Great game, worth every penny. I think it's better if the Recovery Machine takes directly from storage. Thanks
controls, on, Pixel, It looks beautiful and controls well on my Pixel. I am grateful to have console quality game optimized so well for fairly old android phone. A complete package. The android technology has very strong gaming potentional and we need more games like this!
optimized, for, phone, It looks beautiful and controls well on my Pixel. I am grateful to have console quality game optimized so well for fairly old android phone. A complete package. The android technology has very strong gaming potentional and we need more games like this!
work, on, Android, This game doesn't work on Android 10. Works on Android 11.
Works, on, Android, This game doesn't work on Android 10. Works on Android 11.
seems, like, game, It seems like a lovely game and could become the "new" Stardew valley. But.. I played a while and I didn't like the controller on the screen so I bought a Razor Kichi controller. But I tried the game with the controller and it doesn't seems to work with this controller. Is there any chance you are gonna support controllers in the future? Otherwise it's almost unplayable on mobile.
work, with, controller, It seems like a lovely game and could become the "new" Stardew valley. But.. I played a while and I didn't like the controller on the screen so I bought a Razor Kichi controller. But I tried the game with the controller and it doesn't seems to work with this controller. Is there any chance you are gonna support controllers in the future? Otherwise it's almost unplayable on mobile.
support, in, future, It seems like a lovely game and could become the "new" Stardew valley. But.. I played a while and I didn't like the controller on the screen so I bought a Razor Kichi controller. But I tried the game with the controller and it doesn't seems to work with this controller. Is there any chance you are gonna support controllers in the future? Otherwise it's almost unplayable on mobile.
interact, with, Arlo, Uninstalled game due to glitch of not being able to interact with Arlo to complete task... It did not reinstall with game data.
reinstall, with, data, Uninstalled game due to glitch of not being able to interact with Arlo to complete task... It did not reinstall with game data.
waiting, for, support, Still waiting for the controller support
posted, to, phone, Really nice, glad that this was posted to phone to be a portable game. Are the DLC content be included in this version?
included, in, version, Really nice, glad that this was posted to phone to be a portable game. Are the DLC content be included in this version?
looking, at, controller, Please make joystick controller options ASAP guys it's annoying looking at the controller at the screen
looking, at, screen, Please make joystick controller options ASAP guys it's annoying looking at the controller at the screen
paid, on, games, It is really goood! Really worth it for the price considering that I paid more on other games that has recharge.
play, with, friends, Please add a multiplayer option ,so that we can play it with our friends in other places
play, in, places, Please add a multiplayer option ,so that we can play it with our friends in other places
add, in, update, An amazing game, i hope you can add controller support in the future update
play, despite, crashes, I wish it ran better but I'm poor and can't afford a better phone or a good enough pc so I'm still thankful I can even play this, despite all the crashes. I just save often. It's a very fun game.
playing, with, controls, My only complaint is there's no controller support. At least for my kishi controller. It's really hard playing a game like this with screen controls for an extended period. I have pretty large hands. My hands started cramping after 20 minutes. I just bought it for my switch lite on the nintendo site. That should solve the problem.
cramping, after, minutes, My only complaint is there's no controller support. At least for my kishi controller. It's really hard playing a game like this with screen controls for an extended period. I have pretty large hands. My hands started cramping after 20 minutes. I just bought it for my switch lite on the nintendo site. That should solve the problem.
bought, for, lite, My only complaint is there's no controller support. At least for my kishi controller. It's really hard playing a game like this with screen controls for an extended period. I have pretty large hands. My hands started cramping after 20 minutes. I just bought it for my switch lite on the nintendo site. That should solve the problem.
commented, about, voice, The game is really good but ive seen someone commented about the voice acting and ive never heard any when i start the game it would be nice to actually heard each of the characters voices
gone, after, month, Really loved the actual game, but randomly after a month of playing, my entire progress is gone. No way to retrieve. The game acts like I've never played it before. So extremely sad and upset because I really enjoyed playing!
Bought, on, steam, Bought this game on steam then on moblie. Let me say. STILL AN AWESOME GAME! I see a lot of changes and some quest are missing for moblie oh well. BUY THE GAME! ITS WORTH IT! I love it! WISH Dev will make more games.
Bought, on, moblie, Bought this game on steam then on moblie. Let me say. STILL AN AWESOME GAME! I see a lot of changes and some quest are missing for moblie oh well. BUY THE GAME! ITS WORTH IT! I love it! WISH Dev will make more games.
missing, for, moblie, Bought this game on steam then on moblie. Let me say. STILL AN AWESOME GAME! I see a lot of changes and some quest are missing for moblie oh well. BUY THE GAME! ITS WORTH IT! I love it! WISH Dev will make more games.
play, on, mobile, hands down my favorite game to play on mobile the features added from this to consel are enough to keep me hooked for years to come thanks guys
added, from, this, hands down my favorite game to play on mobile the features added from this to consel are enough to keep me hooked for years to come thanks guys
added, to, consel, hands down my favorite game to play on mobile the features added from this to consel are enough to keep me hooked for years to come thanks guys
support, as, whole, I know this was on Xbox first. But it still sets a high bar for what mobile games could be. Comprehensive game mechanics that support the experience as a whole, no advertisements, no microtransactions. Without cheap gimmicks, u have to rely on the playing experience alone to sell the game. And I think it this game does just fine in that regard. Even if Life Sims like these aren't ur cup of tea, mobile gamers can still appreciate the straightforward gameplay design with no flash. Devs, take note.
have, Without, gimmicks, I know this was on Xbox first. But it still sets a high bar for what mobile games could be. Comprehensive game mechanics that support the experience as a whole, no advertisements, no microtransactions. Without cheap gimmicks, u have to rely on the playing experience alone to sell the game. And I think it this game does just fine in that regard. Even if Life Sims like these aren't ur cup of tea, mobile gamers can still appreciate the straightforward gameplay design with no flash. Devs, take note.
rely, on, experience, I know this was on Xbox first. But it still sets a high bar for what mobile games could be. Comprehensive game mechanics that support the experience as a whole, no advertisements, no microtransactions. Without cheap gimmicks, u have to rely on the playing experience alone to sell the game. And I think it this game does just fine in that regard. Even if Life Sims like these aren't ur cup of tea, mobile gamers can still appreciate the straightforward gameplay design with no flash. Devs, take note.
Sims, like, these, I know this was on Xbox first. But it still sets a high bar for what mobile games could be. Comprehensive game mechanics that support the experience as a whole, no advertisements, no microtransactions. Without cheap gimmicks, u have to rely on the playing experience alone to sell the game. And I think it this game does just fine in that regard. Even if Life Sims like these aren't ur cup of tea, mobile gamers can still appreciate the straightforward gameplay design with no flash. Devs, take note.
waiting, for, Time, Edited: Hahaha now I bought a new better phone for gaming and 1 thing for sure.. I'll be waiting for your next 'My Time at Sandrock!' Your game is Lit!🔥
work, for, game, Excellent port of a great game. It would be nice to have customizable mobile controls, but they do work rather well for a 3D mobile game and this point will be moot when they add controller support.
consuming, for, weeks, Beautiful game and well worth the money! Thank you for consuming all my free time for the last few weeks, and for the foreseeable future! 10/10 A++
hunted, down, people, I can't turn in commissions. I completed 2 commissions and I practically hunted down the people to turn in the commissions to them, but there is no way to turn them in even after talking to them. I have the items in my inventory and idk how to get them to the person because it gives no option to give it to them. EDIT: this was happening because I still had a main quest to complete. Sorry about that
turn, to, them, I can't turn in commissions. I completed 2 commissions and I practically hunted down the people to turn in the commissions to them, but there is no way to turn them in even after talking to them. I have the items in my inventory and idk how to get them to the person because it gives no option to give it to them. EDIT: this was happening because I still had a main quest to complete. Sorry about that
talking, to, them, I can't turn in commissions. I completed 2 commissions and I practically hunted down the people to turn in the commissions to them, but there is no way to turn them in even after talking to them. I have the items in my inventory and idk how to get them to the person because it gives no option to give it to them. EDIT: this was happening because I still had a main quest to complete. Sorry about that
get, to, person, I can't turn in commissions. I completed 2 commissions and I practically hunted down the people to turn in the commissions to them, but there is no way to turn them in even after talking to them. I have the items in my inventory and idk how to get them to the person because it gives no option to give it to them. EDIT: this was happening because I still had a main quest to complete. Sorry about that
talk, to, mayor, I was really enjoying the game but I can't progress any further. A task was completed but it won't allow me to talk to the mayor to claim the reward.
play, with, pace, Great game with tons of features, fun activities, interesting stories, and long play time hours. Because this is an offline game, we can play with our own pace, yeay! In default, we are focusing to become a great builder and run our workshop, but it doesn't limit you to focus on other things like become a friends, harvesting, fishing, ruin diving, and many more. This is one of the best game in Android, the price is so cheap compared to what you can get. Thanks developers and publisher!
focusing, In, default, Great game with tons of features, fun activities, interesting stories, and long play time hours. Because this is an offline game, we can play with our own pace, yeay! In default, we are focusing to become a great builder and run our workshop, but it doesn't limit you to focus on other things like become a friends, harvesting, fishing, ruin diving, and many more. This is one of the best game in Android, the price is so cheap compared to what you can get. Thanks developers and publisher!
focus, on, things, Great game with tons of features, fun activities, interesting stories, and long play time hours. Because this is an offline game, we can play with our own pace, yeay! In default, we are focusing to become a great builder and run our workshop, but it doesn't limit you to focus on other things like become a friends, harvesting, fishing, ruin diving, and many more. This is one of the best game in Android, the price is so cheap compared to what you can get. Thanks developers and publisher!
keeping, after, mark, Decent port, interesting enough to keep you hooked for 10-20 hours, but you hardly will have any interest in keeping playing after that time mark. Let's not even talk about finishing the game. After a while that game just become a resource management simulator, where you got wait ridiculously long times for each item to craft, just to make the game artificially longer.
become, After, while, Decent port, interesting enough to keep you hooked for 10-20 hours, but you hardly will have any interest in keeping playing after that time mark. Let's not even talk about finishing the game. After a while that game just become a resource management simulator, where you got wait ridiculously long times for each item to craft, just to make the game artificially longer.
started, without, expectatiom, Haven't loved any mobile games more! I started without much expectatiom, and blinked, then, miraculously, more than 80 hours spent on the game! I do not think I am at the half of the game yet because I just play very leisurely. Chopping woods, chatting up specific npcs, dating two, breaking up with one and marrying the other. I feel really attached to the game and frantically am trying to find a replacement for the future. Urgh. Hard.
spent, on, game, Haven't loved any mobile games more! I started without much expectatiom, and blinked, then, miraculously, more than 80 hours spent on the game! I do not think I am at the half of the game yet because I just play very leisurely. Chopping woods, chatting up specific npcs, dating two, breaking up with one and marrying the other. I feel really attached to the game and frantically am trying to find a replacement for the future. Urgh. Hard.
breaking, with, one, Haven't loved any mobile games more! I started without much expectatiom, and blinked, then, miraculously, more than 80 hours spent on the game! I do not think I am at the half of the game yet because I just play very leisurely. Chopping woods, chatting up specific npcs, dating two, breaking up with one and marrying the other. I feel really attached to the game and frantically am trying to find a replacement for the future. Urgh. Hard.
attached, to, game, Haven't loved any mobile games more! I started without much expectatiom, and blinked, then, miraculously, more than 80 hours spent on the game! I do not think I am at the half of the game yet because I just play very leisurely. Chopping woods, chatting up specific npcs, dating two, breaking up with one and marrying the other. I feel really attached to the game and frantically am trying to find a replacement for the future. Urgh. Hard.
go, to, ruins, I love the game but can u please fix this one bug pls. It was fine before but now I cant go to the ruins anymore because the it keeps getting stuck at the loading screen. I tried to start a new day and everything still the same.
stuck, at, screen, I love the game but can u please fix this one bug pls. It was fine before but now I cant go to the ruins anymore because the it keeps getting stuck at the loading screen. I tried to start a new day and everything still the same.
get, for, hours, I don't know how to describe this, but this is one of the best games I've ever played. You get hooked for hours once you start playing. Also it doesn't overheart my phone, and there are endless things to do there with no money grabbing at all
do, with, money, I don't know how to describe this, but this is one of the best games I've ever played. You get hooked for hours once you start playing. Also it doesn't overheart my phone, and there are endless things to do there with no money grabbing at all
keeps, to, standards, I get bored easily after consistently playing a game for a certain amount of time. This game really keeps up to its standards. It never fails to keep me intrigued! I'm obsessed with its storyline and the probability of exploring more than just the town. This game is the best rpg simulation I have ever played. Worth every penny!
obsessed, with, storyline, I get bored easily after consistently playing a game for a certain amount of time. This game really keeps up to its standards. It never fails to keep me intrigued! I'm obsessed with its storyline and the probability of exploring more than just the town. This game is the best rpg simulation I have ever played. Worth every penny!
turn, for, minutes, Crashed my phone and couldnt turn it on for 20 minutes.
