NOUN, ADJ, 
things, good, The day I started to play this game it was really good then when I started to get better and learn all the bosses I got scared but I Ashley was a boss but then when I found out it wasn't a boss I just mind it and then I got really good loot and I have build it so many good things I have defeated so many good things and now when I kill the world today I'm sad that the guide won't come back so to make that I'm going to play multiplayer for the rest of my entire game Life
game, entire, The day I started to play this game it was really good then when I started to get better and learn all the bosses I got scared but I Ashley was a boss but then when I found out it wasn't a boss I just mind it and then I got really good loot and I have build it so many good things I have defeated so many good things and now when I kill the world today I'm sad that the guide won't come back so to make that I'm going to play multiplayer for the rest of my entire game Life
forwarding, different, Terraria mobile 1.3 amazing. I just wish multiplayer was different, mostly port forwarding. Its annoying.
game, Best, Best game ever
port, decent, It's a pretty decent mobile port, though I kind of wish the google play achivements were re-linked so they'd be obtainable again.
port, mobile, It's a pretty decent mobile port, though I kind of wish the google play achivements were re-linked so they'd be obtainable again.
game, great, A really great game
app, great, Its very good but you should make it so you could log in with steam thtough your phone and computers with everything, charecters, worlds and others but over all great app!
game, pixelated, Fun pixelated game and great boss fights
boss, great, Fun pixelated game and great boss fights
buck, single, Worthy of every single buck spent,, content rich,, fun rich,, variety rich (alot tbh),, this game is perfect in every aspect,, u will never regret spending,, ðŸ¤¡ðŸ¤¡
game, good, Its really good game i hope you can keep updating it
version, ported, This is a really well ported version of terraria, I miss the tutorial version though
version, tutorial, This is a really well ported version of terraria, I miss the tutorial version though
people, other, It's good but I wish you can join other people
game, favorite, It is my 2# favorite game
game, Great, Great game!!!
game, best, Always the best game ever. Been plaging for many years...no issue..all good..
years, many, Always the best game ever. Been plaging for many years...no issue..all good..
tutorial, comprehensive, No comprehensive tutorial within the game that I could find - it's been very confusing so far.
cloth, other, Why no update for princess npc and other vanity cloth im very disappointed
game, awesome, awesome game but devs tell me a joke
day, single, This game is literally so fun I play it every single day I collect so many things it's so fun one of my favorite games in the whole wide world more games like this
things, many, This game is literally so fun I play it every single day I collect so many things it's so fun one of my favorite games in the whole wide world more games like this
games, favorite, This game is literally so fun I play it every single day I collect so many things it's so fun one of my favorite games in the whole wide world more games like this
world, whole, This game is literally so fun I play it every single day I collect so many things it's so fun one of my favorite games in the whole wide world more games like this
world, wide, This game is literally so fun I play it every single day I collect so many things it's so fun one of my favorite games in the whole wide world more games like this
games, more, This game is literally so fun I play it every single day I collect so many things it's so fun one of my favorite games in the whole wide world more games like this
time, first, Very fun and and it was pretty hard fighting mon lord for the first time
game, Great, Great game
fun, Super, Super fun to play and build funny things and great for people who play Minecraft.
things, funny, Super fun to play and build funny things and great for people who play Minecraft.
games, top, I have this on console and have put hundreds of hours into it. I love it so much i bought it again on mobile just so i can have another account to play on the go when i get bored. Easily in my top 5 games of all time and I've been a gamer for over 3 decades.
game, Best, Best game ever...
cannon, super, Trying to craft the super star cannon but not working even though I have the right materials or else the game is great please fix this bug
materials, right, Trying to craft the super star cannon but not working even though I have the right materials or else the game is great please fix this bug
game, overall, I really wish that mobile could play with pc.but overall really good game
game, good, I really wish that mobile could play with pc.but overall really good game
brother, big, Definitely not as good as its big brother Minecraft, but this game has real potential considering its a 2D game.
potential, real, Definitely not as good as its big brother Minecraft, but this game has real potential considering its a 2D game.
game, Great, Great game I have so many good opinions about it but one bad thing is that whenever I open the game It takes the game like 1/2 a minute to load but otherwise good game! Five stars!
opinions, many, Great game I have so many good opinions about it but one bad thing is that whenever I open the game It takes the game like 1/2 a minute to load but otherwise good game! Five stars!
opinions, good, Great game I have so many good opinions about it but one bad thing is that whenever I open the game It takes the game like 1/2 a minute to load but otherwise good game! Five stars!
thing, bad, Great game I have so many good opinions about it but one bad thing is that whenever I open the game It takes the game like 1/2 a minute to load but otherwise good game! Five stars!
game, good, Great game I have so many good opinions about it but one bad thing is that whenever I open the game It takes the game like 1/2 a minute to load but otherwise good game! Five stars!
lol, nice, Can't play because of lag but the 3 minutes i played without lag was nice lol
game, favorite, I love it I've been playing it 4 years and I haven't got bored of it! Update: Five years and now playing on computer! My favorite game
game, Best, Best game ever
volcanos, Japanese, I enjoyed this whilst I ice skate in Japanese volcanos on the 5 Friday of July 2017 under the Christmas scarecrows, like the movie hocus-pocus
game, fun, Its a fun game that you can play with your friends and you can build fight it's fun play it Edit: IM NOT USING A PIRATED VERSION ANYMORE FINALLY
VERSION, PIRATED, Its a fun game that you can play with your friends and you can build fight it's fun play it Edit: IM NOT USING A PIRATED VERSION ANYMORE FINALLY
FINALLY, VERSION, Its a fun game that you can play with your friends and you can build fight it's fun play it Edit: IM NOT USING A PIRATED VERSION ANYMORE FINALLY
game, amazing, It's an amazing survival game, especially once you activate hard mode, I recommend this to people who want a difficult challenge or a just something to do to pass time.
mode, hard, It's an amazing survival game, especially once you activate hard mode, I recommend this to people who want a difficult challenge or a just something to do to pass time.
challenge, difficult, It's an amazing survival game, especially once you activate hard mode, I recommend this to people who want a difficult challenge or a just something to do to pass time.
games, favorite, This is one of my favorite games! I hope it has holiday bosses like Lepus or Turkor the Ungrateful
world, new, Yup. This is terraria where you start a new world on master mode and you die from slimes. Gotta git gud scrubs!
phone, old, Why do I have to pay for this again when I have it on my old phone (same account)
account, same, Why do I have to pay for this again when I have it on my old phone (same account)
ðŸ‘Œ, Classic, Classic ðŸ‘Œ
port, other, Just as great as every other port
game, Gr8, Gr8 game It is very fun Plz add 1.4+ content Doing so would Make this game A stack (as in a minecraft stack) out of 5 â˜†. I played this basically (give or take a few updates) since it came out.
world, earned, Hi terraria, I really love playing you since I'm in elementary. The thing is that my 2 years hard-earned world in terraria has been corrupt and I can't open it. It's been 5 months now but I can't move on.... Please help me with this
review, old, I'm sorry about my old review I was a stupid kid with a bad phone that messed up my saves I love this game again sorry
kid, stupid, I'm sorry about my old review I was a stupid kid with a bad phone that messed up my saves I love this game again sorry
phone, bad, I'm sorry about my old review I was a stupid kid with a bad phone that messed up my saves I love this game again sorry
game, good, Very good game I always love playing terraria definitely would recommend
game, best, Terraria is one of the best 2D survival game I played on Xbox and computer but playing it on mobile devices too is really nice I recommend that other people play it too
devices, mobile, Terraria is one of the best 2D survival game I played on Xbox and computer but playing it on mobile devices too is really nice I recommend that other people play it too
people, other, Terraria is one of the best 2D survival game I played on Xbox and computer but playing it on mobile devices too is really nice I recommend that other people play it too
update, recent, I love this game. I've been playing it for years, and it is rather amazing how far its comeâ€”especially in this recent update, as it feels like the same game but also feels radically different. Can't wait to get it on PC when my computer comes!
game, same, I love this game. I've been playing it for years, and it is rather amazing how far its comeâ€”especially in this recent update, as it feels like the same game but also feels radically different. Can't wait to get it on PC when my computer comes!
craft, crazy, This game has literally so much to do if it helps Terraria is like crazy craft but 2D and can be a whole lot harder
lot, whole, This game has literally so much to do if it helps Terraria is like crazy craft but 2D and can be a whole lot harder
buuut, good, It's a good game buuut if it is possible or can be possible can there be mods in the game? If not then thats ok
ðŸ‘Œ, best, Terraria = the best ðŸ‘Œ
game, Best, Best game ever
game, great, A great game ðŸ™
record, new, What's not to like? It has 4 out of the 20 things i desire in a game and that is a new record for me in terms of games.
game, best, Terraria is the best game I ever played. Am giving it 5 stars because I enjoy everything about this game. The things you can do in this game is incredible.
methods, many, Can't install the game.I don't know why I already purchase the game but every time i tried to install it keep saying"Can't install terraria" plz fix this I've tried so many methods on how to fix it but none of it works
game, Good, Good game but i hope 1.4.1 is on mobile :)
ui, old, I love the game but I would like to have a option to change back to the old ui even tho it has less functionality, and it seems it would be compatible with a controller over bluetooth but it is not. I feel that the differences between mobile and pc are big enough to make it worth having both.
functionality, less, I love the game but I would like to have a option to change back to the old ui even tho it has less functionality, and it seems it would be compatible with a controller over bluetooth but it is not. I feel that the differences between mobile and pc are big enough to make it worth having both.
port, great, For what its worth its a great port of terraria but if you want to actually have fun playing this game use a controller.
scheme, new, At first I hated the new control scheme but after getting used to them, I beat the game and I am currently doing an expert run and it is HARD but I'm getting through slow and steady also I have around 85 hours Edit: all my progress randomly got deleted so now it's 2 stars instead of five
game, other, This game makes me want to never play any other game ever again.
time, fun, Thank for 1.3 waited 20 years for this thank again fun time game yes
controllers, popular, I love this game and was enjoying it until the ps4 controller support got taken away. I don't understand why when it is one of the most popular controllers
fun, so, Its so fun but the price is a little bit high but I definitely recommend it
bit, little, Its so fun but the price is a little bit high but I definitely recommend it
scheme, Awful, Awful new control scheme.
scheme, new, Awful new control scheme.
copies, multiple, Give me my money back. I wanted to play terraria not get a headache from the controls. Please refund my money I have bought multiple copies of the working game in the past. Give me my money back or I'm contacting relogic with my adviser . There is no refund option. Give me back my money now.
game, working, Give me my money back. I wanted to play terraria not get a headache from the controls. Please refund my money I have bought multiple copies of the working game in the past. Give me my money back or I'm contacting relogic with my adviser . There is no refund option. Give me back my money now.
love, pure, pure love, and unlike minecraft no money grind f eatures that destroy the experience
thing, best, Literally the best thing to ever bless the app store
game, Best, Best mobile game i've ever played
game, mobile, Best mobile game i've ever played
update, last, I have this problem with my game when ever I join my world that I spent 8 hours on its lags out and closes the game, now I am rarely able to play that world, so if the problem could be fixed even though I know you already had your last update you still could do bug fixes. But other than that its a great game
game, other, I have this problem with my game when ever I join my world that I spent 8 hours on its lags out and closes the game, now I am rarely able to play that world, so if the problem could be fixed even though I know you already had your last update you still could do bug fixes. But other than that its a great game
game, great, I have this problem with my game when ever I join my world that I spent 8 hours on its lags out and closes the game, now I am rarely able to play that world, so if the problem could be fixed even though I know you already had your last update you still could do bug fixes. But other than that its a great game
game, Best, Best game ever made! Something for everyone. But please update to match PC! We have been waiting so long.
life, whole, The Game of my whole life, can't live without it. I started playing Terraria in the year 2019, skl. ðŸ’•
fun, much, Because it so much fun
cannon, super, i dont know is it just me but compare to the pc versions some items are missing like the super star cannon,l
game, Great, Great game but you buy it on the other platforms bosses are harder on mobile but great game.
bosses, other, Great game but you buy it on the other platforms bosses are harder on mobile but great game.
game, mobile, Great game but you buy it on the other platforms bosses are harder on mobile but great game.
e, great, Its great e at
connection, stable, Money down the drain. I can't play the game until it verifies that I actually bought it from the play store. I have logged into my account and opened the game. I have stable connection. I have tried everything and it still does not work. This used to be my favorite game and I used to play it all the time but when I redownloaded it ever since it hasn't worked at all. I was looking forward to this a lot and it is just such a let down.
game, favorite, Money down the drain. I can't play the game until it verifies that I actually bought it from the play store. I have logged into my account and opened the game. I have stable connection. I have tried everything and it still does not work. This used to be my favorite game and I used to play it all the time but when I redownloaded it ever since it hasn't worked at all. I was looking forward to this a lot and it is just such a let down.
versions, mobile, The mobile app versions controls are pretty annoying to use at first but if you put a bit of time into it then they should be fine, I think that the PC version is by far the best so if you have access to it I recommend getting terraria for PC, if we are talking about the gameplay itself then I would say it's one of the best games to ever be made, i definitely recommend getting terraria you will have a great time, that's all
games, best, The mobile app versions controls are pretty annoying to use at first but if you put a bit of time into it then they should be fine, I think that the PC version is by far the best so if you have access to it I recommend getting terraria for PC, if we are talking about the gameplay itself then I would say it's one of the best games to ever be made, i definitely recommend getting terraria you will have a great time, that's all
time, great, The mobile app versions controls are pretty annoying to use at first but if you put a bit of time into it then they should be fine, I think that the PC version is by far the best so if you have access to it I recommend getting terraria for PC, if we are talking about the gameplay itself then I would say it's one of the best games to ever be made, i definitely recommend getting terraria you will have a great time, that's all
games, new, There's a lot of people complaining about the controls being too hard and the game having no tutorial. To them, I say: learn. It's like all new games. U gotta learn to walk before you can fly. This game is amazing, and has done a lot for me mentally. I love the moonlord update and I hope the don't starve collab comes to mobile as well! (I play on 3 platforms as well btw)
game, moblie, This game is cool and all the but I wish mods can be on moblie but still great game
game, great, This game is cool and all the but I wish mods can be on moblie but still great game
tier, top, around the time where you could mine placed wood with an axe, is when I started playing. This game does everything right. From the graphics to the mechanics and especially the music and atmosphere. The game overall is definitely top tier, each little thing is amazing. There is so much to explore and everytime you find something new, you get a feeling, and that's really addictive. Even when there's a update coming out soon, it's worth the wait. Do play! â¤ï¸
thing, little, around the time where you could mine placed wood with an axe, is when I started playing. This game does everything right. From the graphics to the mechanics and especially the music and atmosphere. The game overall is definitely top tier, each little thing is amazing. There is so much to explore and everytime you find something new, you get a feeling, and that's really addictive. Even when there's a update coming out soon, it's worth the wait. Do play! â¤ï¸
game, Amazing, Amazing game!
content, new, I love what the devs have done with this. I dropped the game a while back after completing the game and I came back to it and lo and behold, tons of new content. 10/10, would definitely recommend.
touch, Horrible, Horrible touch controls. If you dont have a computer or console, just dont buy it. It will probably be more worth it. Instead, you could buy another game, there are a lot of games for the same price, which are better. Game is pretty solid, but the controls ruin it. I guess the PC version is 5 stars, but the mobile is 2.
price, same, Horrible touch controls. If you dont have a computer or console, just dont buy it. It will probably be more worth it. Instead, you could buy another game, there are a lot of games for the same price, which are better. Game is pretty solid, but the controls ruin it. I guess the PC version is 5 stars, but the mobile is 2.
game, good, Well, it's a good game overall. But the problem is it's hard to play with my friends..I wish it was easier to host and join even they're away from me...
mode, new, I bought this years ago but dropped it because the desktop version is easier to play. I recently picked up this version because I don't have time to sit at a desk and game for hours. The new journey mode makes up for the challenge of playing on mobile. Over time the controls get more familiar though I'll never pull off the fancy dodging and skill shotting possible on PC. It's been a more casual, relaxed experience. As a phone game it deserves a solid 5 stars. Congrats to the devs! Masterpiece!
dodging, fancy, I bought this years ago but dropped it because the desktop version is easier to play. I recently picked up this version because I don't have time to sit at a desk and game for hours. The new journey mode makes up for the challenge of playing on mobile. Over time the controls get more familiar though I'll never pull off the fancy dodging and skill shotting possible on PC. It's been a more casual, relaxed experience. As a phone game it deserves a solid 5 stars. Congrats to the devs! Masterpiece!
experience, casual, I bought this years ago but dropped it because the desktop version is easier to play. I recently picked up this version because I don't have time to sit at a desk and game for hours. The new journey mode makes up for the challenge of playing on mobile. Over time the controls get more familiar though I'll never pull off the fancy dodging and skill shotting possible on PC. It's been a more casual, relaxed experience. As a phone game it deserves a solid 5 stars. Congrats to the devs! Masterpiece!
experience, relaxed, I bought this years ago but dropped it because the desktop version is easier to play. I recently picked up this version because I don't have time to sit at a desk and game for hours. The new journey mode makes up for the challenge of playing on mobile. Over time the controls get more familiar though I'll never pull off the fancy dodging and skill shotting possible on PC. It's been a more casual, relaxed experience. As a phone game it deserves a solid 5 stars. Congrats to the devs! Masterpiece!
stars, solid, I bought this years ago but dropped it because the desktop version is easier to play. I recently picked up this version because I don't have time to sit at a desk and game for hours. The new journey mode makes up for the challenge of playing on mobile. Over time the controls get more familiar though I'll never pull off the fancy dodging and skill shotting possible on PC. It's been a more casual, relaxed experience. As a phone game it deserves a solid 5 stars. Congrats to the devs! Masterpiece!
game, good, Still a really good game, played it years ago and now it's even better
mode, journey, Just sucks. Switch sucks as there is no journey mode for me to practice and have, you know... FUN! Not to mention how annoying Wall of Flesh is as its to overpowered with The Hungry and HP AND, damage needs work. Until then, this game can collect DUST for all I care. I'm disappointed. Waste. Of. Money.
game, favorite, This was by far my favorite mobile game. Untill that is, the update. Controls are unrecognizable, and I cannot play at all.
game, mobile, This was by far my favorite mobile game. Untill that is, the update. Controls are unrecognizable, and I cannot play at all.
game, Phenomenal, Phenomenal game
game, Good, Good game but I would like if getting materials was easier.
game, magnificent, absolutely magnificent game. recommend it, and yes, it's completely different from minecraft.
AAAAAAAHHHH, TOO, HELP ITS TOO GOOD AAAAAAAHHHH
AAAAAAAHHHH, GOOD, HELP ITS TOO GOOD AAAAAAAHHHH
game, Amazing, Amazing game would recomend extremely fun
phone, spare, Good app,though when I use my Google account on another device ,like my spare phone,I need to pay again.Can you please address this issue?
game, Best, Best game ever I have played
update, new, Can't wait for the new update, 2021!!!
game, favorite, one of my favorite game ever
games, best, That's one of the best games I have ever played I love it
fun, much, I love this game I played it on my Xbox through the Xbox game pass ultimate and I was amazed with how much fun it was. Plus Minecraft and terraria both are good games. One time Minecraft had a splash text saying "go play tarraria too" and terraria had a splash text saying "try playing Minecraft too" so I think they are both excellent game's.
games, good, I love this game I played it on my Xbox through the Xbox game pass ultimate and I was amazed with how much fun it was. Plus Minecraft and terraria both are good games. One time Minecraft had a splash text saying "go play tarraria too" and terraria had a splash text saying "try playing Minecraft too" so I think they are both excellent game's.
text, splash, I love this game I played it on my Xbox through the Xbox game pass ultimate and I was amazed with how much fun it was. Plus Minecraft and terraria both are good games. One time Minecraft had a splash text saying "go play tarraria too" and terraria had a splash text saying "try playing Minecraft too" so I think they are both excellent game's.
text, splash, I love this game I played it on my Xbox through the Xbox game pass ultimate and I was amazed with how much fun it was. Plus Minecraft and terraria both are good games. One time Minecraft had a splash text saying "go play tarraria too" and terraria had a splash text saying "try playing Minecraft too" so I think they are both excellent game's.
