VERB, PREP, POBJ, 
playing, in, game, To give 5 star .. I recommend that I can change my look except colouring hairstyle mouth etc .. Also please add button or item that can change my name after playing long term in game like I can change My house name .. make this game global because this game the only type of harvest moon that have massive graphic and design .. Thank you overall it's good .. I give 5 star if have change name. I'm to tired to start all from beginning just to change my name or my character look lol ..
Remind, of, Factory, Remind me of Rune Factory and Harvest Moon, but BETTER. So many interact action with NPC. Refreshing mining game play and so much mini games. Easy to play. Many save slot and can be uploaded to cloud data. The map are so wide. Interesting storyline. I really recommended this game, it's worth to play
went, to, commerce, Good game but have some big issue. I went to guild commerce and the game just froze and ui clash, no matter how many times i restart and load my last save whenever i go inside guild commerce the game just froze and ui clash. Good game!! but i can't play it anyway 2star till the dev fix this issue. My device: Samsung galaxy S10+
go, inside, commerce, Good game but have some big issue. I went to guild commerce and the game just froze and ui clash, no matter how many times i restart and load my last save whenever i go inside guild commerce the game just froze and ui clash. Good game!! but i can't play it anyway 2star till the dev fix this issue. My device: Samsung galaxy S10+
loved, on, console, I loved this game on console and on PC. And just learning that they added this game on mobile as well made me the happiest woman ever! I love games like this. I never cease to be entertained by this game and I'd recommend it to anyone who loves a challenging time consuming game like My Time at Portia.
added, on, mobile, I loved this game on console and on PC. And just learning that they added this game on mobile as well made me the happiest woman ever! I love games like this. I never cease to be entertained by this game and I'd recommend it to anyone who loves a challenging time consuming game like My Time at Portia.
recommend, to, anyone, I loved this game on console and on PC. And just learning that they added this game on mobile as well made me the happiest woman ever! I love games like this. I never cease to be entertained by this game and I'd recommend it to anyone who loves a challenging time consuming game like My Time at Portia.
buy, For, time, Oh boi! This game is so good! I played harvest moon before but this game is really different! For the first time i buy a game without a second thought after released xD and I'm glad that I'm buy it! No talk more 5* for sure! REALLY WORTH TO DOWNLOAD!!!
buy, without, thought, Oh boi! This game is so good! I played harvest moon before but this game is really different! For the first time i buy a game without a second thought after released xD and I'm glad that I'm buy it! No talk more 5* for sure! REALLY WORTH TO DOWNLOAD!!!
having, with, this, I'm having a lot of fun with this!
mining, with, joystick, Very enjoyable and chill game, It would be nicer if i could rotate my character while mining with the right joystick or be able to just tap on furnace to open instead having to accurately rotate my character to be straight to be able to open stuff.
tap, on, furnace, Very enjoyable and chill game, It would be nicer if i could rotate my character while mining with the right joystick or be able to just tap on furnace to open instead having to accurately rotate my character to be straight to be able to open stuff.
reminds, of, moon, My experience? Outstanding immersion reminds me of harvest moon but with more to do and upgrade. Rip harvest moon I'm spending my time at Portia
reminds, with, more, My experience? Outstanding immersion reminds me of harvest moon but with more to do and upgrade. Rip harvest moon I'm spending my time at Portia
spending, at, Portia, My experience? Outstanding immersion reminds me of harvest moon but with more to do and upgrade. Rip harvest moon I'm spending my time at Portia
Thank, for, fixes, Thank you for all the fixes to the game!! I really love playing My Time at Portia, thank you for your hardwork!!
Thank, to, game, Thank you for all the fixes to the game!! I really love playing My Time at Portia, thank you for your hardwork!!
playing, at, Portia, Thank you for all the fixes to the game!! I really love playing My Time at Portia, thank you for your hardwork!!
thank, for, hardwork, Thank you for all the fixes to the game!! I really love playing My Time at Portia, thank you for your hardwork!!
played, for, 2weeks, This is great game like harvest moon, i have been played for 2weeks. Its great and very fun. Can u add some more event for 4 seasons to avoid boring doin some task? and add some more monster , legendary weapon and armor. More like mmorpg but offline mod :)
add, for, seasons, This is great game like harvest moon, i have been played for 2weeks. Its great and very fun. Can u add some more event for 4 seasons to avoid boring doin some task? and add some more monster , legendary weapon and armor. More like mmorpg but offline mod :)
move, for, some, My only complaint is that the hair doesn't move for some of them which can make it clip through the hands which makes it look not as good 2nd complaint is that if u use the chainsaw it has a habit of breaking trees/ makes it harder to break them I thinks that's all I found device I'm using samsung s20 fe 5g
clip, through, hands, My only complaint is that the hair doesn't move for some of them which can make it clip through the hands which makes it look not as good 2nd complaint is that if u use the chainsaw it has a habit of breaking trees/ makes it harder to break them I thinks that's all I found device I'm using samsung s20 fe 5g
based, on, capability, The latest update allows me to modify my settings based on my phone capability. I could now run the 60 fps with balanced setting well. I kinda get a problem with getting overheating easily as well as the game consumes my battery quickly. But the game is still fine.
run, with, setting, The latest update allows me to modify my settings based on my phone capability. I could now run the 60 fps with balanced setting well. I kinda get a problem with getting overheating easily as well as the game consumes my battery quickly. But the game is still fine.
played, on, computer, Best game ever I never played on computer or Xbox before so I can't say it's better but it's a great game
Played, in, version, Played this game in pc version.. Fell in love... Now happy to have it mobile version.
Fell, in, love, Played this game in pc version.. Fell in love... Now happy to have it mobile version.
Played, on, heckas, Played on XboxOne heckas ago and I've really missed it!! Great job!
playing, at, pace, I love this game. lots of things to do. Im just playing it at a slow pace to avoid boredom
progress, because, it, I dont know why,but my ack went missing?am stucked not able to progress mission because of it
played, on, pc, I love this game , i've played it on pc and i've finished it. Time to finish it on mobile as well XD It's a great game if you have a decent phone. Great graphics , no lag , no stutter on Poco X3 Pro . It would be nice if we could get some cheats :))) mostly money cheats
finish, on, mobile, I love this game , i've played it on pc and i've finished it. Time to finish it on mobile as well XD It's a great game if you have a decent phone. Great graphics , no lag , no stutter on Poco X3 Pro . It would be nice if we could get some cheats :))) mostly money cheats
buy, about, house, its the best game I've ever buy, it's really worth to spend money to buy this game. but please for dev to update the game, I've several issues to fix. about house, I've buy a biggest house, but the size is not different with before. Maybe you can make a bigger size and make sense with the house type. and please add a lock key items, so we not accidentaly gave an important items to NPC. and about aquarium, please make eat looks clear and essy to check how may fish and what's type of fish in there
make, with, type, its the best game I've ever buy, it's really worth to spend money to buy this game. but please for dev to update the game, I've several issues to fix. about house, I've buy a biggest house, but the size is not different with before. Maybe you can make a bigger size and make sense with the house type. and please add a lock key items, so we not accidentaly gave an important items to NPC. and about aquarium, please make eat looks clear and essy to check how may fish and what's type of fish in there
make, about, aquarium, its the best game I've ever buy, it's really worth to spend money to buy this game. but please for dev to update the game, I've several issues to fix. about house, I've buy a biggest house, but the size is not different with before. Maybe you can make a bigger size and make sense with the house type. and please add a lock key items, so we not accidentaly gave an important items to NPC. and about aquarium, please make eat looks clear and essy to check how may fish and what's type of fish in there
play, on, PC, I really love this game, even i never play on PC. But, that was some bug when you married end of winter season, exactly when you are complete the last battle, Gale will stuck inside the round table and doesn't speech to open deepest ruin, or maybe deepest ruin are not included in mobile version ? I'll make it 5 after answered or fixed
stuck, inside, table, I really love this game, even i never play on PC. But, that was some bug when you married end of winter season, exactly when you are complete the last battle, Gale will stuck inside the round table and doesn't speech to open deepest ruin, or maybe deepest ruin are not included in mobile version ? I'll make it 5 after answered or fixed
included, in, version, I really love this game, even i never play on PC. But, that was some bug when you married end of winter season, exactly when you are complete the last battle, Gale will stuck inside the round table and doesn't speech to open deepest ruin, or maybe deepest ruin are not included in mobile version ? I'll make it 5 after answered or fixed
going, in, workshop, Hello, this game is one of my favorites so far but now that I have lots of things going on in my workshop (having lots of furnaces in action) the game became laggy (only when I'm at my workshop). If I step outside the gate the game will become smooth again, but the moment I enter the gate that's when the game starts lagging. My phone has 8gb of ram, 128gb of storage and has a snapdragon 720G processor. I hope you can find a way to fix this, thank you!
step, outside, gate, Hello, this game is one of my favorites so far but now that I have lots of things going on in my workshop (having lots of furnaces in action) the game became laggy (only when I'm at my workshop). If I step outside the gate the game will become smooth again, but the moment I enter the gate that's when the game starts lagging. My phone has 8gb of ram, 128gb of storage and has a snapdragon 720G processor. I hope you can find a way to fix this, thank you!
going, without, friends, without friends, this game is going Boring for the multiplayers Gamers 😔😪 my time at Sandrock isn't available in mobile Devices 😑
going, for, multiplayers, without friends, this game is going Boring for the multiplayers Gamers 😔😪 my time at Sandrock isn't available in mobile Devices 😑
autosave, on, game, Please make a quicksave or autosave feature on this game. I'm playing on a 32 rom 3 ram vivo y11 which makes it a mediocore device. The game always crashes and take me to the starting point of the day where i crashed and i can't blame the app if my phone can't keep up to the game. I cleaned my phone from games that i really love just to play this game but it's still not enough. Please consider my suggestion for the sake of low specs cp users like me. TY for this game and i hope you'll see this.
playing, on, vivo, Please make a quicksave or autosave feature on this game. I'm playing on a 32 rom 3 ram vivo y11 which makes it a mediocore device. The game always crashes and take me to the starting point of the day where i crashed and i can't blame the app if my phone can't keep up to the game. I cleaned my phone from games that i really love just to play this game but it's still not enough. Please consider my suggestion for the sake of low specs cp users like me. TY for this game and i hope you'll see this.
take, to, point, Please make a quicksave or autosave feature on this game. I'm playing on a 32 rom 3 ram vivo y11 which makes it a mediocore device. The game always crashes and take me to the starting point of the day where i crashed and i can't blame the app if my phone can't keep up to the game. I cleaned my phone from games that i really love just to play this game but it's still not enough. Please consider my suggestion for the sake of low specs cp users like me. TY for this game and i hope you'll see this.
keep, to, game, Please make a quicksave or autosave feature on this game. I'm playing on a 32 rom 3 ram vivo y11 which makes it a mediocore device. The game always crashes and take me to the starting point of the day where i crashed and i can't blame the app if my phone can't keep up to the game. I cleaned my phone from games that i really love just to play this game but it's still not enough. Please consider my suggestion for the sake of low specs cp users like me. TY for this game and i hope you'll see this.
cleaned, from, games, Please make a quicksave or autosave feature on this game. I'm playing on a 32 rom 3 ram vivo y11 which makes it a mediocore device. The game always crashes and take me to the starting point of the day where i crashed and i can't blame the app if my phone can't keep up to the game. I cleaned my phone from games that i really love just to play this game but it's still not enough. Please consider my suggestion for the sake of low specs cp users like me. TY for this game and i hope you'll see this.
consider, like, me, Please make a quicksave or autosave feature on this game. I'm playing on a 32 rom 3 ram vivo y11 which makes it a mediocore device. The game always crashes and take me to the starting point of the day where i crashed and i can't blame the app if my phone can't keep up to the game. I cleaned my phone from games that i really love just to play this game but it's still not enough. Please consider my suggestion for the sake of low specs cp users like me. TY for this game and i hope you'll see this.
toggle, on, right, I love it, but one thing annoy me please remove the front camera view toggle on the right, thanks!
playing, on, PC, Loved playing this on PC, and I'm thoroughly enjoying it on mobile. The only thing I can think of that would make it just that much better is having the ability to use a gaming controller with it, my hand was starting to cramp up the other night due to how long I had been holding my phone in an awkward position for so long while playing. Otherwise it's exactly like the PC version and I'm super happy with it.
enjoying, on, mobile, Loved playing this on PC, and I'm thoroughly enjoying it on mobile. The only thing I can think of that would make it just that much better is having the ability to use a gaming controller with it, my hand was starting to cramp up the other night due to how long I had been holding my phone in an awkward position for so long while playing. Otherwise it's exactly like the PC version and I'm super happy with it.
think, of, that, Loved playing this on PC, and I'm thoroughly enjoying it on mobile. The only thing I can think of that would make it just that much better is having the ability to use a gaming controller with it, my hand was starting to cramp up the other night due to how long I had been holding my phone in an awkward position for so long while playing. Otherwise it's exactly like the PC version and I'm super happy with it.
use, with, it, Loved playing this on PC, and I'm thoroughly enjoying it on mobile. The only thing I can think of that would make it just that much better is having the ability to use a gaming controller with it, my hand was starting to cramp up the other night due to how long I had been holding my phone in an awkward position for so long while playing. Otherwise it's exactly like the PC version and I'm super happy with it.
holding, in, position, Loved playing this on PC, and I'm thoroughly enjoying it on mobile. The only thing I can think of that would make it just that much better is having the ability to use a gaming controller with it, my hand was starting to cramp up the other night due to how long I had been holding my phone in an awkward position for so long while playing. Otherwise it's exactly like the PC version and I'm super happy with it.
wait, for, Time, Best game ever! Can't wait for My Time at Sandrock!
make, because, attack, amazing. .one suggestion if developer can make customized HUD because sometime misclick attack and jump button. .awesome game
finding, during, sequence, Essentially perfect, although I would dearly love controller support. That said the mobile screen controls are pretty good, although finding the pickup button during the airship drop sequence made it hard to collect gifts before other characters grabbed them. You get a lot of game for your money too. If you're a fan of stuff like Stardew Valley this is a no-brainer. Also looks *great* and keeps up a solid 30fps mostly (on Pixel 4)
get, for, money, Essentially perfect, although I would dearly love controller support. That said the mobile screen controls are pretty good, although finding the pickup button during the airship drop sequence made it hard to collect gifts before other characters grabbed them. You get a lot of game for your money too. If you're a fan of stuff like Stardew Valley this is a no-brainer. Also looks *great* and keeps up a solid 30fps mostly (on Pixel 4)
keeps, on, Pixel, Essentially perfect, although I would dearly love controller support. That said the mobile screen controls are pretty good, although finding the pickup button during the airship drop sequence made it hard to collect gifts before other characters grabbed them. You get a lot of game for your money too. If you're a fan of stuff like Stardew Valley this is a no-brainer. Also looks *great* and keeps up a solid 30fps mostly (on Pixel 4)
stuck, at, screen, Bug. Im currently stuck at loading screen. The game said i need to download additional 200mb but when i click download its just stuck there ive been waiting for hours
waiting, for, hours, Bug. Im currently stuck at loading screen. The game said i need to download additional 200mb but when i click download its just stuck there ive been waiting for hours
regarding, with, Petra, The bug regarding with Petra can't be spoken has been fixed. Just have to reload my older save. Means I have to redo my whole day. But it's ok cause now I can continue my missions. I just have a concern regarding the system messages. It shows and vanish so fast that I have no time to read it and its also so small. Specially if its an event reminder like calendar event or playdate reminder. Please make the fonts bigger and shows longer.
Looking, for, game, I love this kind of game so much. Looking forward for the developer's next game, My Time at Sandrock. I couldn't play on pc so I hope they'll port it to mobile version too. I don't mind spending money to support this developer. Thank you for porting this game to mobile!
play, on, pc, I love this kind of game so much. Looking forward for the developer's next game, My Time at Sandrock. I couldn't play on pc so I hope they'll port it to mobile version too. I don't mind spending money to support this developer. Thank you for porting this game to mobile!
port, to, version, I love this kind of game so much. Looking forward for the developer's next game, My Time at Sandrock. I couldn't play on pc so I hope they'll port it to mobile version too. I don't mind spending money to support this developer. Thank you for porting this game to mobile!
porting, to, mobile, I love this kind of game so much. Looking forward for the developer's next game, My Time at Sandrock. I couldn't play on pc so I hope they'll port it to mobile version too. I don't mind spending money to support this developer. Thank you for porting this game to mobile!
stuck, at, screen, I'm stuck at the first loading screen, I can't start the game
loved, on, console, I loved this game on console and out of all the games I have on my tablet and phone, this is my absolute favorite. The controls are top notch too. Thanks for this awesome port of your awesome game 🙂
working, in, game, Everything was working fine in the game... Until I became pregnant, I gave birth without knowing, there were no cut scenes of me in the hospital, I received a bunch of notifications that I didn't feed the baby and my baby is NOWHERE to be found, I've searched everywhere and the baby doesn't show up anywhere but I keep getting notifications that I didn't feed the baby..... HELP. And I'm super sad I didn't see the scene of my child's birth, what an awful bug.
were, in, hospital, Everything was working fine in the game... Until I became pregnant, I gave birth without knowing, there were no cut scenes of me in the hospital, I received a bunch of notifications that I didn't feed the baby and my baby is NOWHERE to be found, I've searched everywhere and the baby doesn't show up anywhere but I keep getting notifications that I didn't feed the baby..... HELP. And I'm super sad I didn't see the scene of my child's birth, what an awful bug.
play, on, device, the game is good but why the cloud save interface so confusing? I accidentally deleted my saves - when the daily save is newer then the game should remove the older auto-save one. i needed to delete the older autosave and then bam!! ALL my saves disappeared!! also when u want to play on another device such as bluestack - why does it not auto load? why do i have to upload my saves to cloud everytime? I don't understand these things please someone help!!
upload, to, cloud, the game is good but why the cloud save interface so confusing? I accidentally deleted my saves - when the daily save is newer then the game should remove the older auto-save one. i needed to delete the older autosave and then bam!! ALL my saves disappeared!! also when u want to play on another device such as bluestack - why does it not auto load? why do i have to upload my saves to cloud everytime? I don't understand these things please someone help!!
download, on, mate, When I download this game on Huawei mate, the character voice is gone.
restart, over, game, Please delete the poluting water - rat king quest in the sewer, really iritating. The problem can't be solved , is it a bug? Probably i just gonna restart over the game and just ignore the main quest to enjoy the game.
play, in, voiceovers, The game is very good and I'm loving it so much! I just wish they have an option for CN voiceovers soon. I would really like it if I can play it in CN voiceovers!
own, on, pc, I own this game on my pc, switch and mobile now. But i have issues with cloud saving, i wanted to upload my progress to cloud but it doesn't detect my current local data.
continue, without, problem, despite having lost 8 days of gameplay due to save files problem, I managed to replay the game and return to my 8 days state in just 2-3 days so I guess it's cool, and 5 stars because bugs were fixed and I managed to continue quests without any problem like quests not triggering and such. Great game overall.
socialize, with, NPCs, Smooth gameplay, great storyline, graphics is not so bad. This game is more story-focused where you'll receive missions one after another, however it also gives players freedom to explore the world, do commissions and socialize with NPCs. Similar concept like other popular simulation games. If you're a fan of simulation games, you'll love this game. However this game is more inclined towards calm and relaxing nature, it's not for everyone. If you preferred action RPG, this is not for you.
drop, from, fps, Could use another fix. Just at complete random the game will decide it is time to drop from 60 fps to a locked 22 fps. My Samsung galaxy note 20 ultra shows it can handle this game at 60 fps anywhere in the game but the game refuses to allow full gpu usage. My metrics only show about 43% gpu usage to get 60 fps on highest settings. Could you fix this for a more stable 60? Even restarting the game doesn't help. My phone isn't even close to hot.
drop, to, fps, Could use another fix. Just at complete random the game will decide it is time to drop from 60 fps to a locked 22 fps. My Samsung galaxy note 20 ultra shows it can handle this game at 60 fps anywhere in the game but the game refuses to allow full gpu usage. My metrics only show about 43% gpu usage to get 60 fps on highest settings. Could you fix this for a more stable 60? Even restarting the game doesn't help. My phone isn't even close to hot.
handle, at, fps, Could use another fix. Just at complete random the game will decide it is time to drop from 60 fps to a locked 22 fps. My Samsung galaxy note 20 ultra shows it can handle this game at 60 fps anywhere in the game but the game refuses to allow full gpu usage. My metrics only show about 43% gpu usage to get 60 fps on highest settings. Could you fix this for a more stable 60? Even restarting the game doesn't help. My phone isn't even close to hot.
