VERB, PREP, POBJ, 
ran, across, farm, the first time i picked up a chicken and ran across the farm for the other ducks and chicks to follow me so everyone can beat me the f up was hilarious... but still too laggy for my phone a good samsung version, a galaxy a21s, but i do can play it on the tablet... when ever this game feels more smooth for my android mobilephone device then you will be getting 5 stars but for now the game is awesome just this lag i be getting on my phone
ran, for, ducks, the first time i picked up a chicken and ran across the farm for the other ducks and chicks to follow me so everyone can beat me the f up was hilarious... but still too laggy for my phone a good samsung version, a galaxy a21s, but i do can play it on the tablet... when ever this game feels more smooth for my android mobilephone device then you will be getting 5 stars but for now the game is awesome just this lag i be getting on my phone
play, on, tablet, the first time i picked up a chicken and ran across the farm for the other ducks and chicks to follow me so everyone can beat me the f up was hilarious... but still too laggy for my phone a good samsung version, a galaxy a21s, but i do can play it on the tablet... when ever this game feels more smooth for my android mobilephone device then you will be getting 5 stars but for now the game is awesome just this lag i be getting on my phone
getting, on, phone, the first time i picked up a chicken and ran across the farm for the other ducks and chicks to follow me so everyone can beat me the f up was hilarious... but still too laggy for my phone a good samsung version, a galaxy a21s, but i do can play it on the tablet... when ever this game feels more smooth for my android mobilephone device then you will be getting 5 stars but for now the game is awesome just this lag i be getting on my phone
do, on, ride, Okay this game is actually kinda 🔥! One of the most in depth mobile games I've ever played, and it doesn't do any money grabbing. Perfect thing to do on a plane ride. I have a suggestion for the devs. The inventory system is incredibly annoying: Don't require that an item is in the backpack in order to complete quests, commissions, selling at shops, gifting, etc. And don't require that an item is in the quick bar to cook with it. Just show whatever cooking items you own. Would be much better!
selling, at, shops, Okay this game is actually kinda 🔥! One of the most in depth mobile games I've ever played, and it doesn't do any money grabbing. Perfect thing to do on a plane ride. I have a suggestion for the devs. The inventory system is incredibly annoying: Don't require that an item is in the backpack in order to complete quests, commissions, selling at shops, gifting, etc. And don't require that an item is in the quick bar to cook with it. Just show whatever cooking items you own. Would be much better!
cook, with, it, Okay this game is actually kinda 🔥! One of the most in depth mobile games I've ever played, and it doesn't do any money grabbing. Perfect thing to do on a plane ride. I have a suggestion for the devs. The inventory system is incredibly annoying: Don't require that an item is in the backpack in order to complete quests, commissions, selling at shops, gifting, etc. And don't require that an item is in the quick bar to cook with it. Just show whatever cooking items you own. Would be much better!
lags, on, tablet, This game has so much promise, but it lags badly on my Samsung tablet in just a short time even with game boosting. I am afraid I got tired of this problem and ended up Uninstaller. Perhaps I wi.l try this game again in the future.
try, in, future, This game has so much promise, but it lags badly on my Samsung tablet in just a short time even with game boosting. I am afraid I got tired of this problem and ended up Uninstaller. Perhaps I wi.l try this game again in the future.
start, at, water, I love this game but I don't know if this a bug or how the game is on my in game birthday my game restart over but all stuff is there like the workshop upgrade and many stuff but my game start over at Pollution water which I already done long time ago and The Dee dee stop also gone :v
run, on, Android, Remarkable port of the PC version and almost all current updates as well. This hasn't just been forced to run on Android this has been very well adapted for controls, quality of life and GUI usability.
adapted, for, controls, Remarkable port of the PC version and almost all current updates as well. This hasn't just been forced to run on Android this has been very well adapted for controls, quality of life and GUI usability.
plays, on, mobile, This game plays great on mobile, in my opinion. I played this game on Xbox One, and liked it, but it was very buggy. It looked like the bugs I was having issues with were resolved on mobile, so I'll play it on here from now on :)
plays, in, opinion, This game plays great on mobile, in my opinion. I played this game on Xbox One, and liked it, but it was very buggy. It looked like the bugs I was having issues with were resolved on mobile, so I'll play it on here from now on :)
played, on, One, This game plays great on mobile, in my opinion. I played this game on Xbox One, and liked it, but it was very buggy. It looked like the bugs I was having issues with were resolved on mobile, so I'll play it on here from now on :)
looked, like, bugs, This game plays great on mobile, in my opinion. I played this game on Xbox One, and liked it, but it was very buggy. It looked like the bugs I was having issues with were resolved on mobile, so I'll play it on here from now on :)
resolved, on, mobile, This game plays great on mobile, in my opinion. I played this game on Xbox One, and liked it, but it was very buggy. It looked like the bugs I was having issues with were resolved on mobile, so I'll play it on here from now on :)
finished, in, days, One of the best game out there today for a very low price and the bugs i encountered seems to be fixed. I finished the game in 167 days. Play this game and you will never regret it.
added, On, update, It was Goood, But I hope the controller support will be added On the Next update
wait, for, support, can't wait for controller support
released, on, android, Will my time at sandrock be released on android?
play, on, Note, I've just started playing this but my first impression of the game is impressive. I play on a Samsung Galaxy Note 20 Ultra and so far the game runs smooth. Not being a mobile gamer I was skeptical if I would like the game controls compared to a game controller, and again, I'm highly impressed how easy the controls are. I will update my review once I have played more extensively.
compared, to, controller, I've just started playing this but my first impression of the game is impressive. I play on a Samsung Galaxy Note 20 Ultra and so far the game runs smooth. Not being a mobile gamer I was skeptical if I would like the game controls compared to a game controller, and again, I'm highly impressed how easy the controls are. I will update my review once I have played more extensively.
bought, at, steam, i alrdy bought it at steam but i dont really like spend time playing on pc, so now i play on mobile and it actually really fun, luckily i give it second chance on different device lol, worth every penny~!
playing, on, pc, i alrdy bought it at steam but i dont really like spend time playing on pc, so now i play on mobile and it actually really fun, luckily i give it second chance on different device lol, worth every penny~!
play, on, mobile, i alrdy bought it at steam but i dont really like spend time playing on pc, so now i play on mobile and it actually really fun, luckily i give it second chance on different device lol, worth every penny~!
need, to, multiplayer, Nice awesome game but no multiplayer game why .. need to multiplayer and 1 or 2 players together play this game need
bummed, about, it, Dont have a laptop or computer to play. I was really bummed out about it. When i saw this, i was so happy. Its been a blast playing it. I havent put it down since i bought. Totally worth the price. 😍
played, for, minutes, I tried to load up the game several times, causing it to crash almost every time. When it was finally open, I was greeted by the most horrifying playable character I've ever seen. I was shocked, even the Wild Thornberries are ugly in a charming way. The game, graphically speaking, just feels unfinished. Most terrain is just a flat, textureless plane. I only played for a few minutes before chickening out. The voice acting is charming though, and rather different from most games, which I liked.
ignore, due, credit, No, I stole my dad credit carrier prepaid just to buy this, I want a refund ! My dad knew but he just ignore it due to his credit has been deducted stealthily. Ah, better getting this game at a half price. Tbh, I want support you just bcs I managed to mod this game meshes + it is in the phone now(Regarding to mod, don't worry I will not share anything public if it breaks the T&C). Fyi, most prepaid credit(include his) can't withdraw into the bank so I made up to buy this game :') Sad story end.
getting, at, price, No, I stole my dad credit carrier prepaid just to buy this, I want a refund ! My dad knew but he just ignore it due to his credit has been deducted stealthily. Ah, better getting this game at a half price. Tbh, I want support you just bcs I managed to mod this game meshes + it is in the phone now(Regarding to mod, don't worry I will not share anything public if it breaks the T&C). Fyi, most prepaid credit(include his) can't withdraw into the bank so I made up to buy this game :') Sad story end.
withdraw, into, bank, No, I stole my dad credit carrier prepaid just to buy this, I want a refund ! My dad knew but he just ignore it due to his credit has been deducted stealthily. Ah, better getting this game at a half price. Tbh, I want support you just bcs I managed to mod this game meshes + it is in the phone now(Regarding to mod, don't worry I will not share anything public if it breaks the T&C). Fyi, most prepaid credit(include his) can't withdraw into the bank so I made up to buy this game :') Sad story end.
reverted, like, day, Game itself is good, but there's a gamebreaking bug. I was getting out of the house and suddenly the game is reverted like day 1 with all the items intact. So i closed the game and the save file cant be opened. Honestly this is a terrible bug it makes you lose all your progress. It happens for the second time
reverted, with, items, Game itself is good, but there's a gamebreaking bug. I was getting out of the house and suddenly the game is reverted like day 1 with all the items intact. So i closed the game and the save file cant be opened. Honestly this is a terrible bug it makes you lose all your progress. It happens for the second time
happens, for, time, Game itself is good, but there's a gamebreaking bug. I was getting out of the house and suddenly the game is reverted like day 1 with all the items intact. So i closed the game and the save file cant be opened. Honestly this is a terrible bug it makes you lose all your progress. It happens for the second time
love, on, mobile, one of the games i love on mobile and i hope they release the sandrock on mobile too.
release, on, mobile, one of the games i love on mobile and i hope they release the sandrock on mobile too.
played, on, account, I love this game! I played it originally on my husband's steam account, so naturally excited when I could download it on my Chromebook. However, it hasn't worked since day one. I can't even get a refund! This game has never loaded, so I haven't been able to play it! Extremely disappointed! Complete Garbage!!!!
download, on, Chromebook, I love this game! I played it originally on my husband's steam account, so naturally excited when I could download it on my Chromebook. However, it hasn't worked since day one. I can't even get a refund! This game has never loaded, so I haven't been able to play it! Extremely disappointed! Complete Garbage!!!!
worked, since, day, I love this game! I played it originally on my husband's steam account, so naturally excited when I could download it on my Chromebook. However, it hasn't worked since day one. I can't even get a refund! This game has never loaded, so I haven't been able to play it! Extremely disappointed! Complete Garbage!!!!
get, past, day, I love the game but it's practically impossible to get past a day. The game constantly crashes even though my system is up to date and my ram is more than ok. It's on the lowest setting possible and literally sucks at running.
load, to, phone, Does NOT cloud save or allow transfer to new devices. I learned this the hard way after my phone broke and I attempted to load my saved game to my new phone. Progression I this game is hard earned and requires a lot of time, the fact that it's all lost if something happens to your device makes the game not worth playing.
happens, to, device, Does NOT cloud save or allow transfer to new devices. I learned this the hard way after my phone broke and I attempted to load my saved game to my new phone. Progression I this game is hard earned and requires a lot of time, the fact that it's all lost if something happens to your device makes the game not worth playing.
keep, for, sig, verry Good game like harvestmoon, me keep playing if have a free time,,,I hope this game won't die and keep update everymonth,once for sig in or a mission for new item or shirt or ,,new boss for obtaining new item from a event,make alive and we can go other friend see their house and farm,like game Hayday me usually play for this 4 year allready,,,so I hope a new system for arrange house and build for our wants,,,make it like gameloft gangstar we can play offline and online
obtaining, from, event, verry Good game like harvestmoon, me keep playing if have a free time,,,I hope this game won't die and keep update everymonth,once for sig in or a mission for new item or shirt or ,,new boss for obtaining new item from a event,make alive and we can go other friend see their house and farm,like game Hayday me usually play for this 4 year allready,,,so I hope a new system for arrange house and build for our wants,,,make it like gameloft gangstar we can play offline and online
see, like, game, verry Good game like harvestmoon, me keep playing if have a free time,,,I hope this game won't die and keep update everymonth,once for sig in or a mission for new item or shirt or ,,new boss for obtaining new item from a event,make alive and we can go other friend see their house and farm,like game Hayday me usually play for this 4 year allready,,,so I hope a new system for arrange house and build for our wants,,,make it like gameloft gangstar we can play offline and online
play, for, year, verry Good game like harvestmoon, me keep playing if have a free time,,,I hope this game won't die and keep update everymonth,once for sig in or a mission for new item or shirt or ,,new boss for obtaining new item from a event,make alive and we can go other friend see their house and farm,like game Hayday me usually play for this 4 year allready,,,so I hope a new system for arrange house and build for our wants,,,make it like gameloft gangstar we can play offline and online
build, for, wants,,,make, verry Good game like harvestmoon, me keep playing if have a free time,,,I hope this game won't die and keep update everymonth,once for sig in or a mission for new item or shirt or ,,new boss for obtaining new item from a event,make alive and we can go other friend see their house and farm,like game Hayday me usually play for this 4 year allready,,,so I hope a new system for arrange house and build for our wants,,,make it like gameloft gangstar we can play offline and online
build, like, gangstar, verry Good game like harvestmoon, me keep playing if have a free time,,,I hope this game won't die and keep update everymonth,once for sig in or a mission for new item or shirt or ,,new boss for obtaining new item from a event,make alive and we can go other friend see their house and farm,like game Hayday me usually play for this 4 year allready,,,so I hope a new system for arrange house and build for our wants,,,make it like gameloft gangstar we can play offline and online
launch, past, character, I'm sad that I can't seem to launch the game past the character set up. It crashes after I create my character. Also it's very difficult to change the character name because I can't get the keyboard to pop up. Only after fiddling with it for way longer than I care to admit was I able to get the keyboard to appear. Way too much time and effort to create a character only to have it crash and disappear.
fiddling, with, it, I'm sad that I can't seem to launch the game past the character set up. It crashes after I create my character. Also it's very difficult to change the character name because I can't get the keyboard to pop up. Only after fiddling with it for way longer than I care to admit was I able to get the keyboard to appear. Way too much time and effort to create a character only to have it crash and disappear.
loved, for, years, I have loved this game for 2 years now and I'm so glad it's on mobile! The mobile port is very well done and the developers fix bugs quite fast. My Time at Portia is a wholesome game where you can live your life as a builder, befriend townspeople, explore the vast open world, and do quests that enhance gameplay and progress the story of the game. I'd say it's well worth my money. Definitely my favorite game.
live, as, builder, I have loved this game for 2 years now and I'm so glad it's on mobile! The mobile port is very well done and the developers fix bugs quite fast. My Time at Portia is a wholesome game where you can live your life as a builder, befriend townspeople, explore the vast open world, and do quests that enhance gameplay and progress the story of the game. I'd say it's well worth my money. Definitely my favorite game.
waiting, for, outfit, Hey hey! I'm waiting for the npc's outfit. Hope the devs added them sooner..
compared, to, platforms, I am super glad I downloaded this mobile version. I was at first concerned that the controls would be noticably bad compared to the other platforms, but the controls are actually managable. Every so often I do see flickering when I move, but it's not bad enough to make me stop playing. That's really my only reason for not giving a 5th star.
gets, on, mobile, The game is one of the best mobile games I have ever played hope it gets more popular on mobile
seems, in, settings, this game is phenomal!!!!! i cant let my phone down playing this game and i already played 210+ hours!! but sadly im using a low end device thats why even in the lowest settings seems laggy. devs could you please adjust the graphics, i suggest in-game option for more lower graphics for low-end devices so that we can play less laggy. pls! i really like this game so much. hope you will take note my suggestion PS: Please make also a mobile platform of MY TIME AT SANDROCK that can play also offline.
used, to, them, I've always wanted to play this but my laptop couldn't run it, it was a potato with a keyboard. Now that it's on mobile I can actually play it! The controls were kinda hard to understand at first, but I'm used to them now. I LOVE this game!!!
play, for, PC, So I've always wanted to play this game for PC. To find out suddenly not only is it mobile now but also $7.99? I jumped at the chance and am now having a great gaming experience. With all the content I'm discovering I can't foresee running out of things to do in the game anytime soon.
jumped, at, chance, So I've always wanted to play this game for PC. To find out suddenly not only is it mobile now but also $7.99? I jumped at the chance and am now having a great gaming experience. With all the content I'm discovering I can't foresee running out of things to do in the game anytime soon.
discovering, With, content, So I've always wanted to play this game for PC. To find out suddenly not only is it mobile now but also $7.99? I jumped at the chance and am now having a great gaming experience. With all the content I'm discovering I can't foresee running out of things to do in the game anytime soon.
do, in, game, So I've always wanted to play this game for PC. To find out suddenly not only is it mobile now but also $7.99? I jumped at the chance and am now having a great gaming experience. With all the content I'm discovering I can't foresee running out of things to do in the game anytime soon.
go, to, inventory, Every time I assemble the stone furnace and retrieve it, it does not go to my inventory. I make sure to have lots of extra space in my inventory but still no luck. Restarted game, restarted phone, doesn't work. Can't advance at all since this is a key build for the first few quests. Super disappointed - a game you pay for should actually work.
have, in, inventory, Every time I assemble the stone furnace and retrieve it, it does not go to my inventory. I make sure to have lots of extra space in my inventory but still no luck. Restarted game, restarted phone, doesn't work. Can't advance at all since this is a key build for the first few quests. Super disappointed - a game you pay for should actually work.
do, in, game, Love this game so much. There's so much to do in game.
crashes, after, update, The game crashes after the recent update. Crashes at 1st loading screen, changing scene, etc while it didnt happen for me in the previous patch.
happen, for, me, The game crashes after the recent update. Crashes at 1st loading screen, changing scene, etc while it didnt happen for me in the previous patch.
happen, in, patch, The game crashes after the recent update. Crashes at 1st loading screen, changing scene, etc while it didnt happen for me in the previous patch.
let, into, ruins, Won't let me into old ruins 2 will just keep loading nonstop and Won't go in
pays, to, it, Its like a dream come true - lots of freedom and a HUGE amount of content, not to mention the devs pays attention to it (even its offline) and care to fix bugs. Definitely a must-try if you like harvest moon-style game!
go, to, sleep, Keeps crashing/freezing . I'm on year 4 and since I got the factory I can't even do a full day. The game doesn't save so I am sick of repeating things and then losing them again. i have to go to sleep after a few game hours have passed if I want to make sure it saves. Its a shame because i have loved playing it so far 😢
match, with, sound, Great game. But the game has a glitch with Dr.Xu dialogue doesn't match with sound, hope Dev. Fix this issues 😉
playing, on, phone, Better experience playing this on my phone than my Nintendo DS! I love this game and any glitches since I began playing have been quickly resolved.
playing, than, DS, Better experience playing this on my phone than my Nintendo DS! I love this game and any glitches since I began playing have been quickly resolved.
wish, for, things, Ok, now that I've finished the whole game I can give final review: Overall a decent game of this genre, however the game feels unpolished to me, doesn't offer much replay value. Not enough decorative items for house and yard, no different play style, restarting to get some of the romance exclusive items isn't worth the time, once the main mission concluded nowhere to spend all the gol. I wish for things to do post game. P.S. Why the fish tanks don't show number of fish inside? Add that please.
release, at, sandrock, Already finished the game, i think i played it too fast, im waiting more update for continuing main mission like the comeback of Aadit, or just release My time at sandrock on android too, i will gladly buy the game too since i like it
played, on, PC, My time is a LONG game there will easily be over 100 hours play time so the price is a steal. I played it on PC but have been commuting and needed to pass time. I am impressed it is the full game. Great game for anyone into open world like Stardew Valley. I didn't like the many of the default settings. I recommend turning down the passage of time in the options menu for the cellphone since it is a multi tasking device. I gave it 5 because I am happy it is on the phone.
turning, for, cellphone, My time is a LONG game there will easily be over 100 hours play time so the price is a steal. I played it on PC but have been commuting and needed to pass time. I am impressed it is the full game. Great game for anyone into open world like Stardew Valley. I didn't like the many of the default settings. I recommend turning down the passage of time in the options menu for the cellphone since it is a multi tasking device. I gave it 5 because I am happy it is on the phone.
get, past, creation, how do I get a refund? Can't get past character creation. Tried several times. UPDATE. thank you for your response.
thank, for, response, how do I get a refund? Can't get past character creation. Tried several times. UPDATE. thank you for your response.
compared, to, launch, Edit 2: The game is in a great state now compared to the initial launch. Most glitches are fixed and a lot more graphics options are added. Overall this is a great port, a must buy for all those who love farming simulation games (although this is more of a workshop simulation, lol)
buy, for, those, Edit 2: The game is in a great state now compared to the initial launch. Most glitches are fixed and a lot more graphics options are added. Overall this is a great port, a must buy for all those who love farming simulation games (although this is more of a workshop simulation, lol)
