VERB, PREP, POBJ, 
completed, within, week, I really wish y'all could update your games. This game is so much fun, but more worlds, more places, more side stories and art. More super powerful bosses. It's always so fun and it's challenging. There's a fair upgrade system and little Easter eggs, achievements, and great artwork. My only complaint is how short this game is. The levels can be completed within a week and it's disheartening to see it just finish. I know it needs to have a finish line, but the finish line is so close to the start
paid, for, Hero, What the hell!! I want my money back i literally paid for Faustus Hero and in-app purchased it ! My money was deducted from my account but i did not get my hero , either give me the character or refund please ,
deducted, from, account, What the hell!! I want my money back i literally paid for Faustus Hero and in-app purchased it ! My money was deducted from my account but i did not get my hero , either give me the character or refund please ,
work, on, tablet, All Kingdom Rush games do not work on my android tablet, i get a error saying no code to run, the game may be packaged incorrectly.
wait, for, Vengeance, Great game, character have they own unique skill. More challenging for most of Kr version, but still good 👍. Can't wait for Kr Vengeance after finished all stage 😉
revisiting, with, difficulty, This is an excellent tower defense game. No ads, no pay to win, no annoying popups. Extremely cheap, definitely worth the money. Else you can just play thenoriginal which is free, without ads. You can easily sink 10+ hours enjoying. It doesn't really feel worth revisiting levels with highest difficulty. Maybe that can be improved in future games. Solid 9/10.
improved, in, games, This is an excellent tower defense game. No ads, no pay to win, no annoying popups. Extremely cheap, definitely worth the money. Else you can just play thenoriginal which is free, without ads. You can easily sink 10+ hours enjoying. It doesn't really feel worth revisiting levels with highest difficulty. Maybe that can be improved in future games. Solid 9/10.
have, on, phone, Even better than the first. It's bigger, prettier, and the strategy of which towers to use and when is mixed up a good amount to keep it fresh and new. If you were only to have one game on your phone, this is it.
need, on, phone, Even better than kingdom rush These are the only two games you need on your phone
have, for, fan, I love every game in the Kingdom Rush series. They are all worth playing. The game still holds up. A must have for a TD fan.
play, like, game, This is my 2nd favorite Kindom Rush game from Iron hide. Really fun to play like every other kindom rush game. They should have added more game themes like snow or something. You can look at the the enimes from a book in the game and look what they can do and how much heath they have which is unique. And you can spend your stars to get upgrades for your guys.
look, at, enimes, This is my 2nd favorite Kindom Rush game from Iron hide. Really fun to play like every other kindom rush game. They should have added more game themes like snow or something. You can look at the the enimes from a book in the game and look what they can do and how much heath they have which is unique. And you can spend your stars to get upgrades for your guys.
get, for, guys, This is my 2nd favorite Kindom Rush game from Iron hide. Really fun to play like every other kindom rush game. They should have added more game themes like snow or something. You can look at the the enimes from a book in the game and look what they can do and how much heath they have which is unique. And you can spend your stars to get upgrades for your guys.
makes, for, me, This is the first Kingdom Rush I played that I actually stopped playing and deleted it. Who thought it was a good idea to have levels change up the path halfway through? Or allow people to go other routes of nowhere? I get you're trying to make it different but for me personally this makes the gameplay infuriating and not fun. I worked for 12 level and now everyone can pretty much bypass the defenses? How is that fun???
worked, for, level, This is the first Kingdom Rush I played that I actually stopped playing and deleted it. Who thought it was a good idea to have levels change up the path halfway through? Or allow people to go other routes of nowhere? I get you're trying to make it different but for me personally this makes the gameplay infuriating and not fun. I worked for 12 level and now everyone can pretty much bypass the defenses? How is that fun???
carries, through, version, I like the balance the game carries through each version.
Based, on, games, Based on the other games this one is good without even playing it.. I'd be saying that
freezing, on, device, The endless levels are repeatedly freezing on my device.
need, with, heroes, This is good I like how this is not pay to win because even with premium powerful heroes you still need strategies to win pls keep making games like this
buy, with, stars, Kingdom Rush is one of the better tower defense games, though I didn't enjoy it as much as their last one. One thing that was annoying; how some of the stages paths were jumbled and you wouldn't know which path to upgrade. It did add a bit of a challenge, which is good for any game worth dL-ing, but as I said, it was annoying. It'd be nice if there was a "5 more waves" option to buy with the leftover stars. On some stages, right when it gets really interesting, it's over. Good game overall.
Take, into, it, Take time into it and it's enjoyable
get, after, while, Had lots of fun though it does get a bit repetitive after a while
having, In, purchases, A truly great game. I love every part. Other than the game costing 3 dollars and still having In app purchases.
wrote, on, comment, addictive game, and I trust the publisher wrote on a comment here, that you can finish the game without any additional purchases
finish, without, purchases, addictive game, and I trust the publisher wrote on a comment here, that you can finish the game without any additional purchases
had, with, it, The veteran difficult (hardest difficulty) is the perfect difficulty for a game, had a blast with it!
got, into, genre, I never really got into the tower defense genre, but this completely changed my mind. It's very engaging, well thought out, just the right balance of challenge and reward. You really get the sense that your strategy worked when everything goes smooth. The heroes are also nice to upgrade and to play around with different styles of combat. The levels are a sight to behold and enemy types keep on changing appearances which keeps everything fresh.
play, with, styles, I never really got into the tower defense genre, but this completely changed my mind. It's very engaging, well thought out, just the right balance of challenge and reward. You really get the sense that your strategy worked when everything goes smooth. The heroes are also nice to upgrade and to play around with different styles of combat. The levels are a sight to behold and enemy types keep on changing appearances which keeps everything fresh.
playing, for, time, Been playing the Kingdom Rush series for a long time. I love it. I hope they continue to make more games.
load, for, me, It wont load for me when i open the game it just stays on a black screen
stays, on, screen, It wont load for me when i open the game it just stays on a black screen
played, in, time, Best game I've played in a long time
seems, on, level, Only on level 3 but seems fun so far.
earn, in, game, It's fun it's addicting but no way to earn the other heroes in game.
wows, with, graphics, This game always wows me with the graphics
compared, with, games, A fresh experience compared with the first 2 games, paid heroes are here as well, but for the starting price it's acceptable. I enjoy this game more than frontiers, fells like something different than the original (but in a good way)
fells, like, something, A fresh experience compared with the first 2 games, paid heroes are here as well, but for the starting price it's acceptable. I enjoy this game more than frontiers, fells like something different than the original (but in a good way)
Looks, like, this, Asking me to rate this game early on, after the third level, is annoying, but I gave it five stars because I liked the other Kingdom Rush games a lot. Looks like this will be a good addition to the series.
compared, to, Vengeance, (original 2017) The best entry in the Kingdom Rush Franchise! Go Elves Go!!! (2021 edit) Graphics still hold up and kinda nice. Even compared to Vengeance. Also better gameplay because branched towers is better than set of 5.
notch, from, Ironhide, Another top notch TD game from Ironhide. The story is a neat prequel, the free heroes are pretty good, and it can be a good challenge. It is well balanced... unless you pay for Phoenix. This flaming bird of death is truly an AoE damage legend that can incinerate damn near anything. I enjoyed it, and consider it well worth the $3.
pay, for, Phoenix, Another top notch TD game from Ironhide. The story is a neat prequel, the free heroes are pretty good, and it can be a good challenge. It is well balanced... unless you pay for Phoenix. This flaming bird of death is truly an AoE damage legend that can incinerate damn near anything. I enjoyed it, and consider it well worth the $3.
incinerate, near, anything, Another top notch TD game from Ironhide. The story is a neat prequel, the free heroes are pretty good, and it can be a good challenge. It is well balanced... unless you pay for Phoenix. This flaming bird of death is truly an AoE damage legend that can incinerate damn near anything. I enjoyed it, and consider it well worth the $3.
hoping, for, one, I have been hoping for a new one for a while an lo an behold iron hide supplied with the wish!! Thank guys an girls at iron hide!!
hoping, for, while, I have been hoping for a new one for a while an lo an behold iron hide supplied with the wish!! Thank guys an girls at iron hide!!
hoping, for, lo, I have been hoping for a new one for a while an lo an behold iron hide supplied with the wish!! Thank guys an girls at iron hide!!
supplied, with, wish, I have been hoping for a new one for a while an lo an behold iron hide supplied with the wish!! Thank guys an girls at iron hide!!
outdone, with, writing, An amazing prequel to the Kingdom rush series! The people of Ironhide game studios have truly outdone themselves with writing, art design, and game mechanics. They added so many things that lead directly into the first game that it is genius! And they added a new hero ability mechanic which just makes the game that much more fun!
lead, into, game, An amazing prequel to the Kingdom rush series! The people of Ironhide game studios have truly outdone themselves with writing, art design, and game mechanics. They added so many things that lead directly into the first game that it is genius! And they added a new hero ability mechanic which just makes the game that much more fun!
has, to, it, Fun mobile version of a classic. Campaign has a nice touch to it.
increases, for, seconds, Exactly the same as the free version, but worse. Diamonds cost the same as the free version, but tower upgrades are more expensive, the enemies take more to kill, towers can be destroyed, and the refresh time is longer; meaning more diamonds will be needed. Gold bags aren't a thing. Only this stupid over-priced glove that increases gold income for a few seconds. Just stick with the free version. This base game isn't expensive, but it's paying for a worse and ultimately more expensive product
stick, with, version, Exactly the same as the free version, but worse. Diamonds cost the same as the free version, but tower upgrades are more expensive, the enemies take more to kill, towers can be destroyed, and the refresh time is longer; meaning more diamonds will be needed. Gold bags aren't a thing. Only this stupid over-priced glove that increases gold income for a few seconds. Just stick with the free version. This base game isn't expensive, but it's paying for a worse and ultimately more expensive product
paying, for, product, Exactly the same as the free version, but worse. Diamonds cost the same as the free version, but tower upgrades are more expensive, the enemies take more to kill, towers can be destroyed, and the refresh time is longer; meaning more diamonds will be needed. Gold bags aren't a thing. Only this stupid over-priced glove that increases gold income for a few seconds. Just stick with the free version. This base game isn't expensive, but it's paying for a worse and ultimately more expensive product
outdoing, with, game, Absolutely fantastic, Ironhide keeps outdoing themselves with each new Kingdom Rush game. Completely new art, same tower progressions, new upgrade tree, and new hero power abilities for you to use. I love the new and old systems in play. Great job Ironhide!
played, for, that, Top mobile game ever in my opinion. I'm not a bot I swear lol, but these games are the only mobile games that I have played for like years. Def worth the money in my opinion
played, for, years, Top mobile game ever in my opinion. I'm not a bot I swear lol, but these games are the only mobile games that I have played for like years. Def worth the money in my opinion
seen, for, this, I was a bit hesitant to try this, but it was 100% worth it. Great levels that balance enjoyment and difficulty, creative enemies and bosses, and post-game campaigns that are not only enjoyable, but require skill. I've seen a lot of one star reviews for this, but all of them are made by people who are outraged they have to make a choice to not buy extra heroes. Great game, excited for Legends. 😘
spent, on, DLC, I really love this game it's so cool seeing some the main story characters in their prequel-era. I also spent all my money on the DLC.
playing, since, 2015, Cool game. Been playing since 2015.
holds, to, roots, One of my all time favorite games as a kid growing up was Kingdom Rush and Kingdom Rush Origins holds true to its ancestral roots. Love the game!
compared, to, games, Very well done, just feels limited compared to some other TD games. The story adds a nice touch though.
pay, for, game, Great game, but I don't like that most heroes are money locked. I would rather pay more for the game, and then get more heroes, but for these pay-to-win times, this is the best case scenario.
hoping, for, part, But i'm sad 😔 because I finished all 3 parts it i'm still hoping for a part 4 😀. If you dont have this game you must have to get it its the best game ever!!!😁😁😁😁😁😁😁😁😁😁😁😁😁
starting, from, beginning, I cool so far I'm starting from the beginning if ben on a higher level i kinda know what is what we see
starting, if, ben, I cool so far I'm starting from the beginning if ben on a higher level i kinda know what is what we see
starting, on, level, I cool so far I'm starting from the beginning if ben on a higher level i kinda know what is what we see
spending, on, it, Good game but after spending money on it and it's pay to win on easy mode, that kinda sucks
win, on, mode, Good game but after spending money on it and it's pay to win on easy mode, that kinda sucks
paying, in, game, These TD series should not be in Google play pass. It's useless and difficult to play without paying in the game. This shows that obviously you need to buy gems to progress in the game.
progress, in, game, These TD series should not be in Google play pass. It's useless and difficult to play without paying in the game. This shows that obviously you need to buy gems to progress in the game.
payed, for, 5, You buy the game just to discover that you payed just for 5 out of 16 characters. Want to play with other characters? Pay 5+ bucks for each! Dev, if you are gonna reply to this the way you usually do, "the game is designed so that you can finish it with the 5 characters alone", don't bother... How about I sell you a car that is perfectly drivable with just one seat, but you pay to use the other seats? TL/DR: get it on steam in full for a fraction of the price...
play, with, characters, You buy the game just to discover that you payed just for 5 out of 16 characters. Want to play with other characters? Pay 5+ bucks for each! Dev, if you are gonna reply to this the way you usually do, "the game is designed so that you can finish it with the 5 characters alone", don't bother... How about I sell you a car that is perfectly drivable with just one seat, but you pay to use the other seats? TL/DR: get it on steam in full for a fraction of the price...
Pay, for, each, You buy the game just to discover that you payed just for 5 out of 16 characters. Want to play with other characters? Pay 5+ bucks for each! Dev, if you are gonna reply to this the way you usually do, "the game is designed so that you can finish it with the 5 characters alone", don't bother... How about I sell you a car that is perfectly drivable with just one seat, but you pay to use the other seats? TL/DR: get it on steam in full for a fraction of the price...
reply, to, this, You buy the game just to discover that you payed just for 5 out of 16 characters. Want to play with other characters? Pay 5+ bucks for each! Dev, if you are gonna reply to this the way you usually do, "the game is designed so that you can finish it with the 5 characters alone", don't bother... How about I sell you a car that is perfectly drivable with just one seat, but you pay to use the other seats? TL/DR: get it on steam in full for a fraction of the price...
finish, with, characters, You buy the game just to discover that you payed just for 5 out of 16 characters. Want to play with other characters? Pay 5+ bucks for each! Dev, if you are gonna reply to this the way you usually do, "the game is designed so that you can finish it with the 5 characters alone", don't bother... How about I sell you a car that is perfectly drivable with just one seat, but you pay to use the other seats? TL/DR: get it on steam in full for a fraction of the price...
get, on, steam, You buy the game just to discover that you payed just for 5 out of 16 characters. Want to play with other characters? Pay 5+ bucks for each! Dev, if you are gonna reply to this the way you usually do, "the game is designed so that you can finish it with the 5 characters alone", don't bother... How about I sell you a car that is perfectly drivable with just one seat, but you pay to use the other seats? TL/DR: get it on steam in full for a fraction of the price...
get, for, fraction, You buy the game just to discover that you payed just for 5 out of 16 characters. Want to play with other characters? Pay 5+ bucks for each! Dev, if you are gonna reply to this the way you usually do, "the game is designed so that you can finish it with the 5 characters alone", don't bother... How about I sell you a car that is perfectly drivable with just one seat, but you pay to use the other seats? TL/DR: get it on steam in full for a fraction of the price...
beat, On, levels, It's a newer version of previous KR games, and I like the new towers powers. My only complaint remains the same: there's no fast forward button. On levels I cannot beat toward the end, 13/15, for example, I don't need to sit through the first 12 rounds. Please add this feature. It gets boring quickly when I have to sit through the same level forever just to try to beat the last two rounds.
beat, toward, end, It's a newer version of previous KR games, and I like the new towers powers. My only complaint remains the same: there's no fast forward button. On levels I cannot beat toward the end, 13/15, for example, I don't need to sit through the first 12 rounds. Please add this feature. It gets boring quickly when I have to sit through the same level forever just to try to beat the last two rounds.
beat, for, example, It's a newer version of previous KR games, and I like the new towers powers. My only complaint remains the same: there's no fast forward button. On levels I cannot beat toward the end, 13/15, for example, I don't need to sit through the first 12 rounds. Please add this feature. It gets boring quickly when I have to sit through the same level forever just to try to beat the last two rounds.
sit, through, rounds, It's a newer version of previous KR games, and I like the new towers powers. My only complaint remains the same: there's no fast forward button. On levels I cannot beat toward the end, 13/15, for example, I don't need to sit through the first 12 rounds. Please add this feature. It gets boring quickly when I have to sit through the same level forever just to try to beat the last two rounds.
sit, through, level, It's a newer version of previous KR games, and I like the new towers powers. My only complaint remains the same: there's no fast forward button. On levels I cannot beat toward the end, 13/15, for example, I don't need to sit through the first 12 rounds. Please add this feature. It gets boring quickly when I have to sit through the same level forever just to try to beat the last two rounds.
listen, to, music, Nice but the problem is play the game while listen to my favorite music.. I can't listen my music at all while play this game
spending, on, it, Great TD game. Perfect for spending a few minutes or a few hours on it.
playing, since, 2015, Have been playing this series since 2015 (IIRC), recently bought almost all the games - they're cheap, fun and engaging! I don't usually get into games, but this is fire! Great sound effects too. :)
get, into, games, Have been playing this series since 2015 (IIRC), recently bought almost all the games - they're cheap, fun and engaging! I don't usually get into games, but this is fire! Great sound effects too. :)
make, to, it, Love this game the fact you creators didn't make dramatic changes to it is amazing compared to other games that hype it up then make stupid changes thank you guys🙏
compared, to, games, Love this game the fact you creators didn't make dramatic changes to it is amazing compared to other games that hype it up then make stupid changes thank you guys🙏
pay, for, game, Solid game, lots of tower strategies and customization. The champions cost money even though u pay 3$ for the game.
wellplay, at, level, Best TD game, but difficulty level is high, I cant wellplay even at easy level, so I cant relax my mind and even get pressure😑
balanced, for, difficulties, Pretty much SCAM of a game. Early levels are balanced ok even for harder difficulties but you REALLY feel the push to make you buy real money upgrades. Since it's P2P I was hoping this will be honest game. Nothing but trying to get the most money out of people. Sad
developing, for, price, My childhood ;_;. Thanks for developing game on android for reasonable price its fun as always <3
say, besides, this, There's nothing more I can say besides this is a great game and a great series.
Reminds, of, type, Fun game. So addictive many options and details make it really fun. Reminds me of a zelda type
installed, since, moment, It is absolutely a cute tower defense game! Love it, and since the moment I installed it, I haven't put my phone down a minute!
delivers, Like, games, Like the previous games Kingdom Rush always delivers.
distracted, from, game, i love love love this game. pretty challenging and very detailed. seriously, there are so many little details in the levels that i almost get distracted from the game itself.
challenging, in, way!I, The best of this kind all three of Kingdom Rush are entertaining, funny,and challenging in a relaxing way!I really raccomand them all!Also the ads are available if one wants to buy gems for extras weapons!
come, as, fun, Amazing game. One of the best games you can download. Played this many time and alwyas come back as its challenging, fun and not don't have to keep pressing buttons on the screen.
keep, on, screen, Amazing game. One of the best games you can download. Played this many time and alwyas come back as its challenging, fun and not don't have to keep pressing buttons on the screen.
played, through, games, Have played through the other two kingdom rush games. Enjoyed them to the max. So happy to find this one. So far so good.
Enjoyed, to, max, Have played through the other two kingdom rush games. Enjoyed them to the max. So happy to find this one. So far so good.
thrown, for, measure, I loooove kingdom rush. Tower defense game with lots of humour thrown in for good measure. Well done guys!
debited, from, account, I bought a hero, money was debited from my account but it still says I have to buy the hero in the game and I am unable to use it. Help?
buy, in, game, I bought a hero, money was debited from my account but it still says I have to buy the hero in the game and I am unable to use it. Help?
pay, in, game, You have to pay loads of money in game to get access to most heroes.
missed, for, game, I almost missed my bus for this game
Got, at, price, Got it at discount price, 1.29, would have puis up to $5 for it. Really good if you even simply liked kingdom rush
have, for, it, Got it at discount price, 1.29, would have puis up to $5 for it. Really good if you even simply liked kingdom rush
get, over, mechanic, It's okay. I just cannot get over the mechanic of enemies creating new paths leading basically to the end, or the enemies who phase around the paths and wind up near the end. It feels cheap. Oh, you didn't fortify the very end of the path? Well here comes 50 enemies who just phased around all of your defenses. Usually just ends in a restart and then prepping for it next time, but the point is it's artificial difficulty and I dislike it.
