NOUN, ADJ, 
experience, Beautiful, Beautiful experience!!!
game, great, This is a really great game I have it on my switch and I wish there was journey gamemode on there as well. so can you please add journey game mode on Nintendo switchðŸ™‚ðŸ˜‰ thanks.
gamemode, journey, This is a really great game I have it on my switch and I wish there was journey gamemode on there as well. so can you please add journey game mode on Nintendo switchðŸ™‚ðŸ˜‰ thanks.
update, new, Plz add the dont starve crossover to mobile soon. then ill give 5 stars but until the new update comes for mobile it stays at 4 stars from me.
classic, Amazing, Amazing classic
game, good, In general it's a really good game but they just need to update it more like they do with the PC version.
time, same, Love the game Terraria, but this version is literally unplayable with how terrible the controls are. Trying to aim is impossible, the control panel thing is somehow hard to notice and way too cluttered at the same time, items are hard to use, etc. All around awful.
game, Good, Good game but only issue is the update schedule. As of now there has been an update on pc for a Don't Starve Together update, but who knows when this update will come here. Also please if possible have a setting possibly that puts the old version of game controls up. Ever since the new controls I've just stopped due to so many mis clicks that shouldn't/weren't intended to happen due to playing on phone and my large finger just blocking all the other buttons. But these are my only issues.
issue, only, Good game but only issue is the update schedule. As of now there has been an update on pc for a Don't Starve Together update, but who knows when this update will come here. Also please if possible have a setting possibly that puts the old version of game controls up. Ever since the new controls I've just stopped due to so many mis clicks that shouldn't/weren't intended to happen due to playing on phone and my large finger just blocking all the other buttons. But these are my only issues.
version, old, Good game but only issue is the update schedule. As of now there has been an update on pc for a Don't Starve Together update, but who knows when this update will come here. Also please if possible have a setting possibly that puts the old version of game controls up. Ever since the new controls I've just stopped due to so many mis clicks that shouldn't/weren't intended to happen due to playing on phone and my large finger just blocking all the other buttons. But these are my only issues.
controls, new, Good game but only issue is the update schedule. As of now there has been an update on pc for a Don't Starve Together update, but who knows when this update will come here. Also please if possible have a setting possibly that puts the old version of game controls up. Ever since the new controls I've just stopped due to so many mis clicks that shouldn't/weren't intended to happen due to playing on phone and my large finger just blocking all the other buttons. But these are my only issues.
clicks, many, Good game but only issue is the update schedule. As of now there has been an update on pc for a Don't Starve Together update, but who knows when this update will come here. Also please if possible have a setting possibly that puts the old version of game controls up. Ever since the new controls I've just stopped due to so many mis clicks that shouldn't/weren't intended to happen due to playing on phone and my large finger just blocking all the other buttons. But these are my only issues.
finger, large, Good game but only issue is the update schedule. As of now there has been an update on pc for a Don't Starve Together update, but who knows when this update will come here. Also please if possible have a setting possibly that puts the old version of game controls up. Ever since the new controls I've just stopped due to so many mis clicks that shouldn't/weren't intended to happen due to playing on phone and my large finger just blocking all the other buttons. But these are my only issues.
buttons, other, Good game but only issue is the update schedule. As of now there has been an update on pc for a Don't Starve Together update, but who knows when this update will come here. Also please if possible have a setting possibly that puts the old version of game controls up. Ever since the new controls I've just stopped due to so many mis clicks that shouldn't/weren't intended to happen due to playing on phone and my large finger just blocking all the other buttons. But these are my only issues.
issues, only, Good game but only issue is the update schedule. As of now there has been an update on pc for a Don't Starve Together update, but who knows when this update will come here. Also please if possible have a setting possibly that puts the old version of game controls up. Ever since the new controls I've just stopped due to so many mis clicks that shouldn't/weren't intended to happen due to playing on phone and my large finger just blocking all the other buttons. But these are my only issues.
years, many, I've played this game on both console and mobile for many years, and it's simply the best. One of my favorite games by far. Only reason I'm giving 4 stars is because you cannot cross play between both console and mobile, which isn't ideal, however I've come to terms with it, I still do wish it was possible. Other from that, this game is one of a kind, can't wait to see more ðŸ™‚
games, favorite, I've played this game on both console and mobile for many years, and it's simply the best. One of my favorite games by far. Only reason I'm giving 4 stars is because you cannot cross play between both console and mobile, which isn't ideal, however I've come to terms with it, I still do wish it was possible. Other from that, this game is one of a kind, can't wait to see more ðŸ™‚
reason, Only, I've played this game on both console and mobile for many years, and it's simply the best. One of my favorite games by far. Only reason I'm giving 4 stars is because you cannot cross play between both console and mobile, which isn't ideal, however I've come to terms with it, I still do wish it was possible. Other from that, this game is one of a kind, can't wait to see more ðŸ™‚
ðŸ™‚, more, I've played this game on both console and mobile for many years, and it's simply the best. One of my favorite games by far. Only reason I'm giving 4 stars is because you cannot cross play between both console and mobile, which isn't ideal, however I've come to terms with it, I still do wish it was possible. Other from that, this game is one of a kind, can't wait to see more ðŸ™‚
world, creative, Terraia is the type of game that can suck you in for hours at a time. The creative world, building, and crafting are so much fun! While PC is where I originally played it, bur they have made it so accessible on mobile and others its worth buying again.
fun, much, Terraia is the type of game that can suck you in for hours at a time. The creative world, building, and crafting are so much fun! While PC is where I originally played it, bur they have made it so accessible on mobile and others its worth buying again.
gaem, good, Is a good gaem
games, of.my, It is fun and one of.my favorite games but it crashes after 1 or 2 hours of playing it.
games, favorite, It is fun and one of.my favorite games but it crashes after 1 or 2 hours of playing it.
game, everbwhy, Worst game everbwhy isnt there any ghacha things too childish
things, ghacha, Worst game everbwhy isnt there any ghacha things too childish
things, childish, Worst game everbwhy isnt there any ghacha things too childish
rpg, Amazing, Amazing rpg, so addicting
challenge, new, I just bought the game, i always play terraria on pc but playing it on mobile is a new challenge for me. Im kinda clumsy with the controls but im getting used to it... it would be great if we can resize every individual controls because i dont really like the scale of it. Only the controls is the downside of this game in my perspective, and please change this for the upcoming updates.
controls, individual, I just bought the game, i always play terraria on pc but playing it on mobile is a new challenge for me. Im kinda clumsy with the controls but im getting used to it... it would be great if we can resize every individual controls because i dont really like the scale of it. Only the controls is the downside of this game in my perspective, and please change this for the upcoming updates.
updates, upcoming, I just bought the game, i always play terraria on pc but playing it on mobile is a new challenge for me. Im kinda clumsy with the controls but im getting used to it... it would be great if we can resize every individual controls because i dont really like the scale of it. Only the controls is the downside of this game in my perspective, and please change this for the upcoming updates.
games, best, It's is 100%, one of the best games ever.
designs, graphic, This Game is Great Journeys end update really upgraded the graphic designs This game is getting prettier
bugs, own, Fixed my own bugs so I'm editing my review: Please do not ever stop updating this game. I'll buy it again once a year just to keep up support... There's still so much you can do, and it's almost time to open up to allowing mods to become part of the main game. Pay the people who love your game and add their work to it. Moon Lord was only the beginning. It took me far too long to get into this game, but I can say with certainty that I 'get' it.
game, main, Fixed my own bugs so I'm editing my review: Please do not ever stop updating this game. I'll buy it again once a year just to keep up support... There's still so much you can do, and it's almost time to open up to allowing mods to become part of the main game. Pay the people who love your game and add their work to it. Moon Lord was only the beginning. It took me far too long to get into this game, but I can say with certainty that I 'get' it.
time, 3rd, This is now the 3rd time I've bought & played Terraria (PS3, PC, & now mobile). It's worth every penny. Developers that support their products like this, are far and few between. Also any mobile game that realizes the importance of controller support, is to be applauded. There's so much to do & so much content to dig up. In fact, my only sort of gripe with the game is that you can easily get mired down with your to do list. EASILY THE BEST STAND ALONE GAME PURCHASE I'VE MADE ON MOBILE.
game, mobile, This is now the 3rd time I've bought & played Terraria (PS3, PC, & now mobile). It's worth every penny. Developers that support their products like this, are far and few between. Also any mobile game that realizes the importance of controller support, is to be applauded. There's so much to do & so much content to dig up. In fact, my only sort of gripe with the game is that you can easily get mired down with your to do list. EASILY THE BEST STAND ALONE GAME PURCHASE I'VE MADE ON MOBILE.
content, much, This is now the 3rd time I've bought & played Terraria (PS3, PC, & now mobile). It's worth every penny. Developers that support their products like this, are far and few between. Also any mobile game that realizes the importance of controller support, is to be applauded. There's so much to do & so much content to dig up. In fact, my only sort of gripe with the game is that you can easily get mired down with your to do list. EASILY THE BEST STAND ALONE GAME PURCHASE I'VE MADE ON MOBILE.
sort, only, This is now the 3rd time I've bought & played Terraria (PS3, PC, & now mobile). It's worth every penny. Developers that support their products like this, are far and few between. Also any mobile game that realizes the importance of controller support, is to be applauded. There's so much to do & so much content to dig up. In fact, my only sort of gripe with the game is that you can easily get mired down with your to do list. EASILY THE BEST STAND ALONE GAME PURCHASE I'VE MADE ON MOBILE.
I'VE, BEST, This is now the 3rd time I've bought & played Terraria (PS3, PC, & now mobile). It's worth every penny. Developers that support their products like this, are far and few between. Also any mobile game that realizes the importance of controller support, is to be applauded. There's so much to do & so much content to dig up. In fact, my only sort of gripe with the game is that you can easily get mired down with your to do list. EASILY THE BEST STAND ALONE GAME PURCHASE I'VE MADE ON MOBILE.
updates, latest, When we getting the latest updates???
games, favorite, Honestly it's one of my favorite games to play even though I grinded for very long trying to get princess just too realize it hasn't been implemented yet.
game, Best, Best game ever
rain, heavy, Is it bug? npc never seems to teleport to house unless heavy rain or death, annoying since i cant buy pylon..
rain, annoying, Is it bug? npc never seems to teleport to house unless heavy rain or death, annoying since i cant buy pylon..
game, Nice, Nice game (I see on youtube where I see a trailer on terraria that is don't starve and terraria update)
game, offline, The best offline game that never made me bored. Every stages of the game makes me excited.
game, Fantastic, Fantastic game, although the UI placement and response is a little to be desired, all in all, brilliant
game, brilliant, Fantastic game, although the UI placement and response is a little to be desired, all in all, brilliant
games, favorite, I love terraria! This is one of my favorite games. I could spend hours just playing and building houses for the npcs. Overall the best game(besides minecraft) I've ever played would recommend for any and everyone
minecraft, best, I love terraria! This is one of my favorite games. I could spend hours just playing and building houses for the npcs. Overall the best game(besides minecraft) I've ever played would recommend for any and everyone
love, initial, I absolutely love Terraria on PC and found an initial love for the game on mobile in 2015. The game plays just fine on my phone considering my phone is not the best. The gameplay has an interesting twist on the PC controls. overall the game is amazing
twist, interesting, I absolutely love Terraria on PC and found an initial love for the game on mobile in 2015. The game plays just fine on my phone considering my phone is not the best. The gameplay has an interesting twist on the PC controls. overall the game is amazing
person, fake, Very good I am not lying this is not a fake person I'm serious Ok if you don't believe me with a fake person be able to do this :((())))))))
person, fake, Very good I am not lying this is not a fake person I'm serious Ok if you don't believe me with a fake person be able to do this :((())))))))
game, good, I like it very good game. But I won't be able to play this beautiful masterpiece for very long
masterpiece, beautiful, I like it very good game. But I won't be able to play this beautiful masterpiece for very long
adventure, new, Edit: For some reason my controller just doesn't work any more. Was 5 star now down to 2. The game is great with Controller but touch screen is pretty bad. ðŸ˜ž It sux to have to play something else but oh well off on a new different adventure!!!!
adventure, different, Edit: For some reason my controller just doesn't work any more. Was 5 star now down to 2. The game is great with Controller but touch screen is pretty bad. ðŸ˜ž It sux to have to play something else but oh well off on a new different adventure!!!!
right, tutorial, Ok I absolutely love this game it is one of the best and I have over 600 hours of playtime and I saw the one star reviews saying there's no tutorials and what I have to say is yes there is you idiots let me explain so there are not only YouTube videos but there is a tutorial right in the menu and there is one individually on the app store and sometimes you just have to learn and deal with it so stop being a baby and learn yourself or find someone or something to learn off of.
controls, old, I love the game, except, the controls. Is there a way to get old controls for mobile? Other than the controls, love it!! <3
game, Great, Great game looks just like the PC terraria worth all of the money
servers, online, I love the game, but we are like 3 to 5 updates behind! The don't starve together update is nowhere here, online servers like Terraria.One can't be used since they are updated and we are not, and it just makes me disappointed. This game is totally amazing though, just mad from the update loss.
account, wrong, I bought the game but am unable to play due to a bug that says I'm signed in to the wrong account t or havent purchased the game.
game, fun, I love terraria as a fun game and it has incredible weapon choices and so much to do.Keep it up developers.
choices, incredible, I love terraria as a fun game and it has incredible weapon choices and so much to do.Keep it up developers.
updates, new, Game is just horrible,as for pc,that just gets everything,mods,new updates, literally everything,yet it takes years for mobile updates,this game isn't even exciting anymore,it's just not like it was before,I can't believe I wasted money on this thing,a whole year has gone,I loved this game,but now it's just horrible
updates, mobile, Game is just horrible,as for pc,that just gets everything,mods,new updates, literally everything,yet it takes years for mobile updates,this game isn't even exciting anymore,it's just not like it was before,I can't believe I wasted money on this thing,a whole year has gone,I loved this game,but now it's just horrible
year, whole, Game is just horrible,as for pc,that just gets everything,mods,new updates, literally everything,yet it takes years for mobile updates,this game isn't even exciting anymore,it's just not like it was before,I can't believe I wasted money on this thing,a whole year has gone,I loved this game,but now it's just horrible
time, first, When i played this for the first time i did it on mobile its a great place to start
place, great, When i played this for the first time i did it on mobile its a great place to start
game, great, love it, great game on all platforms, no matter the version.
confusion, multi, I want to give a 5-star review, but I can't because of their multi-player confusion. I have spent 15 minutes just trying to play this game with a friend who is not local, and every how-to video says I need to download this or sign up for that. It should be a very simple process.
confusion, -, I want to give a 5-star review, but I can't because of their multi-player confusion. I have spent 15 minutes just trying to play this game with a friend who is not local, and every how-to video says I need to download this or sign up for that. It should be a very simple process.
confusion, player, I want to give a 5-star review, but I can't because of their multi-player confusion. I have spent 15 minutes just trying to play this game with a friend who is not local, and every how-to video says I need to download this or sign up for that. It should be a very simple process.
process, simple, I want to give a 5-star review, but I can't because of their multi-player confusion. I have spent 15 minutes just trying to play this game with a friend who is not local, and every how-to video says I need to download this or sign up for that. It should be a very simple process.
game, Best, Best game ever very addictive
game, addictive, Best game ever very addictive
stuff, cool, I love the game beat everything in master and got the Zenith. But the only bad is they give all the cool stuff to PC players and I was excited to get the cool cosmetics from a competition that some people won because they looked cool and stuff from the 1.4.3 update with the collab with Don't Starve â„¢ï¸ It would be a 5 if there was the stuff listed above
cosmetics, cool, I love the game beat everything in master and got the Zenith. But the only bad is they give all the cool stuff to PC players and I was excited to get the cool cosmetics from a competition that some people won because they looked cool and stuff from the 1.4.3 update with the collab with Don't Starve â„¢ï¸ It would be a 5 if there was the stuff listed above
fun, super, Im sad i cant cross play with pc but 5 stars cuz it super fun
game, Amazing, Amazing game, it's hard enough to keep me occupied for hours without getting bored. There is a variety of things you can do in this game. There are soooo many items. And if have to be honest this game is better than Minecraft.
items, many, Amazing game, it's hard enough to keep me occupied for hours without getting bored. There is a variety of things you can do in this game. There are soooo many items. And if have to be honest this game is better than Minecraft.
game, Perfect, Perfect game
mode, hard, this game is really fun but when i defeated the boss wall of flesh it goes into hard mode and it just dosent load and even if it did work i wouldve allready lost two of the boss drops permanently
load, dosent, this game is really fun but when i defeated the boss wall of flesh it goes into hard mode and it just dosent load and even if it did work i wouldve allready lost two of the boss drops permanently
game, good, Very good game, I used to think it was bad and worse then Minecraft. But then, I actually played it with my brother, and then I thought it was way better then Minecraft. More boss battles, and building houses is very easy. Love the game (:
battles, More, Very good game, I used to think it was bad and worse then Minecraft. But then, I actually played it with my brother, and then I thought it was way better then Minecraft. More boss battles, and building houses is very easy. Love the game (:
fun, super, this game super fun but I wish that the dont starve update was also added for mobile because I dont have it for some reason
versions, other, Update: hardware configuration aside, found setting the controller scheme to advanced seems to put it in line with the other versions I've played - so here we go, let's begin the adventure! Will update to 5* if they add in saves to Google account / some cloud, for fluid gameplay between multiple devices.
gameplay, fluid, Update: hardware configuration aside, found setting the controller scheme to advanced seems to put it in line with the other versions I've played - so here we go, let's begin the adventure! Will update to 5* if they add in saves to Google account / some cloud, for fluid gameplay between multiple devices.
devices, multiple, Update: hardware configuration aside, found setting the controller scheme to advanced seems to put it in line with the other versions I've played - so here we go, let's begin the adventure! Will update to 5* if they add in saves to Google account / some cloud, for fluid gameplay between multiple devices.
game, Great, Great game even minecraft tells you to check this game out!
game, Best, Best game ever, it's a challenge so be readyðŸ’›ðŸŒ¹
game, Amazing, Amazing game I beat it a lot but when will it get the don't starve together update it would be like a new game alsoif y'all update again can you more don't starve bosses
alsoif, new, Amazing game I beat it a lot but when will it get the don't starve together update it would be like a new game alsoif y'all update again can you more don't starve bosses
game, good, Ok hear me out. Terraria is a good game just like minecraft... but now that i look at it terraria is better than minecraft. There is just so much to do so over all keep it up. Lmao
time, much, Male it easier to join and male a freinds list mabye it would save so much time
team, mobile, its ok! but the mobile team takes months for any versions to be finished. but atleast it's not years! like the previous (sorry if this insults you ðŸ™)
game, Best, Best game ever
mode, 3D, It will be better if I try 3D mode
games, best, One of the best games on mobile
game, Good, Good game best! But Please don't stop updating this game
game, best, one of the best game i have ever bug tip
NPCs, more, You guys should look at the "thorium mod" for this game and add all that stuff as an update! It would make this game so much better, add more NPCs and things to do and make it so you get more then 1 angler quest a day! Make it better
game, favorite, It is amazing and I love it. My favorite game by far.
times, good, HEY i beated moon lord master mode asa summoner and thx for the good times i had
game, good, I've been playing terraria for 7 years now, terraria is such a good game
years, many, I've played terraria for many years and it's been a really fun game,My only problem is that the PC version is 1.4.3 and has a bunch of items mobile doesnt because mobile is 1.4,But this is still an amazing game :)
game, fun, I've played terraria for many years and it's been a really fun game,My only problem is that the PC version is 1.4.3 and has a bunch of items mobile doesnt because mobile is 1.4,But this is still an amazing game :)
problem, only, I've played terraria for many years and it's been a really fun game,My only problem is that the PC version is 1.4.3 and has a bunch of items mobile doesnt because mobile is 1.4,But this is still an amazing game :)
game, amazing, I've played terraria for many years and it's been a really fun game,My only problem is that the PC version is 1.4.3 and has a bunch of items mobile doesnt because mobile is 1.4,But this is still an amazing game :)
game, Amazing, Amazing game
years, last, I'm changing my rating to 1 because of the last few years you still haven't worked on fixing your cloud save problem and don't deserve to be considered a good game. The loss of my dedicated worlds over countless devices makes me utterly hate this game.
