VERB, PREP, POBJ, 
go, with, game, You can never go wrong with a game from this developer.
play, for, fans, Best in the series. A must play for tower defense fans.
Uses, from, games, Uses same sounds from previous games, unfortunately, they do not fit the enemies. A bit sad, but plays like the others. Good game.
plays, like, others, Uses same sounds from previous games, unfortunately, they do not fit the enemies. A bit sad, but plays like the others. Good game.
got, in, phone, First game that I've got in my first android phone. Now I bought this game to feel the nostalgia again..
spent, on, game, Great game for the phone. I spent a lot time on this game, time i should have used better.
get, with, combo, This game need somw serious rebalance the archer upgrades are so strong that you get by with basically archer+barrack combo… the druid towers are the least useful as it start off weak, and most of the horde type minions has at least higher health or lite armor the splash damage dont make sense, the ones that are weak to physical damage also has such high health the slow and splash mechanics is basically useless…
doing, in, life, If you haven't played any Kingdom's Rush game, you're doing something wrong in your life
pay, for, game, Love the series. Would've had a higher rating if it weren't for the money grab. You pay for the game and just get the basics even if you grind really hard it'll take forever to purchase a top rank champion. I paid for the entire game let me experience the entire game.
paid, for, game, Love the series. Would've had a higher rating if it weren't for the money grab. You pay for the game and just get the basics even if you grind really hard it'll take forever to purchase a top rank champion. I paid for the entire game let me experience the entire game.
Reminds, of, guy, Another great installment in a great franchise. I'm using the tree hero and he's seems pretty strong. Reminds me of the bear guy from the first one.
Reminds, from, one, Another great installment in a great franchise. I'm using the tree hero and he's seems pretty strong. Reminds me of the bear guy from the first one.
live, to, expectations, Ah, I really wanted to like this game, but... it just wasn't my taste :/ I loved the original Kingdom Rush, so I'm pretty sad that this one didn't live up to my expectations. For some reason, the colours seem too garish, the stage layouts often look cluttered & confusing, and I'm not a huge fan of the towers in this version. But the dealbreaker for me has to be the amount of spiders 😭 The original had spiders too, but as an arachnophobe, the Mactans level was a nightmare. Couldn't finish it 😭
seem, For, reason, Ah, I really wanted to like this game, but... it just wasn't my taste :/ I loved the original Kingdom Rush, so I'm pretty sad that this one didn't live up to my expectations. For some reason, the colours seem too garish, the stage layouts often look cluttered & confusing, and I'm not a huge fan of the towers in this version. But the dealbreaker for me has to be the amount of spiders 😭 The original had spiders too, but as an arachnophobe, the Mactans level was a nightmare. Couldn't finish it 😭
paying, to, download, It seems every kingdom Rush game on Android is the same you only get half the experience after paying to download, the rest is locked via 60$+ to get the full experience the game itself is fun but this is not good for the consumer
locked, via, 60$+, It seems every kingdom Rush game on Android is the same you only get half the experience after paying to download, the rest is locked via 60$+ to get the full experience the game itself is fun but this is not good for the consumer
playing, for, decade, Great series, been playing these games for almost a decade
unlock, with, currency, Should have way to unlock hero with in-game currency
max, in, waves, KR series aren't fun at all. It's all about founding the right tower setup. You can't max upgrade your towers, just one or two in the last few waves. It's like they give us a machine gun with just 5 bullets. This is not a hard game, if you want to beat it just search for the right setup for each round. You won't have the ability to play with strategies, you will have to find THE ONE strategy and that's it.
give, with, bullets, KR series aren't fun at all. It's all about founding the right tower setup. You can't max upgrade your towers, just one or two in the last few waves. It's like they give us a machine gun with just 5 bullets. This is not a hard game, if you want to beat it just search for the right setup for each round. You won't have the ability to play with strategies, you will have to find THE ONE strategy and that's it.
search, for, setup, KR series aren't fun at all. It's all about founding the right tower setup. You can't max upgrade your towers, just one or two in the last few waves. It's like they give us a machine gun with just 5 bullets. This is not a hard game, if you want to beat it just search for the right setup for each round. You won't have the ability to play with strategies, you will have to find THE ONE strategy and that's it.
play, with, strategies, KR series aren't fun at all. It's all about founding the right tower setup. You can't max upgrade your towers, just one or two in the last few waves. It's like they give us a machine gun with just 5 bullets. This is not a hard game, if you want to beat it just search for the right setup for each round. You won't have the ability to play with strategies, you will have to find THE ONE strategy and that's it.
looking, for, challenge, supper fun, small game to pass the time. it can be easy or difficult to fit your mood of either killing time or looking for a real challenge. great mechanics. my only issue is since im using chrome book and an android app. i dont have any hot keys so i have to scroll but i am still able to beat all of Kingdom Rush on normal (3 stars) and challenges so it has really hinderd my fun with the game.
beat, on, stars, supper fun, small game to pass the time. it can be easy or difficult to fit your mood of either killing time or looking for a real challenge. great mechanics. my only issue is since im using chrome book and an android app. i dont have any hot keys so i have to scroll but i am still able to beat all of Kingdom Rush on normal (3 stars) and challenges so it has really hinderd my fun with the game.
hinderd, with, game, supper fun, small game to pass the time. it can be easy or difficult to fit your mood of either killing time or looking for a real challenge. great mechanics. my only issue is since im using chrome book and an android app. i dont have any hot keys so i have to scroll but i am still able to beat all of Kingdom Rush on normal (3 stars) and challenges so it has really hinderd my fun with the game.
thought, Of, games, Of all the kingdom rush games, i never thought this would be my favorite. Lilith does so good in combat
Played, in, past, One of my favourite games ever. Played it in the past, now I am playing it again. Never gets old.
keep, with, influx, Honestly I have loved playing kingdom rush. I just feel disappointed that at the extra levels they are too hard because I have only one hero so I can't keep up with the influx of enemies, my hero Mr A is tired from running to and frow! Anyways thank you for such a quality game, that is the only reason I rate it 4 stars.
thank, for, game, Honestly I have loved playing kingdom rush. I just feel disappointed that at the extra levels they are too hard because I have only one hero so I can't keep up with the influx of enemies, my hero Mr A is tired from running to and frow! Anyways thank you for such a quality game, that is the only reason I rate it 4 stars.
add, to, press, Great game but didn't like the addition of environmentals, all they did was add buttons to press while making the game feel a little more shallow
look, up, solution, Suffers from the same problem as most TD games; fail or restart levels repeatedly until you find the "correct" tower placement or look up the solution.
crashes, on, time, The game crashes on the first time I get 'only counts as one' achievement.
engaged, in, game, Good challenging fun, Have to stay engaged in the game or you will be overrun
crashed, on, Neverwonder, Just came here to say I crashed twice on lvl 10 Neverwonder. Oh, and I like the game.
replay, through, four, I love all the kingdom rush games, have since i found them freshman year. I replay through all four every six months or so. After about the fourth time doing this, i went through on black Friday and bought all of the heroes/towers in most of the games, but i left out origins for some reason. I wanted to buy the full hero pack, but haven't gotten any offers in the last couple weeks, even though I've checked every day. Is there any way i could gain access to that offer so i can support more?
went, After, time, I love all the kingdom rush games, have since i found them freshman year. I replay through all four every six months or so. After about the fourth time doing this, i went through on black Friday and bought all of the heroes/towers in most of the games, but i left out origins for some reason. I wanted to buy the full hero pack, but haven't gotten any offers in the last couple weeks, even though I've checked every day. Is there any way i could gain access to that offer so i can support more?
went, on, Friday, I love all the kingdom rush games, have since i found them freshman year. I replay through all four every six months or so. After about the fourth time doing this, i went through on black Friday and bought all of the heroes/towers in most of the games, but i left out origins for some reason. I wanted to buy the full hero pack, but haven't gotten any offers in the last couple weeks, even though I've checked every day. Is there any way i could gain access to that offer so i can support more?
bought, in, most, I love all the kingdom rush games, have since i found them freshman year. I replay through all four every six months or so. After about the fourth time doing this, i went through on black Friday and bought all of the heroes/towers in most of the games, but i left out origins for some reason. I wanted to buy the full hero pack, but haven't gotten any offers in the last couple weeks, even though I've checked every day. Is there any way i could gain access to that offer so i can support more?
left, for, reason, I love all the kingdom rush games, have since i found them freshman year. I replay through all four every six months or so. After about the fourth time doing this, i went through on black Friday and bought all of the heroes/towers in most of the games, but i left out origins for some reason. I wanted to buy the full hero pack, but haven't gotten any offers in the last couple weeks, even though I've checked every day. Is there any way i could gain access to that offer so i can support more?
gotten, in, weeks, I love all the kingdom rush games, have since i found them freshman year. I replay through all four every six months or so. After about the fourth time doing this, i went through on black Friday and bought all of the heroes/towers in most of the games, but i left out origins for some reason. I wanted to buy the full hero pack, but haven't gotten any offers in the last couple weeks, even though I've checked every day. Is there any way i could gain access to that offer so i can support more?
excells, at, dps, This is the wierdest kingdom rush, mages that fires 2 per shot, a MAGE that fires very fast but excells at single target dps, artillery that can stack 3 shots like the archmage and summons units, bladesingers that both excells at dealing damage and tanking despite its looks. Forest keepers which is only 2 units but is actually a support tower. Despite all of it its still high quality, i REALLY wonder where are the others in origins like blackburn, nivus, and the rest of the heroes in the series?
tanking, despite, looks, This is the wierdest kingdom rush, mages that fires 2 per shot, a MAGE that fires very fast but excells at single target dps, artillery that can stack 3 shots like the archmage and summons units, bladesingers that both excells at dealing damage and tanking despite its looks. Forest keepers which is only 2 units but is actually a support tower. Despite all of it its still high quality, i REALLY wonder where are the others in origins like blackburn, nivus, and the rest of the heroes in the series?
wonder, Despite, all, This is the wierdest kingdom rush, mages that fires 2 per shot, a MAGE that fires very fast but excells at single target dps, artillery that can stack 3 shots like the archmage and summons units, bladesingers that both excells at dealing damage and tanking despite its looks. Forest keepers which is only 2 units but is actually a support tower. Despite all of it its still high quality, i REALLY wonder where are the others in origins like blackburn, nivus, and the rest of the heroes in the series?
wonder, Despite, quality, This is the wierdest kingdom rush, mages that fires 2 per shot, a MAGE that fires very fast but excells at single target dps, artillery that can stack 3 shots like the archmage and summons units, bladesingers that both excells at dealing damage and tanking despite its looks. Forest keepers which is only 2 units but is actually a support tower. Despite all of it its still high quality, i REALLY wonder where are the others in origins like blackburn, nivus, and the rest of the heroes in the series?
asked, for, review, Fun so far but I've only played 3 levels. It asked for a review now though, so there it is.
pirchased, in, while, Asks sensitive personal data after pirchased in a while.
have, With, pass, In order to enjoy this game. You need the Google play pass. Because this version is miles harder than the other versions. With the pass you just have to grind and get upgrades because you will NEVER finish the harder levels without them. It's not possible and the developers know this. NOW... If you don't have the pass? STAY AWAY from this game at all costs! You will need to spend HUNDREDS if not THOUSANDS of dollars to complete this game on the harder levels. Pure BS GARBAGE. A money pit🖕🏿
finish, without, them, In order to enjoy this game. You need the Google play pass. Because this version is miles harder than the other versions. With the pass you just have to grind and get upgrades because you will NEVER finish the harder levels without them. It's not possible and the developers know this. NOW... If you don't have the pass? STAY AWAY from this game at all costs! You will need to spend HUNDREDS if not THOUSANDS of dollars to complete this game on the harder levels. Pure BS GARBAGE. A money pit🖕🏿
STAY, at, costs, In order to enjoy this game. You need the Google play pass. Because this version is miles harder than the other versions. With the pass you just have to grind and get upgrades because you will NEVER finish the harder levels without them. It's not possible and the developers know this. NOW... If you don't have the pass? STAY AWAY from this game at all costs! You will need to spend HUNDREDS if not THOUSANDS of dollars to complete this game on the harder levels. Pure BS GARBAGE. A money pit🖕🏿
complete, on, levels, In order to enjoy this game. You need the Google play pass. Because this version is miles harder than the other versions. With the pass you just have to grind and get upgrades because you will NEVER finish the harder levels without them. It's not possible and the developers know this. NOW... If you don't have the pass? STAY AWAY from this game at all costs! You will need to spend HUNDREDS if not THOUSANDS of dollars to complete this game on the harder levels. Pure BS GARBAGE. A money pit🖕🏿
did, for, PC, Great game, great series. In-app purchases ruin it though. Devs responded insisting it's balanced. In-app purchases inherently shift the balance of games to make them infuriating to play unless you pay up. Ironshide, please create an Android version without in-app purchases like you did for PC.
having, with, engine, Love this game. If you need help building levels let me now. I can see myself having alot of fun with your game engine and building wave after wave of fun!
having, after, wave, Love this game. If you need help building levels let me now. I can see myself having alot of fun with your game engine and building wave after wave of fun!
played, for, year, I've played for a year. This is one of the best mobile games! Donated for supporting.
stuck, in, level, It's a very good game, but I put 4 stars because if you're a noob on the game, there's not any way to get better, so u get stuck in a level and u can't continue
played, in, time, The kingdom rush series are the best mobile games I've played in a long time.
Fun, for, family, Fun for the whole family )
pay, for, anything-, Great tower defense strategy game. No need to pay for anything- sometimes need to use the strategy guide and play all aspects of each level but you can do it all. I want more of them!
introduced, in, story, Great game but new heroes should be introduced in the campaign story before they become available for purchase. Or alternatively buying new heroes should open up more campaign content made for the heroes. Over all a great game. Keep the game alive ironhide.
made, for, heroes, Great game but new heroes should be introduced in the campaign story before they become available for purchase. Or alternatively buying new heroes should open up more campaign content made for the heroes. Over all a great game. Keep the game alive ironhide.
looking, for, sequel, Love this game! I've been looking for a sequel since the original and am thrilled with it! No disappointments at all
looking, since, original, Love this game! I've been looking for a sequel since the original and am thrilled with it! No disappointments at all
thrilled, with, it, Love this game! I've been looking for a sequel since the original and am thrilled with it! No disappointments at all
compared, to, masterpiece, Kingdom Rush Vengeance is a greedy cash grab compared to this masterpiece
exist, in, PlayStore, It's one of the best games that exist in the PlayStore. I started out by playing Kingdom Rush, the free version. And I realized that the whole saga is worth buying. Also my congratulations for the developers, the game has very cute and cool graphics. It's an excellent game!
Thank, for, addiction, I spent a considerable amount of time playing these games growing up. Now I spend a concerning amount of time playing them now. Thank you for the most pleasant addiction.
gets, with, game, Just. Amazing, the kingdom rush franchise just gets better and better with each game (besides vengence) just like frontiers and normal ol' kingdom rush this delivers quite as well, if not better. Ironhide has a place in my heart as some of the best flash games I played back in the day and I can only hope they get better.
gets, like, frontiers, Just. Amazing, the kingdom rush franchise just gets better and better with each game (besides vengence) just like frontiers and normal ol' kingdom rush this delivers quite as well, if not better. Ironhide has a place in my heart as some of the best flash games I played back in the day and I can only hope they get better.
played, in, day, Just. Amazing, the kingdom rush franchise just gets better and better with each game (besides vengence) just like frontiers and normal ol' kingdom rush this delivers quite as well, if not better. Ironhide has a place in my heart as some of the best flash games I played back in the day and I can only hope they get better.
recommend, With, heros, Very fun game just like the others. With more free heros I recommend it
wait, for, heroes, I have played kingdom rush and frontiers and this one is awesome like all the others and can't wait for more heroes and I have a question in kingdom rush it was king denas now its prince denas what happened to him from king now a prince? Recent update screwed stuff up u can see stats for android idk about other devices
happened, to, him, I have played kingdom rush and frontiers and this one is awesome like all the others and can't wait for more heroes and I have a question in kingdom rush it was king denas now its prince denas what happened to him from king now a prince? Recent update screwed stuff up u can see stats for android idk about other devices
happened, from, king, I have played kingdom rush and frontiers and this one is awesome like all the others and can't wait for more heroes and I have a question in kingdom rush it was king denas now its prince denas what happened to him from king now a prince? Recent update screwed stuff up u can see stats for android idk about other devices
playing, for, year, I love this sieres ngl. This us Def the hardest game in the sieres. Been playing for a year and still can't get 3 stars on some normal levels. Kinda frustrating.
get, on, levels, I love this sieres ngl. This us Def the hardest game in the sieres. Been playing for a year and still can't get 3 stars on some normal levels. Kinda frustrating.
playing, for, long, Ive been playing for so long and i lpve to see it grow so much its been a blast for me these past few years thank you!
Reminds, of, plants, Very fun and challenging!! Reminds me of plants vs zombies, very fun game!!
carried, on, line, Fantastic game and carried on the kingdom rush line well
hooked, on, game, the game is addictive. i sought medical advice. The advice was that the medical professional was hooked on this game too, so advised to keep playing the saga
goes, for, games, Love the selection of hero's, same goes for all the KR games. They're very interesting and diverse. Wilbur is OP!
did, on, story, Just finished this game, what a great find! Devs did a great job on both story & game play, 5 stars :)
use, with, tons, The whole series is an absolute blast to play. Easily one of the most amazing and well made tower defence games out there. Each game has a distinct feel. There is replayability with difficulty increases and always an epic sense of accomplishment with each siege successfully defended. Multiple heroes to use (or buy) with tons of unique enemies. Great animations and slick graphics. Can keep you busy for hours.
messed, on, level, Great game as always the hyenas messed me up on the 3rd level tho
Love, from, start, Love the gameplay from the very start. Not just a tower defense, it also has RPG element and very attractive unit&hero development. And I won the game without buying any diamond. So, for the one who said it's a pay for win game, maybe you just need to hone your skill.
need, for, one, Love the gameplay from the very start. Not just a tower defense, it also has RPG element and very attractive unit&hero development. And I won the game without buying any diamond. So, for the one who said it's a pay for win game, maybe you just need to hone your skill.
came, across, game, Hello Ironhide I don't know if you'll see this but I just wanted to say you people are Flippin awesome I've been playing this game since I was five.The first time I came across this game was in the public library I saw my brother playing this on the public computer boy did I fall in love with the game 6 years and I'm still playing second thing I want to point out the special offers in this game are absolutely crazy I got two ridiculous offers in ten minutes anyways this game gets1,000,000/10 :)
playing, on, boy, Hello Ironhide I don't know if you'll see this but I just wanted to say you people are Flippin awesome I've been playing this game since I was five.The first time I came across this game was in the public library I saw my brother playing this on the public computer boy did I fall in love with the game 6 years and I'm still playing second thing I want to point out the special offers in this game are absolutely crazy I got two ridiculous offers in ten minutes anyways this game gets1,000,000/10 :)
fall, in, love, Hello Ironhide I don't know if you'll see this but I just wanted to say you people are Flippin awesome I've been playing this game since I was five.The first time I came across this game was in the public library I saw my brother playing this on the public computer boy did I fall in love with the game 6 years and I'm still playing second thing I want to point out the special offers in this game are absolutely crazy I got two ridiculous offers in ten minutes anyways this game gets1,000,000/10 :)
got, in, minutes, Hello Ironhide I don't know if you'll see this but I just wanted to say you people are Flippin awesome I've been playing this game since I was five.The first time I came across this game was in the public library I saw my brother playing this on the public computer boy did I fall in love with the game 6 years and I'm still playing second thing I want to point out the special offers in this game are absolutely crazy I got two ridiculous offers in ten minutes anyways this game gets1,000,000/10 :)
compared, to, rushes, Best game of the series imo. Pros: -Way more free heroes than in original game, -Graphics are definitely improved compared to other Kingdom rushes, -Very unique enemies, -Some actual story, -Great map events. Cons: -Isn't free (and this is a big con since it is a mobile game) -Doesn't take too long to finish a game. Even though there are challenges they're basically the same level with harder difficulty. Overall I'd rate this game 8/10
