NOUN, ADJ, 
game, mobile, It's an amazing game over-all. It took me over three months to fully see what the game had to offer, spending 4 to 7 hours on it a day. It's got enough secrets and gear to keep you captivated for a lifetime. However, there are many complications for multiplayer, especially for mobile. I actually came to the game page to try and download it onto my computer, only to have it not listed as an option. It really is too bad. I was really hoping to be able to upload my most played worlds my computer, so I'm not always trying to look into a tiny screen (which I fully understand is a given for mobile games). The point is, multiplayer's tricky; and cross-platform, forget about it. Other than that, easy 5 stars. Literally the best mobile game I've ever had the honor of owning.
game, Best, Best game I've ever played in a long time. Every aspect of this is amazing. It got me through the pandemic and I'm very greatful for that. Thanks game makersðŸ˜„ðŸ‘
time, long, Best game I've ever played in a long time. Every aspect of this is amazing. It got me through the pandemic and I'm very greatful for that. Thanks game makersðŸ˜„ðŸ‘
makers, Thanks, Best game I've ever played in a long time. Every aspect of this is amazing. It got me through the pandemic and I'm very greatful for that. Thanks game makersðŸ˜„ðŸ‘
port, Excellent, Excellent port for this game
update, new, We need the new update
game, good, This is a very good game but I am a bit sad how I couldn't save my data from my old phone to this, but still it allows me to do the challenge again
phone, old, This is a very good game but I am a bit sad how I couldn't save my data from my old phone to this, but still it allows me to do the challenge again
game, Great, Great game, put hundreds of hours into it. The bossfights are awesome, really well made and thought out. The controls are relatively good compared to other mobile games like this and my favorite thing a out it is getting all the weapons to fight the bosses.
games, other, Great game, put hundreds of hours into it. The bossfights are awesome, really well made and thought out. The controls are relatively good compared to other mobile games like this and my favorite thing a out it is getting all the weapons to fight the bosses.
games, mobile, Great game, put hundreds of hours into it. The bossfights are awesome, really well made and thought out. The controls are relatively good compared to other mobile games like this and my favorite thing a out it is getting all the weapons to fight the bosses.
thing, favorite, Great game, put hundreds of hours into it. The bossfights are awesome, really well made and thought out. The controls are relatively good compared to other mobile games like this and my favorite thing a out it is getting all the weapons to fight the bosses.
thing, only, I absolutely love the game.....but the only thing that made me leave one star on the game i love more than minecraft, is the fact that I used to be able to connect worlds with my brother, I have the Hotspot, he hosts, or visa versa; and it would work. We'd be able to connect worlds like that, and minecraft used to be that way too. But now they're both retarded because they updated and made it so you HAVE TO HAVE WIFI! So here's to another enjoyable game gone stupidðŸ¥‚
game, enjoyable, I absolutely love the game.....but the only thing that made me leave one star on the game i love more than minecraft, is the fact that I used to be able to connect worlds with my brother, I have the Hotspot, he hosts, or visa versa; and it would work. We'd be able to connect worlds like that, and minecraft used to be that way too. But now they're both retarded because they updated and made it so you HAVE TO HAVE WIFI! So here's to another enjoyable game gone stupidðŸ¥‚
game, Great, Great game not easy either its always fun
game, easy, Great game not easy either its always fun
game, favorite, prolly my favorite game ever. minecraft meets zelda meets super mario.
mario, super, prolly my favorite game ever. minecraft meets zelda meets super mario.
EXPERIENCE, BAD, DO NOT BUY SCAM!!!!!!!!! I just recently brought the game for 5 buck but for some reason It did not count it so now i loss 5 bucks and have no way of getting it back. BAD EXPERIENCE!!!!
masterpiece, rpg, this is an rpg sandbox masterpiece. thousands of items, over 25 bosses, and TONS of things to do. the only real complaint i have is the massive ui on this mobile version, makes it real hard to see.
complaint, only, this is an rpg sandbox masterpiece. thousands of items, over 25 bosses, and TONS of things to do. the only real complaint i have is the massive ui on this mobile version, makes it real hard to see.
complaint, real, this is an rpg sandbox masterpiece. thousands of items, over 25 bosses, and TONS of things to do. the only real complaint i have is the massive ui on this mobile version, makes it real hard to see.
ui, massive, this is an rpg sandbox masterpiece. thousands of items, over 25 bosses, and TONS of things to do. the only real complaint i have is the massive ui on this mobile version, makes it real hard to see.
version, mobile, this is an rpg sandbox masterpiece. thousands of items, over 25 bosses, and TONS of things to do. the only real complaint i have is the massive ui on this mobile version, makes it real hard to see.
game, Good, Good game but kinda hard to play on mobile
trips, long, Great for long road trips
game, only, This game was the only game I played on 2018---2021. PS the new update let me beat the game. It is worth the money.
update, new, This game was the only game I played on 2018---2021. PS the new update let me beat the game. It is worth the money.
game, fun, very fun game, been playing on 360 since 1.2.
ðŸ½, Amazing, AmazingðŸ™ŒðŸ½
games, best, One of the best 2D games I have played but I was very disappointed as my character deleted automatically, very vexing as I spent a lot of time on it .
patch, recent, Fixed all of my concerns with the most recent patch. Thanks! Edit - I'm not certain if this is new, but I don't see an option to connect to your Google Play account anymore, which means I can't access my old cloud saves...
cloud, old, Fixed all of my concerns with the most recent patch. Thanks! Edit - I'm not certain if this is new, but I don't see an option to connect to your Google Play account anymore, which means I can't access my old cloud saves...
game, Good, Good game
game, Best, Best game
bucks, Best, Best 3 bucks ive spent â¤ï¸
space, enough, I deleted you and it said it was enough space so i try and download then need more space
space, more, I deleted you and it said it was enough space so i try and download then need more space
game, perfect, Absolutely perfect game. You buy the game, and you get the WHOLE game, just like that. With the newer update on mobile, it's just so convenient, with everything at your fingertips.
update, newer, Absolutely perfect game. You buy the game, and you get the WHOLE game, just like that. With the newer update on mobile, it's just so convenient, with everything at your fingertips.
controls, different, Game plays just like the PC version, with different controls, it is a bit harder but its your Terraria on wheels, as a builder its hard to build, but with combat it becomes a bit more fun because of the increased difficulty and learning curve, get this if you want to experience the ultimate 2D sandbox game on your phone.
fun, more, Game plays just like the PC version, with different controls, it is a bit harder but its your Terraria on wheels, as a builder its hard to build, but with combat it becomes a bit more fun because of the increased difficulty and learning curve, get this if you want to experience the ultimate 2D sandbox game on your phone.
difficulty, increased, Game plays just like the PC version, with different controls, it is a bit harder but its your Terraria on wheels, as a builder its hard to build, but with combat it becomes a bit more fun because of the increased difficulty and learning curve, get this if you want to experience the ultimate 2D sandbox game on your phone.
game, ultimate, Game plays just like the PC version, with different controls, it is a bit harder but its your Terraria on wheels, as a builder its hard to build, but with combat it becomes a bit more fun because of the increased difficulty and learning curve, get this if you want to experience the ultimate 2D sandbox game on your phone.
game, Absolute, Absolute favorite game of all time
game, favorite, Absolute favorite game of all time
update, final, I love this game but I'm sad that the games come to its final update
games, rip, Super hard to control and not very interesting. This is worse than rip-off games
world, vast, Everyone should know about this game, as it's a gem. A vast world of options, creativity or adrenaline- you choose!
game, vary, It is a vary good game but I wish they would continue updating the game though
game, good, It is a vary good game but I wish they would continue updating the game though
depth, good, Berry good depth with random generated worlds
worlds, random, Berry good depth with random generated worlds
worlds, generated, Berry good depth with random generated worlds
game, Bad, Bad game wasted of money
game, good, It's a very good game but i can't summon a solar eclipse
eclipse, solar, It's a very good game but i can't summon a solar eclipse
game, best, Hands down one of the best game you can play on your mobile phone!
phone, mobile, Hands down one of the best game you can play on your mobile phone!
game, gud, It is a gud game
times, several, Game freezes several times while playing and it's not a phone issue, plenty of space and everything is up to date...I love the game and have played it off and on for 8 years...please look into the issue
game, wonderful, Thx for wonderful game) ðŸ’œðŸ’œðŸ’œ
game, great, It's a great game.
games, good, One of super good games like minecraft
bit, little, Fun game really cool sprites but a little bit challenging
game, Great, Great game
amd, balanced, Well balanced amd just an amazing game overall. Hours of fun have been sucked into this game and it has been helping me through hard times with all the content and replayability.
game, amazing, Well balanced amd just an amazing game overall. Hours of fun have been sucked into this game and it has been helping me through hard times with all the content and replayability.
times, hard, Well balanced amd just an amazing game overall. Hours of fun have been sucked into this game and it has been helping me through hard times with all the content and replayability.
game, Amazing, Amazing game would recommend it to anyone.
years, many, I have played the game since the beta and have thoroughly enjoyed it through my many years of playing the game and much more enjoy playing this than playing mine craft ( though I like minecraft don't attack me lol)
button, tutorial, Now I get why people quit because they are confused however there is a tutorial. if you go on settings you can see a tutorial toggle button. and on the top right you will see 3 buttons the the one on the left is a help button to figure out the controls btw the person you spawn with you gives help on what to do. If you are stuck then watch HappyDays on Youtube he does really good farms. Edit: forgot to say this but you can arrange your controls positon as well in settings.
right, top, Now I get why people quit because they are confused however there is a tutorial. if you go on settings you can see a tutorial toggle button. and on the top right you will see 3 buttons the the one on the left is a help button to figure out the controls btw the person you spawn with you gives help on what to do. If you are stuck then watch HappyDays on Youtube he does really good farms. Edit: forgot to say this but you can arrange your controls positon as well in settings.
farms, good, Now I get why people quit because they are confused however there is a tutorial. if you go on settings you can see a tutorial toggle button. and on the top right you will see 3 buttons the the one on the left is a help button to figure out the controls btw the person you spawn with you gives help on what to do. If you are stuck then watch HappyDays on Youtube he does really good farms. Edit: forgot to say this but you can arrange your controls positon as well in settings.
game, amazing, Still an amazing game, just wish it supported S-pen
games, best, Love the game. It's one of the best games I have ever played. I'm happy that they have the game on all devices just wished they had cross-play but other then that I love the game.
computer, bad, This is really exaggerating the gameplay is Soo fun its really good for people who have a bad computer the reason I give 4 stars is because you can't save data system in the game but this is a really good and fun game I definitely recommend it to all people who like this kind of games.
game, good, This is really exaggerating the gameplay is Soo fun its really good for people who have a bad computer the reason I give 4 stars is because you can't save data system in the game but this is a really good and fun game I definitely recommend it to all people who like this kind of games.
slime, fat, So fat King slime is
day, most, I love this game i play it most day
game, fun, Terraria is a fun game filled with things to do. There's a progression system, there's lots of cool vanity items for you to look awesome, weapons of all kinds ranging from handguns to cat-shooting swords. There's infinite things to build, pvp, tons of mobs, and different events that certain mobs can only spawn in. There's a whole world to explore and build in. There's NPC's that you can purchase and sell items from. There are mounts that can fly and do other things, and there are also pets.
items, cool, Terraria is a fun game filled with things to do. There's a progression system, there's lots of cool vanity items for you to look awesome, weapons of all kinds ranging from handguns to cat-shooting swords. There's infinite things to build, pvp, tons of mobs, and different events that certain mobs can only spawn in. There's a whole world to explore and build in. There's NPC's that you can purchase and sell items from. There are mounts that can fly and do other things, and there are also pets.
swords, shooting, Terraria is a fun game filled with things to do. There's a progression system, there's lots of cool vanity items for you to look awesome, weapons of all kinds ranging from handguns to cat-shooting swords. There's infinite things to build, pvp, tons of mobs, and different events that certain mobs can only spawn in. There's a whole world to explore and build in. There's NPC's that you can purchase and sell items from. There are mounts that can fly and do other things, and there are also pets.
things, infinite, Terraria is a fun game filled with things to do. There's a progression system, there's lots of cool vanity items for you to look awesome, weapons of all kinds ranging from handguns to cat-shooting swords. There's infinite things to build, pvp, tons of mobs, and different events that certain mobs can only spawn in. There's a whole world to explore and build in. There's NPC's that you can purchase and sell items from. There are mounts that can fly and do other things, and there are also pets.
events, different, Terraria is a fun game filled with things to do. There's a progression system, there's lots of cool vanity items for you to look awesome, weapons of all kinds ranging from handguns to cat-shooting swords. There's infinite things to build, pvp, tons of mobs, and different events that certain mobs can only spawn in. There's a whole world to explore and build in. There's NPC's that you can purchase and sell items from. There are mounts that can fly and do other things, and there are also pets.
mobs, certain, Terraria is a fun game filled with things to do. There's a progression system, there's lots of cool vanity items for you to look awesome, weapons of all kinds ranging from handguns to cat-shooting swords. There's infinite things to build, pvp, tons of mobs, and different events that certain mobs can only spawn in. There's a whole world to explore and build in. There's NPC's that you can purchase and sell items from. There are mounts that can fly and do other things, and there are also pets.
world, whole, Terraria is a fun game filled with things to do. There's a progression system, there's lots of cool vanity items for you to look awesome, weapons of all kinds ranging from handguns to cat-shooting swords. There's infinite things to build, pvp, tons of mobs, and different events that certain mobs can only spawn in. There's a whole world to explore and build in. There's NPC's that you can purchase and sell items from. There are mounts that can fly and do other things, and there are also pets.
things, other, Terraria is a fun game filled with things to do. There's a progression system, there's lots of cool vanity items for you to look awesome, weapons of all kinds ranging from handguns to cat-shooting swords. There's infinite things to build, pvp, tons of mobs, and different events that certain mobs can only spawn in. There's a whole world to explore and build in. There's NPC's that you can purchase and sell items from. There are mounts that can fly and do other things, and there are also pets.
adventure, Good, Good adventure and easy to god modeðŸ˜„ðŸ‘
game, Awesome, Awesome game when playing it but now it says you need to purchase game to continue but I did buy it
devices, mobile, 1.4 is terrible on mobile devices but great on Xbox
game, cool, Very cool game no bugs
controls, same, You should have the option to keep the same controls than before, attacking is very difficult and moving in general is.
game, funnest, I honestly love this game! There are hundreds of critters and monsters to discover, and there are over 30 bosses to defeat. This is the funnest game I've had in months.
reviews, bad, Stop looking at the bad reviews an get the game already
wifi, different, How do you play with friends from different wifi??
game, Nice, Nice game
game, great, It a great game I love all the stuf you can do but the controls are weird but it one of the best mobile game .ðŸ˜„
game, best, It a great game I love all the stuf you can do but the controls are weird but it one of the best mobile game .ðŸ˜„
game, mobile, It a great game I love all the stuf you can do but the controls are weird but it one of the best mobile game .ðŸ˜„
games, favorite, One of my all time favorite games, ive baught it on pretty much every console/device i can 10/10
game, fun, Really fun game once you figure it out you can make all kinds of things that you can think of and the overall game play is really fun and it never gets old I probably play this game every day. The only problem is I have already blessed my world with mythrl an I have not found a single piece I have created several world and blessed it with the ore but for some reason i can't seem find any
play, overall, Really fun game once you figure it out you can make all kinds of things that you can think of and the overall game play is really fun and it never gets old I probably play this game every day. The only problem is I have already blessed my world with mythrl an I have not found a single piece I have created several world and blessed it with the ore but for some reason i can't seem find any
problem, only, Really fun game once you figure it out you can make all kinds of things that you can think of and the overall game play is really fun and it never gets old I probably play this game every day. The only problem is I have already blessed my world with mythrl an I have not found a single piece I have created several world and blessed it with the ore but for some reason i can't seem find any
piece, single, Really fun game once you figure it out you can make all kinds of things that you can think of and the overall game play is really fun and it never gets old I probably play this game every day. The only problem is I have already blessed my world with mythrl an I have not found a single piece I have created several world and blessed it with the ore but for some reason i can't seem find any
world, several, Really fun game once you figure it out you can make all kinds of things that you can think of and the overall game play is really fun and it never gets old I probably play this game every day. The only problem is I have already blessed my world with mythrl an I have not found a single piece I have created several world and blessed it with the ore but for some reason i can't seem find any
game, Great, Great game
menu, main, Won't load past main menu
game, Good, Good game and you need zero tier to play multiplayer stop whining or go to discord
phone, previous, I absolutely love the game, but I there any way I can carry on with my character and progress I made on my previous phone or do I have to start all over again?
game, favorite, This is my favorite game ever
terraria, cracked, can someone help me i updated to android 11 then my cracked terraria accidentally dissapeared now i bought it but i cant download it
one, current, Love the game. Just hate the controls. Miss one which were over 1.2.4. Sadly current one's ain't worth it.
content, more, I think it could do with more content
device, slow, It is the best...still is. Now for the downside.I have uninstall this game because of slow device.But now I do have a good device I tried downloading it today 18/10/2021 but it can't seem to install it.Even tried all modded version but all of them fail to install. Please I urge you to fix this at the next update.
device, good, It is the best...still is. Now for the downside.I have uninstall this game because of slow device.But now I do have a good device I tried downloading it today 18/10/2021 but it can't seem to install it.Even tried all modded version but all of them fail to install. Please I urge you to fix this at the next update.
version, modded, It is the best...still is. Now for the downside.I have uninstall this game because of slow device.But now I do have a good device I tried downloading it today 18/10/2021 but it can't seem to install it.Even tried all modded version but all of them fail to install. Please I urge you to fix this at the next update.
update, next, It is the best...still is. Now for the downside.I have uninstall this game because of slow device.But now I do have a good device I tried downloading it today 18/10/2021 but it can't seem to install it.Even tried all modded version but all of them fail to install. Please I urge you to fix this at the next update.
game, good, Its a very good game 5/5 would reccomend
game, creative, Pretty good. If your super creative this game might be for you...
game, Best, Best game of my life but update is coming out in July! â˜ºâ˜ºâ˜ºâ˜ºâ˜ºâ˜ºâ˜ºâ˜ºâ˜ºâ˜ºðŸ˜„ðŸ˜„ðŸ˜„ðŸ˜„ðŸ˜„ðŸ˜„ðŸ˜„ðŸ˜„ðŸ˜„ðŸ˜„ðŸ˜„ðŸ˜„ðŸ˜„ðŸ˜„ðŸ˜„ðŸ˜„ it didn't come out for 4 years why just why
ðŸ˜„, ðŸ˜„, Best game of my life but update is coming out in July! â˜ºâ˜ºâ˜ºâ˜ºâ˜ºâ˜ºâ˜ºâ˜ºâ˜ºâ˜ºðŸ˜„ðŸ˜„ðŸ˜„ðŸ˜„ðŸ˜„ðŸ˜„ðŸ˜„ðŸ˜„ðŸ˜„ðŸ˜„ðŸ˜„ðŸ˜„ðŸ˜„ðŸ˜„ðŸ˜„ðŸ˜„ it didn't come out for 4 years why just why
ðŸ˜„, ðŸ˜„, Best game of my life but update is coming out in July! â˜ºâ˜ºâ˜ºâ˜ºâ˜ºâ˜ºâ˜ºâ˜ºâ˜ºâ˜ºðŸ˜„ðŸ˜„ðŸ˜„ðŸ˜„ðŸ˜„ðŸ˜„ðŸ˜„ðŸ˜„ðŸ˜„ðŸ˜„ðŸ˜„ðŸ˜„ðŸ˜„ðŸ˜„ðŸ˜„ðŸ˜„ it didn't come out for 4 years why just why
ðŸ˜„, ðŸ˜„, Best game of my life but update is coming out in July! â˜ºâ˜ºâ˜ºâ˜ºâ˜ºâ˜ºâ˜ºâ˜ºâ˜ºâ˜ºðŸ˜„ðŸ˜„ðŸ˜„ðŸ˜„ðŸ˜„ðŸ˜„ðŸ˜„ðŸ˜„ðŸ˜„ðŸ˜„ðŸ˜„ðŸ˜„ðŸ˜„ðŸ˜„ðŸ˜„ðŸ˜„ it didn't come out for 4 years why just why
ðŸ˜„, ðŸ˜„, Best game of my life but update is coming out in July! â˜ºâ˜ºâ˜ºâ˜ºâ˜ºâ˜ºâ˜ºâ˜ºâ˜ºâ˜ºðŸ˜„ðŸ˜„ðŸ˜„ðŸ˜„ðŸ˜„ðŸ˜„ðŸ˜„ðŸ˜„ðŸ˜„ðŸ˜„ðŸ˜„ðŸ˜„ðŸ˜„ðŸ˜„ðŸ˜„ðŸ˜„ it didn't come out for 4 years why just why
ðŸ˜„, ðŸ˜„, Best game of my life but update is coming out in July! â˜ºâ˜ºâ˜ºâ˜ºâ˜ºâ˜ºâ˜ºâ˜ºâ˜ºâ˜ºðŸ˜„ðŸ˜„ðŸ˜„ðŸ˜„ðŸ˜„ðŸ˜„ðŸ˜„ðŸ˜„ðŸ˜„ðŸ˜„ðŸ˜„ðŸ˜„ðŸ˜„ðŸ˜„ðŸ˜„ðŸ˜„ it didn't come out for 4 years why just why
ðŸ˜„, ðŸ˜„, Best game of my life but update is coming out in July! â˜ºâ˜ºâ˜ºâ˜ºâ˜ºâ˜ºâ˜ºâ˜ºâ˜ºâ˜ºðŸ˜„ðŸ˜„ðŸ˜„ðŸ˜„ðŸ˜„ðŸ˜„ðŸ˜„ðŸ˜„ðŸ˜„ðŸ˜„ðŸ˜„ðŸ˜„ðŸ˜„ðŸ˜„ðŸ˜„ðŸ˜„ it didn't come out for 4 years why just why
ðŸ˜„, ðŸ˜„, Best game of my life but update is coming out in July! â˜ºâ˜ºâ˜ºâ˜ºâ˜ºâ˜ºâ˜ºâ˜ºâ˜ºâ˜ºðŸ˜„ðŸ˜„ðŸ˜„ðŸ˜„ðŸ˜„ðŸ˜„ðŸ˜„ðŸ˜„ðŸ˜„ðŸ˜„ðŸ˜„ðŸ˜„ðŸ˜„ðŸ˜„ðŸ˜„ðŸ˜„ it didn't come out for 4 years why just why
ðŸ˜„, ðŸ˜„, Best game of my life but update is coming out in July! â˜ºâ˜ºâ˜ºâ˜ºâ˜ºâ˜ºâ˜ºâ˜ºâ˜ºâ˜ºðŸ˜„ðŸ˜„ðŸ˜„ðŸ˜„ðŸ˜„ðŸ˜„ðŸ˜„ðŸ˜„ðŸ˜„ðŸ˜„ðŸ˜„ðŸ˜„ðŸ˜„ðŸ˜„ðŸ˜„ðŸ˜„ it didn't come out for 4 years why just why
