VERB, PREP, POBJ, 
get, past, %, I can't get past 40% on the first level. I try to calibrate it and it won't do it. I try and tap to the rythm and it says let's just go with the original game settings and won't calibrate. I try and tap to the rhythm and it won't do it. If I follow it visually I can get to 40% of the first level but then I am not taping in rythm to the music at all I am just following the visual squares so I don't die. I can not get past 40% on the first level. This game is impossible. Don't waste your time.
get, on, level, I can't get past 40% on the first level. I try to calibrate it and it won't do it. I try and tap to the rythm and it says let's just go with the original game settings and won't calibrate. I try and tap to the rhythm and it won't do it. If I follow it visually I can get to 40% of the first level but then I am not taping in rythm to the music at all I am just following the visual squares so I don't die. I can not get past 40% on the first level. This game is impossible. Don't waste your time.
Works, for, musicians, Very simple nice and at the same time challenging game. Works great for musicians.
freaking, at, level, Nice and freaking challanging at some level. But it will be 5 star if dev make a checkpoint every 20%-30% of the progress. It's frustrating to repeat the whole song when it come to a miss/late tapping at 90% or above. Hope dev can fix this on the next update. Realy love this game anyway.
come, to, miss, Nice and freaking challanging at some level. But it will be 5 star if dev make a checkpoint every 20%-30% of the progress. It's frustrating to repeat the whole song when it come to a miss/late tapping at 90% or above. Hope dev can fix this on the next update. Realy love this game anyway.
come, to, tapping, Nice and freaking challanging at some level. But it will be 5 star if dev make a checkpoint every 20%-30% of the progress. It's frustrating to repeat the whole song when it come to a miss/late tapping at 90% or above. Hope dev can fix this on the next update. Realy love this game anyway.
tapping, at, %, Nice and freaking challanging at some level. But it will be 5 star if dev make a checkpoint every 20%-30% of the progress. It's frustrating to repeat the whole song when it come to a miss/late tapping at 90% or above. Hope dev can fix this on the next update. Realy love this game anyway.
fix, on, update, Nice and freaking challanging at some level. But it will be 5 star if dev make a checkpoint every 20%-30% of the progress. It's frustrating to repeat the whole song when it come to a miss/late tapping at 90% or above. Hope dev can fix this on the next update. Realy love this game anyway.
saw, on, media, Phew! I first thought it was simple when I saw it on social media where influencer plays it, it looks real simple! But after I downloaded it, and experienced, it was extremely interesting and unexpectedly hard. For me, it really is an interesting game and helps you to get the beat well. I highly recommend playing this game!
played, by, that, It's the best game that I ever played its worth by
comes, to, version, Nice game! Played PC version before! Now comes to phone version as my keyboard is spoiling!
used, in, games, An excellent rhythm game that helps build muscle memory used in most rhythm games. Highly suggest to any new or even skilled players of rhythm games.
suggest, to, players, An excellent rhythm game that helps build muscle memory used in most rhythm games. Highly suggest to any new or even skilled players of rhythm games.
buy, on, steam, Very epic. Game made well. Will buy on steam
followed, on, pc, Love it, have followed on pc and found out there was mobile
getting, into, genre, This game is really fun! It's the perfect pocket rhythm game when games like Phigros and DEEMO are getting a tad boring, and also perfect for people just getting into the rhythm game genre.. I've personally been playing this game competitively on speedrun leaderboards but it's also a nice game to just relax and play when you're bored or just feel like tapping your screen to the rhythm
playing, on, leaderboards, This game is really fun! It's the perfect pocket rhythm game when games like Phigros and DEEMO are getting a tad boring, and also perfect for people just getting into the rhythm game genre.. I've personally been playing this game competitively on speedrun leaderboards but it's also a nice game to just relax and play when you're bored or just feel like tapping your screen to the rhythm
tapping, to, rhythm, This game is really fun! It's the perfect pocket rhythm game when games like Phigros and DEEMO are getting a tad boring, and also perfect for people just getting into the rhythm game genre.. I've personally been playing this game competitively on speedrun leaderboards but it's also a nice game to just relax and play when you're bored or just feel like tapping your screen to the rhythm
love, on, computer, I love this game on computer!! Phone version is awesome! But add more bonus levels!!
get, into, game, The game is simple, it may not look that interesting until you actually play it, which totally blew my mind when I did. How hard could a game with 2 orbs spinning around be? It starts off easy to get players into the game, but the final stages especially the challenges are very difficult. Amazing high quality music and aesthetic level design. As a person who has been playing rhythm games for years, I would say it's one of the best rhythm games out there! Overall, spectacular game!
playing, for, years, The game is simple, it may not look that interesting until you actually play it, which totally blew my mind when I did. How hard could a game with 2 orbs spinning around be? It starts off easy to get players into the game, but the final stages especially the challenges are very difficult. Amazing high quality music and aesthetic level design. As a person who has been playing rhythm games for years, I would say it's one of the best rhythm games out there! Overall, spectacular game!
say, As, person, The game is simple, it may not look that interesting until you actually play it, which totally blew my mind when I did. How hard could a game with 2 orbs spinning around be? It starts off easy to get players into the game, but the final stages especially the challenges are very difficult. Amazing high quality music and aesthetic level design. As a person who has been playing rhythm games for years, I would say it's one of the best rhythm games out there! Overall, spectacular game!
continue, on, level, Why It only shows black screen when i opened it? I want to continue on level 4 after playing the demo on browser.plss fix it. Thank you
playing, on, browser.plss, Why It only shows black screen when i opened it? I want to continue on level 4 after playing the demo on browser.plss fix it. Thank you
did, in, day, Captures the same "lightning in a bottle" that geometry dash did back in the day.
loved, on, pc, loved it on pc, amazing its on mobile too
amazing, on, mobile, loved it on pc, amazing its on mobile too
play, on, break, Love the game, it has some good beat and is great to play on a break.
make, like, account, I LOVED IT, it gets my adrenaline pumping because of how ridicoulusly fun it is. I'm considering to purchase the PC version so I can play the custom levels too as I've finished this mobile version. I just think maybe it'd be nice if there was also custom levels like in PC and/or if there's an option to make like an account to link it with the PC version too. The bad reviews here are all ridiculous, because you can recallibrate and I can play Heracles blindfolded so it's not too hard either.
link, with, version, I LOVED IT, it gets my adrenaline pumping because of how ridicoulusly fun it is. I'm considering to purchase the PC version so I can play the custom levels too as I've finished this mobile version. I just think maybe it'd be nice if there was also custom levels like in PC and/or if there's an option to make like an account to link it with the PC version too. The bad reviews here are all ridiculous, because you can recallibrate and I can play Heracles blindfolded so it's not too hard either.
Played, on, PC, Played this on PC first, this game is amazing XD
say, As, years, As someone w/ years of general Rhythm Game playing and high level Mania 4k and CH experience, I can confidently say this is an amazingly put together rhythm game. The music is all original (and very high quality) and it's simple to learn, while also having an astronomical skill ceiling. My only real issue is that touch inputs on phones are notoriously laggy (usually 200ms+) which can make the game very awkward to adjust to at first, as you often need to tap a frame or 2 earlier than you'd think.
say, As, Mania, As someone w/ years of general Rhythm Game playing and high level Mania 4k and CH experience, I can confidently say this is an amazingly put together rhythm game. The music is all original (and very high quality) and it's simple to learn, while also having an astronomical skill ceiling. My only real issue is that touch inputs on phones are notoriously laggy (usually 200ms+) which can make the game very awkward to adjust to at first, as you often need to tap a frame or 2 earlier than you'd think.
inputs, on, phones, As someone w/ years of general Rhythm Game playing and high level Mania 4k and CH experience, I can confidently say this is an amazingly put together rhythm game. The music is all original (and very high quality) and it's simple to learn, while also having an astronomical skill ceiling. My only real issue is that touch inputs on phones are notoriously laggy (usually 200ms+) which can make the game very awkward to adjust to at first, as you often need to tap a frame or 2 earlier than you'd think.
playing, for, time, amazing rithm game, it's like playing gd for the firt time again
Bought, on, PC, Bought it on PC and played it there for about an hour or so first, bought it here next just so I can play it on the go. Deceptively difficult, with a low barrier to entry, this is a very fun rhythm game that I'll be burning many hours on!
played, for, hour, Bought it on PC and played it there for about an hour or so first, bought it here next just so I can play it on the go. Deceptively difficult, with a low barrier to entry, this is a very fun rhythm game that I'll be burning many hours on!
play, on, go, Bought it on PC and played it there for about an hour or so first, bought it here next just so I can play it on the go. Deceptively difficult, with a low barrier to entry, this is a very fun rhythm game that I'll be burning many hours on!
works, on, mobile, This a really cool and simple beat game that works great on mobile.
progress, from, world, Awesome work! Gets extremely harder when we progress from one world to next, so it would be good if you could add more levels in each world.
progress, to, next, Awesome work! Gets extremely harder when we progress from one world to next, so it would be good if you could add more levels in each world.
found, on, tiktok, This is by far one of my favorite rhythm games. I found it on tiktok, bought it on steam and now I'm on the phone. Even my 4 yr old and 6 yr old are addicted.
bought, on, steam, This is by far one of my favorite rhythm games. I found it on tiktok, bought it on steam and now I'm on the phone. Even my 4 yr old and 6 yr old are addicted.
get, on, version, You dont get guidance for invisible tiles like on the steam version but it's still a really fun game! Correction: just turn the graphics up 😅
Dude, like, this, Dude like this is awesome
addicted, to, game, I have never gotten so addicted to a mobile game before.
lacking, in, game, This game is great. For me, the only thing lacking in this game is saving progress online, custom level and custom songs. I wish this game had an account to be able to save progress online.
saving, For, me, This game is great. For me, the only thing lacking in this game is saving progress online, custom level and custom songs. I wish this game had an account to be able to save progress online.
Have, on, Steam, Have this also on Steam. It's rythm game, I like rythm games.
lacking, in, this, Updated Review as the problem was solved. A dance of fire and ice is honestly a game one should get if they even have a little bit of intrest in rhythm games. The only thing lacking in this, is custom songs but that's not really needed to enjoy the game fully. Beautiful sound and design
done, with, level, Very good game! The first 5 worlds are quite fun and have just the right amount of challenge, and the extra's level was extremely difficult but had checkpoints every 15-25%, which was extremely nice! And then world 6 happened. I have over 50 tries on world 6 alone, and I'm not even past 30% done with the final level of that. What ever happened to the steady difficulty curve? And it only gets harder from there. If there was an option to have checkpoints every 20% that would be extremely helpful.
happened, to, curve, Very good game! The first 5 worlds are quite fun and have just the right amount of challenge, and the extra's level was extremely difficult but had checkpoints every 15-25%, which was extremely nice! And then world 6 happened. I have over 50 tries on world 6 alone, and I'm not even past 30% done with the final level of that. What ever happened to the steady difficulty curve? And it only gets harder from there. If there was an option to have checkpoints every 20% that would be extremely helpful.
work, despite, input, Fun game, but the audio calibration for my headphones doesn't work despite vert consistent input from my end, so I can only use it without headphone.
use, without, headphone, Fun game, but the audio calibration for my headphones doesn't work despite vert consistent input from my end, so I can only use it without headphone.
registered, in, time, Not sure if its the game or my device, but there are quite a bit of taps not being registered in time or at all. Aside from that, this is fun as hell and challenging
satisfying, in, moment, Very fun and feels satisfying in the moment and after
had, for, day, I've only had the game for a day and already love it. It is pretty challenging and a ton of fun
Had, with, calibration, It's a blast! Had a bit of trouble with the calibration, but once I got the time on sync it became a way better experience
saw, on, tiktok, I love it. I saw it on tiktok and bought it. I enjoy it overall but I'm kinda disappointed that there aren't any checkpoints, especially on longer levels.
are, on, levels, I love it. I saw it on tiktok and bought it. I enjoy it overall but I'm kinda disappointed that there aren't any checkpoints, especially on longer levels.
found, through, tiktok, Honestly, found this game through a tiktok showing it played on PC. Blew my mind I had to try it. It really rewrites how you mind thinks about matching rhythm in a good way!
played, on, PC, Honestly, found this game through a tiktok showing it played on PC. Blew my mind I had to try it. It really rewrites how you mind thinks about matching rhythm in a good way!
matching, in, way, Honestly, found this game through a tiktok showing it played on PC. Blew my mind I had to try it. It really rewrites how you mind thinks about matching rhythm in a good way!
done, w, levels, Takes a second to get used to but its pretty simple, downloaded like a week ago and im done w all the levels already. Beats are very good especially 11 and 12. Cant wait for more levels
wait, for, levels, Takes a second to get used to but its pretty simple, downloaded like a week ago and im done w all the levels already. Beats are very good especially 11 and 12. Cant wait for more levels
needed, in, opinion, This game is very good for the most part, there are a few things needed in my opinion, such as a practice mode as if you keep messing up on one part at the end of a long sequence you have to redo the entire song just to mess up again.
messing, on, part, This game is very good for the most part, there are a few things needed in my opinion, such as a practice mode as if you keep messing up on one part at the end of a long sequence you have to redo the entire song just to mess up again.
messing, at, end, This game is very good for the most part, there are a few things needed in my opinion, such as a practice mode as if you keep messing up on one part at the end of a long sequence you have to redo the entire song just to mess up again.
own, on, pc, I absolutely love this game, I own it on pc and then bought this for when bored at work, took a bit of time calibrating to phone response time but love it
bored, at, work, I absolutely love this game, I own it on pc and then bought this for when bored at work, took a bit of time calibrating to phone response time but love it
calibrating, to, time, I absolutely love this game, I own it on pc and then bought this for when bored at work, took a bit of time calibrating to phone response time but love it
take, to, stars, I think this is a great game! I notice I have to calibrate kinda often while having a session but I don't mind that too much. What would take it to 5 stars for me is maybe a built in screen recorder because I'd love to share my perfect runs with my friends!
built, in, recorder, I think this is a great game! I notice I have to calibrate kinda often while having a session but I don't mind that too much. What would take it to 5 stars for me is maybe a built in screen recorder because I'd love to share my perfect runs with my friends!
throw, across, room, While this game has made me throw my phone across my room several times, I have to agree that it's really fun and addictive. I think the 2 dollars were worth it! Update: When I tried to play this game three days after downloading it the screen was just black even though I closed it and reopened it about five times. When I uninstalled it then reinstalled it, my entirw progress was deleted and I had to start over. I didnt really mind as I still liked the game but the screen turned black again.
hate, in, few, Honestly terrible if you ask me, you only get to calibrate once so if you mess it up may as well kiss this game goodbye. Also, I honestly hate how the screen transitions so suddenly in a few of the songs. Mainly in the final song of world two. I am frustrated beyond belief since I've been stuck on world 2's final song for maybe 30 minutes now. I think I'll just stick to a steam rythm game instead.
frustrated, beyond, belief, Honestly terrible if you ask me, you only get to calibrate once so if you mess it up may as well kiss this game goodbye. Also, I honestly hate how the screen transitions so suddenly in a few of the songs. Mainly in the final song of world two. I am frustrated beyond belief since I've been stuck on world 2's final song for maybe 30 minutes now. I think I'll just stick to a steam rythm game instead.
stuck, on, song, Honestly terrible if you ask me, you only get to calibrate once so if you mess it up may as well kiss this game goodbye. Also, I honestly hate how the screen transitions so suddenly in a few of the songs. Mainly in the final song of world two. I am frustrated beyond belief since I've been stuck on world 2's final song for maybe 30 minutes now. I think I'll just stick to a steam rythm game instead.
stick, to, game, Honestly terrible if you ask me, you only get to calibrate once so if you mess it up may as well kiss this game goodbye. Also, I honestly hate how the screen transitions so suddenly in a few of the songs. Mainly in the final song of world two. I am frustrated beyond belief since I've been stuck on world 2's final song for maybe 30 minutes now. I think I'll just stick to a steam rythm game instead.
struggled, with, one, I struggled with the 3rd one
take, to, 5, Great game play but there are tiny little features missing that can make it frustrating to play. Checkpoints for longer stages and a practice mode would take this to a 5 for sure. It's annoying to keep messing up on a key part late in a long stage
messing, on, part, Great game play but there are tiny little features missing that can make it frustrating to play. Checkpoints for longer stages and a practice mode would take this to a 5 for sure. It's annoying to keep messing up on a key part late in a long stage
messing, in, stage, Great game play but there are tiny little features missing that can make it frustrating to play. Checkpoints for longer stages and a practice mode would take this to a 5 for sure. It's annoying to keep messing up on a key part late in a long stage
makes, On, Android, Dope game! Such a simple and awesome concept! Missing OSU! On Android and this makes up for it
makes, for, it, Dope game! Such a simple and awesome concept! Missing OSU! On Android and this makes up for it
Saw, on, tiktok, Saw this one on tiktok and instantly had to buy it! Could be less then a dollar maybe
play, in, levels, The game is really good and looks fun to play especially in later levels but the HUGE issue I'm having is that I can't calibrate it. If I try calibrating it then the whole game is offbeat by a whole note and just won't let me have it any other way, I can play it on the notes if I keep the default calibration but then the problem is that I have to click just a little off beat every time if I wanna be able to play at all. Please fix this or tell me how to, I r e a l l y wanna play
play, on, notes, The game is really good and looks fun to play especially in later levels but the HUGE issue I'm having is that I can't calibrate it. If I try calibrating it then the whole game is offbeat by a whole note and just won't let me have it any other way, I can play it on the notes if I keep the default calibration but then the problem is that I have to click just a little off beat every time if I wanna be able to play at all. Please fix this or tell me how to, I r e a l l y wanna play
played, in, while, Best rhythm game I've played in a while.
saw, on, stream, Definitely worth checking out! I saw this game on a stream and was very happy to know it was available on mobile as well
recommend, for, kids, This is the best rhythm game I ever bought it but I'm not recommend for kids under 10 because it has a super extreme gameplay very nice game :D
recommend, under, 10, This is the best rhythm game I ever bought it but I'm not recommend for kids under 10 because it has a super extreme gameplay very nice game :D
play, unlike, lot, unlike a lot of rythym games, because of the calibration, i actually can play to the beat. most of the older games are off by a few seconds, but this one is amazingly accurate
play, because, calibration, unlike a lot of rythym games, because of the calibration, i actually can play to the beat. most of the older games are off by a few seconds, but this one is amazingly accurate
play, to, beat, unlike a lot of rythym games, because of the calibration, i actually can play to the beat. most of the older games are off by a few seconds, but this one is amazingly accurate
give, on, difficulty, 8 hours deep now and I love the pain! Stages 3 & 6 give a bad impression on the difficulty by being overly long and uninteresting musically, but 7-11 are some of the finest pieces of rhythm gaming I've played in years. The jazzier, off-tempo instrumentals lend themselves really well to the tile-based system, with the bass drum on later electronic tracks driving behind every note tapped. It really builds into a fantastic game. Don't let 6-X ruin that!
played, in, years, 8 hours deep now and I love the pain! Stages 3 & 6 give a bad impression on the difficulty by being overly long and uninteresting musically, but 7-11 are some of the finest pieces of rhythm gaming I've played in years. The jazzier, off-tempo instrumentals lend themselves really well to the tile-based system, with the bass drum on later electronic tracks driving behind every note tapped. It really builds into a fantastic game. Don't let 6-X ruin that!
lend, to, system, 8 hours deep now and I love the pain! Stages 3 & 6 give a bad impression on the difficulty by being overly long and uninteresting musically, but 7-11 are some of the finest pieces of rhythm gaming I've played in years. The jazzier, off-tempo instrumentals lend themselves really well to the tile-based system, with the bass drum on later electronic tracks driving behind every note tapped. It really builds into a fantastic game. Don't let 6-X ruin that!
lend, with, drum, 8 hours deep now and I love the pain! Stages 3 & 6 give a bad impression on the difficulty by being overly long and uninteresting musically, but 7-11 are some of the finest pieces of rhythm gaming I've played in years. The jazzier, off-tempo instrumentals lend themselves really well to the tile-based system, with the bass drum on later electronic tracks driving behind every note tapped. It really builds into a fantastic game. Don't let 6-X ruin that!
builds, into, game, 8 hours deep now and I love the pain! Stages 3 & 6 give a bad impression on the difficulty by being overly long and uninteresting musically, but 7-11 are some of the finest pieces of rhythm gaming I've played in years. The jazzier, off-tempo instrumentals lend themselves really well to the tile-based system, with the bass drum on later electronic tracks driving behind every note tapped. It really builds into a fantastic game. Don't let 6-X ruin that!
humming, during, day, Fantastic rhythmical game. The music is catchy and you will find yourself humming it randomly during the day! No ads! What a bonus! Definitely recommend!
addicting, as, hell, One of the best rythym games on Android, hands down. If you're into games like this then you'll love this one. Absolutely addicting as hell and just a joy to play. Just goes to show how much more important the actual gameplay is in a game, than it's graphics are. Props to the developer(s). Awesome job!!
