NOUN, ADJ, 
emulator, good, This was a good emulator but since Android screwed up the ability for emulators to read SD cards in the phones this app is completely useless! Paid for an app I can't use......
features, many, So many great features, it's crazy how good it runs. Gets updated frequently enough. Excellent :)
features, great, So many great features, it's crazy how good it runs. Gets updated frequently enough. Excellent :)
causes, known, Incompatible with Final Fantasy Tactics Advance 2. Some animation sequences always crash the game, known causes below (these are repeatable): Casting thunder magic on 3+ targets. Third target animation always crashes emulator Klesta using the Devour attack on 2+ targets. Emulator crashes during this animation every time Any Hunter using the Sidewinder ability. Animation crashes the emulator every time. These animations do not crash other emulators, but developers have been silent.
animation, Third, Incompatible with Final Fantasy Tactics Advance 2. Some animation sequences always crash the game, known causes below (these are repeatable): Casting thunder magic on 3+ targets. Third target animation always crashes emulator Klesta using the Devour attack on 2+ targets. Emulator crashes during this animation every time Any Hunter using the Sidewinder ability. Animation crashes the emulator every time. These animations do not crash other emulators, but developers have been silent.
emulators, other, Incompatible with Final Fantasy Tactics Advance 2. Some animation sequences always crash the game, known causes below (these are repeatable): Casting thunder magic on 3+ targets. Third target animation always crashes emulator Klesta using the Devour attack on 2+ targets. Emulator crashes during this animation every time Any Hunter using the Sidewinder ability. Animation crashes the emulator every time. These animations do not crash other emulators, but developers have been silent.
versions, newer, If it works, it's the best out there. However, it can't find the file structure on newer android versions. I can't recommend it until that's fixed
versions, android, If it works, it's the best out there. However, it can't find the file structure on newer android versions. I can't recommend it until that's fixed
states, save, You can play games but The save states don't seem to work. So basically pointless especially if you want to play Pokemon.
storage, internal, Can't read as card and it screwed everything up when I transferred my games to my sd card. Even after transferring them back to internal storage it was still screwed up and wouldn't read them.
complaint, only, works p well! controls function properly. my only complaint is that the controls take up a HUGE amount of the emulated touchscreen space. if you're playing a game with touchscreen commands, especially timed ones, you're v likely to fail because the screen is hidden by the controls. this is *partially* fixed if you use a stylus for your phone, but not entirely. if i was using a tablet or even a larger phone, this would probably be *perfect*.
amount, HUGE, works p well! controls function properly. my only complaint is that the controls take up a HUGE amount of the emulated touchscreen space. if you're playing a game with touchscreen commands, especially timed ones, you're v likely to fail because the screen is hidden by the controls. this is *partially* fixed if you use a stylus for your phone, but not entirely. if i was using a tablet or even a larger phone, this would probably be *perfect*.
space, emulated, works p well! controls function properly. my only complaint is that the controls take up a HUGE amount of the emulated touchscreen space. if you're playing a game with touchscreen commands, especially timed ones, you're v likely to fail because the screen is hidden by the controls. this is *partially* fixed if you use a stylus for your phone, but not entirely. if i was using a tablet or even a larger phone, this would probably be *perfect*.
commands, touchscreen, works p well! controls function properly. my only complaint is that the controls take up a HUGE amount of the emulated touchscreen space. if you're playing a game with touchscreen commands, especially timed ones, you're v likely to fail because the screen is hidden by the controls. this is *partially* fixed if you use a stylus for your phone, but not entirely. if i was using a tablet or even a larger phone, this would probably be *perfect*.
ones, timed, works p well! controls function properly. my only complaint is that the controls take up a HUGE amount of the emulated touchscreen space. if you're playing a game with touchscreen commands, especially timed ones, you're v likely to fail because the screen is hidden by the controls. this is *partially* fixed if you use a stylus for your phone, but not entirely. if i was using a tablet or even a larger phone, this would probably be *perfect*.
phone, larger, works p well! controls function properly. my only complaint is that the controls take up a HUGE amount of the emulated touchscreen space. if you're playing a game with touchscreen commands, especially timed ones, you're v likely to fail because the screen is hidden by the controls. this is *partially* fixed if you use a stylus for your phone, but not entirely. if i was using a tablet or even a larger phone, this would probably be *perfect*.
game, new, When I go to load new game, it takes me to an empty /storage and there's nothing else I can do
closing, lid, Worth the price, runs without issues with built in features like lid closing, microphone or touchscreen, requires almost no configuration and zero technical knowledge to setup properly.
knowledge, technical, Worth the price, runs without issues with built in features like lid closing, microphone or touchscreen, requires almost no configuration and zero technical knowledge to setup properly.
android, last, After the last android update this app can't find rom in device so please fix permission for this app
storage, scoped, A bit broken on Android 11. Can then only read from INTERNAL STORAGE, not SD card due to "scoped storage". Other than that works flawlessly.
emulator, best, This is the best Ds emulator i have ever used, it has high quality graphics, it runs all my ds games, and its also easy to use.
emulator, Ds, This is the best Ds emulator i have ever used, it has high quality graphics, it runs all my ds games, and its also easy to use.
quality, high, This is the best Ds emulator i have ever used, it has high quality graphics, it runs all my ds games, and its also easy to use.
games, ds, This is the best Ds emulator i have ever used, it has high quality graphics, it runs all my ds games, and its also easy to use.
folder, black, Cannot open black folder to search. :( Android 12.5 Xiaomi Redmi 9 and Xiamo Poco X3 Pro, same result.
result, same, Cannot open black folder to search. :( Android 12.5 Xiaomi Redmi 9 and Xiamo Poco X3 Pro, same result.
games, ds, This is the Best Emulator for Playing pokemon ds games. But the problem is it is painful to load the game. So i am giving it 4 star Please solve this Problem as quick as possible
emulator, best, It used to be the best emulator but am I the only one with an issue with physical keyboard ? When I don't press anything the left arrow is randomly being pressed and my characters go left and I can interact.
keyboard, physical, It used to be the best emulator but am I the only one with an issue with physical keyboard ? When I don't press anything the left arrow is randomly being pressed and my characters go left and I can interact.
arrow, left, It used to be the best emulator but am I the only one with an issue with physical keyboard ? When I don't press anything the left arrow is randomly being pressed and my characters go left and I can interact.
emulator, smoothest, This is the smoothest NDS emulator on android that I've tried so far! On many devices tho such as Galaxy J1 mini, J7 prime, S6 Edge plus, S10 etc.
devices, many, This is the smoothest NDS emulator on android that I've tried so far! On many devices tho such as Galaxy J1 mini, J7 prime, S6 Edge plus, S10 etc.
controller, external, Works well for me. I have a 2018 honor phone and a Samsung SD card. Also a 2017 Fire 10 tablet. Brilliant for puzzle, card & board games. Being able to swap screen position and move the on-screen keyboard around makes my games very playable. I did notice lag on one game, but all the others I play have been fine so far. Also loving the save/load game state. Makes games even more playable! Haven't tried with an external controller yet. Will update review if I manage to try.
period, Best, Best ds emulator period. can play both homebrews and original games no problem, plays 60fps smooth as silk. has tons of customization options, and you can switch between roms effortlessly.
games, original, Best ds emulator period. can play both homebrews and original games no problem, plays 60fps smooth as silk. has tons of customization options, and you can switch between roms effortlessly.
quality, Good, Good quality app
nds, best, The best nds emulator on Android so far
deal, bad, The emulator doesn't want to scan games and it won't let me open folders manually. I am using Samsung Galaxy A20s. Please solve this problem, i was playing fine almost a month ago, reinstalling doesn't fix the problem. Paying in indonesian Rupiah is worth a month of meals here, so It's a bad deal to be paying for an app that doesn't work. I'd consider changing the rating if this bug is fixed because DraStic was one of the better DS emulator next to No$.
emulator, better, The emulator doesn't want to scan games and it won't let me open folders manually. I am using Samsung Galaxy A20s. Please solve this problem, i was playing fine almost a month ago, reinstalling doesn't fix the problem. Paying in indonesian Rupiah is worth a month of meals here, so It's a bad deal to be paying for an app that doesn't work. I'd consider changing the rating if this bug is fixed because DraStic was one of the better DS emulator next to No$.
app, Amazing, Amazing app, works so well
policies, android, Does not comply with android 11 storage policies. Works fine on Android 10 but doesn't work on Android 11 or above.
emulator, Best, Best emulator for nds
phone, newest, on my newest phone if i leave the app closed for too long then the game i am playing will pop as a white screen, otherwise ive used this since HS with no issues on worse phones than my current one. a good option, maybe even a great one.
screen, white, on my newest phone if i leave the app closed for too long then the game i am playing will pop as a white screen, otherwise ive used this since HS with no issues on worse phones than my current one. a good option, maybe even a great one.
phones, worse, on my newest phone if i leave the app closed for too long then the game i am playing will pop as a white screen, otherwise ive used this since HS with no issues on worse phones than my current one. a good option, maybe even a great one.
option, good, on my newest phone if i leave the app closed for too long then the game i am playing will pop as a white screen, otherwise ive used this since HS with no issues on worse phones than my current one. a good option, maybe even a great one.
simulator, perfect, The perfect ds simulator
simulator, ds, The perfect ds simulator
devices, android, This emulator works well with all sorts of android devices. I started use with an s5 and now have the s10. I did notice the drive saves didn't really work but haven't checked since then. Either way...a great emu
emu, great, This emulator works well with all sorts of android devices. I started use with an s5 and now have the s10. I did notice the drive saves didn't really work but haven't checked since then. Either way...a great emu
games, 3ds, Works and runs amazing just wish I could play 3ds games and multi-player
time, same, The controls seems quite buggy to me, base on my experience while playing some games, triggering 2 or 3 buttons at the same time they're not functioning correctly ...
games, 3ds, It should be able to emulate 3ds games when it can I'll give it 5 stars for sure.
emulator, good, It's a good emulator and does what it says. I have a major problem with the controls though. This doesn't happen with the Dpad but but the A and B keys keep getting pressed all the bloody time. No matter how big i make them/ move them around or even have it on Landscape. Can we customize the buttons fully to be able to move each one? A slight move further apart will fix this simple problem... Phone is a Samsung S8 EDIT: No longer works with android 11
problem, major, It's a good emulator and does what it says. I have a major problem with the controls though. This doesn't happen with the Dpad but but the A and B keys keep getting pressed all the bloody time. No matter how big i make them/ move them around or even have it on Landscape. Can we customize the buttons fully to be able to move each one? A slight move further apart will fix this simple problem... Phone is a Samsung S8 EDIT: No longer works with android 11
time, bloody, It's a good emulator and does what it says. I have a major problem with the controls though. This doesn't happen with the Dpad but but the A and B keys keep getting pressed all the bloody time. No matter how big i make them/ move them around or even have it on Landscape. Can we customize the buttons fully to be able to move each one? A slight move further apart will fix this simple problem... Phone is a Samsung S8 EDIT: No longer works with android 11
move, slight, It's a good emulator and does what it says. I have a major problem with the controls though. This doesn't happen with the Dpad but but the A and B keys keep getting pressed all the bloody time. No matter how big i make them/ move them around or even have it on Landscape. Can we customize the buttons fully to be able to move each one? A slight move further apart will fix this simple problem... Phone is a Samsung S8 EDIT: No longer works with android 11
problem, simple, It's a good emulator and does what it says. I have a major problem with the controls though. This doesn't happen with the Dpad but but the A and B keys keep getting pressed all the bloody time. No matter how big i make them/ move them around or even have it on Landscape. Can we customize the buttons fully to be able to move each one? A slight move further apart will fix this simple problem... Phone is a Samsung S8 EDIT: No longer works with android 11
emulator, coolest, Easily the coolest and most feature-rich emulator I know. I don't typically trust a lot of paid emulators since I'm from the FOSS world of doing things but I'm glad to say that I had nothing to worry about. It's well worth it.
emulators, paid, Easily the coolest and most feature-rich emulator I know. I don't typically trust a lot of paid emulators since I'm from the FOSS world of doing things but I'm glad to say that I had nothing to worry about. It's well worth it.
folder, single, App doesn't allow navigation of folders AT ALL. Displays a single folder with '..' even after creating a user and specifying a directory, which doesn't even show games outside of a folder. Pure garbage.
garbage, Pure, App doesn't allow navigation of folders AT ALL. Displays a single folder with '..' even after creating a user and specifying a directory, which doesn't even show games outside of a folder. Pure garbage.
quality, high, It's great, works perfectly, high quality save states are helpful, can hold multiple saves of multiple games at once.
saves, multiple, It's great, works perfectly, high quality save states are helpful, can hold multiple saves of multiple games at once.
games, multiple, It's great, works perfectly, high quality save states are helpful, can hold multiple saves of multiple games at once.
meaty, fat, I love Drastic, I'm not gay but I'd suck the creator if Drastic's fat meaty cock.
emulator, Great, Great emulator. No ads, plays ds games well.
folder, black, i reinstalled this app but black folder won't respond.. i click many times, nothing happens and that i need SD manager just to link the games to my drastic app :( hassle
times, many, i reinstalled this app but black folder won't respond.. i click many times, nothing happens and that i need SD manager just to link the games to my drastic app :( hassle
emu, Best, Best ds emu! I just wish that the touch controll could be map to a controller like the right stick for fps games. Im not really a big fan of touch aiming. Keep it up devs!!
stick, right, Best ds emu! I just wish that the touch controll could be map to a controller like the right stick for fps games. Im not really a big fan of touch aiming. Keep it up devs!!
fan, big, Best ds emu! I just wish that the touch controll could be map to a controller like the right stick for fps games. Im not really a big fan of touch aiming. Keep it up devs!!
emulators, free, I've tried a few of the free emulators, and this one rides a Ferrari. The others I've tried are riddled with ads and seem to be poorly optimized or purposely slowed down. Can't wait to play some childhood classics
app, Great, Great app, works perfectly on my phone no issues, I have an acer spin 311 chromebook, however, that I cannot get it to run on at all, It will not load most of the games I have with one exception as far as I"ve tested, it will run spirit tracks, that is all. currently wont even load up any of the games in my folders but only on my chromebook. I've gone so far as to extract the roms myself to no avail. Maybe my chromebooks too lowend Idk
game, saved, Keep crushing every time I load the saved game
emulator, 3ds, Can you work on 3ds emulator
card, micro, No mention that I can see that this will now only work with ROMs installed in a folder on the phone itself, not on a micro SD card.
feature, quick, Excellent! Love the quick resume feature.
crashes, frequent, This app has frequent crashes during very repeatable moments. Please fix and I'll update review. Update: randomly tested today, and it works. They must have updated. I've updated my review.
moments, repeatable, This app has frequent crashes during very repeatable moments. Please fix and I'll update review. Update: randomly tested today, and it works. They must have updated. I've updated my review.
emulator, best, It's the best emulator I have ever used. Gameplay is smooth, and accessing different options is quite easy.
options, different, It's the best emulator I have ever used. Gameplay is smooth, and accessing different options is quite easy.
pop, automatic, There was no automatic pop up of games that I downloaded the only thing I kept getting were files that had no games in them whatsoever waste of money and my time refund please.
thing, only, There was no automatic pop up of games that I downloaded the only thing I kept getting were files that had no games in them whatsoever waste of money and my time refund please.
features, Key, Rendering perfectly. Key features: Quick save state (works perfectly), portrait and horizontal gaming mode, emulated monitor switch. Overall I wouldn't play it on anything other than vertically because it feels more like a NDS. 5 star for smoothness of emulation, 4 star for UI and 5 star for rendering multiple instances (the reason I had to switch over). One update you could have several save states so S1, S2 and maybe S3. Very happy to pay for this!
mode, horizontal, Rendering perfectly. Key features: Quick save state (works perfectly), portrait and horizontal gaming mode, emulated monitor switch. Overall I wouldn't play it on anything other than vertically because it feels more like a NDS. 5 star for smoothness of emulation, 4 star for UI and 5 star for rendering multiple instances (the reason I had to switch over). One update you could have several save states so S1, S2 and maybe S3. Very happy to pay for this!
switch, emulated, Rendering perfectly. Key features: Quick save state (works perfectly), portrait and horizontal gaming mode, emulated monitor switch. Overall I wouldn't play it on anything other than vertically because it feels more like a NDS. 5 star for smoothness of emulation, 4 star for UI and 5 star for rendering multiple instances (the reason I had to switch over). One update you could have several save states so S1, S2 and maybe S3. Very happy to pay for this!
instances, multiple, Rendering perfectly. Key features: Quick save state (works perfectly), portrait and horizontal gaming mode, emulated monitor switch. Overall I wouldn't play it on anything other than vertically because it feels more like a NDS. 5 star for smoothness of emulation, 4 star for UI and 5 star for rendering multiple instances (the reason I had to switch over). One update you could have several save states so S1, S2 and maybe S3. Very happy to pay for this!
states, several, Rendering perfectly. Key features: Quick save state (works perfectly), portrait and horizontal gaming mode, emulated monitor switch. Overall I wouldn't play it on anything other than vertically because it feels more like a NDS. 5 star for smoothness of emulation, 4 star for UI and 5 star for rendering multiple instances (the reason I had to switch over). One update you could have several save states so S1, S2 and maybe S3. Very happy to pay for this!
states, save, Rendering perfectly. Key features: Quick save state (works perfectly), portrait and horizontal gaming mode, emulated monitor switch. Overall I wouldn't play it on anything other than vertically because it feels more like a NDS. 5 star for smoothness of emulation, 4 star for UI and 5 star for rendering multiple instances (the reason I had to switch over). One update you could have several save states so S1, S2 and maybe S3. Very happy to pay for this!
work, Nice, Nice work but i want to suggest that you add wireless features so we can connect with other players
features, wireless, Nice work but i want to suggest that you add wireless features so we can connect with other players
players, other, Nice work but i want to suggest that you add wireless features so we can connect with other players
years, 5ish, I bought this for Pokemon games, have had it for 5ish years and loved it the whole time. A lot of problems imo I see people having, can possibly be fixed in the settings. Either way best Emulator for the money imo
time, whole, I bought this for Pokemon games, have had it for 5ish years and loved it the whole time. A lot of problems imo I see people having, can possibly be fixed in the settings. Either way best Emulator for the money imo
screen, Ds, between A and B press or a auto hold option, u cant run and jump through levels in New super Mario bros, multi touch movement problem, were the dpad gets stuck or the Ds touch screen within emulator stops working when moving two touch points and let go of one the other messes up
emulator, awesome, Another awesome emulator definitely recommend this one for nds lovers
screen, split, Basically unplayable when using split screen mode on Android. Resizing doesnt work becuase it wont save changes. It gives the option to resize to 1x or 2x but wont save even when i click both "save as global" and "set as current". After messing with it i can resize it in the editor but again will not save changes, although when i go back to the editor the changes are already there.
emulator, intrusive, Honestly the least intrusive ds emulator on android. Built in cheats are a nice way to spice up gameplay of an old game.
emulator, ds, Honestly the least intrusive ds emulator on android. Built in cheats are a nice way to spice up gameplay of an old game.
way, nice, Honestly the least intrusive ds emulator on android. Built in cheats are a nice way to spice up gameplay of an old game.
game, old, Honestly the least intrusive ds emulator on android. Built in cheats are a nice way to spice up gameplay of an old game.
emus, choppy, Absolutely worth the $5. Runs very smoothly, as opposed to more choppy free emus. Edit: i can't seem to see any files in the app anymore, it only takes me to the /storage file, and i can't change it. This means all my progress is lost. Please help.
emus, free, Absolutely worth the $5. Runs very smoothly, as opposed to more choppy free emus. Edit: i can't seem to see any files in the app anymore, it only takes me to the /storage file, and i can't change it. This means all my progress is lost. Please help.
lite, mi, I have already paid the game in my mi 8 lite, but cannot install in my mi 11 phone with same email login.
login, same, I have already paid the game in my mi 8 lite, but cannot install in my mi 11 phone with same email login.
emulator, best, The best NDS emulator in the store Worth paying for. The load and save States works. all the games I've downloaded from an Nintendo DS rom site works. It's smooth and easy to use. Looking forward to what else the developer has in the future.
site, Nintendo, The best NDS emulator in the store Worth paying for. The load and save States works. all the games I've downloaded from an Nintendo DS rom site works. It's smooth and easy to use. Looking forward to what else the developer has in the future.
emulator, Nice, Nice emulator
control, more, Need more control over virtual buttons.
buttons, virtual, Need more control over virtual buttons.
emulator, Best, Best Ds emulator.
emulator, Ds, Best Ds emulator.
emulators, other, Edit: ok, lowering the stars because I can't get this to play roms that are in my SD card. Please change this, other emulators can play roms on my SD card just fine.
EMULATOR, FREE, Can't use START or SELECT in ANY games! I am on a Samsung A51 and I'll be damned if I didn't just convert from the FREE EMULATOR BECAUSE OF THE SAME SITUATION! Really hoping to get an answer from the developers so I don't have to ask Google for a refund!
