NOUN, ADJ, 
game, online, Came for the rhythm, hooked up with the storyline. It has RPG vibes with its different endings. The game's atmosphere also changes along the story!Story-wise,I find them cool. However, Im giving 4 stars because this game only relies on cloud save to save progress.I get that its not an online game, but I wish it saves progress within google account. I forgot to save my progress with cloud storage leading me losing my progress.Now I have to restart all over from lvl1 again, ugh.I was at lvl54.
game, Amazing, Amazing game. I was able to get into it really quickly. I wish there was a MP mode or something.
launch, first, The game stopped working for me and it gives me an error that says that im offline even though im connected to the internet, i tried to fix it but theres nothing i can do except redownloading the app, at first launch it works as usual, but the second time i launch the app it gives me a "AUTHENTICATION=1" error, please fix the overall game performance for phones in android 10.
time, second, The game stopped working for me and it gives me an error that says that im offline even though im connected to the internet, i tried to fix it but theres nothing i can do except redownloading the app, at first launch it works as usual, but the second time i launch the app it gives me a "AUTHENTICATION=1" error, please fix the overall game performance for phones in android 10.
performance, overall, The game stopped working for me and it gives me an error that says that im offline even though im connected to the internet, i tried to fix it but theres nothing i can do except redownloading the app, at first launch it works as usual, but the second time i launch the app it gives me a "AUTHENTICATION=1" error, please fix the overall game performance for phones in android 10.
game, phenomenal, The game's great, the sounds are too. I don't know what I'm doing wrong - but my songs don't seem to save? All my progress wiped? It's frustrating. I've gotten the compensation and the post that it was fixed and I happily went back on to play again since it really is a phenomenal game. I've updated, but it still doesn't seem to save? Help?
music, best, Still he best music Rhythm game ever!!! They've fixed most of the crashes and I'm back to being ranked in the top 3 most of the time! Love it!
thing, only, It was nice that I got a deal on it for free! :D I enjoy it so much, and will never uninstall!! The only thing that I kinda wish you could do it get more of the story to some of them... :(
character, favorite, First of all cytus ll is a god tear game....... And KAF is my favorite character.... I don't know about you All but the MUSIC and the characters are the best.....by the way thanks for the free packs :)
packs, free, First of all cytus ll is a god tear game....... And KAF is my favorite character.... I don't know about you All but the MUSIC and the characters are the best.....by the way thanks for the free packs :)
u, best, This game's definitely one of the best rythm oriented gameplay u can get in the store. Other than that, well this game is for rich players. U like the song buy it. If not, stick with the free characters. Not gonna blame em cos the DJs seem to be payed as I came across YouTube channel of some of them commenting about their song on Cytus. Don't have any prove tho. I'm f2p btw L0L!
u, oriented, This game's definitely one of the best rythm oriented gameplay u can get in the store. Other than that, well this game is for rich players. U like the song buy it. If not, stick with the free characters. Not gonna blame em cos the DJs seem to be payed as I came across YouTube channel of some of them commenting about their song on Cytus. Don't have any prove tho. I'm f2p btw L0L!
players, rich, This game's definitely one of the best rythm oriented gameplay u can get in the store. Other than that, well this game is for rich players. U like the song buy it. If not, stick with the free characters. Not gonna blame em cos the DJs seem to be payed as I came across YouTube channel of some of them commenting about their song on Cytus. Don't have any prove tho. I'm f2p btw L0L!
characters, free, This game's definitely one of the best rythm oriented gameplay u can get in the store. Other than that, well this game is for rich players. U like the song buy it. If not, stick with the free characters. Not gonna blame em cos the DJs seem to be payed as I came across YouTube channel of some of them commenting about their song on Cytus. Don't have any prove tho. I'm f2p btw L0L!
favorites, top, I absolutely love this game, and it is one of top favorites! I wish I could keep playing it but it eats up my space on my phone.
people, Many, I lost my game data. Many people are loosing too. Fix it plz...
optimisation, awful, You thought that the awful optimisation is bad enough but guess what; THE RECENT (ver 4.2) UPDATE WIPES YOUR ENTIRE PROGRESS CLEAN!!! and I absolutely despise grinding in this game just to proceed story-wise or just obtaining tracks in general because of how convoluted it can be. DO NOT UPDATE IF YOU CARE ABOUT YOUR PROGRESS!!
WIPES, RECENT, You thought that the awful optimisation is bad enough but guess what; THE RECENT (ver 4.2) UPDATE WIPES YOUR ENTIRE PROGRESS CLEAN!!! and I absolutely despise grinding in this game just to proceed story-wise or just obtaining tracks in general because of how convoluted it can be. DO NOT UPDATE IF YOU CARE ABOUT YOUR PROGRESS!!
stuff, new, Focusing too much on adding new stuff instead of fixing the actual gameplay performance problems. Game has always been horribly optimized but WAS still playable, but last update changed that. There is a consistent constant stuttering EVERY 3 SECONDS in-game which turns random notes into misses, basically making it unplayable now. UPDATE: 6 updates and nearing half-a-year later, still happening. If it helps, I'm on Android 10.
problems, actual, Focusing too much on adding new stuff instead of fixing the actual gameplay performance problems. Game has always been horribly optimized but WAS still playable, but last update changed that. There is a consistent constant stuttering EVERY 3 SECONDS in-game which turns random notes into misses, basically making it unplayable now. UPDATE: 6 updates and nearing half-a-year later, still happening. If it helps, I'm on Android 10.
update, last, Focusing too much on adding new stuff instead of fixing the actual gameplay performance problems. Game has always been horribly optimized but WAS still playable, but last update changed that. There is a consistent constant stuttering EVERY 3 SECONDS in-game which turns random notes into misses, basically making it unplayable now. UPDATE: 6 updates and nearing half-a-year later, still happening. If it helps, I'm on Android 10.
notes, random, Focusing too much on adding new stuff instead of fixing the actual gameplay performance problems. Game has always been horribly optimized but WAS still playable, but last update changed that. There is a consistent constant stuttering EVERY 3 SECONDS in-game which turns random notes into misses, basically making it unplayable now. UPDATE: 6 updates and nearing half-a-year later, still happening. If it helps, I'm on Android 10.
year, half, Focusing too much on adding new stuff instead of fixing the actual gameplay performance problems. Game has always been horribly optimized but WAS still playable, but last update changed that. There is a consistent constant stuttering EVERY 3 SECONDS in-game which turns random notes into misses, basically making it unplayable now. UPDATE: 6 updates and nearing half-a-year later, still happening. If it helps, I'm on Android 10.
songs, good, Ahh love itt, i played the first one and enjoyed it, this one is also quite good, lots of good songs i recognize from another game I've played in the past :)
characters, free, pls add free playable characters and also i lost my account with 15 million master due to factory corrupt or something like that basically i installed a virus that factory resets my tablet so now i re download cytus and found out that sync isn't available and also no other option but to cry all night and start a new day.. its so sad..
characters, playable, pls add free playable characters and also i lost my account with 15 million master due to factory corrupt or something like that basically i installed a virus that factory resets my tablet so now i re download cytus and found out that sync isn't available and also no other option but to cry all night and start a new day.. its so sad..
factory, corrupt, pls add free playable characters and also i lost my account with 15 million master due to factory corrupt or something like that basically i installed a virus that factory resets my tablet so now i re download cytus and found out that sync isn't available and also no other option but to cry all night and start a new day.. its so sad..
option, other, pls add free playable characters and also i lost my account with 15 million master due to factory corrupt or something like that basically i installed a virus that factory resets my tablet so now i re download cytus and found out that sync isn't available and also no other option but to cry all night and start a new day.. its so sad..
day, new, pls add free playable characters and also i lost my account with 15 million master due to factory corrupt or something like that basically i installed a virus that factory resets my tablet so now i re download cytus and found out that sync isn't available and also no other option but to cry all night and start a new day.. its so sad..
screen, black, Why i can't play the game, it's just black screen immediately after i opened it.
game, nice, Is was nice game but pls fix the bug that game won't save my progress,i lost 50 capule to unlock 1 pack and now it gone
game, nice, What a nice game! Love it.
game, fun, I really like the game, but the characters are a bit overpriced and i bought one and i kinda regret it but overall a fun game also i dont like how they got rid of offline play
play, offline, I really like the game, but the characters are a bit overpriced and i bought one and i kinda regret it but overall a fun game also i dont like how they got rid of offline play
lags, Constant, As much as I love this game, please optimize the game. Constant lags, menu loading time takes too long, my device easily heats up, occasional crashes, songs sometimes glitching out. This game used to be fun but with all these bugs, it has become uplayable sometimes. It's been so long since 3.8 update where all these bugs and glitches started to really become worse. Please do better and have a dedicated update just for bug fixes
crashes, occasional, As much as I love this game, please optimize the game. Constant lags, menu loading time takes too long, my device easily heats up, occasional crashes, songs sometimes glitching out. This game used to be fun but with all these bugs, it has become uplayable sometimes. It's been so long since 3.8 update where all these bugs and glitches started to really become worse. Please do better and have a dedicated update just for bug fixes
update, dedicated, As much as I love this game, please optimize the game. Constant lags, menu loading time takes too long, my device easily heats up, occasional crashes, songs sometimes glitching out. This game used to be fun but with all these bugs, it has become uplayable sometimes. It's been so long since 3.8 update where all these bugs and glitches started to really become worse. Please do better and have a dedicated update just for bug fixes
game, Best, Best rhythm game I've ever played. The story, the interaction and ofc the songs and tapping system is so great. I love it. I've had this game since 2019 and idk why it took me so l9ng to write a review, lol
system, tapping, Best rhythm game I've ever played. The story, the interaction and ofc the songs and tapping system is so great. I love it. I've had this game since 2019 and idk why it took me so l9ng to write a review, lol
arch, x86, after YEARS AND YEARS of updates the game they didnt fix the game crash for the x86 arch and they dont really care even the DLC are just cash grab and not that worth it especially on the 5 song pack.. even the definite story are locked behind a paid characters just why.. even a rhythm PC game that have a proper keysound,BGA and more music are not this expensive
story, definite, after YEARS AND YEARS of updates the game they didnt fix the game crash for the x86 arch and they dont really care even the DLC are just cash grab and not that worth it especially on the 5 song pack.. even the definite story are locked behind a paid characters just why.. even a rhythm PC game that have a proper keysound,BGA and more music are not this expensive
characters, paid, after YEARS AND YEARS of updates the game they didnt fix the game crash for the x86 arch and they dont really care even the DLC are just cash grab and not that worth it especially on the 5 song pack.. even the definite story are locked behind a paid characters just why.. even a rhythm PC game that have a proper keysound,BGA and more music are not this expensive
game, rhythm, after YEARS AND YEARS of updates the game they didnt fix the game crash for the x86 arch and they dont really care even the DLC are just cash grab and not that worth it especially on the 5 song pack.. even the definite story are locked behind a paid characters just why.. even a rhythm PC game that have a proper keysound,BGA and more music are not this expensive
keysound, proper, after YEARS AND YEARS of updates the game they didnt fix the game crash for the x86 arch and they dont really care even the DLC are just cash grab and not that worth it especially on the 5 song pack.. even the definite story are locked behind a paid characters just why.. even a rhythm PC game that have a proper keysound,BGA and more music are not this expensive
music, more, after YEARS AND YEARS of updates the game they didnt fix the game crash for the x86 arch and they dont really care even the DLC are just cash grab and not that worth it especially on the 5 song pack.. even the definite story are locked behind a paid characters just why.. even a rhythm PC game that have a proper keysound,BGA and more music are not this expensive
game, amazing, Absolutely amazing rhythm game with great music and very difficult
game, difficult, Absolutely amazing rhythm game with great music and very difficult
music, great, Absolutely amazing rhythm game with great music and very difficult
game, Best, Best rhytm game ever i played but the in game song purchases is too expensive, yeah i dont complain about it bcuse the song quality is good, damn i really enjoyed
experience, better, the game wont launch, I get to the part that says wear earphones for better experience and then it just crashes
game, Cool, Cool game
music, nice, Pretty nice good music
music, good, Pretty nice good music
game, blessed, blessed game thanks rayark favorite game ever
game, favorite, blessed game thanks rayark favorite game ever
rythm, mobile, Ok so, I'm not usually into rating games, but this game right here, is easily the best mobile rythm game I have ever played, it has interesting gameplay but its extremely fun, it also has an amazing story line, lots of cliffhangers that just make you want to play more, so this game gets an easy 5 stars from me.
game, best, Ok so, I'm not usually into rating games, but this game right here, is easily the best mobile rythm game I have ever played, it has interesting gameplay but its extremely fun, it also has an amazing story line, lots of cliffhangers that just make you want to play more, so this game gets an easy 5 stars from me.
gameplay, interesting, Ok so, I'm not usually into rating games, but this game right here, is easily the best mobile rythm game I have ever played, it has interesting gameplay but its extremely fun, it also has an amazing story line, lots of cliffhangers that just make you want to play more, so this game gets an easy 5 stars from me.
line, amazing, Ok so, I'm not usually into rating games, but this game right here, is easily the best mobile rythm game I have ever played, it has interesting gameplay but its extremely fun, it also has an amazing story line, lots of cliffhangers that just make you want to play more, so this game gets an easy 5 stars from me.
stars, easy, Ok so, I'm not usually into rating games, but this game right here, is easily the best mobile rythm game I have ever played, it has interesting gameplay but its extremely fun, it also has an amazing story line, lots of cliffhangers that just make you want to play more, so this game gets an easy 5 stars from me.
game, enjoyable, Very enjoyable game to play on the game and on Free time!
time, Free, Very enjoyable game to play on the game and on Free time!
update, new, I had a problem with the new update.My friend got all the characters for free when you download it recently but when I updated it I still had to paid for all the characters,but other then that the game is pretty amazing.
music, good, good music, good plot, it deserves a big POG
plot, good, good music, good plot, it deserves a big POG
POG, big, good music, good plot, it deserves a big POG
day, fateful, I don't play rhythm games in general but this was free on a fateful day and gotta say, this is a banger!!!! 11/10 very hard haha
haha, hard, I don't play rhythm games in general but this was free on a fateful day and gotta say, this is a banger!!!! 11/10 very hard haha
progress, old, Loved the story and the game but I can't take back my old progress anymore? I synced it and I also can't play offline anymore. I used to play this game daily mostly because it's entertaining and it's offline.
stars, like, Dang idk man-the story's like 10 stars XD and the gameplay is 15! No lags and can be played offline, if u wanna try out a new game, u gotta try this
game, new, Dang idk man-the story's like 10 stars XD and the gameplay is 15! No lags and can be played offline, if u wanna try out a new game, u gotta try this
game, Awesome, Awesome game, awesome songs. No complaints
songs, awesome, Awesome game, awesome songs. No complaints
feature, offline, I really loved this game for 2 years but then why did you remove the offline feature??? Pls bring it back i will always love this game 😭
game, made, Unquestionably one of the most well made and polished game on smartphones. The songs and pieces that can be played are mostly made by talented artists or composers and the story and gameplay is incredible, especially for free. There are some In App purchases but they're only for extra content and to help Rayark continue and develop as a company.
artists, talented, Unquestionably one of the most well made and polished game on smartphones. The songs and pieces that can be played are mostly made by talented artists or composers and the story and gameplay is incredible, especially for free. There are some In App purchases but they're only for extra content and to help Rayark continue and develop as a company.
content, extra, Unquestionably one of the most well made and polished game on smartphones. The songs and pieces that can be played are mostly made by talented artists or composers and the story and gameplay is incredible, especially for free. There are some In App purchases but they're only for extra content and to help Rayark continue and develop as a company.
song, Good, Good song good music good stories 👌
music, good, Good song good music good stories 👌
stories, good, Good song good music good stories 👌
game, Great, Great game
game, cool, Besides being a very cool rhythm game, Cytus II has a wonderful and immersive storyline, which I enjoyed fully. The writing is elegant, every character feels alive. The music is also diverse too, which a bunch of different genres to chose from. My only complains are the paywalls and DLCs that lock you out of content you will enjoy, but other than that, the whole game and story can be played without any other purchases besides the initial one. Overall, it's a fun game to play, and a nice story.
storyline, wonderful, Besides being a very cool rhythm game, Cytus II has a wonderful and immersive storyline, which I enjoyed fully. The writing is elegant, every character feels alive. The music is also diverse too, which a bunch of different genres to chose from. My only complains are the paywalls and DLCs that lock you out of content you will enjoy, but other than that, the whole game and story can be played without any other purchases besides the initial one. Overall, it's a fun game to play, and a nice story.
genres, different, Besides being a very cool rhythm game, Cytus II has a wonderful and immersive storyline, which I enjoyed fully. The writing is elegant, every character feels alive. The music is also diverse too, which a bunch of different genres to chose from. My only complains are the paywalls and DLCs that lock you out of content you will enjoy, but other than that, the whole game and story can be played without any other purchases besides the initial one. Overall, it's a fun game to play, and a nice story.
complains, only, Besides being a very cool rhythm game, Cytus II has a wonderful and immersive storyline, which I enjoyed fully. The writing is elegant, every character feels alive. The music is also diverse too, which a bunch of different genres to chose from. My only complains are the paywalls and DLCs that lock you out of content you will enjoy, but other than that, the whole game and story can be played without any other purchases besides the initial one. Overall, it's a fun game to play, and a nice story.
game, whole, Besides being a very cool rhythm game, Cytus II has a wonderful and immersive storyline, which I enjoyed fully. The writing is elegant, every character feels alive. The music is also diverse too, which a bunch of different genres to chose from. My only complains are the paywalls and DLCs that lock you out of content you will enjoy, but other than that, the whole game and story can be played without any other purchases besides the initial one. Overall, it's a fun game to play, and a nice story.
purchases, other, Besides being a very cool rhythm game, Cytus II has a wonderful and immersive storyline, which I enjoyed fully. The writing is elegant, every character feels alive. The music is also diverse too, which a bunch of different genres to chose from. My only complains are the paywalls and DLCs that lock you out of content you will enjoy, but other than that, the whole game and story can be played without any other purchases besides the initial one. Overall, it's a fun game to play, and a nice story.
game, fun, Besides being a very cool rhythm game, Cytus II has a wonderful and immersive storyline, which I enjoyed fully. The writing is elegant, every character feels alive. The music is also diverse too, which a bunch of different genres to chose from. My only complains are the paywalls and DLCs that lock you out of content you will enjoy, but other than that, the whole game and story can be played without any other purchases besides the initial one. Overall, it's a fun game to play, and a nice story.
story, nice, Besides being a very cool rhythm game, Cytus II has a wonderful and immersive storyline, which I enjoyed fully. The writing is elegant, every character feels alive. The music is also diverse too, which a bunch of different genres to chose from. My only complains are the paywalls and DLCs that lock you out of content you will enjoy, but other than that, the whole game and story can be played without any other purchases besides the initial one. Overall, it's a fun game to play, and a nice story.
game, perfect, Just a perfect game which let's you enjoy the music with cool visual gameplay. Except the fact that end levels kinda hard though. :)
gameplay, cool, Just a perfect game which let's you enjoy the music with cool visual gameplay. Except the fact that end levels kinda hard though. :)
gameplay, visual, Just a perfect game which let's you enjoy the music with cool visual gameplay. Except the fact that end levels kinda hard though. :)
version, newest, I like this game, very much. but it keeps stopping after i played for 2 days. I've done everything but it keeps stopping and it's bothering me. i already reinstall it to the newest version and always cleaning my storage until 25 gb (capacity 32 gb) but it keeps stopping. can you fix this? thank you :)
game, Good, Good game but it kinda sucks that we need to play online not like the previous version
version, previous, Good game but it kinda sucks that we need to play online not like the previous version
ways, worst, I've played Cytus since 2017. The premise of the game itself is genius and no rhythm game can ever replicate how fun it can be. Unfortunately, a lot of the charts in this are either painfully boring or super overcharted in the worst ways possible, and its only been getting worse since version 3.7. Wish Rayark would get some new blood in the charters, cause the leading few have all gone stale.
ways, possible, I've played Cytus since 2017. The premise of the game itself is genius and no rhythm game can ever replicate how fun it can be. Unfortunately, a lot of the charts in this are either painfully boring or super overcharted in the worst ways possible, and its only been getting worse since version 3.7. Wish Rayark would get some new blood in the charters, cause the leading few have all gone stale.
