NOUN, ADJ, 
SD, internal, After updating to Android 11, I can't load Rom even I'm only using my internal SD, the fullscreen option (the option that ignore the notch) seems to be broken with the app
emulator, good, Really good emulator. Everything is smooth and runs good. I use the Myboy series but they don't have a DS so this is good. One problem. The multiplayer/wifi system needs to be added. As a pokemon player, it would be great to trade between game files. As an advance wars player, it would be great to fight against my friends. Certainly could use that. I quite literally say this would be perfect with the connectivity, there is nothing else I could say for improvement.
emulator, functional, Overall, the quality and experience deserves 5 stars. It's a perfectly functional DS emulator for Android, without ads or any major UX issues. However, recently there's been a problem where the app will freeze if it's in the background for any reason, which means you'll lose progress whenever you accidentally open another app or go to your Overview or Home screen. It also means you have to save the game every time you back out to check a wiki.
issues, major, Overall, the quality and experience deserves 5 stars. It's a perfectly functional DS emulator for Android, without ads or any major UX issues. However, recently there's been a problem where the app will freeze if it's in the background for any reason, which means you'll lose progress whenever you accidentally open another app or go to your Overview or Home screen. It also means you have to save the game every time you back out to check a wiki.
app, wonderful, It's a wonderful app. It is the perfect application that allows you to play old games that you can no longer purchase or find in person because they're out of date or other reasons. Maybe it's just me but sometimes it glitches and crashes so when I press game A instead of playing game A game b turns on instead. A bit of technical issues but could be my phone or the file. Sometimes crashes as well and shows game glitches when too much of speed forwarding is used. Other than that a it's perfect.
application, perfect, It's a wonderful app. It is the perfect application that allows you to play old games that you can no longer purchase or find in person because they're out of date or other reasons. Maybe it's just me but sometimes it glitches and crashes so when I press game A instead of playing game A game b turns on instead. A bit of technical issues but could be my phone or the file. Sometimes crashes as well and shows game glitches when too much of speed forwarding is used. Other than that a it's perfect.
games, old, It's a wonderful app. It is the perfect application that allows you to play old games that you can no longer purchase or find in person because they're out of date or other reasons. Maybe it's just me but sometimes it glitches and crashes so when I press game A instead of playing game A game b turns on instead. A bit of technical issues but could be my phone or the file. Sometimes crashes as well and shows game glitches when too much of speed forwarding is used. Other than that a it's perfect.
reasons, other, It's a wonderful app. It is the perfect application that allows you to play old games that you can no longer purchase or find in person because they're out of date or other reasons. Maybe it's just me but sometimes it glitches and crashes so when I press game A instead of playing game A game b turns on instead. A bit of technical issues but could be my phone or the file. Sometimes crashes as well and shows game glitches when too much of speed forwarding is used. Other than that a it's perfect.
issues, technical, It's a wonderful app. It is the perfect application that allows you to play old games that you can no longer purchase or find in person because they're out of date or other reasons. Maybe it's just me but sometimes it glitches and crashes so when I press game A instead of playing game A game b turns on instead. A bit of technical issues but could be my phone or the file. Sometimes crashes as well and shows game glitches when too much of speed forwarding is used. Other than that a it's perfect.
pokemon, Played, Played pokemon white v2 for over 2 hours. Made multiple saves during that time. Only to close the app and come back to a blank game with no saved progress. How irritating. How can I trust this app for anything else?
pokemon, white, Played pokemon white v2 for over 2 hours. Made multiple saves during that time. Only to close the app and come back to a blank game with no saved progress. How irritating. How can I trust this app for anything else?
saves, multiple, Played pokemon white v2 for over 2 hours. Made multiple saves during that time. Only to close the app and come back to a blank game with no saved progress. How irritating. How can I trust this app for anything else?
game, blank, Played pokemon white v2 for over 2 hours. Made multiple saves during that time. Only to close the app and come back to a blank game with no saved progress. How irritating. How can I trust this app for anything else?
progress, saved, Played pokemon white v2 for over 2 hours. Made multiple saves during that time. Only to close the app and come back to a blank game with no saved progress. How irritating. How can I trust this app for anything else?
emulator, amazing, Not even going to lie this is an amazing emulator. It speeds, has cheats, and the roms are very easy to process in this. This would be a 5 star app if it wasn't for one thing. Sometimes, after I save the game and leave, and when I try to load it again, it will crash a few times. It's just a minor annoyance, not anything big.
times, few, Not even going to lie this is an amazing emulator. It speeds, has cheats, and the roms are very easy to process in this. This would be a 5 star app if it wasn't for one thing. Sometimes, after I save the game and leave, and when I try to load it again, it will crash a few times. It's just a minor annoyance, not anything big.
annoyance, minor, Not even going to lie this is an amazing emulator. It speeds, has cheats, and the roms are very easy to process in this. This would be a 5 star app if it wasn't for one thing. Sometimes, after I save the game and leave, and when I try to load it again, it will crash a few times. It's just a minor annoyance, not anything big.
emulator, good, Very good emulator. Only real complaint here is the useless microphone noise button which basically prohibits any use of microphone usage in the roms. Otherwise still a very solid app.
complaint, real, Very good emulator. Only real complaint here is the useless microphone noise button which basically prohibits any use of microphone usage in the roms. Otherwise still a very solid app.
button, useless, Very good emulator. Only real complaint here is the useless microphone noise button which basically prohibits any use of microphone usage in the roms. Otherwise still a very solid app.
app, solid, Very good emulator. Only real complaint here is the useless microphone noise button which basically prohibits any use of microphone usage in the roms. Otherwise still a very solid app.
emulator, great, This was once a great emulator. Now it is just stuck on the root directory and not showing folders.
copies, legal, 5 out of 5 stars I added legal back up copies of all of my d's games
team, good, Worthed every penny I spent, good job team
emulator, best, The best (and only) DS emulator that can actually run the games well without lag or anything like that plus LOTS of great features others on the playstore lack, without a doubt THE GO TO for DS Emulation on Android and even in general
storage, internal, Almost perfect! At this time, on Android 11, I cant select the SD card though, and if you go up enough in the path, the path can get stuck with no coming back, cause you can only go up but it doesn't have anywhere to go, and from that point you can't select internal or external storage. Please fix this bug.
emulators, best, This is definitely worth the money. One of the best DS emulators if not the best one out there. Totally recommend it.
emulator, Best, Best DS emulator, hands down. Great work.
work, Great, Best DS emulator, hands down. Great work.
version, previous, Drastic won't detect my sd card where i put all my DS games. This didn't happen with the previous version of drastic and its really annoying to keep DS games on my internal storage since it only has a small storage.
storage, internal, Drastic won't detect my sd card where i put all my DS games. This didn't happen with the previous version of drastic and its really annoying to keep DS games on my internal storage since it only has a small storage.
storage, small, Drastic won't detect my sd card where i put all my DS games. This didn't happen with the previous version of drastic and its really annoying to keep DS games on my internal storage since it only has a small storage.
emulator, ds, Any ds emulator works even rom hacks
one, right, Very fast, streamline and user friendly. Don't look elsewhere for NDS emulators on Android. You have found the right one.
audio, internal, This emulator runs like a dream. Can it also support internal audio for android 10+ soon too?
emulator, good, A very good emulator, and worth the price..maybe the best on Playstore! The only complain i have is about the backups on Google drive not work all the time, and so bad WiFi don't work as WiFi and multiplayer. Otg cable gamepad work good, and all games with high graphics..Keep up the good work Ps. Not working with Android 11, until they update this, I don't change my 🌟
complain, only, A very good emulator, and worth the price..maybe the best on Playstore! The only complain i have is about the backups on Google drive not work all the time, and so bad WiFi don't work as WiFi and multiplayer. Otg cable gamepad work good, and all games with high graphics..Keep up the good work Ps. Not working with Android 11, until they update this, I don't change my 🌟
work, Otg, A very good emulator, and worth the price..maybe the best on Playstore! The only complain i have is about the backups on Google drive not work all the time, and so bad WiFi don't work as WiFi and multiplayer. Otg cable gamepad work good, and all games with high graphics..Keep up the good work Ps. Not working with Android 11, until they update this, I don't change my 🌟
graphics, high, A very good emulator, and worth the price..maybe the best on Playstore! The only complain i have is about the backups on Google drive not work all the time, and so bad WiFi don't work as WiFi and multiplayer. Otg cable gamepad work good, and all games with high graphics..Keep up the good work Ps. Not working with Android 11, until they update this, I don't change my 🌟
work, good, A very good emulator, and worth the price..maybe the best on Playstore! The only complain i have is about the backups on Google drive not work all the time, and so bad WiFi don't work as WiFi and multiplayer. Otg cable gamepad work good, and all games with high graphics..Keep up the good work Ps. Not working with Android 11, until they update this, I don't change my 🌟
years, many, Served me for many years now. Damn pro
theme, dark, Can you make dark theme ui. The emulator is great btw
competitor, better, paid garbage-tier software. If a better competitor comes out, I'm dumping this heap of junk.
price, Terrible, Can't even browse game files. Terrible UI. Terrible price, scam
moves, certain, Keeps crashing on FFA2 when certain moves are used. Otherwise works fine. Will update when fixed.
games, 3ds, I love it been using it for years if theres ever a problem its wit the game thats been downloaded this app runs smooth,but on a side not i recently seen a google post saying this runs 3ds games? Am i tripping or is this a thing i dont see anything about it in the description.
info, cheat, can you please update the cheat info? i have zero clue how to do it and i am on chrome book. please help me!
system, horrible, The horrible savestate system will absolutely ruin any enjoyment you will gain from playing the games. It is in desperate need of an overhaul. It works great otherwise.
need, desperate, The horrible savestate system will absolutely ruin any enjoyment you will gain from playing the games. It is in desperate need of an overhaul. It works great otherwise.
night, last, Was working fine until last night. I like to play in portrait mode but now ive lost the virtual controls, works if i restart my phone. What is going on!
controls, virtual, Was working fine until last night. I like to play in portrait mode but now ive lost the virtual controls, works if i restart my phone. What is going on!
emulator, favorite, Used to be my favorite emulator but now cant even scan for games without a freeze and crash. Fix it and I'll bump it to 5 stars. It truly is the best Ds emulator. On ROG phone 3.
emulator, best, Used to be my favorite emulator but now cant even scan for games without a freeze and crash. Fix it and I'll bump it to 5 stars. It truly is the best Ds emulator. On ROG phone 3.
emulator, Ds, Used to be my favorite emulator but now cant even scan for games without a freeze and crash. Fix it and I'll bump it to 5 stars. It truly is the best Ds emulator. On ROG phone 3.
errors, graphical, Plays Pokemon SoulSilver without graphical errors, DeSmuME could never
emulator, Amazing, Amazing emulator! Was looking for a way to play Pokemon black on my phone. Fast, no ads, simple, and easily accessible. Highly recommended, hope to see what the future brings for this emulator.
ads, Fast, Amazing emulator! Was looking for a way to play Pokemon black on my phone. Fast, no ads, simple, and easily accessible. Highly recommended, hope to see what the future brings for this emulator.
problem, common, Can't use DraStic's file explorer to open games. Unusable now. Worked fine before but this seems to be a common problem.
titles, classic, Great for playing classic DS titles.
time, long, bought the app long long time ago, I am still impressed and worth the full pricing for this emulator. hats off for the dev(s) 😎
time, long, bought the app long long time ago, I am still impressed and worth the full pricing for this emulator. hats off for the dev(s) 😎
pricing, full, bought the app long long time ago, I am still impressed and worth the full pricing for this emulator. hats off for the dev(s) 😎
stars, easy, I loved this app, when it worked. Now I can't get into any games, heck I can't even get into my files to look for my games through the app. If I could actually use it, it would get an easy 5 stars from me.
emulator, Best, Best emulator to date.
forward, fast, Edited: I'm an idiot, I found the fast forward button. App works great, has in game cheats (haven't used them yet,) and has a nice button layout.
button, forward, Edited: I'm an idiot, I found the fast forward button. App works great, has in game cheats (haven't used them yet,) and has a nice button layout.
layout, nice, Edited: I'm an idiot, I found the fast forward button. App works great, has in game cheats (haven't used them yet,) and has a nice button layout.
games, most, The emulator itself works great and runs most games flawlessly. There is built-in cheat support and the app comes with it's own cheat database. The only issue is with Android 11 users, the app cannot access any files on the Sd Card due to Android 11's Scoped Storage system. Hopefully a update to this app addresses this. In the meantime I have to copy over my DS games from my SD card to Internal Storage.
support, built, The emulator itself works great and runs most games flawlessly. There is built-in cheat support and the app comes with it's own cheat database. The only issue is with Android 11 users, the app cannot access any files on the Sd Card due to Android 11's Scoped Storage system. Hopefully a update to this app addresses this. In the meantime I have to copy over my DS games from my SD card to Internal Storage.
support, cheat, The emulator itself works great and runs most games flawlessly. There is built-in cheat support and the app comes with it's own cheat database. The only issue is with Android 11 users, the app cannot access any files on the Sd Card due to Android 11's Scoped Storage system. Hopefully a update to this app addresses this. In the meantime I have to copy over my DS games from my SD card to Internal Storage.
database, own, The emulator itself works great and runs most games flawlessly. There is built-in cheat support and the app comes with it's own cheat database. The only issue is with Android 11 users, the app cannot access any files on the Sd Card due to Android 11's Scoped Storage system. Hopefully a update to this app addresses this. In the meantime I have to copy over my DS games from my SD card to Internal Storage.
issue, only, The emulator itself works great and runs most games flawlessly. There is built-in cheat support and the app comes with it's own cheat database. The only issue is with Android 11 users, the app cannot access any files on the Sd Card due to Android 11's Scoped Storage system. Hopefully a update to this app addresses this. In the meantime I have to copy over my DS games from my SD card to Internal Storage.
emulator, Great, Great emulator! Lots of customizability. Easy to use. Well worth the price.
emulation, Perfect, Perfect emulation. Using with my Fire HD10 Plus tablet mostly with zero issues. Runs games perfectly even with the settings cranked up.
game, Good, Good game
storage, internal, Since my Redmi Note 9 Pro updated to Android 11, it cannot access any storage (internal and external). Please update it.
way, good, Really good way to enjoy DS games on your phone. Especially if you have an HDMI adapter to play on tv with PS4 trackpad.
emulator, fantastic, Freaking fantastic emulator. I was considering buying a Nintendo DS to relive my childhood games, but instead I bought this app plus a mobile controller. I'm so happy that I can pop up my makeshift Nintendo DS on my phone anywhere. I highly recommend this emulator, you won't regret it. :)
controller, mobile, Freaking fantastic emulator. I was considering buying a Nintendo DS to relive my childhood games, but instead I bought this app plus a mobile controller. I'm so happy that I can pop up my makeshift Nintendo DS on my phone anywhere. I highly recommend this emulator, you won't regret it. :)
emulator, best, One of the best DS emulator in play store 😗😘
feature, local, Please enable "Link local/remote" feature to trade pokemons between and in-between games. Also battling other trainers would be cool.
trainers, other, Please enable "Link local/remote" feature to trade pokemons between and in-between games. Also battling other trainers would be cool.
game, automatic, Phone: Xiaomi Mi 11 Lite 8/128, Snapdragon 732G. DraStic automatic game scanning doesn't work. Searching manually also doesn't work, permission for files and data are already allowed, but the search manually on internal storage doesn't work. Trying to open manually on File Manager app also doesn't work, it doesn't have DraStic as a choice to open the app. Please do fix this. What's the purpose of me paying this app if I can't use it?
storage, internal, Phone: Xiaomi Mi 11 Lite 8/128, Snapdragon 732G. DraStic automatic game scanning doesn't work. Searching manually also doesn't work, permission for files and data are already allowed, but the search manually on internal storage doesn't work. Trying to open manually on File Manager app also doesn't work, it doesn't have DraStic as a choice to open the app. Please do fix this. What's the purpose of me paying this app if I can't use it?
emulation, Perfect, Perfect emulation, cheats are pre downloaded if you decide you want to use them. No complaints whatsoever.
superstar, Emulated, Emulated Kirby superstar, first time I played since I was 8, big ups to you guys loved the emulator. Ran smoothly.
time, first, Emulated Kirby superstar, first time I played since I was 8, big ups to you guys loved the emulator. Ran smoothly.
ups, big, Emulated Kirby superstar, first time I played since I was 8, big ups to you guys loved the emulator. Ran smoothly.
emulator, favourite, My favourite DS emulator. The ability to flip screens (toggle) on controller L3 or R3 is so cool. I wish there was support for multiplayer, the options are there but nothing works. I'd give a 100 star review if you manage to get it up and running. 😉
phones, newer, -edited review- it works fine but in newer phones you have to put your games in the internal memory and its kinda tricky. 3 stars for the lack of support. . --old review-- i never bought an application before but after trying the best "free emulators" and reading a few forum reviews i decided to give this a try... i was not disappointed at all. Heil Kirby!!!
memory, internal, -edited review- it works fine but in newer phones you have to put your games in the internal memory and its kinda tricky. 3 stars for the lack of support. . --old review-- i never bought an application before but after trying the best "free emulators" and reading a few forum reviews i decided to give this a try... i was not disappointed at all. Heil Kirby!!!
emulators, best, -edited review- it works fine but in newer phones you have to put your games in the internal memory and its kinda tricky. 3 stars for the lack of support. . --old review-- i never bought an application before but after trying the best "free emulators" and reading a few forum reviews i decided to give this a try... i was not disappointed at all. Heil Kirby!!!
emulators, free, -edited review- it works fine but in newer phones you have to put your games in the internal memory and its kinda tricky. 3 stars for the lack of support. . --old review-- i never bought an application before but after trying the best "free emulators" and reading a few forum reviews i decided to give this a try... i was not disappointed at all. Heil Kirby!!!
experience, great, Emulator works great gaming experience is great however after purchasing the emulator I joined my wife's Google Play family library and I am unable to share this game even though I've already purchased it. I would like to share this emulator with my children on their tablets however I am unable to. Any information in regards to this would be great.
storage, internal, Tried it but it's unable to find files on internal storage rendering it useless because I can't load any games. This is apparently a know issue since March 2020 but hasn't been fixed.
issue, know, Tried it but it's unable to find files on internal storage rendering it useless because I can't load any games. This is apparently a know issue since March 2020 but hasn't been fixed.
mistakes, Many, Many mistakes on a moto G8 power with android 11, pleas fix it
power, moto, Many mistakes on a moto G8 power with android 11, pleas fix it
dudd, great, great dudd
games, recongizing, Stopped recongizing games and no longer functions.
functions, longer, Stopped recongizing games and no longer functions.
error, detected, After I installed this on my S10 I started getting the moisture detected error. Phone won't take a charge now. Requesting refund.
emulator, best, The best ds emulator for Android
battles, specific, Emulator works but crashes in specific battles in ffta2. Looking forward to a fix
emulator, great, It is a great emulator for those who have the files needed for the games. Also those files are easy to find online if you do not currently have them.
emulator, only, This is the only ds emulator for android that works great
emulator, ds, This is the only ds emulator for android that works great
screens, black, Used to be good but now it constantly crashes black screens or sends me to my lock screen when I click on load game and the developer doesn't respond to emails nor fixes the app and hardly ever updates the app
light, weird, Great App. But a weird blue light at the bottom of the screen as i play, kind of looks like when you ask siri or google and it actively listens to your voice. Kind of weird and don't know what it is. Would like an answer!!
light, blue, Great App. But a weird blue light at the bottom of the screen as i play, kind of looks like when you ask siri or google and it actively listens to your voice. Kind of weird and don't know what it is. Would like an answer!!
emulator, irreplaceable, An irreplaceable DS emulator. This is best and go-to emulator for those who want to play DS games. It's got everything I wish other console emulators wouuld have.
emulators, other, An irreplaceable DS emulator. This is best and go-to emulator for those who want to play DS games. It's got everything I wish other console emulators wouuld have.
bust, drastic, I have a galaxy s21 and have used drastic forever bust since I got this phone speed up on games is choppy and unplayable its fine unsped up I've looked everywhere for a fix and can't find anything
application, good, very good application!!!
emulator, best, this is the best emulator for Nintendo DS
storage, scoped, Needs update to fix scoped storage on Android 11 Samsung phone, please...
emulator, Phenomenal, Phenomenal emulator. I haven't had any bug's, performance & graphical issues. All the games I've tried booted up without a hitch. It runs as smooth as melted butter, endless customization, graphical and performance options. Truly an amazing product! Costing only $5 ridiculously cheap! If you're a ds fan and want to bank on nostalgia or a random looking for more games you can't go wrong with this emulator. High recommendation!
