VERB, PREP, POBJ, 
play, on, pc, Even though this was a good game to play on the pc and console, the problems with this game is you need some serious mobile hardware to play this. When i was playing this cutscenes were fine however at some points the game was crashing or other times stalling from granade explosions. The game was also crashing at random when i was just in the xcom hq managing things.
crashing, at, points, Even though this was a good game to play on the pc and console, the problems with this game is you need some serious mobile hardware to play this. When i was playing this cutscenes were fine however at some points the game was crashing or other times stalling from granade explosions. The game was also crashing at random when i was just in the xcom hq managing things.
stalling, from, explosions, Even though this was a good game to play on the pc and console, the problems with this game is you need some serious mobile hardware to play this. When i was playing this cutscenes were fine however at some points the game was crashing or other times stalling from granade explosions. The game was also crashing at random when i was just in the xcom hq managing things.
had, for, ages, I've had this for ages, and I'm playing through again on a tablet, which is going pretty well. A few odd glitches but overall still a great game. But I actually came here to explain to others that even though I also get the "no Google account" error, it's simply that it's trying to connect to Google+, bless its heart. Turns out that it still saves on the device itself just fine if I select a spot to save and hit "next." I do wish the devs would break the news about Google+ to it, though.
playing, on, tablet, I've had this for ages, and I'm playing through again on a tablet, which is going pretty well. A few odd glitches but overall still a great game. But I actually came here to explain to others that even though I also get the "no Google account" error, it's simply that it's trying to connect to Google+, bless its heart. Turns out that it still saves on the device itself just fine if I select a spot to save and hit "next." I do wish the devs would break the news about Google+ to it, though.
explain, to, others, I've had this for ages, and I'm playing through again on a tablet, which is going pretty well. A few odd glitches but overall still a great game. But I actually came here to explain to others that even though I also get the "no Google account" error, it's simply that it's trying to connect to Google+, bless its heart. Turns out that it still saves on the device itself just fine if I select a spot to save and hit "next." I do wish the devs would break the news about Google+ to it, though.
connect, to, Google+, I've had this for ages, and I'm playing through again on a tablet, which is going pretty well. A few odd glitches but overall still a great game. But I actually came here to explain to others that even though I also get the "no Google account" error, it's simply that it's trying to connect to Google+, bless its heart. Turns out that it still saves on the device itself just fine if I select a spot to save and hit "next." I do wish the devs would break the news about Google+ to it, though.
saves, on, device, I've had this for ages, and I'm playing through again on a tablet, which is going pretty well. A few odd glitches but overall still a great game. But I actually came here to explain to others that even though I also get the "no Google account" error, it's simply that it's trying to connect to Google+, bless its heart. Turns out that it still saves on the device itself just fine if I select a spot to save and hit "next." I do wish the devs would break the news about Google+ to it, though.
break, to, it, I've had this for ages, and I'm playing through again on a tablet, which is going pretty well. A few odd glitches but overall still a great game. But I actually came here to explain to others that even though I also get the "no Google account" error, it's simply that it's trying to connect to Google+, bless its heart. Turns out that it still saves on the device itself just fine if I select a spot to save and hit "next." I do wish the devs would break the news about Google+ to it, though.
cloud, to, Google+, Tries to cloud save to Google+, which predictably fails, given that it hasn't existed for 2.5 years now. Misregisters the location of your touches so you have to tap sightly above buttons, and you get stuck in one demo level because you can neither shoot or cancel your action. I'm sure it's a great game but it's been abandoned for years and is approaching unsupported obsolescence.
existed, for, years, Tries to cloud save to Google+, which predictably fails, given that it hasn't existed for 2.5 years now. Misregisters the location of your touches so you have to tap sightly above buttons, and you get stuck in one demo level because you can neither shoot or cancel your action. I'm sure it's a great game but it's been abandoned for years and is approaching unsupported obsolescence.
tap, above, buttons, Tries to cloud save to Google+, which predictably fails, given that it hasn't existed for 2.5 years now. Misregisters the location of your touches so you have to tap sightly above buttons, and you get stuck in one demo level because you can neither shoot or cancel your action. I'm sure it's a great game but it's been abandoned for years and is approaching unsupported obsolescence.
stuck, in, level, Tries to cloud save to Google+, which predictably fails, given that it hasn't existed for 2.5 years now. Misregisters the location of your touches so you have to tap sightly above buttons, and you get stuck in one demo level because you can neither shoot or cancel your action. I'm sure it's a great game but it's been abandoned for years and is approaching unsupported obsolescence.
abandoned, for, years, Tries to cloud save to Google+, which predictably fails, given that it hasn't existed for 2.5 years now. Misregisters the location of your touches so you have to tap sightly above buttons, and you get stuck in one demo level because you can neither shoot or cancel your action. I'm sure it's a great game but it's been abandoned for years and is approaching unsupported obsolescence.
connect, to, account, Unable to connect to Google account. So I'm unable to save my game. This needs to be fixed
Seems, for, port, Honestly why does it need to access contacts, phone history, etc. Seems pretty predatory for an old XCOM port.
paying, for, this, Fun game but has been abandoned by the devs for another version. Avoid paying money for this as crashes are frequent due to lack of updates to current mobile devices.
logged, into, Play, As stated by others, even though I'm properly logged into Google Play, the game will not save on my Android 9 device. Also, it does not properly center on my screen and the button presses must be a little above each button. Epic fail... Got a refund within a few minutes of testing the game.
save, on, device, As stated by others, even though I'm properly logged into Google Play, the game will not save on my Android 9 device. Also, it does not properly center on my screen and the button presses must be a little above each button. Epic fail... Got a refund within a few minutes of testing the game.
center, on, screen, As stated by others, even though I'm properly logged into Google Play, the game will not save on my Android 9 device. Also, it does not properly center on my screen and the button presses must be a little above each button. Epic fail... Got a refund within a few minutes of testing the game.
Got, within, minutes, As stated by others, even though I'm properly logged into Google Play, the game will not save on my Android 9 device. Also, it does not properly center on my screen and the button presses must be a little above each button. Epic fail... Got a refund within a few minutes of testing the game.
running, on, Android, Can't believe it this awe game running on Android 😲
run, on, phones, The game is great, but will there be any updates? More maps? Maybe some of the DLC's? Updated graphics? Even if I had to pay again, that would be nice for those who can't run Xcom 2 on their phones and being fair, this port doesn't really hold in 2021.
hold, in, 2021, The game is great, but will there be any updates? More maps? Maybe some of the DLC's? Updated graphics? Even if I had to pay again, that would be nice for those who can't run Xcom 2 on their phones and being fair, this port doesn't really hold in 2021.
beat, on, breaks, Loved it soooo much, nothing but positive vibes. Thanks for allowing me to beat this game on breaks and lunches
opted, for, phone, Overall great game. The only problem is the game is opted for a lower quality phone so sometimes the game will freeze then crash if you have a higher quality phone. The graphics look very poor and there's no way to change that in the settings
change, in, settings, Overall great game. The only problem is the game is opted for a lower quality phone so sometimes the game will freeze then crash if you have a higher quality phone. The graphics look very poor and there's no way to change that in the settings
log, into, play, I really want to play but I can log into Google play, so you can't save...
Played, on, PC, Played on PC however playing on android devices has issues on certain phone's. Using a Samsung A2core octa core and 1 gb ram and game will boot and run opening cut scene perfectly until loading first level then hard crash closing the game. Given the game a 5 star because the game is fantastic just a shame I can't play it on this handset.
playing, on, devices, Played on PC however playing on android devices has issues on certain phone's. Using a Samsung A2core octa core and 1 gb ram and game will boot and run opening cut scene perfectly until loading first level then hard crash closing the game. Given the game a 5 star because the game is fantastic just a shame I can't play it on this handset.
play, on, handset, Played on PC however playing on android devices has issues on certain phone's. Using a Samsung A2core octa core and 1 gb ram and game will boot and run opening cut scene perfectly until loading first level then hard crash closing the game. Given the game a 5 star because the game is fantastic just a shame I can't play it on this handset.
downloads, from, store, App downloads from the store but when I launch it I get an error saying download failed and the game exits.
Avoid, like, plague, Can't even manual local save on device. Also no cloud saves . Avoid this game like the plague , no developer support and last update was over 4 years ago.
reveal, with, Scanner, Like the game, but unfortunately, it seems to freak out and freeze up whenever I reveal a Stalker with a Battle Scanner.
log, into, account, It's a great game but saving is impossible. I can't log into a Google account so my progress is never saved. Worked fine on the last phone had. It's just giving an error message. This game is unplayable without being able to save progress. Skip it until you see reviews saying its been addressed.
Worked, on, phone, It's a great game but saving is impossible. I can't log into a Google account so my progress is never saved. Worked fine on the last phone had. It's just giving an error message. This game is unplayable without being able to save progress. Skip it until you see reviews saying its been addressed.
crashed, in, row, It crashed too much sometimes 3 to 4 times in a row
using, for, disc, This is a terrific game, especially if you played the old XCOM games using the 3 and 1/2 inch for 5 and 1/4 inch disc. If you download this game, you're going to have a great time.
seems, on, phone, Really decent game. Although on phone it seems a little to "close up" . I assume it wouldn't be so bad on tablet?
Depends, on, device, Depends on your device. Don't run on a 2014 phone.
run, on, phone, Depends on your device. Don't run on a 2014 phone.
work, on, Chromebook, Does not work on Chromebook.
optimized, for, mobile, It crashes when trying to load it resume game. It's a fun game but what's the point if you can't beat it. This problem is very common, the game isn't well optimized for mobile.
played, on, ps4, I played this on my ps4 and on phone i like them both
Getting, into, positions, Looks great, controls are glitchy. Getting into elevated positions is iffy at best. It errors when loading or saving because Google+ doesn't exist any longer.
connect, with, saves, Gameplay is quite awesome but left lil bit disappointing because unable to cloud saves using Google Play Games.. Unable to connect with other cloud saves available.. Maybe developer just didn't care about this game anymore..
care, about, game, Gameplay is quite awesome but left lil bit disappointing because unable to cloud saves using Google Play Games.. Unable to connect with other cloud saves available.. Maybe developer just didn't care about this game anymore..
done, for, phone, Fun game just as I remember well done for the phone
make, to, mobile, Will Xcom 2 ever make the port to mobile?
let, On, Xiaomi, It used to be a good game but it stopped working. On Xiaomi mi 10 miui 12.5 it doesn't let to perform some actions and it is impossible to complete missions.
crashed, during, screen, Game crashed during game booting screen in mi11t pro. Saddd
crashed, in, pro, Game crashed during game booting screen in mi11t pro. Saddd
played, Within, game, I have never played Enemy Within but the base game, I have betten feels good.
crashes, on, phone, I just bought a Samsung Galaxy A12 and was super excited to finally have enough space for XCOM again. Unfortunately it crashes on this phone too I guess. Such a bummer.
beat, in, lmao, This game has so many glitches and crashes all the time. I should be refunded for being able to beat it in its current condition lmao
updated, with, expansions, Great game but it really needs to be updated with some new expansions and experiences for game play.
complaining, about, issue, Only problem is it's a little zoomed in, making it more diffult to plan out an ambush without zooming out over and over. Everyone complaining about the elevation issue there's a camera button with an up and down toggle 🤦. Plays extremely well, only had a few crashea and those were only launching the game not in the middle of a battle. I'm honestly surprised how well This was ported over, and the price?? On steam and Xbox this still runs at $40, but here the exact game is $5. No brainer 💁
launching, in, middle, Only problem is it's a little zoomed in, making it more diffult to plan out an ambush without zooming out over and over. Everyone complaining about the elevation issue there's a camera button with an up and down toggle 🤦. Plays extremely well, only had a few crashea and those were only launching the game not in the middle of a battle. I'm honestly surprised how well This was ported over, and the price?? On steam and Xbox this still runs at $40, but here the exact game is $5. No brainer 💁
runs, On, steam, Only problem is it's a little zoomed in, making it more diffult to plan out an ambush without zooming out over and over. Everyone complaining about the elevation issue there's a camera button with an up and down toggle 🤦. Plays extremely well, only had a few crashea and those were only launching the game not in the middle of a battle. I'm honestly surprised how well This was ported over, and the price?? On steam and Xbox this still runs at $40, but here the exact game is $5. No brainer 💁
runs, at, 40, Only problem is it's a little zoomed in, making it more diffult to plan out an ambush without zooming out over and over. Everyone complaining about the elevation issue there's a camera button with an up and down toggle 🤦. Plays extremely well, only had a few crashea and those were only launching the game not in the middle of a battle. I'm honestly surprised how well This was ported over, and the price?? On steam and Xbox this still runs at $40, but here the exact game is $5. No brainer 💁
selecting, as, position, Overall game is fine, just a little trouble when selecting slove as the end position. Sometimes can't even select the slove (stairs is fine though)
crashing, on, Nord, Keeps crashing on a OnePlus Nord 5g phone Please fix this issue bc I liked the game on Xbox
liked, on, Xbox, Keeps crashing on a OnePlus Nord 5g phone Please fix this issue bc I liked the game on Xbox
plays, with, crash, The tutorial is broken but the rest of the game plays fine with an occasional crash,
beat, With, expansion, Great game and mobile port. With the expansion, for the price, can't be beat
beat, for, price, Great game and mobile port. With the expansion, for the price, can't be beat
connecting, to, account, Game has trouble connecting to Google account so you can't save your progress. Shame game feels fantastic....even if it was the tutorial...
save, to, phone, Won't save to phone. Chinese game company and Chinese phone(Nubia Red Magic 5G Global-Android 11) and will not save game progress due to write fail. Just fix the write permission, or a redirect flag for the save location.
Works, with, controls, Device: one plus 7 pro The game runs and looks great. Works perfectly with touch controls. Except for the pc this is the best way to play the game. I've had one slight issue where because of my curved screen some UI elements don't quite display right, but it doesn't impact gameplay at all so it's nothing major. I haven't tested controller support but the touch controls work so well that I wouldn't use one anyway, might be worth looking into if you have an android TV though.
display, because, screen, Device: one plus 7 pro The game runs and looks great. Works perfectly with touch controls. Except for the pc this is the best way to play the game. I've had one slight issue where because of my curved screen some UI elements don't quite display right, but it doesn't impact gameplay at all so it's nothing major. I haven't tested controller support but the touch controls work so well that I wouldn't use one anyway, might be worth looking into if you have an android TV though.
load, without, fail, Great game and a good port until you need to load. Mine crashes every time I load the game without fail. I literally can't play unless I want to start from scratch. It's a shame because I was really getting to like my squad.
start, from, scratch, Great game and a good port until you need to load. Mine crashes every time I load the game without fail. I literally can't play unless I want to start from scratch. It's a shame because I was really getting to like my squad.
show, on, device, Please don't show up on my device without my permission, I SHALL migrate TO APPLE. and I going to at on Reddit.
show, without, permission, Please don't show up on my device without my permission, I SHALL migrate TO APPLE. and I going to at on Reddit.
migrate, TO, APPLE, Please don't show up on my device without my permission, I SHALL migrate TO APPLE. and I going to at on Reddit.
starting, from, scratch, Crashes on any attempt to save. Get used to seeing "Failed to write save" and starting from scratch. The cloud save and Facebook login aren't compatible with the latest Android. Otherwise a great game but not the type you can play without access to saves. Please fix compatibility issues.
play, without, access, Crashes on any attempt to save. Get used to seeing "Failed to write save" and starting from scratch. The cloud save and Facebook login aren't compatible with the latest Android. Otherwise a great game but not the type you can play without access to saves. Please fix compatibility issues.
played, after, math, Bought the game, but it just won't install! After downloading 3gigs of data, it says, failed to install! Bought the game cause I have played xcom 2 and UFO after math and after light. This was disappointing. Edit: they fixed the bug, however, after my first session it seems the save file got corrupted, due to which I am unable to load it again. 2-3 hours of game save. At this point I have given up really. Just play it on your system guys, X-com just isn't working out for on the go
fixed, after, session, Bought the game, but it just won't install! After downloading 3gigs of data, it says, failed to install! Bought the game cause I have played xcom 2 and UFO after math and after light. This was disappointing. Edit: they fixed the bug, however, after my first session it seems the save file got corrupted, due to which I am unable to load it again. 2-3 hours of game save. At this point I have given up really. Just play it on your system guys, X-com just isn't working out for on the go
given, At, point, Bought the game, but it just won't install! After downloading 3gigs of data, it says, failed to install! Bought the game cause I have played xcom 2 and UFO after math and after light. This was disappointing. Edit: they fixed the bug, however, after my first session it seems the save file got corrupted, due to which I am unable to load it again. 2-3 hours of game save. At this point I have given up really. Just play it on your system guys, X-com just isn't working out for on the go
play, on, guys, Bought the game, but it just won't install! After downloading 3gigs of data, it says, failed to install! Bought the game cause I have played xcom 2 and UFO after math and after light. This was disappointing. Edit: they fixed the bug, however, after my first session it seems the save file got corrupted, due to which I am unable to load it again. 2-3 hours of game save. At this point I have given up really. Just play it on your system guys, X-com just isn't working out for on the go
working, on, go, Bought the game, but it just won't install! After downloading 3gigs of data, it says, failed to install! Bought the game cause I have played xcom 2 and UFO after math and after light. This was disappointing. Edit: they fixed the bug, however, after my first session it seems the save file got corrupted, due to which I am unable to load it again. 2-3 hours of game save. At this point I have given up really. Just play it on your system guys, X-com just isn't working out for on the go
work, on, motorola, Won't work on a motorola
work, from, soldier, The game does not work. Movements do not work from each soldier to soldier. Game freezes. Just a bad port. Should not be sold in this condition. Waste of money.
sold, in, condition, The game does not work. Movements do not work from each soldier to soldier. Game freezes. Just a bad port. Should not be sold in this condition. Waste of money.
involved, at, difficulty, Best strategy game available on android so far ! Great variability , actuall thinking involved at higher difficulty , and has replayability .
porting, to, mobile, Awesome port of an awesome game except they didn't do such an awesome job actually porting the game to mobile. If it would work I'd give it 5 stars and say it's the best game on mobile devices.
paid, for, game, Im annoyed that i paid money for a game that twice now ive had to close before completing the tutorial due to inability to progress.
completing, due, inability, Im annoyed that i paid money for a game that twice now ive had to close before completing the tutorial due to inability to progress.
find, on, mobile, The best game I find on mobile, but be careful is a very hard game, you don't play to chill and relax, you play hard 😅
work, on, Fold, Doesn't work on the Galaxy Fold 3
install, onto, card, I love this game and this is a fairly faithful port of it. I wish I could give it a higher rating but the fact that I can't install it onto my SD card means I can't free up enough space to play it on my new mobile device. I'd love to be able to give it a higher rating.
play, on, device, I love this game and this is a fairly faithful port of it. I wish I could give it a higher rating but the fact that I can't install it onto my SD card means I can't free up enough space to play it on my new mobile device. I'd love to be able to give it a higher rating.
ending, after, mission, Fantastic game, but I've encountered 3 issues that are a bit annoying. Cloud Save doesn't seem to work, I've had occasional never ending loads after a mission causing me to that progress, and minorly, some crashes continuing a game in progress, resolved by force closing the game and restarting. 4 stars despite those issues.
causing, to, progress, Fantastic game, but I've encountered 3 issues that are a bit annoying. Cloud Save doesn't seem to work, I've had occasional never ending loads after a mission causing me to that progress, and minorly, some crashes continuing a game in progress, resolved by force closing the game and restarting. 4 stars despite those issues.
runs, on, poco, Some bugs, but not gamebreaking, reload solved most. But great game, runs good on poco x3 pro. Some animations (running) can be lagging.
runs, on, x3, Some bugs, but not gamebreaking, reload solved most. But great game, runs good on poco x3 pro. Some animations (running) can be lagging.
runs, on, pro, Some bugs, but not gamebreaking, reload solved most. But great game, runs good on poco x3 pro. Some animations (running) can be lagging.
bought, for, bucks, Well I bought this game for 5 bucks and it seemed like it would be a great game but it would do anything it wouldnt let me attack or overwatch anything
play, at, time, Brand new Samsung and it keeps crashing I really love this game. It sucks I can only play a few minutes at a time I'm lucky.
get, down, props, I have to say this is definitely one of the best mobile games you can get hands down props to the makers 👍
get, to, makers, I have to say this is definitely one of the best mobile games you can get hands down props to the makers 👍
