VERB, PREP, POBJ, 
leading, to, end, It's okay. I just cannot get over the mechanic of enemies creating new paths leading basically to the end, or the enemies who phase around the paths and wind up near the end. It feels cheap. Oh, you didn't fortify the very end of the path? Well here comes 50 enemies who just phased around all of your defenses. Usually just ends in a restart and then prepping for it next time, but the point is it's artificial difficulty and I dislike it.
phased, around, all, It's okay. I just cannot get over the mechanic of enemies creating new paths leading basically to the end, or the enemies who phase around the paths and wind up near the end. It feels cheap. Oh, you didn't fortify the very end of the path? Well here comes 50 enemies who just phased around all of your defenses. Usually just ends in a restart and then prepping for it next time, but the point is it's artificial difficulty and I dislike it.
ends, in, restart, It's okay. I just cannot get over the mechanic of enemies creating new paths leading basically to the end, or the enemies who phase around the paths and wind up near the end. It feels cheap. Oh, you didn't fortify the very end of the path? Well here comes 50 enemies who just phased around all of your defenses. Usually just ends in a restart and then prepping for it next time, but the point is it's artificial difficulty and I dislike it.
prepping, for, it, It's okay. I just cannot get over the mechanic of enemies creating new paths leading basically to the end, or the enemies who phase around the paths and wind up near the end. It feels cheap. Oh, you didn't fortify the very end of the path? Well here comes 50 enemies who just phased around all of your defenses. Usually just ends in a restart and then prepping for it next time, but the point is it's artificial difficulty and I dislike it.
Start, with, one, The FUNNEST Kingdom Rush Game. I'm a huge fan of the series and this one is by far the funnest to me. Great heroes, great spells, I beat this one way quicker than the others. Start with the first one or Frontiers I would recommend. But once you get some games under your belt you'll love this one too.
pay, for, champs, This game has provided entertainment since I was a kid and still holds up. Having to pay for champs is kind of a drag and not having a fast forward option are the only gripes I have.
played, off, game, This is a very good game and I played all off the Kingdom Rush game's
deducted, for, dragon, Money was deducted for dragon, but it didnt unlock. Stupid game i want refund for my purchase
paid, for, this, Don't like the constant pop ups and also I paid full price for this, whats with the freemium stuff? Game is alright
s, with, stuff, Don't like the constant pop ups and also I paid full price for this, whats with the freemium stuff? Game is alright
is, of, KR, After playing this game I bought every other game there is of KR, its fast paced gameplay and its alot more unique which is what alot of TD games lack. I really love this game and i hope they can expand their games into something big :) From Big Donner Kebab
expand, into, something, After playing this game I bought every other game there is of KR, its fast paced gameplay and its alot more unique which is what alot of TD games lack. I really love this game and i hope they can expand their games into something big :) From Big Donner Kebab
play, on, pc, One of the game that I play on pc back to the day
Pay, To, Win, Simply Put: Pay To Win 3$ then... Pay To Win... seriously? Please balance your game instead of charging in game grinding diams.
download, onto, device, Love the whole KR series. There's 4 games and I download all 4 onto each device I get. They are endlessly replayable, even if you start over. I love to play them on flights, it makes the flight pass quickly. Can't recommend enough!
play, on, flights, Love the whole KR series. There's 4 games and I download all 4 onto each device I get. They are endlessly replayable, even if you start over. I love to play them on flights, it makes the flight pass quickly. Can't recommend enough!
Love, in, frontier, Best grapic in the series. Not my favorite but thats my opinon. Love the mech in frontier.But man it looks nice man.I liked the boat map in frontier but this is nice all way around.My only complain is the paid heros.but the free are fine.I did buy denas.
lounging, at, home, Played a few rounds so far and overall smooth and fluid game play. Enjoying it while I wait or even lounging at home, this is a good TD to enjoy
paid, for, game, Great TD game but most the characters are behind a pay wall and I've already paid for your game and that doesn't sit well with me
sit, with, me, Great TD game but most the characters are behind a pay wall and I've already paid for your game and that doesn't sit well with me
play, on, iPod, Super fun! You ever play that balloon game on your iPod? Yeah, this is pretty much the same idea just a whole lot more enjoyable.
needs, on, map, So far, it's my least favorite KR game. Too much that needs your attention on the map. Still, a KR game is better than most.
buy, with, money, Love it so far! Fun and way more challenging than I was expecting. Love the art and design of it too. My only complaint is that you're expected to buy additional heros with physical money, instead of being able to earn them as you play or buy them with an in-game currency. Feel like a game that you already have to buy shouldn't have very many in-app purchases... and I'm sure many others will agree.
buy, with, currency, Love it so far! Fun and way more challenging than I was expecting. Love the art and design of it too. My only complaint is that you're expected to buy additional heros with physical money, instead of being able to earn them as you play or buy them with an in-game currency. Feel like a game that you already have to buy shouldn't have very many in-app purchases... and I'm sure many others will agree.
Feel, like, game, Love it so far! Fun and way more challenging than I was expecting. Love the art and design of it too. My only complaint is that you're expected to buy additional heros with physical money, instead of being able to earn them as you play or buy them with an in-game currency. Feel like a game that you already have to buy shouldn't have very many in-app purchases... and I'm sure many others will agree.
closing, in, middle, I'm using honor 9x pro mobile and have some issues with this game always closing in the middle of the game wich is annoying becouse the game can't autosave in the middle of the game wich forced me to start all over and shutting again. I love the game and sorry for having to write about this issue here becouse i cant find any report button inside the game . If it's not fixible can i get a refund for the game and the charchters insid the game.
autosave, in, middle, I'm using honor 9x pro mobile and have some issues with this game always closing in the middle of the game wich is annoying becouse the game can't autosave in the middle of the game wich forced me to start all over and shutting again. I love the game and sorry for having to write about this issue here becouse i cant find any report button inside the game . If it's not fixible can i get a refund for the game and the charchters insid the game.
write, about, issue, I'm using honor 9x pro mobile and have some issues with this game always closing in the middle of the game wich is annoying becouse the game can't autosave in the middle of the game wich forced me to start all over and shutting again. I love the game and sorry for having to write about this issue here becouse i cant find any report button inside the game . If it's not fixible can i get a refund for the game and the charchters insid the game.
paid, for, app, The Kingdom Rush games are all excellent. I'm not wild about the IAPs for an already paid for app, but it's still SOOOO good.
forgetting, about, time, Definitely keeps you busy, forgetting about the time.
play, since, 13, Always the best game i ever play since 13, never get bored of the story. Good character with a lot of skill variation. Challenging levels and enemies with bosses. Fun tower combination. Very pleasant gaming experience. 10/10 cartoonie graphic.
make, for, fun, This is yet another classic TD game. I'm not wild about micro-transactions, so I'm glad that Play Pass includes all of the Kingdom Rush series. Since this isn't their first game, a lot little improvements make for extra fun, but without sacrificing much of the winning concepts in the earlier games.
Bought, on, sale, Bought it on sale. It was a steal
immerses, into, game, I love the clean art that immerses you into the game, which is much better than kingdom rush. Unfortunately, I didn't see improvements with starting new rounds since Kingdom Rush, because the button is often blocked by the escape button. But I still love this game and it's definitely worth a shot.
starting, since, Rush, I love the clean art that immerses you into the game, which is much better than kingdom rush. Unfortunately, I didn't see improvements with starting new rounds since Kingdom Rush, because the button is often blocked by the escape button. But I still love this game and it's definitely worth a shot.
played, from, guys, So far every tower defense game I have played from these guys has been really good. Love how interactive the game play is instead of just building towers you have to use other things to pass a stage.
connect, to, store, Used to love playing this game and even owned some in game characters. Got a new phone and cant reclaim my bravebark, tells me i cant connect to the play store and all the prices are question marks. Once/ if this gets fixed for me I'll give it 5 stars bc i love the game.
fixed, for, me, Used to love playing this game and even owned some in game characters. Got a new phone and cant reclaim my bravebark, tells me i cant connect to the play store and all the prices are question marks. Once/ if this gets fixed for me I'll give it 5 stars bc i love the game.
looking, for, something, If you are looking for something after the free version this one is the right choice. Its the 2nd best one after Vengeance. Good jokes, well balanced
looking, after, version, If you are looking for something after the free version this one is the right choice. Its the 2nd best one after Vengeance. Good jokes, well balanced
crashing, on, stage, Game keeps crashing on stage "Crystal Lake".
loved, for, years, Ive loved this game for years
played, for, long, It is a amazing tower defense game played the kingdom rush series for so long and I loved this game it has cool towers and and amazing heros but you have to pay for them but that's ok.
pay, for, them, It is a amazing tower defense game played the kingdom rush series for so long and I loved this game it has cool towers and and amazing heros but you have to pay for them but that's ok.
progress, on, level, Game is okay, the enemies have weird abilities and feels tidious to play (often you need to wait ages to progress on a level). Other KR games are better
try, for, thanks, I got to try the game for free thanks to play pass! I am giving the game 1 star because they charge $3 for it. There are other games that are better of the same genre that are free. Would gave given 3 stars otherwise.
charge, for, it, I got to try the game for free thanks to play pass! I am giving the game 1 star because they charge $3 for it. There are other games that are better of the same genre that are free. Would gave given 3 stars otherwise.
expanding, with, details, Simple, yet engaging. I would suggest expanding the storyline with more details, so as to create more complex campaigns.
built, as, boost, Challenging without being too frustrating. Would be nice if one could get some credits built up as a boost within the game for having spent time here... Hmm? Mahalo, Auntie Sandy.
win, like, %, This game is awesome and not pay to win garbage like 99% of games on here. Highly recommended!
come, with, game, Love the lore or the KR series! Awesome prequel to the KR timeline, can't wait to see what new game they come up with next! Try to find all the easter eggs in every level BTW 😋
come, with, next, Love the lore or the KR series! Awesome prequel to the KR timeline, can't wait to see what new game they come up with next! Try to find all the easter eggs in every level BTW 😋
find, in, level, Love the lore or the KR series! Awesome prequel to the KR timeline, can't wait to see what new game they come up with next! Try to find all the easter eggs in every level BTW 😋
set, on, mode, First time td. I think I picked right one! Loads of fun, and not too difficult, when set on easy mode, to figure out. Recommended!
start, with, this, Another great game from Ironhide. If you like tower defense this is a top notch choice. If you've never played tower defense, start with this or another game from the publisher. Engaging game play, great aesthetic, poppin music. Not a deep story, but enough to bring some context and flavour. Never *need* to make any additional purchases beyond initial game to play through, but the option to expand choices is there for those who want some extra content. Lots of fun to be had here.
came, to, game, great game! I came to this game because of the original kindom rush. I am not disappointed.
came, because, rush, great game! I came to this game because of the original kindom rush. I am not disappointed.
thought, as, versions, It was nice but not as well thought out as the previous versions
take, on, TD, So far, I have really enjoyed the game. It's a great mythical take on old fashioned TD.
reached, after, weeks, It's a great game with different ways to play to make it challenging. However after only a few weeks I reached the end. Why are there not more levels? I see multiple other games to buy.
go, For, years, Consistently Fun tower defense. For years now every time I go to my play store library to check for games I end up installing one of these great story filled tower defense games. I don't know how to do reviews and the sounds cheesy to me so I'm just going to leave it at that.
go, to, library, Consistently Fun tower defense. For years now every time I go to my play store library to check for games I end up installing one of these great story filled tower defense games. I don't know how to do reviews and the sounds cheesy to me so I'm just going to leave it at that.
check, for, games, Consistently Fun tower defense. For years now every time I go to my play store library to check for games I end up installing one of these great story filled tower defense games. I don't know how to do reviews and the sounds cheesy to me so I'm just going to leave it at that.
leave, at, that, Consistently Fun tower defense. For years now every time I go to my play store library to check for games I end up installing one of these great story filled tower defense games. I don't know how to do reviews and the sounds cheesy to me so I'm just going to leave it at that.
listen, to, music, I love all the small details and reference the only thing that i don't like is that im not able to listen to music while playing
got, in, two, I was bored one night so i downloaded the first one. Not being a fan of tower defense games shows how bored I was. This game is a classic in the making. I have played the first 3 so far and its not pay to win. Sure you can buy heros but thats just buying a cheat code. All levels are easily winnable on all 3 versions I have so far, and I got max stars in the first two. Just gotta play smart. The extra heros are basically paying to cheat.
put, on, face, Absolute fun. Not designed to be unbeatable and yet offering some decent challenge. Little secrets and references to other material (games, books, films and comics) put a smile on my face. Big thank you to the developers. This little game is a delight!
thank, to, developers, Absolute fun. Not designed to be unbeatable and yet offering some decent challenge. Little secrets and references to other material (games, books, films and comics) put a smile on my face. Big thank you to the developers. This little game is a delight!
looked, for, games, I originally played the fiest one on computer and loved it, then I found out it was on mobile, and installed it right away. After I finished it, I looked for other games by Iron Hide and I wasn't disappointed. This one is much better in most areas, like heroes, and things to interact with in the map, buffed the soldiers on the ground, and changed some things like how the wizard tower fires. I love these games and I always will. These games are the only games I take time and review. -Ron Man
interact, in, map, I originally played the fiest one on computer and loved it, then I found out it was on mobile, and installed it right away. After I finished it, I looked for other games by Iron Hide and I wasn't disappointed. This one is much better in most areas, like heroes, and things to interact with in the map, buffed the soldiers on the ground, and changed some things like how the wizard tower fires. I love these games and I always will. These games are the only games I take time and review. -Ron Man
buffed, on, ground, I originally played the fiest one on computer and loved it, then I found out it was on mobile, and installed it right away. After I finished it, I looked for other games by Iron Hide and I wasn't disappointed. This one is much better in most areas, like heroes, and things to interact with in the map, buffed the soldiers on the ground, and changed some things like how the wizard tower fires. I love these games and I always will. These games are the only games I take time and review. -Ron Man
found, for, device, One of the best Tower Defense games I've found for my mobile device. Good job!
Came, after, months, Came back after 3 months to look back at this game which will have a permanent place in my heart. Still the same, but i really enjoyed it! Had completed this game about 2 or 3 months ago, went for the original kingdom rush. Keep it up, good devs!!
look, at, game, Came back after 3 months to look back at this game which will have a permanent place in my heart. Still the same, but i really enjoyed it! Had completed this game about 2 or 3 months ago, went for the original kingdom rush. Keep it up, good devs!!
went, for, rush, Came back after 3 months to look back at this game which will have a permanent place in my heart. Still the same, but i really enjoyed it! Had completed this game about 2 or 3 months ago, went for the original kingdom rush. Keep it up, good devs!!
knew, about, game, Honestly, before I knew about this game and played the more of, "future ish" type kingdom rush, I always wanted to know what made all this a thing? And when I found out about this game the one thing I wanted came true. I got to learn about how it happened. But aside from that, the gameplay was really good. It was just like the other game just a bit different. The style that you use for the characters is one of the things I like the most. I've actually used your character design for a few drawing
found, about, game, Honestly, before I knew about this game and played the more of, "future ish" type kingdom rush, I always wanted to know what made all this a thing? And when I found out about this game the one thing I wanted came true. I got to learn about how it happened. But aside from that, the gameplay was really good. It was just like the other game just a bit different. The style that you use for the characters is one of the things I like the most. I've actually used your character design for a few drawing
use, for, characters, Honestly, before I knew about this game and played the more of, "future ish" type kingdom rush, I always wanted to know what made all this a thing? And when I found out about this game the one thing I wanted came true. I got to learn about how it happened. But aside from that, the gameplay was really good. It was just like the other game just a bit different. The style that you use for the characters is one of the things I like the most. I've actually used your character design for a few drawing
used, for, drawing, Honestly, before I knew about this game and played the more of, "future ish" type kingdom rush, I always wanted to know what made all this a thing? And when I found out about this game the one thing I wanted came true. I got to learn about how it happened. But aside from that, the gameplay was really good. It was just like the other game just a bit different. The style that you use for the characters is one of the things I like the most. I've actually used your character design for a few drawing
run, past, infantry, The defensive unit A.I which was perfect in the original game is absolute garbage in this. The enemies just run past my infantry as if the A.I is braindead
played, at, times, Beat tower defense game ever played at times hard to beat and at time funny with in game voice
adds, to, titles, The rush series are perhaps the best tower defense games around, although this is the weakest in the series the visuals are washed out pastel and the gameplay adds nothing new to the previous titles.
playing, since, instalment, Been playing Kingdom Rush since the first instalment I bumped into on Kongregate. Then it was on Android. Needless to say, I was a hardcore fan since day one and I am NOT exactly a lover of tower defense type of games. So yeah, it's that good. Props to the developers!
bumped, on, Kongregate, Been playing Kingdom Rush since the first instalment I bumped into on Kongregate. Then it was on Android. Needless to say, I was a hardcore fan since day one and I am NOT exactly a lover of tower defense type of games. So yeah, it's that good. Props to the developers!
click, on, refund, Not giving me refund I didn't installed the app n click on refund but it didn't refund the amount which was deducted worst app so plz don't install Any aap of irongames OK Bakwas app developer
play, with, style, Very well made game, it reminds me of when I would play the OG kingdom rush when i was younger. No adds which is just a plus. It feels so magical and mistic to play with a very cool art style, worth the price!
beat, without, heroes, It it basically pay to win game. There is no way you beat the chapter 2 above without the most expensive heroes (it is cheap tho only $4). I have max lv phoenix but sill have difficulties beating the stage
spend, during, quarantine, Best game to spend time during quarantine.
playing, for, 10years, I have been playing this game for more than 10years since the fist kingdom rush. So much fun. Wish ironhide can created more games. Thank you.
playing, since, rush, I have been playing this game for more than 10years since the fist kingdom rush. So much fun. Wish ironhide can created more games. Thank you.
kept, during, levela, Was my favorite. Recently redownloaded and the game kept freezing during the last Campaign levela. Disappointed.
