VERB, PREP, POBJ, 
put, in, this, This game is garbage I'd doesn't have a tutorial the guy that speaks doesn't even help you he's just there to make you even more mad this game sucks it has nothing any other game has you didn't put time in this you rushed it has nothing. I would recommend updating it and give it something that makes it better this game sucks noodle cake studios it just sucks it has nothing
going, to, hell, -13615/10 I hope the creators of this game a die a very painful, tragic way and end up going to hell.
Frustrating, in, way, Frustrating in the most satisfying way possible. Beautiful commentary as you climb.
got, with, pass, I got this with play pass for free lol hahaha
got, for, hahaha, I got this with play pass for free lol hahaha
got, with, pass, Love it the first part is hard but its extra fun i got it with the play pass
launched, to, bottom, Bad Controls. Why does the guy auto adjust the hammer himself, and also why do I get launched to the very bottom when I touch an orange, but trying to launch myself ends up with me going 1 inch above the ground.
ends, with, me, Bad Controls. Why does the guy auto adjust the hammer himself, and also why do I get launched to the very bottom when I touch an orange, but trying to launch myself ends up with me going 1 inch above the ground.
going, above, ground, Bad Controls. Why does the guy auto adjust the hammer himself, and also why do I get launched to the very bottom when I touch an orange, but trying to launch myself ends up with me going 1 inch above the ground.
allow, for, movement, Definitely as challenging, stressful, and frustrating as I was expecting. The controls could be refined just a little bit further to allow for more precise movement. Definitely a lot of fun as far as mobile games go. Excellent work.
celeste, in, regard, This is game is not frustrating. It's as Bennett Foddy says we create the mountain in our attempts to reach the summit. Every time I fall I know that when I make it back up I will feel better. This game is similar to celeste in that regard. In that game its the death count. In this it's falling. In a game like this when you fail you learn how to prevent this new failure. In celeste the first time I beat it I died over 1000 times. Now i can beat with less than 40. You can feel great relief then.
falling, In, this, This is game is not frustrating. It's as Bennett Foddy says we create the mountain in our attempts to reach the summit. Every time I fall I know that when I make it back up I will feel better. This game is similar to celeste in that regard. In that game its the death count. In this it's falling. In a game like this when you fail you learn how to prevent this new failure. In celeste the first time I beat it I died over 1000 times. Now i can beat with less than 40. You can feel great relief then.
learn, In, game, This is game is not frustrating. It's as Bennett Foddy says we create the mountain in our attempts to reach the summit. Every time I fall I know that when I make it back up I will feel better. This game is similar to celeste in that regard. In that game its the death count. In this it's falling. In a game like this when you fail you learn how to prevent this new failure. In celeste the first time I beat it I died over 1000 times. Now i can beat with less than 40. You can feel great relief then.
died, In, celeste, This is game is not frustrating. It's as Bennett Foddy says we create the mountain in our attempts to reach the summit. Every time I fall I know that when I make it back up I will feel better. This game is similar to celeste in that regard. In that game its the death count. In this it's falling. In a game like this when you fail you learn how to prevent this new failure. In celeste the first time I beat it I died over 1000 times. Now i can beat with less than 40. You can feel great relief then.
died, In, time, This is game is not frustrating. It's as Bennett Foddy says we create the mountain in our attempts to reach the summit. Every time I fall I know that when I make it back up I will feel better. This game is similar to celeste in that regard. In that game its the death count. In this it's falling. In a game like this when you fail you learn how to prevent this new failure. In celeste the first time I beat it I died over 1000 times. Now i can beat with less than 40. You can feel great relief then.
beat, with, 40, This is game is not frustrating. It's as Bennett Foddy says we create the mountain in our attempts to reach the summit. Every time I fall I know that when I make it back up I will feel better. This game is similar to celeste in that regard. In that game its the death count. In this it's falling. In a game like this when you fail you learn how to prevent this new failure. In celeste the first time I beat it I died over 1000 times. Now i can beat with less than 40. You can feel great relief then.
come, with, game, The most stupid (so called) game ever made. Some stupid company must've been REALLY bored to have come up with a worthless game. Isnt worth the digital space it's created in.
challenging, at, first, getting over it is a fun rage game. it can be challenging at first but once you beat it once or twice its pretty easy. c:
got, after, bit, Good, it was great, too hard tho got boring after a bit at least for me
got, for, me, Good, it was great, too hard tho got boring after a bit at least for me
is, for, developer, Haha 游땍 there is a special place in hell for this developer. It's so bad it's good, I really enjoy how it's purposely made to frustrate the hell out of you while simultaneously telling you that it's fine and to simply get over it. Well done 游녨!
get, over, it, Haha 游땍 there is a special place in hell for this developer. It's so bad it's good, I really enjoy how it's purposely made to frustrate the hell out of you while simultaneously telling you that it's fine and to simply get over it. Well done 游녨!
come, for, more, I found it annoying but calming I would say I quit but I always come back for more I want to beat it though
live, for, it, Pain, live for it
played, on, platforms, Frustrating but entertaining, haven't played on any other platforms so can't compare but despite the common complaints the controls seem responsive and work well in my experience. The game is just difficult.. get over it
seem, despite, complaints, Frustrating but entertaining, haven't played on any other platforms so can't compare but despite the common complaints the controls seem responsive and work well in my experience. The game is just difficult.. get over it
work, in, experience, Frustrating but entertaining, haven't played on any other platforms so can't compare but despite the common complaints the controls seem responsive and work well in my experience. The game is just difficult.. get over it
get, over, it, Frustrating but entertaining, haven't played on any other platforms so can't compare but despite the common complaints the controls seem responsive and work well in my experience. The game is just difficult.. get over it
had, at, beginning, "Don't worry I'll save your progress" That was a lie bud.. I just re-download it and it had me at the beginning when my other device is still on the huge tree so... not professional for a game maker.. I'm going to uninstall it cuz there's no point if you don't save my progress... I'm going to discuss a refund with Google
discuss, with, Google, "Don't worry I'll save your progress" That was a lie bud.. I just re-download it and it had me at the beginning when my other device is still on the huge tree so... not professional for a game maker.. I'm going to uninstall it cuz there's no point if you don't save my progress... I'm going to discuss a refund with Google
translates, to, mobile, If you've ever wanted a unique series of cramps in your hands and fingers, this game is for you. You know it's a good game when it makes you mad but also makes you wanna keep playing. It's a quality game for the price, and translates quite nicely to mobile. Pro-tip: mess around with the sensitivity and input acceleration to better suit your gameplay experience. It won't make the game easy, but it will make it easier. Also, PHYSICS.
finshed, in, week, I've loved the game I have finshed the game in 1 week with out raging once I was always calm and when I fell I did it agien and agien and it got more easier feeling really good to finsh the game and we want part 2 please lets start another new journey with a new getting over it map
used, to, it, Absolutely what i expected, a great game. There is the issue of your finger being in the way but i believe thats just an extra level of added difficulty to an already insanely hard game. You can get used to it though, easier if your more than a casual mobile gamer.
put, as, star, I put this as a 5 star because it's fun but only when you get past the object and yes this game will get you.
get, past, object, I put this as a 5 star because it's fun but only when you get past the object and yes this game will get you.
result, in, movements, Used to be decent. Control system has been changed and is now overly gittery and chaotic. They seemed to add an assist system so minor movements will result in massive movements even with minimal sensitivity. No way to change controls, should have an option for a joystick mode instead of what they have. Would not recommend until they revert the changes. Uninstalled
result, with, sensitivity, Used to be decent. Control system has been changed and is now overly gittery and chaotic. They seemed to add an assist system so minor movements will result in massive movements even with minimal sensitivity. No way to change controls, should have an option for a joystick mode instead of what they have. Would not recommend until they revert the changes. Uninstalled
cause, for, one, This game can cause lots of mental pain for one, but when you complete it you feel like a new person.
feel, like, person, This game can cause lots of mental pain for one, but when you complete it you feel like a new person.
recommend, to, you, The game itself is pretty interesting but if your not the patient and gentle kind, then I wouldn't really recommend this game to you. Overall it's a decent game with a simple purpose . (That is to obviously get over the mountain.) 3 starsl because I suck at it.
get, over, mountain, The game itself is pretty interesting but if your not the patient and gentle kind, then I wouldn't really recommend this game to you. Overall it's a decent game with a simple purpose . (That is to obviously get over the mountain.) 3 starsl because I suck at it.
suck, at, it, The game itself is pretty interesting but if your not the patient and gentle kind, then I wouldn't really recommend this game to you. Overall it's a decent game with a simple purpose . (That is to obviously get over the mountain.) 3 starsl because I suck at it.
s, in, places, Very fun and sometimes frustrating but theres a lot of lag in some places I face, just like how certain games have lag when you look somewhere
playing, on, screen, The guys below me and below him is dumb cuz its for mobile lile bruh playing in pc is different cuz its pc ur using a mouse but playing on mobile using touch screen yea lol
felt, at, end, Such a fun journey. I cannot explain the amount of happiness and how content I felt at the end. This took me over 3 months to finish but it was very worth it. I actually play the game when im stressed. The sounds are almost ear-candy and the backround ambience is very relaxing. One thing I would add is the option to enable motion blur as I quite like it and some higher-end devices could probably handle it.
enable, like, it, Such a fun journey. I cannot explain the amount of happiness and how content I felt at the end. This took me over 3 months to finish but it was very worth it. I actually play the game when im stressed. The sounds are almost ear-candy and the backround ambience is very relaxing. One thing I would add is the option to enable motion blur as I quite like it and some higher-end devices could probably handle it.
suffer, through, game, Hours of entertainment just watching other people suffer through this game. I absolutely love the whole concept.
flicks, at, point, Ok I guess, But i can't pass the 2nd level, at that point the game flicks you offa ledge and when that happended it said oof
playing, on, steam, This game is DIFFICULT. BRUTAL. I recommend playing this on steam. Mouse is an infinitely better control interface than phone touchpad. Love it though.
works, as, game, I think this works better as a mobile game. It's better to play it in small doses. Really satisfying to reach new landmarks on the mountain. Beware the jumpscare.
play, in, doses, I think this works better as a mobile game. It's better to play it in small doses. Really satisfying to reach new landmarks on the mountain. Beware the jumpscare.
subscribe, to, number, N a few years now and subscribe now and subscribe to the thumbnail number I have a good morning 游똂游꿀 you have any questions you
recommend, on, book, It was kinda fun don't recommend on chrome book even with mouse because it doesn't follow the mouse the way you would expect it to it is still fun but an aquired taste sorta game. Hope this reveiw helped!
recommend, with, mouse, It was kinda fun don't recommend on chrome book even with mouse because it doesn't follow the mouse the way you would expect it to it is still fun but an aquired taste sorta game. Hope this reveiw helped!
expect, to, it, It was kinda fun don't recommend on chrome book even with mouse because it doesn't follow the mouse the way you would expect it to it is still fun but an aquired taste sorta game. Hope this reveiw helped!
play, for, time, It's the worst ever game it's suck o MG you play for time and get back from the beginning
work, for, me, It doesn't work for me
get, over, something, I like the game but every time I get over something I rage a lot
flings, at, speed, it's a great game and I'm just not good at things like this, but I have 2 complaints. it flings me at the speed of light with one wrong swipe and I cant control the hammer sometimes. other than that it's really good and I recommend it.
flings, with, swipe, it's a great game and I'm just not good at things like this, but I have 2 complaints. it flings me at the speed of light with one wrong swipe and I cant control the hammer sometimes. other than that it's really good and I recommend it.
tried, to, speedruning, This game sucks. I've tried to speedruning but it's lag. UNPLAYABLE. No one plays this game. Seriously. Make another intresting games not this stupid game.
making, of, you, Instead of the game making fun of you it actually encourages you to push forward.
encourages, of, game, Instead of the game making fun of you it actually encourages you to push forward.
play, on, mobile, This is a frustratingly difficult at times game when using a mouse and keyboard. Touch controls could cause you to need blood pressure medication. I only gave it a 3* because the game itself is good. Just don't play it on mobile unless it's your only way or you're a massochist.
optimized, for, mobile, The game is the same as the PC version but graphics are optimized for mobile so there are little to no shadows.
yeeted, after, that, The game is good and fun sometimes but after my google play pass expired i opened it and after that it just yeeted me to google play and it was saying that my play pass expired and it gaved to me 2 options buy the game separaletly or buy the play pass Pls make it free
yeeted, to, play, The game is good and fun sometimes but after my google play pass expired i opened it and after that it just yeeted me to google play and it was saying that my play pass expired and it gaved to me 2 options buy the game separaletly or buy the play pass Pls make it free
gaved, to, me, The game is good and fun sometimes but after my google play pass expired i opened it and after that it just yeeted me to google play and it was saying that my play pass expired and it gaved to me 2 options buy the game separaletly or buy the play pass Pls make it free
laugh, at, mistake, Best way to laugh at your mistake. Puts the big mistakes into perspective
Puts, into, perspective, Best way to laugh at your mistake. Puts the big mistakes into perspective
spending, on, steam, The best experience on mobile instead of spending it on steam
runs, at, 20FPS, It runs really, really bad on my Pixel 3a XL, but it's pretty fun when it runs at a stable 20FPS...
cost, on, Samsung, Love it but can you make it not cost money on the Samsung lol cool game it is challenging i Bought it with my money some people say that the controls are bad on the tablet I don't think thats true the only bad thing about it is that it costs money minus the money its a great game
Bought, with, money, Love it but can you make it not cost money on the Samsung lol cool game it is challenging i Bought it with my money some people say that the controls are bad on the tablet I don't think thats true the only bad thing about it is that it costs money minus the money its a great game
costs, minus, money, Love it but can you make it not cost money on the Samsung lol cool game it is challenging i Bought it with my money some people say that the controls are bad on the tablet I don't think thats true the only bad thing about it is that it costs money minus the money its a great game
playing, with, sensitivity, I would recomend playing with the highest sensitivity and high input acceleration. It makes this game a slightly less excruciating experience.
love, for, me, This game is utterly horrible for people who get mad easily, but for me I love watching my friends scream
wasted, for, game, Hey you don't have manners made this hell game my 7 $ wasted only for 1 game you made a very extreme rage game most of the player break their mobile pc tablet laptop remove this game from the world or I can hack you when I will learn LMAO
remove, from, world, Hey you don't have manners made this hell game my 7 $ wasted only for 1 game you made a very extreme rage game most of the player break their mobile pc tablet laptop remove this game from the world or I can hack you when I will learn LMAO
PLAY, FOR, FUN, IF YOU WANT TO PLAY THIS GAME FOR FUN YOUR CRAZY ITS IMPOSSIBLE PLAY THIS GAME IF YOU WANT TO BURN YOUR HOUSE DOWN
goes, in, head, fun but the main question that goes on in my head is bennet who hurt you?
adding, to, anger, Bad controls are adding to your anger. Which in the description of the game is what it was made for. For pushing you to your limit making you realize levels of frustration you never have guessed you could have experienced. This game holds a deep meaning that its difficulty contributes to. And if you're beating this on mobile as your first play through then beating it makes you feel much more accomlished than if it were easier. Everything has a place, even if it's not purposefully that way.
made, for, what, Bad controls are adding to your anger. Which in the description of the game is what it was made for. For pushing you to your limit making you realize levels of frustration you never have guessed you could have experienced. This game holds a deep meaning that its difficulty contributes to. And if you're beating this on mobile as your first play through then beating it makes you feel much more accomlished than if it were easier. Everything has a place, even if it's not purposefully that way.
pushing, to, limit, Bad controls are adding to your anger. Which in the description of the game is what it was made for. For pushing you to your limit making you realize levels of frustration you never have guessed you could have experienced. This game holds a deep meaning that its difficulty contributes to. And if you're beating this on mobile as your first play through then beating it makes you feel much more accomlished than if it were easier. Everything has a place, even if it's not purposefully that way.
beating, on, mobile, Bad controls are adding to your anger. Which in the description of the game is what it was made for. For pushing you to your limit making you realize levels of frustration you never have guessed you could have experienced. This game holds a deep meaning that its difficulty contributes to. And if you're beating this on mobile as your first play through then beating it makes you feel much more accomlished than if it were easier. Everything has a place, even if it's not purposefully that way.
beating, as, play, Bad controls are adding to your anger. Which in the description of the game is what it was made for. For pushing you to your limit making you realize levels of frustration you never have guessed you could have experienced. This game holds a deep meaning that its difficulty contributes to. And if you're beating this on mobile as your first play through then beating it makes you feel much more accomlished than if it were easier. Everything has a place, even if it's not purposefully that way.
made, past, anything, Its to hard I haven't made it past the anything for the past 100 days
made, for, days, Its to hard I haven't made it past the anything for the past 100 days
compared, to, version, This is an interesting port. The controls arent the best, especially compared to the pc version, but isn't that good? You aren't playing getting over it to have fun, you're playing it to suffer. The bad controls add to it. Your at the mercy of a shoddily controlled hammer. It makes you suffer more than the pc version, which is the games main goal.
getting, over, it, This is an interesting port. The controls arent the best, especially compared to the pc version, but isn't that good? You aren't playing getting over it to have fun, you're playing it to suffer. The bad controls add to it. Your at the mercy of a shoddily controlled hammer. It makes you suffer more than the pc version, which is the games main goal.
add, to, it, This is an interesting port. The controls arent the best, especially compared to the pc version, but isn't that good? You aren't playing getting over it to have fun, you're playing it to suffer. The bad controls add to it. Your at the mercy of a shoddily controlled hammer. It makes you suffer more than the pc version, which is the games main goal.
covering, due, controls, Unforgiving game about climbing a mountain. Enjoyment on this game very much depends and how well you persevere and handle setbacks while a voice is egging you on. Very good port for the mobile, there are some inherent extra frustrations due to you sometimes covering too much of the screen due to touch controls but the game experience and feel translates suprisingly well.
launching, off, mountain, Worst game ever. I kept getting stuck because it kept launching me off the mountain back to the beginning where you first started from.
started, from, where, Worst game ever. I kept getting stuck because it kept launching me off the mountain back to the beginning where you first started from.
getting, into, what, I knew exactly what I was getting myself into and still I regret buying this game. I could not get past the cave with the lights
get, past, cave, I knew exactly what I was getting myself into and still I regret buying this game. I could not get past the cave with the lights
get, with, lights, I knew exactly what I was getting myself into and still I regret buying this game. I could not get past the cave with the lights
get, at, game, This is much more than a video game to me. The difficulty here is so raw. So real and pure. No matter how angry I get at this game, it always manages to calm me down. The climb, music and narration are sirene, the falls are devastating.
place, on, something, Okay, so the thing is, I've beaten this game twice now. Once on PC, and once on the Iphone 7. It's a HARD GAME, so understandable a lot of people leave bad reviews saying "oh the controls suck" and like, its really just them wanting to place blame on something. But since I have beaten it twice on two different platforms, I can honestly say, the android control are really BAD. Great game! Hard game, and I'm still gonna try and beat it. But, why does the iPhone have better controls? Lol
beaten, on, platforms, Okay, so the thing is, I've beaten this game twice now. Once on PC, and once on the Iphone 7. It's a HARD GAME, so understandable a lot of people leave bad reviews saying "oh the controls suck" and like, its really just them wanting to place blame on something. But since I have beaten it twice on two different platforms, I can honestly say, the android control are really BAD. Great game! Hard game, and I'm still gonna try and beat it. But, why does the iPhone have better controls? Lol
fall, to, beginning, The game is really hard but still, it's great. It has a original concept and nice design. It's very unique in its play style. Good game overall. (Exept when you fall to the beginning again)
scaling, with, sledgehammer, After weeks of unsuccessfull attempts at scaling an impossible construction with a sledgehammer whilst trapped in a couldron of infinate water I have no choice but to accept that the simple mechanics, the singular goal and the constant beratement for failure makes this game a unique charm to play.
trapped, in, couldron, After weeks of unsuccessfull attempts at scaling an impossible construction with a sledgehammer whilst trapped in a couldron of infinate water I have no choice but to accept that the simple mechanics, the singular goal and the constant beratement for failure makes this game a unique charm to play.
