NOUN, ADJ, 
game, Great, Great rhythm game. Cool story, and beautiful songs, but steep dlcs. The reason for the four stars is that the recents updates kinda suck, with every update there is an issue like the data loss on Android players just recently.
story, Cool, Great rhythm game. Cool story, and beautiful songs, but steep dlcs. The reason for the four stars is that the recents updates kinda suck, with every update there is an issue like the data loss on Android players just recently.
songs, beautiful, Great rhythm game. Cool story, and beautiful songs, but steep dlcs. The reason for the four stars is that the recents updates kinda suck, with every update there is an issue like the data loss on Android players just recently.
dlcs, steep, Great rhythm game. Cool story, and beautiful songs, but steep dlcs. The reason for the four stars is that the recents updates kinda suck, with every update there is an issue like the data loss on Android players just recently.
problem, only, Overall the game is extremely good normally this would be 5 stars for me but the only problem is the cloudsave it isnt that attentive or effective because of that i lost all my progress in story but it really isnt much of a problem i can always replay it but i hope the cloudsave gets a bit more fix so it could work properly
fix, more, Overall the game is extremely good normally this would be 5 stars for me but the only problem is the cloudsave it isnt that attentive or effective because of that i lost all my progress in story but it really isnt much of a problem i can always replay it but i hope the cloudsave gets a bit more fix so it could work properly
game, fun, Very fun rhythm game with a good storyline 😊
storyline, good, Very fun rhythm game with a good storyline 😊
game, best, The best rhythm game I ever played, the gameplay and the story is great(and I almost cry becuz the story...), I have installed this game when it's free and there is also a dlc like character and more, so I was planing to buy the character but my wallet can't take it, and I know there is 60% offer thing sometimes, soo when I can have that discount again?, every new month? Or just when anniversary? I will be very thankful if you can answer this (Also sorry for my bad English)
month, new, The best rhythm game I ever played, the gameplay and the story is great(and I almost cry becuz the story...), I have installed this game when it's free and there is also a dlc like character and more, so I was planing to buy the character but my wallet can't take it, and I know there is 60% offer thing sometimes, soo when I can have that discount again?, every new month? Or just when anniversary? I will be very thankful if you can answer this (Also sorry for my bad English)
music, great, great music
songs, Cool, Cool songs.
game, Best, Best music game of all time
game, great, Izza great game, it's just hard to get past alot of level locks unless you buy literally every song pack in the game, or ur just got tier at the game, which I'm far from. I'm also not sure how the xp system works, I think B rank gives the most xp though. Other than that, bumping soundtrack from what I heard myself, most of NEKO's songs are nightcore though so I'm not too thrilled lol. The gameplay is awesome and I prefer it over VOEZ honestly, though I do prefer that game's OST (non-dlc)
system, xp, Izza great game, it's just hard to get past alot of level locks unless you buy literally every song pack in the game, or ur just got tier at the game, which I'm far from. I'm also not sure how the xp system works, I think B rank gives the most xp though. Other than that, bumping soundtrack from what I heard myself, most of NEKO's songs are nightcore though so I'm not too thrilled lol. The gameplay is awesome and I prefer it over VOEZ honestly, though I do prefer that game's OST (non-dlc)
lol, thrilled, Izza great game, it's just hard to get past alot of level locks unless you buy literally every song pack in the game, or ur just got tier at the game, which I'm far from. I'm also not sure how the xp system works, I think B rank gives the most xp though. Other than that, bumping soundtrack from what I heard myself, most of NEKO's songs are nightcore though so I'm not too thrilled lol. The gameplay is awesome and I prefer it over VOEZ honestly, though I do prefer that game's OST (non-dlc)
time, first, So this is my first time to play this game... So awesome
purchases, restore, No matter what I've tried, I can't access any of the song packs or characters I've purchased. After reinstalling I got access to Miku again, but all of the others are locked and I can't even access the purchase menu. Please add a restore purchases option to remedy this. The cloud save feature does not seem to be working to fix it
game, fantastic, fantastic game to be honest. a little expensive but thats alright when you have such a quality story and such strong gameplay
gameplay, such, fantastic game to be honest. a little expensive but thats alright when you have such a quality story and such strong gameplay
gameplay, strong, fantastic game to be honest. a little expensive but thats alright when you have such a quality story and such strong gameplay
plot, awesome, This game has awesome plot and really immersive character stories that help the player feel as if their part of the world the game is set in. The in-game purchases, although not necessary to enjoy the game are definitely worth it and add new layers to the in game experience. Overall a wonderful and immersive experience! Would definitely recommend!
stories, immersive, This game has awesome plot and really immersive character stories that help the player feel as if their part of the world the game is set in. The in-game purchases, although not necessary to enjoy the game are definitely worth it and add new layers to the in game experience. Overall a wonderful and immersive experience! Would definitely recommend!
layers, new, This game has awesome plot and really immersive character stories that help the player feel as if their part of the world the game is set in. The in-game purchases, although not necessary to enjoy the game are definitely worth it and add new layers to the in game experience. Overall a wonderful and immersive experience! Would definitely recommend!
experience, wonderful, This game has awesome plot and really immersive character stories that help the player feel as if their part of the world the game is set in. The in-game purchases, although not necessary to enjoy the game are definitely worth it and add new layers to the in game experience. Overall a wonderful and immersive experience! Would definitely recommend!
masterpiece, hidden, Truly a hidden masterpiece! Amazing game play and story is absolutely addicting. Btw when will A.R.C release digital girlfriend?
play, Amazing, Truly a hidden masterpiece! Amazing game play and story is absolutely addicting. Btw when will A.R.C release digital girlfriend?
girlfriend, digital, Truly a hidden masterpiece! Amazing game play and story is absolutely addicting. Btw when will A.R.C release digital girlfriend?
game, solid, Very solid rhythm game with the initial cost going a long way. About half of the artists and songs are paid afterward but you get a very large selection with just the initial cost.
cost, initial, Very solid rhythm game with the initial cost going a long way. About half of the artists and songs are paid afterward but you get a very large selection with just the initial cost.
way, long, Very solid rhythm game with the initial cost going a long way. About half of the artists and songs are paid afterward but you get a very large selection with just the initial cost.
selection, large, Very solid rhythm game with the initial cost going a long way. About half of the artists and songs are paid afterward but you get a very large selection with just the initial cost.
cost, initial, Very solid rhythm game with the initial cost going a long way. About half of the artists and songs are paid afterward but you get a very large selection with just the initial cost.
game, active, If you got game pass and love a more active rhythm game you should definitely give it a shot. Also carries a pretty good story that unravels as you play.
story, good, If you got game pass and love a more active rhythm game you should definitely give it a shot. Also carries a pretty good story that unravels as you play.
game, great, It's a great game for killing time, the mechanics are solid, it has a nice ui, a good variety of music and an interesting story. Overall a good game
ui, nice, It's a great game for killing time, the mechanics are solid, it has a nice ui, a good variety of music and an interesting story. Overall a good game
variety, good, It's a great game for killing time, the mechanics are solid, it has a nice ui, a good variety of music and an interesting story. Overall a good game
story, interesting, It's a great game for killing time, the mechanics are solid, it has a nice ui, a good variety of music and an interesting story. Overall a good game
game, good, It's a great game for killing time, the mechanics are solid, it has a nice ui, a good variety of music and an interesting story. Overall a good game
phone, new, I use to play this games along time ago but had to delete it because of phone storage. After I downloaded it into my new phone I try to play the Sdorica sponsor song but they don't show it even thought it clearly show it as new song. I don't know if it's my phone or they just deleted the song. So, please help me with this problem.
song, new, I use to play this games along time ago but had to delete it because of phone storage. After I downloaded it into my new phone I try to play the Sdorica sponsor song but they don't show it even thought it clearly show it as new song. I don't know if it's my phone or they just deleted the song. So, please help me with this problem.
game, wonderful, Well, it's a wonderful game. I have played it for a long time. But recently, the capso I get from each song is less than the before. For the former edition, I can get 1-5 capsos, but now, I just can get it 1 or 2 pieces. Besides, the flexibility of the game is worse and worse.
time, long, Well, it's a wonderful game. I have played it for a long time. But recently, the capso I get from each song is less than the before. For the former edition, I can get 1-5 capsos, but now, I just can get it 1 or 2 pieces. Besides, the flexibility of the game is worse and worse.
edition, former, Well, it's a wonderful game. I have played it for a long time. But recently, the capso I get from each song is less than the before. For the former edition, I can get 1-5 capsos, but now, I just can get it 1 or 2 pieces. Besides, the flexibility of the game is worse and worse.
game, good, Very good game, i like it very much, though its a bit pricey if you wanna play few last characters, theres a lot playable without paying a cent and its worth it, game is really good in that sense
characters, few, Very good game, i like it very much, though its a bit pricey if you wanna play few last characters, theres a lot playable without paying a cent and its worth it, game is really good in that sense
characters, last, Very good game, i like it very much, though its a bit pricey if you wanna play few last characters, theres a lot playable without paying a cent and its worth it, game is really good in that sense
time, right, I've noticed a bug where I cant seem to hit the notes even tho I press it at the right time, I've had this happen in Ivy's summer zephyr (easy) and Robohead's midnight (easy), please fix this soon I'm trying to MM all the songs and the songs I cant MM are easy ones.
ones, easy, I've noticed a bug where I cant seem to hit the notes even tho I press it at the right time, I've had this happen in Ivy's summer zephyr (easy) and Robohead's midnight (easy), please fix this soon I'm trying to MM all the songs and the songs I cant MM are easy ones.
thing, only, Love the music as well as the gameplay functionality. The only thing is the loading times can feel like an eternity when you just want to play songs and sometimes when you don't read the story for a hot sec, you can get into some deep water. But the story is super in depth and the mechanics are easy to grasp, but has a high skill cap. This deserves my top pick for a mobile game!
sec, hot, Love the music as well as the gameplay functionality. The only thing is the loading times can feel like an eternity when you just want to play songs and sometimes when you don't read the story for a hot sec, you can get into some deep water. But the story is super in depth and the mechanics are easy to grasp, but has a high skill cap. This deserves my top pick for a mobile game!
water, deep, Love the music as well as the gameplay functionality. The only thing is the loading times can feel like an eternity when you just want to play songs and sometimes when you don't read the story for a hot sec, you can get into some deep water. But the story is super in depth and the mechanics are easy to grasp, but has a high skill cap. This deserves my top pick for a mobile game!
cap, high, Love the music as well as the gameplay functionality. The only thing is the loading times can feel like an eternity when you just want to play songs and sometimes when you don't read the story for a hot sec, you can get into some deep water. But the story is super in depth and the mechanics are easy to grasp, but has a high skill cap. This deserves my top pick for a mobile game!
pick, top, Love the music as well as the gameplay functionality. The only thing is the loading times can feel like an eternity when you just want to play songs and sometimes when you don't read the story for a hot sec, you can get into some deep water. But the story is super in depth and the mechanics are easy to grasp, but has a high skill cap. This deserves my top pick for a mobile game!
game, mobile, Love the music as well as the gameplay functionality. The only thing is the loading times can feel like an eternity when you just want to play songs and sometimes when you don't read the story for a hot sec, you can get into some deep water. But the story is super in depth and the mechanics are easy to grasp, but has a high skill cap. This deserves my top pick for a mobile game!
game, Nice, Nice game
game, good, This is a good game, but, bad business practice. I played the game and it was actually fun. I do enjoy most of the characters, but, just personally don't vibe with some. Thats said, it has a terrible way of monetizing. Plagued with character paywalls to tempt you to unlock more songs rather than grinding level locks to do just that on free characters. No preview of songs attached to each character to give you a more informed decision. The high ~$14 price on each character doesn't help.
practice, bad, This is a good game, but, bad business practice. I played the game and it was actually fun. I do enjoy most of the characters, but, just personally don't vibe with some. Thats said, it has a terrible way of monetizing. Plagued with character paywalls to tempt you to unlock more songs rather than grinding level locks to do just that on free characters. No preview of songs attached to each character to give you a more informed decision. The high ~$14 price on each character doesn't help.
way, terrible, This is a good game, but, bad business practice. I played the game and it was actually fun. I do enjoy most of the characters, but, just personally don't vibe with some. Thats said, it has a terrible way of monetizing. Plagued with character paywalls to tempt you to unlock more songs rather than grinding level locks to do just that on free characters. No preview of songs attached to each character to give you a more informed decision. The high ~$14 price on each character doesn't help.
songs, more, This is a good game, but, bad business practice. I played the game and it was actually fun. I do enjoy most of the characters, but, just personally don't vibe with some. Thats said, it has a terrible way of monetizing. Plagued with character paywalls to tempt you to unlock more songs rather than grinding level locks to do just that on free characters. No preview of songs attached to each character to give you a more informed decision. The high ~$14 price on each character doesn't help.
characters, free, This is a good game, but, bad business practice. I played the game and it was actually fun. I do enjoy most of the characters, but, just personally don't vibe with some. Thats said, it has a terrible way of monetizing. Plagued with character paywalls to tempt you to unlock more songs rather than grinding level locks to do just that on free characters. No preview of songs attached to each character to give you a more informed decision. The high ~$14 price on each character doesn't help.
decision, informed, This is a good game, but, bad business practice. I played the game and it was actually fun. I do enjoy most of the characters, but, just personally don't vibe with some. Thats said, it has a terrible way of monetizing. Plagued with character paywalls to tempt you to unlock more songs rather than grinding level locks to do just that on free characters. No preview of songs attached to each character to give you a more informed decision. The high ~$14 price on each character doesn't help.
price, high, This is a good game, but, bad business practice. I played the game and it was actually fun. I do enjoy most of the characters, but, just personally don't vibe with some. Thats said, it has a terrible way of monetizing. Plagued with character paywalls to tempt you to unlock more songs rather than grinding level locks to do just that on free characters. No preview of songs attached to each character to give you a more informed decision. The high ~$14 price on each character doesn't help.
bugs, many, Game is llaggy and so many bugs
game, Good, Good game wwwww
game, Amazing, Amazing music game with a good story. Kind of a money grab tho. Very addictive and worth the money you want to spend on the game. Kinda got bored of how the story is told tho. (I don't read it any more just click on it for the new music) definitely a long and difficult learning curve but once you get it it's still challenging. Been playing this game for almost a year now.
story, good, Amazing music game with a good story. Kind of a money grab tho. Very addictive and worth the money you want to spend on the game. Kinda got bored of how the story is told tho. (I don't read it any more just click on it for the new music) definitely a long and difficult learning curve but once you get it it's still challenging. Been playing this game for almost a year now.
music, new, Amazing music game with a good story. Kind of a money grab tho. Very addictive and worth the money you want to spend on the game. Kinda got bored of how the story is told tho. (I don't read it any more just click on it for the new music) definitely a long and difficult learning curve but once you get it it's still challenging. Been playing this game for almost a year now.
curve, long, Amazing music game with a good story. Kind of a money grab tho. Very addictive and worth the money you want to spend on the game. Kinda got bored of how the story is told tho. (I don't read it any more just click on it for the new music) definitely a long and difficult learning curve but once you get it it's still challenging. Been playing this game for almost a year now.
story, amazing, How in the heck did you manage a RHYTHM GAME with such an amazing story???
work, good, One of the best Rhytm Game that exist in the playstore and android version,, keep up the good work dev
gameplay, great, It's basically an eye candy mixed with some great music and thrilling gameplay. Not to mention the intriguing storyline, it keeps you craving for more. The only drawback which comes to mind is that the beat map of some songs could use a little bit of working on. However it's still 5 star worthy for the gameplay and visuals alone.
storyline, intriguing, It's basically an eye candy mixed with some great music and thrilling gameplay. Not to mention the intriguing storyline, it keeps you craving for more. The only drawback which comes to mind is that the beat map of some songs could use a little bit of working on. However it's still 5 star worthy for the gameplay and visuals alone.
drawback, only, It's basically an eye candy mixed with some great music and thrilling gameplay. Not to mention the intriguing storyline, it keeps you craving for more. The only drawback which comes to mind is that the beat map of some songs could use a little bit of working on. However it's still 5 star worthy for the gameplay and visuals alone.
map, beat, It's basically an eye candy mixed with some great music and thrilling gameplay. Not to mention the intriguing storyline, it keeps you craving for more. The only drawback which comes to mind is that the beat map of some songs could use a little bit of working on. However it's still 5 star worthy for the gameplay and visuals alone.
bit, little, It's basically an eye candy mixed with some great music and thrilling gameplay. Not to mention the intriguing storyline, it keeps you craving for more. The only drawback which comes to mind is that the beat map of some songs could use a little bit of working on. However it's still 5 star worthy for the gameplay and visuals alone.
game, Cool, Cool game! Everything is fine inside it for me. The song... My favourite is Devilic Sphere in Robo Head. Because this song is very fast and fantastic... I love it because I like the challenging game. Same with the character... The most I want is Conner, Xenon, Kaf, Nora, Neko and Aroma. But sadly, the problem is, all of those characters need to be pay. But everything is great, the game and more thing, just all I want is try to fix that problem that's all.
game, challenging, Cool game! Everything is fine inside it for me. The song... My favourite is Devilic Sphere in Robo Head. Because this song is very fast and fantastic... I love it because I like the challenging game. Same with the character... The most I want is Conner, Xenon, Kaf, Nora, Neko and Aroma. But sadly, the problem is, all of those characters need to be pay. But everything is great, the game and more thing, just all I want is try to fix that problem that's all.
thing, more, Cool game! Everything is fine inside it for me. The song... My favourite is Devilic Sphere in Robo Head. Because this song is very fast and fantastic... I love it because I like the challenging game. Same with the character... The most I want is Conner, Xenon, Kaf, Nora, Neko and Aroma. But sadly, the problem is, all of those characters need to be pay. But everything is great, the game and more thing, just all I want is try to fix that problem that's all.
money, Wasted, What happened? I lost all my progress by the time I had reinstalled the game. I had grinded those levels for days and now my data is gone? Wasted money for the character pack and some song packs but those are remained while the data progress is gone. WTH and I honestly thought I was a BUG.
game, Best, Best game ever
game, Amazing, Amazing game but there's a bug with google play pass when you get the 48h sale popup you can't get out of it. I had to wait 48 hours to be able to play the game again but the things that should be free weren't free anymore.
acc, main, Owh men finally i bought again this game with my main acc 😆 twice bought lmao cause i'm so loving this game ♥ i play osu but that was lmfao feel like drumming in phone don't like osu cytus 2 best of the the best rythm games for me
feel, lmfao, Owh men finally i bought again this game with my main acc 😆 twice bought lmao cause i'm so loving this game ♥ i play osu but that was lmfao feel like drumming in phone don't like osu cytus 2 best of the the best rythm games for me
games, best, Owh men finally i bought again this game with my main acc 😆 twice bought lmao cause i'm so loving this game ♥ i play osu but that was lmfao feel like drumming in phone don't like osu cytus 2 best of the the best rythm games for me
game, favorite, Still one of my most favorite music game on my mobile despite not having much time to touch on it.
time, much, Still one of my most favorite music game on my mobile despite not having much time to touch on it.
games, best, literally one of the best mobile games I've ever experienced. rayark coming back again with much more then just great rythm games, that not only is attractive due to great mechanics and design, but incredible ORIGINAL music, fabulous art and smooth animations, and MOST IMPORTANTLY mind-blowing storyline. I would totally recommend this game if you enjoy rythm games as much as I do, and even if you don't, I think that this wonderful story and unique characters would convince you to love this game.
games, mobile, literally one of the best mobile games I've ever experienced. rayark coming back again with much more then just great rythm games, that not only is attractive due to great mechanics and design, but incredible ORIGINAL music, fabulous art and smooth animations, and MOST IMPORTANTLY mind-blowing storyline. I would totally recommend this game if you enjoy rythm games as much as I do, and even if you don't, I think that this wonderful story and unique characters would convince you to love this game.
