VERB, PREP, POBJ, 
used, to, mouse, Just as frustrating as with mouse. Still have yet to find out what's at the top. 10/10 P.S. if you're expecting the same thing as the PC then you're wrong. If you're used to the mouse then you'll be frustrated by the touch controls but you just have to understand that it's a new challenge, just like switching from keyboard to controller on PC.
switching, from, keyboard, Just as frustrating as with mouse. Still have yet to find out what's at the top. 10/10 P.S. if you're expecting the same thing as the PC then you're wrong. If you're used to the mouse then you'll be frustrated by the touch controls but you just have to understand that it's a new challenge, just like switching from keyboard to controller on PC.
switching, to, controller, Just as frustrating as with mouse. Still have yet to find out what's at the top. 10/10 P.S. if you're expecting the same thing as the PC then you're wrong. If you're used to the mouse then you'll be frustrated by the touch controls but you just have to understand that it's a new challenge, just like switching from keyboard to controller on PC.
bought, to, torture, I bought it to torture myself did the job perfectly also love hearing bennett foddy narrating it
pride, in, quiting, Very simple, yet extremely challenging game. If you pride yourself in never "rage quiting" a game, this game will probably give you a run for your money. Have you ever done a math problem where a frog is trying to jump out of a 12ft hole but everytime he jumps up 3ft he then slides down 2.5ft? Well... Same kinda thing but when the frog gets almost to the top, he may slip & fall all the way back down to the bottom, and instead of a frog your a dude taking a bath in a cauldron with a sledge hammer
gets, to, top, Very simple, yet extremely challenging game. If you pride yourself in never "rage quiting" a game, this game will probably give you a run for your money. Have you ever done a math problem where a frog is trying to jump out of a 12ft hole but everytime he jumps up 3ft he then slides down 2.5ft? Well... Same kinda thing but when the frog gets almost to the top, he may slip & fall all the way back down to the bottom, and instead of a frog your a dude taking a bath in a cauldron with a sledge hammer
taking, in, cauldron, Very simple, yet extremely challenging game. If you pride yourself in never "rage quiting" a game, this game will probably give you a run for your money. Have you ever done a math problem where a frog is trying to jump out of a 12ft hole but everytime he jumps up 3ft he then slides down 2.5ft? Well... Same kinda thing but when the frog gets almost to the top, he may slip & fall all the way back down to the bottom, and instead of a frog your a dude taking a bath in a cauldron with a sledge hammer
rip, on, occupations, This game made me cry and try to rip my head off on multiple occupations now I'm a psychopath who wants to murder people best game ever
feels, like, journey, The controls don't facilitate the same PC experience Before I get hated because it's a rage game, let me eexplain. The pc version of this game is awesome. However, the Android version doesn't facilitate exactly the same physics, so things don't quite work right. Overall, the pc version feels like a journey to improvement. The Android version feels like I'm actually being cheated by the physics. I've beaten the Pc version, so I know what it should feel like. Just stick to PC.
feel, like, what, The controls don't facilitate the same PC experience Before I get hated because it's a rage game, let me eexplain. The pc version of this game is awesome. However, the Android version doesn't facilitate exactly the same physics, so things don't quite work right. Overall, the pc version feels like a journey to improvement. The Android version feels like I'm actually being cheated by the physics. I've beaten the Pc version, so I know what it should feel like. Just stick to PC.
stick, to, PC, The controls don't facilitate the same PC experience Before I get hated because it's a rage game, let me eexplain. The pc version of this game is awesome. However, the Android version doesn't facilitate exactly the same physics, so things don't quite work right. Overall, the pc version feels like a journey to improvement. The Android version feels like I'm actually being cheated by the physics. I've beaten the Pc version, so I know what it should feel like. Just stick to PC.
put, on, controls, I'm all for hard learning curves and punishing game mechanics, I mean I play tarkov, but for Christs sake, put some on screen controls so I can determine what the dude is about to do. The exact same motions can have several different and seemingly random reactions from the character. I haven't played the PC version (I intend to, as I like the games concept) but as far as the mobile version goes, not worth my time.
GET, OVER, FRIST, HA HA HA THIS IS A MEME GAME I LOVE IT ITS FUNNY BECAUSE A CAN GET OVER THE FRIST (R.O.C.K) SO IM GOING TO UNINSTALLER THIS GAME. hay that for horses
taks, to, long, i dont relly like it beacouse it taks to long to lern the controls.
get, into, idea, Weirdly, I find the controls on mobile to be easier than on PC. Not nearly as frustrating (tho still plenty of cursing and gnashing of teeth - but then, that's the point!). Definitely a wonderful little time-killer, if you can get into the idea of it. Keep in mind that the game is not meant to be easy and you'll learn to love it.
Keep, in, mind, Weirdly, I find the controls on mobile to be easier than on PC. Not nearly as frustrating (tho still plenty of cursing and gnashing of teeth - but then, that's the point!). Definitely a wonderful little time-killer, if you can get into the idea of it. Keep in mind that the game is not meant to be easy and you'll learn to love it.
get, past, obstacle, I understand it's a rage game and that's part of the fun, but god the controls are garbage on mobile. Your hammer behaves as if it has a mind of its own because you have next to no accuracy with your fingers, which cover part of the screen anyways. This game is great on PC, since you have that accuracy with a mouse. However a mobile port just wasn't necessary. You almost need a pen to even get past the first obstacle
compared, to, version, I have played the PC version and the mobile version is horrible. My hammer clips through objects and sometimes I lose control of the hammer as it spins around wildly Edit: After playing just to see the extent of the problems I found out that surfaces tend to be very slippery compared to the PC version and lag occurs that can throw off your "footing". I would just stick to the PC version because mobile controls aren't bad because they're designed to be bad but bad because they're bad.
stick, to, version, I have played the PC version and the mobile version is horrible. My hammer clips through objects and sometimes I lose control of the hammer as it spins around wildly Edit: After playing just to see the extent of the problems I found out that surfaces tend to be very slippery compared to the PC version and lag occurs that can throw off your "footing". I would just stick to the PC version because mobile controls aren't bad because they're designed to be bad but bad because they're bad.
got, for, phone, Played this years ago. Now I got it for the phone. Honestly, phone edition is crazy hard. No wide view, controls feel a bit more stiff. Still excellent with 5/5 rating from me
started, in, this, Just getting started in this and I am already having flashbacks to I am bread
played, on, PC, Have played on PC and now phone. The shittily done touch controls turned an already frustrating game into something completely unplayable.
turned, into, something, Have played on PC and now phone. The shittily done touch controls turned an already frustrating game into something completely unplayable.
think, for, point, Great experience and hard as nails, though I think even for the point of the game being to be hard, the rock next the red metal platform is ridiculously slippery compared to the other rocks, making it a more unrealistically forced annoyance, but beside that it really is an awesome game.
compared, to, rocks, Great experience and hard as nails, though I think even for the point of the game being to be hard, the rock next the red metal platform is ridiculously slippery compared to the other rocks, making it a more unrealistically forced annoyance, but beside that it really is an awesome game.
born, in, pot, its perfect a man somehow born in a pot and sometimes swings for no reason climbing a mountain to space and what makes you fall is ur anger be calm take it easy
swings, for, reason, its perfect a man somehow born in a pot and sometimes swings for no reason climbing a mountain to space and what makes you fall is ur anger be calm take it easy
climbing, to, space, its perfect a man somehow born in a pot and sometimes swings for no reason climbing a mountain to space and what makes you fall is ur anger be calm take it easy
done, with, game, Look, im not even done with this game, and I can tell you, this game is amazing, it's challenging, and while the controls have a horrifically steep learning curve, I've been handling it well. This game is great use of time, despite it's difficulty, as it helps one deal with difficulty, and that is something everyone needs
controll, on, screen, Good but hard to controll on touch screen. They should really add an option to play with a cotroller
play, with, cotroller, Good but hard to controll on touch screen. They should really add an option to play with a cotroller
Gave, because, commentary, The controls are so horrible with touch screen. They are confusing and imprecise. Maybe that is the way its supposed to be, but making a game difficult because the controls suck is just annoying. Gave 2 starts because of the commentary during the game.
go, without, me, It is a great game the consent is fun but the controls are really stupid like il be using the Hamer and then it will go from up to down without me even touching it
Burn, in, B@##$, Burn in hell B@##$
calming, at, all, It's not calming at all I noticed from the YouTubers Markiplier and jacksepticeye and I feel bad for them
noticed, from, Markiplier, It's not calming at all I noticed from the YouTubers Markiplier and jacksepticeye and I feel bad for them
feel, for, them, It's not calming at all I noticed from the YouTubers Markiplier and jacksepticeye and I feel bad for them
listen, to, people, Don't listen to people complaining about the controls. Yes it is hard and has a learning curve and that's the point. The point isn't really to beat it, it's how you respond when you lose. You can see the passion put into every piece of terrain, Everytime you fall the developer hits you with a philosophy line. One of the most challenging games I've ever played, it's rewarding to see yourself improve with each run. What took you 2 hours one day might take you 5 min the next. This should be 5/5
complaining, about, controls, Don't listen to people complaining about the controls. Yes it is hard and has a learning curve and that's the point. The point isn't really to beat it, it's how you respond when you lose. You can see the passion put into every piece of terrain, Everytime you fall the developer hits you with a philosophy line. One of the most challenging games I've ever played, it's rewarding to see yourself improve with each run. What took you 2 hours one day might take you 5 min the next. This should be 5/5
put, into, piece, Don't listen to people complaining about the controls. Yes it is hard and has a learning curve and that's the point. The point isn't really to beat it, it's how you respond when you lose. You can see the passion put into every piece of terrain, Everytime you fall the developer hits you with a philosophy line. One of the most challenging games I've ever played, it's rewarding to see yourself improve with each run. What took you 2 hours one day might take you 5 min the next. This should be 5/5
hits, with, line, Don't listen to people complaining about the controls. Yes it is hard and has a learning curve and that's the point. The point isn't really to beat it, it's how you respond when you lose. You can see the passion put into every piece of terrain, Everytime you fall the developer hits you with a philosophy line. One of the most challenging games I've ever played, it's rewarding to see yourself improve with each run. What took you 2 hours one day might take you 5 min the next. This should be 5/5
improve, with, run, Don't listen to people complaining about the controls. Yes it is hard and has a learning curve and that's the point. The point isn't really to beat it, it's how you respond when you lose. You can see the passion put into every piece of terrain, Everytime you fall the developer hits you with a philosophy line. One of the most challenging games I've ever played, it's rewarding to see yourself improve with each run. What took you 2 hours one day might take you 5 min the next. This should be 5/5
found, As, someone, As someone who was able to (somewhat consistently) progress past the vertical tunnel section near the start of the game on the PC version, I found myself unable to make it past that section after over a half hour of trying. I kept tweaking the control settings, but it's always either way too sensitive, not sensitive enough, or somehow both. I hated the way that torque scales based on the speed and acceleration of your mouse on PC, but on a phone with touch controls, it is actually unplayable.
make, past, section, As someone who was able to (somewhat consistently) progress past the vertical tunnel section near the start of the game on the PC version, I found myself unable to make it past that section after over a half hour of trying. I kept tweaking the control settings, but it's always either way too sensitive, not sensitive enough, or somehow both. I hated the way that torque scales based on the speed and acceleration of your mouse on PC, but on a phone with touch controls, it is actually unplayable.
make, after, hour, As someone who was able to (somewhat consistently) progress past the vertical tunnel section near the start of the game on the PC version, I found myself unable to make it past that section after over a half hour of trying. I kept tweaking the control settings, but it's always either way too sensitive, not sensitive enough, or somehow both. I hated the way that torque scales based on the speed and acceleration of your mouse on PC, but on a phone with touch controls, it is actually unplayable.
based, on, speed, As someone who was able to (somewhat consistently) progress past the vertical tunnel section near the start of the game on the PC version, I found myself unable to make it past that section after over a half hour of trying. I kept tweaking the control settings, but it's always either way too sensitive, not sensitive enough, or somehow both. I hated the way that torque scales based on the speed and acceleration of your mouse on PC, but on a phone with touch controls, it is actually unplayable.
pass, on, it, A game for people who need to up the amount of stress and frustration in their lives. Runs smooth. The controls add an unnecessary layer of frustration however, which made me pass on it.
tells, from, start, Terrible. Awful. I hate it. Which is why I rated 5 stars because it does exactly what it's supposed to do. Right from the start, the game tells you, you might beat it, you might not. It doesn't give you a false sense of security, it literally tells you, don't get your hopes up: No amount of forward progress is guaranteed. It tells you the game will make you mad and it encourages you to take breaks if you get too frustrated. This game is so much more than a rage game. It's a valuable life lesson.
got, from, it, I got anger issues from it
go, with, it, This game is fun with a Carolina reaper on top. It's strange you stress about falling you fall you chill out and just go with it you get to the top. The controls could be a little better but I think that's how Bennett intended it to be. But overall it's worth the 8 bucks and with no adds its just a fantastic game. I definitely recommend buying it游때
get, to, top, This game is fun with a Carolina reaper on top. It's strange you stress about falling you fall you chill out and just go with it you get to the top. The controls could be a little better but I think that's how Bennett intended it to be. But overall it's worth the 8 bucks and with no adds its just a fantastic game. I definitely recommend buying it游때
get, to, orange.i, This game neeeeeedss to be fixed because the hammer keeps doing what it wants.and the others were right about the game its difficult and it freezzes.so basically theirs A lege that's I'mpossibl to go up to slippery and it sets you back Faaaarr wen you get to the orange.i wonder what Bennett thought wen he made the game.i finally get to the bucket and I take the snake.
get, to, wonder, This game neeeeeedss to be fixed because the hammer keeps doing what it wants.and the others were right about the game its difficult and it freezzes.so basically theirs A lege that's I'mpossibl to go up to slippery and it sets you back Faaaarr wen you get to the orange.i wonder what Bennett thought wen he made the game.i finally get to the bucket and I take the snake.
get, to, bucket, This game neeeeeedss to be fixed because the hammer keeps doing what it wants.and the others were right about the game its difficult and it freezzes.so basically theirs A lege that's I'mpossibl to go up to slippery and it sets you back Faaaarr wen you get to the orange.i wonder what Bennett thought wen he made the game.i finally get to the bucket and I take the snake.
put, on, :), If you have anger issues, I suggest you put a durable case on :).. Amazing game tho 游때
play, on, mobile, Hard to play on mobile, but still really fun when you get the hang of it
locked, to, hammer, Please make a joystick control option for this i don't like how all the swiping is locked to the hammer, yes it is okay but because of the controls I got all the way to the 2 buildings near the top of the crane then got pushed off back to the start its a fun game but please add different types of controls so we can try get a feel for a different types of play styles
got, because, controls, Please make a joystick control option for this i don't like how all the swiping is locked to the hammer, yes it is okay but because of the controls I got all the way to the 2 buildings near the top of the crane then got pushed off back to the start its a fun game but please add different types of controls so we can try get a feel for a different types of play styles
got, to, buildings, Please make a joystick control option for this i don't like how all the swiping is locked to the hammer, yes it is okay but because of the controls I got all the way to the 2 buildings near the top of the crane then got pushed off back to the start its a fun game but please add different types of controls so we can try get a feel for a different types of play styles
complain, about, games, The same people who complain about this games are the same people who are in the debate of controllers being over powered but won't even touch one.
Playing, On, Computer, Playing On Computer:Ok. Playing On Mobile:HELL!!!
Playing, On, Mobile, Playing On Computer:Ok. Playing On Mobile:HELL!!!
freezes, to, time, The controls are okay not bad but not good but can be annoying at times sometimes it feels like the game just freezes a bit time to time but rarely happens But without talking about the cons the game feels fun to play and a decent game to play while bored even if it can make you angry either from the controls or the game
talking, about, cons, The controls are okay not bad but not good but can be annoying at times sometimes it feels like the game just freezes a bit time to time but rarely happens But without talking about the cons the game feels fun to play and a decent game to play while bored even if it can make you angry either from the controls or the game
suck, for, player, It isn't worth the price to be hinest it has good quality but the controlls suck for a mobile player over all it is just a bad game i am not trying to be rude
gotten, over, barrels, Still haven't gotten over the barrels游땱
play, with, all, As hard as it is, its fun to play with all it gives and I enjoy it. And I makes me realize something within all the insanity.
had, with, controls, Idk the game was pretty good and i like it. But i definitely had a very hard time with the controls and ik its designed to be that way but sometimes it would input things i had clearly not did like super dast sporadic movement when i was going really slow.
input, like, movement, Idk the game was pretty good and i like it. But i definitely had a very hard time with the controls and ik its designed to be that way but sometimes it would input things i had clearly not did like super dast sporadic movement when i was going really slow.
infuriated, with, game, I have never been as infuriated with a mobile game like I have with this one. In saying that I keep coming back to it again and again. Word of advice, Don't play sleep deprived as I have found it can lead to poor choices...
have, with, one, I have never been as infuriated with a mobile game like I have with this one. In saying that I keep coming back to it again and again. Word of advice, Don't play sleep deprived as I have found it can lead to poor choices...
lead, to, choices, I have never been as infuriated with a mobile game like I have with this one. In saying that I keep coming back to it again and again. Word of advice, Don't play sleep deprived as I have found it can lead to poor choices...
paid, for, game, I hate this game. I hate this game so much. I paid $4 for this stupid MF game. I paid for someone to annoy me and antagonize me ever so gently. I F***ING HATE THIS GAME....but I keep playing....I can't stop...
paid, for, someone, I hate this game. I hate this game so much. I paid $4 for this stupid MF game. I paid for someone to annoy me and antagonize me ever so gently. I F***ING HATE THIS GAME....but I keep playing....I can't stop...
play, with, stylist, The fact that I can't play this game with my stylist makes it unplayable for me. I have giant fingers that's why I bought a note so I could use the damn stylist. N
getting, over, it, I was about to get a 1 minute world record in getting over it until Bennet sabotage me and kicked me out for speedrunning I was BANNED FROM THE GAME FOR SPEED RUNNING
prove, to, yourself, Frustrating but rewarding you just want to prove to yourself you can do it LOL don't get me started on watching The rage clips on youtube it'll just encourage you more and you will rage more and more! LOL but when you make it to the top man is it worth it. And always impossible and literally like the first game I've downloaded with no bugs
watching, on, youtube, Frustrating but rewarding you just want to prove to yourself you can do it LOL don't get me started on watching The rage clips on youtube it'll just encourage you more and you will rage more and more! LOL but when you make it to the top man is it worth it. And always impossible and literally like the first game I've downloaded with no bugs
make, to, man, Frustrating but rewarding you just want to prove to yourself you can do it LOL don't get me started on watching The rage clips on youtube it'll just encourage you more and you will rage more and more! LOL but when you make it to the top man is it worth it. And always impossible and literally like the first game I've downloaded with no bugs
downloaded, with, bugs, Frustrating but rewarding you just want to prove to yourself you can do it LOL don't get me started on watching The rage clips on youtube it'll just encourage you more and you will rage more and more! LOL but when you make it to the top man is it worth it. And always impossible and literally like the first game I've downloaded with no bugs
cooperate, with, finger, The only thing this $hit wants to do is not cooperate with your 춲uking finger, bounce off of things and push downwards to the bottom. Play the PC version because you have a mouse to easily use, unlike the mobile version which is 춱rap!
push, to, bottom, The only thing this $hit wants to do is not cooperate with your 춲uking finger, bounce off of things and push downwards to the bottom. Play the PC version because you have a mouse to easily use, unlike the mobile version which is 춱rap!
have, unlike, version, The only thing this $hit wants to do is not cooperate with your 춲uking finger, bounce off of things and push downwards to the bottom. Play the PC version because you have a mouse to easily use, unlike the mobile version which is 춱rap!
fly, to, beginning, This game sucks it has no physics because I fly to the beginning again and the annoying guy does not stop talking
forgot, about, game, Almost a year since last update seems Bennet forgot about his game! Devs dont listen and with no updates how can you provide the best gaming experience! No update means the app can not perform as needed with the new technologies and updates! Someone needs to inform noodlecake and Bennet of this because it seems they don't understand why there is updates! Waste of money in my personal opinion. No updates, no leadearboards, no boosts, this game falls short in today's gaming world.
