VERB, PREP, POBJ, 
used, for, multiplayer, Love the game it's really good but with the multiplayer why is the saying that I'm not able to connectwe can be playing at one day or a few matches and then we'll sit there and say that I can't connect to a phone friendship trying to fix the bugswhy is multiplayer saying my account does not work when I've used it several times for the multiplayer
updated, to, system, It was good when it worked. Since my phone updated to a newer operating system, the game will no longer run. It attempts to download a patch but there is not patch available. I'd like my account refunded.
loved, since, version, I loved this game since the PS4 version. Was surprised you could do things the PS4 couldn't but ever since I was able to download this it has officially " bugged " up during an operation/Missions it won't let me do?
bugged, during, operation, I loved this game since the PS4 version. Was surprised you could do things the PS4 couldn't but ever since I was able to download this it has officially " bugged " up during an operation/Missions it won't let me do?
fixed, after, review, Great game but constant crashes on S8+ keep forcing me to rewatch the 1 minute intro video... Was fixed a couple months after this review, much better now.
get, in, game, Wish it was alil easier to complete missions to get further in the game
Payed, for, game, Payed only 5.49$ for this magnificent game — on Xbox Live it was 19.99$. Best turn based strategy game @ Google Play. Played through the game multiple times and never needed to make in game purchases. And I'm very happy to see no graphical difference between my Xbox 360 and my Smartphone (Umidigi A5 Pro Phone). Only disadvantage is that it has less maps than the Xbox version. Big thanks to the developers
Payed, on, Live, Payed only 5.49$ for this magnificent game — on Xbox Live it was 19.99$. Best turn based strategy game @ Google Play. Played through the game multiple times and never needed to make in game purchases. And I'm very happy to see no graphical difference between my Xbox 360 and my Smartphone (Umidigi A5 Pro Phone). Only disadvantage is that it has less maps than the Xbox version. Big thanks to the developers
Played, through, game, Payed only 5.49$ for this magnificent game — on Xbox Live it was 19.99$. Best turn based strategy game @ Google Play. Played through the game multiple times and never needed to make in game purchases. And I'm very happy to see no graphical difference between my Xbox 360 and my Smartphone (Umidigi A5 Pro Phone). Only disadvantage is that it has less maps than the Xbox version. Big thanks to the developers
make, in, purchases, Payed only 5.49$ for this magnificent game — on Xbox Live it was 19.99$. Best turn based strategy game @ Google Play. Played through the game multiple times and never needed to make in game purchases. And I'm very happy to see no graphical difference between my Xbox 360 and my Smartphone (Umidigi A5 Pro Phone). Only disadvantage is that it has less maps than the Xbox version. Big thanks to the developers
crashing, at, beginning, Keep crashing at the beginning on my 2/16 tablet
crashing, on, tablet, Keep crashing at the beginning on my 2/16 tablet
dissapointing, for, me, Good game, just that im heavy gamepad gamer on android and it just support left joystick only, and that quite dissapointing for me
Ran, on, LG, Amazing game. Comparable to the 360 Xbox version. Ran well on my generic LG that I purchased this year. Four stars instead of five because they used up all of my available space on my phone and my phone doesn't allow me to utilize SD card for saving apps
used, on, phone, Amazing game. Comparable to the 360 Xbox version. Ran well on my generic LG that I purchased this year. Four stars instead of five because they used up all of my available space on my phone and my phone doesn't allow me to utilize SD card for saving apps
going, for, game, Great game but too much going on for a mobile game in my opinion. Hard to see whats going on
work, on, 8hd, Does not work on Kindle 8hd 2018. It downloads 3.5 gb app however it gets stuck at start screen. Research download failed error
stuck, at, screen, Does not work on Kindle 8hd 2018. It downloads 3.5 gb app however it gets stuck at start screen. Research download failed error
ported, over, game, It's a wholly ported over game. Works fantastic. Great at what it is supposed to do. On my phone and offline too. Just the perfect game for xcom fans until xcom 2 on the the phone comes out. Hopefully. Lol
work, on, devices, Doesn't work on newer android devices and versions
Played, on, S10, Yes! Not good for your battery, but still awesome! Played on a Samsung Galaxy S10+ No real issues other than some Camera/hight selection ines. Just save regulairly.
Lowered, to, stars, Lowered to 3 stars since the online mode doesn't work anymore
played, through, titles, An incredible Xcom experience on your phone! Have played through both PC titles and am so impressed with how well this translates. Sure, movement can be a little tricky with these fat fingers, but it's compelling and ultra addictive. Go shoot some aliens in the face.
shoot, in, face, An incredible Xcom experience on your phone! Have played through both PC titles and am so impressed with how well this translates. Sure, movement can be a little tricky with these fat fingers, but it's compelling and ultra addictive. Go shoot some aliens in the face.
add, to, game, I like the game but it will be nice if you add some long war to this game
ported, to, Android, This appears to be the full PC version, ported to Android. Needs a lot of horsepower, though. Runs great on my Galaxy Note 9, but not so well on an older device.
making, through, portion, Great game, just recently started crashing after making it through a good portion of the game. 😕
playing, through, mission, Poorly optimized port. Laggy animation, insane load times. Didn't bother playing through first mission due to the framerate issues. LOVE XCOM though !
playing, due, issues, Poorly optimized port. Laggy animation, insane load times. Didn't bother playing through first mission due to the framerate issues. LOVE XCOM though !
play, on, ps4, Love it. Made me play xcom 2 on ps4. Would really enjoy if you added more maps or like a random skirmish mode, but with a seperate thing that lets you unlock troops/level up/ customize like a rpgish vibe, but my main input would be to add more characters and make it more customizable like adding more stuff for troops or make it more detailed like intsad of just armor you can change the hat torso and legs. Just more in depth i would even pay if it was addons. Sorry for the grammar.
added, like, mode, Love it. Made me play xcom 2 on ps4. Would really enjoy if you added more maps or like a random skirmish mode, but with a seperate thing that lets you unlock troops/level up/ customize like a rpgish vibe, but my main input would be to add more characters and make it more customizable like adding more stuff for troops or make it more detailed like intsad of just armor you can change the hat torso and legs. Just more in depth i would even pay if it was addons. Sorry for the grammar.
pay, in, depth, Love it. Made me play xcom 2 on ps4. Would really enjoy if you added more maps or like a random skirmish mode, but with a seperate thing that lets you unlock troops/level up/ customize like a rpgish vibe, but my main input would be to add more characters and make it more customizable like adding more stuff for troops or make it more detailed like intsad of just armor you can change the hat torso and legs. Just more in depth i would even pay if it was addons. Sorry for the grammar.
work, on, anything, Doesn't work on anything recent. If you have an android more recent than 2017, do not even try. Wasted money
start, since, update, Great game, but since the latest android update it wont start on my note 10 :(
start, on, note, Great game, but since the latest android update it wont start on my note 10 :(
load, on, mission, Horrible I love the xcom games but it doesn't even work. The map doesn't even load on the first mission it's just black. I want my money back.
loved, on, pc, worth every penny, absolutely loved this game on pc and now on mobile. good work 2KGAMES. If it ever manages to download again.... for some reason it downloads to 99% and then restarts the download???
manages, for, reason, worth every penny, absolutely loved this game on pc and now on mobile. good work 2KGAMES. If it ever manages to download again.... for some reason it downloads to 99% and then restarts the download???
made, for, mobile, Holy hell made-for-mobile games suck, just play a scaled-down PC or console game like this one.
play, like, one, Holy hell made-for-mobile games suck, just play a scaled-down PC or console game like this one.
see, because, resolution, I have a OnePlus7 Pro, and because of the resolution the phone puts me in when I play it, I cannot see some of the screen when I go to manage my soldiers. Plz fix this asap!
bought, from, phone, Games awesome on the campaign I really love it I bought it twice one from my phone and one for my girl there's a small problem with the multiplayerI like how if we're interrupted in the game we can still go back and finish it without having to redo everythingto set it up but sometimes you won't be able to move your characters my girl had it to where she couldn't move two of her teammates it'll just skip her turns if you keep please fix this bug I really do appreciate it I love this game thank u
bought, for, girl, Games awesome on the campaign I really love it I bought it twice one from my phone and one for my girl there's a small problem with the multiplayerI like how if we're interrupted in the game we can still go back and finish it without having to redo everythingto set it up but sometimes you won't be able to move your characters my girl had it to where she couldn't move two of her teammates it'll just skip her turns if you keep please fix this bug I really do appreciate it I love this game thank u
interrupted, in, game, Games awesome on the campaign I really love it I bought it twice one from my phone and one for my girl there's a small problem with the multiplayerI like how if we're interrupted in the game we can still go back and finish it without having to redo everythingto set it up but sometimes you won't be able to move your characters my girl had it to where she couldn't move two of her teammates it'll just skip her turns if you keep please fix this bug I really do appreciate it I love this game thank u
updated, in, time, XCOM is awesome. Sadly this port has not been updated in a long time so the app crashes randomly. This is usually a few missions in so it gives you a false hope that you will be fine. For me it crashes at the beginning of a mission on the second month. Really got my hopes up, I started two games to make sure it can be reproduced. Both times it was a different map so that's not even a specific one. I will update my review if this is fixed.
crashes, For, me, XCOM is awesome. Sadly this port has not been updated in a long time so the app crashes randomly. This is usually a few missions in so it gives you a false hope that you will be fine. For me it crashes at the beginning of a mission on the second month. Really got my hopes up, I started two games to make sure it can be reproduced. Both times it was a different map so that's not even a specific one. I will update my review if this is fixed.
crashes, at, beginning, XCOM is awesome. Sadly this port has not been updated in a long time so the app crashes randomly. This is usually a few missions in so it gives you a false hope that you will be fine. For me it crashes at the beginning of a mission on the second month. Really got my hopes up, I started two games to make sure it can be reproduced. Both times it was a different map so that's not even a specific one. I will update my review if this is fixed.
playing, on, A6, Lags a bit, there's some glitches here and there. Currently playing it on my SAMSUNG A6 (2018).
updated, in, years, Why haven't you updated your game in 3 years?
playing, on, phone, I tried playing this on my phone and it was buggy as hell and unplayable. 1*. Then I played it on a tablet and it worked fine. The game is great. So much fun to play and kept me guessing. 5*
played, on, tablet, I tried playing this on my phone and it was buggy as hell and unplayable. 1*. Then I played it on a tablet and it worked fine. The game is great. So much fun to play and kept me guessing. 5*
ported, to, devices, The game itself is what's on the box, this is xcom ported pretty damn well to mobile devices, could use an update so it keeps it working for newer devices however other than a lack of updates this is just what I wanted and what I'm happy I paid for. 8/10 solid port
working, for, devices, The game itself is what's on the box, this is xcom ported pretty damn well to mobile devices, could use an update so it keeps it working for newer devices however other than a lack of updates this is just what I wanted and what I'm happy I paid for. 8/10 solid port
paid, for, what, The game itself is what's on the box, this is xcom ported pretty damn well to mobile devices, could use an update so it keeps it working for newer devices however other than a lack of updates this is just what I wanted and what I'm happy I paid for. 8/10 solid port
bringing, on, android, Best game ever. Thankyou for bringing this on android. Craving for more.
Craving, for, more, Best game ever. Thankyou for bringing this on android. Craving for more.
bear, in, mind, It runs well and is a lot of fun, but bear in mind this port hasn't been updated in basically three years. It will give you a warning on startup that it was made for an older version of Android, and it will refuse to connect to Google play or allow cloud saves. Local saves still work, though. If it were updated to allow continued use of Google play services I would give it five stars, but without that three is all it gets.
updated, in, years, It runs well and is a lot of fun, but bear in mind this port hasn't been updated in basically three years. It will give you a warning on startup that it was made for an older version of Android, and it will refuse to connect to Google play or allow cloud saves. Local saves still work, though. If it were updated to allow continued use of Google play services I would give it five stars, but without that three is all it gets.
made, for, version, It runs well and is a lot of fun, but bear in mind this port hasn't been updated in basically three years. It will give you a warning on startup that it was made for an older version of Android, and it will refuse to connect to Google play or allow cloud saves. Local saves still work, though. If it were updated to allow continued use of Google play services I would give it five stars, but without that three is all it gets.
connect, to, play, It runs well and is a lot of fun, but bear in mind this port hasn't been updated in basically three years. It will give you a warning on startup that it was made for an older version of Android, and it will refuse to connect to Google play or allow cloud saves. Local saves still work, though. If it were updated to allow continued use of Google play services I would give it five stars, but without that three is all it gets.
connect, to, play, Was great but newest update wont let me connect to google play to save. Able to save over previous files (overwrite existing saves) but no new ones. Love xcom, will update to 5 stars once it works again
update, to, stars, Was great but newest update wont let me connect to google play to save. Able to save over previous files (overwrite existing saves) but no new ones. Love xcom, will update to 5 stars once it works again
Reinstalled, on, tablet, Reinstalled on tablet, working well now apart from Google Play error when saving
Update, to, version, Update the game to the latest version of Android. It's been three years since the last update.
have, on, games, Some issues with Google at services I don't have on other games. Otherwise still a great game
lags, at, time, Fantastic although I have a LG K20 and the game lags at most time and the battery gets hot fast I bought it from Google Play store tobad I can't get a refund for it so I uninstalled the game many some time I get a gaming phone Cheers Xmatt
bought, from, tobad, Fantastic although I have a LG K20 and the game lags at most time and the battery gets hot fast I bought it from Google Play store tobad I can't get a refund for it so I uninstalled the game many some time I get a gaming phone Cheers Xmatt
play, with, touchscreen, A bit clunky to play with a touchscreen, but if you have a tablet, or a relatively large phone, then it should be fine. Otherwise a great port of XCOM.
liked, on, PC, EDIT: Year later, new tablet with 4Gb RAM running smooth. Uses between 500Mb-1Gb memory, so 1Gb of FREE RAM is a hard minimum requirement. Doesn't have Slingshot or Progeny questlines, which I really liked on PC. Misses the option to turn off the Enemy Within expansion content like you can on PC. My problem with the DLC is mostly because how rubbish and easy the whole EXALT "questline" is after aliens. Still, a great game, and a very good port, considering it's a real PC game originally.
turn, Within, content, EDIT: Year later, new tablet with 4Gb RAM running smooth. Uses between 500Mb-1Gb memory, so 1Gb of FREE RAM is a hard minimum requirement. Doesn't have Slingshot or Progeny questlines, which I really liked on PC. Misses the option to turn off the Enemy Within expansion content like you can on PC. My problem with the DLC is mostly because how rubbish and easy the whole EXALT "questline" is after aliens. Still, a great game, and a very good port, considering it's a real PC game originally.
turn, on, PC, EDIT: Year later, new tablet with 4Gb RAM running smooth. Uses between 500Mb-1Gb memory, so 1Gb of FREE RAM is a hard minimum requirement. Doesn't have Slingshot or Progeny questlines, which I really liked on PC. Misses the option to turn off the Enemy Within expansion content like you can on PC. My problem with the DLC is mostly because how rubbish and easy the whole EXALT "questline" is after aliens. Still, a great game, and a very good port, considering it's a real PC game originally.
connect, since, update, Was a very awesome port! However, since newest android update, game will no longer connect to google play, so you can no longer save the game. I have been playing this game since release. I have had it on every phone since my Note 2. But it is currently incompatible with the Note 10. I hope they find an update to fix the problem.
connect, to, play, Was a very awesome port! However, since newest android update, game will no longer connect to google play, so you can no longer save the game. I have been playing this game since release. I have had it on every phone since my Note 2. But it is currently incompatible with the Note 10. I hope they find an update to fix the problem.
playing, since, release, Was a very awesome port! However, since newest android update, game will no longer connect to google play, so you can no longer save the game. I have been playing this game since release. I have had it on every phone since my Note 2. But it is currently incompatible with the Note 10. I hope they find an update to fix the problem.
had, on, phone, Was a very awesome port! However, since newest android update, game will no longer connect to google play, so you can no longer save the game. I have been playing this game since release. I have had it on every phone since my Note 2. But it is currently incompatible with the Note 10. I hope they find an update to fix the problem.
had, since, Note, Was a very awesome port! However, since newest android update, game will no longer connect to google play, so you can no longer save the game. I have been playing this game since release. I have had it on every phone since my Note 2. But it is currently incompatible with the Note 10. I hope they find an update to fix the problem.
getting, on, game, It worked great at first. About my third time getting on the game it wont even work. It's a black screen. Nothing loads. I want a refund.
Tried, on, devices, Tried this on 2 devices, will not download after 44%
download, after, %, Tried this on 2 devices, will not download after 44%
kicking, before, load, Favorite game for the past year! Its getting buggy all of the sudden kicking me out before menus load. But it earned 5 stars in my book! Good run.
earned, in, book, Favorite game for the past year! Its getting buggy all of the sudden kicking me out before menus load. But it earned 5 stars in my book! Good run.
link, with, gameplay, Gameplay is good. Unfortunately i cant link with my gameplay for achievement. Kindly update the resolution too. My device P20pro Please put cheat available (money, god mode, etc) since i paid it for premium.
link, for, achievement, Gameplay is good. Unfortunately i cant link with my gameplay for achievement. Kindly update the resolution too. My device P20pro Please put cheat available (money, god mode, etc) since i paid it for premium.
paid, for, premium, Gameplay is good. Unfortunately i cant link with my gameplay for achievement. Kindly update the resolution too. My device P20pro Please put cheat available (money, god mode, etc) since i paid it for premium.
got, after, couple, The game is hard at first but after couple of failed attempts I finally got the hang of it thanks for a good game but if it had something more it would be awesome way more 😁😁😁.
bugs, after, turns, Broken! As said before, the game bugs out after 2/3 turns in the second level. I know XCOM is a good game, this should not have this name if its unplayable. Just saying.
work, on, Galaxy, Wont work on Galaxy 10+
save, on, phone, Can't manually save on the phone or even cloud save. Says fail to write when I do manual save and when I pick cloud save it just kicks me back out to my homescreen. I am using a Galaxy S10+, so I don't know why this game would not work, please fix this if you can.
kicks, to, homescreen, Can't manually save on the phone or even cloud save. Says fail to write when I do manual save and when I pick cloud save it just kicks me back out to my homescreen. I am using a Galaxy S10+, so I don't know why this game would not work, please fix this if you can.
plugged, to, mains, Awesome game ported ok controls can be frustrating at first but wants you get used to it plays brilliantly.Need to be plugged in to mains or battery pack as it drains big time. I long for more games like this on my mobile.
long, for, games, Awesome game ported ok controls can be frustrating at first but wants you get used to it plays brilliantly.Need to be plugged in to mains or battery pack as it drains big time. I long for more games like this on my mobile.
Put, into, this, Put hundreds of hours into this, a mobile port for this turns out to work really well. customization for all of your soldiers, from what weapon they use to what color their armor is you make the decisions in this game. The only issue I've had is sometimes it's hard to control whether you want a troop on high ground or low ground. Ik there's a button that controls elevation but even at the right elevation sometimes I tap through the ceiling of a building and my sniper dashes through and dies. 🤷
tap, at, elevation, Put hundreds of hours into this, a mobile port for this turns out to work really well. customization for all of your soldiers, from what weapon they use to what color their armor is you make the decisions in this game. The only issue I've had is sometimes it's hard to control whether you want a troop on high ground or low ground. Ik there's a button that controls elevation but even at the right elevation sometimes I tap through the ceiling of a building and my sniper dashes through and dies. 🤷
tap, through, ceiling, Put hundreds of hours into this, a mobile port for this turns out to work really well. customization for all of your soldiers, from what weapon they use to what color their armor is you make the decisions in this game. The only issue I've had is sometimes it's hard to control whether you want a troop on high ground or low ground. Ik there's a button that controls elevation but even at the right elevation sometimes I tap through the ceiling of a building and my sniper dashes through and dies. 🤷
occur, on, devices, Could you fix the crashes that occur on Samsung Galaxy A8 2018 devices? Other wise the game is amazing, a great port. Port XCOM 2 maybe wink wink?
missing, from, game, Its xcom can never go wrong runs well. But I have noticed a lot of the cut scenes are missing from the game not a big deal guess they gotta save space somewhere. The big deal is the games touch controls. They are abysmal beyond belief. Like wow this game has a hard time with them and it gets worse on multilevel and elevation maps. If you can stand the infuriating touch control I would say get it.
has, with, them, Its xcom can never go wrong runs well. But I have noticed a lot of the cut scenes are missing from the game not a big deal guess they gotta save space somewhere. The big deal is the games touch controls. They are abysmal beyond belief. Like wow this game has a hard time with them and it gets worse on multilevel and elevation maps. If you can stand the infuriating touch control I would say get it.
