NOUN, ADJ, 
gameplay, addictive, Was my favorite game, it still is btw. It's just I grinded this game for a very long period of time and sadly was forced to Uninstall after awhile I decided to install again and all of my progress was gone even though I remember saving my progress. Secondly i believe they removed the feature to play offline which made me very sad. But other than that, it's a very wonderful game with beautiful visuals and addictive gameplay that you can spend 100+ hours without getting bored or tired.
game, good, Worth your $1.99. This game's pretty good. The story on this game is just decent. The maps are very well made, chaos maps are balanced to the point where they are just perfect to test your skills and the easy/hard ones are also made to be just challenging enough to improve your skills. I give a 9/10.
ones, hard, Worth your $1.99. This game's pretty good. The story on this game is just decent. The maps are very well made, chaos maps are balanced to the point where they are just perfect to test your skills and the easy/hard ones are also made to be just challenging enough to improve your skills. I give a 9/10.
10th, Happy, Happy anniversary 10th, Cytus ii !
icons, popular, For people like me that doesnt have money to afford, atleast make some of those popular icons like kaf and Kizuna Ai playable even just half of their songs and the rest is unlockable through purchase cuz literally its a rip-off, even though its for supporting the devs, anyway 2 stars still, besides that gameplay is absolutely fine but the IAP dragged it down. syncing data on cloud and not google is not a good move cuz before it was working but now it reset my progress jeez
move, good, For people like me that doesnt have money to afford, atleast make some of those popular icons like kaf and Kizuna Ai playable even just half of their songs and the rest is unlockable through purchase cuz literally its a rip-off, even though its for supporting the devs, anyway 2 stars still, besides that gameplay is absolutely fine but the IAP dragged it down. syncing data on cloud and not google is not a good move cuz before it was working but now it reset my progress jeez
game, whole, I miss Miku!! 😭😭😭 I started on the beta team before this game came out and I got the whole game for free. Later, I got Play Pass as well which made the game more fun! I come back after a few busy months and Miku's gone. ;-;
months, busy, I miss Miku!! 😭😭😭 I started on the beta team before this game came out and I got the whole game for free. Later, I got Play Pass as well which made the game more fun! I come back after a few busy months and Miku's gone. ;-;
game, Cool, Cool game, monetization is a bit rough though.
game, Super, Super fun rhythm game! The levels are balanced and there is a ton of replayability with the level system! My only criticisms falls on the character level lock system and the limited songs of a certain punk album which will not be named... just wish there was more than 3 songs available at the start...
game, fun, Super fun rhythm game! The levels are balanced and there is a ton of replayability with the level system! My only criticisms falls on the character level lock system and the limited songs of a certain punk album which will not be named... just wish there was more than 3 songs available at the start...
criticisms, only, Super fun rhythm game! The levels are balanced and there is a ton of replayability with the level system! My only criticisms falls on the character level lock system and the limited songs of a certain punk album which will not be named... just wish there was more than 3 songs available at the start...
songs, limited, Super fun rhythm game! The levels are balanced and there is a ton of replayability with the level system! My only criticisms falls on the character level lock system and the limited songs of a certain punk album which will not be named... just wish there was more than 3 songs available at the start...
album, certain, Super fun rhythm game! The levels are balanced and there is a ton of replayability with the level system! My only criticisms falls on the character level lock system and the limited songs of a certain punk album which will not be named... just wish there was more than 3 songs available at the start...
songs, available, Super fun rhythm game! The levels are balanced and there is a ton of replayability with the level system! My only criticisms falls on the character level lock system and the limited songs of a certain punk album which will not be named... just wish there was more than 3 songs available at the start...
superb, Super, Super superb!
game, awesome, Is really bad that every time you update the game we have to download again all the 1.5GB of it, espite of saying is just and update of 260mb. Apart from that, is an awesome game.
game, Good, Good game. Unfortunately the monetisation is pretty bad. The game requires an Internet connection now too, which it didn't used to :/
move, Bad, Bad move Rayark. You just lost a lot of players here in my country due to the internet requirement update. I have been playing this game for a very long time. One of the reasons I like this game was that the game can be played offline and so I can play during my travels.
time, long, Bad move Rayark. You just lost a lot of players here in my country due to the internet requirement update. I have been playing this game for a very long time. One of the reasons I like this game was that the game can be played offline and so I can play during my travels.
update, recent, Loved this game and played it so much before the recent update. But recent update has made it borderline unplayale for me with the constant internet requirement aswell as deleting my 100s of hours of progress.
update, recent, Loved this game and played it so much before the recent update. But recent update has made it borderline unplayale for me with the constant internet requirement aswell as deleting my 100s of hours of progress.
aswell, constant, Loved this game and played it so much before the recent update. But recent update has made it borderline unplayale for me with the constant internet requirement aswell as deleting my 100s of hours of progress.
response, quick, After the update.. You can play offline again. And thanks for the quick response from the customer service :)
game, Nice, Nice game. Enjoyable. Nice musics. And no problems.
musics, Nice, Nice game. Enjoyable. Nice musics. And no problems.
game, first, i love it, when i played the first Cytus game on the other phone i enjoyed it very much and now Cytus 2 bringing new songs,graphics,and my most favorite the "comment section" for every song is just marvelous and brilliant,it brings some sort of life into the game and with every musicians and DJ they have their own personality and backstories are just Perfect! and also the Report system answer our question so fast! I'M GLAD THERE'S COLLAB WITH HATSUNE MIKU, KIZUNA AI AND KAF!!!
phone, other, i love it, when i played the first Cytus game on the other phone i enjoyed it very much and now Cytus 2 bringing new songs,graphics,and my most favorite the "comment section" for every song is just marvelous and brilliant,it brings some sort of life into the game and with every musicians and DJ they have their own personality and backstories are just Perfect! and also the Report system answer our question so fast! I'M GLAD THERE'S COLLAB WITH HATSUNE MIKU, KIZUNA AI AND KAF!!!
songs, new, i love it, when i played the first Cytus game on the other phone i enjoyed it very much and now Cytus 2 bringing new songs,graphics,and my most favorite the "comment section" for every song is just marvelous and brilliant,it brings some sort of life into the game and with every musicians and DJ they have their own personality and backstories are just Perfect! and also the Report system answer our question so fast! I'M GLAD THERE'S COLLAB WITH HATSUNE MIKU, KIZUNA AI AND KAF!!!
section, favorite, i love it, when i played the first Cytus game on the other phone i enjoyed it very much and now Cytus 2 bringing new songs,graphics,and my most favorite the "comment section" for every song is just marvelous and brilliant,it brings some sort of life into the game and with every musicians and DJ they have their own personality and backstories are just Perfect! and also the Report system answer our question so fast! I'M GLAD THERE'S COLLAB WITH HATSUNE MIKU, KIZUNA AI AND KAF!!!
personality, own, i love it, when i played the first Cytus game on the other phone i enjoyed it very much and now Cytus 2 bringing new songs,graphics,and my most favorite the "comment section" for every song is just marvelous and brilliant,it brings some sort of life into the game and with every musicians and DJ they have their own personality and backstories are just Perfect! and also the Report system answer our question so fast! I'M GLAD THERE'S COLLAB WITH HATSUNE MIKU, KIZUNA AI AND KAF!!!
game, online, This game became an online game after the latest update, please fix this.
update, latest, This game became an online game after the latest update, please fix this.
screen, black, My game just stuck at black screen
game, new, YEEEEESS !!! You remade it ! Your gale is a new an offline game ! Thanks you so much !!!! I love you !!! ⭐⭐⭐⭐⭐🌟
game, offline, YEEEEESS !!! You remade it ! Your gale is a new an offline game ! Thanks you so much !!!! I love you !!! ⭐⭐⭐⭐⭐🌟
game, great, great game but maybe a graphic setting would be better
setting, graphic, great game but maybe a graphic setting would be better
side, other, I can't switch the landscape mode to the other side.
prices, reasonable, The game is amazing. But the fact that there's over $300 of in app purchases and a third of it is characters and story content is laughable. I have no problem supporting developers further a game I love but locking lore behind a credit card is ridiculous and not even for reasonable prices either smh
screen, welcome, Where did the welcome screen changing option go?
option, changing, Where did the welcome screen changing option go?
device, android, I had sync issue on my android device for a while now and I thought it was never gonna get fixed. But gladly rayark released an update regarding this issue and I got my progress back, excellent customer service.
service, excellent, I had sync issue on my android device for a while now and I thought it was never gonna get fixed. But gladly rayark released an update regarding this issue and I got my progress back, excellent customer service.
game, classic, I love this game so much! First the graphics, I genuinely love everything about it, from the characters to the gameplay itself The gameplay, it's like a classic rythm game and it's easy to follow and play. I really like it unlike others mobile games Overall it's a great game.
games, mobile, I love this game so much! First the graphics, I genuinely love everything about it, from the characters to the gameplay itself The gameplay, it's like a classic rythm game and it's easy to follow and play. I really like it unlike others mobile games Overall it's a great game.
game, great, I love this game so much! First the graphics, I genuinely love everything about it, from the characters to the gameplay itself The gameplay, it's like a classic rythm game and it's easy to follow and play. I really like it unlike others mobile games Overall it's a great game.
game, Nice, Nice game with a lot good song. Highly recommend it.
song, good, Nice game with a lot good song. Highly recommend it.
game, cool, Just a very cool rhytm game with a quite good plot, though very hard to get into at the first place
game, hard, Just a very cool rhytm game with a quite good plot, though very hard to get into at the first place
plot, good, Just a very cool rhytm game with a quite good plot, though very hard to get into at the first place
place, first, Just a very cool rhytm game with a quite good plot, though very hard to get into at the first place
story, deep, Came in expecting a rhythm game, but instead I got a deep and interesting story, mind blowing immersion, banger music, and a rhythm game
line, Great, Great story line and just like the first one it's a great game :)
game, great, Great story line and just like the first one it's a great game :)
game, favorite, Used to be my favorite game, but the removal of offline play is a deal breaker for me. Not sure what Rayark was thinking with that. Game data cannot be transferred between operating systems, and the leaderboard system is a joke. With that said, in terms of gameplay this is the best rhythm game out there. Great songs, handles smoothly, and a nice range of difficulty. Great story as well. I really want to give this game 5 stars and keep buying DLC, but there's just too many deal breakers.
play, offline, Used to be my favorite game, but the removal of offline play is a deal breaker for me. Not sure what Rayark was thinking with that. Game data cannot be transferred between operating systems, and the leaderboard system is a joke. With that said, in terms of gameplay this is the best rhythm game out there. Great songs, handles smoothly, and a nice range of difficulty. Great story as well. I really want to give this game 5 stars and keep buying DLC, but there's just too many deal breakers.
game, best, Used to be my favorite game, but the removal of offline play is a deal breaker for me. Not sure what Rayark was thinking with that. Game data cannot be transferred between operating systems, and the leaderboard system is a joke. With that said, in terms of gameplay this is the best rhythm game out there. Great songs, handles smoothly, and a nice range of difficulty. Great story as well. I really want to give this game 5 stars and keep buying DLC, but there's just too many deal breakers.
songs, Great, Used to be my favorite game, but the removal of offline play is a deal breaker for me. Not sure what Rayark was thinking with that. Game data cannot be transferred between operating systems, and the leaderboard system is a joke. With that said, in terms of gameplay this is the best rhythm game out there. Great songs, handles smoothly, and a nice range of difficulty. Great story as well. I really want to give this game 5 stars and keep buying DLC, but there's just too many deal breakers.
range, nice, Used to be my favorite game, but the removal of offline play is a deal breaker for me. Not sure what Rayark was thinking with that. Game data cannot be transferred between operating systems, and the leaderboard system is a joke. With that said, in terms of gameplay this is the best rhythm game out there. Great songs, handles smoothly, and a nice range of difficulty. Great story as well. I really want to give this game 5 stars and keep buying DLC, but there's just too many deal breakers.
story, Great, Used to be my favorite game, but the removal of offline play is a deal breaker for me. Not sure what Rayark was thinking with that. Game data cannot be transferred between operating systems, and the leaderboard system is a joke. With that said, in terms of gameplay this is the best rhythm game out there. Great songs, handles smoothly, and a nice range of difficulty. Great story as well. I really want to give this game 5 stars and keep buying DLC, but there's just too many deal breakers.
breakers, many, Used to be my favorite game, but the removal of offline play is a deal breaker for me. Not sure what Rayark was thinking with that. Game data cannot be transferred between operating systems, and the leaderboard system is a joke. With that said, in terms of gameplay this is the best rhythm game out there. Great songs, handles smoothly, and a nice range of difficulty. Great story as well. I really want to give this game 5 stars and keep buying DLC, but there's just too many deal breakers.
games, fun, One of the most fun rhythm games I've played. There's no ads, no lives so your gameplay is never interrupted. The songs are really good, and the story mode is interesting. Love the gameplay, though it can be frustrating as it's very easy to miss notes when your fingers are in the way. Definitely worth a try
games, best, One of the best rhythm games out there! No forced microtransactions, great gameplay, engaging story... A++
microtransactions, forced, One of the best rhythm games out there! No forced microtransactions, great gameplay, engaging story... A++
gameplay, great, One of the best rhythm games out there! No forced microtransactions, great gameplay, engaging story... A++
story, engaging, One of the best rhythm games out there! No forced microtransactions, great gameplay, engaging story... A++
requirement, Constant, Constant Internet connection requirement is a complete bs. Don't treat the game like it's some kind of MOBA. People play this because it's the best one out of the rythm games out there and the internet authentication process happens once in awhile.
bs, complete, Constant Internet connection requirement is a complete bs. Don't treat the game like it's some kind of MOBA. People play this because it's the best one out of the rythm games out there and the internet authentication process happens once in awhile.
space, enough, Can't download it. I have more than enough space. I have a good connection. Deemo DLS just fine...it's something on your end. I've payed a lot for this game and I'm really angry that I can't play it I have a android Motorola. Edit: This issue is still not fixed when it was 2020 when it was brought to your attention rayark. Your rates dropped from 5 to 2 then 1 stars...I have 4gs available on my phone...there is no excuse. And now the support staff is dead
connection, good, Can't download it. I have more than enough space. I have a good connection. Deemo DLS just fine...it's something on your end. I've payed a lot for this game and I'm really angry that I can't play it I have a android Motorola. Edit: This issue is still not fixed when it was 2020 when it was brought to your attention rayark. Your rates dropped from 5 to 2 then 1 stars...I have 4gs available on my phone...there is no excuse. And now the support staff is dead
version, latest, This used to not be a problem, but I can no longer play this game offline even when I am on the latest version. It it a huge inconvenience that I have to authenticate every time I open the app.
inconvenience, huge, This used to not be a problem, but I can no longer play this game offline even when I am on the latest version. It it a huge inconvenience that I have to authenticate every time I open the app.
screens, frozen, Re-rating from 5 to 1 star. We deserve an optimization update. The game is laggy, frozen screens, game randomly popping out. Atleast optimize the game for a) faster startup b) faster loading screens c) reduce bugs and d) stability in general.
b, startup, Re-rating from 5 to 1 star. We deserve an optimization update. The game is laggy, frozen screens, game randomly popping out. Atleast optimize the game for a) faster startup b) faster loading screens c) reduce bugs and d) stability in general.
update, new, For new update it requires internet connection,in previous update it didn't need internet connection so I can play it offline so I feel bad for new updates so i hope in next update is no longer require internet connection and btw i love your song tnx..
update, previous, For new update it requires internet connection,in previous update it didn't need internet connection so I can play it offline so I feel bad for new updates so i hope in next update is no longer require internet connection and btw i love your song tnx..
updates, new, For new update it requires internet connection,in previous update it didn't need internet connection so I can play it offline so I feel bad for new updates so i hope in next update is no longer require internet connection and btw i love your song tnx..
update, next, For new update it requires internet connection,in previous update it didn't need internet connection so I can play it offline so I feel bad for new updates so i hope in next update is no longer require internet connection and btw i love your song tnx..
game, enjoyable, Worth playing over and over.Really enjoyable perfect game (im retarded)
game, perfect, Worth playing over and over.Really enjoyable perfect game (im retarded)
music, best, Game can run at 120 hrz on my note 20 ultra and has the best music its like play ocu on mobile
games, favourite, After finishing the game, I think I can confidently say that this game has become one of my all time most favourite games, the unique style of rhythm game is fun and given the right charts can be incredibly varied, any DLC is completely worth it, and the story, world and characters are absolutely phenomenal, I absolutely couldn't recommend it more, it is incredibly saddening to me that the story is over, unless Rayark has something planned. Farewell, Cytus II, I will forever wait for III.
style, unique, After finishing the game, I think I can confidently say that this game has become one of my all time most favourite games, the unique style of rhythm game is fun and given the right charts can be incredibly varied, any DLC is completely worth it, and the story, world and characters are absolutely phenomenal, I absolutely couldn't recommend it more, it is incredibly saddening to me that the story is over, unless Rayark has something planned. Farewell, Cytus II, I will forever wait for III.
charts, right, After finishing the game, I think I can confidently say that this game has become one of my all time most favourite games, the unique style of rhythm game is fun and given the right charts can be incredibly varied, any DLC is completely worth it, and the story, world and characters are absolutely phenomenal, I absolutely couldn't recommend it more, it is incredibly saddening to me that the story is over, unless Rayark has something planned. Farewell, Cytus II, I will forever wait for III.
authentication, online, So now the game needs an online authentication now, why? This is supposed to be my on the go offline game and now you're bringing this in for what reason? You're making a good go bad for this reason. I downloaded it for one reason. Its a fun offline game that works amazingly on my phone and I love it for that reason. Nothing comes close to Cytus 2. But please fix this major issue
game, offline, So now the game needs an online authentication now, why? This is supposed to be my on the go offline game and now you're bringing this in for what reason? You're making a good go bad for this reason. I downloaded it for one reason. Its a fun offline game that works amazingly on my phone and I love it for that reason. Nothing comes close to Cytus 2. But please fix this major issue
issue, major, So now the game needs an online authentication now, why? This is supposed to be my on the go offline game and now you're bringing this in for what reason? You're making a good go bad for this reason. I downloaded it for one reason. Its a fun offline game that works amazingly on my phone and I love it for that reason. Nothing comes close to Cytus 2. But please fix this major issue
update, Newest, Newest update works great! A novel-like journey into Cytus lore. Observe the story and events through many 3rd-person narratives. Pay close attention to the date/time stamps!
works, great, Newest update works great! A novel-like journey into Cytus lore. Observe the story and events through many 3rd-person narratives. Pay close attention to the date/time stamps!
journey, like, Newest update works great! A novel-like journey into Cytus lore. Observe the story and events through many 3rd-person narratives. Pay close attention to the date/time stamps!
person, 3rd, Newest update works great! A novel-like journey into Cytus lore. Observe the story and events through many 3rd-person narratives. Pay close attention to the date/time stamps!
narratives, many, Newest update works great! A novel-like journey into Cytus lore. Observe the story and events through many 3rd-person narratives. Pay close attention to the date/time stamps!
attention, close, Newest update works great! A novel-like journey into Cytus lore. Observe the story and events through many 3rd-person narratives. Pay close attention to the date/time stamps!
design, Simpler, Simpler yet cooler design, a fresh take on storytelling yet still stunning (if not even better) as the first game. And of course, the song selection is just spot on. Update: Just heard that you must have internet on to play this game. Not a chance I will even update it. In fact I've deleted it. I will wait until whether they decide to walk back on that or not. If they do, I will happily come back. If they don't, farewell.
take, fresh, Simpler yet cooler design, a fresh take on storytelling yet still stunning (if not even better) as the first game. And of course, the song selection is just spot on. Update: Just heard that you must have internet on to play this game. Not a chance I will even update it. In fact I've deleted it. I will wait until whether they decide to walk back on that or not. If they do, I will happily come back. If they don't, farewell.
game, first, Simpler yet cooler design, a fresh take on storytelling yet still stunning (if not even better) as the first game. And of course, the song selection is just spot on. Update: Just heard that you must have internet on to play this game. Not a chance I will even update it. In fact I've deleted it. I will wait until whether they decide to walk back on that or not. If they do, I will happily come back. If they don't, farewell.
game, Best, Best rhythm game on the Play Store
progress, saved, Cant restore saved progress. it says connection problem but my internet is fine. i found other people have the same issue too.
