NOUN, ADJ, 
app, Great, Great app, I just wish the devs would add a link option like Myboy so I can do trades in pokemon
mess, Confusing, Confusing mess that lacks crucial options, doesn't detect ROMs properly, and has nothing to set it apart from just using the superior DS core on RetroArch. Don't waste your money
options, crucial, Confusing mess that lacks crucial options, doesn't detect ROMs properly, and has nothing to set it apart from just using the superior DS core on RetroArch. Don't waste your money
core, superior, Confusing mess that lacks crucial options, doesn't detect ROMs properly, and has nothing to set it apart from just using the superior DS core on RetroArch. Don't waste your money
emulator, Great, Great emulator, just a little bug report here. Pokemon White 2 goes black whenever I go out of the pokemon selection screen.
report, little, Great emulator, just a little bug report here. Pokemon White 2 goes black whenever I go out of the pokemon selection screen.
emulator, Best, Best emulator by far. Could you add a feature to be able search the cheat database and assign cheats to a game such as ROM hacks or when cheats aren't automatically detected. Adding them one by one through custom cheats is tedious. Love everything else about this emulator though thanks for creating this amazing piece of nostalgia for us.
piece, amazing, Best emulator by far. Could you add a feature to be able search the cheat database and assign cheats to a game such as ROM hacks or when cheats aren't automatically detected. Adding them one by one through custom cheats is tedious. Love everything else about this emulator though thanks for creating this amazing piece of nostalgia for us.
emulator, great, Straightforward, no bee ehs great emulator, it beats the emulator Retroarch has and Lemuroid. Go with this if you have the Huawei Mate 10 Pro edit: the emulator stopped functioning for my new Poco X3 Pro after the new android 11 update it cant scan ext storage!
edit, Pro, Straightforward, no bee ehs great emulator, it beats the emulator Retroarch has and Lemuroid. Go with this if you have the Huawei Mate 10 Pro edit: the emulator stopped functioning for my new Poco X3 Pro after the new android 11 update it cant scan ext storage!
update, new, Straightforward, no bee ehs great emulator, it beats the emulator Retroarch has and Lemuroid. Go with this if you have the Huawei Mate 10 Pro edit: the emulator stopped functioning for my new Poco X3 Pro after the new android 11 update it cant scan ext storage!
reason, unknown, The loading of roms from sdcard stopped working for some unknown reason. Please fix this
game, new, Sometimes glitches out but I've never lost progress so ion mind it, takes a while when selecting a new game, but besides all that, I absolutely love playing the games I used to play on my NDS :) thanks for making it possible
multiplayer, primitive, Flawless. I will be extremely happy if some kind of primitive multiplayer support gets released one day :)
update, last, I'm sorry to say that this app just doesn't work. I have a Samsung Note 9, android 10, and I haven't been able to make this app work at all. When it was android 9 it worked, but seeing as the last update was over a year ago, I'm not holding my breath for a new update. Specifically, I click load new game, the screen dims like it's loading something, then the app crashes. Nothing I do fixes this, even a complete reset of my phone.
update, new, I'm sorry to say that this app just doesn't work. I have a Samsung Note 9, android 10, and I haven't been able to make this app work at all. When it was android 9 it worked, but seeing as the last update was over a year ago, I'm not holding my breath for a new update. Specifically, I click load new game, the screen dims like it's loading something, then the app crashes. Nothing I do fixes this, even a complete reset of my phone.
game, new, I'm sorry to say that this app just doesn't work. I have a Samsung Note 9, android 10, and I haven't been able to make this app work at all. When it was android 9 it worked, but seeing as the last update was over a year ago, I'm not holding my breath for a new update. Specifically, I click load new game, the screen dims like it's loading something, then the app crashes. Nothing I do fixes this, even a complete reset of my phone.
reset, complete, I'm sorry to say that this app just doesn't work. I have a Samsung Note 9, android 10, and I haven't been able to make this app work at all. When it was android 9 it worked, but seeing as the last update was over a year ago, I'm not holding my breath for a new update. Specifically, I click load new game, the screen dims like it's loading something, then the app crashes. Nothing I do fixes this, even a complete reset of my phone.
emulator, powerful, Extremely powerful and convenient emulator. I love it
experience, good, Well I was only playing Pokémon...but I believe I had a good experience.
version, free, This is better than any free version esp for Pokemon games worth it!
emulator, Best, Best ds emulator on mobile.
emulator, ds, Best ds emulator on mobile.
functions, longer, Used Drastic flawlessly for years. But as of Android 11 it no longer functions. A search online shows that they aren't responding to any help threads either. Do not waste your money on it.
code, cheat, I really used to love this app. That is until the app became frustrating to use. I would insert a cheat code into the custom cheats and the code wouldn't load properly. Another issue is that some of the cheats that were already programmed into the app don't work anymore like they were intended to. If these issues could be resolved I would truly appreciate it.
pokemon, black, Hey guys I love this app but I have stumbled into a problem the arrow at the bottom of my game (pokemon black 2) seems to have gone for good so I can no longer drag up the menu to savestate and I have the manual save bug where it says I cant save over my file blablabla.. I want to play other games on the app but I don't want to close it as It will only give me the option to open my last save can anybody help me please?
games, other, Hey guys I love this app but I have stumbled into a problem the arrow at the bottom of my game (pokemon black 2) seems to have gone for good so I can no longer drag up the menu to savestate and I have the manual save bug where it says I cant save over my file blablabla.. I want to play other games on the app but I don't want to close it as It will only give me the option to open my last save can anybody help me please?
save, last, Hey guys I love this app but I have stumbled into a problem the arrow at the bottom of my game (pokemon black 2) seems to have gone for good so I can no longer drag up the menu to savestate and I have the manual save bug where it says I cant save over my file blablabla.. I want to play other games on the app but I don't want to close it as It will only give me the option to open my last save can anybody help me please?
SD, External, Please fix this issue, my phone is the Motorola Edge S and this emulator is not detecting if there's an External SD card or not and I stored all my roms there to save internal space and I already bought the pro version, please fix it
space, internal, Please fix this issue, my phone is the Motorola Edge S and this emulator is not detecting if there's an External SD card or not and I stored all my roms there to save internal space and I already bought the pro version, please fix it
version, pro, Please fix this issue, my phone is the Motorola Edge S and this emulator is not detecting if there's an External SD card or not and I stored all my roms there to save internal space and I already bought the pro version, please fix it
emulator, best, The best DS emulator for Android phones. My S20 runs it perfectly
emulator, free, Works great... only using for pokemon but it is much better than the free emulator. Worth the 5 bucks
mobiles, stupid, Work great some stupid mobiles noob said have a problem with external controller thats actually a Andoird 11 problem theyre too stupid to make some research and maybe their phone is trash low spec
controller, external, Work great some stupid mobiles noob said have a problem with external controller thats actually a Andoird 11 problem theyre too stupid to make some research and maybe their phone is trash low spec
spec, low, Work great some stupid mobiles noob said have a problem with external controller thats actually a Andoird 11 problem theyre too stupid to make some research and maybe their phone is trash low spec
problem, only, this emulator works perfect. The only problem now is.. it cant access my sd card anymore where my roms are at. Using Miui 12 android 11... On android 10 it can access the sd card... I hope this gets updated coz this emu is really great.
coz, updated, this emulator works perfect. The only problem now is.. it cant access my sd card anymore where my roms are at. Using Miui 12 android 11... On android 10 it can access the sd card... I hope this gets updated coz this emu is really great.
purchase, Best, Best purchase ever. There's a game shark included and it works well
emulator, good, Very good emulator had fee minor issues with crashing but nothin that's hasn't been fixed great price definitely worth it for those wanting emulator their phone
issues, minor, Very good emulator had fee minor issues with crashing but nothin that's hasn't been fixed great price definitely worth it for those wanting emulator their phone
price, great, Very good emulator had fee minor issues with crashing but nothin that's hasn't been fixed great price definitely worth it for those wanting emulator their phone
emulator, best, Was the best DS emulator, but I'm now unable to see any of my games to load. Latest update didn't fix the issue with the file browser. I have a Pixel 4a 5G on Android 11. Rom files are in main directory, as that is the only place available on my phone.
update, Latest, Was the best DS emulator, but I'm now unable to see any of my games to load. Latest update didn't fix the issue with the file browser. I have a Pixel 4a 5G on Android 11. Rom files are in main directory, as that is the only place available on my phone.
directory, main, Was the best DS emulator, but I'm now unable to see any of my games to load. Latest update didn't fix the issue with the file browser. I have a Pixel 4a 5G on Android 11. Rom files are in main directory, as that is the only place available on my phone.
place, only, Was the best DS emulator, but I'm now unable to see any of my games to load. Latest update didn't fix the issue with the file browser. I have a Pixel 4a 5G on Android 11. Rom files are in main directory, as that is the only place available on my phone.
place, available, Was the best DS emulator, but I'm now unable to see any of my games to load. Latest update didn't fix the issue with the file browser. I have a Pixel 4a 5G on Android 11. Rom files are in main directory, as that is the only place available on my phone.
device, external, The emulation is perfect, you can use any external device by Bluetooth and filter the resolution to get an amazing graphic experience, obviously, you haven't the double screen and that's the only problem
experience, amazing, The emulation is perfect, you can use any external device by Bluetooth and filter the resolution to get an amazing graphic experience, obviously, you haven't the double screen and that's the only problem
experience, graphic, The emulation is perfect, you can use any external device by Bluetooth and filter the resolution to get an amazing graphic experience, obviously, you haven't the double screen and that's the only problem
screen, double, The emulation is perfect, you can use any external device by Bluetooth and filter the resolution to get an amazing graphic experience, obviously, you haven't the double screen and that's the only problem
problem, only, The emulation is perfect, you can use any external device by Bluetooth and filter the resolution to get an amazing graphic experience, obviously, you haven't the double screen and that's the only problem
ROM, valid, Android 11 Users: This app DOES work, but you need to drop a valid NDS ROM into your MAIN DEVICE FOLDER first, then navigate to the folder where the rest of your ROMs are at. Will rate higher once the storage system is updated properly.
DEVICE, MAIN, Android 11 Users: This app DOES work, but you need to drop a valid NDS ROM into your MAIN DEVICE FOLDER first, then navigate to the folder where the rest of your ROMs are at. Will rate higher once the storage system is updated properly.
purposes, most, Works well for most purposes, but I can find no trace of the actual save files and customer support has been unresponsive. This makes sharing save files across devices very annoying, especially since I also can't simply tell it where to keep and use save files.
files, actual, Works well for most purposes, but I can find no trace of the actual save files and customer support has been unresponsive. This makes sharing save files across devices very annoying, especially since I also can't simply tell it where to keep and use save files.
files, save, Works well for most purposes, but I can find no trace of the actual save files and customer support has been unresponsive. This makes sharing save files across devices very annoying, especially since I also can't simply tell it where to keep and use save files.
devices, annoying, Works well for most purposes, but I can find no trace of the actual save files and customer support has been unresponsive. This makes sharing save files across devices very annoying, especially since I also can't simply tell it where to keep and use save files.
files, save, Works well for most purposes, but I can find no trace of the actual save files and customer support has been unresponsive. This makes sharing save files across devices very annoying, especially since I also can't simply tell it where to keep and use save files.
game, single, Waste of money. The app constantly crashes and never saves, the calibration isn't right so the buttons never work and you can't use the touch screen, the custom clock doesn't work and it doesn't read all games. I had to restart on every single game when I transferred phones because the app didn't recognize that the files were there and I couldn't change the folder destination.
sound, Excellent, Excellent, matching sound & quality. No crashes so far, and feels very comfortable to play on.
emulator, Great, Great emulator but one problem: it doesn't accept cheat codes it originally could accept? Is it because of drastic being updated? Please respond ASAP
app, Good, Good app I've had this emulator for some time now back then when i had a GS5 now I have a S9 and a Galaxy Tab S7+ I havent reslly tried using the app on my new tablet because I'm trying to find a way to load my games from my micro SD but I can't find the option and I guess it just dosen't exist because I've been looking for a while hopefully it gets added on a future update and hopefully this years update since its been more than a year from the last update
tablet, new, Good app I've had this emulator for some time now back then when i had a GS5 now I have a S9 and a Galaxy Tab S7+ I havent reslly tried using the app on my new tablet because I'm trying to find a way to load my games from my micro SD but I can't find the option and I guess it just dosen't exist because I've been looking for a while hopefully it gets added on a future update and hopefully this years update since its been more than a year from the last update
SD, micro, Good app I've had this emulator for some time now back then when i had a GS5 now I have a S9 and a Galaxy Tab S7+ I havent reslly tried using the app on my new tablet because I'm trying to find a way to load my games from my micro SD but I can't find the option and I guess it just dosen't exist because I've been looking for a while hopefully it gets added on a future update and hopefully this years update since its been more than a year from the last update
update, future, Good app I've had this emulator for some time now back then when i had a GS5 now I have a S9 and a Galaxy Tab S7+ I havent reslly tried using the app on my new tablet because I'm trying to find a way to load my games from my micro SD but I can't find the option and I guess it just dosen't exist because I've been looking for a while hopefully it gets added on a future update and hopefully this years update since its been more than a year from the last update
update, last, Good app I've had this emulator for some time now back then when i had a GS5 now I have a S9 and a Galaxy Tab S7+ I havent reslly tried using the app on my new tablet because I'm trying to find a way to load my games from my micro SD but I can't find the option and I guess it just dosen't exist because I've been looking for a while hopefully it gets added on a future update and hopefully this years update since its been more than a year from the last update
range, low, BETTER THAN ANYTHING ELSE. I have a Samsung A21 which is a kinda mid to low range performance phone, but this is the first emulator I've found where pokemon platinum runs at intended FPS and doesn't crash every 90 seconds, Drastic somehow squeezed the extra performance out lol. Completely worth the money.
emulator, first, BETTER THAN ANYTHING ELSE. I have a Samsung A21 which is a kinda mid to low range performance phone, but this is the first emulator I've found where pokemon platinum runs at intended FPS and doesn't crash every 90 seconds, Drastic somehow squeezed the extra performance out lol. Completely worth the money.
performance, extra, BETTER THAN ANYTHING ELSE. I have a Samsung A21 which is a kinda mid to low range performance phone, but this is the first emulator I've found where pokemon platinum runs at intended FPS and doesn't crash every 90 seconds, Drastic somehow squeezed the extra performance out lol. Completely worth the money.
emulator, good, This was a good emulator until the last few days As a search for games the app crashes
days, last, This was a good emulator until the last few days As a search for games the app crashes
days, few, This was a good emulator until the last few days As a search for games the app crashes
menu, quick, Works well, has plenty of options. I mostly play sticker games which are great in the touchscreen, the emulator lets me hide the controllers and nullify the buttons, all from the quick menu which has all the most convenient options at hand. Couldn't ask for more in a DS emulator for mobile phones.
options, convenient, Works well, has plenty of options. I mostly play sticker games which are great in the touchscreen, the emulator lets me hide the controllers and nullify the buttons, all from the quick menu which has all the most convenient options at hand. Couldn't ask for more in a DS emulator for mobile phones.
phones, mobile, Works well, has plenty of options. I mostly play sticker games which are great in the touchscreen, the emulator lets me hide the controllers and nullify the buttons, all from the quick menu which has all the most convenient options at hand. Couldn't ask for more in a DS emulator for mobile phones.
screen, dual, I have a dual screen phone and I was really hoping this app would allow me to turn it into a DS with boths screens a little disapointed it's still a halfway decent app though just missing the potential that I hoped it had
app, halfway, I have a dual screen phone and I was really hoping this app would allow me to turn it into a DS with boths screens a little disapointed it's still a halfway decent app though just missing the potential that I hoped it had
app, decent, I have a dual screen phone and I was really hoping this app would allow me to turn it into a DS with boths screens a little disapointed it's still a halfway decent app though just missing the potential that I hoped it had
folder, own, Doesn't find rooms on phone storage, even if dropped in the app own folder
emulator, best, Simply the best DS emulator on Android. Well worth the small purchase.
purchase, small, Simply the best DS emulator on Android. Well worth the small purchase.
game, new, It was working well at first but when I not only could it not find two of the games I had, but when I tried to start a new game, the app kept crashing. If you're gonna make me spend money on this, you better make damn well sure that it works.
review, first, Made my first review in 2014 and forgot to ever update it. Love this emulator, I get to play all the pokemon games I never got the chance to growing up! Had to change my rating :)
stick, right, I only have a couple of nitpicks: 1- You can't map buttons to directions of the right analog stick on a controller, which its a bummer because there's some games where it'd be handy to map the camera controls buttons (Usually L and R) to pushing the analog left and right. 2- You can only map 1 physical button to each of the emulated controls, which its also a bummer, because even if the first nitpick was fixed, I'd have to swap between mapping L and R to the triggers and analog back and forth.
button, physical, I only have a couple of nitpicks: 1- You can't map buttons to directions of the right analog stick on a controller, which its a bummer because there's some games where it'd be handy to map the camera controls buttons (Usually L and R) to pushing the analog left and right. 2- You can only map 1 physical button to each of the emulated controls, which its also a bummer, because even if the first nitpick was fixed, I'd have to swap between mapping L and R to the triggers and analog back and forth.
controls, emulated, I only have a couple of nitpicks: 1- You can't map buttons to directions of the right analog stick on a controller, which its a bummer because there's some games where it'd be handy to map the camera controls buttons (Usually L and R) to pushing the analog left and right. 2- You can only map 1 physical button to each of the emulated controls, which its also a bummer, because even if the first nitpick was fixed, I'd have to swap between mapping L and R to the triggers and analog back and forth.
nitpick, first, I only have a couple of nitpicks: 1- You can't map buttons to directions of the right analog stick on a controller, which its a bummer because there's some games where it'd be handy to map the camera controls buttons (Usually L and R) to pushing the analog left and right. 2- You can only map 1 physical button to each of the emulated controls, which its also a bummer, because even if the first nitpick was fixed, I'd have to swap between mapping L and R to the triggers and analog back and forth.
emulator, Great, Great ds emulator. For anyone having storage issues were it not showing your games on external sd, just move your roms to internal memory and reinstall drastic it reads them then. This is an error with android 11 most emulators are having this problem some are fixed this 1 isn't.
emulator, ds, Great ds emulator. For anyone having storage issues were it not showing your games on external sd, just move your roms to internal memory and reinstall drastic it reads them then. This is an error with android 11 most emulators are having this problem some are fixed this 1 isn't.
sd, external, Great ds emulator. For anyone having storage issues were it not showing your games on external sd, just move your roms to internal memory and reinstall drastic it reads them then. This is an error with android 11 most emulators are having this problem some are fixed this 1 isn't.
memory, internal, Great ds emulator. For anyone having storage issues were it not showing your games on external sd, just move your roms to internal memory and reinstall drastic it reads them then. This is an error with android 11 most emulators are having this problem some are fixed this 1 isn't.
emulators, most, Great ds emulator. For anyone having storage issues were it not showing your games on external sd, just move your roms to internal memory and reinstall drastic it reads them then. This is an error with android 11 most emulators are having this problem some are fixed this 1 isn't.
months, several, Unable to load any roms... was able to load them several months ago, but recently i cannot navigate the folder structure to find them...
handle, easy, WORKS 100% all NDS roms... smoothly fasted easy handle controlling and has an huge option menu for anything and everything needed possible to manage or arrange to it's own way/accessibility/etc..
menu, huge, WORKS 100% all NDS roms... smoothly fasted easy handle controlling and has an huge option menu for anything and everything needed possible to manage or arrange to it's own way/accessibility/etc..
accessibility, own, WORKS 100% all NDS roms... smoothly fasted easy handle controlling and has an huge option menu for anything and everything needed possible to manage or arrange to it's own way/accessibility/etc..
games, blank, For those of you who are using phones without SD cards, android 11, or those who are getting the blank games list issue please note all you have to do is make a folder within the base directory of your phone. Example is I made a folder called Ds roms in my "internal memory" area. Then booted up the app and bam. My games all work. Phones are different meaning of this doesn't work try moving said folder around until it does. Thank you for a wonderful app. The BEST DS app on the market worth $5.00
