VERB, PREP, POBJ, 
looking, after, years, This game is amazing! I remember buying this long ago. Now I am looking back at it after a few years disappointed on the lack of new levels. Please make more levels!
disappointed, on, lack, This game is amazing! I remember buying this long ago. Now I am looking back at it after a few years disappointed on the lack of new levels. Please make more levels!
line, with, calibration, Even with calibration some of the song beats don't line up.
had, for, levels, This game is fun,fresh,and keeps me wanting to play more. Please keep making levels for this game. I would pay if I had to for more levels. keep up the great work .
wait, for, more, This is awesome. The beats and songs :O!! Cant wait for more. Im recommending this to so many of my mates. One thing, if you could have a verses option so I can verse my brother haha and more beats please!!
recommending, to, many, This is awesome. The beats and songs :O!! Cant wait for more. Im recommending this to so many of my mates. One thing, if you could have a verses option so I can verse my brother haha and more beats please!!
waiting, in, time, I absolutely love it, really addicting game! One of the best rhythm game I have ever played, I'm waiting for new updates to come, in the mean time I am stuck at 3-X (1.1x). Can you add like maybe easy mode or something? because it gets really challenging. other than that, fun experience. 6/5
stuck, at, 3, I absolutely love it, really addicting game! One of the best rhythm game I have ever played, I'm waiting for new updates to come, in the mean time I am stuck at 3-X (1.1x). Can you add like maybe easy mode or something? because it gets really challenging. other than that, fun experience. 6/5
stuck, at, 1.1x, I absolutely love it, really addicting game! One of the best rhythm game I have ever played, I'm waiting for new updates to come, in the mean time I am stuck at 3-X (1.1x). Can you add like maybe easy mode or something? because it gets really challenging. other than that, fun experience. 6/5
add, like, mode, I absolutely love it, really addicting game! One of the best rhythm game I have ever played, I'm waiting for new updates to come, in the mean time I am stuck at 3-X (1.1x). Can you add like maybe easy mode or something? because it gets really challenging. other than that, fun experience. 6/5
comparing, to, version, Cool mechanics, visuals and the difficulty is just right (for me atleast). It's kinda sorta laggy (in frames) for some reason but that's just me comparing it to the web version. It's still very playable since you don't really have to rely on visuals in this game too much.
rely, on, visuals, Cool mechanics, visuals and the difficulty is just right (for me atleast). It's kinda sorta laggy (in frames) for some reason but that's just me comparing it to the web version. It's still very playable since you don't really have to rely on visuals in this game too much.
break, into, chunks, A really great, absorbing game. The only thing that would make it better would be the ability to break the long, hard levels into practice chunks. There are areas in the long levels that require a certain amount of repetitive practice to internalize the rhythm, but playing over the entire level to get to that point causes finger fatigue, which makes any kind of repetitive practice both difficult and painful.
get, to, point, A really great, absorbing game. The only thing that would make it better would be the ability to break the long, hard levels into practice chunks. There are areas in the long levels that require a certain amount of repetitive practice to internalize the rhythm, but playing over the entire level to get to that point causes finger fatigue, which makes any kind of repetitive practice both difficult and painful.
share, with, people, I have deleted all the others.   Clever mechanic and visuals. Fun and addictive, great to share with people. frustrating enough to keep you playing and fun enough/ enough of a skill barrier to keep you coming back.   any time i need a 5-10 min break this is the only game I need.
played, on, Kongregate, A rhythm gamer friend of mine and i played this first on Kongregate and we loved it. I bought it to support the creator and in hopes to get more levels! We bothe also want a level creator/editor. Id love to make my own songs!                                                Edit: its been a while and im sooo looking forward to new content! I was also wondering if, now that the Nintendo 3DS is going to have Unity support, if a verson for it will be created? Edit 2: awesome! Im so excited to see more in this!
looking, to, content, A rhythm gamer friend of mine and i played this first on Kongregate and we loved it. I bought it to support the creator and in hopes to get more levels! We bothe also want a level creator/editor. Id love to make my own songs!                                                Edit: its been a while and im sooo looking forward to new content! I was also wondering if, now that the Nintendo 3DS is going to have Unity support, if a verson for it will be created? Edit 2: awesome! Im so excited to see more in this!
see, in, this, A rhythm gamer friend of mine and i played this first on Kongregate and we loved it. I bought it to support the creator and in hopes to get more levels! We bothe also want a level creator/editor. Id love to make my own songs!                                                Edit: its been a while and im sooo looking forward to new content! I was also wondering if, now that the Nintendo 3DS is going to have Unity support, if a verson for it will be created? Edit 2: awesome! Im so excited to see more in this!
lags, on, nexus, Found this game online today! Once I figured out is was on Android I bought it, unfortunately it lags on the nexus 6... :(
getting, with, level, There's a similar game out called Skyward, and while that has better graphics, I think you have better gameplay here by introducing a rhythm element. That and you don't have ads. It's fun but doesn't look great.  Reply: Dude, getting ratings as high as this with this level of graphics is an achievement. I look forward to seeing the look change. :)
played, on, browser, As others have said, I played on browser but bought anyway to support. Also, I would like to get in touch with the developer for some questions, as this topic is my masters thesis.
get, in, touch, As others have said, I played on browser but bought anyway to support. Also, I would like to get in touch with the developer for some questions, as this topic is my masters thesis.
get, for, questions, As others have said, I played on browser but bought anyway to support. Also, I would like to get in touch with the developer for some questions, as this topic is my masters thesis.
struggle, with, something, I play this game when I have a bad day or struggle with something. It reminds me that there are things in life I am worse at.
looking, for, game, I spent another night looking for a better rhythm game.  A game called Radiohammer looked promising but the controls weren't responsive so it's useless.  If you want an android rhythm game this is it!  God I'm sick of guitar-hero style rhythm games--I played DDR a long time ago and got over it!  Anyway, this Dev is responsive and his appreciation of Rhythm Tengoku (the best rhythm game) shows.  Maybe he'll team up with some other like-minded folks and create a full-fledged game like Rhythm Tengoku?!
got, over, it, I spent another night looking for a better rhythm game.  A game called Radiohammer looked promising but the controls weren't responsive so it's useless.  If you want an android rhythm game this is it!  God I'm sick of guitar-hero style rhythm games--I played DDR a long time ago and got over it!  Anyway, this Dev is responsive and his appreciation of Rhythm Tengoku (the best rhythm game) shows.  Maybe he'll team up with some other like-minded folks and create a full-fledged game like Rhythm Tengoku?!
team, with, folks, I spent another night looking for a better rhythm game.  A game called Radiohammer looked promising but the controls weren't responsive so it's useless.  If you want an android rhythm game this is it!  God I'm sick of guitar-hero style rhythm games--I played DDR a long time ago and got over it!  Anyway, this Dev is responsive and his appreciation of Rhythm Tengoku (the best rhythm game) shows.  Maybe he'll team up with some other like-minded folks and create a full-fledged game like Rhythm Tengoku?!
playing, on, web, Just playing this game on the web and I fell in love with it. Instant buy when I know that I can play this on my phone
fell, in, love, Just playing this game on the web and I fell in love with it. Instant buy when I know that I can play this on my phone
fell, with, it, Just playing this game on the web and I fell in love with it. Instant buy when I know that I can play this on my phone
play, on, phone, Just playing this game on the web and I fell in love with it. Instant buy when I know that I can play this on my phone
play, on, pc, I used to play it all the time on my pc, and I've never stopped loving it.
keep, like, me, Love this game!  It's simple but oh so challenging!  I wish there were more levels!   This game isn't for the faint of heart.  (or people who can't keep a rhythm like me).  There's something so wonderful about this game that keeps me coming back.  FIVE STARS!  Great job.  I'd pay good money if there was a sequel!
happen, to, store, Fun, addicting, occasionally frustrating, this game is simple and fun to play. If every developer could make these kinds of games for the price range of &lt;$2, they could be the best thing to happen to the app store.
Getting, on, tool, Getting an A on the calibration tool was a bit of extra fun. However I feel that the buttons on the screen could be smaller, and the calibration number a little bigger. Overall it was quite short and I'm looking forward to more worlds or other game modes too.
looking, to, worlds, Getting an A on the calibration tool was a bit of extra fun. However I feel that the buttons on the screen could be smaller, and the calibration number a little bigger. Overall it was quite short and I'm looking forward to more worlds or other game modes too.
throwing, at, me, This game is amazing, it takes me back to the days of playing rock band everynight. I like that it's throwing odd rhythms at me that I don't normally hear in music too. My only problem is that I get little lag spikes every once in a while, does anyone know a fix for this? I've tried stopping all background apps and it still happens, just enough lag to mess me up :( Edit: I'm using a galaxy S5 if it helps, also really hoping this gets updated in the future, nice work dev!
hear, in, music, This game is amazing, it takes me back to the days of playing rock band everynight. I like that it's throwing odd rhythms at me that I don't normally hear in music too. My only problem is that I get little lag spikes every once in a while, does anyone know a fix for this? I've tried stopping all background apps and it still happens, just enough lag to mess me up :( Edit: I'm using a galaxy S5 if it helps, also really hoping this gets updated in the future, nice work dev!
get, in, while, This game is amazing, it takes me back to the days of playing rock band everynight. I like that it's throwing odd rhythms at me that I don't normally hear in music too. My only problem is that I get little lag spikes every once in a while, does anyone know a fix for this? I've tried stopping all background apps and it still happens, just enough lag to mess me up :( Edit: I'm using a galaxy S5 if it helps, also really hoping this gets updated in the future, nice work dev!
updated, in, future, This game is amazing, it takes me back to the days of playing rock band everynight. I like that it's throwing odd rhythms at me that I don't normally hear in music too. My only problem is that I get little lag spikes every once in a while, does anyone know a fix for this? I've tried stopping all background apps and it still happens, just enough lag to mess me up :( Edit: I'm using a galaxy S5 if it helps, also really hoping this gets updated in the future, nice work dev!
prove, to, myself, I even had to try the calibration mini-game several times just to prove to myself that I could get an "A"
spent, on, app, Great music, a fast pace and lots of fun, which makes it easy to get drawn in.   Had enough fun for it to be an easy 5 stars to give, but this game clearly has lots more potential for future updates.  Best 60p spent on an app in a long time.
spent, in, time, Great music, a fast pace and lots of fun, which makes it easy to get drawn in.   Had enough fun for it to be an easy 5 stars to give, but this game clearly has lots more potential for future updates.  Best 60p spent on an app in a long time.
