NOUN, ADJ, 
graphics, good, This game is SO GOOD And have good graphics
game, good, Very good game and I'm very happy with how smooth the game runs. I have no bugs except when I'm mid game and leave the app (to go text a freind and come back) when I come back it lags although I just re open the app so it 99% always works and so far 4 stars:))
game, mid, Very good game and I'm very happy with how smooth the game runs. I have no bugs except when I'm mid game and leave the app (to go text a freind and come back) when I come back it lags although I just re open the app so it 99% always works and so far 4 stars:))
game, amazing, Real amazing game the $2 was worth it keep up making the great games even though you said you're kind of done really amazing game all the mechanics are good and the music pretty cool but I wish there was the extras menu like on PC
games, great, Real amazing game the $2 was worth it keep up making the great games even though you said you're kind of done really amazing game all the mechanics are good and the music pretty cool but I wish there was the extras menu like on PC
game, amazing, Real amazing game the $2 was worth it keep up making the great games even though you said you're kind of done really amazing game all the mechanics are good and the music pretty cool but I wish there was the extras menu like on PC
game, Super, Super scary game and very difficult a compliment to the fnaf franchise
game, scary, Super scary game and very difficult a compliment to the fnaf franchise
level, next, Ok first off SOOO good its like FNAF but to the next level
game, cool, It's a really cool game and I love it it's a really fun game To play
game, fun, It's a really cool game and I love it it's a really fun game To play
game, hard, Very hard game I always come close to beating the first night I will never give up until I get the flumpty night 2 unlocked
night, first, Very hard game I always come close to beating the first night I will never give up until I get the flumpty night 2 unlocked
night, flumpty, Very hard game I always come close to beating the first night I will never give up until I get the flumpty night 2 unlocked
fun, super, This game will get your blood pumping. Its super fun and the mechanics are good👍. For only 2 bucks this game is a steal i recommend anyone who wants to try fnaf fan games to try this one.
game, Best, Best game in my life
game, fun, Really fun game
game, Amazing, Amazing game
game, favorite, One nights at flumpty's 3 my favorite game ever
game, great, Such a great game.To bad its the finial game of the one night at flumptys series.
game, finial, Such a great game.To bad its the finial game of the one night at flumptys series.
series, flumptys, Such a great game.To bad its the finial game of the one night at flumptys series.
game, good, Very good game, the only thing to improve is changing cameras, and flipping the camera up... That's about it.
thing, only, Very good game, the only thing to improve is changing cameras, and flipping the camera up... That's about it.
game, Best, Best FNaF fan-game yet. EASILY.
game, Good, Good game
night, flumptys, I paid for this but on game jolt it not paid give me my money back and no flumptys night, hard boald mode and the other one
mode, boald, I paid for this but on game jolt it not paid give me my money back and no flumptys night, hard boald mode and the other one
game, cool, Very cool game! I didn't know this game and that everyone was nostalgic to it until now. I'm sad that it's the last game, but I hope the community of the FNaF and ONaF will encourage and help you make more games of the ONaF franchise so that ONaF will be continued!
game, last, Very cool game! I didn't know this game and that everyone was nostalgic to it until now. I'm sad that it's the last game, but I hope the community of the FNaF and ONaF will encourage and help you make more games of the ONaF franchise so that ONaF will be continued!
games, more, Very cool game! I didn't know this game and that everyone was nostalgic to it until now. I'm sad that it's the last game, but I hope the community of the FNaF and ONaF will encourage and help you make more games of the ONaF franchise so that ONaF will be continued!
bug, crashing, Thanks for fixing the crashing bug. I had already beaten the game on another phone I have, and this game was amazing! Although I didn't really like how on Hard Boiled Mode, or normal mode, there's a chance that Birthday Boy Blam and Grunkfuss can enter the hallway at the exact same time, making it almost impossible, especially on HBM, to get rid of BBB. This can also happen with Eyesaur, but hes beatable because he doesnt attack as fast. Beside that, excellent game and port!
mode, normal, Thanks for fixing the crashing bug. I had already beaten the game on another phone I have, and this game was amazing! Although I didn't really like how on Hard Boiled Mode, or normal mode, there's a chance that Birthday Boy Blam and Grunkfuss can enter the hallway at the exact same time, making it almost impossible, especially on HBM, to get rid of BBB. This can also happen with Eyesaur, but hes beatable because he doesnt attack as fast. Beside that, excellent game and port!
time, exact, Thanks for fixing the crashing bug. I had already beaten the game on another phone I have, and this game was amazing! Although I didn't really like how on Hard Boiled Mode, or normal mode, there's a chance that Birthday Boy Blam and Grunkfuss can enter the hallway at the exact same time, making it almost impossible, especially on HBM, to get rid of BBB. This can also happen with Eyesaur, but hes beatable because he doesnt attack as fast. Beside that, excellent game and port!
time, same, Thanks for fixing the crashing bug. I had already beaten the game on another phone I have, and this game was amazing! Although I didn't really like how on Hard Boiled Mode, or normal mode, there's a chance that Birthday Boy Blam and Grunkfuss can enter the hallway at the exact same time, making it almost impossible, especially on HBM, to get rid of BBB. This can also happen with Eyesaur, but hes beatable because he doesnt attack as fast. Beside that, excellent game and port!
game, excellent, Thanks for fixing the crashing bug. I had already beaten the game on another phone I have, and this game was amazing! Although I didn't really like how on Hard Boiled Mode, or normal mode, there's a chance that Birthday Boy Blam and Grunkfuss can enter the hallway at the exact same time, making it almost impossible, especially on HBM, to get rid of BBB. This can also happen with Eyesaur, but hes beatable because he doesnt attack as fast. Beside that, excellent game and port!
egg, funny, This game good. It has funny egg.
game, Awesome, Awesome game! I love the mechanics and it's super easy to move around and check cams quickly. I haven't experienced the bug people yet where you get frozen at some point. Although if I go to recent tabs and go back in I get serious lag. Other than that, great game and really not a disappointing third entry to the series! Keep up the good work, guys!
tabs, recent, Awesome game! I love the mechanics and it's super easy to move around and check cams quickly. I haven't experienced the bug people yet where you get frozen at some point. Although if I go to recent tabs and go back in I get serious lag. Other than that, great game and really not a disappointing third entry to the series! Keep up the good work, guys!
lag, serious, Awesome game! I love the mechanics and it's super easy to move around and check cams quickly. I haven't experienced the bug people yet where you get frozen at some point. Although if I go to recent tabs and go back in I get serious lag. Other than that, great game and really not a disappointing third entry to the series! Keep up the good work, guys!
game, great, Awesome game! I love the mechanics and it's super easy to move around and check cams quickly. I haven't experienced the bug people yet where you get frozen at some point. Although if I go to recent tabs and go back in I get serious lag. Other than that, great game and really not a disappointing third entry to the series! Keep up the good work, guys!
entry, disappointing, Awesome game! I love the mechanics and it's super easy to move around and check cams quickly. I haven't experienced the bug people yet where you get frozen at some point. Although if I go to recent tabs and go back in I get serious lag. Other than that, great game and really not a disappointing third entry to the series! Keep up the good work, guys!
entry, third, Awesome game! I love the mechanics and it's super easy to move around and check cams quickly. I haven't experienced the bug people yet where you get frozen at some point. Although if I go to recent tabs and go back in I get serious lag. Other than that, great game and really not a disappointing third entry to the series! Keep up the good work, guys!
work, good, Awesome game! I love the mechanics and it's super easy to move around and check cams quickly. I haven't experienced the bug people yet where you get frozen at some point. Although if I go to recent tabs and go back in I get serious lag. Other than that, great game and really not a disappointing third entry to the series! Keep up the good work, guys!
man, red, This game is nice when I played it was okay but I was watching YouTube I was watching five nights at thumptys3 and it was super scary I feel like the clown is super hard to deel with cuz how are you supposed to know when to not picture the clown like can there be somthing to know when to not picture the clown and there's this red man he comes from the fire how when your heating up then he pops out and kills you how are you supposed to know to time it right when red man comes
man, red, This game is nice when I played it was okay but I was watching YouTube I was watching five nights at thumptys3 and it was super scary I feel like the clown is super hard to deel with cuz how are you supposed to know when to not picture the clown like can there be somthing to know when to not picture the clown and there's this red man he comes from the fire how when your heating up then he pops out and kills you how are you supposed to know to time it right when red man comes
effects, sound, Pros: The game style is good, there are no ads, you don't have to pay foe anything in-game, the jumpscares are good, the sound effects are great, the game is well made. Cons: Sometimes the game lags, you have to pay on phone but not on PC.
update, new, The new update has thankfully fixed the game, thank you Clickteam for making another great game 🎮👍
game, great, The new update has thankfully fixed the game, thank you Clickteam for making another great game 🎮👍
screen, rhe, Let me put this in details for you guys to understand. The game shows rhe loading screen then closes the app from it crashing. Thats all there is.
Job, amazing, MY GOD this is frickin amazing the amount of difficulty is great and you have to be very attentive on everything,I like how grunkuss can get in the way but is balanced because he is fast,You did an amazing Job on the creation of everyone and everything,Nothing is unfair (flumpty) and it's balanced,I haven't experienced bugs which is good,But aside that,I loved it you have no idea how much people waited for this,I hope you have a great day and try to relax aswell (and Hi Scott)
day, great, MY GOD this is frickin amazing the amount of difficulty is great and you have to be very attentive on everything,I like how grunkuss can get in the way but is balanced because he is fast,You did an amazing Job on the creation of everyone and everything,Nothing is unfair (flumpty) and it's balanced,I haven't experienced bugs which is good,But aside that,I loved it you have no idea how much people waited for this,I hope you have a great day and try to relax aswell (and Hi Scott)
game, Great, Great game but at 4am and 5am it is very stressful
time, cracking, A cracking good time
time, good, A cracking good time
time, next, As of now, the game can't even get to the warning screen without crashing. I know this is already being fixed, but next time can you please test this on smaller devices so we don't get deceived from these crashes. (Update: the game works perfectly fine now. I works perfectly and the 2nd half of the game is so intense. Definitely give this a try.)
devices, smaller, As of now, the game can't even get to the warning screen without crashing. I know this is already being fixed, but next time can you please test this on smaller devices so we don't get deceived from these crashes. (Update: the game works perfectly fine now. I works perfectly and the 2nd half of the game is so intense. Definitely give this a try.)
half, 2nd, As of now, the game can't even get to the warning screen without crashing. I know this is already being fixed, but next time can you please test this on smaller devices so we don't get deceived from these crashes. (Update: the game works perfectly fine now. I works perfectly and the 2nd half of the game is so intense. Definitely give this a try.)
fnaf, best, Now that the optimization update came out, it runs flawlessly and wont crash anymore. This is the single best fnaf style game out there. Play It.
game, single, Now that the optimization update came out, it runs flawlessly and wont crash anymore. This is the single best fnaf style game out there. Play It.
fangames, other, I love this game and the mechanics, great send off to the story, can't wait for the other fangames!
night, main, This completely exceeded my expectations. The main night itself is just as good as ONaF 2, but the twist halfway through is what really makes the game. Never before in a FNaF game have i ever wanted to replay a night over, and over, and over again.
atmosphere, Nice, The game is great. Nice atmosphere, nice scares. This is an amazing game, great job!
scares, nice, The game is great. Nice atmosphere, nice scares. This is an amazing game, great job!
game, amazing, The game is great. Nice atmosphere, nice scares. This is an amazing game, great job!
job, great, The game is great. Nice atmosphere, nice scares. This is an amazing game, great job!
night, original, Very fun they did fix where it would crash on the warning screen for me atleast...BUT it is very hard for me but I'm on the original 1st night I can only make it to 4am
night, 1st, Very fun they did fix where it would crash on the warning screen for me atleast...BUT it is very hard for me but I'm on the original 1st night I can only make it to 4am
game, first, played the very first flumpty game back on 2015 waited for the second one bit more intense than 1 but after hearing news about new flumpty game being cancelled I became a bit sad but after hearing the story of why it was cancelled I respect that but now year's after year Finally a new Flumpty game sad since this is the last time we'll ever see him but what a great way to end a series on a good note hopefully we see merch probably not or maybe would love to have a Grunkfuss figure
game, flumpty, played the very first flumpty game back on 2015 waited for the second one bit more intense than 1 but after hearing news about new flumpty game being cancelled I became a bit sad but after hearing the story of why it was cancelled I respect that but now year's after year Finally a new Flumpty game sad since this is the last time we'll ever see him but what a great way to end a series on a good note hopefully we see merch probably not or maybe would love to have a Grunkfuss figure
game, new, played the very first flumpty game back on 2015 waited for the second one bit more intense than 1 but after hearing news about new flumpty game being cancelled I became a bit sad but after hearing the story of why it was cancelled I respect that but now year's after year Finally a new Flumpty game sad since this is the last time we'll ever see him but what a great way to end a series on a good note hopefully we see merch probably not or maybe would love to have a Grunkfuss figure
game, flumpty, played the very first flumpty game back on 2015 waited for the second one bit more intense than 1 but after hearing news about new flumpty game being cancelled I became a bit sad but after hearing the story of why it was cancelled I respect that but now year's after year Finally a new Flumpty game sad since this is the last time we'll ever see him but what a great way to end a series on a good note hopefully we see merch probably not or maybe would love to have a Grunkfuss figure
game, sad, played the very first flumpty game back on 2015 waited for the second one bit more intense than 1 but after hearing news about new flumpty game being cancelled I became a bit sad but after hearing the story of why it was cancelled I respect that but now year's after year Finally a new Flumpty game sad since this is the last time we'll ever see him but what a great way to end a series on a good note hopefully we see merch probably not or maybe would love to have a Grunkfuss figure
time, last, played the very first flumpty game back on 2015 waited for the second one bit more intense than 1 but after hearing news about new flumpty game being cancelled I became a bit sad but after hearing the story of why it was cancelled I respect that but now year's after year Finally a new Flumpty game sad since this is the last time we'll ever see him but what a great way to end a series on a good note hopefully we see merch probably not or maybe would love to have a Grunkfuss figure
way, great, played the very first flumpty game back on 2015 waited for the second one bit more intense than 1 but after hearing news about new flumpty game being cancelled I became a bit sad but after hearing the story of why it was cancelled I respect that but now year's after year Finally a new Flumpty game sad since this is the last time we'll ever see him but what a great way to end a series on a good note hopefully we see merch probably not or maybe would love to have a Grunkfuss figure
note, good, played the very first flumpty game back on 2015 waited for the second one bit more intense than 1 but after hearing news about new flumpty game being cancelled I became a bit sad but after hearing the story of why it was cancelled I respect that but now year's after year Finally a new Flumpty game sad since this is the last time we'll ever see him but what a great way to end a series on a good note hopefully we see merch probably not or maybe would love to have a Grunkfuss figure
job, outstanding, Amazing game jono did an outstanding job here only one complaint How the hell is it #1 in SIMULATION like it's not even a simulator
problem, crashing, You need to fix this crashing problem you technically stole people's money cuz we can't play the game cuz it keeps crashing
things, good, Heard good things about this game but when I load in it kicks me out
clickstream, better, It keeps backing out of the app don't put the game on here if it's not gonna the work for all phones one star do better clickstream
comments, other, Same as all the other comments, game boot... Game crash. Just fix this and I'll be happy (I have the game on PC too so I know that I like this game)
game, best, I love this one best game ever
game, scariest, The scariest game I've played in a while
fan, big, This game works fine and I am a big fan of the series I think this game turned out great! Loading is slow occasionally but it is bearable!
status, Absolute, Absolute godtier status. I love this game! Not gonna spoil but the game had me in the first half ngl after it hit 6 XD I also love the graphics very improved from the last 2 games I can tell that Jonochrome put his heart and soul into this game :3
status, godtier, Absolute godtier status. I love this game! Not gonna spoil but the game had me in the first half ngl after it hit 6 XD I also love the graphics very improved from the last 2 games I can tell that Jonochrome put his heart and soul into this game :3
games, last, Absolute godtier status. I love this game! Not gonna spoil but the game had me in the first half ngl after it hit 6 XD I also love the graphics very improved from the last 2 games I can tell that Jonochrome put his heart and soul into this game :3
disappointment, huge, the face it keeps on crashing is a huge disappointment. if you're hearing this jonochrome, please fix this problem, thanks. also, egg
game, new, The game keeps crashing when I try to load it but this is expected from such a new game.
lag, due, The game has lag so the jumpscare animations sometimes take long due to that lag and they feel wonky and boring to sit through, other than that good game
game, good, The game has lag so the jumpscare animations sometimes take long due to that lag and they feel wonky and boring to sit through, other than that good game
onaf, fav, My fav onaf it's very fun and it's the best of the trilogy
game, Best, Best game
