VERB, PREP, POBJ, 
play, on, phone, Love the game on pc and console. Horrible on phone, pretty much a pain to play on phone. I would not purchase and I bought this game on every platform from pc to ps4 and xbox.
bought, on, platform, Love the game on pc and console. Horrible on phone, pretty much a pain to play on phone. I would not purchase and I bought this game on every platform from pc to ps4 and xbox.
bought, to, ps4, Love the game on pc and console. Horrible on phone, pretty much a pain to play on phone. I would not purchase and I bought this game on every platform from pc to ps4 and xbox.
made, for, mobile, Fabulous port from the original. Well made for mobile. Occasional glitch with saves but that's a small price to pay, and usually resolves itself with a second attempt to load. Truly, brilliant. Xcom fan forever!!
resolves, with, attempt, Fabulous port from the original. Well made for mobile. Occasional glitch with saves but that's a small price to pay, and usually resolves itself with a second attempt to load. Truly, brilliant. Xcom fan forever!!
crashing, for, oneplus, Game keeps crashing for oneplus 8t android 11
Fight, for, God, Fight the Aliens for God. No 666 No Mark Of Beast
have, on, chromebook, ive always enjoyed this game, n when i found out i can have it on my chromebook, i jumped on it.
jumped, on, it, ive always enjoyed this game, n when i found out i can have it on my chromebook, i jumped on it.
notice, in, missions, Great strategy game. Handles well. Did notice a glitch in the first couple missions that blocked my guys from going up ladders but wasn't necessary
updated, in, years, Have the devs abandoned this game as it hasn't been updated in three years?! Biggest frustration is the alien abduction mechanic of the game.Choosing one country out of three only for panic levels to rise exponentially throughout the continents the other two are from is a major flaw as it's game over too soon when 8 dropout after reaching the critical level.It's especially grating as you're getting a handle on the game, really enjoying it.Don't have the panic levels rise so high, please.
rise, throughout, continents, Have the devs abandoned this game as it hasn't been updated in three years?! Biggest frustration is the alien abduction mechanic of the game.Choosing one country out of three only for panic levels to rise exponentially throughout the continents the other two are from is a major flaw as it's game over too soon when 8 dropout after reaching the critical level.It's especially grating as you're getting a handle on the game, really enjoying it.Don't have the panic levels rise so high, please.
works, on, s10e, I was worried since the devs abandoned the game years ago. I am pleased to say it works fine on a Samsung s10e with current Android OS as of 11/2020. It is a clone/port of the PC game, so there are some UI inconveniences as you would expect. But the game does not crash and there is only one game breaking bug that is easily avoidable once you find it.
works, with, OS, I was worried since the devs abandoned the game years ago. I am pleased to say it works fine on a Samsung s10e with current Android OS as of 11/2020. It is a clone/port of the PC game, so there are some UI inconveniences as you would expect. But the game does not crash and there is only one game breaking bug that is easily avoidable once you find it.
Love, on, phone, Love it, even on a phone that I consider sub-par.... All things considered. Fun and great throw back I didn't know was available in the play store.
STAY, AS, I'M, Good port but having to zoom out every single time you move a new character is a pain in the butt. Completely ruins the game for me. PLEASE MAKE THE VIEW ZOOMED OUT AND STAY THAT WAY AS AN OPTION I'M BEGGING YOU 🙏
wait, for, Collection, Can't wait for XCOM 2 Collection for Android in 2021.
wait, in, 2021, Can't wait for XCOM 2 Collection for Android in 2021.
play, on, difficulty, Best strategy game on mobile Just make sure your anus is clenchef if you play on original difficulty ;)
turn, from, pc, Best strategy turn base game and best port from pc ever made.
work, on, phone, The game didn't work on my phone (Galaxy S10). It regularly froze on loading screens and would crash intermittently. Roughly 1/5 attempts to play worked. I requested a refund, Google Play said to contact the developer. I then contacted 2K, they said to contact the retailer. In short - the game didn't work, and neither company will give a refund. I do not recommend you purchase this game.
froze, on, screens, The game didn't work on my phone (Galaxy S10). It regularly froze on loading screens and would crash intermittently. Roughly 1/5 attempts to play worked. I requested a refund, Google Play said to contact the developer. I then contacted 2K, they said to contact the retailer. In short - the game didn't work, and neither company will give a refund. I do not recommend you purchase this game.
made, While, game, While a good game, the camera controls are just not made for a touch device.
made, for, device, While a good game, the camera controls are just not made for a touch device.
run, on, tablet, i downloaded and installed but the app will not run on my tablet . i hav3 redownloaded it twice and still doesnt work. it wont allow for me to get a refund either! im furious.
played, in, couple, I love it. THE BEST TURN BASE STRATGY in my device. I played in couple of months, have fun and some lag, but everyting ok. Untuk Google Play updates. After loading and go to main menu, my apps suddenly stop. Dev Teams, please fix this, so this game won't die, pretty please.
go, to, menu, I love it. THE BEST TURN BASE STRATGY in my device. I played in couple of months, have fun and some lag, but everyting ok. Untuk Google Play updates. After loading and go to main menu, my apps suddenly stop. Dev Teams, please fix this, so this game won't die, pretty please.
stop, After, loading, I love it. THE BEST TURN BASE STRATGY in my device. I played in couple of months, have fun and some lag, but everyting ok. Untuk Google Play updates. After loading and go to main menu, my apps suddenly stop. Dev Teams, please fix this, so this game won't die, pretty please.
play, on, phone, Got this pc and just thought perfect game to play on a phone so got android version as well. Very hard but awesome game it seems same as pc version to me so far runs great for me on sony Xperia XZ2 (android 10)
seems, as, version, Got this pc and just thought perfect game to play on a phone so got android version as well. Very hard but awesome game it seems same as pc version to me so far runs great for me on sony Xperia XZ2 (android 10)
runs, on, XZ2, Got this pc and just thought perfect game to play on a phone so got android version as well. Very hard but awesome game it seems same as pc version to me so far runs great for me on sony Xperia XZ2 (android 10)
save, to, cloud, Updating review, I had a permission setting that was blocking the local save. Cannot save a game, all saves give error message both in mission and out of mission. Unable to save to either cloud or local. Running on a pixel 2.
Running, on, pixel, Updating review, I had a permission setting that was blocking the local save. Cannot save a game, all saves give error message both in mission and out of mission. Unable to save to either cloud or local. Running on a pixel 2.
Running, on, 2, Updating review, I had a permission setting that was blocking the local save. Cannot save a game, all saves give error message both in mission and out of mission. Unable to save to either cloud or local. Running on a pixel 2.
recommend, for, people, This game is so good and would recommend it for people who have plenty of time.
playing, on, screen, Great game, great port but unfortunately doesnt have recent updates that allow me playing it on 21:9 screen. Camera movements seem clingy but other than that thumbs up to developers to bring a full fledged pc port experience to android! I wish there would be more games like this.
thumbs, to, developers, Great game, great port but unfortunately doesnt have recent updates that allow me playing it on 21:9 screen. Camera movements seem clingy but other than that thumbs up to developers to bring a full fledged pc port experience to android! I wish there would be more games like this.
play, for, couple, i recently bought a samsung tab s6 lite and installed xcom ew. i was able to play it for a couple of missions. then afterwards it kept on crashing after the introduction or when i press resume game. please fix this because i was playing xcom before in my android phone then bought a tab so that i could enjoy the graphics of the gameplay with a bigger screen. please help! i really love this game! just needed to get your attention.
crashing, after, introduction, i recently bought a samsung tab s6 lite and installed xcom ew. i was able to play it for a couple of missions. then afterwards it kept on crashing after the introduction or when i press resume game. please fix this because i was playing xcom before in my android phone then bought a tab so that i could enjoy the graphics of the gameplay with a bigger screen. please help! i really love this game! just needed to get your attention.
playing, in, phone, i recently bought a samsung tab s6 lite and installed xcom ew. i was able to play it for a couple of missions. then afterwards it kept on crashing after the introduction or when i press resume game. please fix this because i was playing xcom before in my android phone then bought a tab so that i could enjoy the graphics of the gameplay with a bigger screen. please help! i really love this game! just needed to get your attention.
enjoy, with, screen, i recently bought a samsung tab s6 lite and installed xcom ew. i was able to play it for a couple of missions. then afterwards it kept on crashing after the introduction or when i press resume game. please fix this because i was playing xcom before in my android phone then bought a tab so that i could enjoy the graphics of the gameplay with a bigger screen. please help! i really love this game! just needed to get your attention.
released, Within, that, A great port of the peerless XCOM: Enemy Unknown/Within that was released for consoles in 2012-2013. It does have some graphical issues and a couple of minor issues/bugs but nothing game breaking. Well worth the price and great value for what you pay.
released, for, consoles, A great port of the peerless XCOM: Enemy Unknown/Within that was released for consoles in 2012-2013. It does have some graphical issues and a couple of minor issues/bugs but nothing game breaking. Well worth the price and great value for what you pay.
released, in, 2012, A great port of the peerless XCOM: Enemy Unknown/Within that was released for consoles in 2012-2013. It does have some graphical issues and a couple of minor issues/bugs but nothing game breaking. Well worth the price and great value for what you pay.
floating, in, air, Worth the money, they fixed most of the problems. I just wish it was a bit easier to rotate the camera. There's a bug with the carapace or skeleton armor where you select decor 2, there is an arm brace floating in the air and stretches your characters arms when moving. Other than that if you want an xcom game on the go then I recommend buying this. You can play it on the plane as an "offline" game, so it's a great time killer without a real repetativeness to it like other mobile offline games.
play, on, plane, Worth the money, they fixed most of the problems. I just wish it was a bit easier to rotate the camera. There's a bug with the carapace or skeleton armor where you select decor 2, there is an arm brace floating in the air and stretches your characters arms when moving. Other than that if you want an xcom game on the go then I recommend buying this. You can play it on the plane as an "offline" game, so it's a great time killer without a real repetativeness to it like other mobile offline games.
play, as, game, Worth the money, they fixed most of the problems. I just wish it was a bit easier to rotate the camera. There's a bug with the carapace or skeleton armor where you select decor 2, there is an arm brace floating in the air and stretches your characters arms when moving. Other than that if you want an xcom game on the go then I recommend buying this. You can play it on the plane as an "offline" game, so it's a great time killer without a real repetativeness to it like other mobile offline games.
compared, to, release, I love this game xcom ew is beautiful but this port has some serious bugs and game crashing experiences it feels so unpolished compared to its release on 360 will update rating 5 star when game load crashes are fixed along with the various glitches
fixed, with, glitches, I love this game xcom ew is beautiful but this port has some serious bugs and game crashing experiences it feels so unpolished compared to its release on 360 will update rating 5 star when game load crashes are fixed along with the various glitches
addicted, to, stress, Xcom is very stressful. I'm addicted to stress. It's the way that I get things done. Runs mostly fine on my device, seems to be a decent port. Only occasionally screw over an operative due to a miss click.
screw, over, operative, Xcom is very stressful. I'm addicted to stress. It's the way that I get things done. Runs mostly fine on my device, seems to be a decent port. Only occasionally screw over an operative due to a miss click.
screw, due, click, Xcom is very stressful. I'm addicted to stress. It's the way that I get things done. Runs mostly fine on my device, seems to be a decent port. Only occasionally screw over an operative due to a miss click.
controls, for, zoom, Auto save is pretty much iron man mode. Save games are buggy. Camera controls for zoom in and out are confused with turn. Gameplay is torture. A peon enemy can shoot you from across the map multiple times in a row, while your badass resource glutton mec, literally standing next to a peon, will miss, with a mini gun... .. . Yep. When you see things like this in gameplay you wonder, why am I spending my time on this...
confused, with, turn, Auto save is pretty much iron man mode. Save games are buggy. Camera controls for zoom in and out are confused with turn. Gameplay is torture. A peon enemy can shoot you from across the map multiple times in a row, while your badass resource glutton mec, literally standing next to a peon, will miss, with a mini gun... .. . Yep. When you see things like this in gameplay you wonder, why am I spending my time on this...
shoot, from, times, Auto save is pretty much iron man mode. Save games are buggy. Camera controls for zoom in and out are confused with turn. Gameplay is torture. A peon enemy can shoot you from across the map multiple times in a row, while your badass resource glutton mec, literally standing next to a peon, will miss, with a mini gun... .. . Yep. When you see things like this in gameplay you wonder, why am I spending my time on this...
shoot, in, row, Auto save is pretty much iron man mode. Save games are buggy. Camera controls for zoom in and out are confused with turn. Gameplay is torture. A peon enemy can shoot you from across the map multiple times in a row, while your badass resource glutton mec, literally standing next to a peon, will miss, with a mini gun... .. . Yep. When you see things like this in gameplay you wonder, why am I spending my time on this...
miss, with, gun, Auto save is pretty much iron man mode. Save games are buggy. Camera controls for zoom in and out are confused with turn. Gameplay is torture. A peon enemy can shoot you from across the map multiple times in a row, while your badass resource glutton mec, literally standing next to a peon, will miss, with a mini gun... .. . Yep. When you see things like this in gameplay you wonder, why am I spending my time on this...
see, in, gameplay, Auto save is pretty much iron man mode. Save games are buggy. Camera controls for zoom in and out are confused with turn. Gameplay is torture. A peon enemy can shoot you from across the map multiple times in a row, while your badass resource glutton mec, literally standing next to a peon, will miss, with a mini gun... .. . Yep. When you see things like this in gameplay you wonder, why am I spending my time on this...
spending, on, this, Auto save is pretty much iron man mode. Save games are buggy. Camera controls for zoom in and out are confused with turn. Gameplay is torture. A peon enemy can shoot you from across the map multiple times in a row, while your badass resource glutton mec, literally standing next to a peon, will miss, with a mini gun... .. . Yep. When you see things like this in gameplay you wonder, why am I spending my time on this...
Avoid, like, plague, Way too difficult even at the lowest level! Avoid this game like the plague unless you like frustration. Even at the very lowest level, the game will kick your butt when you get to the covert missions. Whoever did the work to balance this game was out of their fricking mind.
kick, at, level, Way too difficult even at the lowest level! Avoid this game like the plague unless you like frustration. Even at the very lowest level, the game will kick your butt when you get to the covert missions. Whoever did the work to balance this game was out of their fricking mind.
get, to, missions, Way too difficult even at the lowest level! Avoid this game like the plague unless you like frustration. Even at the very lowest level, the game will kick your butt when you get to the covert missions. Whoever did the work to balance this game was out of their fricking mind.
bring, to, mobile, Such a great feeling to be able to just buy and play! I hope they bring more titles like this to mobile because the mobile gaming market could really benefit from this practice. Cheers to you 2K, I hope you continue to bring games like this with the same lack of digital "padding" that others bring to the table
benefit, from, practice, Such a great feeling to be able to just buy and play! I hope they bring more titles like this to mobile because the mobile gaming market could really benefit from this practice. Cheers to you 2K, I hope you continue to bring games like this with the same lack of digital "padding" that others bring to the table
bring, with, lack, Such a great feeling to be able to just buy and play! I hope they bring more titles like this to mobile because the mobile gaming market could really benefit from this practice. Cheers to you 2K, I hope you continue to bring games like this with the same lack of digital "padding" that others bring to the table
bring, to, table, Such a great feeling to be able to just buy and play! I hope they bring more titles like this to mobile because the mobile gaming market could really benefit from this practice. Cheers to you 2K, I hope you continue to bring games like this with the same lack of digital "padding" that others bring to the table
get, on, try, Decent game. If you are looking to kill a short amount of free time, this isn't the game for you. Load up time is over a minute and even then it tends to crash and close. If you are able to get in on the second (or third) try, the missions are time consuming. Like I said, it's a decent game, but I am not looking for a game that has so much load and play time requirements.
looking, for, game, Decent game. If you are looking to kill a short amount of free time, this isn't the game for you. Load up time is over a minute and even then it tends to crash and close. If you are able to get in on the second (or third) try, the missions are time consuming. Like I said, it's a decent game, but I am not looking for a game that has so much load and play time requirements.
played, through, times, The best value for money mobile game I have purchased- although expensive it is a big game and I have played through 3 times now, so I reckon that it works out as the cheapest per hour played. It is tough, tactical and deeply satisfying when you beat it. The AI is good and challenging on normal. The controls are excellent. This is basically the full PC game on your mobile. Shame number 2 isn't being ported.
works, as, cheapest, The best value for money mobile game I have purchased- although expensive it is a big game and I have played through 3 times now, so I reckon that it works out as the cheapest per hour played. It is tough, tactical and deeply satisfying when you beat it. The AI is good and challenging on normal. The controls are excellent. This is basically the full PC game on your mobile. Shame number 2 isn't being ported.
see, on, game, I love xcom and I'm so happy to see it on the phone fun game keeps me busy for hrs
save, on, cloud, Great game, but... It has it's graphic bugs. They don't bother me that much. What bothers me is that I cannot save on cloud. I switch phones allot and I want to be able to save online and continue on my next phone. They say it cannot be done... then why put that option in the menu? Anyways... it's a game worth playing and buying!
continue, on, phone, Great game, but... It has it's graphic bugs. They don't bother me that much. What bothers me is that I cannot save on cloud. I switch phones allot and I want to be able to save online and continue on my next phone. They say it cannot be done... then why put that option in the menu? Anyways... it's a game worth playing and buying!
put, in, menu, Great game, but... It has it's graphic bugs. They don't bother me that much. What bothers me is that I cannot save on cloud. I switch phones allot and I want to be able to save online and continue on my next phone. They say it cannot be done... then why put that option in the menu? Anyways... it's a game worth playing and buying!
crashes, at, menu, The app crashes at the main menu all the time. Definitely not worth the money you pay for this game.
pay, for, game, The app crashes at the main menu all the time. Definitely not worth the money you pay for this game.
shines, in, gameplay, Loved it! The story is bit silly but well written and people clearly put a tonne of sci-fi-ish sounding thought into it. But the game really shines in it's gameplay. You know that feeling you get when you start a new game with nothing and then end up at the ending feeling like an almighty force of God itself... This game got's that in aces of spades. Thanks developers!
start, with, nothing, Loved it! The story is bit silly but well written and people clearly put a tonne of sci-fi-ish sounding thought into it. But the game really shines in it's gameplay. You know that feeling you get when you start a new game with nothing and then end up at the ending feeling like an almighty force of God itself... This game got's that in aces of spades. Thanks developers!
end, at, feeling, Loved it! The story is bit silly but well written and people clearly put a tonne of sci-fi-ish sounding thought into it. But the game really shines in it's gameplay. You know that feeling you get when you start a new game with nothing and then end up at the ending feeling like an almighty force of God itself... This game got's that in aces of spades. Thanks developers!
played, for, years, An excellent strategy game, I've played this for years and I just keep playing it
brought, to, 👌, This is what mobile gaming should be, no extra microtransactions, no filler garbage or time limits. A solid game brought perfectly to a mobile platform 👌
seem, at, times, Love xcom and always come back to it. Must be me being rubbish but I find it hard to progress even on easy - the dice rolls seem unfair at times! But enjoyable as hell and a perfect port
Finished, on, modes, Had fun. Finished it yesterday on higher modes. Wish there was a multi select option. But ya great game, enjoyable.
waiting, for, port, Still waiting for xcom 2 port. 2025
wasted, on, game, Hate the concept can't believe I wasted money on another vault dwelling game
playing, on, GS9, Im playing on a GS9+. Why, why, why cant more developers bring actual games to mobile platforms? Far from another idle clicking, ad infested, p2w rubbish... this is a fully loaded port of one of the all time greats. It plays well on the small screen - my only gripes are some of yhe fine detail in control. Auto zooming in on characters, and not being able to turn off double-tap to move cause some problems. Its a banger.
bring, to, platforms, Im playing on a GS9+. Why, why, why cant more developers bring actual games to mobile platforms? Far from another idle clicking, ad infested, p2w rubbish... this is a fully loaded port of one of the all time greats. It plays well on the small screen - my only gripes are some of yhe fine detail in control. Auto zooming in on characters, and not being able to turn off double-tap to move cause some problems. Its a banger.
infested, from, clicking, Im playing on a GS9+. Why, why, why cant more developers bring actual games to mobile platforms? Far from another idle clicking, ad infested, p2w rubbish... this is a fully loaded port of one of the all time greats. It plays well on the small screen - my only gripes are some of yhe fine detail in control. Auto zooming in on characters, and not being able to turn off double-tap to move cause some problems. Its a banger.
plays, on, screen, Im playing on a GS9+. Why, why, why cant more developers bring actual games to mobile platforms? Far from another idle clicking, ad infested, p2w rubbish... this is a fully loaded port of one of the all time greats. It plays well on the small screen - my only gripes are some of yhe fine detail in control. Auto zooming in on characters, and not being able to turn off double-tap to move cause some problems. Its a banger.
