VERB, PREP, POBJ, 
have, After, weeks, After weeks of unsuccessfull attempts at scaling an impossible construction with a sledgehammer whilst trapped in a couldron of infinate water I have no choice but to accept that the simple mechanics, the singular goal and the constant beratement for failure makes this game a unique charm to play.
go, for, game, Love the game but the controls aren't very good. Pc is the way to go for this game.
love, if, it, It's a infuriating game, but I love the hell out if it. The controls suck but you get use to it. Just mess with the settings til it fits what you want. Figured out how to get past the lights. Will update as I go.
get, to, it, It's a infuriating game, but I love the hell out if it. The controls suck but you get use to it. Just mess with the settings til it fits what you want. Figured out how to get past the lights. Will update as I go.
get, past, lights, It's a infuriating game, but I love the hell out if it. The controls suck but you get use to it. Just mess with the settings til it fits what you want. Figured out how to get past the lights. Will update as I go.
compared, to, version, This game is impossible on a phone..the input lag is terrible....ive adjusted the settings as best I could but the game mechanics feel jenky compared to the pc version
getting, past, section, "Bennett shut the f*** up" is one of the thousands of things that I've said while playing this game, if you don't want to get mad or frustrated I suggest you don't play this game it is very difficult just getting past the first section.
agree, with, mistake, Honestly, being a patient person to a great degree, this game is inspiring, challenging and humorous. However, I don't agree with the slightest mistake putting the player ALL the way back at the bottom. If people are willing to give the game a chance, then at least give them some hope and incentive that their efforts won't be totally in vain.
getting, over, it, Hey getting over it it's just how do you get past this obstacle can I tell something those lights they are so annoying for me to get up because you made a really bad game for yourself the all YouTubers does not wanna play a game but I'm trying but I'm trying to beat this game too many pros beat that the game I want to be a pro like that but it doesn't matter you just have to be treated Li Well so I'm not that frustrated well the days getting over it make a nice game take that fantastic so that
get, past, obstacle, Hey getting over it it's just how do you get past this obstacle can I tell something those lights they are so annoying for me to get up because you made a really bad game for yourself the all YouTubers does not wanna play a game but I'm trying but I'm trying to beat this game too many pros beat that the game I want to be a pro like that but it doesn't matter you just have to be treated Li Well so I'm not that frustrated well the days getting over it make a nice game take that fantastic so that
made, for, yourself, Hey getting over it it's just how do you get past this obstacle can I tell something those lights they are so annoying for me to get up because you made a really bad game for yourself the all YouTubers does not wanna play a game but I'm trying but I'm trying to beat this game too many pros beat that the game I want to be a pro like that but it doesn't matter you just have to be treated Li Well so I'm not that frustrated well the days getting over it make a nice game take that fantastic so that
fell, because, Foddey, This game is made to make you mad Not because of its difficulty But because of Bennet Foddey mocking you whenever you fall Bennet I just fell all the way back to the beginning I don't need to hear a poem made by Abraham Lincoln
make, to, hard, the game is fun but to hard can you make a ez mode
stuck, at, level, too hard help im still stuck at the first level
think, of, anything, I enjoy this game and can't really think of anything in terms of improving it. However, if you are to download the game then prepare to feel emotions such as anger, anxiety, happiness, sadness, and possibly etc. This is part of the experience, as this is a rage game after all. There ARE going to be times when you finally reach a point you've been trying to reach for quite a while, just to fall down again. Once again, this is part of the experience and I'm just telling you what to expect.
think, in, terms, I enjoy this game and can't really think of anything in terms of improving it. However, if you are to download the game then prepare to feel emotions such as anger, anxiety, happiness, sadness, and possibly etc. This is part of the experience, as this is a rage game after all. There ARE going to be times when you finally reach a point you've been trying to reach for quite a while, just to fall down again. Once again, this is part of the experience and I'm just telling you what to expect.
reach, for, while, I enjoy this game and can't really think of anything in terms of improving it. However, if you are to download the game then prepare to feel emotions such as anger, anxiety, happiness, sadness, and possibly etc. This is part of the experience, as this is a rage game after all. There ARE going to be times when you finally reach a point you've been trying to reach for quite a while, just to fall down again. Once again, this is part of the experience and I'm just telling you what to expect.
tapping, after, move, Please make fixed controls, the game is so annoying when you have to keep changing the finger by constantly tapping the screen after Every single move.
play, for, HOURS, This game is so frustratingly fun. I'm a very angry person and this game surprisingly calms me down. I literally can play this game for HOURS. My only complaint is that the controls are touchy and that can be rather annoying.
rely, on, luck, Interesting game. Yeah, I like it. You can concentrate on how you hook the hammer to climb/fly higher up, or you can rely on your blind luck by just spinning the hammer round like a mad man. You probably will feel like screaming if you manage to get within a few pixels of the top, only to fall a great distance down. But the fun is in the journey, not the destination. 5 stars, because it's really good for what it is.
get, within, pixels, Interesting game. Yeah, I like it. You can concentrate on how you hook the hammer to climb/fly higher up, or you can rely on your blind luck by just spinning the hammer round like a mad man. You probably will feel like screaming if you manage to get within a few pixels of the top, only to fall a great distance down. But the fun is in the journey, not the destination. 5 stars, because it's really good for what it is.
die, on, inside, This game is fantastic at what it's ment to be doing, and he even let's you refund if you die on the inside, which I did. But I bought the game off steam so don't call me a sissy. This game is astonishing though, which is also proven by the refund policy. (Which most games don't have.) His point isn't to infuriate you, it's to make you work harder so the reward is more fulfilling. If it was as simple as getting over the tree at the beginning then you wouldn't have confidence for barely working.
getting, over, tree, This game is fantastic at what it's ment to be doing, and he even let's you refund if you die on the inside, which I did. But I bought the game off steam so don't call me a sissy. This game is astonishing though, which is also proven by the refund policy. (Which most games don't have.) His point isn't to infuriate you, it's to make you work harder so the reward is more fulfilling. If it was as simple as getting over the tree at the beginning then you wouldn't have confidence for barely working.
getting, at, beginning, This game is fantastic at what it's ment to be doing, and he even let's you refund if you die on the inside, which I did. But I bought the game off steam so don't call me a sissy. This game is astonishing though, which is also proven by the refund policy. (Which most games don't have.) His point isn't to infuriate you, it's to make you work harder so the reward is more fulfilling. If it was as simple as getting over the tree at the beginning then you wouldn't have confidence for barely working.
f'ing, of, game, It is a MUST try, painstakingly painful, excruciating difficult, notoriously repetitive, meticulously unforgiving, unforgettably memorable, delightfully satisfying, brilliantly crafted, unmistakable unique, completely addictive, mother f'ing of a game!!! Can't wait for a new map or v2. You said it is "designed to hurt a particular type of person" ... I love you and hate you at the same time! Well done ... Just well done!
wait, for, map, It is a MUST try, painstakingly painful, excruciating difficult, notoriously repetitive, meticulously unforgiving, unforgettably memorable, delightfully satisfying, brilliantly crafted, unmistakable unique, completely addictive, mother f'ing of a game!!! Can't wait for a new map or v2. You said it is "designed to hurt a particular type of person" ... I love you and hate you at the same time! Well done ... Just well done!
hate, at, time, It is a MUST try, painstakingly painful, excruciating difficult, notoriously repetitive, meticulously unforgiving, unforgettably memorable, delightfully satisfying, brilliantly crafted, unmistakable unique, completely addictive, mother f'ing of a game!!! Can't wait for a new map or v2. You said it is "designed to hurt a particular type of person" ... I love you and hate you at the same time! Well done ... Just well done!
hurl, at, wall, Heed my words, my friends. This is the most frustrating, the most infuriating, the most enraging game I have ever played. I have seen many a Youtuber freak out, scream, & even hurl chairs at the wall over this. On mobile, it's much more difficult. But no matter who you are, this will plague you.
hurl, over, this, Heed my words, my friends. This is the most frustrating, the most infuriating, the most enraging game I have ever played. I have seen many a Youtuber freak out, scream, & even hurl chairs at the wall over this. On mobile, it's much more difficult. But no matter who you are, this will plague you.
stands, to, version, Its fun and stands up to the PC version. Of course the PC versions controls are 100x better. They still wont add controller support. Some people dont have a problem with using the touch screen controls but alot of us do so you need to add controller support. Just add it! Your score will increase dramatically on the play store. Update: Will you please add controller support?! just add bluetooth controller support so we can use a controller or mouse. This should have been done long ago.
increase, on, store, Its fun and stands up to the PC version. Of course the PC versions controls are 100x better. They still wont add controller support. Some people dont have a problem with using the touch screen controls but alot of us do so you need to add controller support. Just add it! Your score will increase dramatically on the play store. Update: Will you please add controller support?! just add bluetooth controller support so we can use a controller or mouse. This should have been done long ago.
refunded, in, life, I've never refunded a game so quick in my life. All I have to say is, its definitely more fun watching other people play it.
burn, in, hell, This honestly whoever made this game could burn in hell the controls are so stupid it never goes to where I point
came, to, creator, i installed it it coz im very curious when i see a streamer playing this game..so i buy load and buy the game but i realize that im only wasting my time..and now i unstalled kt already..but my money/load didn't came back..to the creator kf this game,please give me back my load游륋릦
swing, in, direction, The controls are not responsive, and no, I don't mean the mechanics, rather, I mean that half of the time the character doesn't swing the hammer in the direction I touch, and he doesn't pull back said hammer even if I'm touching over the character model, he just keeps it extended. You'd think they'd get the controls right when porting a game that's all about precision.
touching, over, model, The controls are not responsive, and no, I don't mean the mechanics, rather, I mean that half of the time the character doesn't swing the hammer in the direction I touch, and he doesn't pull back said hammer even if I'm touching over the character model, he just keeps it extended. You'd think they'd get the controls right when porting a game that's all about precision.
played, for, min, It is not giving me refund i played only for 1 min
's, to, it, The controls make this game unplayable. It's absolutely terrible. There's no consistency to it.
looking, for, what, The never ending pain and syffering just what i was looking for also its so claming to hear the narrator after losing so much progress
get, past, chimney, Solid greatness can't get enough of it 驕쥞잺 not past devil's chimney yet but I'm determined 游눩游녧
run, at, settings, I have a phone that can run games like Bully at max settings yet this game at low settings lags like a motherf*cker. Don't waste your time or your money. It's obviously a cash grab with no effort made to optimize it. Touchscreen controls are god awful as well. Skip this one
lags, like, motherf*cker, I have a phone that can run games like Bully at max settings yet this game at low settings lags like a motherf*cker. Don't waste your time or your money. It's obviously a cash grab with no effort made to optimize it. Touchscreen controls are god awful as well. Skip this one
beat, on, phone, People dont realize that this game is in a category of games that is made to piss you off. They are called "B games". The narrator even taunts you as you fail and mess up. Not a game for snowflakes. They will just piss and moan. That being said, it is significantly easier on PC/Mac. Having a mouse just makes it so much more playable but I beat it on my phone and im not someone you would call "good"" at games. If youre easily irritated or a snowflake who rage quits... Just dont
beat, at, games, People dont realize that this game is in a category of games that is made to piss you off. They are called "B games". The narrator even taunts you as you fail and mess up. Not a game for snowflakes. They will just piss and moan. That being said, it is significantly easier on PC/Mac. Having a mouse just makes it so much more playable but I beat it on my phone and im not someone you would call "good"" at games. If youre easily irritated or a snowflake who rage quits... Just dont
beat, in, try, This game is the best game I beat it in my first try but good try you but you couldn't beat me
RIP, IN, POT, ANGER AAAAASHHHHHHVXSSB IM MAD OOOOOOOHHHHHH IM NOT HAPPY ARG OOF FUDGE IM GOING TO RIP OUT MY SCROTUM AND SHUVE IT IN THAT DAM POT also it was pretty goot
enducing, at, time, Rage enducing and fun at the same time and runs well ignore the people talking about glitches because they aren't in the game and it is worth your money
talking, about, glitches, Rage enducing and fun at the same time and runs well ignore the people talking about glitches because they aren't in the game and it is worth your money
reminds, of, 2019, This game is old but its still as hard and frustrating as ever reminds me of 2019 when things were way better than now
respond, to, input, The cursor doesn't respond the same way to the same input and the part trying to climb between the rocks with the lights is nothing but RNG because you can't swing up and arc down on a screen at the same time
climb, between, rocks, The cursor doesn't respond the same way to the same input and the part trying to climb between the rocks with the lights is nothing but RNG because you can't swing up and arc down on a screen at the same time
arc, on, screen, The cursor doesn't respond the same way to the same input and the part trying to climb between the rocks with the lights is nothing but RNG because you can't swing up and arc down on a screen at the same time
arc, at, time, The cursor doesn't respond the same way to the same input and the part trying to climb between the rocks with the lights is nothing but RNG because you can't swing up and arc down on a screen at the same time
going, through, things, This garbage game is a waste of money my hammer keeps going through things do not buy
got, to, part, Bad controls, and when I got to the lantern part right after the big slippery chunk of metal, there's this small rock you have to get onto, but it was WAAAAY to slippery and I spent about an hour and a half on that part of the game. All I'm asking is to make the rock not as slippery and the lantern vertical tunnel a bit more wide please
got, after, chunk, Bad controls, and when I got to the lantern part right after the big slippery chunk of metal, there's this small rock you have to get onto, but it was WAAAAY to slippery and I spent about an hour and a half on that part of the game. All I'm asking is to make the rock not as slippery and the lantern vertical tunnel a bit more wide please
WAAAAY, to, slippery, Bad controls, and when I got to the lantern part right after the big slippery chunk of metal, there's this small rock you have to get onto, but it was WAAAAY to slippery and I spent about an hour and a half on that part of the game. All I'm asking is to make the rock not as slippery and the lantern vertical tunnel a bit more wide please
spent, on, part, Bad controls, and when I got to the lantern part right after the big slippery chunk of metal, there's this small rock you have to get onto, but it was WAAAAY to slippery and I spent about an hour and a half on that part of the game. All I'm asking is to make the rock not as slippery and the lantern vertical tunnel a bit more wide please
stop, at, time, Goddammit i ducking hate this rage inducing game but at the same time I can't stop playing it. But the controls in this suck absolute nuts
do, like, challenge, Too hard. I do like the challenge. 驕驕驕驕
playing, on, pc, Took many hours playing this game on pc but that was worth it, while I am stuck on the touch control of this. Yeah, gonna get over it :'( . Quite a horrible experience.
get, over, it, Took many hours playing this game on pc but that was worth it, while I am stuck on the touch control of this. Yeah, gonna get over it :'( . Quite a horrible experience.
did, on, lol, They did this pretty dang well on mobile lol
GO, TO, APPS, I JUST BOUGHT THIS GAME AND IT STILL SAYS I HAVE TO PAY!! BUT WHEN I GO TO MY APPS AND GAMES,IT SAYS NOT INSTALLED!! PLEASE FIX THIS !!
took, after, that, So I bought the hame and it didn't download and right after that it took my money Can I have a refund
got, to, ladder, This game is amazing it just some parts I got pass the lamps what takes so long long and long but when I got to the ladder I couldn't do anything you just have to get your hammer on it the problem is that you can't move your self across you just swing across and the guy talking to you is annoying
get, on, it, This game is amazing it just some parts I got pass the lamps what takes so long long and long but when I got to the ladder I couldn't do anything you just have to get your hammer on it the problem is that you can't move your self across you just swing across and the guy talking to you is annoying
move, across, you, This game is amazing it just some parts I got pass the lamps what takes so long long and long but when I got to the ladder I couldn't do anything you just have to get your hammer on it the problem is that you can't move your self across you just swing across and the guy talking to you is annoying
talking, to, you, This game is amazing it just some parts I got pass the lamps what takes so long long and long but when I got to the ladder I couldn't do anything you just have to get your hammer on it the problem is that you can't move your self across you just swing across and the guy talking to you is annoying
get, over, it, 游눮 游뱆游뱆游뱆 It's frustrating. That's for sure. But, you gotta get over it. 10-10
said, on, mobile, A bunch of people said on mobile it's impossible to get past chimminey but they are liars or just bad players who have no patience I've gotten all the way to past orange so clearly they were wrong just have patience and practice also it helps to watch the youtuber codyumm he is really good and you can learn some tricks from him I watch him alot edit i have now gotten all the way to the snow mountain its really hard to do and the game starts getting laggier up there but still possible
learn, from, him, A bunch of people said on mobile it's impossible to get past chimminey but they are liars or just bad players who have no patience I've gotten all the way to past orange so clearly they were wrong just have patience and practice also it helps to watch the youtuber codyumm he is really good and you can learn some tricks from him I watch him alot edit i have now gotten all the way to the snow mountain its really hard to do and the game starts getting laggier up there but still possible
gotten, to, mountain, A bunch of people said on mobile it's impossible to get past chimminey but they are liars or just bad players who have no patience I've gotten all the way to past orange so clearly they were wrong just have patience and practice also it helps to watch the youtuber codyumm he is really good and you can learn some tricks from him I watch him alot edit i have now gotten all the way to the snow mountain its really hard to do and the game starts getting laggier up there but still possible
give, to, game, Dont give bad rating to this game bcs Its hard. Its supposed to be hard if you think this costs too much buy play pass
addicted, to, game, I am addicted to this game . I have completed it 239 times just for fun. By the way if u are wondering my best time is 7m:11sec still trying to improve游뗵
completed, for, fun, I am addicted to this game . I have completed it 239 times just for fun. By the way if u are wondering my best time is 7m:11sec still trying to improve游뗵
complete, in, minute, it is very easy game I complete this in 1:23 minute
love, at, time, I hate it but I love it at the same time
waste, on, game, Dont waste your money on this dumb game I was a at the top I made to space for a second then out of no where my hammer kept spinning supper fast and this has happened to me many times and the only way to fix this is to reset the game this has happened to me over 5 times and I have lost hours of my life just wasted cuz of this game font waste your money and the game looks terrible too and when you actually make it to the top your prize a link to a store where you can get a 35$ shirt not worth it
space, for, second, Dont waste your money on this dumb game I was a at the top I made to space for a second then out of no where my hammer kept spinning supper fast and this has happened to me many times and the only way to fix this is to reset the game this has happened to me over 5 times and I have lost hours of my life just wasted cuz of this game font waste your money and the game looks terrible too and when you actually make it to the top your prize a link to a store where you can get a 35$ shirt not worth it
happened, to, me, Dont waste your money on this dumb game I was a at the top I made to space for a second then out of no where my hammer kept spinning supper fast and this has happened to me many times and the only way to fix this is to reset the game this has happened to me over 5 times and I have lost hours of my life just wasted cuz of this game font waste your money and the game looks terrible too and when you actually make it to the top your prize a link to a store where you can get a 35$ shirt not worth it
happened, to, me, Dont waste your money on this dumb game I was a at the top I made to space for a second then out of no where my hammer kept spinning supper fast and this has happened to me many times and the only way to fix this is to reset the game this has happened to me over 5 times and I have lost hours of my life just wasted cuz of this game font waste your money and the game looks terrible too and when you actually make it to the top your prize a link to a store where you can get a 35$ shirt not worth it
make, to, top, Dont waste your money on this dumb game I was a at the top I made to space for a second then out of no where my hammer kept spinning supper fast and this has happened to me many times and the only way to fix this is to reset the game this has happened to me over 5 times and I have lost hours of my life just wasted cuz of this game font waste your money and the game looks terrible too and when you actually make it to the top your prize a link to a store where you can get a 35$ shirt not worth it
make, to, prize, Dont waste your money on this dumb game I was a at the top I made to space for a second then out of no where my hammer kept spinning supper fast and this has happened to me many times and the only way to fix this is to reset the game this has happened to me over 5 times and I have lost hours of my life just wasted cuz of this game font waste your money and the game looks terrible too and when you actually make it to the top your prize a link to a store where you can get a 35$ shirt not worth it
get, over, life, i really love you ..游땝游땝仇 I'm trying to get over my love life 游땫 oh cindy, if only we could get together !! 游뗵游놑 josh in a relationship with her 游눖 (Yo i want you to know this game doesn't work- lmfao hml) This is gonna get bloody 游뗽 涌
