NOUN, ADJ, 
game, Amazing, Amazing farming game perfect yes it is like harvest town but better there like over 40 seeds to plant 5 skills would like a luck tab but that's alright I love this game @a
game, Best, Best mobile game I've played in years. Probably gonna get it on switch too for multiplayer
game, mobile, Best mobile game I've played in years. Probably gonna get it on switch too for multiplayer
version, mobile, The mobile version is actually my preferred version because of how accessible clicking the character is instead of having to hold down a joystick as they slowly walk. wish the option was in other versions. love the zoom in and zoom out from the screen as well
version, preferred, The mobile version is actually my preferred version because of how accessible clicking the character is instead of having to hold down a joystick as they slowly walk. wish the option was in other versions. love the zoom in and zoom out from the screen as well
versions, other, The mobile version is actually my preferred version because of how accessible clicking the character is instead of having to hold down a joystick as they slowly walk. wish the option was in other versions. love the zoom in and zoom out from the screen as well
phone, new, I absolutely love this game. Been playing for over a year and can't stop. I recently upgraded to a new phone and I'm having trouble switching over my current saved game to this new phone. Is there a way to do that? I really would hate to restart all over again when I was so far into 2 saved games.
game, current, I absolutely love this game. Been playing for over a year and can't stop. I recently upgraded to a new phone and I'm having trouble switching over my current saved game to this new phone. Is there a way to do that? I really would hate to restart all over again when I was so far into 2 saved games.
game, saved, I absolutely love this game. Been playing for over a year and can't stop. I recently upgraded to a new phone and I'm having trouble switching over my current saved game to this new phone. Is there a way to do that? I really would hate to restart all over again when I was so far into 2 saved games.
phone, new, I absolutely love this game. Been playing for over a year and can't stop. I recently upgraded to a new phone and I'm having trouble switching over my current saved game to this new phone. Is there a way to do that? I really would hate to restart all over again when I was so far into 2 saved games.
games, saved, I absolutely love this game. Been playing for over a year and can't stop. I recently upgraded to a new phone and I'm having trouble switching over my current saved game to this new phone. Is there a way to do that? I really would hate to restart all over again when I was so far into 2 saved games.
game, fun, Picked this up out of boredom, lemme tell you, for the price, this is worth your money. It's a fun game you can play anywhere. Definitely recommend stardew valley
game, Best, Best game in awhile that I've played. I put it up there with Terraria and Roller Coaster Tycoon and Retro Bowl.
simulation, Best, Best farm simulation
game, Great, Great game. Highly Addictive. Several hundred hours worth of gameplay for just a single playthrough.
playthrough, single, Great game. Highly Addictive. Several hundred hours worth of gameplay for just a single playthrough.
tgat, sad, Wish it was multiplayer sad tgat they siad no to it would play it more if it was waiting for next update for willys boat....other then tat great game
update, next, Wish it was multiplayer sad tgat they siad no to it would play it more if it was waiting for next update for willys boat....other then tat great game
game, other, Wish it was multiplayer sad tgat they siad no to it would play it more if it was waiting for next update for willys boat....other then tat great game
game, tat, Wish it was multiplayer sad tgat they siad no to it would play it more if it was waiting for next update for willys boat....other then tat great game
game, great, Wish it was multiplayer sad tgat they siad no to it would play it more if it was waiting for next update for willys boat....other then tat great game
update, new, Just waiting for the new update. Hope it comes soon :/
fun, much, So much fun. Make sure don't have any pressing life matters when you start this game because you will not attend to them at all.
matters, pressing, So much fun. Make sure don't have any pressing life matters when you start this game because you will not attend to them at all.
version, mobile, I love this game so much. Been playing it for nearly a year. Cannot wait for the 1.5 update to come to the mobile version.
support, mod, Just an qnzing game and mod support is extremely usefull such as the automate mod which is a must.
mod, automate, Just an qnzing game and mod support is extremely usefull such as the automate mod which is a must.
win, Cozy, Cozy gaming win. This is a great game to play in the few minutes I get while watching my babies. It's low stress and chill, but I can still go and kill things in the mines when I feel the need.
game, great, Cozy gaming win. This is a great game to play in the few minutes I get while watching my babies. It's low stress and chill, but I can still go and kill things in the mines when I feel the need.
minutes, few, Cozy gaming win. This is a great game to play in the few minutes I get while watching my babies. It's low stress and chill, but I can still go and kill things in the mines when I feel the need.
stress, low, Cozy gaming win. This is a great game to play in the few minutes I get while watching my babies. It's low stress and chill, but I can still go and kill things in the mines when I feel the need.
game, solid, It's a solid game that gets boring after a little while. Good game though.
while, little, It's a solid game that gets boring after a little while. Good game though.
game, Good, It's a solid game that gets boring after a little while. Good game though.
game, Good, Good game but it would be nice if I didn't have to restart the game every time I download it onto a new device
device, new, Good game but it would be nice if I didn't have to restart the game every time I download it onto a new device
game, best, I'm into it, best RPG game that fits right into your pocket!
game, great, I think its a great game and i watch youtubers play it and i dont got the setting that they have but it still super great the way it is i play on a chrome os lap top and it still runs great
game, good, Overall a good game, but there is one thing that doesn't make sense to me. Turning crops of different quality into food makes no sense, when that food is all the same quality. I like to farm coffee beans then turn those beans into coffee before selling them, but it makes no sense turning higher quality beans into coffee when that coffee would just be the same price as a cup of coffee made with regular beans. Each quality crop should create food equal to the quality of the crop used.
quality, different, Overall a good game, but there is one thing that doesn't make sense to me. Turning crops of different quality into food makes no sense, when that food is all the same quality. I like to farm coffee beans then turn those beans into coffee before selling them, but it makes no sense turning higher quality beans into coffee when that coffee would just be the same price as a cup of coffee made with regular beans. Each quality crop should create food equal to the quality of the crop used.
quality, same, Overall a good game, but there is one thing that doesn't make sense to me. Turning crops of different quality into food makes no sense, when that food is all the same quality. I like to farm coffee beans then turn those beans into coffee before selling them, but it makes no sense turning higher quality beans into coffee when that coffee would just be the same price as a cup of coffee made with regular beans. Each quality crop should create food equal to the quality of the crop used.
beans, higher, Overall a good game, but there is one thing that doesn't make sense to me. Turning crops of different quality into food makes no sense, when that food is all the same quality. I like to farm coffee beans then turn those beans into coffee before selling them, but it makes no sense turning higher quality beans into coffee when that coffee would just be the same price as a cup of coffee made with regular beans. Each quality crop should create food equal to the quality of the crop used.
price, same, Overall a good game, but there is one thing that doesn't make sense to me. Turning crops of different quality into food makes no sense, when that food is all the same quality. I like to farm coffee beans then turn those beans into coffee before selling them, but it makes no sense turning higher quality beans into coffee when that coffee would just be the same price as a cup of coffee made with regular beans. Each quality crop should create food equal to the quality of the crop used.
beans, regular, Overall a good game, but there is one thing that doesn't make sense to me. Turning crops of different quality into food makes no sense, when that food is all the same quality. I like to farm coffee beans then turn those beans into coffee before selling them, but it makes no sense turning higher quality beans into coffee when that coffee would just be the same price as a cup of coffee made with regular beans. Each quality crop should create food equal to the quality of the crop used.
food, equal, Overall a good game, but there is one thing that doesn't make sense to me. Turning crops of different quality into food makes no sense, when that food is all the same quality. I like to farm coffee beans then turn those beans into coffee before selling them, but it makes no sense turning higher quality beans into coffee when that coffee would just be the same price as a cup of coffee made with regular beans. Each quality crop should create food equal to the quality of the crop used.
devices, mobile, I love this game but I just really really want there to be a co op/multiplayer. I think it would be better too because all the people I know that play stardew Valley agree it should be co op on mobile devices.But I also don't get why they fix all the glitches because my brother just loves glitching games and stardew valley does not really matter because it is not a game like minecraft were its online with people.But it does not mean everyone cheats most don't.
games, glitching, I love this game but I just really really want there to be a co op/multiplayer. I think it would be better too because all the people I know that play stardew Valley agree it should be co op on mobile devices.But I also don't get why they fix all the glitches because my brother just loves glitching games and stardew valley does not really matter because it is not a game like minecraft were its online with people.But it does not mean everyone cheats most don't.
world, virtual, Life has left you unsatisfied and depressed, so you immerse yourself in this virtual world to catch a glimmer of what it could be.
months, several, I'm away from my pc for several months right now and this game fills the void in my soul
games, anymore, Give me a refund pls I can't buy anymore games
issue, small, This game is great and can be addictive. I just have a small issue. The newest update doesn't start properly on my phone I have no idea why I changed nothing on my phone I have tried redownloading the game and all kinds of things but haven't found a fix.
update, newest, This game is great and can be addictive. I just have a small issue. The newest update doesn't start properly on my phone I have no idea why I changed nothing on my phone I have tried redownloading the game and all kinds of things but haven't found a fix.
platforms, multiple, After playing on multiple platforms and for over hours the game is phenomenal when it comes to goals, gameplay, and feeling of achievement. Great 2D graphics and well done mechanics made this my favorite farming simulator. Although some parts of dialog are repeated and events are always the same, great game.
graphics, Great, After playing on multiple platforms and for over hours the game is phenomenal when it comes to goals, gameplay, and feeling of achievement. Great 2D graphics and well done mechanics made this my favorite farming simulator. Although some parts of dialog are repeated and events are always the same, great game.
simulator, favorite, After playing on multiple platforms and for over hours the game is phenomenal when it comes to goals, gameplay, and feeling of achievement. Great 2D graphics and well done mechanics made this my favorite farming simulator. Although some parts of dialog are repeated and events are always the same, great game.
game, same, After playing on multiple platforms and for over hours the game is phenomenal when it comes to goals, gameplay, and feeling of achievement. Great 2D graphics and well done mechanics made this my favorite farming simulator. Although some parts of dialog are repeated and events are always the same, great game.
game, great, After playing on multiple platforms and for over hours the game is phenomenal when it comes to goals, gameplay, and feeling of achievement. Great 2D graphics and well done mechanics made this my favorite farming simulator. Although some parts of dialog are repeated and events are always the same, great game.
phone, mobile, Worth it, enjoyed so much. Gameplay hour long enough for a mobile phone.
things, many, I love this game ITS SO GOOD there so many things to do! I do ask for a wish please maybe we can also post on the pin pored and give them money who ever give us the item we wanted or needed. Thank you for so many things goodbye. LOVE UR GAME BTW.
things, many, I love this game ITS SO GOOD there so many things to do! I do ask for a wish please maybe we can also post on the pin pored and give them money who ever give us the item we wanted or needed. Thank you for so many things goodbye. LOVE UR GAME BTW.
things, enough, I can't say enough good things about this game. I played the PC version, several years ago, but now I have this to pass my time on long flights or when taking a break from my e-commerce business. You want to buy this and have it on Android forever. A+
things, good, I can't say enough good things about this game. I played the PC version, several years ago, but now I have this to pass my time on long flights or when taking a break from my e-commerce business. You want to buy this and have it on Android forever. A+
years, several, I can't say enough good things about this game. I played the PC version, several years ago, but now I have this to pass my time on long flights or when taking a break from my e-commerce business. You want to buy this and have it on Android forever. A+
flights, long, I can't say enough good things about this game. I played the PC version, several years ago, but now I have this to pass my time on long flights or when taking a break from my e-commerce business. You want to buy this and have it on Android forever. A+
game, Amazing, Amazing game
players, multiple, I want multiple players on mobile then its five stars
game, Best, Best game ever
game, Good, I just beaten the mine on mobile and I like it so good I got it on nintendo switch. Good game 🎮👏👍👌💪🙌🎮👏👍👌💪🙌🎮👏👍👌💪🙌🎮👏👍👌💪🙌🎮.
game, Best, Best farming game ever, I downloaded this a couple of days ago and haven't put my phone down. Really addictive, I love the simple graphics and all the interactions you can do. I love the different maps at the beginning and all the animals you can look after. The only disappointment is I got far into the game, I cleared most of my farm and had chickens and cows and I've gone to log back in and it's gone. My game would usually automatically save and be fine the next day but its gone now. :(
graphics, simple, Best farming game ever, I downloaded this a couple of days ago and haven't put my phone down. Really addictive, I love the simple graphics and all the interactions you can do. I love the different maps at the beginning and all the animals you can look after. The only disappointment is I got far into the game, I cleared most of my farm and had chickens and cows and I've gone to log back in and it's gone. My game would usually automatically save and be fine the next day but its gone now. :(
maps, different, Best farming game ever, I downloaded this a couple of days ago and haven't put my phone down. Really addictive, I love the simple graphics and all the interactions you can do. I love the different maps at the beginning and all the animals you can look after. The only disappointment is I got far into the game, I cleared most of my farm and had chickens and cows and I've gone to log back in and it's gone. My game would usually automatically save and be fine the next day but its gone now. :(
disappointment, only, Best farming game ever, I downloaded this a couple of days ago and haven't put my phone down. Really addictive, I love the simple graphics and all the interactions you can do. I love the different maps at the beginning and all the animals you can look after. The only disappointment is I got far into the game, I cleared most of my farm and had chickens and cows and I've gone to log back in and it's gone. My game would usually automatically save and be fine the next day but its gone now. :(
day, next, Best farming game ever, I downloaded this a couple of days ago and haven't put my phone down. Really addictive, I love the simple graphics and all the interactions you can do. I love the different maps at the beginning and all the animals you can look after. The only disappointment is I got far into the game, I cleared most of my farm and had chickens and cows and I've gone to log back in and it's gone. My game would usually automatically save and be fine the next day but its gone now. :(
game, Beautiful, Beautiful game
game, Best, Best game every it's relaxing couldnt wait for 1.5 so decided to buy it on pc too
mouse, small, There are hats you can buy from a small mouse
save, mobile, I can move my mobile save file to PC, but I cannot bring it back from PC to mobile. Claims "incompatible version". When will this issue be solved so that I can play on both devices?
version, incompatible, I can move my mobile save file to PC, but I cannot bring it back from PC to mobile. Claims "incompatible version". When will this issue be solved so that I can play on both devices?
game, fun, A fun game ^-^
game, best, This is the best game you can have on android
game, good, Always wanted to try this game and I enjoyed every second of it when I first booted it up.Very good game with very beautiful pixel art.
art, beautiful, Always wanted to try this game and I enjoyed every second of it when I first booted it up.Very good game with very beautiful pixel art.
art, pixel, Always wanted to try this game and I enjoyed every second of it when I first booted it up.Very good game with very beautiful pixel art.
game, haunted, I gave up.I don't wanna anymore update.Because Eric is working haunted choco game but i don't want this.I just want the 1.5 update.It has almost been 1 year.Congrats Eric you don't care us.And i think we must give one star for the boycott.If he did the 1.5 for mobile before haunted choco game maybe good.And I think he isn't working on the mobile.Im not wanna the porting.He is working on the hc and Im not patient anymore.
game, haunted, I gave up.I don't wanna anymore update.Because Eric is working haunted choco game but i don't want this.I just want the 1.5 update.It has almost been 1 year.Congrats Eric you don't care us.And i think we must give one star for the boycott.If he did the 1.5 for mobile before haunted choco game maybe good.And I think he isn't working on the mobile.Im not wanna the porting.He is working on the hc and Im not patient anymore.
game, favorite, My favorite game on mobile period. Which is saying a lot considering I run emulators at times playing classic AAA titles on my phone as well.
period, mobile, My favorite game on mobile period. Which is saying a lot considering I run emulators at times playing classic AAA titles on my phone as well.
titles, classic, My favorite game on mobile period. Which is saying a lot considering I run emulators at times playing classic AAA titles on my phone as well.
version, mobile, I love this game, just a little upset that the mobile version hasn't gotten an updated since January.
game, great, It is a great game but when you finished all the main story it just then feels old and crave for something new. I think it needs a Online multiplayer mode that you can interact with other people.
story, main, It is a great game but when you finished all the main story it just then feels old and crave for something new. I think it needs a Online multiplayer mode that you can interact with other people.
people, other, It is a great game but when you finished all the main story it just then feels old and crave for something new. I think it needs a Online multiplayer mode that you can interact with other people.
game, Best, Best game, still remember play on pc but ended stop play because lot of work. Now on mobile, I alwasy play on free time.
stop, ended, Best game, still remember play on pc but ended stop play because lot of work. Now on mobile, I alwasy play on free time.
time, free, Best game, still remember play on pc but ended stop play because lot of work. Now on mobile, I alwasy play on free time.
quirks, own, I love Stardew Valley and own it on both my pc and my phone. Both have their own quirks but are both excellent. I can't wait for ConcernedApe's future projects!
projects, future, I love Stardew Valley and own it on both my pc and my phone. Both have their own quirks but are both excellent. I can't wait for ConcernedApe's future projects!
stress, nonstop, Basically no tutorial, time goes by way way too fast, I can't find even half the people to introduce myself to even after days of searching. Fishing is ridiculously difficult. Finally caught a fish and I couldn't figure out how to put it in my inventory so my chatter just dropped the fish back in the water that I spent half the day trying to catch. It's way too much to manage and gives me nonstop stress and anxiety. It's just not for me
game, based, I AM 110% IN LOVE WITH THIS GAME, like if you like farming, a long based game .. it just has everything and more. The only thing i'm sad about is the fact that .. the 1.5 update isn't on mobile but i do know that the creator is trying his best to get out there which i think is amazing considering the fact that he's built this inspiring game by himself. The creativity is definitely 10/10 !! Can't wait for more.
thing, only, I AM 110% IN LOVE WITH THIS GAME, like if you like farming, a long based game .. it just has everything and more. The only thing i'm sad about is the fact that .. the 1.5 update isn't on mobile but i do know that the creator is trying his best to get out there which i think is amazing considering the fact that he's built this inspiring game by himself. The creativity is definitely 10/10 !! Can't wait for more.
game, inspiring, I AM 110% IN LOVE WITH THIS GAME, like if you like farming, a long based game .. it just has everything and more. The only thing i'm sad about is the fact that .. the 1.5 update isn't on mobile but i do know that the creator is trying his best to get out there which i think is amazing considering the fact that he's built this inspiring game by himself. The creativity is definitely 10/10 !! Can't wait for more.
play, local, Really love this game and would love for their to be maybe a local play or 1-4 people can play together since it's supposed to be a small community. But still Id love local because then I can work on my farm with 3 or less of my friends or maybe my siblings!!!
community, small, Really love this game and would love for their to be maybe a local play or 1-4 people can play together since it's supposed to be a small community. But still Id love local because then I can work on my farm with 3 or less of my friends or maybe my siblings!!!
love, d, Really love this game and would love for their to be maybe a local play or 1-4 people can play together since it's supposed to be a small community. But still Id love local because then I can work on my farm with 3 or less of my friends or maybe my siblings!!!
love, local, Really love this game and would love for their to be maybe a local play or 1-4 people can play together since it's supposed to be a small community. But still Id love local because then I can work on my farm with 3 or less of my friends or maybe my siblings!!!
concern, only, I love this game! I love all the mechanics of the game, the fact you can date some npcs and grow a farm. My only concern is when ginger Island will be on mobile
game, wholesome, This game is very addictive, and a (mostly) wholesome farming game. It's fun to watch your character develop relationships with the in game characters, to meet the goals in the game, and to find all the little fun things hidden throughout. There comes a point after a while where there aren't any more goals to meet - but android has yet to receive the latest version which includes Ginger Island and gives players more to do. Plus, it's fun to restart at least once after you learn all the tricks.
