NOUN, ADJ, 
farming, Excellent, Excellent farming but the fishing minigame is next to impossible on mobile which gates some of the content. It could do with an autofish setting (similar to the autocombat)
setting, autofish, Excellent farming but the fishing minigame is next to impossible on mobile which gates some of the content. It could do with an autofish setting (similar to the autocombat)
setting, similar, Excellent farming but the fishing minigame is next to impossible on mobile which gates some of the content. It could do with an autofish setting (similar to the autocombat)
game, Great, Great game but could use updates on my tablet and switch
phone, new, I'm pissed I bought this game awhile ago but I got a new phone and now I have to pay again???
game, fun, Very fun game to play. My favorite thing about the game is that it is not a pay to play type game. The only payment is the initial purchase and then it's free. No special tokens or gems needed for any item.
thing, favorite, Very fun game to play. My favorite thing about the game is that it is not a pay to play type game. The only payment is the initial purchase and then it's free. No special tokens or gems needed for any item.
payment, only, Very fun game to play. My favorite thing about the game is that it is not a pay to play type game. The only payment is the initial purchase and then it's free. No special tokens or gems needed for any item.
purchase, initial, Very fun game to play. My favorite thing about the game is that it is not a pay to play type game. The only payment is the initial purchase and then it's free. No special tokens or gems needed for any item.
tokens, special, Very fun game to play. My favorite thing about the game is that it is not a pay to play type game. The only payment is the initial purchase and then it's free. No special tokens or gems needed for any item.
creators, good, I absolutely love this game. Keeps you busy for hours. Keep up the good work creators! 😁
game, great, A great game that has everything you need as an rpg
adaptation, good, Very good adaptation, very faithful to the console/PC version, only real criticism is that fishing is 1000 times more difficult and that was my specialty so if I'm having a hard time with it then most other people will struggle. If I could give 4.9 that would be my actual rating.
adaptation, faithful, Very good adaptation, very faithful to the console/PC version, only real criticism is that fishing is 1000 times more difficult and that was my specialty so if I'm having a hard time with it then most other people will struggle. If I could give 4.9 that would be my actual rating.
criticism, real, Very good adaptation, very faithful to the console/PC version, only real criticism is that fishing is 1000 times more difficult and that was my specialty so if I'm having a hard time with it then most other people will struggle. If I could give 4.9 that would be my actual rating.
time, hard, Very good adaptation, very faithful to the console/PC version, only real criticism is that fishing is 1000 times more difficult and that was my specialty so if I'm having a hard time with it then most other people will struggle. If I could give 4.9 that would be my actual rating.
people, most, Very good adaptation, very faithful to the console/PC version, only real criticism is that fishing is 1000 times more difficult and that was my specialty so if I'm having a hard time with it then most other people will struggle. If I could give 4.9 that would be my actual rating.
people, other, Very good adaptation, very faithful to the console/PC version, only real criticism is that fishing is 1000 times more difficult and that was my specialty so if I'm having a hard time with it then most other people will struggle. If I could give 4.9 that would be my actual rating.
rating, actual, Very good adaptation, very faithful to the console/PC version, only real criticism is that fishing is 1000 times more difficult and that was my specialty so if I'm having a hard time with it then most other people will struggle. If I could give 4.9 that would be my actual rating.
ape, concerned, Still waiting 1.5, concerned ape announced that in july they will soon update it and here i am still waiting lol
game, best, The best farming game ever. Whoever play Harvest Moon PC mode, will love this game for sure. There are still many things to do every single day in the game, endless in other words. I'm waiting for new patch, please release ASAP! We thirst for more!❤️
things, many, The best farming game ever. Whoever play Harvest Moon PC mode, will love this game for sure. There are still many things to do every single day in the game, endless in other words. I'm waiting for new patch, please release ASAP! We thirst for more!❤️
things, endless, The best farming game ever. Whoever play Harvest Moon PC mode, will love this game for sure. There are still many things to do every single day in the game, endless in other words. I'm waiting for new patch, please release ASAP! We thirst for more!❤️
day, single, The best farming game ever. Whoever play Harvest Moon PC mode, will love this game for sure. There are still many things to do every single day in the game, endless in other words. I'm waiting for new patch, please release ASAP! We thirst for more!❤️
words, other, The best farming game ever. Whoever play Harvest Moon PC mode, will love this game for sure. There are still many things to do every single day in the game, endless in other words. I'm waiting for new patch, please release ASAP! We thirst for more!❤️
patch, new, The best farming game ever. Whoever play Harvest Moon PC mode, will love this game for sure. There are still many things to do every single day in the game, endless in other words. I'm waiting for new patch, please release ASAP! We thirst for more!❤️
work, much, I honestly love it but I did so much work to get to ginger island just to figure out it's not on mobile I would really appreciate it if you added ginger island on mobile please
game, Great, Great game played it several times through on mobile, but still waiting on that 1.5 release.
times, several, Great game played it several times through on mobile, but still waiting on that 1.5 release.
moon, good, really enjoyed playing it,...Now i actually stopped playing because i reached perfection i have everything in my farm and its well decorated, it reminds me of our good ol' farming rpg game harvest moon now i am Waiting For 1.5 and multiplayer so i can play it with my friends, totally deserves your money :)
moon, ol', really enjoyed playing it,...Now i actually stopped playing because i reached perfection i have everything in my farm and its well decorated, it reminds me of our good ol' farming rpg game harvest moon now i am Waiting For 1.5 and multiplayer so i can play it with my friends, totally deserves your money :)
items, multiple, This game is amazing and I can't put it down at times! The reason why the rating is low is because I can not sell multiple items effectively. I put multiple items in the box as suggested by others but my stuff dissappears and is lost and I only get money for 1 item per shipping which is really annoying... is it a bug? Can you help me please? I play on my mobile
items, multiple, This game is amazing and I can't put it down at times! The reason why the rating is low is because I can not sell multiple items effectively. I put multiple items in the box as suggested by others but my stuff dissappears and is lost and I only get money for 1 item per shipping which is really annoying... is it a bug? Can you help me please? I play on my mobile
game, fun, A really fun farm game and many thing to explore and can have animals etc😊 Definitely worth to purchase this game. Hours of endless fun. Addictied to this game. Thumb up to the creator for creating such a amazing game.
thing, many, A really fun farm game and many thing to explore and can have animals etc😊 Definitely worth to purchase this game. Hours of endless fun. Addictied to this game. Thumb up to the creator for creating such a amazing game.
fun, endless, A really fun farm game and many thing to explore and can have animals etc😊 Definitely worth to purchase this game. Hours of endless fun. Addictied to this game. Thumb up to the creator for creating such a amazing game.
game, amazing, A really fun farm game and many thing to explore and can have animals etc😊 Definitely worth to purchase this game. Hours of endless fun. Addictied to this game. Thumb up to the creator for creating such a amazing game.
games, best, I have over 600 hours in this game, and without a doubt, it's one of the best games I've ever played. Everything about it is absolutely great. The music, the range of characters, the story, everything. Kudos, ConcernedApe! I'm really looking forward to the 1.5 update on mobile.
game, Best, Best game ever!
life, social, Ruin my, friendships, my social life and my health because I can't stop playing. 10/10.
pace, own, Let me start off by saying this game is fantastic. The beauty of the game is you can play at your own pace; Nothing is forced down your throat. The music is both beautiful and peaceful. There's not a sound track I dislike. There's something for everyone in this game. It is not all about farming. There's a plethora of things to enjoy. This is truly a one of a kind game. The experiences it has to offer is like no other. A definite escape from your reality when you open this app.
track, sound, Let me start off by saying this game is fantastic. The beauty of the game is you can play at your own pace; Nothing is forced down your throat. The music is both beautiful and peaceful. There's not a sound track I dislike. There's something for everyone in this game. It is not all about farming. There's a plethora of things to enjoy. This is truly a one of a kind game. The experiences it has to offer is like no other. A definite escape from your reality when you open this app.
game, kind, Let me start off by saying this game is fantastic. The beauty of the game is you can play at your own pace; Nothing is forced down your throat. The music is both beautiful and peaceful. There's not a sound track I dislike. There's something for everyone in this game. It is not all about farming. There's a plethora of things to enjoy. This is truly a one of a kind game. The experiences it has to offer is like no other. A definite escape from your reality when you open this app.
escape, definite, Let me start off by saying this game is fantastic. The beauty of the game is you can play at your own pace; Nothing is forced down your throat. The music is both beautiful and peaceful. There's not a sound track I dislike. There's something for everyone in this game. It is not all about farming. There's a plethora of things to enjoy. This is truly a one of a kind game. The experiences it has to offer is like no other. A definite escape from your reality when you open this app.
devices, mobile, So worth it I've had this game since It came out and now it's on mobile devices this is a beautiful game even though its just pixels its amazing 👏
game, beautiful, So worth it I've had this game since It came out and now it's on mobile devices this is a beautiful game even though its just pixels its amazing 👏
👏, amazing, So worth it I've had this game since It came out and now it's on mobile devices this is a beautiful game even though its just pixels its amazing 👏
player, mobile, I love the game! I've had it for a while now and am an exclusively mobile player bc I'm pretty bad at pc controls. I was wondering when Ginger Island will be added to the mobile ver? Or will it not be added?
ver, mobile, I love the game! I've had it for a while now and am an exclusively mobile player bc I'm pretty bad at pc controls. I was wondering when Ginger Island will be added to the mobile ver? Or will it not be added?
game, great, So this is a great game and there are some events that happen at night like the comic one that it's it's a bad and good event and yea that's all I got to say!
one, comic, So this is a great game and there are some events that happen at night like the comic one that it's it's a bad and good event and yea that's all I got to say!
event, bad, So this is a great game and there are some events that happen at night like the comic one that it's it's a bad and good event and yea that's all I got to say!
game, wonderful, I think it's a wonderful game.
game, good, Such a good game 10/10 time killer i just wish it could be multi-player on mobile (but overall it great!)
games, favourite, This has been one of my favourite games for YEARS. When I heard it was going to be on mobile I got it instantly. I love this game, there's an amazing story and it's so personalizable, immersive, and just fun. It's generally calming, but there's times where it can be stressful, heart breaking, loving, and so much more. I honestly do not know one person who doesnt like this game. This is my like 20th time playing it/beating it and I'm still not tired of it. Seriously play this, it won't disappoint
story, amazing, This has been one of my favourite games for YEARS. When I heard it was going to be on mobile I got it instantly. I love this game, there's an amazing story and it's so personalizable, immersive, and just fun. It's generally calming, but there's times where it can be stressful, heart breaking, loving, and so much more. I honestly do not know one person who doesnt like this game. This is my like 20th time playing it/beating it and I'm still not tired of it. Seriously play this, it won't disappoint
breaking, stressful, This has been one of my favourite games for YEARS. When I heard it was going to be on mobile I got it instantly. I love this game, there's an amazing story and it's so personalizable, immersive, and just fun. It's generally calming, but there's times where it can be stressful, heart breaking, loving, and so much more. I honestly do not know one person who doesnt like this game. This is my like 20th time playing it/beating it and I'm still not tired of it. Seriously play this, it won't disappoint
time, 20th, This has been one of my favourite games for YEARS. When I heard it was going to be on mobile I got it instantly. I love this game, there's an amazing story and it's so personalizable, immersive, and just fun. It's generally calming, but there's times where it can be stressful, heart breaking, loving, and so much more. I honestly do not know one person who doesnt like this game. This is my like 20th time playing it/beating it and I'm still not tired of it. Seriously play this, it won't disappoint
graphics, pixel, I love this game so much, I play it all the time. There's actually a lot you can do in the game so you don't get bored fast! Plus the pixel graphics are very good and the storylines are fun. 👍👍
game, good, Really good game overall the one thing that would make it better is multi-player.
hours, more, I own this game on five platforms. I've logged in maybe more hours than any other game I've ever played. $5 for this game is an absolute steal.
game, other, I own this game on five platforms. I've logged in maybe more hours than any other game I've ever played. $5 for this game is an absolute steal.
steal, absolute, I own this game on five platforms. I've logged in maybe more hours than any other game I've ever played. $5 for this game is an absolute steal.
platforms, different, I've bought this game on 3 different platforms.
game, great, I think started valley is a great game. With the fishing to the events to the farming etc. It really is a great game it would be five stars if it was not for the buggy and lag items and sometimes it just is like a lag hole but a really good game would recommend.
game, great, I think started valley is a great game. With the fishing to the events to the farming etc. It really is a great game it would be five stars if it was not for the buggy and lag items and sometimes it just is like a lag hole but a really good game would recommend.
game, good, I think started valley is a great game. With the fishing to the events to the farming etc. It really is a great game it would be five stars if it was not for the buggy and lag items and sometimes it just is like a lag hole but a really good game would recommend.
game, Great, Great game for a while... then when you're done being everybody's best friend and bought all the fancy stuff you're kinda done... until this fabled 1.5 update that every platform but this one already has. I played religiously until a month or so ago when I ran out of stuff to do (other than cooking... I can't seem to bring myself to care about cooking). Update: Lost more stars because I'm still waiting for new content.
friend, best, Great game for a while... then when you're done being everybody's best friend and bought all the fancy stuff you're kinda done... until this fabled 1.5 update that every platform but this one already has. I played religiously until a month or so ago when I ran out of stuff to do (other than cooking... I can't seem to bring myself to care about cooking). Update: Lost more stars because I'm still waiting for new content.
stuff, fancy, Great game for a while... then when you're done being everybody's best friend and bought all the fancy stuff you're kinda done... until this fabled 1.5 update that every platform but this one already has. I played religiously until a month or so ago when I ran out of stuff to do (other than cooking... I can't seem to bring myself to care about cooking). Update: Lost more stars because I'm still waiting for new content.
stars, more, Great game for a while... then when you're done being everybody's best friend and bought all the fancy stuff you're kinda done... until this fabled 1.5 update that every platform but this one already has. I played religiously until a month or so ago when I ran out of stuff to do (other than cooking... I can't seem to bring myself to care about cooking). Update: Lost more stars because I'm still waiting for new content.
content, new, Great game for a while... then when you're done being everybody's best friend and bought all the fancy stuff you're kinda done... until this fabled 1.5 update that every platform but this one already has. I played religiously until a month or so ago when I ran out of stuff to do (other than cooking... I can't seem to bring myself to care about cooking). Update: Lost more stars because I'm still waiting for new content.
game, Great, Great game. wonderful art style, and easy custom controls to your liking. Over all just an amazing experience
style, wonderful, Great game. wonderful art style, and easy custom controls to your liking. Over all just an amazing experience
custom, easy, Great game. wonderful art style, and easy custom controls to your liking. Over all just an amazing experience
experience, amazing, Great game. wonderful art style, and easy custom controls to your liking. Over all just an amazing experience
game, good, It is a very good game
game, great, Honestly one of my all time favorites, it's a great sim game, worth the purchase. I have the steam version and I absolutely love it, 10/10 game! Just waiting for Ginger island.
game, sim, Honestly one of my all time favorites, it's a great sim game, worth the purchase. I have the steam version and I absolutely love it, 10/10 game! Just waiting for Ginger island.
game, worth, Honestly one of my all time favorites, it's a great sim game, worth the purchase. I have the steam version and I absolutely love it, 10/10 game! Just waiting for Ginger island.
love, Great, Great game love it addicted but i hate how u cant play multiplayer if on phone or chromebook
game, Great, Great game but the controls are terrible on a small screen. Play this on a tablet or on console, you won't regret it! 5 star game with 3 star controls
screen, small, Great game but the controls are terrible on a small screen. Play this on a tablet or on console, you won't regret it! 5 star game with 3 star controls
vibes, major, Never thought I'd be into farming. I get major zelda/animal crossing vibes playing this.
version, mobile, I've got ~210 hours in it on PC, and the mobile version is just as good. Only minor gripe is that the controls are iffy at first, but you can change them.
gripe, minor, I've got ~210 hours in it on PC, and the mobile version is just as good. Only minor gripe is that the controls are iffy at first, but you can change them.
time, long, I heard about how good of this game for a long time until I got and played it. Now I know Stardew valley is realy good game.
game, good, I heard about how good of this game for a long time until I got and played it. Now I know Stardew valley is realy good game.
save, backup, This is a 5 star game 100% but i just need help. I accidentally changed my Date size to 200 and now it blocks 75% of my screen making it unplayable. Due to the size i cant click on settings and change it back. I did not make a backup save and i really dont know what to do because i did a lot on that specific save.
save, specific, This is a 5 star game 100% but i just need help. I accidentally changed my Date size to 200 and now it blocks 75% of my screen making it unplayable. Due to the size i cant click on settings and change it back. I did not make a backup save and i really dont know what to do because i did a lot on that specific save.
game, great, What a great game! I've spent countless hours on this game. Never an ad, never asks for money. Super fun game, definitely worth it! Has never crashed on me either!
hours, countless, What a great game! I've spent countless hours on this game. Never an ad, never asks for money. Super fun game, definitely worth it! Has never crashed on me either!
game, Super, What a great game! I've spent countless hours on this game. Never an ad, never asks for money. Super fun game, definitely worth it! Has never crashed on me either!
game, worth, What a great game! I've spent countless hours on this game. Never an ad, never asks for money. Super fun game, definitely worth it! Has never crashed on me either!
platforms, multiple, Fun game on multiple platforms.
diversity, more, I really hate how fishing works. I know it's more realistic to have the fish give you a challenge but it would be nice to have some way to level up fishing easier. It would be nice for more diversity in the original game and some other things. Walking around and exploring is relaxing. Saving up money and supplies for things like chicken coop and barn takes a while. Wish there wasn't a word limit here.
game, original, I really hate how fishing works. I know it's more realistic to have the fish give you a challenge but it would be nice to have some way to level up fishing easier. It would be nice for more diversity in the original game and some other things. Walking around and exploring is relaxing. Saving up money and supplies for things like chicken coop and barn takes a while. Wish there wasn't a word limit here.
things, other, I really hate how fishing works. I know it's more realistic to have the fish give you a challenge but it would be nice to have some way to level up fishing easier. It would be nice for more diversity in the original game and some other things. Walking around and exploring is relaxing. Saving up money and supplies for things like chicken coop and barn takes a while. Wish there wasn't a word limit here.
day, first, Got addicted the first day I played it. It's kinda hard to maneuver the joystick though because it's in the middle left of the screen. The joystick makes it hard in the combat part but overall, it's addicting. Thanks developers for creating a great game!
game, great, Got addicted the first day I played it. It's kinda hard to maneuver the joystick though because it's in the middle left of the screen. The joystick makes it hard in the combat part but overall, it's addicting. Thanks developers for creating a great game!
game, Good, Good little farming game that's brings back memories from childhood worth every penny spent in my opinion. It's like playing an old Zelda.
game, little, Good little farming game that's brings back memories from childhood worth every penny spent in my opinion. It's like playing an old Zelda.
game, Beautiful, Beautiful game
store, opened, The shop keepers aren't at their post when the stores are opened sometimes. What a waste of a day when you walk across town, find a opened store, and the shop keeper is goofing off somewhere.
port, mobile, I'm finished with this mobile port. The Creator should have found another Company by now to complete work for a current update and already have been released...
update, current, I'm finished with this mobile port. The Creator should have found another Company by now to complete work for a current update and already have been released...
game, Awesome, Awesome game... when i got to the egg festival however it didn't allow me to pick up any of the Easter eggs
features, new, Wish they would update and add new features more often but it's actually really relaxing and fun. Even my dad likes this game!
game, fun, This game is amazing! It is so relaxing and fun! I love how you can talk to all the town folk! Overall it's a really fun game 100% recommend!
challenge, more, Good. but better if they can update the app to 1.5. and add more challenge. game is too easy to earn money. Add taxes / bill payment to the game. Please make it challenging.
