VERB, PREP, POBJ, 
needed, with, technologies, Almost a year since last update seems Bennet forgot about his game! Devs dont listen and with no updates how can you provide the best gaming experience! No update means the app can not perform as needed with the new technologies and updates! Someone needs to inform noodlecake and Bennet of this because it seems they don't understand why there is updates! Waste of money in my personal opinion. No updates, no leadearboards, no boosts, this game falls short in today's gaming world.
falls, in, world, Almost a year since last update seems Bennet forgot about his game! Devs dont listen and with no updates how can you provide the best gaming experience! No update means the app can not perform as needed with the new technologies and updates! Someone needs to inform noodlecake and Bennet of this because it seems they don't understand why there is updates! Waste of money in my personal opinion. No updates, no leadearboards, no boosts, this game falls short in today's gaming world.
Played, for, minutes, Played for 5 minutes and tried to refund it. I own and enjoy it on PC, but the touchscreen controls don't translate well
enjoy, on, PC, Played for 5 minutes and tried to refund it. I own and enjoy it on PC, but the touchscreen controls don't translate well
spin, in, circles, This game would probably be a fun challenge except I keep getting this game breaking bug that causes my character to spin his hammer wildly in counter clockwise circles launching me back to the beginning of the game regardless of my progress.
sit, for, hours, I broke my phone while playing this game but I still would 100% recommend it to you its the perfect combination of difficult but fun and it's a game you can sit on for hours.
do, on, S8, Really enjoyed this game. It is probably for a certain personality type... I managed to do it on Samsung S8 but I think Steam and mouse might be a more convenient input setup. I can confirm though it IS possible :)
broken, for, mouseless, the mouse controles are broken for mouseless
do, to, IM, I cannot do its to hard IM NEVER GOEIN ON THIS APP
got, over, it, I got over it on my pc and I got a mug:)
got, on, pc, I got over it on my pc and I got a mug:)
attempted, in, ways, Legitimately the most difficult and infuriating game I have ever attempted to play, in all the best ways. May have finally found the game that causes me to snap a $1300 device in half. Well played.
spend, on, something, I only got the game because i seen YouTubers play it and I'd rather spend 5 dollars on something else
Took, over, year, It's a very unique game. Took me over a year to finally beat, and after that it was smooth sailing. This game can occupy a lot of time, and can be very fun to many people.
become, with, completion, This game is actually super short, it's just the lack of skill that makes it long, which I find pretty interesting, because with each completion, you become better and better and can beat the game faster and faster.
launching, across, room, You remember launching your Gameboy across the room because the game crashed right before you hit a save point? Yaaa.... this game will revisit some childhood video game trauma you never dealt with. You've been warned.
get, over, game, Amazing game but everytime I fall I get super mad but over all very fun game
see, in, Foddy, Beat the game. I'll see you in hell Foddy.
paid, for, this, Well, since i paid for this, i must complete it, that's it.
work, on, mobile, Just doesn't work on mobile.
wish, in, direction, Really wish the controls were more.. in the direction you're actually pointing, rather than following an invisible joystick centered where you started swiping
raging, over, game, Advice: raging over this game makes it harder, but just stick to it, and its fun!
stick, to, it, Advice: raging over this game makes it harder, but just stick to it, and its fun!
raging, on, game, This game is really fun and controllable because i know I've been raging on this game over my skills but the only reason why I gave this a 4 star instead of a 5 star is because this game is not free and I think all people should able to experience the game and I don't think people should waste money on a game that's gonna last days if you're that trash at the game
raging, over, skills, This game is really fun and controllable because i know I've been raging on this game over my skills but the only reason why I gave this a 4 star instead of a 5 star is because this game is not free and I think all people should able to experience the game and I don't think people should waste money on a game that's gonna last days if you're that trash at the game
waste, on, game, This game is really fun and controllable because i know I've been raging on this game over my skills but the only reason why I gave this a 4 star instead of a 5 star is because this game is not free and I think all people should able to experience the game and I don't think people should waste money on a game that's gonna last days if you're that trash at the game
PLAY, WITH, SCREEN, I love the game 10/10 BUT HEAR ME OUT DO NOT PLAY WITH A CRACKED SCREEN MY FINGERS WERE BLEEDING CAUSE I USED A CRACKED SCREEN
remove, from, store, Its such a hard game flappy bird was way better this game sucks they should make it less harder remove it from the play store i can take to pieces of bread slap them together and call that a better game then this horrible game 0 stars its sucks
take, to, pieces, Its such a hard game flappy bird was way better this game sucks they should make it less harder remove it from the play store i can take to pieces of bread slap them together and call that a better game then this horrible game 0 stars its sucks
give, on, mobile, I wanted to give this game a try again on mobile, and regretted it almost immediately, and now can't get a refund for it. The game is good on pc and I've beat it around 100 times, but porting it to mobile is an obvious cash grab. The game doesn't work on mobile, it's impossible to play like you can on pc. Bennett, I hope you personally read this and understand how greedy this is, and that you're a bad developer for it.
porting, to, mobile, I wanted to give this game a try again on mobile, and regretted it almost immediately, and now can't get a refund for it. The game is good on pc and I've beat it around 100 times, but porting it to mobile is an obvious cash grab. The game doesn't work on mobile, it's impossible to play like you can on pc. Bennett, I hope you personally read this and understand how greedy this is, and that you're a bad developer for it.
work, on, mobile, I wanted to give this game a try again on mobile, and regretted it almost immediately, and now can't get a refund for it. The game is good on pc and I've beat it around 100 times, but porting it to mobile is an obvious cash grab. The game doesn't work on mobile, it's impossible to play like you can on pc. Bennett, I hope you personally read this and understand how greedy this is, and that you're a bad developer for it.
play, like, you, I wanted to give this game a try again on mobile, and regretted it almost immediately, and now can't get a refund for it. The game is good on pc and I've beat it around 100 times, but porting it to mobile is an obvious cash grab. The game doesn't work on mobile, it's impossible to play like you can on pc. Bennett, I hope you personally read this and understand how greedy this is, and that you're a bad developer for it.
play, on, pc, I wanted to give this game a try again on mobile, and regretted it almost immediately, and now can't get a refund for it. The game is good on pc and I've beat it around 100 times, but porting it to mobile is an obvious cash grab. The game doesn't work on mobile, it's impossible to play like you can on pc. Bennett, I hope you personally read this and understand how greedy this is, and that you're a bad developer for it.
beat, on, mobile, People keep saying the controlls are bad and I also saw one that said it's impossible on mobile. The game is intentionally hard with purposely bad controls. Also the game is very possible. I have beat this game on mobile 25 times and 7 on pc. Both versions are the same mountain with mobile being harder, but still possible. Took me 8hrs to beat my first time, and now I average 13min.
beat, on, pc, People keep saying the controlls are bad and I also saw one that said it's impossible on mobile. The game is intentionally hard with purposely bad controls. Also the game is very possible. I have beat this game on mobile 25 times and 7 on pc. Both versions are the same mountain with mobile being harder, but still possible. Took me 8hrs to beat my first time, and now I average 13min.
getting, over, it, It tests your patience, people with high levels of patience can only play this... I'm in love with getting over it... It's sooo relaxing oh my God!!! The thing you can do to support to creator is to reward him with 430rs... No ads nothing, and full enjoyment with the game! So many quote in it... It says a lot bout life as well...
support, to, creator, It tests your patience, people with high levels of patience can only play this... I'm in love with getting over it... It's sooo relaxing oh my God!!! The thing you can do to support to creator is to reward him with 430rs... No ads nothing, and full enjoyment with the game! So many quote in it... It says a lot bout life as well...
reward, with, 430rs, It tests your patience, people with high levels of patience can only play this... I'm in love with getting over it... It's sooo relaxing oh my God!!! The thing you can do to support to creator is to reward him with 430rs... No ads nothing, and full enjoyment with the game! So many quote in it... It says a lot bout life as well...
add, to, games, Amazing game with a weird vibe and awful controls that add to the games overall difficulty and intent. 10/10
stuck, in, ground, This game is absolutely broken. I got my hammer stuck in the ground FOREVER. I want a refund and it makes sad that a really good game could get absolutely ruined because people are cheap and want to make not deserved money.
wased, on, game, Honestly I don't even think this game Dezurves a star It is definitely not worth춲5 please don't wased your money on this game
listen, to, reviews, Don't listen to the negative reviews of this game they are just from people who have no clue what they are doing. This game is very difficult, and it is supposed to be that way. 5/5 stars, would recommend to anyone without anger management issues.
recommend, to, anyone, Don't listen to the negative reviews of this game they are just from people who have no clue what they are doing. This game is very difficult, and it is supposed to be that way. 5/5 stars, would recommend to anyone without anger management issues.
recommend, without, issues, Don't listen to the negative reviews of this game they are just from people who have no clue what they are doing. This game is very difficult, and it is supposed to be that way. 5/5 stars, would recommend to anyone without anger management issues.
lag, in, butvit, I would give five star rating but it seems that when I reached the region where sky turns orange I don't know why. Game starts to lag..... Even I have good device If it Wasn't compatible on my device then it should lag in the beginning butvit only lags in oeange sky region. Please take a look at this...... :)(
payed, for, this, Im mad i payed for this is still not working
listin, to, others, Pretty fun game good controls and fun when you get higher and higher Btw dont listin to others that saw the controls are bad they are super good
love, 游녧, 游때, I love how its such a challenge and to me thats the point of the game to test your ability to work from nothing to climb the tallest peaks and every time you fall its give you a memorable historical sentance sooo goood 游때游때游때游녧游녧游녧游때游때游때游녧游녧游녧游땘.
work, from, nothing, I love how its such a challenge and to me thats the point of the game to test your ability to work from nothing to climb the tallest peaks and every time you fall its give you a memorable historical sentance sooo goood 游때游때游때游녧游녧游녧游때游때游때游녧游녧游녧游땘.
expect, from, game, It's fine. What you would expect from this game on mobile. Not impossible to play. Definitely need to fix the controls big time tho. Should make the control more like a loose analog, not just free for all on the screen.
expect, on, mobile, It's fine. What you would expect from this game on mobile. Not impossible to play. Definitely need to fix the controls big time tho. Should make the control more like a loose analog, not just free for all on the screen.
make, like, analog, It's fine. What you would expect from this game on mobile. Not impossible to play. Definitely need to fix the controls big time tho. Should make the control more like a loose analog, not just free for all on the screen.
get, past, parts, Is this game worth $5? Nope. My biggest complaint is that the controls are terrible. Granted it's a mobile game so you shouldn't expect much anyway, but it's extremely frustrating to get past certain parts only to get launched in the opposite direction because the controls are either unresponsive or over sensitive. The only plus side is that this game is free with the play pass so you don't have to waste your money to try it out if you have that.
launched, in, direction, Is this game worth $5? Nope. My biggest complaint is that the controls are terrible. Granted it's a mobile game so you shouldn't expect much anyway, but it's extremely frustrating to get past certain parts only to get launched in the opposite direction because the controls are either unresponsive or over sensitive. The only plus side is that this game is free with the play pass so you don't have to waste your money to try it out if you have that.
pay, for, this, Why do I have to pay for this again even tho I bought it on a different device but same google account????
bought, on, device, Why do I have to pay for this again even tho I bought it on a different device but same google account????
Shout, to, team, Really hard. Mad respect to anyone who finishes. Shout out to the mobile team for making this. I saw PewDiePie play this so I'm glad it came to mobile. Thanks for joining the android play pass. You guys rock!
came, to, mobile, Really hard. Mad respect to anyone who finishes. Shout out to the mobile team for making this. I saw PewDiePie play this so I'm glad it came to mobile. Thanks for joining the android play pass. You guys rock!
trying, for, year, It's so hard I've been trying for a year 游
boil, after, failure, Absolute gem, 9 wins in and I'm only enjoying improving more. Definitely at least 춲5 of value in this game. Great challenge and a patronising quote to boil the blood after a big failure always helps
used, to, words, man do I love this game. its great once you get used to the degrading words游땍
rigged, on, mobile, Pretty much rigged on mobile so it's really not enjoyable
loosing, on, part, I kept loosing on the first part this game is RIGGED 游땨游땨 Getting over it more like getting pissed over it
Getting, over, it, I kept loosing on the first part this game is RIGGED 游땨游땨 Getting over it more like getting pissed over it
pissed, over, it, I kept loosing on the first part this game is RIGGED 游땨游땨 Getting over it more like getting pissed over it
playing, for, week, It's strangely addicting, but very difficult. I can appreciate the commentary as well. It does get frustrating, however if you take your time and take breaks it isn't so bad. I've been playing for like a week at the time of this review, and I don't think I've even made it halfway yet... But I can see the progress I have made and it's pretty satisfying. Sometimes you'll hit a wall, but if you keep trying you'll get over it.
playing, at, time, It's strangely addicting, but very difficult. I can appreciate the commentary as well. It does get frustrating, however if you take your time and take breaks it isn't so bad. I've been playing for like a week at the time of this review, and I don't think I've even made it halfway yet... But I can see the progress I have made and it's pretty satisfying. Sometimes you'll hit a wall, but if you keep trying you'll get over it.
get, over, it, It's strangely addicting, but very difficult. I can appreciate the commentary as well. It does get frustrating, however if you take your time and take breaks it isn't so bad. I've been playing for like a week at the time of this review, and I don't think I've even made it halfway yet... But I can see the progress I have made and it's pretty satisfying. Sometimes you'll hit a wall, but if you keep trying you'll get over it.
optimized, on, mobile, not well optimized and extremely hard on mobile, beat it first on PC then try it on mobile to make the experience less painful.
beat, on, PC, not well optimized and extremely hard on mobile, beat it first on PC then try it on mobile to make the experience less painful.
try, on, mobile, not well optimized and extremely hard on mobile, beat it first on PC then try it on mobile to make the experience less painful.
talking, about, what, I don't understand what people are talking about when they say the controls such on mobile... it is literally just your finger on the screen. So far, very fun and worth the price.
go, into, game, This game is pretty addictive. There are poor reviews for functionality and responsiveness, and where they may be right, its still a good game. There are issues with the hammer not moving while mid-air to catch yourself, it just feels like it was made that way. If you go into the game expecting a challenge, let me tell you its well worth it. The creator made this game difficult and those reviews who complain about certain aspects are just complaints. There are ways to overcome the bugs. 游눮
complain, about, aspects, This game is pretty addictive. There are poor reviews for functionality and responsiveness, and where they may be right, its still a good game. There are issues with the hammer not moving while mid-air to catch yourself, it just feels like it was made that way. If you go into the game expecting a challenge, let me tell you its well worth it. The creator made this game difficult and those reviews who complain about certain aspects are just complaints. There are ways to overcome the bugs. 游눮
falling, as, part, He made the game to hurt you.... it's a frustration numbing agent. Genius! You will get used to falling as part of life is itself. Only intelligent people will understand this and source this element of love from the creator. This is why he said "I made this game for a particular type of person." Most Capricorns will understand the hard climbs we take all the time are just part of the game.
made, for, type, He made the game to hurt you.... it's a frustration numbing agent. Genius! You will get used to falling as part of life is itself. Only intelligent people will understand this and source this element of love from the creator. This is why he said "I made this game for a particular type of person." Most Capricorns will understand the hard climbs we take all the time are just part of the game.
get, past, tree, Couldn't get past the first tree. 7 out of 5 stars. Will recommend to my enemies.
recommend, to, enemies, Couldn't get past the first tree. 7 out of 5 stars. Will recommend to my enemies.
get, because, this, Controls are broken and keep flipping back and forth between right being left and right being right, left being right and left being left. I can't even get that far because of this.
swing, with, bucket, ShiiiiiiiiiiiiiIIIIIIIIIII.....AAAAAAAHHHHHHHGG!!!!!!!!!!!! I got the snake I was trying to swing with the bucket and I did but I slept on the ice and went down the snake all the way that sucks
slept, on, ice, ShiiiiiiiiiiiiiIIIIIIIIIII.....AAAAAAAHHHHHHHGG!!!!!!!!!!!! I got the snake I was trying to swing with the bucket and I did but I slept on the ice and went down the snake all the way that sucks
went, down, snake, ShiiiiiiiiiiiiiIIIIIIIIIII.....AAAAAAAHHHHHHHGG!!!!!!!!!!!! I got the snake I was trying to swing with the bucket and I did but I slept on the ice and went down the snake all the way that sucks
recommend, for, anyone, This game is absolutely beautiful. Between the well written lines created by Bennett, and the more quotes from others that truly inspires you to keep moving forward. This game is very difficult, but that just makes the ending so much sweeter. I highly recommend this for anyone who's up for a challenge, because this game keeps you on your toes!
keeps, on, toes, This game is absolutely beautiful. Between the well written lines created by Bennett, and the more quotes from others that truly inspires you to keep moving forward. This game is very difficult, but that just makes the ending so much sweeter. I highly recommend this for anyone who's up for a challenge, because this game keeps you on your toes!
Recommended, for, people, Super duper crazy weirdness. If you like this game, you will like it, and if not, you won't. Recommended for people who have taken philosophy 101, or LSD. Preferably both, I guess.
playing, for, time, Be warned, if you find this game difficult on PC, the mobile version is like playing Dark Souls for the first time, blindfolded, with your feet, using a trombone as a controller. Why? Because touch screens were not built for controls like this. You rub your finger quickly over the same spot over and over and you lose what little fine tuned control you have (if you had any at all). Had to turn the stupid quotes off. PC version is fine and easy, this version is trash
blindfolded, with, feet, Be warned, if you find this game difficult on PC, the mobile version is like playing Dark Souls for the first time, blindfolded, with your feet, using a trombone as a controller. Why? Because touch screens were not built for controls like this. You rub your finger quickly over the same spot over and over and you lose what little fine tuned control you have (if you had any at all). Had to turn the stupid quotes off. PC version is fine and easy, this version is trash
using, as, controller, Be warned, if you find this game difficult on PC, the mobile version is like playing Dark Souls for the first time, blindfolded, with your feet, using a trombone as a controller. Why? Because touch screens were not built for controls like this. You rub your finger quickly over the same spot over and over and you lose what little fine tuned control you have (if you had any at all). Had to turn the stupid quotes off. PC version is fine and easy, this version is trash
built, for, controls, Be warned, if you find this game difficult on PC, the mobile version is like playing Dark Souls for the first time, blindfolded, with your feet, using a trombone as a controller. Why? Because touch screens were not built for controls like this. You rub your finger quickly over the same spot over and over and you lose what little fine tuned control you have (if you had any at all). Had to turn the stupid quotes off. PC version is fine and easy, this version is trash
rub, over, spot, Be warned, if you find this game difficult on PC, the mobile version is like playing Dark Souls for the first time, blindfolded, with your feet, using a trombone as a controller. Why? Because touch screens were not built for controls like this. You rub your finger quickly over the same spot over and over and you lose what little fine tuned control you have (if you had any at all). Had to turn the stupid quotes off. PC version is fine and easy, this version is trash
used, as, excuse, This game is dumb, I mean I get it's supposed to be a rage game, but Bennett just used it as an excuse to not have to try, in fact, one of his quotes was "it felt like it was more my fault as the player".
make, to, angle, This game DESPERATELY needs controller support! The controls are so unrefined in this game. Also, I lowered my 3 star review because I found out that this game isn't completable on mobile. The controls don't allow you to make minute adjustments to your angle, and as a result players can't pass the first diagnol cave near the start of the game. And before you say anything, I already know how to complete it, and I've already tried many times over. Just take my advice get the PC version instead!
cave, near, start, This game DESPERATELY needs controller support! The controls are so unrefined in this game. Also, I lowered my 3 star review because I found out that this game isn't completable on mobile. The controls don't allow you to make minute adjustments to your angle, and as a result players can't pass the first diagnol cave near the start of the game. And before you say anything, I already know how to complete it, and I've already tried many times over. Just take my advice get the PC version instead!
throw, at, wall, Fun game. Did make me want to throw my phone at a wall a couple times, but fun.
reacted, to, fall, You know i honestly have never been to the top. Never over reacted to a fall. Never had to git off pissed. This app just let me know to stop being an arsewhole and waisting my time on unimportant things in life. Good app.
waisting, on, things, You know i honestly have never been to the top. Never over reacted to a fall. Never had to git off pissed. This app just let me know to stop being an arsewhole and waisting my time on unimportant things in life. Good app.
