NOUN, ADJ, 
ðŸ˜„, ðŸ˜„, Best game of my life but update is coming out in July! â˜ºâ˜ºâ˜ºâ˜ºâ˜ºâ˜ºâ˜ºâ˜ºâ˜ºâ˜ºðŸ˜„ðŸ˜„ðŸ˜„ðŸ˜„ðŸ˜„ðŸ˜„ðŸ˜„ðŸ˜„ðŸ˜„ðŸ˜„ðŸ˜„ðŸ˜„ðŸ˜„ðŸ˜„ðŸ˜„ðŸ˜„ it didn't come out for 4 years why just why
ðŸ˜„, ðŸ˜„, Best game of my life but update is coming out in July! â˜ºâ˜ºâ˜ºâ˜ºâ˜ºâ˜ºâ˜ºâ˜ºâ˜ºâ˜ºðŸ˜„ðŸ˜„ðŸ˜„ðŸ˜„ðŸ˜„ðŸ˜„ðŸ˜„ðŸ˜„ðŸ˜„ðŸ˜„ðŸ˜„ðŸ˜„ðŸ˜„ðŸ˜„ðŸ˜„ðŸ˜„ it didn't come out for 4 years why just why
ðŸ˜„, ðŸ˜„, Best game of my life but update is coming out in July! â˜ºâ˜ºâ˜ºâ˜ºâ˜ºâ˜ºâ˜ºâ˜ºâ˜ºâ˜ºðŸ˜„ðŸ˜„ðŸ˜„ðŸ˜„ðŸ˜„ðŸ˜„ðŸ˜„ðŸ˜„ðŸ˜„ðŸ˜„ðŸ˜„ðŸ˜„ðŸ˜„ðŸ˜„ðŸ˜„ðŸ˜„ it didn't come out for 4 years why just why
ðŸ˜„, ðŸ˜„, Best game of my life but update is coming out in July! â˜ºâ˜ºâ˜ºâ˜ºâ˜ºâ˜ºâ˜ºâ˜ºâ˜ºâ˜ºðŸ˜„ðŸ˜„ðŸ˜„ðŸ˜„ðŸ˜„ðŸ˜„ðŸ˜„ðŸ˜„ðŸ˜„ðŸ˜„ðŸ˜„ðŸ˜„ðŸ˜„ðŸ˜„ðŸ˜„ðŸ˜„ it didn't come out for 4 years why just why
love, good, Soon good love it my son showed it to me now I play every day
games, best, One of the best games i have ever played. The thing with terraria is that there is always something to do there are so many bosses and mobs and biomes and items and soooo much to explore and progress. I definetly recommend this game its absulutely worth your money.
bosses, many, One of the best games i have ever played. The thing with terraria is that there is always something to do there are so many bosses and mobs and biomes and items and soooo much to explore and progress. I definetly recommend this game its absulutely worth your money.
complaint, common, I want to see a way to change the resolution the game decides to use..  I don't Want to play the game cause its to zoomed in to  really see what is going on..  I'm kind of surprised  this isn't a common complaint?
game, good, Very good game dare I say scary a times. One of the best mobile games I have ever played in my opinion it's better the minecraft ðŸ‘Œ 5 stars must get.
games, best, Very good game dare I say scary a times. One of the best mobile games I have ever played in my opinion it's better the minecraft ðŸ‘Œ 5 stars must get.
games, mobile, Very good game dare I say scary a times. One of the best mobile games I have ever played in my opinion it's better the minecraft ðŸ‘Œ 5 stars must get.
player, new, This game will be good and amazing if the control like My Time at Portia or Minecraft...so hard to craft items and build anything because don't have tutorial,I'm new player but don't know what to do..so lose in this game with the control and no tutorial...please make the UI more comfortable for beginners...EDIT : MOST TERRIBLE CONTROL IN MOBILE GAMES
gameplay, good, Great Game! progression is pretty hard but has really good gameplay, pixel characters look really cool especially the bosses and this is recommended for people who want a challenge and love pixel styled games.
characters, pixel, Great Game! progression is pretty hard but has really good gameplay, pixel characters look really cool especially the bosses and this is recommended for people who want a challenge and love pixel styled games.
games, styled, Great Game! progression is pretty hard but has really good gameplay, pixel characters look really cool especially the bosses and this is recommended for people who want a challenge and love pixel styled games.
game, amazing, An amazing sandbox survival game this game has bought me years of happiness and I would 1000% recommend buying this
game, Best, Best game ever first time playing this game so exciting
time, first, Best game ever first time playing this game so exciting
item, more, I need more item for summoner like Pc
things, different, Always loved this game since I was a kid. And my passion hasn't changed one bit, growing up with it, I adored all the different things you could do. It almost seemed infinite. And today I still think so. The Journey's End update added so much for me to enjoy even more. I really recommend Terraria.
npcs, more, Every time I get more npcs into the game i tend to lag a ton and my frames drop so much during night time in the game no matter how low my settings are if you can please fix this game
game, worthy, The worthy game in low price
price, low, The worthy game in low price
game, good, you can discover alot in this game and theres thousands of items to choose from good game
party, third, Devs. Has always something new each update, players would like...im playing since ver.1.2 then till now... terraria was never a disappointment..i wish going multi would be more easier..(without any third-party apps of course)
game, Great, Great and amazing game, but is there a way to make non-lan multiplayer possible? I've been trying to play with my friend that lives quite far, and I want them to enjoy the game as much as I do
multiplayer, non, Great and amazing game, but is there a way to make non-lan multiplayer possible? I've been trying to play with my friend that lives quite far, and I want them to enjoy the game as much as I do
multiplayer, -, Great and amazing game, but is there a way to make non-lan multiplayer possible? I've been trying to play with my friend that lives quite far, and I want them to enjoy the game as much as I do
multiplayer, lan, Great and amazing game, but is there a way to make non-lan multiplayer possible? I've been trying to play with my friend that lives quite far, and I want them to enjoy the game as much as I do
variety, great, This game is awesome. I'm not gonna ignore the fact that they've had this game up and running since 2011, and this game is hella fun. If you have not played it, you have to. The game contains a variety of weapons and mobs, along with armor. It's best for survival and adventure if you're looking for some fun, and has a great variety of bosses. It's sad to hear that ReLogic is not working on the game anymore, their game came so far, yet they had to stop. This game is a great game, you should try.
game, great, This game is awesome. I'm not gonna ignore the fact that they've had this game up and running since 2011, and this game is hella fun. If you have not played it, you have to. The game contains a variety of weapons and mobs, along with armor. It's best for survival and adventure if you're looking for some fun, and has a great variety of bosses. It's sad to hear that ReLogic is not working on the game anymore, their game came so far, yet they had to stop. This game is a great game, you should try.
fun, amazing, Absoulotly amazing so fun and alot of things to do in the game
game, good, (â™¡Ë™ï¸¶Ë™â™¡) the only good game t
t, only, (â™¡Ë™ï¸¶Ë™â™¡) the only good game t
bag, lavaproov, Bruh It's 1.4.0, not 1.4.1. There's no lavaproov tackle bag.
version, free, Remembered and bought this because of nostalgia playing the free version
MAN, Fokin, Fokin decent MAN!!
MAN, decent, Fokin decent MAN!!
games, changed, Ive always loved this games, its changed games for me, theres no game ive gone back to more than this one.
game, Great, Great game to play when your bored 10/10
game, good, It's a very good game and I think you must make more updates
updates, more, It's a very good game and I think you must make more updates
fun, pure, Just pure fun the whole time. The experience this game gives me is way more than most games I've ever played
time, whole, Just pure fun the whole time. The experience this game gives me is way more than most games I've ever played
games, most, Just pure fun the whole time. The experience this game gives me is way more than most games I've ever played
game, good, It's a good game, would highly recommend to people who love fighting bosses and create a thriving town in their world.
bosses, fighting, It's a good game, would highly recommend to people who love fighting bosses and create a thriving town in their world.
town, thriving, It's a good game, would highly recommend to people who love fighting bosses and create a thriving town in their world.
button, literal, Why woulf you change the controls it is so much more dificult now (ex: a literal jump button you hust had to move the left stick before) im sorry it just dosent really work for me that much edit like 2 years after redownload I've gotten used to it
stick, left, Why woulf you change the controls it is so much more dificult now (ex: a literal jump button you hust had to move the left stick before) im sorry it just dosent really work for me that much edit like 2 years after redownload I've gotten used to it
edit, much, Why woulf you change the controls it is so much more dificult now (ex: a literal jump button you hust had to move the left stick before) im sorry it just dosent really work for me that much edit like 2 years after redownload I've gotten used to it
game, Best, The Best game ever =)
game, cool, Its a really cool game and I really recommend you to try it out
update, critical, All of my things are gone because of the "critical update" and you guys are not going to do anything about it. I still would like to know where my stuff went. Hopefully not in the void
loot, solar, For solar loot from The towers
thing, best, Game is the best it's probably like the best thing I ever bought this game is probably my favorite game in the whole entire world
game, favorite, Game is the best it's probably like the best thing I ever bought this game is probably my favorite game in the whole entire world
world, whole, Game is the best it's probably like the best thing I ever bought this game is probably my favorite game in the whole entire world
world, entire, Game is the best it's probably like the best thing I ever bought this game is probably my favorite game in the whole entire world
hours, Countless, Incredible. No paywall. Countless hours of fun
game, Hard, Hard game to get used to but when you are it's worth it. So much to do and works very smoothly.
version, android, Can you give us cloud storage for saves in android version please :< backup data to be precise.
data, backup, Can you give us cloud storage for saves in android version please :< backup data to be precise.
game, good, It's a realy good game you get to go on journey mode you get to go on classic mediumcore and hardcore mode you can do journey mode, normal mode, expert mode, and master mode and I got the zenith it's hard but I got my hard work and I am proud.
mode, journey, It's a realy good game you get to go on journey mode you get to go on classic mediumcore and hardcore mode you can do journey mode, normal mode, expert mode, and master mode and I got the zenith it's hard but I got my hard work and I am proud.
mediumcore, classic, It's a realy good game you get to go on journey mode you get to go on classic mediumcore and hardcore mode you can do journey mode, normal mode, expert mode, and master mode and I got the zenith it's hard but I got my hard work and I am proud.
mode, hardcore, It's a realy good game you get to go on journey mode you get to go on classic mediumcore and hardcore mode you can do journey mode, normal mode, expert mode, and master mode and I got the zenith it's hard but I got my hard work and I am proud.
mode, normal, It's a realy good game you get to go on journey mode you get to go on classic mediumcore and hardcore mode you can do journey mode, normal mode, expert mode, and master mode and I got the zenith it's hard but I got my hard work and I am proud.
work, hard, It's a realy good game you get to go on journey mode you get to go on classic mediumcore and hardcore mode you can do journey mode, normal mode, expert mode, and master mode and I got the zenith it's hard but I got my hard work and I am proud.
person, only, Terraria fails to install now I have updated to android 11. Will there be a fix for this or have I wasted my money. I am not the only person with this issue.
country, other, I used too love this game but now it's kinda boring cuz I can't connect to multiplayer games! I'm from Malaysia I don't know is it because no one purchase this game in my country or what, but please make you can play with other country.
time, inconvenient, Seems to sometimes crash at an inconvenient time and not saving completely (the world).
game, best, Terraria is the best game ever, but may I know why the language Chinese had been deleted cuz Terraria released at China? even at here still got Chinese players, the things I don't like is only this, or not, everything will be perfect
players, Chinese, Terraria is the best game ever, but may I know why the language Chinese had been deleted cuz Terraria released at China? even at here still got Chinese players, the things I don't like is only this, or not, everything will be perfect
games, mobile, It's fun! Better than most mobile games i've seen (which is ALOT). I'd recommend this to new or old players. Thanks for making this!!!
players, new, It's fun! Better than most mobile games i've seen (which is ALOT). I'd recommend this to new or old players. Thanks for making this!!!
day, single, This game is so fun and mythical And I've been playing it for 5 years And I am an expert at the game And I love this game so much I Play on every single day
gam, best, best gam every
capability, mod, Only wish it had mod capability
game, amazing, It's an amazing game. I know your not going, but you should change up the world generation.
game, Best, Best game ever been playing it for a long time and loved every part of it
time, long, Best game ever been playing it for a long time and loved every part of it
support, mod, after 10 years of development it was worth the wait By the way can you guys add mod support so i can play with viarety
game, fun, A fun game to play when bored and when you're not. Well done:)
update, last, Loved it for years but the last update is on another level completely. The mobile game now has everything that the PC version has. Dream come true for serious fans.
game, mobile, Loved it for years but the last update is on another level completely. The mobile game now has everything that the PC version has. Dream come true for serious fans.
fans, serious, Loved it for years but the last update is on another level completely. The mobile game now has everything that the PC version has. Dream come true for serious fans.
gameeee, good, good gameeee
boss, highest, Played this app since orchera or whatever his name is was the highest boss back in like 1.1 or 1.2 and habe played for years, definately one of the best games ever, for sure a 5 star and for sure worth the $5 I paid for it.
games, best, Played this app since orchera or whatever his name is was the highest boss back in like 1.1 or 1.2 and habe played for years, definately one of the best games ever, for sure a 5 star and for sure worth the $5 I paid for it.
fun, better, fun and addicting, better than minecraft IMO
shield, ankh, I had 150+ hours into this game, I had an ankh shield and everything and defeated the moon lord multiple times with solar armor until the game decides to delete my character. Fix this issue! I am very upset... I had a huge attachment to my character... you're lucky my town isnt deleted.
times, multiple, I had 150+ hours into this game, I had an ankh shield and everything and defeated the moon lord multiple times with solar armor until the game decides to delete my character. Fix this issue! I am very upset... I had a huge attachment to my character... you're lucky my town isnt deleted.
armor, solar, I had 150+ hours into this game, I had an ankh shield and everything and defeated the moon lord multiple times with solar armor until the game decides to delete my character. Fix this issue! I am very upset... I had a huge attachment to my character... you're lucky my town isnt deleted.
attachment, huge, I had 150+ hours into this game, I had an ankh shield and everything and defeated the moon lord multiple times with solar armor until the game decides to delete my character. Fix this issue! I am very upset... I had a huge attachment to my character... you're lucky my town isnt deleted.
game, Cool, Cool game it's just like Minecraft but 2D and there are more bosses
bosses, more, Cool game it's just like Minecraft but 2D and there are more bosses
games, greatest, One of the greatest mobile games of all time. Truly worth every penny. I prefer the pc version, but when on the road there's nothing better than some terraria.
games, mobile, One of the greatest mobile games of all time. Truly worth every penny. I prefer the pc version, but when on the road there's nothing better than some terraria.
controls, Good, Good experience controls are a little bit wonky but still amazing game
bit, little, Good experience controls are a little bit wonky but still amazing game
game, amazing, Good experience controls are a little bit wonky but still amazing game
game, fun, It's just a fun great game and I love playing it with my family and it's a hard game which I think hard games are better
game, great, It's just a fun great game and I love playing it with my family and it's a hard game which I think hard games are better
game, hard, It's just a fun great game and I love playing it with my family and it's a hard game which I think hard games are better
games, hard, It's just a fun great game and I love playing it with my family and it's a hard game which I think hard games are better
game, Good, Good game. Zenith go brrrr
game, amazing, Great amazing game forgor to play it a lot so I'm going to play it now again ðŸ˜ŠðŸ‘âœ¨
forgor, Great, Great amazing game forgor to play it a lot so I'm going to play it now again ðŸ˜ŠðŸ‘âœ¨
phone, new, I got a new phone and I used the same Google account but all my progress will not transfer to my new phone
account, same, I got a new phone and I used the same Google account but all my progress will not transfer to my new phone
phone, new, I got a new phone and I used the same Google account but all my progress will not transfer to my new phone
experience, Enjoyable, Enjoyable fun optimized experience great if you do not have a vomputer or just want to play on the go. On the go that is its mobile so controls are not great plus the new 1.4 latout is terrible for mobile i did give it 4 stars in 1.3 but now i give it 3 please update the controls
experience, optimized, Enjoyable fun optimized experience great if you do not have a vomputer or just want to play on the go. On the go that is its mobile so controls are not great plus the new 1.4 latout is terrible for mobile i did give it 4 stars in 1.3 but now i give it 3 please update the controls
experience, great, Enjoyable fun optimized experience great if you do not have a vomputer or just want to play on the go. On the go that is its mobile so controls are not great plus the new 1.4 latout is terrible for mobile i did give it 4 stars in 1.3 but now i give it 3 please update the controls
latout, new, Enjoyable fun optimized experience great if you do not have a vomputer or just want to play on the go. On the go that is its mobile so controls are not great plus the new 1.4 latout is terrible for mobile i did give it 4 stars in 1.3 but now i give it 3 please update the controls
game, epic, Very epic game
game, best, The best game I ever played
controles, older, Please add an option to revert to the older controles. My new phone is still not big enough to use the controles precicely without hitting other buttons, half of which i don't understand.
phone, new, Please add an option to revert to the older controles. My new phone is still not big enough to use the controles precicely without hitting other buttons, half of which i don't understand.
buttons, other, Please add an option to revert to the older controles. My new phone is still not big enough to use the controles precicely without hitting other buttons, half of which i don't understand.
stuff, new, The app is extremly cool with journeys end to and all the new stuff added in the app there is 2 problems the xbox one and series x controllers when you use them by bluetooth all the buttons work but the start pause button does not work in the app the other problem its annoying all the NPC in terraria does not close the doors in my world i have a bunch of npc that has left all doors open i dont know if its bug or some sort of thing its odd ðŸ¤”I dont really know
problem, other, The app is extremly cool with journeys end to and all the new stuff added in the app there is 2 problems the xbox one and series x controllers when you use them by bluetooth all the buttons work but the start pause button does not work in the app the other problem its annoying all the NPC in terraria does not close the doors in my world i have a bunch of npc that has left all doors open i dont know if its bug or some sort of thing its odd ðŸ¤”I dont really know
ðŸ¤”, odd, The app is extremly cool with journeys end to and all the new stuff added in the app there is 2 problems the xbox one and series x controllers when you use them by bluetooth all the buttons work but the start pause button does not work in the app the other problem its annoying all the NPC in terraria does not close the doors in my world i have a bunch of npc that has left all doors open i dont know if its bug or some sort of thing its odd ðŸ¤”I dont really know
games, best, One of the best chill games of all time, you can do so much, the possibilities are limitless.. just dig, build, create & enjoy endless hours of fun..
hours, endless, One of the best chill games of all time, you can do so much, the possibilities are limitless.. just dig, build, create & enjoy endless hours of fun..
boss, Final, 1.4 Finally Came to the Android â¤â¤ Must Download this game â¤ Worth the money â¤ Edit: Yes, i obtain the Zenith.. And it became boring now, I defeated the Final boss and what's the use of Zenith now? I have the Endgame Weapon but i want endgame enemies too.. And make a new npc like in Halloween, like skeleton npc and lives in Graveyard biome Make npc sells new when the mini event like christmas and halloween
event, mini, 1.4 Finally Came to the Android â¤â¤ Must Download this game â¤ Worth the money â¤ Edit: Yes, i obtain the Zenith.. And it became boring now, I defeated the Final boss and what's the use of Zenith now? I have the Endgame Weapon but i want endgame enemies too.. And make a new npc like in Halloween, like skeleton npc and lives in Graveyard biome Make npc sells new when the mini event like christmas and halloween
stuff, cool, It's fun, lots of adventure, and so much cool magic stuff! You will love it even before you you defeat your first boss!
stuff, magic, It's fun, lots of adventure, and so much cool magic stuff! You will love it even before you you defeat your first boss!
boss, first, It's fun, lots of adventure, and so much cool magic stuff! You will love it even before you you defeat your first boss!
updates, new, Its very fun and challenging,i love these kind of games.So im looking forward to new updates :)
game, good, I love this game a lot i think it is a very good game how every i dont like the phone version a lot. I like it on the xbox and pc tho but it is still a good game ðŸ˜„ðŸ˜„ðŸ˜„ðŸ˜„ðŸ˜„
ðŸ˜„, good, I love this game a lot i think it is a very good game how every i dont like the phone version a lot. I like it on the xbox and pc tho but it is still a good game ðŸ˜„ðŸ˜„ðŸ˜„ðŸ˜„ðŸ˜„
ðŸ˜„, ðŸ˜„, I love this game a lot i think it is a very good game how every i dont like the phone version a lot. I like it on the xbox and pc tho but it is still a good game ðŸ˜„ðŸ˜„ðŸ˜„ðŸ˜„ðŸ˜„
port, good, The game is great, and it's a pretty good port, but I just cannot find a good enough reason to buy it when I have better systems that can give me the same experience. Even though it's not my favorite version, it's still worth the money if you don't have a PC or a console.
reason, enough, The game is great, and it's a pretty good port, but I just cannot find a good enough reason to buy it when I have better systems that can give me the same experience. Even though it's not my favorite version, it's still worth the money if you don't have a PC or a console.
systems, better, The game is great, and it's a pretty good port, but I just cannot find a good enough reason to buy it when I have better systems that can give me the same experience. Even though it's not my favorite version, it's still worth the money if you don't have a PC or a console.
experience, same, The game is great, and it's a pretty good port, but I just cannot find a good enough reason to buy it when I have better systems that can give me the same experience. Even though it's not my favorite version, it's still worth the money if you don't have a PC or a console.
version, favorite, The game is great, and it's a pretty good port, but I just cannot find a good enough reason to buy it when I have better systems that can give me the same experience. Even though it's not my favorite version, it's still worth the money if you don't have a PC or a console.
multiplayer, Online, Online multiplayer doesn't exists
differences, few, This is essentially minecraft(I hate that game) with a few differences.
game, famous, I cant belive that this game isnt atleast the second most famous game on eath its so good and i never ever got a single ad you should definitly get it its worth the money
