VERB, PREP, POBJ, 
spawn, on, spoiler, Incredible port. Unfortunately, I was doing a playthrough on Ironman and the game refused to spawn any bad guys on a level (spoiler) where you can't abort the mission. No save point to go back to to try again. Disappointing. If that got fixed, 5 stars.
updated, for, version, Its good actually, but it needs to be updated for latest android version. Cause it always crash when i play.
work, on, tablet, Does not work on tablet wont even load saying download Failed. Tried to redownload this 5 times.
developed, for, version, The game it's good until crash I really enjoying the game BUT some times it's just close without any error message, just close and I lost my progress... I realized that when I try to sync my save with the cloud, the error also happens. Sometimes when I open the game the following message appears: "This game was developed for previous version of Android" I'm now on Android 10. Please developers make it fully compatible with newer Android.
panning, around, map, Would be great if not for the awful camera controls. This game seems determined to keep you zoomed in so far that you cant see anything, and on top of that is only capable of slowely panning around the map. Most of your time in battle will be spent thumbing around trying to see something that isnt the 10 squares around your soldiers that the game seems to think is all you need
played, for, 2hrs, Game is very fun but I only played for 2hrs because you cannot save the game Tried to load back in today but my save was deleted Keeps saying Cloud Save Not Working please make an update Thank you
load, in, today, Game is very fun but I only played for 2hrs because you cannot save the game Tried to load back in today but my save was deleted Keeps saying Cloud Save Not Working please make an update Thank you
work, with, Chromebook, The game pretty much won't work with any Chromebook anymore. That's because if you have a Chromebook, then google keeps updating their android OS, and their latest version of Android has basically broken the game completely.
finished, on, android, I finished this game on psvita years ago. And now just finished it on android. Please release Xcom 2 collection on android. I'll definitely gonna get it!!
release, on, android, I finished this game on psvita years ago. And now just finished it on android. Please release Xcom 2 collection on android. I'll definitely gonna get it!!
updated, for, phones, It need to be updated for newer phones .please update it.
taken, of, that, Pretty decent game. I have problems loading sometimes using resume. Hitting single player seems to have taken care of that. I have XCOM:UFO Defence for PS1 and it's my favorite game all time. This is ok so far, could be better tho. Especially aiming percent algorithms. 80% chance to hit misses at LEAST 50% of the time which makes it very hard to survive an win even on easy mode ( and I have aiming device on them to give an extra 10% ). Your guys get killed because you miss 3 out of 4 80% shots.
wish, to, five, I wish to five a good feedback. I am a follower of pc series. The mobile implementation has 3 problems. Not being able to save between missions. Long time to start playing. It is difficult to be precise when selecting characters.which delays the game agility. Finally, if you leave the app open while doing soemthing else it is going to eat battery and get your mobile warm.
save, between, missions, I wish to five a good feedback. I am a follower of pc series. The mobile implementation has 3 problems. Not being able to save between missions. Long time to start playing. It is difficult to be precise when selecting characters.which delays the game agility. Finally, if you leave the app open while doing soemthing else it is going to eat battery and get your mobile warm.
get, past, permissions, It literally won't let me get past app permissions. Won't start at all.
stays, to, original, An excellent port that stays true to the pc original
work, for, phones, Unfortunately doesn't work for new phones, got a new Galaxy S21 and I can't play anymore :( 3 stars because it's still a good game.
crashes, on, S10, Game crashes constantly on my Galaxy S10. I couldn't finish prologue mission because my soldiers didn't have enough AP to move to designated area. What a joke
move, to, area, Game crashes constantly on my Galaxy S10. I couldn't finish prologue mission because my soldiers didn't have enough AP to move to designated area. What a joke
works, on, tablet, This is my absolute favorite PS3 game. I just got a Galaxy Tab A7 and was shocked to see that there is an Android version, which I decided to buy (because it's my fav). This version works better on the tablet than on the PS3! As I'm playing I keep muttering, "This is so freaking awesome!" If you like this game, don't even hesitate. I personally believe this game is one of the best games EVER made, and the Android version on my tab A7 does not disappoint!
work, for, while, Devs don't keep this updated. Worst part is it does work for a while in new devices but then you can't load games and you already lost the time for a refund. Don't buy unless you have an old phone.
work, in, devices, Devs don't keep this updated. Worst part is it does work for a while in new devices but then you can't load games and you already lost the time for a refund. Don't buy unless you have an old phone.
climb, to, position, Its almost impossible to climb to an elevated position. Pls fix it
add, to, it, Please add multi multiplayer to it
zooms, on, dudes, Cloud saves busted. You WILL get a message saying your phone is too new for the game to work correctly. If it does work enough to play, the game zooms in on your dudes when you select them making you take the time to pinch zoom out on every action. This makes the game tedious to play. Requested refund.
take, of, power, This game is so much fun. Yes the graphics take a hit and yes the control can be iffy but its THE FULL GAME. I love it. I would love to see an updateto this so it can take advantage of newer phones power
replaying, for, years, One of the best Android games ever, replaying it for years after purchase. No adds no pay to win. To avoid crashing just let the title video play for a short time before skipping it
Loved, on, xbox, Excellent. Loved this game on the xbox and loving it here too. I could play any xcom game over and over happily, can't wait for the day xcom 2 comes to mobile when the hardware improves.
wait, for, day, Excellent. Loved this game on the xbox and loving it here too. I could play any xcom game over and over happily, can't wait for the day xcom 2 comes to mobile when the hardware improves.
comes, to, mobile, Excellent. Loved this game on the xbox and loving it here too. I could play any xcom game over and over happily, can't wait for the day xcom 2 comes to mobile when the hardware improves.
add, like, mission, Please bring the multiplayer mode back and make the mkbile ver same like the pc. Fpr example, the equipment per soldier, in pc/console ver they have 2 equipment slots, but the mobile only have 1 slots equipment. And the guardian armor that can flying. You only can fly 2 step. And add more event, like train mission, mission on the dam, and that asian guy.
move, by, accident, Pretty solid port the only complaint is just the controls aren't that great. I wish they added controller support like PC. I often move by accident.
play, on, mobile, An incredible experience. XCOM is one of my favourite franchises of all time, and being able to play it on mobile is such an amazing thing. An incredibly faithful and functional port, too. It's truly the full experience on mobile.
played, on, devices, I have played this now on two devices, my galaxy s6 and my n100 smartphone, both run beautifully.
made, on, platform, Still the best turn based tactical game ever made (on any platform).
ported, to, environment, An epic game from the PC that almost perfectly transfers to mobile. Some of the controls can be difficult to use, but it is great to see a fully fledged PC game ported to a mobile environment. Very few tactical turn based squad games compare to this masterpiece.
compare, to, masterpiece, An epic game from the PC that almost perfectly transfers to mobile. Some of the controls can be difficult to use, but it is great to see a fully fledged PC game ported to a mobile environment. Very few tactical turn based squad games compare to this masterpiece.
work, with, update, Cloud saves doesn't work with the March 11 2021 update of Google Play but keeps on asking you to login. No Multiplayer servers are available so it's just a single-player game.
cleared, for, it, Its to big for my internal memory...cant we have a smaller bit and download the rest? I mean i cleared my phone for it 3.2 gb and once the downloads finished it demands additional space its not fair yet i paid for it. The game is fun but im saddened that i cant play what i bought really
paid, for, it, Its to big for my internal memory...cant we have a smaller bit and download the rest? I mean i cleared my phone for it 3.2 gb and once the downloads finished it demands additional space its not fair yet i paid for it. The game is fun but im saddened that i cant play what i bought really
seen, on, YouTube, I love this game so far, and it's worth every penny, I would love to see xcom 2 on mobile as well I've seen lots of videos of it on YouTube and I'm loving how it plays. I know it's a bit of a large request but could xcom 2 be put on mobile and someone make mods for the games on mobile plz, also what's up with the multiplayer feature not working on here, it's frustrating to say the least.
put, on, mobile, I love this game so far, and it's worth every penny, I would love to see xcom 2 on mobile as well I've seen lots of videos of it on YouTube and I'm loving how it plays. I know it's a bit of a large request but could xcom 2 be put on mobile and someone make mods for the games on mobile plz, also what's up with the multiplayer feature not working on here, it's frustrating to say the least.
make, for, games, I love this game so far, and it's worth every penny, I would love to see xcom 2 on mobile as well I've seen lots of videos of it on YouTube and I'm loving how it plays. I know it's a bit of a large request but could xcom 2 be put on mobile and someone make mods for the games on mobile plz, also what's up with the multiplayer feature not working on here, it's frustrating to say the least.
effect, to, much, Pretty great port, well worth the 5 dollars. Its got some jank but its a port so thats not surprising, it doesn't effect the gameplay to much. Solid 5 outta 7.
deal, with, chance, Tough game even on easy because you still deal with chance, not sure but even at 95% chance to hit you still will miss a lot, "it's crazy"but not them, I just wish on easy mode it was a more relaxing, because all I want to do is play a game not stress myself out. Just used to save option and you'll be fine.
miss, at, chance, Tough game even on easy because you still deal with chance, not sure but even at 95% chance to hit you still will miss a lot, "it's crazy"but not them, I just wish on easy mode it was a more relaxing, because all I want to do is play a game not stress myself out. Just used to save option and you'll be fine.
wish, on, mode, Tough game even on easy because you still deal with chance, not sure but even at 95% chance to hit you still will miss a lot, "it's crazy"but not them, I just wish on easy mode it was a more relaxing, because all I want to do is play a game not stress myself out. Just used to save option and you'll be fine.
work, for, me, It used to work really well for me. But it seems the game hasn't been updated in a long time and it works poorly on my new phone. Also the elevation change with two finger swipe seems to completely not work at all and elevation changing is very messy and clunky in general and causes me to be unable to see things I should be able to like what's on the roof.
updated, in, time, It used to work really well for me. But it seems the game hasn't been updated in a long time and it works poorly on my new phone. Also the elevation change with two finger swipe seems to completely not work at all and elevation changing is very messy and clunky in general and causes me to be unable to see things I should be able to like what's on the roof.
works, on, phone, It used to work really well for me. But it seems the game hasn't been updated in a long time and it works poorly on my new phone. Also the elevation change with two finger swipe seems to completely not work at all and elevation changing is very messy and clunky in general and causes me to be unable to see things I should be able to like what's on the roof.
give, for, fact, Even though I love the series I give this a 4 star for the fact that it refused to download for 3 hours and when I was going to take a video of it for my you tube it was completely removed from my phone so I have to go through the process again by the time you we this edit It got removed which was my phone's fault but it takes so long to download because it refuses for a long time
download, for, hours, Even though I love the series I give this a 4 star for the fact that it refused to download for 3 hours and when I was going to take a video of it for my you tube it was completely removed from my phone so I have to go through the process again by the time you we this edit It got removed which was my phone's fault but it takes so long to download because it refuses for a long time
removed, from, phone, Even though I love the series I give this a 4 star for the fact that it refused to download for 3 hours and when I was going to take a video of it for my you tube it was completely removed from my phone so I have to go through the process again by the time you we this edit It got removed which was my phone's fault but it takes so long to download because it refuses for a long time
go, through, process, Even though I love the series I give this a 4 star for the fact that it refused to download for 3 hours and when I was going to take a video of it for my you tube it was completely removed from my phone so I have to go through the process again by the time you we this edit It got removed which was my phone's fault but it takes so long to download because it refuses for a long time
go, by, time, Even though I love the series I give this a 4 star for the fact that it refused to download for 3 hours and when I was going to take a video of it for my you tube it was completely removed from my phone so I have to go through the process again by the time you we this edit It got removed which was my phone's fault but it takes so long to download because it refuses for a long time
refuses, for, time, Even though I love the series I give this a 4 star for the fact that it refused to download for 3 hours and when I was going to take a video of it for my you tube it was completely removed from my phone so I have to go through the process again by the time you we this edit It got removed which was my phone's fault but it takes so long to download because it refuses for a long time
updated, in, time, Great game but has not been updated in long time so probably won't work much longer... needs update
playing, for, years, I've been playing this game for six years. It's my favorite game. I play it on a tablet, the graphics are just amazing compared to a phone.
play, on, tablet, I've been playing this game for six years. It's my favorite game. I play it on a tablet, the graphics are just amazing compared to a phone.
compared, to, phone, I've been playing this game for six years. It's my favorite game. I play it on a tablet, the graphics are just amazing compared to a phone.
speaks, of, condition, Really sorry this game is a menace on touchscreen. Also the density of action speaks of a go robot condition. False devising of distribution with an else fair entertainment.
shoot, like, drop, Wheres the graphic setting?? My device is POCO X3 NFC i think its a good device to play this game.. But why the game still a bitt lag when i play it.. When it walk or shoot like my fps drop so the game a bit lag.. N theres no graphic setting?? Come on dev please help me..
playing, for, years, Been playing on/off for two years now and u must say, its infuriatingly hard and managed to beat the game once and i want to delete it from time to time but something in this game just stops me and keeps me wanting more. Its hard yes but i still love it.
delete, from, time, Been playing on/off for two years now and u must say, its infuriatingly hard and managed to beat the game once and i want to delete it from time to time but something in this game just stops me and keeps me wanting more. Its hard yes but i still love it.
playing, on, redmi, I am playing this game on redmi note 9pro. And while playing suddenly app crashes and you have start the game from beginning. Waste of money.
listen, through, headphones, This is a very good port of XCOM: Enemy Within to Android. Loading times are very fast, graphics are generally clear, the sounds are very good when I listen through headphones, and the gameplay is as difficult and fun as I remember on the Steam version. My only issues have been that sometimes the touch input thinks you want to launch a grenade when you're just trying to move the landing spot a little, and there is a (edge case) AI bug that may cause an infinite loop requiring a force quit.
remember, on, version, This is a very good port of XCOM: Enemy Within to Android. Loading times are very fast, graphics are generally clear, the sounds are very good when I listen through headphones, and the gameplay is as difficult and fun as I remember on the Steam version. My only issues have been that sometimes the touch input thinks you want to launch a grenade when you're just trying to move the landing spot a little, and there is a (edge case) AI bug that may cause an infinite loop requiring a force quit.
developed, for, version, The game just displays a message saying it was developed for an older version of android and wont load at all , so basically i paid for a game that i cant even play so beware! Even though im running it on an android flagship phone.
paid, for, game, The game just displays a message saying it was developed for an older version of android and wont load at all , so basically i paid for a game that i cant even play so beware! Even though im running it on an android flagship phone.
running, on, phone, The game just displays a message saying it was developed for an older version of android and wont load at all , so basically i paid for a game that i cant even play so beware! Even though im running it on an android flagship phone.
loved, on, pc, So good. So. So good. I loved it on pc and its perfect for tablet. I can't think of a game better suited for mobile devices. Perfection. And a bargain too.
think, of, game, So good. So. So good. I loved it on pc and its perfect for tablet. I can't think of a game better suited for mobile devices. Perfection. And a bargain too.
suited, for, devices, So good. So. So good. I loved it on pc and its perfect for tablet. I can't think of a game better suited for mobile devices. Perfection. And a bargain too.
getting, across, map, Great game, almost identical to the pc and console version. Perfect game for mobile, gameplay A+. One thing that would improve the interface is adjustable scroll speed for getting across the map, otherwise flawless
comimg, to, game, 30fps lock?!? Fix that ASAP devs! I have 144hz screen so comimg to this game always feels so slow and laggy. An awfull experience. What a shame... Otherwise an awesome game! Definitely my all time favourite mobile game! 6/5❤️
Play, at, %, Play store installation failure at about 40%. This is my Nth attempt and still no bacon.
r.2012, na, PC, Hra r.2012 na PC a hra roku na Android do teraz..pretože stále od vydania pre mobily (r.2014) nemá konkurenciu na Android, iOS a na PC mu konkuruje iba XCOM 2 ..nehladte na cenu je to TOP a na rozdiel od hack & crack je aktualizovaná + stiahne sa verzia pre váš model mobilu. Ide skvele aj na Acer z630 (low end) aj na Galaxy Note 4 (hight end) samozrejme iná verzia pre model aj inak vyzerá. Na Note 4 je to nádhera, na Acer je hra len pekná. Je to skutočná kvalita PC titulu ktorá nie je oproti PC verzie okrem grafiky a pár micro DLC odsekana. Je to 100% klon a už len dùfat že raz aj vyjde do mobilou kompletný XCOM 2. Nemusíte sa báť ovládania - je to skôr pre väčšie mobily, alebo tablety..
cenu, to, TOP, Hra r.2012 na PC a hra roku na Android do teraz..pretože stále od vydania pre mobily (r.2014) nemá konkurenciu na Android, iOS a na PC mu konkuruje iba XCOM 2 ..nehladte na cenu je to TOP a na rozdiel od hack & crack je aktualizovaná + stiahne sa verzia pre váš model mobilu. Ide skvele aj na Acer z630 (low end) aj na Galaxy Note 4 (hight end) samozrejme iná verzia pre model aj inak vyzerá. Na Note 4 je to nádhera, na Acer je hra len pekná. Je to skutočná kvalita PC titulu ktorá nie je oproti PC verzie okrem grafiky a pár micro DLC odsekana. Je to 100% klon a už len dùfat že raz aj vyjde do mobilou kompletný XCOM 2. Nemusíte sa báť ovládania - je to skôr pre väčšie mobily, alebo tablety..
Note, to, nádhera, Hra r.2012 na PC a hra roku na Android do teraz..pretože stále od vydania pre mobily (r.2014) nemá konkurenciu na Android, iOS a na PC mu konkuruje iba XCOM 2 ..nehladte na cenu je to TOP a na rozdiel od hack & crack je aktualizovaná + stiahne sa verzia pre váš model mobilu. Ide skvele aj na Acer z630 (low end) aj na Galaxy Note 4 (hight end) samozrejme iná verzia pre model aj inak vyzerá. Na Note 4 je to nádhera, na Acer je hra len pekná. Je to skutočná kvalita PC titulu ktorá nie je oproti PC verzie okrem grafiky a pár micro DLC odsekana. Je to 100% klon a už len dùfat že raz aj vyjde do mobilou kompletný XCOM 2. Nemusíte sa báť ovládania - je to skôr pre väčšie mobily, alebo tablety..
Toned, from, version, Good strategy game. Toned down from PC version but still fun to play. Pray to your RnG god/s before downloading
Pray, to, RnG, Good strategy game. Toned down from PC version but still fun to play. Pray to your RnG god/s before downloading
stuck, at, mission, The game stuck at the first mission. I'm suppose to lunch a rocket but it doesn't work when I press accept and I can't do any other action.
feels, after, while, Good, but feels repetitive after a while.
run, on, my, Just bought the game last month... Absolutely LOVE it.. The game run smoothly on my Galaxy Tab A. Highly recommend this game to avid X-Com fans or strategy games fans. Really disappointed when Operation Slingshot and Progeny were omitted from the android version. Still I rated this game 10/10
omitted, from, version, Just bought the game last month... Absolutely LOVE it.. The game run smoothly on my Galaxy Tab A. Highly recommend this game to avid X-Com fans or strategy games fans. Really disappointed when Operation Slingshot and Progeny were omitted from the android version. Still I rated this game 10/10
Played, for, all, Broken. Played for all of 5 minutes before I was unable to carry out any actions with my squad. Reloaded, same issue. Shame as I love the Xcom games and was happy to pay to play it on my phone. Total waste of money
play, on, phone, Broken. Played for all of 5 minutes before I was unable to carry out any actions with my squad. Reloaded, same issue. Shame as I love the Xcom games and was happy to pay to play it on my phone. Total waste of money
crashes, after, hours, Just crashes after a couple hours.
cloud, on, galaxy, Would be 5 stars if I could do cloud saves on my galaxy tab a and galaxy s21 please fix this
get, for, years, Purchase a game, and it doesn't get updates for 3 years?! That's completely sad. The sync with Google Cloud no longer works, so you can no longer resume a game from other devices. I lost my saved games when I had to replace/upgrade my Android. Absurd!
locked, at, 30fps, The game is great. But I'm giving it 3 stars just because it's locked at 30fps. I'm pretty sure that my phone would be able to run it at 120fps without any problems. Please update the game to support high frame rates and add some graphic settings so the game can look as good as on PC. Nowadays phones are definitely powerful enough to run this game at higher graphic settings and frame rate.
run, at, 120fps, The game is great. But I'm giving it 3 stars just because it's locked at 30fps. I'm pretty sure that my phone would be able to run it at 120fps without any problems. Please update the game to support high frame rates and add some graphic settings so the game can look as good as on PC. Nowadays phones are definitely powerful enough to run this game at higher graphic settings and frame rate.
run, without, problems, The game is great. But I'm giving it 3 stars just because it's locked at 30fps. I'm pretty sure that my phone would be able to run it at 120fps without any problems. Please update the game to support high frame rates and add some graphic settings so the game can look as good as on PC. Nowadays phones are definitely powerful enough to run this game at higher graphic settings and frame rate.
run, at, settings, The game is great. But I'm giving it 3 stars just because it's locked at 30fps. I'm pretty sure that my phone would be able to run it at 120fps without any problems. Please update the game to support high frame rates and add some graphic settings so the game can look as good as on PC. Nowadays phones are definitely powerful enough to run this game at higher graphic settings and frame rate.
beating, on, pc, Plays like the pc verison with less graphics. Enjoyed playing it even after beating the game on the pc.
