NOUN, ADJ, 
market, black, (Edit: Extra star for adding DLC song bundles.) Great art, great music, great story, but the IAP is ridiculous. If your going to do this at least offer an all characters dlc bundle or season pass type thing. $120 to get the full story so far is utter nonsense especially if you want all the black market packs which raises it to $220. It's a great rhythm game and If it gets a console release with ALL the DLC I'll DEFINITELY give it a raving 5-Star review on whatever I get it on.
game, great, (Edit: Extra star for adding DLC song bundles.) Great art, great music, great story, but the IAP is ridiculous. If your going to do this at least offer an all characters dlc bundle or season pass type thing. $120 to get the full story so far is utter nonsense especially if you want all the black market packs which raises it to $220. It's a great rhythm game and If it gets a console release with ALL the DLC I'll DEFINITELY give it a raving 5-Star review on whatever I get it on.
review, raving, (Edit: Extra star for adding DLC song bundles.) Great art, great music, great story, but the IAP is ridiculous. If your going to do this at least offer an all characters dlc bundle or season pass type thing. $120 to get the full story so far is utter nonsense especially if you want all the black market packs which raises it to $220. It's a great rhythm game and If it gets a console release with ALL the DLC I'll DEFINITELY give it a raving 5-Star review on whatever I get it on.
game, good, A good game
game, awesome, Not working for OnePlus 7T. Was an awesome game, very disappointed.
game, disappointed, Not working for OnePlus 7T. Was an awesome game, very disappointed.
update, latest, The game keeps crashing since the latest update it became unplayable for me, 2 updates ago the game was working well and it doesn't crash but now it does hopefully you can fix this soon i still rate 4 stars because me and my friends had fun with this game back then
update, last, After this last update the game keeps crashing in the opening video or while loading, after I tap the screen in the "tap the screen to continue" screen.
game, best, Still the best rhythm game in android, and i already play Cytus since 2015 i never bored playing this game!
game, great, It's a great rhythm game, but too bad most of the song are paid in game
game, great, Kinda like Osu! But it's a great game and has a story line that you can ignore or play along with
hope, last, After I updated the game, it keeps crashing. I restarted my phone but it still keeps on crashing. My last hope is clearing its data, so guess what? Its still keeps crashing and my data has been erased even though it is connected to my google play account. Another data to waste to redownload this game. I'll edit my review later if I solved it or not. Edit: Its working again, but I lost my progress even though I cloud saved it. ):> Edit2: yep, its still crashing, pls. Optimize it :<
game, nice, Pretty nice game, i like this gameplay
screen, black, So in actually this game is good and great, but something that still the problem is that the game always hard to install in this device (maybe that's because of my device too) like the app says data not fully downloaded or just black screen, so I think it still need to be fixed on that.
update, new, Hi! Im so happy about the new update! But there is a BIG issue. It wont let me save the score of the song, like the data and Im scared that Il have to switch my phone or reset it and the game will be loaded to a lower level( the game reseted one time and thanks god I saved the data) I tried to play different characters and try to save the data, but the game crashes or locks my screen. Sorry for the rating, but Im really upset about this... Do you think you can solve it?
issue, BIG, Hi! Im so happy about the new update! But there is a BIG issue. It wont let me save the score of the song, like the data and Im scared that Il have to switch my phone or reset it and the game will be loaded to a lower level( the game reseted one time and thanks god I saved the data) I tried to play different characters and try to save the data, but the game crashes or locks my screen. Sorry for the rating, but Im really upset about this... Do you think you can solve it?
level, lower, Hi! Im so happy about the new update! But there is a BIG issue. It wont let me save the score of the song, like the data and Im scared that Il have to switch my phone or reset it and the game will be loaded to a lower level( the game reseted one time and thanks god I saved the data) I tried to play different characters and try to save the data, but the game crashes or locks my screen. Sorry for the rating, but Im really upset about this... Do you think you can solve it?
characters, different, Hi! Im so happy about the new update! But there is a BIG issue. It wont let me save the score of the song, like the data and Im scared that Il have to switch my phone or reset it and the game will be loaded to a lower level( the game reseted one time and thanks god I saved the data) I tried to play different characters and try to save the data, but the game crashes or locks my screen. Sorry for the rating, but Im really upset about this... Do you think you can solve it?
screen, black, Im stuck at black screen and I don't even touch anything my device is umidigi a7 pro
pro, umidigi, Im stuck at black screen and I don't even touch anything my device is umidigi a7 pro
seconds, few, the game keep closing after a few seconds after the new update. please fix it, i can't play it. thank you
update, new, the game keep closing after a few seconds after the new update. please fix it, i can't play it. thank you
game, Nice, Nice game
amat, susah, Yang ngasih 1 star, 2 star, 3 star, blg aja ga bisa main, susah amat
content, Missing, Missing game content that I have purchased before I had bought a bunch of the characters a while back and they are all locked behind a pay wall again I had problems spent 50-60$ on them and I can't play them if there is a way to get them back I would love to play em again I think the new 4.1 update also deleted all my progress as well I am very upset that this is even an issue
update, new, Missing game content that I have purchased before I had bought a bunch of the characters a while back and they are all locked behind a pay wall again I had problems spent 50-60$ on them and I can't play them if there is a way to get them back I would love to play em again I think the new 4.1 update also deleted all my progress as well I am very upset that this is even an issue
game, SuperB, SuperB game. Tho after the new update it became laggy and it feels a bit off when starting up the game. In vanessa, when opening the "chatty thing" to get new song, the game suddenly crash. I hope you'll fix this soon and thank you in advance.
update, new, SuperB game. Tho after the new update it became laggy and it feels a bit off when starting up the game. In vanessa, when opening the "chatty thing" to get new song, the game suddenly crash. I hope you'll fix this soon and thank you in advance.
thing, chatty, SuperB game. Tho after the new update it became laggy and it feels a bit off when starting up the game. In vanessa, when opening the "chatty thing" to get new song, the game suddenly crash. I hope you'll fix this soon and thank you in advance.
song, new, SuperB game. Tho after the new update it became laggy and it feels a bit off when starting up the game. In vanessa, when opening the "chatty thing" to get new song, the game suddenly crash. I hope you'll fix this soon and thank you in advance.
game, beautiful, Very beautiful reythem game one of the best one
update, latest, Keep crashing recently after the latest update. Pls fix.
game, Great, Great game.
game, last, After last update game crashes on startup screen...
concept, cool, A really cool concept that I've never seen before and trust me when I say this buy the Google play pass and you will literally unlock all the albums it's really worth it 👉👈
question, new, new question. My game crashes just after start-up video. I want to get some answers to solve it.
video, start, new question. My game crashes just after start-up video. I want to get some answers to solve it.
updates, fresh, Thank you for keeping this game alive with its fresh updates!! No other game compares to the clean feel that is Cytus. 👌👌 Good work!
game, other, Thank you for keeping this game alive with its fresh updates!! No other game compares to the clean feel that is Cytus. 👌👌 Good work!
feel, clean, Thank you for keeping this game alive with its fresh updates!! No other game compares to the clean feel that is Cytus. 👌👌 Good work!
work, Good, Thank you for keeping this game alive with its fresh updates!! No other game compares to the clean feel that is Cytus. 👌👌 Good work!
characters, other, Giving it 4 stars. This game is really good that I've bought some other characters just to play. I really hope that they add some free characters and songs. And hoping that they add some new skins for Neko and others, also hoping that they add new endings and extend the story 'coz it's really coolll!!! UPDATE!: bruhh the update takes over my phone storage. The update shows 81 mb but it feels like I downloaded a 3 Gigabyte worth of app.
characters, free, Giving it 4 stars. This game is really good that I've bought some other characters just to play. I really hope that they add some free characters and songs. And hoping that they add some new skins for Neko and others, also hoping that they add new endings and extend the story 'coz it's really coolll!!! UPDATE!: bruhh the update takes over my phone storage. The update shows 81 mb but it feels like I downloaded a 3 Gigabyte worth of app.
skins, new, Giving it 4 stars. This game is really good that I've bought some other characters just to play. I really hope that they add some free characters and songs. And hoping that they add some new skins for Neko and others, also hoping that they add new endings and extend the story 'coz it's really coolll!!! UPDATE!: bruhh the update takes over my phone storage. The update shows 81 mb but it feels like I downloaded a 3 Gigabyte worth of app.
endings, new, Giving it 4 stars. This game is really good that I've bought some other characters just to play. I really hope that they add some free characters and songs. And hoping that they add some new skins for Neko and others, also hoping that they add new endings and extend the story 'coz it's really coolll!!! UPDATE!: bruhh the update takes over my phone storage. The update shows 81 mb but it feels like I downloaded a 3 Gigabyte worth of app.
game, Phenomenal, Phenomenal game. I remember waiting anxiously for it to release in my high-school homeroom, and I've been playing it since the day it came out. Beautiful artwork, story, and music. The game is completely realized and provides more than enough content to fully enjoy the game without having to make a single additional purchase; however, if you do choose to buy an expansion it's more than worth the money. Rayark knocked it out of the park with this one, a 10/10 experience.
school, high, Phenomenal game. I remember waiting anxiously for it to release in my high-school homeroom, and I've been playing it since the day it came out. Beautiful artwork, story, and music. The game is completely realized and provides more than enough content to fully enjoy the game without having to make a single additional purchase; however, if you do choose to buy an expansion it's more than worth the money. Rayark knocked it out of the park with this one, a 10/10 experience.
artwork, Beautiful, Phenomenal game. I remember waiting anxiously for it to release in my high-school homeroom, and I've been playing it since the day it came out. Beautiful artwork, story, and music. The game is completely realized and provides more than enough content to fully enjoy the game without having to make a single additional purchase; however, if you do choose to buy an expansion it's more than worth the money. Rayark knocked it out of the park with this one, a 10/10 experience.
content, enough, Phenomenal game. I remember waiting anxiously for it to release in my high-school homeroom, and I've been playing it since the day it came out. Beautiful artwork, story, and music. The game is completely realized and provides more than enough content to fully enjoy the game without having to make a single additional purchase; however, if you do choose to buy an expansion it's more than worth the money. Rayark knocked it out of the park with this one, a 10/10 experience.
purchase, single, Phenomenal game. I remember waiting anxiously for it to release in my high-school homeroom, and I've been playing it since the day it came out. Beautiful artwork, story, and music. The game is completely realized and provides more than enough content to fully enjoy the game without having to make a single additional purchase; however, if you do choose to buy an expansion it's more than worth the money. Rayark knocked it out of the park with this one, a 10/10 experience.
purchase, additional, Phenomenal game. I remember waiting anxiously for it to release in my high-school homeroom, and I've been playing it since the day it came out. Beautiful artwork, story, and music. The game is completely realized and provides more than enough content to fully enjoy the game without having to make a single additional purchase; however, if you do choose to buy an expansion it's more than worth the money. Rayark knocked it out of the park with this one, a 10/10 experience.
game, Excellent, Excellent game, better than OSU. But the cloud save fonction is broken on my phone now. The game send an error message every time saying: internet connection failed. I would have given 5 star if not for that bug.
game, better, Excellent game, better than OSU. But the cloud save fonction is broken on my phone now. The game send an error message every time saying: internet connection failed. I would have given 5 star if not for that bug.
improvement, only, Loading times are now worse compared to back then. The only improvement that I like is that the story database has now a filter. Anyway, i really hope that there would be an option to lower or disable some menu transitions or graphics.
pack, miku, I really love the miku pack. I hope for more collaborations and please add cytus or deemo songs
collaborations, more, I really love the miku pack. I hope for more collaborations and please add cytus or deemo songs
mess, unplayable, The game has become an unplayable mess
issue, only, It Worth to play I love it.The only issue is loading screen take too long.
issue, only, I love this game a lot. The story is engaging and the gameplay is fun and challenging enough that it doesn't get boring. The only issue is that if you delete the app, your progress isn't saved with google play. I've gotten new phones and redownloaded the app, only to have to level up my characters to level eighty all over again, which takes super long every time. This game is great if you never switch phones or delete the app, but if you do either of those things, you have to start from scratch.
phones, new, I love this game a lot. The story is engaging and the gameplay is fun and challenging enough that it doesn't get boring. The only issue is that if you delete the app, your progress isn't saved with google play. I've gotten new phones and redownloaded the app, only to have to level up my characters to level eighty all over again, which takes super long every time. This game is great if you never switch phones or delete the app, but if you do either of those things, you have to start from scratch.
games, best, One of the best games Play store have, love this!
game, premium, A very premium game indeed. It's a storyline we didn't know we needed. Definitely worth the buy, great replay value, I heard. But story alone is quite long, I've been playing for almost a week and I barely made a dent in the plot.
value, great, A very premium game indeed. It's a storyline we didn't know we needed. Definitely worth the buy, great replay value, I heard. But story alone is quite long, I've been playing for almost a week and I barely made a dent in the plot.
updates, last, too laggy after the last 2 updates, now it wont open.
songs, more, If adding more songs makes the game increasingly unstable you should stop adding songs and make a new game or fix the issue.
game, new, If adding more songs makes the game increasingly unstable you should stop adding songs and make a new game or fix the issue.
storyline, Great, Great storyline and I really liked the mechanics
game, best, best mobile game ever
game, mobile, best mobile game ever
update, recent, Changing my rating to 1 star because the recent update broke the game. Every time I try to boot it up the game instantly crashes. Never had problems with this game until now.
experience, last, Ok ok, from my last experience, a lot of the songs were paid but putting that aside, my main problem with it is how oftenly it requires us to login with internet in order to grant us access to the game. I get that it's for security reasons, but seriously. If I had internet all the time I wouldn't be looking for an offline game. It's way better with Cytus, where you need to check in only once or twice a week.
problem, main, Ok ok, from my last experience, a lot of the songs were paid but putting that aside, my main problem with it is how oftenly it requires us to login with internet in order to grant us access to the game. I get that it's for security reasons, but seriously. If I had internet all the time I wouldn't be looking for an offline game. It's way better with Cytus, where you need to check in only once or twice a week.
game, offline, Ok ok, from my last experience, a lot of the songs were paid but putting that aside, my main problem with it is how oftenly it requires us to login with internet in order to grant us access to the game. I get that it's for security reasons, but seriously. If I had internet all the time I wouldn't be looking for an offline game. It's way better with Cytus, where you need to check in only once or twice a week.
stuff, Good, Good stuff
update, new, I've always liked this game, but the new update seems to be crashing the game all the time. I've tried reinstalling it, but it didn't help. If something new in the game is making that happen, I can't even try to fix it since it crashes 3-20 seconds within opening the app. I hope this gets fixed so I can play again.
game, Perfect, Perfect music game
devices, small, It's hard to play on small screen devices
loading, Long, Damn, Rayark, you really ****ed this game up. Now the game is pisspoor in terms of performance too. Long loading times that freeze often and constant stutters during gameplay which is absolutely unacceptable in a rhythm game. These problems did not exist in my phone before the 4.0 update. Just, wow. Guess my phone doesn't meet this game's standards anymore. Cool.
stutters, constant, Damn, Rayark, you really ****ed this game up. Now the game is pisspoor in terms of performance too. Long loading times that freeze often and constant stutters during gameplay which is absolutely unacceptable in a rhythm game. These problems did not exist in my phone before the 4.0 update. Just, wow. Guess my phone doesn't meet this game's standards anymore. Cool.
game, Great, Great game, been playing many years (since before the knight chapter was added to OG Cytus). Thank you :) keep up the great work.. more slow charts please!!
years, many, Great game, been playing many years (since before the knight chapter was added to OG Cytus). Thank you :) keep up the great work.. more slow charts please!!
work, great, Great game, been playing many years (since before the knight chapter was added to OG Cytus). Thank you :) keep up the great work.. more slow charts please!!
charts, slow, Great game, been playing many years (since before the knight chapter was added to OG Cytus). Thank you :) keep up the great work.. more slow charts please!!
space, much, I had given this game 5 stars but now I gotta change my rating. As it keeps getting updated, it now takes up too much GB space on my phone. I have had to delete apps just to be able to play and then redownload them when I'm done. I have invested $$ money in this game and I'd hate to delete it again since I'll lose all my progress, but if there are going to be more updates I'll probably have to delete this game permanently from my phone since I won't be able to play it. 😩
updates, more, I had given this game 5 stars but now I gotta change my rating. As it keeps getting updated, it now takes up too much GB space on my phone. I have had to delete apps just to be able to play and then redownload them when I'm done. I have invested $$ money in this game and I'd hate to delete it again since I'll lose all my progress, but if there are going to be more updates I'll probably have to delete this game permanently from my phone since I won't be able to play it. 😩
stories, Great, Rayark: Great stories in exchange for your emotions getting kicked in the testicles.
bit, kinda, Its been a while now, and i found the tap circle fx kinda bit pixelated and the older version is so satisfying whenever you click on it, can you make a feature where you can also put the older ver. of tapping circles as a selectable feature, i recently play more on Cytus than CytusII because of it. I think itll help a lot
version, older, Its been a while now, and i found the tap circle fx kinda bit pixelated and the older version is so satisfying whenever you click on it, can you make a feature where you can also put the older ver. of tapping circles as a selectable feature, i recently play more on Cytus than CytusII because of it. I think itll help a lot
ver, older, Its been a while now, and i found the tap circle fx kinda bit pixelated and the older version is so satisfying whenever you click on it, can you make a feature where you can also put the older ver. of tapping circles as a selectable feature, i recently play more on Cytus than CytusII because of it. I think itll help a lot
circles, tapping, Its been a while now, and i found the tap circle fx kinda bit pixelated and the older version is so satisfying whenever you click on it, can you make a feature where you can also put the older ver. of tapping circles as a selectable feature, i recently play more on Cytus than CytusII because of it. I think itll help a lot
feature, selectable, Its been a while now, and i found the tap circle fx kinda bit pixelated and the older version is so satisfying whenever you click on it, can you make a feature where you can also put the older ver. of tapping circles as a selectable feature, i recently play more on Cytus than CytusII because of it. I think itll help a lot
section, little, Wow this game is just incredible and fun, the music is outstanding and it really bring you in the atmosphere when reading the little message section feels like another world and i didnt think it was possible for me to ever think so high of any game till i played this game, must try.
account, correct, Unfortunate. I love Cytus, and I have it on both my phone and iPad, but today, I decided to play it during work break, only to find that it started all over again. My phone is new, but I've never had this issue as long as I'm logged into the correct Google account, which I always am. I'm not raging pissed since I have my iPad, but I had my million master records on my phone, so it's... Ok, I guess I'm a little pissed.
game, Great, Great game.
characters, other, hoping to have other characters for free. 😁 really love this game
bit, little, Can you decrease the space a little bit
update, latest, Ever since the latest update, the game gets stuck in the loading screen, hope this issue gets fixed soon 🙏 Edit 29/7 : Great, forget the loading screen now I can't even start the game anymore
game, great, It seems to be a great game, but it's currently unplayable.
game, Awesome, Awesome music game, beautiful art. Two glaring problems with it though. First is the tempo line changes in certain songs sometimes too radically it almost feels like a cheap way to ramp up the difficulty and turn it into a pure reaction game. Second is the unskippable story scenes, and the enormous amount of story related messages that are mandatory to go through one by one. I still give it five stars because I feel a lot of care is being put in which is more than I can say for most mobile games
art, beautiful, Awesome music game, beautiful art. Two glaring problems with it though. First is the tempo line changes in certain songs sometimes too radically it almost feels like a cheap way to ramp up the difficulty and turn it into a pure reaction game. Second is the unskippable story scenes, and the enormous amount of story related messages that are mandatory to go through one by one. I still give it five stars because I feel a lot of care is being put in which is more than I can say for most mobile games
problems, glaring, Awesome music game, beautiful art. Two glaring problems with it though. First is the tempo line changes in certain songs sometimes too radically it almost feels like a cheap way to ramp up the difficulty and turn it into a pure reaction game. Second is the unskippable story scenes, and the enormous amount of story related messages that are mandatory to go through one by one. I still give it five stars because I feel a lot of care is being put in which is more than I can say for most mobile games
