NOUN, ADJ, 
games, other, One of the most satisfying Sim games for mobile. Very simple to understand game, especially for me who doesn't play many games similar to this. The gameplay loop is very satisfying to me, I get a sense of growing a game studio. I highly recommend this and all other Kairosoft games!
game, new, I love the game but I am in year 12 and every new game I make theres a blackout or something that takes nearly all of my points from the game Im making so now non e of the games i am making are good and its making me lose the game..... I can understand if there's a black out every now and then but every single game that I make.... it starting to get irritating.
e, non, I love the game but I am in year 12 and every new game I make theres a blackout or something that takes nearly all of my points from the game Im making so now non e of the games i am making are good and its making me lose the game..... I can understand if there's a black out every now and then but every single game that I make.... it starting to get irritating.
game, single, I love the game but I am in year 12 and every new game I make theres a blackout or something that takes nearly all of my points from the game Im making so now non e of the games i am making are good and its making me lose the game..... I can understand if there's a black out every now and then but every single game that I make.... it starting to get irritating.
game, Great, Great game and should be celebrated for actually being a game you can buy, own and enjoy on your phone. In a sea of pay to play/win games that have infected mobile gaming this is a great example of how to do it right.
gaming, mobile, Great game and should be celebrated for actually being a game you can buy, own and enjoy on your phone. In a sea of pay to play/win games that have infected mobile gaming this is a great example of how to do it right.
example, great, Great game and should be celebrated for actually being a game you can buy, own and enjoy on your phone. In a sea of pay to play/win games that have infected mobile gaming this is a great example of how to do it right.
game, Great, Great game, I'm not usually one to play smartphone games but this is one I have on every phone
games, smartphone, Great game, I'm not usually one to play smartphone games but this is one I have on every phone
game, Solid, Solid fun game, however after 3 hours of play. Every game came out number #1 with no real advancment in game after you move to third office. Cute game but could be so much better
advancment, real, Solid fun game, however after 3 hours of play. Every game came out number #1 with no real advancment in game after you move to third office. Cute game but could be so much better
office, third, Solid fun game, however after 3 hours of play. Every game came out number #1 with no real advancment in game after you move to third office. Cute game but could be so much better
game, Cute, Solid fun game, however after 3 hours of play. Every game came out number #1 with no real advancment in game after you move to third office. Cute game but could be so much better
blast, absolute, So I've played this game before. It's an absolute blast. Or it would be if it even loaded. Infinite loading screens suck, and having to pay money to stare at a game that doesn't even open is essentially theft. You sold me a defective product. On top of that, I tried to uninstall and reinstall the game to see if it fixed the issue. I'm now being asked to pay twice for a piece of content I've already purchased and own. Is this legit how you treat customers?
screens, Infinite, So I've played this game before. It's an absolute blast. Or it would be if it even loaded. Infinite loading screens suck, and having to pay money to stare at a game that doesn't even open is essentially theft. You sold me a defective product. On top of that, I tried to uninstall and reinstall the game to see if it fixed the issue. I'm now being asked to pay twice for a piece of content I've already purchased and own. Is this legit how you treat customers?
product, defective, So I've played this game before. It's an absolute blast. Or it would be if it even loaded. Infinite loading screens suck, and having to pay money to stare at a game that doesn't even open is essentially theft. You sold me a defective product. On top of that, I tried to uninstall and reinstall the game to see if it fixed the issue. I'm now being asked to pay twice for a piece of content I've already purchased and own. Is this legit how you treat customers?
game, addictive, Been waiting over 7 years for a sequel to this Amazingly addictive game. Updates need Changelogs. Where is a new game!? I don't wanna play the other games you make I'm only interested in this kind. Lowered stars because no sequel.
game, new, Been waiting over 7 years for a sequel to this Amazingly addictive game. Updates need Changelogs. Where is a new game!? I don't wanna play the other games you make I'm only interested in this kind. Lowered stars because no sequel.
games, other, Been waiting over 7 years for a sequel to this Amazingly addictive game. Updates need Changelogs. Where is a new game!? I don't wanna play the other games you make I'm only interested in this kind. Lowered stars because no sequel.
stars, Lowered, Been waiting over 7 years for a sequel to this Amazingly addictive game. Updates need Changelogs. Where is a new game!? I don't wanna play the other games you make I'm only interested in this kind. Lowered stars because no sequel.
sim, Great, Great sim! Played for hours. Would love a sequel!
money, same, I really wanted to like this game. Unfortunately it is too simple and for the same money there are other more enjoyable games.
games, other, I really wanted to like this game. Unfortunately it is too simple and for the same money there are other more enjoyable games.
games, enjoyable, I really wanted to like this game. Unfortunately it is too simple and for the same money there are other more enjoyable games.
time, everytime, power outage and equipment issues everytime single time I make a game is extremely annoying and pretty unfair.
time, single, power outage and equipment issues everytime single time I make a game is extremely annoying and pretty unfair.
game, Great, Great game before updated.  Now it's too slow even in fast mode to play.  Fix it and five stars
mode, fast, Great game before updated.  Now it's too slow even in fast mode to play.  Fix it and five stars
game, Great, Great game and very addicting. Would love to see new features to the game.
features, new, Great game and very addicting. Would love to see new features to the game.
life, limited, Addicting but with a limited life.
game, fantastic, This is a fantastic game, addictive and rewarding most times. It definitely needs a sequel! It would be great with a more detailed manual or insights into the inner workings of your choices though, and methods to mitigate frustrating rng failures (like buying a battery backup system for those power outages).
game, addictive, This is a fantastic game, addictive and rewarding most times. It definitely needs a sequel! It would be great with a more detailed manual or insights into the inner workings of your choices though, and methods to mitigate frustrating rng failures (like buying a battery backup system for those power outages).
times, most, This is a fantastic game, addictive and rewarding most times. It definitely needs a sequel! It would be great with a more detailed manual or insights into the inner workings of your choices though, and methods to mitigate frustrating rng failures (like buying a battery backup system for those power outages).
manual, detailed, This is a fantastic game, addictive and rewarding most times. It definitely needs a sequel! It would be great with a more detailed manual or insights into the inner workings of your choices though, and methods to mitigate frustrating rng failures (like buying a battery backup system for those power outages).
workings, inner, This is a fantastic game, addictive and rewarding most times. It definitely needs a sequel! It would be great with a more detailed manual or insights into the inner workings of your choices though, and methods to mitigate frustrating rng failures (like buying a battery backup system for those power outages).
failures, frustrating, This is a fantastic game, addictive and rewarding most times. It definitely needs a sequel! It would be great with a more detailed manual or insights into the inner workings of your choices though, and methods to mitigate frustrating rng failures (like buying a battery backup system for those power outages).
system, backup, This is a fantastic game, addictive and rewarding most times. It definitely needs a sequel! It would be great with a more detailed manual or insights into the inner workings of your choices though, and methods to mitigate frustrating rng failures (like buying a battery backup system for those power outages).
games, best, One of the best mobile games.
games, mobile, One of the best mobile games.
game, fantastic, This game is PHENOMENAL! Seriously it is. It's addictive too. Its such a fantastic game. One thing that would make the game better is if you could leave like a review or something for people you hire. For instance I just paid an exorbitant amount of money for someone to doy graphics and they only gave me 6 GRAPHIC POINTS! Like legit I need to do something about that guy even though he's a game character!!! Lol this game is so fun lol.
amount, exorbitant, This game is PHENOMENAL! Seriously it is. It's addictive too. Its such a fantastic game. One thing that would make the game better is if you could leave like a review or something for people you hire. For instance I just paid an exorbitant amount of money for someone to doy graphics and they only gave me 6 GRAPHIC POINTS! Like legit I need to do something about that guy even though he's a game character!!! Lol this game is so fun lol.
lol, fun, This game is PHENOMENAL! Seriously it is. It's addictive too. Its such a fantastic game. One thing that would make the game better is if you could leave like a review or something for people you hire. For instance I just paid an exorbitant amount of money for someone to doy graphics and they only gave me 6 GRAPHIC POINTS! Like legit I need to do something about that guy even though he's a game character!!! Lol this game is so fun lol.
game, new, When will you release a new game on mobile?? Still playing this game after however many years and it's always the first game on a new phone.
years, many, When will you release a new game on mobile?? Still playing this game after however many years and it's always the first game on a new phone.
game, first, When will you release a new game on mobile?? Still playing this game after however many years and it's always the first game on a new phone.
phone, new, When will you release a new game on mobile?? Still playing this game after however many years and it's always the first game on a new phone.
games, few, I love this game one of the very few moble games I'm willing to pay for. They made a great game, worth it.
games, moble, I love this game one of the very few moble games I'm willing to pay for. They made a great game, worth it.
game, great, I love this game one of the very few moble games I'm willing to pay for. They made a great game, worth it.
game, Great, Great game, highly addictive as most of Kairosofts games are.
game, addictive, Great game, highly addictive as most of Kairosofts games are.
game, payed, They added advertisements in a payed game after being purchased without advertising, used to be good but now they just money grabbing with every release. Also some suspicious permissions required.... why does this game need my contacts phone numbers???
permissions, suspicious, They added advertisements in a payed game after being purchased without advertising, used to be good but now they just money grabbing with every release. Also some suspicious permissions required.... why does this game need my contacts phone numbers???
OG, Absolute, Absolute OG
balance, more, Soooooo much better than Game dev Tycoon. Particularly because the game appears to have more balance, and decisions available, unlike Game Dev Tycoon, which seems to be designed to cause bankruptcy.
decisions, available, Soooooo much better than Game dev Tycoon. Particularly because the game appears to have more balance, and decisions available, unlike Game Dev Tycoon, which seems to be designed to cause bankruptcy.
console, actual, More than a time killer. I actually choose to play this on my phone over turning on my actual console sometimes.
successor, spiritual, While it was good in its time. Its spiritual successor Game Dev TYCOON has more features and more challenging than this game. Even though the graphics are way different, I highly recommend buying that game over this. This game did not age well gameplay-wise
features, more, While it was good in its time. Its spiritual successor Game Dev TYCOON has more features and more challenging than this game. Even though the graphics are way different, I highly recommend buying that game over this. This game did not age well gameplay-wise
way, Great, Great way to pass the time! Huge fan of these devs!!
fan, Huge, Great way to pass the time! Huge fan of these devs!!
fun, Pretty, It was Pretty fun
actions, tran, All the games this company makes are great. No mirco-tran actions or time stops, no stupid marketing tricks. Sure the free versions of the games have ads but once you buy the game they are adfree. I've been really enjoying this game dev game and like how they approached choosing generes.I also recommend the game dev game by greenheart games (pc game) totally different game but same concept. Anyway play this game if you support games without mircotranactions! ♥
tricks, stupid, All the games this company makes are great. No mirco-tran actions or time stops, no stupid marketing tricks. Sure the free versions of the games have ads but once you buy the game they are adfree. I've been really enjoying this game dev game and like how they approached choosing generes.I also recommend the game dev game by greenheart games (pc game) totally different game but same concept. Anyway play this game if you support games without mircotranactions! ♥
versions, free, All the games this company makes are great. No mirco-tran actions or time stops, no stupid marketing tricks. Sure the free versions of the games have ads but once you buy the game they are adfree. I've been really enjoying this game dev game and like how they approached choosing generes.I also recommend the game dev game by greenheart games (pc game) totally different game but same concept. Anyway play this game if you support games without mircotranactions! ♥
generes, choosing, All the games this company makes are great. No mirco-tran actions or time stops, no stupid marketing tricks. Sure the free versions of the games have ads but once you buy the game they are adfree. I've been really enjoying this game dev game and like how they approached choosing generes.I also recommend the game dev game by greenheart games (pc game) totally different game but same concept. Anyway play this game if you support games without mircotranactions! ♥
game, different, All the games this company makes are great. No mirco-tran actions or time stops, no stupid marketing tricks. Sure the free versions of the games have ads but once you buy the game they are adfree. I've been really enjoying this game dev game and like how they approached choosing generes.I also recommend the game dev game by greenheart games (pc game) totally different game but same concept. Anyway play this game if you support games without mircotranactions! ♥
concept, same, All the games this company makes are great. No mirco-tran actions or time stops, no stupid marketing tricks. Sure the free versions of the games have ads but once you buy the game they are adfree. I've been really enjoying this game dev game and like how they approached choosing generes.I also recommend the game dev game by greenheart games (pc game) totally different game but same concept. Anyway play this game if you support games without mircotranactions! ♥
finish, able, Everything is great about the game. It's finish able within a day, addictive for a while and isn't pay to win. There's almost no sign of advertising and as far as I'm concerned it is a good little game that isn't complex and passes the time sufficiently. However, the manual for the game isn't specific enough, especially in the more advanced parts of the game like how to get a hardware engineer, and I feel like there should be more in terms of the offices you can move into.
game, good, Everything is great about the game. It's finish able within a day, addictive for a while and isn't pay to win. There's almost no sign of advertising and as far as I'm concerned it is a good little game that isn't complex and passes the time sufficiently. However, the manual for the game isn't specific enough, especially in the more advanced parts of the game like how to get a hardware engineer, and I feel like there should be more in terms of the offices you can move into.
game, little, Everything is great about the game. It's finish able within a day, addictive for a while and isn't pay to win. There's almost no sign of advertising and as far as I'm concerned it is a good little game that isn't complex and passes the time sufficiently. However, the manual for the game isn't specific enough, especially in the more advanced parts of the game like how to get a hardware engineer, and I feel like there should be more in terms of the offices you can move into.
parts, advanced, Everything is great about the game. It's finish able within a day, addictive for a while and isn't pay to win. There's almost no sign of advertising and as far as I'm concerned it is a good little game that isn't complex and passes the time sufficiently. However, the manual for the game isn't specific enough, especially in the more advanced parts of the game like how to get a hardware engineer, and I feel like there should be more in terms of the offices you can move into.
killer, Great, Great time killer
time, fun, Way fun time killer. No pvp, no real time, no internet needed. Stop and start friendly. Great if you find yourself waiting around a lot. Can stop on a moment and not lose anything.
time, real, Way fun time killer. No pvp, no real time, no internet needed. Stop and start friendly. Great if you find yourself waiting around a lot. Can stop on a moment and not lose anything.
way, Super, Super fun way to kill some time. Very simplistic vs Game Dev Tycoon, but it's still a blast.
way, fun, Super fun way to kill some time. Very simplistic vs Game Dev Tycoon, but it's still a blast.
genre, new, It is simple and fun and you can always get back to this game and find a new genre and new combination to try
excitement, same, The touch controls are weird, but that's all kairosoft games. Gets too grindy too quickly without the same excitement of game dev tycoon.
sim, classic, Kairosofts classic game dev sim. Hours and hours of fun, the occasional blackout will make you tear your hair out. Really enjoyed it
blackout, occasional, Kairosofts classic game dev sim. Hours and hours of fun, the occasional blackout will make you tear your hair out. Really enjoyed it
games, best, One of the best games on mobile but needed challenges, more in depth creation system for those wanting that extra challenge, either played have played this every year or so and is always enjoyable
challenges, mobile, One of the best games on mobile but needed challenges, more in depth creation system for those wanting that extra challenge, either played have played this every year or so and is always enjoyable
system, more, One of the best games on mobile but needed challenges, more in depth creation system for those wanting that extra challenge, either played have played this every year or so and is always enjoyable
challenge, extra, One of the best games on mobile but needed challenges, more in depth creation system for those wanting that extra challenge, either played have played this every year or so and is always enjoyable
buildings, more, There should be more buildings you could move into
game, Super, Super fun Little game, my only complaint is that is too damn short, pretty much ends 10 years ago and there's no new hardware to develop games. Could use real competition between companies, maybe next version.
game, fun, Super fun Little game, my only complaint is that is too damn short, pretty much ends 10 years ago and there's no new hardware to develop games. Could use real competition between companies, maybe next version.
game, Little, Super fun Little game, my only complaint is that is too damn short, pretty much ends 10 years ago and there's no new hardware to develop games. Could use real competition between companies, maybe next version.
complaint, only, Super fun Little game, my only complaint is that is too damn short, pretty much ends 10 years ago and there's no new hardware to develop games. Could use real competition between companies, maybe next version.
hardware, new, Super fun Little game, my only complaint is that is too damn short, pretty much ends 10 years ago and there's no new hardware to develop games. Could use real competition between companies, maybe next version.
competition, real, Super fun Little game, my only complaint is that is too damn short, pretty much ends 10 years ago and there's no new hardware to develop games. Could use real competition between companies, maybe next version.
version, next, Super fun Little game, my only complaint is that is too damn short, pretty much ends 10 years ago and there's no new hardware to develop games. Could use real competition between companies, maybe next version.
games, finest, Easily one of the finest games Kairosoft has ever put into the mobile gaming world.
gaming, mobile, Easily one of the finest games Kairosoft has ever put into the mobile gaming world.
game, Great, Great game. Needs a more defined goal though. Challenges etc. I know this won't happen as the game is old, but that would have made it more replayable.
goal, defined, Great game. Needs a more defined goal though. Challenges etc. I know this won't happen as the game is old, but that would have made it more replayable.
gameplay, Pointless, I don't get it. Pointless gameplay. No meaningful decisions, no challenge, just clicker like progression. I guess this is as good as mobile gaming gets
decisions, meaningful, I don't get it. Pointless gameplay. No meaningful decisions, no challenge, just clicker like progression. I guess this is as good as mobile gaming gets
gaming, mobile, I don't get it. Pointless gameplay. No meaningful decisions, no challenge, just clicker like progression. I guess this is as good as mobile gaming gets
money, worth, Played this game a lot definitely my money's worth BEST GAME EVER
years, first, Simple to learn and a lot of fun, but it gets too easy after a while. The story timeline is 20 years (about 6hrs if you play straight through), and the first 10 years is exciting and challenging with new consoles being released at a frenetic pace, forcing you to carefully consider your budget and market share of each platform. But after 10yrs everything slows down and if you figured out 1 or 2 successful genres you can just release sequels continuously and get the same returns every time.
consoles, new, Simple to learn and a lot of fun, but it gets too easy after a while. The story timeline is 20 years (about 6hrs if you play straight through), and the first 10 years is exciting and challenging with new consoles being released at a frenetic pace, forcing you to carefully consider your budget and market share of each platform. But after 10yrs everything slows down and if you figured out 1 or 2 successful genres you can just release sequels continuously and get the same returns every time.
pace, frenetic, Simple to learn and a lot of fun, but it gets too easy after a while. The story timeline is 20 years (about 6hrs if you play straight through), and the first 10 years is exciting and challenging with new consoles being released at a frenetic pace, forcing you to carefully consider your budget and market share of each platform. But after 10yrs everything slows down and if you figured out 1 or 2 successful genres you can just release sequels continuously and get the same returns every time.
genres, successful, Simple to learn and a lot of fun, but it gets too easy after a while. The story timeline is 20 years (about 6hrs if you play straight through), and the first 10 years is exciting and challenging with new consoles being released at a frenetic pace, forcing you to carefully consider your budget and market share of each platform. But after 10yrs everything slows down and if you figured out 1 or 2 successful genres you can just release sequels continuously and get the same returns every time.
returns, same, Simple to learn and a lot of fun, but it gets too easy after a while. The story timeline is 20 years (about 6hrs if you play straight through), and the first 10 years is exciting and challenging with new consoles being released at a frenetic pace, forcing you to carefully consider your budget and market share of each platform. But after 10yrs everything slows down and if you figured out 1 or 2 successful genres you can just release sequels continuously and get the same returns every time.
