NOUN, ADJ, 
game, Super, Super fun game, good tactics, easy to play!
game, easy, Super fun game, good tactics, easy to play!
tactics, good, Super fun game, good tactics, easy to play!
game, little, Fun little game
shoppes, micro, 1star supershort needs more micro shoppes
drawer, Top, Top drawer 🤙🏿
decisions, top, Very fun, once you get the hang of it you'll be making top notch decisions in no time.
decisions, notch, Very fun, once you get the hang of it you'll be making top notch decisions in no time.
game, Great, Great game but wish they were more consoles to make games for
consoles, more, Great game but wish they were more consoles to make games for
prize, grand, Been having tons of fun. Finally got a grand prize.
strategies, new, It is very addicting. Keeps you playing and trying new strategies and employees. Hard to resist the urge to not look up tips online. But for the true gaming experience, be prepared to try a lot of different combos.
experience, true, It is very addicting. Keeps you playing and trying new strategies and employees. Hard to resist the urge to not look up tips online. But for the true gaming experience, be prepared to try a lot of different combos.
combos, different, It is very addicting. Keeps you playing and trying new strategies and employees. Hard to resist the urge to not look up tips online. But for the true gaming experience, be prepared to try a lot of different combos.
game, Great, Great game!
score, prior, I have played this game for years and always come back to beat my prior score and/or win Game Of The Year faster. It's always a challenge finding the right combination of staff, leveling and training them up.
combination, right, I have played this game for years and always come back to beat my prior score and/or win Game Of The Year faster. It's always a challenge finding the right combination of staff, leveling and training them up.
game, great, Still a great game after many years!
years, many, Still a great game after many years!
bit, repetitive, Addicting but limited I have a lot of fun playing. It's addicting but after a bit very repetitive. I would love to be able to carry a person I've hired from one play through to the next, or have more variety in the game play loop. But overall, it's a fun mindless game to play.
variety, more, Addicting but limited I have a lot of fun playing. It's addicting but after a bit very repetitive. I would love to be able to carry a person I've hired from one play through to the next, or have more variety in the game play loop. But overall, it's a fun mindless game to play.
game, mindless, Addicting but limited I have a lot of fun playing. It's addicting but after a bit very repetitive. I would love to be able to carry a person I've hired from one play through to the next, or have more variety in the game play loop. But overall, it's a fun mindless game to play.
game, lighthearted, Fun and lighthearted game
hole, Black, Black hole
goes, few, Loved it took a few goes to get going but I'm glued to it now
fun, much, So much fun!
killer, Great, Great time killer, well thought out.
prize, grand, Won the grand prize
challenge, new, It's addicting until you get the hang of it. After that, making the #1 game becomes easy. I wish there was a new challenge. All my staff are max level and can get 200 in every category.
play, Great, Great game play
fun, Super, Super fun and simple. Almost addicting!! ;_;
game, Amazing, Amazing game! I can't put it down.
game, Amazing, Amazing game very addictive 😁
😁, addictive, Amazing game very addictive 😁
time, entire, Game is fun and addicting. Didn't take long to complete a game, but keeps you hooked the entire time.
variety, more, Fun game needs to have more character variety bigger offices more game options but fun game
offices, bigger, Fun game needs to have more character variety bigger offices more game options but fun game
options, more, Fun game needs to have more character variety bigger offices more game options but fun game
game, fun, Fun game needs to have more character variety bigger offices more game options but fun game
options, more, No ads to break game play. Keeps you busy for a while; I wish there were more customization options.
game, Great, Great game..... killed to much time
time, much, Great game..... killed to much time
game, same, It's Game Dev Story, the same game I fell in love with over a decade ago. No game has managed to quite match its charm and formula since, but at the same time it's certainly showing its age. This is one of the best and most venerable games on mobile, but it could use an expansion or sequel.
time, same, It's Game Dev Story, the same game I fell in love with over a decade ago. No game has managed to quite match its charm and formula since, but at the same time it's certainly showing its age. This is one of the best and most venerable games on mobile, but it could use an expansion or sequel.
games, best, It's Game Dev Story, the same game I fell in love with over a decade ago. No game has managed to quite match its charm and formula since, but at the same time it's certainly showing its age. This is one of the best and most venerable games on mobile, but it could use an expansion or sequel.
game, entertaining, Pretty entertaining game although it feels fairly limited and repetitive at times, could be better in a few ways but overall, it's a good way to pass some time.
ways, few, Pretty entertaining game although it feels fairly limited and repetitive at times, could be better in a few ways but overall, it's a good way to pass some time.
way, good, Pretty entertaining game although it feels fairly limited and repetitive at times, could be better in a few ways but overall, it's a good way to pass some time.
fun, much, so much fun
game, fun, It's a fun game and easily passes the time.
one, second, Love this game played it on and off since it first came out. Just wish they would either add to the game, or release a second one. Perfect game for when you have nothing else going on! Please add content or make a sequel!
game, Perfect, Love this game played it on and off since it first came out. Just wish they would either add to the game, or release a second one. Perfect game for when you have nothing else going on! Please add content or make a sequel!
addicting, Pretty, Pretty addicting
combo, winning, Love this game since I was really young, but somethings that would be better is that you can create sequels earlier. Just because if you find a winning combo then it is just harder to use it again.
game, Excellent, Excellent game to pass the time. The only part of the game I don't quite like is having to really guess what combinations work sometimes rather than what makes sense.
part, only, Excellent game to pass the time. The only part of the game I don't quite like is having to really guess what combinations work sometimes rather than what makes sense.
mix, right, Keep coming back to this game, which is rare for me. Has just the right mix for me.
way, simple, Fun and simple way to simulate being an incredibly wealthy and successful game development company.
company, wealthy, Fun and simple way to simulate being an incredibly wealthy and successful game development company.
days, few, I'm a fan Kairosoft games and have played several of their games and loved them, but this one gets a bit boring after a while. The tasks are quite repetitive so I find myself bored after a few days of playing this.
time, more, Not gonna lie, i spend more time on here then i do my console and pc games!!!
game, Great, Great game to pass the time!
time, long, This game I been playing on and off for a long time. I absolutely love it and finally won the million dollar ceremony. Thank you so much for the amazing game. I hope that someday there will be a sequel to it. P.s. Much love Joefraust!
game, amazing, This game I been playing on and off for a long time. I absolutely love it and finally won the million dollar ceremony. Thank you so much for the amazing game. I hope that someday there will be a sequel to it. P.s. Much love Joefraust!
love, Much, This game I been playing on and off for a long time. I absolutely love it and finally won the million dollar ceremony. Thank you so much for the amazing game. I hope that someday there will be a sequel to it. P.s. Much love Joefraust!
game, Great, Great game
killer, great, This game is a great time killer. Easy mechanics combined with quick results makes for a fun game that I can stay glued to for hours.
mechanics, Easy, This game is a great time killer. Easy mechanics combined with quick results makes for a fun game that I can stay glued to for hours.
results, quick, This game is a great time killer. Easy mechanics combined with quick results makes for a fun game that I can stay glued to for hours.
game, fun, This game is a great time killer. Easy mechanics combined with quick results makes for a fun game that I can stay glued to for hours.
way, Great, Love this game. Great way to pass the time.
time, 3rd, 3rd time over many years playing this through. Kairosoft always equals fun forever
years, many, 3rd time over many years playing this through. Kairosoft always equals fun forever
strategy, classic, A classic strategy RPG from back in the day. It's still as fun as ever and runs perfectly on the new android phones.
phones, new, A classic strategy RPG from back in the day. It's still as fun as ever and runs perfectly on the new android phones.
phones, android, A classic strategy RPG from back in the day. It's still as fun as ever and runs perfectly on the new android phones.
game, Great, Great game
game, Good, Good game, I hope othergames will be for free, so I can play more games like this
games, more, Good game, I hope othergames will be for free, so I can play more games like this
game, fun, Really fun game. Redownloaded it cause its been a while and ive stayed up way too late playing it.
playthrough, new, Played this game 3 times and I love it like it's a new playthrough every single time!
time, single, Played this game 3 times and I love it like it's a new playthrough every single time!
issues, minor, Some minor issues but great
Hours, worth, Hours of fun, worth the money for sure.
game, Great, Great game. Played it for years and have always enjoyed it.
screen, full, Very fun, but please update to fill motorola atrix full screen pleasee
game, Great, Great game
game, favorite, My favorite game on Android!
rate, perfect, The frame rate, once perfect on my Galaxy Nexus and Droid X, is abysmal on my newer, faster Note 4. This is pretty heartbreaking with nothing running in the background and my settings set to "Performance." Update: Smooth as butter!
offices, bigger, I adore this game. Would have given it 5 stars if I could have moved to bigger offices more than twice. Some of the consoles that other developers bring out are a little too pricey for someone who knows nothing about game genres and direction, and I completed the game before I had even had chance to hire a hardware engineer to build my own console. However, once the game is completed you can still play on or you can start again with some of your achievements making next time round easier.
developers, other, I adore this game. Would have given it 5 stars if I could have moved to bigger offices more than twice. Some of the consoles that other developers bring out are a little too pricey for someone who knows nothing about game genres and direction, and I completed the game before I had even had chance to hire a hardware engineer to build my own console. However, once the game is completed you can still play on or you can start again with some of your achievements making next time round easier.
console, own, I adore this game. Would have given it 5 stars if I could have moved to bigger offices more than twice. Some of the consoles that other developers bring out are a little too pricey for someone who knows nothing about game genres and direction, and I completed the game before I had even had chance to hire a hardware engineer to build my own console. However, once the game is completed you can still play on or you can start again with some of your achievements making next time round easier.
time, next, I adore this game. Would have given it 5 stars if I could have moved to bigger offices more than twice. Some of the consoles that other developers bring out are a little too pricey for someone who knows nothing about game genres and direction, and I completed the game before I had even had chance to hire a hardware engineer to build my own console. However, once the game is completed you can still play on or you can start again with some of your achievements making next time round easier.
game, Great, Great game
game, cute, this is a really cute and addictive game, I remember playing this with my friends back when I was 8 I think. it's still just as fun as I remember it <3
reactions, different, Fun game, noticed different company reactions to your own. In one playthrough two companies were developing many consoles and in the other those consoles were discontinued while mine dominated the industry. Fun to play, easy to pickup
consoles, many, Fun game, noticed different company reactions to your own. In one playthrough two companies were developing many consoles and in the other those consoles were discontinued while mine dominated the industry. Fun to play, easy to pickup
Fun, easy, Fun game, noticed different company reactions to your own. In one playthrough two companies were developing many consoles and in the other those consoles were discontinued while mine dominated the industry. Fun to play, easy to pickup
gameplay, Epic, Epic gameplay
game, First, First game I ever played of theirs and it's still amazing to this day. I want a sequel to this
game, Great, Great game!
game, old, Fun. Reminds of the old Lionhead Studios game The Movies.
games, best, One of the best games ever!
game, Great, Great game for what it is. Play it on and off and it never fails to get me hooked
game, great, This is a great game, I have been on it off and on for years but know they really need to add some new stuff to it.
stuff, new, This is a great game, I have been on it off and on for years but know they really need to add some new stuff to it.
killer, Good, Good time killer
time, Great, Great time with this
fun, simple, Honestly just simple fun what more can you ask for!!!
game, fun, Its a fun little game. The only thing i would pike is that tou could research new game types and genres instead of having to keep making game to levep up in the hopes of learning new categories or gaining points to invest in your games.
game, little, Its a fun little game. The only thing i would pike is that tou could research new game types and genres instead of having to keep making game to levep up in the hopes of learning new categories or gaining points to invest in your games.
thing, only, Its a fun little game. The only thing i would pike is that tou could research new game types and genres instead of having to keep making game to levep up in the hopes of learning new categories or gaining points to invest in your games.
types, new, Its a fun little game. The only thing i would pike is that tou could research new game types and genres instead of having to keep making game to levep up in the hopes of learning new categories or gaining points to invest in your games.
categories, new, Its a fun little game. The only thing i would pike is that tou could research new game types and genres instead of having to keep making game to levep up in the hopes of learning new categories or gaining points to invest in your games.
fun, Perfect, Perfect bite-sized fun
fun, sized, Perfect bite-sized fun
time, fun, It's a fun time waster with many combo options for games, to discover.
options, many, It's a fun time waster with many combo options for games, to discover.
games, favorite, I love Game dev story! It's one of my most favorite games of all time and I've made two consoles and 43 games but my only complaint is that when you make a console you can't choose how it looks and when I made my second portable console it looked the same as the first one I made (The fist and second one looked really weird), and when you update the game again (if you do and please still update the game, many people love) could u make it so you can either change your office layout or customizeit
complaint, only, I love Game dev story! It's one of my most favorite games of all time and I've made two consoles and 43 games but my only complaint is that when you make a console you can't choose how it looks and when I made my second portable console it looked the same as the first one I made (The fist and second one looked really weird), and when you update the game again (if you do and please still update the game, many people love) could u make it so you can either change your office layout or customizeit
console, second, I love Game dev story! It's one of my most favorite games of all time and I've made two consoles and 43 games but my only complaint is that when you make a console you can't choose how it looks and when I made my second portable console it looked the same as the first one I made (The fist and second one looked really weird), and when you update the game again (if you do and please still update the game, many people love) could u make it so you can either change your office layout or customizeit
console, portable, I love Game dev story! It's one of my most favorite games of all time and I've made two consoles and 43 games but my only complaint is that when you make a console you can't choose how it looks and when I made my second portable console it looked the same as the first one I made (The fist and second one looked really weird), and when you update the game again (if you do and please still update the game, many people love) could u make it so you can either change your office layout or customizeit
one, first, I love Game dev story! It's one of my most favorite games of all time and I've made two consoles and 43 games but my only complaint is that when you make a console you can't choose how it looks and when I made my second portable console it looked the same as the first one I made (The fist and second one looked really weird), and when you update the game again (if you do and please still update the game, many people love) could u make it so you can either change your office layout or customizeit
people, many, I love Game dev story! It's one of my most favorite games of all time and I've made two consoles and 43 games but my only complaint is that when you make a console you can't choose how it looks and when I made my second portable console it looked the same as the first one I made (The fist and second one looked really weird), and when you update the game again (if you do and please still update the game, many people love) could u make it so you can either change your office layout or customizeit
game, great, It's a great mobile Sim game. This was Karisoft at its best, before they charged a premium PLUS IAP! Sad how greedy they have become..
game, mobile, It's a great mobile Sim game. This was Karisoft at its best, before they charged a premium PLUS IAP! Sad how greedy they have become..
representation, accurate, I love this game its an accurate representation of actual games but wish they would update it with more upto date consoles
games, actual, I love this game its an accurate representation of actual games but wish they would update it with more upto date consoles
consoles, more, I love this game its an accurate representation of actual games but wish they would update it with more upto date consoles
way, best, Addictive in the best way. On my fourth play through now I think! Edit: seems to run slower now that I have upgraded to android 5 (lollipop). Still, an awesome game!
play, fourth, Addictive in the best way. On my fourth play through now I think! Edit: seems to run slower now that I have upgraded to android 5 (lollipop). Still, an awesome game!
game, awesome, Addictive in the best way. On my fourth play through now I think! Edit: seems to run slower now that I have upgraded to android 5 (lollipop). Still, an awesome game!
hours, more, Put more hours into this than I would like to admit
games, favorite, One of my favorite mobile games of all time. Simple but so much fun!
games, mobile, One of my favorite mobile games of all time. Simple but so much fun!
fun, Simple, One of my favorite mobile games of all time. Simple but so much fun!
energy, mental, This is my favorites game of theirs. Not complicated and great to play when you dont want to use a lot of mental energy.
skin, white, this dev never met a character model they wouldn't always set to white skin
fun, great, This game is great fun to play as is the Kairosoft way thourly enjoyable, no problems with the game play, I only wish that I could give names to the games I develop, nonetheless five stars!
way, enjoyable, This game is great fun to play as is the Kairosoft way thourly enjoyable, no problems with the game play, I only wish that I could give names to the games I develop, nonetheless five stars!
game, Great, Great game to kill some time
going, Slow, Slow going and every time scores get high, blackout. It's almost purposely not fun
blackout, high, Slow going and every time scores get high, blackout. It's almost purposely not fun
games, fun, To me, this is one of the most fun games. I just wish there was more to do. Also, I decided to see what the 1 star reviews were and a ton of then were dumb. I saw that a lot of people were saying that they uninstalled it or they were on a different phone and then when they went to install it again, it said that they have to pay again. That's probably google a google problem, not something they did. Another was saying that there is ads, when there isn't. I would say more but I ran out of letters
phone, different, To me, this is one of the most fun games. I just wish there was more to do. Also, I decided to see what the 1 star reviews were and a ton of then were dumb. I saw that a lot of people were saying that they uninstalled it or they were on a different phone and then when they went to install it again, it said that they have to pay again. That's probably google a google problem, not something they did. Another was saying that there is ads, when there isn't. I would say more but I ran out of letters
gameplay, Repetitive, Repetitive gameplay
game, alright, Its alright game to kill some time but needs to be extended past year 20 and more buildings to move into but all the updates are all just for different languages i had loads of fun with this game
languages, different, Its alright game to kill some time but needs to be extended past year 20 and more buildings to move into but all the updates are all just for different languages i had loads of fun with this game
games, best, One of the best mobile games.
games, mobile, One of the best mobile games.
maintenance, low, It's a really low-maintenance game that's I've had a ton of fun playing through.
game, fun, It's a fun game. But the frequency at which random accidents (equipment failure, power outage, etc.) occur is literally every game. At least once sometimes twice. Which makes it almost impossible to get a hall of fame game
accidents, random, It's a fun game. But the frequency at which random accidents (equipment failure, power outage, etc.) occur is literally every game. At least once sometimes twice. Which makes it almost impossible to get a hall of fame game
tutorial, Boring, Boring, no tutorial
game, Fantastic, Fantastic game, one of the Android legends. This game definitely deserves a remake one day. Brings back memories.
fun, super, I love this game, just like I love all Kairosoft games. It's super fun, but mind you it's ridiculously addictive.
engineer, maxxed, I don't understand how I can get an "amazing!" Combo and my level 5 (maxxed) sound engineer only give a me 5 for music. That can't be right but I never get >10 for sound graphics etc initially
graphics, sound, I don't understand how I can get an "amazing!" Combo and my level 5 (maxxed) sound engineer only give a me 5 for music. That can't be right but I never get >10 for sound graphics etc initially
time, great, Absolutely love this game. Been playing it on repeat for years. Fun and a great time waster. I'd love a few more updates, nothing major just another office upgrade and some new genres maybe. I'd definitely recommend the download!!
updates, more, Absolutely love this game. Been playing it on repeat for years. Fun and a great time waster. I'd love a few more updates, nothing major just another office upgrade and some new genres maybe. I'd definitely recommend the download!!
upgrade, major, Absolutely love this game. Been playing it on repeat for years. Fun and a great time waster. I'd love a few more updates, nothing major just another office upgrade and some new genres maybe. I'd definitely recommend the download!!
genres, new, Absolutely love this game. Been playing it on repeat for years. Fun and a great time waster. I'd love a few more updates, nothing major just another office upgrade and some new genres maybe. I'd definitely recommend the download!!
game, Awesome, Awesome game, I hope more is still to be added for this game was addicting, I'm only at 500,000k money and I still want to do more.
device, other, Please add feature to save player progress on other device with google account, its really hurt whenever I play this game yet always lose the game progress after I uninstall it or re download this game on my other device.
device, other, Please add feature to save player progress on other device with google account, its really hurt whenever I play this game yet always lose the game progress after I uninstall it or re download this game on my other device.
