VERB, PREP, POBJ, 
blown, like, first, Just like the first, Dungeon Village yet again has blown it out if the water, with adorable sprites and animations, and a surprisingly in-depth village-dungeoneering mechanic, this game will have you instantly hooked. Naming the heroes is pretty fun too, helps to identify high level heroes.
going, for, time, Fun game to sink your time into. It is complex enough to keep you going for a long time.
expect, from, addictive, So much fun! Everything you expect from kairosoft - addictive and value for money
put, with, summoner, The game is very engaging with a lot of different class options to work with. I personally like the monster companion engine. It's always nice to put a draggi with a summoner.
guessing, on, lot, Addicting, but some things could definitely use more info on how they work. Just guessing on a lot of things, which is fun in its own way
fixed, on, , they fixed the long load times on lg g7  thank you kairosoft
played, for, first, Have played both the for the first and this game and I just have to say, buy this. The first isn't bad, this one just cleans up every loose ends and roughed up bits. Nice cute visuals, and the gameplay is nice and easy
involved, for, hours, As always, this is a winning pairing or casual and tycoon game that still keeps you involved for hours on end.
put, Like, one, Fantastic sequel. Like the first one, can't put it down!
took, to, level, Where the last game fell short, this one took the game to a whole new level. Worth the money. Karisoft created a masterpiece here. Enjoy and keep on hunting fellow adventures!
spend, for, 5hr, Exciting,I spend my time for 5hr when I get lockdown at home. If you looking for interesting game this game is one choice.
lockdown, at, home, Exciting,I spend my time for 5hr when I get lockdown at home. If you looking for interesting game this game is one choice.
looking, for, game, Exciting,I spend my time for 5hr when I get lockdown at home. If you looking for interesting game this game is one choice.
get, on, end, Love kairosoft games, loved dungeon village 1... this one is no exception. Numerous cool new features to get you hooked for hours more on end than ever before. Definitely worth buying.
hooked, for, hours, Love kairosoft games, loved dungeon village 1... this one is no exception. Numerous cool new features to get you hooked for hours more on end than ever before. Definitely worth buying.
sleeping, for, night, I forgot sleeping for a night playing this game. I find it is challenging when the town reach 3 stars and above. Each year passes very quick and there are several things to plan and invest. I find this game is much relax since it no require combo, which sometime it really time consuming rather than just enjoy the game.
relax, since, it, I forgot sleeping for a night playing this game. I find it is challenging when the town reach 3 stars and above. Each year passes very quick and there are several things to plan and invest. I find this game is much relax since it no require combo, which sometime it really time consuming rather than just enjoy the game.
recommend, to, others, It took a little bit to get an understanding of it. However once you grasp it, then it become quite enjoyable. I would recommend it to others.
Increase, on, value, A solid update to the original. Mostly the same game, but with enough new activities to keep it interesting. Increase on replay value is a huge plus
have, from, fan, Nice ver. Hope next ver. have more feature as this one :) from this game fan.
displayed, for, milestones, Popup advice: remove the town point pop-ups and reward those points autonomously. The common complaint is that there are too many popups. This specific popup isn't needed. There's already a notification displayed for town point milestones. Removing these should fix the too many popups complaint in my opinion.
fix, in, opinion, Popup advice: remove the town point pop-ups and reward those points autonomously. The common complaint is that there are too many popups. This specific popup isn't needed. There's already a notification displayed for town point milestones. Removing these should fix the too many popups complaint in my opinion.
build, into, town, It's entertaining enough to buy. Fun to build up a little village into a booming town
look, without, pop, It's a solid upgrade from dungeon village 1, however once you get to around a 4 star village you can't even look away from your phone without a pop-up pausing your game to tell you something mundane, really frustrating after awhile.
took, for, while, Really fun Kairosoft game! Been a fan for years, took a break for a while, and so glad this was one of the first I tried when I came back.
Lasted, about, week, Had a good time. Lasted me about a week.
improves, in, way, Great game, improves the first in every way!
had, with, game, I cannot explain how much fun I had with this game. I'm a huge Kairosoft fan in general, but this one blew me away. Great work!
finished, with, 5stars, just finished my first town with 5stars there for this review is for 5stars. like all there games it's a simple concept and they expand on it further slow and steady love it 
expand, on, it, just finished my first town with 5stars there for this review is for 5stars. like all there games it's a simple concept and they expand on it further slow and steady love it 
improved, on, iteration, This game is fantastic! So much improved on the last iteration. Great job Kairosoft!! 
move, to, settlements, Fun time killing app, a lot of characters and the option to move to new settlements was a pleasant surprise.
looking, for, something, Amazing game been looking for something like this for a long time. Really fun game.
looking, for, time, Amazing game been looking for something like this for a long time. Really fun game.
enjoy, during, map, Games is fun and addictive. I enjoy the most during the 1st map, subsequent map is relatively similar with added difficulties. A little expensive for a mobile app that last me 3 days.
spent, on, couch, Literally spent hours on the couch enjoying this game. So easy to play!
upgrade, from, version, So much to do! Much upgrade from the earlier version
brings, to, table, Simply phenomenal! This game brings a lot to the table and I have only just begun! Love the way each character can do multiple jobs and become stronger and stronger! I am still trying to figure out how to make my income positive instead of being in deficit most of the times, but I guess that's one of the beauty of the game: You are free to do as you wish! Build, destroy, rearrange and go out there and kill some monsters and raid some dungeons!
Picked, on, whim, Picked this up on a whim and it's absolutely addicting.
do, for, reading, Brilliant game I absolutely love it the first game was good to but this is it's supreme form love the dungeon village games this game is so fun so much to do thanks for reading!
gating, with, etc, Downloaded this one day out of boredom. Somehow became one of my favorite mobile games to date. Simple design and easy to grasp mechanics. No premium currency/time gating with building/objectives etc. Hands down 10/10 if you're into city or village building sims!
waiting, on, game, Totally worth the money. They add so many small details, if you've played their earlier games, you'll see the improvements on this one. I've always been a Kairosoft fan so definitely gonna be waiting on the next game with just as much, if not more, details on customization with the houses, characters, monsters and placement of things.
waiting, with, much, Totally worth the money. They add so many small details, if you've played their earlier games, you'll see the improvements on this one. I've always been a Kairosoft fan so definitely gonna be waiting on the next game with just as much, if not more, details on customization with the houses, characters, monsters and placement of things.
playing, in, intervals, Fun gameplay, but the popups from in-game events turn me off from playing the game in longer intervals.
gifting, to, adventurer, Fantastic sequel to DV1! The new tamable monsters, multiple towns, traits, jobs and cauldron upgrades are great! My only minus is the amount of "pop-ups" you get, especially after gifting lots of things to an adventurer. But its not bad enough for me personally, so still rating it 5*! Huge fan of Kairosoft games, played them all several times!
allow, to, notifications, Please allow us to disable notifications for popularity, medals and traits. So annoying
go, For, new, This is NOT a sequel to dungeon village, it's a remaster if the original. I loved the original and was excited new content but the first hour or so are almost identical. Exact same shops, minimal change to mechanics, even the items haven't changed. For those new to the franchise, definitely go for it, but if you wanted a different game to the original keep your money.
go, for, it, This is NOT a sequel to dungeon village, it's a remaster if the original. I loved the original and was excited new content but the first hour or so are almost identical. Exact same shops, minimal change to mechanics, even the items haven't changed. For those new to the franchise, definitely go for it, but if you wanted a different game to the original keep your money.
manage, on, time, Great game to play and manage on your free time.
put, with, them, fun game. it's true the pop ups can be annoying however you learn to put up with them over time. Worth the money
put, over, time, fun game. it's true the pop ups can be annoying however you learn to put up with them over time. Worth the money
going, after, that, Couldnt put it down had a set end point but you can keep going after that
loved, like, thanks, I've always been a huge fan of Ksoft games. I loved dungeon village 1 and really like Dv2 thanks for a good game at a rationale price
unwind, after, work, I have had a blast with this game! I didn't expect it to have the level of depth that it does. It's a great way to unwind after work.
Got, by, end, Well worth the few bucks to buy. Got five star village by the end of my second day playing, and think it would be fun to play it again. I see the validity of the complaints about pop-ups. One thing I would suggest is on the pop-up, add a small button to take you to the settings where you can choose to speed up the pop-ups and mute the sound on it.
take, to, settings, Well worth the few bucks to buy. Got five star village by the end of my second day playing, and think it would be fun to play it again. I see the validity of the complaints about pop-ups. One thing I would suggest is on the pop-up, add a small button to take you to the settings where you can choose to speed up the pop-ups and mute the sound on it.
mute, on, it, Well worth the few bucks to buy. Got five star village by the end of my second day playing, and think it would be fun to play it again. I see the validity of the complaints about pop-ups. One thing I would suggest is on the pop-up, add a small button to take you to the settings where you can choose to speed up the pop-ups and mute the sound on it.
