VERB, PREP, POBJ, 
designed, like, game, No ads, pay to win, or gambling mechanics. It is designed like a proper game. Progression is fun and you can develop a connection to individual characters. I did not give a 5-star for the following reasons: - Too many notifications! This has been said by other reviewers and I have to agree 100% Please listen and set most to just be the pop-up ones across the bottom. Some things notify you 3 times and its tiring when the game freezes every few seconds with information you have read 100s of times since the first year. - Menu organization. Facilities organization doesn't make sense there are stores under all categories. Under adventure, quests are the only adventure option the other presents and monsters should be an adventurer tab. There are so many other things on this but that was just a few of them. Just a few other points for Dungeon Village 3. Please make unique attributes for each adventurer. Make adventurers randomly generated and allow them to die if they aren't recovered from the field for a hardcore mode. Change the map for easy monsters close to town and harder monsters further away and make lairs stay on the map and replenish over time. Great working title keep it up!
give, for, reasons, No ads, pay to win, or gambling mechanics. It is designed like a proper game. Progression is fun and you can develop a connection to individual characters. I did not give a 5-star for the following reasons: - Too many notifications! This has been said by other reviewers and I have to agree 100% Please listen and set most to just be the pop-up ones across the bottom. Some things notify you 3 times and its tiring when the game freezes every few seconds with information you have read 100s of times since the first year. - Menu organization. Facilities organization doesn't make sense there are stores under all categories. Under adventure, quests are the only adventure option the other presents and monsters should be an adventurer tab. There are so many other things on this but that was just a few of them. Just a few other points for Dungeon Village 3. Please make unique attributes for each adventurer. Make adventurers randomly generated and allow them to die if they aren't recovered from the field for a hardcore mode. Change the map for easy monsters close to town and harder monsters further away and make lairs stay on the map and replenish over time. Great working title keep it up!
freezes, with, information, No ads, pay to win, or gambling mechanics. It is designed like a proper game. Progression is fun and you can develop a connection to individual characters. I did not give a 5-star for the following reasons: - Too many notifications! This has been said by other reviewers and I have to agree 100% Please listen and set most to just be the pop-up ones across the bottom. Some things notify you 3 times and its tiring when the game freezes every few seconds with information you have read 100s of times since the first year. - Menu organization. Facilities organization doesn't make sense there are stores under all categories. Under adventure, quests are the only adventure option the other presents and monsters should be an adventurer tab. There are so many other things on this but that was just a few of them. Just a few other points for Dungeon Village 3. Please make unique attributes for each adventurer. Make adventurers randomly generated and allow them to die if they aren't recovered from the field for a hardcore mode. Change the map for easy monsters close to town and harder monsters further away and make lairs stay on the map and replenish over time. Great working title keep it up!
read, since, year, No ads, pay to win, or gambling mechanics. It is designed like a proper game. Progression is fun and you can develop a connection to individual characters. I did not give a 5-star for the following reasons: - Too many notifications! This has been said by other reviewers and I have to agree 100% Please listen and set most to just be the pop-up ones across the bottom. Some things notify you 3 times and its tiring when the game freezes every few seconds with information you have read 100s of times since the first year. - Menu organization. Facilities organization doesn't make sense there are stores under all categories. Under adventure, quests are the only adventure option the other presents and monsters should be an adventurer tab. There are so many other things on this but that was just a few of them. Just a few other points for Dungeon Village 3. Please make unique attributes for each adventurer. Make adventurers randomly generated and allow them to die if they aren't recovered from the field for a hardcore mode. Change the map for easy monsters close to town and harder monsters further away and make lairs stay on the map and replenish over time. Great working title keep it up!
recovered, from, field, No ads, pay to win, or gambling mechanics. It is designed like a proper game. Progression is fun and you can develop a connection to individual characters. I did not give a 5-star for the following reasons: - Too many notifications! This has been said by other reviewers and I have to agree 100% Please listen and set most to just be the pop-up ones across the bottom. Some things notify you 3 times and its tiring when the game freezes every few seconds with information you have read 100s of times since the first year. - Menu organization. Facilities organization doesn't make sense there are stores under all categories. Under adventure, quests are the only adventure option the other presents and monsters should be an adventurer tab. There are so many other things on this but that was just a few of them. Just a few other points for Dungeon Village 3. Please make unique attributes for each adventurer. Make adventurers randomly generated and allow them to die if they aren't recovered from the field for a hardcore mode. Change the map for easy monsters close to town and harder monsters further away and make lairs stay on the map and replenish over time. Great working title keep it up!
recovered, for, mode, No ads, pay to win, or gambling mechanics. It is designed like a proper game. Progression is fun and you can develop a connection to individual characters. I did not give a 5-star for the following reasons: - Too many notifications! This has been said by other reviewers and I have to agree 100% Please listen and set most to just be the pop-up ones across the bottom. Some things notify you 3 times and its tiring when the game freezes every few seconds with information you have read 100s of times since the first year. - Menu organization. Facilities organization doesn't make sense there are stores under all categories. Under adventure, quests are the only adventure option the other presents and monsters should be an adventurer tab. There are so many other things on this but that was just a few of them. Just a few other points for Dungeon Village 3. Please make unique attributes for each adventurer. Make adventurers randomly generated and allow them to die if they aren't recovered from the field for a hardcore mode. Change the map for easy monsters close to town and harder monsters further away and make lairs stay on the map and replenish over time. Great working title keep it up!
stay, on, map, No ads, pay to win, or gambling mechanics. It is designed like a proper game. Progression is fun and you can develop a connection to individual characters. I did not give a 5-star for the following reasons: - Too many notifications! This has been said by other reviewers and I have to agree 100% Please listen and set most to just be the pop-up ones across the bottom. Some things notify you 3 times and its tiring when the game freezes every few seconds with information you have read 100s of times since the first year. - Menu organization. Facilities organization doesn't make sense there are stores under all categories. Under adventure, quests are the only adventure option the other presents and monsters should be an adventurer tab. There are so many other things on this but that was just a few of them. Just a few other points for Dungeon Village 3. Please make unique attributes for each adventurer. Make adventurers randomly generated and allow them to die if they aren't recovered from the field for a hardcore mode. Change the map for easy monsters close to town and harder monsters further away and make lairs stay on the map and replenish over time. Great working title keep it up!
replenish, over, time, No ads, pay to win, or gambling mechanics. It is designed like a proper game. Progression is fun and you can develop a connection to individual characters. I did not give a 5-star for the following reasons: - Too many notifications! This has been said by other reviewers and I have to agree 100% Please listen and set most to just be the pop-up ones across the bottom. Some things notify you 3 times and its tiring when the game freezes every few seconds with information you have read 100s of times since the first year. - Menu organization. Facilities organization doesn't make sense there are stores under all categories. Under adventure, quests are the only adventure option the other presents and monsters should be an adventurer tab. There are so many other things on this but that was just a few of them. Just a few other points for Dungeon Village 3. Please make unique attributes for each adventurer. Make adventurers randomly generated and allow them to die if they aren't recovered from the field for a hardcore mode. Change the map for easy monsters close to town and harder monsters further away and make lairs stay on the map and replenish over time. Great working title keep it up!
having, with, game, Addicting, but no ads to be invasive. I'm having more fun with the $7 game right now then the $20 one I bought on pc
paid, for, it, Fantastic, i love how my adventures can get pet monsters and theres replay-ability. Once one town is maxed out, you can make a new town to expand your territory. I love it so much. Well worth the money i paid for it.
improves, on, original, Fun game. Definitely improves on the original
waste, on, phone, I've played a few Kairosoft games, but this is one has been my favorite so far. Plenty of content for such a cheap price, and no microtransactions. Just a fun way to waste time on your phone.
lost, in, world, Blissfully lost in this cute world.
had, as, pop, Its a good time waster. The only thing i dont like is the constant awards slowing everything down. If they had it as a little pop up that was translusant so i could read it and go on it would be better.
go, on, it, Its a good time waster. The only thing i dont like is the constant awards slowing everything down. If they had it as a little pop up that was translusant so i could read it and go on it would be better.
keeping, on, games, After quite some time of not keeping myself up to date on kairosoft games i still bought this without hesitation. 1. Because kairosoft. 2. Dungeon village part 2! This is such a huge upgrade from the first one. Tons of gameplay! It has different maps to explore while still keeping your progress. Jobs facilities adventurers still remain while there's new ones unlock on the next map. Overall it's another good one from kairosoft. Now I'm hoping to see Ninja Village 2!
bought, After, time, After quite some time of not keeping myself up to date on kairosoft games i still bought this without hesitation. 1. Because kairosoft. 2. Dungeon village part 2! This is such a huge upgrade from the first one. Tons of gameplay! It has different maps to explore while still keeping your progress. Jobs facilities adventurers still remain while there's new ones unlock on the next map. Overall it's another good one from kairosoft. Now I'm hoping to see Ninja Village 2!
bought, without, hesitation, After quite some time of not keeping myself up to date on kairosoft games i still bought this without hesitation. 1. Because kairosoft. 2. Dungeon village part 2! This is such a huge upgrade from the first one. Tons of gameplay! It has different maps to explore while still keeping your progress. Jobs facilities adventurers still remain while there's new ones unlock on the next map. Overall it's another good one from kairosoft. Now I'm hoping to see Ninja Village 2!
living, in, it, This is a fun, interactive game to play when you get some downtime. It pauses when you leave the game so you always start off where you left things. I love how you can customize your town and the people living in it!
played, for, hours, Kairosoft are so good at strategy mobile games. This is another one that has me hooked! I was only disappointed to see the end game material operates slightly differently, however, it's a game that can be played for hours without too much stress or strain!
played, without, stress, Kairosoft are so good at strategy mobile games. This is another one that has me hooked! I was only disappointed to see the end game material operates slightly differently, however, it's a game that can be played for hours without too much stress or strain!
Seems, like, seconds, I loved this game as much as the first version. The reason I didn't give 5* is because there is an excessive amount of in-game notifications/messages that pop up. Seems like every 10 seconds a congratulations would come up on screen for a mundane task. I'd recommend for the developers to reduce these so you can actually play the game
come, on, screen, I loved this game as much as the first version. The reason I didn't give 5* is because there is an excessive amount of in-game notifications/messages that pop up. Seems like every 10 seconds a congratulations would come up on screen for a mundane task. I'd recommend for the developers to reduce these so you can actually play the game
come, for, task, I loved this game as much as the first version. The reason I didn't give 5* is because there is an excessive amount of in-game notifications/messages that pop up. Seems like every 10 seconds a congratulations would come up on screen for a mundane task. I'd recommend for the developers to reduce these so you can actually play the game
lose, in, them, I have always loved Kairosoft's little rpg management games. There's always so much to do, classes and places to explore, and you can lose yourself in them for hours. They were starting to head to the horrible freemium/wi-fi connection format so many use, but thankfully it looks like they have abandoned the abomination of a platform. Stay awesome Kairosoft. I'll happily buy these little gems you make for $6-7 a pop.
lose, for, hours, I have always loved Kairosoft's little rpg management games. There's always so much to do, classes and places to explore, and you can lose yourself in them for hours. They were starting to head to the horrible freemium/wi-fi connection format so many use, but thankfully it looks like they have abandoned the abomination of a platform. Stay awesome Kairosoft. I'll happily buy these little gems you make for $6-7 a pop.
head, to, format, I have always loved Kairosoft's little rpg management games. There's always so much to do, classes and places to explore, and you can lose yourself in them for hours. They were starting to head to the horrible freemium/wi-fi connection format so many use, but thankfully it looks like they have abandoned the abomination of a platform. Stay awesome Kairosoft. I'll happily buy these little gems you make for $6-7 a pop.
make, for, 6, I have always loved Kairosoft's little rpg management games. There's always so much to do, classes and places to explore, and you can lose yourself in them for hours. They were starting to head to the horrible freemium/wi-fi connection format so many use, but thankfully it looks like they have abandoned the abomination of a platform. Stay awesome Kairosoft. I'll happily buy these little gems you make for $6-7 a pop.
gets, around, game, Hard at first then it gets easier all around fun game and you want stop playing it
's, in, purchases, So fare its been fun I've played 2 le els so fare but its a grate game in my book well worth the money love that there's no adds or in app purchases
wait, for, animations, Good game. The biggest flaw are the pop up dialogs. It pauses the game and forces you to wait for the animations and click through. Very annoying.
is, than, one, Love this game! There is more to do than the first one, so even more awesome!
Returning, to, gameplay, Great game! Returning to the old kairosoft gameplay is always the best. Good job dev team!
doing, by, 2nd, Animations seriously have to be skippable. At least by 2nd, 3rd city when you are already doing more or less the same thing it is sooo annoying watching everyone leave for a quest for 2000th time or using items or using the cauldron. Make it skippable in settings!!!
doing, by, city, Animations seriously have to be skippable. At least by 2nd, 3rd city when you are already doing more or less the same thing it is sooo annoying watching everyone leave for a quest for 2000th time or using items or using the cauldron. Make it skippable in settings!!!
leave, for, quest, Animations seriously have to be skippable. At least by 2nd, 3rd city when you are already doing more or less the same thing it is sooo annoying watching everyone leave for a quest for 2000th time or using items or using the cauldron. Make it skippable in settings!!!
enjoyed, for, years, Another great hit from Kairosoft. I've enjoyed these games for years and I'm proud to be a fan.
play, without, thought, Kairosoft again, come a second version of Dungeon Village. One of my favourite. Bought n play without second thought. Another sleepless nights
lost, by, time, The startup loading is so long that by the time I'm halfway through I already lost interest in playing. A mobile game should not load for this long every single time
load, for, time, The startup loading is so long that by the time I'm halfway through I already lost interest in playing. A mobile game should not load for this long every single time
change, for, customization, This game is pretty cute honestly. I enjoy renaming but I do wish you could change their looks a bit for full customization along with chromas for costumes. Overall the same is great.
change, for, costumes, This game is pretty cute honestly. I enjoy renaming but I do wish you could change their looks a bit for full customization along with chromas for costumes. Overall the same is great.
Spent, on, game, Spent more time on this game than I thought I would. Managing your own town and group of adventurers is fun!
deal, with, this, I have enjoyed playing this game, but if you don't like games that constantly make pop ups then you might not find it as enjoyable. Here's an example of what I mean provided you have a monster tamer : new dungeon, completed dungeon, [monster name] wants to join you, get a metal, [monster name] wants revenge, a new monster has appeared, [adventurer] want a house, [adventurer] house completed, and you have to deal with this every 30 seconds or so. Over all I have enjoyed playing this game.
enjoyed, Over, all, I have enjoyed playing this game, but if you don't like games that constantly make pop ups then you might not find it as enjoyable. Here's an example of what I mean provided you have a monster tamer : new dungeon, completed dungeon, [monster name] wants to join you, get a metal, [monster name] wants revenge, a new monster has appeared, [adventurer] want a house, [adventurer] house completed, and you have to deal with this every 30 seconds or so. Over all I have enjoyed playing this game.
Feels, like, progress, Another hit from Kairosoft. All the sim fun of their other games, with much more endgame content. Feels like progress
help, through, gameplay, Really fun game with a large playground. The progress system is well designed to help you through gameplay while learning about the game for the first time.
learning, about, game, Really fun game with a large playground. The progress system is well designed to help you through gameplay while learning about the game for the first time.
learning, for, time, Really fun game with a large playground. The progress system is well designed to help you through gameplay while learning about the game for the first time.
gets, without, much, Really good, gets repetitive without much being added by the 4th or 5th world. Still had a great time.
loved, about, one, I loved the first one. If you played it then you have to play this one. It has everything I loved about the first one but a million more things. A lot of people commented on on the number of pop up in game. There are a lot but that means you're doing well. The pop ups are tell you things that are going on. And there's alot going on. I just got my first 5 star town. If you've ever played a game like this and liked it then you'll love this game. It's worth every penny
commented, on, number, I loved the first one. If you played it then you have to play this one. It has everything I loved about the first one but a million more things. A lot of people commented on on the number of pop up in game. There are a lot but that means you're doing well. The pop ups are tell you things that are going on. And there's alot going on. I just got my first 5 star town. If you've ever played a game like this and liked it then you'll love this game. It's worth every penny
addicted, to, game, I am thoroughly addicted to this game. I'm on my third town, and I won't stop until the game stops.
spent, on, game, Some of the best money I've spent on a mobile game. Very fun!
adding, to, it, Enamored.. Fun, adorable, and I hope they keeping adding on to it. 
bogged, with, amount, Fun game but really gets bogged down with the amount of pop-ups towards end game. Still a great time killer overall.
play, for, hours, Exactly as advertised. good game to play for a couple hours. fun management game with an old style RPG feel.
make, for, experience, Pretty fun, nice pixel classic that engages the player enough to make for a very good casual gaming experience.
dumping, into, something, Like the 1st but better. Solid buy. Only gripe is the the village trait system. If your dumping a bunch of resources into something you can trigger the a bunch of traits at once that'll spam your screen. Not game breaking but can get super annoying
spend, upon, hours, I absolutely love this game, I spend hours upon hours on it and it doesn't even get boring. Well worth the price. Much improved from the first dungeon village.
spend, on, it, I absolutely love this game, I spend hours upon hours on it and it doesn't even get boring. Well worth the price. Much improved from the first dungeon village.
improved, from, village, I absolutely love this game, I spend hours upon hours on it and it doesn't even get boring. Well worth the price. Much improved from the first dungeon village.
learn, about, mechanics, This game is a lot of fun. The first town doesn't have high stakes but it is still fun to play and to learn about the mechanics.
asks, for, review, Solid game, worth the rating even though it asks for a 5* review for an in-game reward. I'm giving it 5* anyway. Builds off everything that made the first one addictively fun, with more to do and build. Lots of pop-up notifications as you play, far more than the first, so be prepared for that. The addition of more worlds is a great touch!
Builds, off, everything, Solid game, worth the rating even though it asks for a 5* review for an in-game reward. I'm giving it 5* anyway. Builds off everything that made the first one addictively fun, with more to do and build. Lots of pop-up notifications as you play, far more than the first, so be prepared for that. The addition of more worlds is a great touch!
Builds, with, more, Solid game, worth the rating even though it asks for a 5* review for an in-game reward. I'm giving it 5* anyway. Builds off everything that made the first one addictively fun, with more to do and build. Lots of pop-up notifications as you play, far more than the first, so be prepared for that. The addition of more worlds is a great touch!
prepared, for, that, Solid game, worth the rating even though it asks for a 5* review for an in-game reward. I'm giving it 5* anyway. Builds off everything that made the first one addictively fun, with more to do and build. Lots of pop-up notifications as you play, far more than the first, so be prepared for that. The addition of more worlds is a great touch!
like, like, Valley, This is a good game, but it needs tweaking to be a great mobile game. Less popups, improved GUI etc. However it is fun and enjoyable, in fact it was to quick to beat. The popups are too much need to be handled better. I would like to see a PC port, with longer game play; like stardew Valley and a longer more casual version for mobile. Game is designed well and has good mechanics, perfect for fun, just do not expect to put your phone down.
see, with, play, This is a good game, but it needs tweaking to be a great mobile game. Less popups, improved GUI etc. However it is fun and enjoyable, in fact it was to quick to beat. The popups are too much need to be handled better. I would like to see a PC port, with longer game play; like stardew Valley and a longer more casual version for mobile. Game is designed well and has good mechanics, perfect for fun, just do not expect to put your phone down.
had, with, it, I've had fun with it. It's an interesting set up, different from most games out there, but still easy to figure out.
click, through, them, A Return to Form for Kairosoft! Really great entry in the Kairosoft franchise. I'm loving the game and only just finished the first town. I don't really understand the complaints about the frequent pop-ups. It's a little annoying, but you can quickly click through them. Typical for a Kairo game. Great work overall.
