NOUN, ADJ, 
time, good, Really fun and a good time killer
games, best, Still stands as one of the best Kairosoft games. Kudos
game, Great, Great game. They should add more larger offices since max 8 ppl are too small. Rest is great!
offices, larger, Great game. They should add more larger offices since max 8 ppl are too small. Rest is great!
content, more, So much about this game is fun and wildly addicting. I would love to see a sequel that adds more content and depth. Do PC OS instead of just PC as a console that never grows. More office upgrades and longer than 20 year story would be awesome too. Expand on genres allowing one than 2 at once.
upgrades, More, So much about this game is fun and wildly addicting. I would love to see a sequel that adds more content and depth. Do PC OS instead of just PC as a console that never grows. More office upgrades and longer than 20 year story would be awesome too. Expand on genres allowing one than 2 at once.
fun, much, It's SO addicting I can't stop playing it. I've had so much fun making sequels and I'm excited to see what else this game brings
sequels, making, It's SO addicting I can't stop playing it. I've had so much fun making sequels and I'm excited to see what else this game brings
time, single, I've played through this game over 20 times and it's different and just as fun every single time.
killer, Enjoyable, Enjoyable time killer
game, Great, Great game!! I don't know why it's so addictive but it is. Such a simple game, takes 2 minutes to learn and you'll be playing for hours!
game, simple, Great game!! I don't know why it's so addictive but it is. Such a simple game, takes 2 minutes to learn and you'll be playing for hours!
one, 2nd, Wish there was a 2nd one that went deeper with new options and it would be cool to see how other companies are doing and lots of little things like that but this game is fun for a while and quite addicting
options, new, Wish there was a 2nd one that went deeper with new options and it would be cool to see how other companies are doing and lots of little things like that but this game is fun for a while and quite addicting
companies, other, Wish there was a 2nd one that went deeper with new options and it would be cool to see how other companies are doing and lots of little things like that but this game is fun for a while and quite addicting
things, little, Wish there was a 2nd one that went deeper with new options and it would be cool to see how other companies are doing and lots of little things like that but this game is fun for a while and quite addicting
years, many, I've been playing it for so many years now and it still does not get old. I wish there was more.
dev, original, The original and still best game dev sim out there. Easy to get into and hard to put down. You're always trying to best your last hit, and the journey to the top is just as fun as it is exciting.
hit, last, The original and still best game dev sim out there. Easy to get into and hard to put down. You're always trying to best your last hit, and the journey to the top is just as fun as it is exciting.
time, Good, Good time waster
game, Great, Great game
games, other, Love this game more the other dev games wish they would add more things to it like a bigger office more little things like actual getting the million or little prizes but I have brought the game and its worth the price
things, more, Love this game more the other dev games wish they would add more things to it like a bigger office more little things like actual getting the million or little prizes but I have brought the game and its worth the price
office, bigger, Love this game more the other dev games wish they would add more things to it like a bigger office more little things like actual getting the million or little prizes but I have brought the game and its worth the price
things, little, Love this game more the other dev games wish they would add more things to it like a bigger office more little things like actual getting the million or little prizes but I have brought the game and its worth the price
fun, Good, Good fun
offices, different, Only thing i wish is to browse around for different offices whenever i like.
fun, Great, Great fun, can get lost in it for hours!
classic, instant, An instant classic!
way, great, Gin to play great way to kill time.
game, Great, Great game!
game, Good, Good game
era, better, Solid as hell, from a better era of mobile gaming. No microtransactions or anything of that ilk. Only complaint is that the screen always rotates with the phone whether or not the global setting is on
gaming, mobile, Solid as hell, from a better era of mobile gaming. No microtransactions or anything of that ilk. Only complaint is that the screen always rotates with the phone whether or not the global setting is on
setting, global, Solid as hell, from a better era of mobile gaming. No microtransactions or anything of that ilk. Only complaint is that the screen always rotates with the phone whether or not the global setting is on
game, Great, Great game, but there were some issues of understanding the words and it was too easy, finished the game in 5hrs
type, sim, One of my favorite sim type games. Forgiving gameplay, but takes a bit of strategy and grinding to make the team you want. F2P. Definitely worth it.
games, favorite, One of my favorite sim type games. Forgiving gameplay, but takes a bit of strategy and grinding to make the team you want. F2P. Definitely worth it.
game, fun, Really fun game, one of my favourites for Android.
prize, grand, Highly addictive, been playing for 4 days straight now and just won the grand prize.
game, best, Still the best game
school, high, I used to play this game back in high-school, recently downloaded it while on break at work and have fallen back in love with the game.
game, short, Addictive, but relatively short game
game, Awesome, Awesome game! I been playing on and off for a good while and finally just won the grand prize haha! Super challenging in its own way. Love the game
while, good, Awesome game! I been playing on and off for a good while and finally just won the grand prize haha! Super challenging in its own way. Love the game
way, own, Awesome game! I been playing on and off for a good while and finally just won the grand prize haha! Super challenging in its own way. Love the game
game, cool, It's really cool game. If you like tycoon, it's a good choice. Fun and easy.
choice, good, It's really cool game. If you like tycoon, it's a good choice. Fun and easy.
yrs, few, Haven't played for a few yrs but when i did i enjoyed the game play ive had over 400 hours of gameplay. I would love to be able to make games like this someday
game, Favourite, Favourite game
type, best, I've been playing this game over and over for more than 8 years now, love it and still the best Game tycoon type of game out there. Has some flaws that just take the edge of the game being a 5 star review and the lack of a sequel after all this time is still frustrating but buy it, play it, and become addicted to Game Dev Story!
games, favorite, One of my favorite games
game, Incredible, Incredible game.
game, complex, Wonderfully complex, addicting game. Superb! Game of the year worthy ;)
year, worthy, Wonderfully complex, addicting game. Superb! Game of the year worthy ;)
game, Great, Great game
game, best, one of the best game
playthrough, next, It was OK, took a while to figure everything out. Console licenses seemed restrictive, maybe on next playthrough they won't be.
game, Great, Great game. Controls can be a bit funky until you get used to them. Otherwise, I'm really impressed with the UI - there aren't flashing buttons everywhere, and user is not presented with ads every 30 seconds.
fun, Good, Good fun!
combinations, best, Having a blast figuring out the best combinations for hit games. Simple game, but very addictive.
games, hit, Having a blast figuring out the best combinations for hit games. Simple game, but very addictive.
game, Simple, Having a blast figuring out the best combinations for hit games. Simple game, but very addictive.
money, real, Super addictive and I love that you don't have to pay real money to progress. Would recommend for sure!
years, few, This game has been a favorite of mine for a few years
game, Pretty, Pretty fun game, I wonder if there is more to it.
game, fun, Pretty fun game, I wonder if there is more to it.
time, long, The game is perfect. But it need to be guide.because it took me a long time to understand the procedure. Well done guys.
guys, done, The game is perfect. But it need to be guide.because it took me a long time to understand the procedure. Well done guys.
failure, random, Years later and I'm still deeply annoyed by the random "equipment failure" and similar events that ruin ruin things when I'm actually having good luck or pay a lot while making a game
events, similar, Years later and I'm still deeply annoyed by the random "equipment failure" and similar events that ruin ruin things when I'm actually having good luck or pay a lot while making a game
luck, good, Years later and I'm still deeply annoyed by the random "equipment failure" and similar events that ruin ruin things when I'm actually having good luck or pay a lot while making a game
game, Best, Best game I have on my phone. Download it you won't regret.
game, Good, Good game
games, favorite, One of my favorite mobile games, this is my 5th playthrough.
games, mobile, One of my favorite mobile games, this is my 5th playthrough.
playthrough, 5th, One of my favorite mobile games, this is my 5th playthrough.
killer, great, Awesome and Entertaining! This game is a great time killer, and it's very fun and entertaining. There's really no issues! It's just a fun game.
game, fun, Awesome and Entertaining! This game is a great time killer, and it's very fun and entertaining. There's really no issues! It's just a fun game.
game, Great, Great game. Keeps me going at work
game, Pretty, Pretty fun game! Runs great on mobile. It's very similar to Game Dev Tycoon, but I think I actually prefer this slightly. Worth it.
game, fun, Pretty fun game! Runs great on mobile. It's very similar to Game Dev Tycoon, but I think I actually prefer this slightly. Worth it.
cycle, satisfying, Really fun! Has a very satisfying game cycle!
game, fun, Such a fun game to pass the time
game, fun, Always a fun game
score, better, Very addictive, always striving to get a better score on the game.
game, fun, Absolutely fun game! I think out of all the Kairo titles this one has to be my favorite. So simple yet so fun and entertaining! You definitely won't be disappointed with this purchase :)
game, Best, Best game ever
game, Great, Great game! Love the way you have to work your way up from the bottom
addicting, Pretty, Pretty addicting. Very fun
fun, pure, This is how all apps should be. No ads or money grabbing techniques just pure fun!
time, Long, Long time Kairo games lover.. just amazing
game, Great, Great game
games, mobile, Meh, to be honest i was bored within 5 min and uninstalled. I am giving an even 3 stars since i do not really play mobile games or find game developing relatable or particularly interesting - so ... its not the app... its me? actually, 4 stars because the graphics and characters were cute. read more reviews other than mine before downloading 👍
reviews, more, Meh, to be honest i was bored within 5 min and uninstalled. I am giving an even 3 stars since i do not really play mobile games or find game developing relatable or particularly interesting - so ... its not the app... its me? actually, 4 stars because the graphics and characters were cute. read more reviews other than mine before downloading 👍
reviews, other, Meh, to be honest i was bored within 5 min and uninstalled. I am giving an even 3 stars since i do not really play mobile games or find game developing relatable or particularly interesting - so ... its not the app... its me? actually, 4 stars because the graphics and characters were cute. read more reviews other than mine before downloading 👍
game, Great, Great game, as its a fair bit older, needs an update to add that little bit more fun, as in current gen consoles and maybe some VR? "motion" does NOT count ;)
game, older, Great game, as its a fair bit older, needs an update to add that little bit more fun, as in current gen consoles and maybe some VR? "motion" does NOT count ;)
bit, fair, Great game, as its a fair bit older, needs an update to add that little bit more fun, as in current gen consoles and maybe some VR? "motion" does NOT count ;)
bit, little, Great game, as its a fair bit older, needs an update to add that little bit more fun, as in current gen consoles and maybe some VR? "motion" does NOT count ;)
consoles, current, Great game, as its a fair bit older, needs an update to add that little bit more fun, as in current gen consoles and maybe some VR? "motion" does NOT count ;)
game, entertaining, Pretty entertaining game. I always find my self coming back to it every now and then.
game, Brilliant, Brilliant game I'm hooked
game, full, I remember playing the demo years ago, and bought the full game yesterday just because I got a massive nostalgia spike. By far the best impulse purchase I've ever made.
spike, massive, I remember playing the demo years ago, and bought the full game yesterday just because I got a massive nostalgia spike. By far the best impulse purchase I've ever made.
purchase, best, I remember playing the demo years ago, and bought the full game yesterday just because I got a massive nostalgia spike. By far the best impulse purchase I've ever made.
purchase, impulse, I remember playing the demo years ago, and bought the full game yesterday just because I got a massive nostalgia spike. By far the best impulse purchase I've ever made.
game, fun, This is a fun little game. After you get the idea of how the game works, it's quite entertaining and fun to see just how far you can get.
game, little, This is a fun little game. After you get the idea of how the game works, it's quite entertaining and fun to see just how far you can get.
game, Great, Great game, very fun and relaxing. Love games where I can work to achieve a goal
game, fun, Great game, very fun and relaxing. Love games where I can work to achieve a goal
feeling, nostalgic, At first, felt strange. But then I tried harder, figured it out and loved it. THIS and dev Tycoon is best out there. But this..... as a developer myself I even cryied when I got the first grand Prize. I imagined that being true. • GIVE IT A TRY. Even graphics have a nostalgic feeling making you remember or dream.
trees, clear, Fun, simple, and clean. It has very clear progression trees and game is very well designed for a mobile rpg
rpg, mobile, Fun, simple, and clean. It has very clear progression trees and game is very well designed for a mobile rpg
time, great, Run game great time killer been playing for years
game, fun, Always a fun game to play very innovative
graphics, fun, Addictive with fun bright graphics
graphics, bright, Addictive with fun bright graphics
game, original, This is probably the most original and enjoyable, simple game for mobiles. Addictive but easy to pick up and put down any time
game, simple, This is probably the most original and enjoyable, simple game for mobiles. Addictive but easy to pick up and put down any time
game, addicting, Very addicting game!
games, mobile, Fun and non-intrusive, like mobile games used to be. (Doesn't stuff ads down your throat, no microtransactions or pay-to-win). Some small issues (hardware engineer, secret characters, secret consoles, and winning GOTY are all very difficult to figure out without using a guide, less attentive players might not notice several key mechanics, and a somewhat boring postgame), but overall well worth your time. A sequel with more fleshed out mechanics and customization would be awesome
issues, small, Fun and non-intrusive, like mobile games used to be. (Doesn't stuff ads down your throat, no microtransactions or pay-to-win). Some small issues (hardware engineer, secret characters, secret consoles, and winning GOTY are all very difficult to figure out without using a guide, less attentive players might not notice several key mechanics, and a somewhat boring postgame), but overall well worth your time. A sequel with more fleshed out mechanics and customization would be awesome
characters, secret, Fun and non-intrusive, like mobile games used to be. (Doesn't stuff ads down your throat, no microtransactions or pay-to-win). Some small issues (hardware engineer, secret characters, secret consoles, and winning GOTY are all very difficult to figure out without using a guide, less attentive players might not notice several key mechanics, and a somewhat boring postgame), but overall well worth your time. A sequel with more fleshed out mechanics and customization would be awesome
consoles, secret, Fun and non-intrusive, like mobile games used to be. (Doesn't stuff ads down your throat, no microtransactions or pay-to-win). Some small issues (hardware engineer, secret characters, secret consoles, and winning GOTY are all very difficult to figure out without using a guide, less attentive players might not notice several key mechanics, and a somewhat boring postgame), but overall well worth your time. A sequel with more fleshed out mechanics and customization would be awesome
players, attentive, Fun and non-intrusive, like mobile games used to be. (Doesn't stuff ads down your throat, no microtransactions or pay-to-win). Some small issues (hardware engineer, secret characters, secret consoles, and winning GOTY are all very difficult to figure out without using a guide, less attentive players might not notice several key mechanics, and a somewhat boring postgame), but overall well worth your time. A sequel with more fleshed out mechanics and customization would be awesome
mechanics, several, Fun and non-intrusive, like mobile games used to be. (Doesn't stuff ads down your throat, no microtransactions or pay-to-win). Some small issues (hardware engineer, secret characters, secret consoles, and winning GOTY are all very difficult to figure out without using a guide, less attentive players might not notice several key mechanics, and a somewhat boring postgame), but overall well worth your time. A sequel with more fleshed out mechanics and customization would be awesome
mechanics, key, Fun and non-intrusive, like mobile games used to be. (Doesn't stuff ads down your throat, no microtransactions or pay-to-win). Some small issues (hardware engineer, secret characters, secret consoles, and winning GOTY are all very difficult to figure out without using a guide, less attentive players might not notice several key mechanics, and a somewhat boring postgame), but overall well worth your time. A sequel with more fleshed out mechanics and customization would be awesome
postgame, boring, Fun and non-intrusive, like mobile games used to be. (Doesn't stuff ads down your throat, no microtransactions or pay-to-win). Some small issues (hardware engineer, secret characters, secret consoles, and winning GOTY are all very difficult to figure out without using a guide, less attentive players might not notice several key mechanics, and a somewhat boring postgame), but overall well worth your time. A sequel with more fleshed out mechanics and customization would be awesome
mechanics, fleshed, Fun and non-intrusive, like mobile games used to be. (Doesn't stuff ads down your throat, no microtransactions or pay-to-win). Some small issues (hardware engineer, secret characters, secret consoles, and winning GOTY are all very difficult to figure out without using a guide, less attentive players might not notice several key mechanics, and a somewhat boring postgame), but overall well worth your time. A sequel with more fleshed out mechanics and customization would be awesome
game, Good, Good game
game, Classic, Classic game, very well made, great time all around!
time, made, Classic game, very well made, great time all around!
time, great, Classic game, very well made, great time all around!
life, waking, This game is single handedly killing my productivity in my waking life.
fun, Great, Great fun
game, favourite, Probably my favourite Kairosoft game, been coming back to this one for a few years and still loving it!
years, few, Probably my favourite Kairosoft game, been coming back to this one for a few years and still loving it!
game, Great, Great game
game, fun, Just a fun little game
game, little, Just a fun little game
killer, Great, Great time killer
prize, grand, I love this game. Totally addicting. Also since I won the grand prize, finally, in year 14, I felt I should leave a review.
fun, much, So much fun, so addictive
fun, addictive, So much fun, so addictive
game, Great, C: Great game
game, Excellent, Excellent game! Good job guys!
guys, Good, Excellent game! Good job guys!
game, fun, It's a fun game, wish there was more content.
game, Great, Great little game. I find myself coming back to it over and over again
game, little, Great little game. I find myself coming back to it over and over again
game, Great, Great game, had me hooked for hours 😊
content, more, Fun, I hope to see more content in the future
experience, great, This game is great casual experience, with enough nods to your childhood growing up as a gamer. Good fun!
experience, casual, This game is great casual experience, with enough nods to your childhood growing up as a gamer. Good fun!
nods, enough, This game is great casual experience, with enough nods to your childhood growing up as a gamer. Good fun!
fun, Good, This game is great casual experience, with enough nods to your childhood growing up as a gamer. Good fun!
curve, steep, Very fun, but a steep learning curve
way, Nice, Nice way to pass time, unfortunately replayability tedious.
replayability, tedious, Nice way to pass time, unfortunately replayability tedious.
hours, many, Excellent. I was entranced for many hours. Outside world? People? Bugger all that! Thanks devs!
value, Pretty, Simple but surprisingly fun and addictive. Pretty good replay value too!
value, good, Simple but surprisingly fun and addictive. Pretty good replay value too!
game, Great, Great game
game, Dopest, Dopest game ever!
devices, different, I've played this game for years over different devices! This game is the only reason that I was even excited to own an android phone.
reason, only, I've played this game for years over different devices! This game is the only reason that I was even excited to own an android phone.
phone, android, I've played this game for years over different devices! This game is the only reason that I was even excited to own an android phone.
console, best, I would give this game 5 stars but the game deleted my save with over 1billion dollars on it and I had the best console on that save it didn't even say that it was deleted I got on the game and saw no money in my save
way, great, It's fun, great way to pass time.
fun, much, So much fun!
sim, Best, Best Video game sim available. Multiple options and genres to unlock. Create award winning video games and stay in business by not going broke. Go to Gamecon and draw worldwide fans. So many options.
options, Multiple, Best Video game sim available. Multiple options and genres to unlock. Create award winning video games and stay in business by not going broke. Go to Gamecon and draw worldwide fans. So many options.
fans, worldwide, Best Video game sim available. Multiple options and genres to unlock. Create award winning video games and stay in business by not going broke. Go to Gamecon and draw worldwide fans. So many options.
options, many, Best Video game sim available. Multiple options and genres to unlock. Create award winning video games and stay in business by not going broke. Go to Gamecon and draw worldwide fans. So many options.
game, Great, Great game
time, down, I love playing this game in my down time. It has become increasingly fun to try to get the grand prize.
prize, grand, I love playing this game in my down time. It has become increasingly fun to try to get the grand prize.
game, Good, Good game but to many glitches
glitches, many, Good game but to many glitches
games, perfect, This is one of those near-perfect games for me. I come back every few months to play through a career or two.
months, few, This is one of those near-perfect games for me. I come back every few months to play through a career or two.
crashes, Random, Random crashes
game, good, A really good game. No nonsense, and replayble. Comprehensive stats system if you're into that, and makes you feel smart when you figure out ways to cheese the mechanics. Great events and achievements to keep you engaged as well as some cute easter eggs.
system, Comprehensive, A really good game. No nonsense, and replayble. Comprehensive stats system if you're into that, and makes you feel smart when you figure out ways to cheese the mechanics. Great events and achievements to keep you engaged as well as some cute easter eggs.
events, Great, A really good game. No nonsense, and replayble. Comprehensive stats system if you're into that, and makes you feel smart when you figure out ways to cheese the mechanics. Great events and achievements to keep you engaged as well as some cute easter eggs.
eggs, cute, A really good game. No nonsense, and replayble. Comprehensive stats system if you're into that, and makes you feel smart when you figure out ways to cheese the mechanics. Great events and achievements to keep you engaged as well as some cute easter eggs.
