VERB, PREP, POBJ, 
lose, in, days, Enjoyable, long progression however there is a lack of a speed-up button from the get go. There are many pockets of times where you simply have to sit with the application open or constantly have to press and hold to speed up dialogue or events. The save feature is the most frustrating-- you can lose many in game days of progress. If you decide to get this game, be sure to save in a spot you don't mind repeating the last few in game days.
save, in, spot, Enjoyable, long progression however there is a lack of a speed-up button from the get go. There are many pockets of times where you simply have to sit with the application open or constantly have to press and hold to speed up dialogue or events. The save feature is the most frustrating-- you can lose many in game days of progress. If you decide to get this game, be sure to save in a spot you don't mind repeating the last few in game days.
require, so, game, Fun times, doesn't require constant attention so its a pretty good game to have off on the side when working.
have, on, side, Fun times, doesn't require constant attention so its a pretty good game to have off on the side when working.
playing, for, days, I couldn't stop playing for 2 days! Please make a pc version of the game.
check, on, it, Not bad... I think I'll enjoy it more if I didn't have to constantly check on it. 50% of the game is pop-ups, notifying you of ingame stuff. Really annoying. It feels like a clicker game just to get through it so the game can continue.
notifying, of, stuff, Not bad... I think I'll enjoy it more if I didn't have to constantly check on it. 50% of the game is pop-ups, notifying you of ingame stuff. Really annoying. It feels like a clicker game just to get through it so the game can continue.
feels, like, game, Not bad... I think I'll enjoy it more if I didn't have to constantly check on it. 50% of the game is pop-ups, notifying you of ingame stuff. Really annoying. It feels like a clicker game just to get through it so the game can continue.
get, through, it, Not bad... I think I'll enjoy it more if I didn't have to constantly check on it. 50% of the game is pop-ups, notifying you of ingame stuff. Really annoying. It feels like a clicker game just to get through it so the game can continue.
hope, on, mobile, If you like Sim games, then Kairosoft games are the best you can hope for on mobile. Well balanced, fun, and time consuming, Dungeon Village 2 is worth every penny.
gotten, in, while, I have not gotten a kairosoft game in a while as they started to be less fun. However this game scratches all the old Kairosoft itches for me.
playing, through, day, Well worth the price. I have had a lot of fun playing this randomly through my day. Some notifications can be annoying though.
want, from, game, Simple, fun, relaxing. What can one want more from a game!
keep, in, mind, Fun game. It does offer an in game reward for writing a review so keep that in mind.
play, in, time, It's a really fun, cute little game too play in spare time. It's just a kick back and chill kind-of game. I really love it.
spent, in, total, Fun mindless somewhat ocd pleasing have spent 30+ hours in total
sink, into, that, This is a great game that you can sink lots of time into. You pay once then never again. No in game adds, no microtransactions. They are a bit heavy on ai notifs but it is worth it.
Looking, to, releases, Love it! Looking forward to more releases from the studio
reinstall, after, months, I had to reinstall the game after several months of playing, for a paid game, not being able to recover data in the same device is really a big concern
reinstall, for, game, I had to reinstall the game after several months of playing, for a paid game, not being able to recover data in the same device is really a big concern
recover, in, device, I had to reinstall the game after several months of playing, for a paid game, not being able to recover data in the same device is really a big concern
seen, For, example, Pretty interesting game! The interface could be improved. For example, the display of traits provided by events or items can only be seen one by one.
Love, to, pieces, Love it to pieces!
put, into, game, I've enjoyed all the time I've put into into this game.
get, like, game, Really like this game, you get to make it your own and build up your town and no in app purchases or ads. Also you get cool monster friends along the way!
get, along, way, Really like this game, you get to make it your own and build up your town and no in app purchases or ads. Also you get cool monster friends along the way!
do, than, one, Hooked much more to do than the 1st one
feels, like, game, I truly don't get the high rating if this game, this one is so dull I can't believe I paid for it! It feels like an idle game to me, not my thing.
gotten, to, stars, Really fun offline game. I wish that the UI used less popups as it can get a little busy, but overall its a great game! I've gotten to 5 stars on the first town and am now moving on to the next one, I'm glad there's a progression to the game. Worth the $ too, as theres no ads and the gameplay is smooth.
moving, to, one, Really fun offline game. I wish that the UI used less popups as it can get a little busy, but overall its a great game! I've gotten to 5 stars on the first town and am now moving on to the next one, I'm glad there's a progression to the game. Worth the $ too, as theres no ads and the gameplay is smooth.
pays, in, end, This game rocks, it's a lot of work. But it pays off in the end. Keep it up!
Turns, to, game, Turns out the trick to a great idle game is no micro transactions. A lovely game that can mostly run in the background, although some of the dialog is hard to skip and repeating, it's overall a lot of fun.
run, in, background, Turns out the trick to a great idle game is no micro transactions. A lovely game that can mostly run in the background, although some of the dialog is hard to skip and repeating, it's overall a lot of fun.
makes, for, time, So fun! Definitely worth checking out as it makes for a calm and fun time.
reminded, of, game, Time consuming. It reminded of old school city building game. Its not to expensive. If say try it
play, for, hours, Kairosoft does it again! It's a casual game, but requires strategy. I can play it for hours!
played, in, background, Pretty good game, it has a lot of interruptions that i wish played more in the background though. Also wish editing the town was easier like adding a sort of building storage or something
help, along, way, Better than the 1st game. No ads, no waiting, just a great city building game with adventurers to help along their way.
competing, with, yourself, Addictive, but you can sit it down and enjoy life. You're competing with yourself, so there's no rush. I'm on the 3rd town, with 5* across so far. Very casual and fun. I enjoy just letting it run and watching them grind. Looking forward to DV3 or added content here.
Looking, to, DV3, Addictive, but you can sit it down and enjoy life. You're competing with yourself, so there's no rush. I'm on the 3rd town, with 5* across so far. Very casual and fun. I enjoy just letting it run and watching them grind. Looking forward to DV3 or added content here.
pick, during, break, Easy to pick up during my lunch break. Fun to play too!
try, from, company, Really cute! I enjoyed this a lot. Definitely going to try more from the same company.
take, on, style, Interesting take on the tycoon type game style. It's sucked me in, even though i don't usually get into these games too easily. It's just one of those games that's really well made, but doesn't have a lot of info readily available online, so doing well in the game is entirely up to you.
get, into, games, Interesting take on the tycoon type game style. It's sucked me in, even though i don't usually get into these games too easily. It's just one of those games that's really well made, but doesn't have a lot of info readily available online, so doing well in the game is entirely up to you.
doing, in, game, Interesting take on the tycoon type game style. It's sucked me in, even though i don't usually get into these games too easily. It's just one of those games that's really well made, but doesn't have a lot of info readily available online, so doing well in the game is entirely up to you.
recommended, for, People, Amazing good fun for 5 bucks. And i havent close to finish my first town! And there are even more towns to do. Highly recommended for People Who like management in some form.
get, for, money, I've had a blast with the game. Super clean game. Worth buying for sure. Beats p2w any day. Plus, for as cheap as the game is, you'll get way more for your money in this game than anything else.
get, in, game, I've had a blast with the game. Super clean game. Worth buying for sure. Beats p2w any day. Plus, for as cheap as the game is, you'll get way more for your money in this game than anything else.
get, than, anything, I've had a blast with the game. Super clean game. Worth buying for sure. Beats p2w any day. Plus, for as cheap as the game is, you'll get way more for your money in this game than anything else.
stuck, on, it, Ok this game has me hands down. No pay to win AT ALL. Great dang game. I am stuck on it every chance I get.
pick, for, bit, It's a good game worth the money easy to pick up for just a little bit or to get caught up in for a few hours. 9/10 for a phone game.
caught, for, hours, It's a good game worth the money easy to pick up for just a little bit or to get caught up in for a few hours. 9/10 for a phone game.
add, to, buildings, I wish they would add unique upgrades to buildings, or the old tile combo system. Perhaps 2 buildings of the same type becoming an upgraded version. The items feel a little excessive and the population popup gets annoying, population doesn't have any value than upgrade requirements. Perhaps farmland needs a buff. Also the second town expansion should come a bit earlier, I was sitting with a cramped town for a long time. The titles are nice, wish they had more purpose like a merging system.
sitting, with, town, I wish they would add unique upgrades to buildings, or the old tile combo system. Perhaps 2 buildings of the same type becoming an upgraded version. The items feel a little excessive and the population popup gets annoying, population doesn't have any value than upgrade requirements. Perhaps farmland needs a buff. Also the second town expansion should come a bit earlier, I was sitting with a cramped town for a long time. The titles are nice, wish they had more purpose like a merging system.
sitting, for, time, I wish they would add unique upgrades to buildings, or the old tile combo system. Perhaps 2 buildings of the same type becoming an upgraded version. The items feel a little excessive and the population popup gets annoying, population doesn't have any value than upgrade requirements. Perhaps farmland needs a buff. Also the second town expansion should come a bit earlier, I was sitting with a cramped town for a long time. The titles are nice, wish they had more purpose like a merging system.
did, with, one, They really did a nice job with this one. Sticking to the original reason why these games are fun with enough additions that made it more enjoyable. I loved the first one but this one is even better.
Sticking, to, reason, They really did a nice job with this one. Sticking to the original reason why these games are fun with enough additions that made it more enjoyable. I loved the first one but this one is even better.
Got, to, stars, Really fun, been binge playing it. Got my first town to five stars and working on the second. Monsters have really silly and playful dialog and it is micromanage heaven. No p2w, p2c, or anything pay related except begging villagers for gold and buying the game itself.
working, on, second, Really fun, been binge playing it. Got my first town to five stars and working on the second. Monsters have really silly and playful dialog and it is micromanage heaven. No p2w, p2c, or anything pay related except begging villagers for gold and buying the game itself.
begging, for, gold, Really fun, been binge playing it. Got my first town to five stars and working on the second. Monsters have really silly and playful dialog and it is micromanage heaven. No p2w, p2c, or anything pay related except begging villagers for gold and buying the game itself.
is, to, notification, The game itself is really good, I could give 5, but there is to many achievements notification it's kind annoys and makes me a bit tired when playing. I wish you make another dungeon village sequel with less notification like this one. Overall this is a great game
send, on, quests, Brilliant, great fun to pass the time. Manage a village full of adventurers, send them on quests, upgrade your shops. So much variation. And no micro transactions or subscriptions.
played, on, iOS, One of the best RPGs I've played on iOS just wish I could control characters directly other than that the game is at 10 out of 10!
kept, with, more, A great improvement on dungeon village one, all the fun kept with more to do
invested, in, game, Honestly didn't think I was too invested in the game, but then there were several occasions where I would play it for actual hours and not even realize. Definitely worth the money.
play, for, hours, Honestly didn't think I was too invested in the game, but then there were several occasions where I would play it for actual hours and not even realize. Definitely worth the money.
Reminds, of, gameplay, Reminds me of old Super Nintendo gameplay. The game-pausing popups are part of the nostalgia! Really enjoy this!
switch, between, phone, Fantastic game. Wish the saleable could be easily located and transfered so I could switch between phone and tablet. Worth every penny
defeat, in, way, Nice game, happy to see a sequel to Dungeon Village, but first boss is impossible to beat first time. If intentional, this is bad game design, as there is no telegraphing of this and you get punished for not being able to beat him. If not, this is still bad game design as he is too hard to defeat in any reasonable way, being able to wipe you even if you send literally everything you have.
spend, on, app, another great Kairosoft game! Just about the best money you can spend on an app.
tapping, through, them, The constant popups are actually a problem. Prepare to waste hours tapping through them. Otherwise great game.
play, from, creators, Like most kairosoft games it's fun and easy to play. They price games well and it's just so much better than trying to play an ad infested game from other creators.
play, with, maps, This game was and is so addicting and I can play forever with different maps and worlds and ppl I don't think it ever stops but it's very fulfilling And fun and lots and lots of equipment and items and things to unlock. When you think you beat the game, you are maybe only 1 percent done
fulfilling, of, equipment, This game was and is so addicting and I can play forever with different maps and worlds and ppl I don't think it ever stops but it's very fulfilling And fun and lots and lots of equipment and items and things to unlock. When you think you beat the game, you are maybe only 1 percent done
playing, for, while, Super fun! I'm sure I'm going to keep playing this for quite a while.
get, at, times, Very charming and fun town management/rpg game. The popups do get a bit annoying at times which is the only thing keeping me from giving it 5 stars... Worth a buy, solid game!
clicking, After, village, Gets repetitive and boring real fast. After the first village most of your playtime is repeatedly clicking through 5 window pop-ups.
clicking, through, ups, Gets repetitive and boring real fast. After the first village most of your playtime is repeatedly clicking through 5 window pop-ups.
agreed, with, it, Love this game but, I've seen other's comment on how to improve this game and I kinda agreed with it. Maybe do it for the dungeon village 3 in case you guys gonna make it (please make it, dungeon village series is the best one you got for now)... Also, the most importantly, make a button of "buy all" or select the number of things we wanna buy in store, it's annoying to buy it one by one...
do, for, village, Love this game but, I've seen other's comment on how to improve this game and I kinda agreed with it. Maybe do it for the dungeon village 3 in case you guys gonna make it (please make it, dungeon village series is the best one you got for now)... Also, the most importantly, make a button of "buy all" or select the number of things we wanna buy in store, it's annoying to buy it one by one...
buy, in, store, Love this game but, I've seen other's comment on how to improve this game and I kinda agreed with it. Maybe do it for the dungeon village 3 in case you guys gonna make it (please make it, dungeon village series is the best one you got for now)... Also, the most importantly, make a button of "buy all" or select the number of things we wanna buy in store, it's annoying to buy it one by one...
buy, by, one, Love this game but, I've seen other's comment on how to improve this game and I kinda agreed with it. Maybe do it for the dungeon village 3 in case you guys gonna make it (please make it, dungeon village series is the best one you got for now)... Also, the most importantly, make a button of "buy all" or select the number of things we wanna buy in store, it's annoying to buy it one by one...
drop, within, day, To be honest, I thought I'd get bored and drop it within the first day. But the end, it was enough to draw me in and satiate. I just cleared the five star mark and will probably stop now, but what it does give you isn't bad for what it is.
Loved, as, kid, Loved this game as a kid, and still love the sequel. Thank you Kairosoft.
waiting, for, something, Fun time sink when your waiting around for something.
figure, at, first, It was hard to figure out at first but once i did it was really fun. I couldnt put it down. I just reached 5 stars in my town im not sure if the game continues or not but im looking forward to finding out.
reached, in, town, It was hard to figure out at first but once i did it was really fun. I couldnt put it down. I just reached 5 stars in my town im not sure if the game continues or not but im looking forward to finding out.
working, towards, title, Pretty fun game overall. Takes a little getting used to to navigate the menus. Wish there was an easier way to see how you're doing on working towards a new title or way to tag your own goal. Overall fun little game though
operated, like, this, Excellent little town builder rpg. Lots of things to keep you busy. Takes some strategy to keep your towns gold balance where it should be, which is a good thing. I wish more mobile games operated like this.
entertaining, for, hours, solid, entertaining for several hours, characters are imaginative
stuck, in, middle, Fun the first day, but then gets very repetitive and boring. Too many pop ups all the time. One of the characters got stuck in the middle of the road and couldnt move for the rest of the game. Also, if you switch to another app and switch back, you'll get a black screen and have to restart your game without being able to save.
move, for, rest, Fun the first day, but then gets very repetitive and boring. Too many pop ups all the time. One of the characters got stuck in the middle of the road and couldnt move for the rest of the game. Also, if you switch to another app and switch back, you'll get a black screen and have to restart your game without being able to save.
switch, to, app, Fun the first day, but then gets very repetitive and boring. Too many pop ups all the time. One of the characters got stuck in the middle of the road and couldnt move for the rest of the game. Also, if you switch to another app and switch back, you'll get a black screen and have to restart your game without being able to save.
play, with, mechanics, This game is honestly addicting. No micro transactions no BS. Just play the game with the mechanics the devs designed. Love this game.
compared, to, village, Really easy game compared to dungeon village 1. Haven't mastered half the jobs yet and beat the game. It's fun. Try it out.
love, for, dollars, Very fun game! I love that for just a few dollars you can have constant play. And you can just keep growing!
see, with, ECT, I was convinced that this was going to be a bad experience because my town was always in debt but it quickly became a game I simply couldn't put down. It continuously became more and more enjoyable. With no cash shop! Absolutely amazing experience. Would love to see some quality of life with the town management ECT. And some better menu navigation would make this a very chill game.
built, upon, success, Enjoyed the first game and this one built upon that success. Quite enjoyable as all Kairosoft games have been that I've played
stuck, in, loops, Overall a great game and I'm loving it. I would say sometimes you get stuck in the notificafion/animation loops for what feels like days. Hope they add a feature to skip or supress some of it. Seeing the same message 500 times in two hours gets old. maybe move some of them to a mailbox system or add an option to skip join animations, maybe checkmarks to assign medals and the like.
feels, like, days, Overall a great game and I'm loving it. I would say sometimes you get stuck in the notificafion/animation loops for what feels like days. Hope they add a feature to skip or supress some of it. Seeing the same message 500 times in two hours gets old. maybe move some of them to a mailbox system or add an option to skip join animations, maybe checkmarks to assign medals and the like.
move, to, system, Overall a great game and I'm loving it. I would say sometimes you get stuck in the notificafion/animation loops for what feels like days. Hope they add a feature to skip or supress some of it. Seeing the same message 500 times in two hours gets old. maybe move some of them to a mailbox system or add an option to skip join animations, maybe checkmarks to assign medals and the like.
added, since, version, They ask you to write a review after you've finished a gameplay cycle. It's fun, they've added a lot of content since the first version, which I also enjoyed. Definitely worth the price if you have a few people in your play family to share it with.
Look, to, games, Definitely a fun little game. Look forward to new games!
lying, on, Sofa, Absolute blast. Spent way too much time lying on the Sofa, micromanaging my town and watching my Adventurers move out. Its amazing
built, upon, first, Always a pleasure to play this game. First one was great and the second one just built upon the first. The pop ups are a tad annoying but not unbearable. Keep up the good work kairosoft!
beats, in, terms, I played the first one a lot and i was really excited to see that a second one was being developed. This game beats out the first in terms of content and replayability, this was definetly worth the few bucks.
start, after, work, Absolutely worth the money, I'd start this game after work and find myself playing for hours right in front of my yet to be turned on PS5. Keep making amazing quality games!
playing, for, hours, Absolutely worth the money, I'd start this game after work and find myself playing for hours right in front of my yet to be turned on PS5. Keep making amazing quality games!
playing, in, front, Absolutely worth the money, I'd start this game after work and find myself playing for hours right in front of my yet to be turned on PS5. Keep making amazing quality games!
turned, on, PS5, Absolutely worth the money, I'd start this game after work and find myself playing for hours right in front of my yet to be turned on PS5. Keep making amazing quality games!
sucked, in, you, Pretty fun, surprising how sucked in you get.
purchased, without, thought, Dungeon Village was my first Kairosoft app, and I'm so happy to see a 2nd one has come out! Immediately purchased without a second thought, and haven't regretted it yet. Looks like Kairosoft is stepping away from the F2P zone, which I definitely support.
use, in, time, Fun app to use in idle time.
Builds, off, parts, Builds off the best parts of the first installment. It guess much deeper and incentivizes to post much longer than the first with more quests and slower boss reveals.
replace, with, weapon, Fun and worth the low price. The only complaint I have is the AI needs a bit of work, since physical characters will sometimes replace a good weapon they have with a magic boosting weapon, and vice versa.
