NOUN, ADJ, 
years, many, I simply love everything about it. Been a fan of the game since it released many years ago on my iPhone device, I cant even remember how I stumbled upon kairosoft but I am glad I did! Game is so unique and charming, hope for a sequel. Ps the mechanics and gameplay of 'Game Dev Tycoon' on steam is suspiciously similar, they might have been a fan!
game, Awesome, Awesome game! Played to snot out of it a loooong time ago and just started again. It's so fun, it's totally addicting, and best of all, no in app purchases. Keep up the good work!
time, loooong, Awesome game! Played to snot out of it a loooong time ago and just started again. It's so fun, it's totally addicting, and best of all, no in app purchases. Keep up the good work!
work, good, Awesome game! Played to snot out of it a loooong time ago and just started again. It's so fun, it's totally addicting, and best of all, no in app purchases. Keep up the good work!
time, main, Game was great a little short but I feel the main time frame idea was pretty original
game, phenomenal, This is a phenomenal game, the only downfall is that you can't play offline.
downfall, only, This is a phenomenal game, the only downfall is that you can't play offline.
fun, Good, Good fun much game
game, much, Good fun much game
sheet, competing, Great Game loads of Fun..would be nice to build a competing stat sheet with you and the other companies. how do get Hardware engineer? Evo 3d [2/27/12] Update: This game is addicting. I started playing it again and couldn't put it down. Hours of gameplay. Glad I got this. LG G6 [9/30/18] Still enjoyed this game [3/10/20]
companies, other, Great Game loads of Fun..would be nice to build a competing stat sheet with you and the other companies. how do get Hardware engineer? Evo 3d [2/27/12] Update: This game is addicting. I started playing it again and couldn't put it down. Hours of gameplay. Glad I got this. LG G6 [9/30/18] Still enjoyed this game [3/10/20]
game, amazing, An amazing game, needs a sequel. Desperately. Seriously, please make a second one. I'll buy it in a heartbeat.
one, second, An amazing game, needs a sequel. Desperately. Seriously, please make a second one. I'll buy it in a heartbeat.
game, best, This is THE best game for any phone. The graphics are amazing, the story is great but in my opinion to short, I would love it to be longer. The mechanics of the game are the real deal of the game.
deal, real, This is THE best game for any phone. The graphics are amazing, the story is great but in my opinion to short, I would love it to be longer. The mechanics of the game are the real deal of the game.
game, great, I saw my friend play this game and it looked fun, so I bought it too! It is a great game. :)
phones, new, Not compatible with new android phones :(
game, absolute, The absolute best game dev game.
game, best, The absolute best game dev game.
game, other, Please make other game more cheap, give it under RM 8 PKZ
year, full, It's been a full year since I really play that game, now I'm ready for the actual review. Gameplay wise, this game hooked me up until I forgot about my assignment. Tons of options are shown, and the NG+ features extends this game lifespan. You can't just finish this game after 20 years, and wished to get the GOTY award. The main problem I have is how this game doesn't allow you to develop a sequel if that game doesn't make it to the hall of fame. But thanks for removing the 14 characrer limit.
review, actual, It's been a full year since I really play that game, now I'm ready for the actual review. Gameplay wise, this game hooked me up until I forgot about my assignment. Tons of options are shown, and the NG+ features extends this game lifespan. You can't just finish this game after 20 years, and wished to get the GOTY award. The main problem I have is how this game doesn't allow you to develop a sequel if that game doesn't make it to the hall of fame. But thanks for removing the 14 characrer limit.
problem, main, It's been a full year since I really play that game, now I'm ready for the actual review. Gameplay wise, this game hooked me up until I forgot about my assignment. Tons of options are shown, and the NG+ features extends this game lifespan. You can't just finish this game after 20 years, and wished to get the GOTY award. The main problem I have is how this game doesn't allow you to develop a sequel if that game doesn't make it to the hall of fame. But thanks for removing the 14 characrer limit.
games, other, Iv waited years for Game Dev Story 2. Never happened. They made tons of other games. And I questioned why have they not made their own Sims(or Sims City) version type of game. Combine everything they know into one game and sell for $20 or $30 on steam, then port to mobile on later date. Update(01/22/20): another thing I love about this game compared to all their others, is no in app purchases, none whatsoever, no lame loot boxes XD
Sims(or, own, Iv waited years for Game Dev Story 2. Never happened. They made tons of other games. And I questioned why have they not made their own Sims(or Sims City) version type of game. Combine everything they know into one game and sell for $20 or $30 on steam, then port to mobile on later date. Update(01/22/20): another thing I love about this game compared to all their others, is no in app purchases, none whatsoever, no lame loot boxes XD
date, later, Iv waited years for Game Dev Story 2. Never happened. They made tons of other games. And I questioned why have they not made their own Sims(or Sims City) version type of game. Combine everything they know into one game and sell for $20 or $30 on steam, then port to mobile on later date. Update(01/22/20): another thing I love about this game compared to all their others, is no in app purchases, none whatsoever, no lame loot boxes XD
loot, lame, Iv waited years for Game Dev Story 2. Never happened. They made tons of other games. And I questioned why have they not made their own Sims(or Sims City) version type of game. Combine everything they know into one game and sell for $20 or $30 on steam, then port to mobile on later date. Update(01/22/20): another thing I love about this game compared to all their others, is no in app purchases, none whatsoever, no lame loot boxes XD
game, Great, Great game but replaying kinda dull
game, dull, Great game but replaying kinda dull
touch, ipod, very good I've been playing since the ipod touch!!! YOU NEED TO MAKE A SECOND ONE PLEEAASSEEE YOU CAN EXPAND ON THIS GAME SO MUCH have an effect on everything with how games are made today and how people react and have more than 2 game types for mixes have many kinds being able to mix more buildings multiple studios for one game company contracts with other game companies mixing with yours more consoles you can have so much to do with this game I have many other ideas please consider it!!
kinds, many, very good I've been playing since the ipod touch!!! YOU NEED TO MAKE A SECOND ONE PLEEAASSEEE YOU CAN EXPAND ON THIS GAME SO MUCH have an effect on everything with how games are made today and how people react and have more than 2 game types for mixes have many kinds being able to mix more buildings multiple studios for one game company contracts with other game companies mixing with yours more consoles you can have so much to do with this game I have many other ideas please consider it!!
buildings, more, very good I've been playing since the ipod touch!!! YOU NEED TO MAKE A SECOND ONE PLEEAASSEEE YOU CAN EXPAND ON THIS GAME SO MUCH have an effect on everything with how games are made today and how people react and have more than 2 game types for mixes have many kinds being able to mix more buildings multiple studios for one game company contracts with other game companies mixing with yours more consoles you can have so much to do with this game I have many other ideas please consider it!!
studios, multiple, very good I've been playing since the ipod touch!!! YOU NEED TO MAKE A SECOND ONE PLEEAASSEEE YOU CAN EXPAND ON THIS GAME SO MUCH have an effect on everything with how games are made today and how people react and have more than 2 game types for mixes have many kinds being able to mix more buildings multiple studios for one game company contracts with other game companies mixing with yours more consoles you can have so much to do with this game I have many other ideas please consider it!!
companies, other, very good I've been playing since the ipod touch!!! YOU NEED TO MAKE A SECOND ONE PLEEAASSEEE YOU CAN EXPAND ON THIS GAME SO MUCH have an effect on everything with how games are made today and how people react and have more than 2 game types for mixes have many kinds being able to mix more buildings multiple studios for one game company contracts with other game companies mixing with yours more consoles you can have so much to do with this game I have many other ideas please consider it!!
ideas, many, very good I've been playing since the ipod touch!!! YOU NEED TO MAKE A SECOND ONE PLEEAASSEEE YOU CAN EXPAND ON THIS GAME SO MUCH have an effect on everything with how games are made today and how people react and have more than 2 game types for mixes have many kinds being able to mix more buildings multiple studios for one game company contracts with other game companies mixing with yours more consoles you can have so much to do with this game I have many other ideas please consider it!!
ideas, other, very good I've been playing since the ipod touch!!! YOU NEED TO MAKE A SECOND ONE PLEEAASSEEE YOU CAN EXPAND ON THIS GAME SO MUCH have an effect on everything with how games are made today and how people react and have more than 2 game types for mixes have many kinds being able to mix more buildings multiple studios for one game company contracts with other game companies mixing with yours more consoles you can have so much to do with this game I have many other ideas please consider it!!
mode, endless, I loved this game but it's really taken a hit for me... I just want an endless mode... Idc about high scores...
scores, high, I loved this game but it's really taken a hit for me... I just want an endless mode... Idc about high scores...
game, casual, This is a casual game, not for the gamers per say like myself but i sometimes find this sort of thing passes the time... which is completely ok. so if you like a casual game relax and have cup of coffee with during work break,ect this not a bad choice and bonus you pay once which good value for money if your fed up with paying tons only to be asked for more and more this is refreshing that aspect. so value is how i rate this. try it
game, casual, This is a casual game, not for the gamers per say like myself but i sometimes find this sort of thing passes the time... which is completely ok. so if you like a casual game relax and have cup of coffee with during work break,ect this not a bad choice and bonus you pay once which good value for money if your fed up with paying tons only to be asked for more and more this is refreshing that aspect. so value is how i rate this. try it
choice, bad, This is a casual game, not for the gamers per say like myself but i sometimes find this sort of thing passes the time... which is completely ok. so if you like a casual game relax and have cup of coffee with during work break,ect this not a bad choice and bonus you pay once which good value for money if your fed up with paying tons only to be asked for more and more this is refreshing that aspect. so value is how i rate this. try it
value, good, This is a casual game, not for the gamers per say like myself but i sometimes find this sort of thing passes the time... which is completely ok. so if you like a casual game relax and have cup of coffee with during work break,ect this not a bad choice and bonus you pay once which good value for money if your fed up with paying tons only to be asked for more and more this is refreshing that aspect. so value is how i rate this. try it
game, new, My genres and types aren't transferring to my new game so have to start completely over.
game, fantastic, The blackouts and equipment failures ruin an otherwise fantastic game.
game, Great, Great simulation game! Very fun and perfect to pass the time while on the subway.
problem, only, Returning to this game after at least a year and I'm still impressed by how good it is. My only problem is there's lag now and its more noticeable
depth, real, Starts out good, but gets repetitive quickly with no real depth and most of your decisions don't matter either.
screen, Touch, Touch screen controls positioning not quite right with the pixl 3 xl. Couldn't play because of it. :(
game, good, Very fun, makes me happy, do buy, worth money for buy, do it, good game. Though in all honesty the change title option should come before the ship. 1 star
game, great, This is a great game if you like tycoon games the only issue is when you get pro devs you will make 4 games in a year with rates over 8 and no challenge at the end. Also you dont dev. Online games =(
issue, only, This is a great game if you like tycoon games the only issue is when you get pro devs you will make 4 games in a year with rates over 8 and no challenge at the end. Also you dont dev. Online games =(
devs, pro, This is a great game if you like tycoon games the only issue is when you get pro devs you will make 4 games in a year with rates over 8 and no challenge at the end. Also you dont dev. Online games =(
games, Online, This is a great game if you like tycoon games the only issue is when you get pro devs you will make 4 games in a year with rates over 8 and no challenge at the end. Also you dont dev. Online games =(
game, great, It was a great game and I don't find any bug
system, own, It's a game worth buying because you do have to use your head at how to make your games better over time, including if you want to make your own game system, which depending on what you put in it can cost a lot of money and is time consuming. However the more everyone in the game uses your system the more you get paid, the more you use it the more it sells on the market. I really recommend this game for everyone.
PH-1, Essential, Fun game but not optimized for the Essential PH-1
game, Good, Good game
things, more, Add more things to it please
consoles, best, I became my own Kojima and developed the best consoles and games around. Not half bad. Need to play it again.
memories, old, This game brings back old memories of consoles I used to play.. amazing gameplay and graphics.
gameplay, amazing, This game brings back old memories of consoles I used to play.. amazing gameplay and graphics.
game, Best, Best game
game, Great, Great game.
game, decent, decent game but it is lacking any real substance just minlessly make a game and train employees
substance, real, decent game but it is lacking any real substance just minlessly make a game and train employees
game, Great, Great game, worth the money. You can easily have multiple playthroughs as the gameplay is quite simple.
game, worth, Great game, worth the money. You can easily have multiple playthroughs as the gameplay is quite simple.
playthroughs, multiple, Great game, worth the money. You can easily have multiple playthroughs as the gameplay is quite simple.
strategy, lite, 6 years on, and i still can't put it down! Did 13 years and battery died :-D A great and addictive lite-strategy game that's fun to play and manage. Name your own games, create sequels, develop a console, attend expositions, follow the charts and make money! What's not to love? Only thing needed now is support for 4k devices and Google Achievements.
game, great, 6 years on, and i still can't put it down! Did 13 years and battery died :-D A great and addictive lite-strategy game that's fun to play and manage. Name your own games, create sequels, develop a console, attend expositions, follow the charts and make money! What's not to love? Only thing needed now is support for 4k devices and Google Achievements.
games, own, 6 years on, and i still can't put it down! Did 13 years and battery died :-D A great and addictive lite-strategy game that's fun to play and manage. Name your own games, create sequels, develop a console, attend expositions, follow the charts and make money! What's not to love? Only thing needed now is support for 4k devices and Google Achievements.
title, great, All I need is to let AI do the job and just imagine a great title. However, some genres that need to add in such as Strategy (real time, turn based, both tactical), platform, fighting (vs or beat em up), stealth, party, visual novel. Sport game should be genre instead of type. Shooter can be First Person, Third Person, Hero, Shoot Em Up. Type that need to add in can be space combat, crime, cop, sci-fi, post apocalyptic, more vehicles etc. Both genres and types can be combined with two or more.
time, real, All I need is to let AI do the job and just imagine a great title. However, some genres that need to add in such as Strategy (real time, turn based, both tactical), platform, fighting (vs or beat em up), stealth, party, visual novel. Sport game should be genre instead of type. Shooter can be First Person, Third Person, Hero, Shoot Em Up. Type that need to add in can be space combat, crime, cop, sci-fi, post apocalyptic, more vehicles etc. Both genres and types can be combined with two or more.
novel, visual, All I need is to let AI do the job and just imagine a great title. However, some genres that need to add in such as Strategy (real time, turn based, both tactical), platform, fighting (vs or beat em up), stealth, party, visual novel. Sport game should be genre instead of type. Shooter can be First Person, Third Person, Hero, Shoot Em Up. Type that need to add in can be space combat, crime, cop, sci-fi, post apocalyptic, more vehicles etc. Both genres and types can be combined with two or more.
vehicles, apocalyptic, All I need is to let AI do the job and just imagine a great title. However, some genres that need to add in such as Strategy (real time, turn based, both tactical), platform, fighting (vs or beat em up), stealth, party, visual novel. Sport game should be genre instead of type. Shooter can be First Person, Third Person, Hero, Shoot Em Up. Type that need to add in can be space combat, crime, cop, sci-fi, post apocalyptic, more vehicles etc. Both genres and types can be combined with two or more.
vehicles, more, All I need is to let AI do the job and just imagine a great title. However, some genres that need to add in such as Strategy (real time, turn based, both tactical), platform, fighting (vs or beat em up), stealth, party, visual novel. Sport game should be genre instead of type. Shooter can be First Person, Third Person, Hero, Shoot Em Up. Type that need to add in can be space combat, crime, cop, sci-fi, post apocalyptic, more vehicles etc. Both genres and types can be combined with two or more.
game, nice, It was a very nice game and appealed a lot of its self to cartoony players but what i had a weird time with was the fact that thwre was nothing to do after you made hundreds of millions of dollars
time, weird, It was a very nice game and appealed a lot of its self to cartoony players but what i had a weird time with was the fact that thwre was nothing to do after you made hundreds of millions of dollars
interface, Awful, Awful user interface. Didn't recognise where I was tapping and couldn't scroll. Waste of time
game, Awesome, Awesome game!
games, favorite, literally one of my favorite games of all time
permissions, unnecessary, I like this game! but there's a unnecessary permissions, it it seems kinda wrong too, I payed for this game.
life, real, It so asm it it like im realy make games in real life
years, last, I've played this game for 5 years, ever since Felicia Day mentioned it in her vlog. It's worth the cost for no in app purchases whatsoever! Installed this game in over 8 phones in the last 5 years and I keep coming back to it! Just as addictive and fun as a certain monster catching game we all know and love! edit: still playing in 2019! make a sequel!
game, certain, I've played this game for 5 years, ever since Felicia Day mentioned it in her vlog. It's worth the cost for no in app purchases whatsoever! Installed this game in over 8 phones in the last 5 years and I keep coming back to it! Just as addictive and fun as a certain monster catching game we all know and love! edit: still playing in 2019! make a sequel!
game, catching, I've played this game for 5 years, ever since Felicia Day mentioned it in her vlog. It's worth the cost for no in app purchases whatsoever! Installed this game in over 8 phones in the last 5 years and I keep coming back to it! Just as addictive and fun as a certain monster catching game we all know and love! edit: still playing in 2019! make a sequel!
game, new, yea nope this game would be great but every time I start a new game I open the menu and it keeps telling me to start a new game
game, new, yea nope this game would be great but every time I start a new game I open the menu and it keeps telling me to start a new game
game, good, good game
info, top, the notification bar on my pixel 2 xl hides the top info in the game(money and date). please fix this.
aspect, good, it has such a good aspect of game design it feels like you are actually creating games and consoles!!
games, best, i think this is one of the best games i have played i got only one problem i need more to the game becuse when you got to the highest buliding the game just gets boring you have all the money and 10 10 ratings i think it just needs more to it like add more upgrades to the office or somthing like that.
upgrades, more, i think this is one of the best games i have played i got only one problem i need more to the game becuse when you got to the highest buliding the game just gets boring you have all the money and 10 10 ratings i think it just needs more to it like add more upgrades to the office or somthing like that.
game, good, really good game!! But it could be made much better in the future... i would definitely recommend buying this game it really fun!
game, fun, Honestly fun game to burn time.
time, long, I bought this game a long time ago for 10 cents so now when I click install it pops up with another purchase menu and I try to buy it, but it says I already own this item. How do I fix this so I can play this again?
priority, audio, I love this game.....but the in game music gets obnoxious quick and even when you turn it off to play Spotify in the background the game still holds some kind of audio priority which causes Spotify to stay at a much lower volume while in the game. please fix this so I can give 5 stars!!!!!
volume, lower, I love this game.....but the in game music gets obnoxious quick and even when you turn it off to play Spotify in the background the game still holds some kind of audio priority which causes Spotify to stay at a much lower volume while in the game. please fix this so I can give 5 stars!!!!!
game, great, great game. plenty of replay value with newgame+
update, big, Pretty good. Just want a big final update that adds all consoles are missing, new gameplay features and multiplayer.
update, final, Pretty good. Just want a big final update that adds all consoles are missing, new gameplay features and multiplayer.
features, new, Pretty good. Just want a big final update that adds all consoles are missing, new gameplay features and multiplayer.
time, endless, i love the games you guys produce. endless time killing and decent enough mechanics to keep one well invested in the game
mechanics, enough, i love the games you guys produce. endless time killing and decent enough mechanics to keep one well invested in the game
game, addictive, This is the most addictive game on the market! Completely worth the money!
game, fun, such a fun game
game, best, still the best game I still go back too I have already beaten the game to the point where I was getting the best score with like $50 million and had all the special characters but eventually got a new phone :( 10/10 even wanting to do it all again this game is addicting
score, best, still the best game I still go back too I have already beaten the game to the point where I was getting the best score with like $50 million and had all the special characters but eventually got a new phone :( 10/10 even wanting to do it all again this game is addicting
characters, special, still the best game I still go back too I have already beaten the game to the point where I was getting the best score with like $50 million and had all the special characters but eventually got a new phone :( 10/10 even wanting to do it all again this game is addicting
phone, new, still the best game I still go back too I have already beaten the game to the point where I was getting the best score with like $50 million and had all the special characters but eventually got a new phone :( 10/10 even wanting to do it all again this game is addicting
game, similar, I have always liked your games. I would have given this one 5 stars but it seems like every time I get my stats up high like my fun or graphic for instance. the lights crash or another company is making a game similar which means I dont sale many units. I would understand if it was every once in a while but it has been every time. if I purchase a game I expect it to be fun. that isn't fun. plz fix this issue. thank u. an I will still continue to play your games
