VERB, PREP, POBJ, 
returning, to, it, I love this game and keep returning to it to grow my towns
invested, in, game, Genuinely didn't think I'd be as invested in the game as I am. It's simple and fun
comparing, to, games, Loading time over a minute on a flagman phone is killing. No new gameplay mechanics comparing to similar games
lying, around, ground, You build a town for adventures, you give said adventures 100 bananas (individually) to make them stronger, and then a banana monster defeats 75% of your adventurers anyway. Thankfully defeat for an adventurer in this game involves them lying around the ground for about a minute until they get back up. I give this game 5 hats out of 5.
lying, for, minute, You build a town for adventures, you give said adventures 100 bananas (individually) to make them stronger, and then a banana monster defeats 75% of your adventurers anyway. Thankfully defeat for an adventurer in this game involves them lying around the ground for about a minute until they get back up. I give this game 5 hats out of 5.
changed, in, years, Overall a fun town builder game. It would be perfect but there are just so many event popups in the game that it ruins the flow. Also the interface hasn't changed in years for games from this dev. I get it is their style but some ergonomic improvements would make their games A+.
changed, for, games, Overall a fun town builder game. It would be perfect but there are just so many event popups in the game that it ruins the flow. Also the interface hasn't changed in years for games from this dev. I get it is their style but some ergonomic improvements would make their games A+.
running, in, background, Save frequently. if you leave the game running in the background it can black screen and you may lose progress
optimized, like, champ, Excellent mobile game, optimized like a champ. No nonsense. No pay to win.
supporting, for, years, I LOVE Kairosoft and have been supporting them for several years now. The games always make me happy and an easy way to kill time. They are simple to play with just enough challenge to either make you work a bit harder to achieve the rankings inside the game. Dungeon Village 2 is amazing!!! Adored the first one but this one gives you so much more from farming, monster tamers, outside visitors that you get from cart/balloon/ship, monstera to fight while still keeping original characters.
play, with, challenge, I LOVE Kairosoft and have been supporting them for several years now. The games always make me happy and an easy way to kill time. They are simple to play with just enough challenge to either make you work a bit harder to achieve the rankings inside the game. Dungeon Village 2 is amazing!!! Adored the first one but this one gives you so much more from farming, monster tamers, outside visitors that you get from cart/balloon/ship, monstera to fight while still keeping original characters.
gives, from, farming, I LOVE Kairosoft and have been supporting them for several years now. The games always make me happy and an easy way to kill time. They are simple to play with just enough challenge to either make you work a bit harder to achieve the rankings inside the game. Dungeon Village 2 is amazing!!! Adored the first one but this one gives you so much more from farming, monster tamers, outside visitors that you get from cart/balloon/ship, monstera to fight while still keeping original characters.
gives, outside, visitors, I LOVE Kairosoft and have been supporting them for several years now. The games always make me happy and an easy way to kill time. They are simple to play with just enough challenge to either make you work a bit harder to achieve the rankings inside the game. Dungeon Village 2 is amazing!!! Adored the first one but this one gives you so much more from farming, monster tamers, outside visitors that you get from cart/balloon/ship, monstera to fight while still keeping original characters.
get, from, ship, I LOVE Kairosoft and have been supporting them for several years now. The games always make me happy and an easy way to kill time. They are simple to play with just enough challenge to either make you work a bit harder to achieve the rankings inside the game. Dungeon Village 2 is amazing!!! Adored the first one but this one gives you so much more from farming, monster tamers, outside visitors that you get from cart/balloon/ship, monstera to fight while still keeping original characters.
Played, through, map, Played through the first map. Really like this game!
playing, for, bit, Fun little adventure sim. Great time killer. However, it crashes my phone after playing for a bit. Hope they fix this soon.
engrossing, with, progression, Cute and engrossing, with steady progression. It does drain the battery pretty badly, though.
made, to, original, Honestly great game, made improvements to the original, logged in 20+ hours in just a week, think I'm addicted...
logged, in, hours, Honestly great game, made improvements to the original, logged in 20+ hours in just a week, think I'm addicted...
logged, in, week, Honestly great game, made improvements to the original, logged in 20+ hours in just a week, think I'm addicted...
doing, for, adventurers, Definitely a fun town simulator. Would love to have some more ingame help to see what stats are doing for adventurers and facilities, but it's great even without it.
plays, like, game, It plays like an actual game, like the ones that were played before pay to win was a thing. It's incredibly smooth and engaging.
played, before, pay, It plays like an actual game, like the ones that were played before pay to win was a thing. It's incredibly smooth and engaging.
load, for, me, So uhh... The game doesn't load for me. Not sure if it's my os or the game, but I've reinstalled 3 times, restarted my device a few, left the game for a few weeks, and nothing really seemed to work. GUI loads.. I think? Again I don't know because the game didn't load properly. Not really sure how to fix so help would be nice :)
left, for, weeks, So uhh... The game doesn't load for me. Not sure if it's my os or the game, but I've reinstalled 3 times, restarted my device a few, left the game for a few weeks, and nothing really seemed to work. GUI loads.. I think? Again I don't know because the game didn't load properly. Not really sure how to fix so help would be nice :)
put, into, experience, This is by far one of the best mobile games I've ever played. It brings so much joy to me to see all of the little things the developers put into this experience. So much content then what meets the eye. I will definitely try out other games from the same developer in the future. Thank you so much for an awesome game Kairosoft!
try, from, developer, This is by far one of the best mobile games I've ever played. It brings so much joy to me to see all of the little things the developers put into this experience. So much content then what meets the eye. I will definitely try out other games from the same developer in the future. Thank you so much for an awesome game Kairosoft!
Thank, for, game, This is by far one of the best mobile games I've ever played. It brings so much joy to me to see all of the little things the developers put into this experience. So much content then what meets the eye. I will definitely try out other games from the same developer in the future. Thank you so much for an awesome game Kairosoft!
immersed, in, game, Cannot complain, I was actually immersed in the game. Towards the end of it everything just sped up and I started going through all ranks and all facilities upgrade. Slow to fast past love it!
sped, Towards, end, Cannot complain, I was actually immersed in the game. Towards the end of it everything just sped up and I started going through all ranks and all facilities upgrade. Slow to fast past love it!
going, through, ranks, Cannot complain, I was actually immersed in the game. Towards the end of it everything just sped up and I started going through all ranks and all facilities upgrade. Slow to fast past love it!
go, with, kairosoft, Had a lot of fun building up my favorite characters and had plenty of options for them. Can't go wrong with kairosoft.
clicked, on, times, Great game, really deep, loads to do. There are a lot of 'hey, you did a thing!' pop ups that have to be clicked on multiple times and it can get slightly annoying, but it's still a great game and totally warrants 5 stars
asked, As, bonus, Fun fantasy town sim/idle game. Place buildings and decorations to make youe town turn a profit and lure in more adventurers that you can eventually move in. Worth the price imo, as it avoids the pay to win/proceed scheme many similar free games use. As a bonus it only asked for the rating very far in gameplay wise so it didnt feel like an annoyance. If you like these types of games I highly recommend it.
asked, for, rating, Fun fantasy town sim/idle game. Place buildings and decorations to make youe town turn a profit and lure in more adventurers that you can eventually move in. Worth the price imo, as it avoids the pay to win/proceed scheme many similar free games use. As a bonus it only asked for the rating very far in gameplay wise so it didnt feel like an annoyance. If you like these types of games I highly recommend it.
asked, in, gameplay, Fun fantasy town sim/idle game. Place buildings and decorations to make youe town turn a profit and lure in more adventurers that you can eventually move in. Worth the price imo, as it avoids the pay to win/proceed scheme many similar free games use. As a bonus it only asked for the rating very far in gameplay wise so it didnt feel like an annoyance. If you like these types of games I highly recommend it.
feel, like, annoyance, Fun fantasy town sim/idle game. Place buildings and decorations to make youe town turn a profit and lure in more adventurers that you can eventually move in. Worth the price imo, as it avoids the pay to win/proceed scheme many similar free games use. As a bonus it only asked for the rating very far in gameplay wise so it didnt feel like an annoyance. If you like these types of games I highly recommend it.
give, for, reason, The game is that great that you lose track of time..it's a money well spent..there is one thing that kinda bugs me..when i give items to a character for the reason that it is the best for it..after some time it will buy a crappie one...hope it just sticks to the one that i give or at least buy a much better one...all and all i love the game i hope there is a part 3...
buy, after, time, The game is that great that you lose track of time..it's a money well spent..there is one thing that kinda bugs me..when i give items to a character for the reason that it is the best for it..after some time it will buy a crappie one...hope it just sticks to the one that i give or at least buy a much better one...all and all i love the game i hope there is a part 3...
sticks, to, one, The game is that great that you lose track of time..it's a money well spent..there is one thing that kinda bugs me..when i give items to a character for the reason that it is the best for it..after some time it will buy a crappie one...hope it just sticks to the one that i give or at least buy a much better one...all and all i love the game i hope there is a part 3...
glue, to, screen, Very fun and engaging, it can easily glue you to the screen for hours. There's a lot of depth and a nice variety in features. Well worth the pricetag!
glue, for, hours, Very fun and engaging, it can easily glue you to the screen for hours. There's a lot of depth and a nice variety in features. Well worth the pricetag!
get, to, end, Fun little game to spend time on when you have a few minutes free. You get to the end pretty quickly, wish it tookore to get to the "end" of the game.
get, to, end, Fun little game to spend time on when you have a few minutes free. You get to the end pretty quickly, wish it tookore to get to the "end" of the game.
mixes, into, blend, This game mixes so many different variables into a beautiful blend of gameplay. I love the city building aspect. Just watching your little adventurers walk around is fun. The only reason I rate for stars is like everyone else says, too many pop ups! They interrupt the gameplay so much because it freezes each pop up, and lemme tell you there are plenty lol. Other than that this game is the perfect grinding, crafting, building mobile game I've been looking for! Well worth the money, BUY IT!!
rate, for, stars, This game mixes so many different variables into a beautiful blend of gameplay. I love the city building aspect. Just watching your little adventurers walk around is fun. The only reason I rate for stars is like everyone else says, too many pop ups! They interrupt the gameplay so much because it freezes each pop up, and lemme tell you there are plenty lol. Other than that this game is the perfect grinding, crafting, building mobile game I've been looking for! Well worth the money, BUY IT!!
give, without, question, Game is fantastic but the amount of information pop ups is extremely frustrating. Would give 5 stars without question if this could be turned off.
turn, of, popups, Fun game but very short like more of the kairosoft games but no ads! Maybe only give us options to turn of certain popups because they are very anoying sometimes.
playing, for, days, Way more content than I expected, super fun, been playing it for days straight and really enjoying it. I appreciate there being no ads or microtransactions as I'm a compulsive spender. I'm definitely going to buy kairosoft games in the future since I can trust their quality games (and to avoid temptations of microtransactions in their f2p games :) )
buy, in, future, Way more content than I expected, super fun, been playing it for days straight and really enjoying it. I appreciate there being no ads or microtransactions as I'm a compulsive spender. I'm definitely going to buy kairosoft games in the future since I can trust their quality games (and to avoid temptations of microtransactions in their f2p games :) )
played, in, while, Charming enough... Okay, okay, it's the best Kairosoft game I've played in a while.
get, to, stars, It felt really short to get to five stars, but was really addictive I binged it
play, without, ads, Great games, so nice to play an addictive game without the damn ads every 2 minites
does, with, progression, Honestly a good second game kinda the same concept but they definitely added more and for sure I know the first one has freemium but this is definitely worth the low cost that it is. Hours worth of game play at your fingertips and honestly takes days to beat even playing non-stop, game honestly does well with its progression and honestly if you find it at all challenging push through as your second playthrough you'll whiz through it with ease, still takes days to beat and has replay value!!
find, at, push, Honestly a good second game kinda the same concept but they definitely added more and for sure I know the first one has freemium but this is definitely worth the low cost that it is. Hours worth of game play at your fingertips and honestly takes days to beat even playing non-stop, game honestly does well with its progression and honestly if you find it at all challenging push through as your second playthrough you'll whiz through it with ease, still takes days to beat and has replay value!!
find, as, playthrough, Honestly a good second game kinda the same concept but they definitely added more and for sure I know the first one has freemium but this is definitely worth the low cost that it is. Hours worth of game play at your fingertips and honestly takes days to beat even playing non-stop, game honestly does well with its progression and honestly if you find it at all challenging push through as your second playthrough you'll whiz through it with ease, still takes days to beat and has replay value!!
whiz, through, it, Honestly a good second game kinda the same concept but they definitely added more and for sure I know the first one has freemium but this is definitely worth the low cost that it is. Hours worth of game play at your fingertips and honestly takes days to beat even playing non-stop, game honestly does well with its progression and honestly if you find it at all challenging push through as your second playthrough you'll whiz through it with ease, still takes days to beat and has replay value!!
whiz, with, ease, Honestly a good second game kinda the same concept but they definitely added more and for sure I know the first one has freemium but this is definitely worth the low cost that it is. Hours worth of game play at your fingertips and honestly takes days to beat even playing non-stop, game honestly does well with its progression and honestly if you find it at all challenging push through as your second playthrough you'll whiz through it with ease, still takes days to beat and has replay value!!
pass, with, Game, Omg. This game is not just gameplay addictive..its simple, cute and deep. Once u start u can't. Put down. No micro-transcation and hours just pass by with this Game
looking, for, something, I have been looking for something similar to the first Dungeon Village game. I was quite surprised and happy to see this. Played through once, it definitely does not disappoint.
appreciated, on, off, Pretty good. I enjoyed playing it. Although the near constant pop-up notifications disrupt the flow of the game. An option to toggle that on/off would be appreciated.
feel, near, end, Ok, whoa. Didn't expect to enjoy this as much as I have. The game doesn't ask you to rate it till youve reached a 5 star town, so I've already played quite a bit. And it's QUITE addicting. There's plenty of depth in the simplicity of all the systems. There is so much charm and polish. And near the end of the game where I'm at right now i feel very challenged and engaged. The game is good. 5 star. Thank You.
spending, on, transcations, It's like a dumbed down version of the original. You're better off playing the first and spending $8 on micro transcations
played, in, time, This is one of the most addictive mobile games I've ever played in a very long time. The progression, classes, adorable monsters! I love it.
start, with, one, Its a fun game, definately better than the first, however beginners should start with the first one.
recommended, for, tag, A very simple charming city builder with fun RPG elements. Highly recommended for this price tag.
win, with, characters, Love it. No ads no pay to win just a fun city managment game with great characters
did, in, game, Kairosoft is easily the best mobile developer out there. Their games strike this perfect balance of fun and engaging gameplay that's easy to learn but hard to master. I loved the first Dungeon Village and this game is very much the same but they turned everything up to 11... more jobs to learn, more streamlined gameplay, more depth to basically everything they did in the first game, and to top it off, they give you a bunch of new zones where you can take a handful of your best fighters to start a new town but with everything you've already unlocked. It's almost like a new game + but within the same save file. It really extends the longevity of the game considerably, and they still add tons of new things to unlock. I'm rather shocked by the depth of this game and how much value you get for your money. My only gripe might be that some of the animations for performing actions, like setting up a quest or handing out medals at the end of the year get kind of tedious and would be a lot nicer if you could unlock an option to speed them up or just turn some popups up altogether. Can't complain too much though. Get this game. It's damn near perfect.
take, with, everything, Kairosoft is easily the best mobile developer out there. Their games strike this perfect balance of fun and engaging gameplay that's easy to learn but hard to master. I loved the first Dungeon Village and this game is very much the same but they turned everything up to 11... more jobs to learn, more streamlined gameplay, more depth to basically everything they did in the first game, and to top it off, they give you a bunch of new zones where you can take a handful of your best fighters to start a new town but with everything you've already unlocked. It's almost like a new game + but within the same save file. It really extends the longevity of the game considerably, and they still add tons of new things to unlock. I'm rather shocked by the depth of this game and how much value you get for your money. My only gripe might be that some of the animations for performing actions, like setting up a quest or handing out medals at the end of the year get kind of tedious and would be a lot nicer if you could unlock an option to speed them up or just turn some popups up altogether. Can't complain too much though. Get this game. It's damn near perfect.
shocked, by, depth, Kairosoft is easily the best mobile developer out there. Their games strike this perfect balance of fun and engaging gameplay that's easy to learn but hard to master. I loved the first Dungeon Village and this game is very much the same but they turned everything up to 11... more jobs to learn, more streamlined gameplay, more depth to basically everything they did in the first game, and to top it off, they give you a bunch of new zones where you can take a handful of your best fighters to start a new town but with everything you've already unlocked. It's almost like a new game + but within the same save file. It really extends the longevity of the game considerably, and they still add tons of new things to unlock. I'm rather shocked by the depth of this game and how much value you get for your money. My only gripe might be that some of the animations for performing actions, like setting up a quest or handing out medals at the end of the year get kind of tedious and would be a lot nicer if you could unlock an option to speed them up or just turn some popups up altogether. Can't complain too much though. Get this game. It's damn near perfect.
get, for, money, Kairosoft is easily the best mobile developer out there. Their games strike this perfect balance of fun and engaging gameplay that's easy to learn but hard to master. I loved the first Dungeon Village and this game is very much the same but they turned everything up to 11... more jobs to learn, more streamlined gameplay, more depth to basically everything they did in the first game, and to top it off, they give you a bunch of new zones where you can take a handful of your best fighters to start a new town but with everything you've already unlocked. It's almost like a new game + but within the same save file. It really extends the longevity of the game considerably, and they still add tons of new things to unlock. I'm rather shocked by the depth of this game and how much value you get for your money. My only gripe might be that some of the animations for performing actions, like setting up a quest or handing out medals at the end of the year get kind of tedious and would be a lot nicer if you could unlock an option to speed them up or just turn some popups up altogether. Can't complain too much though. Get this game. It's damn near perfect.
lacking, on, lists, Game is fun and addicting. Info parsing options in game are lacking though (no real filter + search + sort on long lists)
spent, on, it, Fun little manager, spent hours on it. Better yet, no ads or pay to win nonsense
spent, on, game, A rare occasion I'm happy to have spent money on a mobile game.
put, into, game, An excellent time sink. The more you put into the game, the more you will get out of it.
engaging, in, game, Great little strategy game simple yet engaging and best of all no spending real money in game to enjoy it or move forward!
hidden, behind, simple, Deceptively complex and engaging game, hidden behind a simple and easy to use interface and cute graphics.
stands, for, quality, Always enjoy Kairosoft's games but this one stands out for quality, interactivity, and choosing how to do things
has, with, games, Always has fun killing time with their games. Few new things added from last game. Keeps it fresh.
added, from, game, Always has fun killing time with their games. Few new things added from last game. Keeps it fresh.
played, in, time, Great fun game with a lot of content. Best mobile game I've played in a long time.
sucked, for, hours, Don't normally but glad I did, get sucked in for hours playing the game so I would say definitely worth the buy
expect, from, Kairosoft, Great game, wouldn't expect anything less from Kairosoft. Better than the first version because it includes multiple towns and extends beyond the previous time limit. Well done!
extends, beyond, limit, Great game, wouldn't expect anything less from Kairosoft. Better than the first version because it includes multiple towns and extends beyond the previous time limit. Well done!
sit, with, application, Enjoyable, long progression however there is a lack of a speed-up button from the get go. There are many pockets of times where you simply have to sit with the application open or constantly have to press and hold to speed up dialogue or events. The save feature is the most frustrating-- you can lose many in game days of progress. If you decide to get this game, be sure to save in a spot you don't mind repeating the last few in game days.
